HDB,HDFC Bank Limited,20180119,BRIEF-HDFC Bank Dec Qtr Net Profit Up About 20 Pct ,* DEC QUARTER NET PROFIT 46.43 BILLION RUPEES VERSUS NET PROFIT OF 38.65 BILLION RUPEES YEAR AGO,normal
HSBC,HSBC Holdings plc,20180119,HSBC to pay $100 mln to settle U.S. probe into currency rigging ,HSBC Holdings Plc on Thursday agreed to pay $101.5 million to settle a U.S. criminal probe into the rigging of currency transactions  which has already led the conviction of one of its former bankers.,topStory
HSEA,HSBC Holdings plc,20180119,HSBC to pay $100 mln to settle U.S. probe into currency rigging ,HSBC Holdings Plc on Thursday agreed to pay $101.5 million to settle a U.S. criminal probe into the rigging of currency transactions  which has already led the conviction of one of its former bankers.,topStory
HSEB,HSBC Holdings plc,20180119,HSBC to pay $100 mln to settle U.S. probe into currency rigging ,HSBC Holdings Plc on Thursday agreed to pay $101.5 million to settle a U.S. criminal probe into the rigging of currency transactions  which has already led the conviction of one of its former bankers.,topStory
HGT,Hugoton Royalty Trust,20180119,BRIEF-Hugoton Royalty Trust Declares No January Cash Distribution ,* HUGOTON ROYALTY TRUST DECLARES NO JANUARY CASH DISTRIBUTION AND GIVES NOTICE OF TENTATIVE XTO SETTLEMENT AMOUNT,topStory
IBM,International Business Machines Corporation,20180119,Ex-IBM employee from China gets five years prison for stealing code ,NEW YORK  Jan 19 A former software engineer for IBM in China was sentenced to five years in prison after he pleaded guilty to stealing proprietary source code from the company  prosecutors announced on Friday.,topStory
IBM,International Business Machines Corporation,20180119,US STOCKS-S&P  Nasdaq hit records  Dow muted as govt shutdown looms ,* Dow up 0.03 pct  S&P up 0.3 pct  Nasdaq up 0.5 pct (Updates to late afternoon  changes byline  adds dateline NEW YORK),normal
IBM,International Business Machines Corporation,20180119,US STOCKS-S&P lifted by consumer stocks  IBM weighs on Dow ,* Dow off 0.21 pct  S&P up 0.16 pct  Nasdaq up 0.34 pct (Updates to early afternoon),normal
IBM,International Business Machines Corporation,20180119,US STOCKS-Gains in consumer stocks prop up S&P  Nasdaq ,* Dow off 0.15 pct  S&P 0.09 pct  Nasdaq 0.12 pct (Changes comment  updates prices  adds details),normal
IBM,International Business Machines Corporation,20180119,US STOCKS-Amazon  Nike drive Wall Street higher ,* Indexes up: Dow 0.05 pct  S&P 0.28 pct  Nasdaq 0.37 pct (Updates to open),normal
IBM,International Business Machines Corporation,20180119,IBM shares fall on soft profit outlook ,Shares in International Business Machines fell 2.6 percent on Friday as analysts judged a "disappointing" full-year profit forecast showed that the company would take more time to get back on a path of steady growth.,normal
IBM,International Business Machines Corporation,20180119,IBM shares fall on soft profit outlook ,Jan 19 Shares in International Business Machines fell 2.6 percent on Friday as analysts judged a "disappointing" full-year profit forecast showed that the company would take more time to get back on a path of steady growth.,normal
IBM,International Business Machines Corporation,20180119,BRIEF-IBM  Salesforce Strengthen Strategic Partnership ,* IBM - PARTNERSHIP BRINGS TOGETHER IBM CLOUD AND WATSON SERVICES WITH SALESFORCE QUIP AND SALESFORCE SERVICE CLOUD EINSTEIN,normal
IBM,International Business Machines Corporation,20180119,CORRECTED-UPDATE 3-IBM returns to growth after 6 years  but dour forecast hits shares ,Jan 18 International Business Machines Corp's revenue rose for the first time in 23 quarters  beating analysts' estimates  but the company warned that a higher tax rate this year would eat into its profit.,normal
IBM,International Business Machines Corporation,20180119,IBM returns to growth after six years  but dour forecast hits shares ,International Business Machines Corp's  revenue rose for the first time in 23 quarters  beating analysts' estimates  but the company warned that a higher tax rate this year would eat into its profit.,normal
JPM,J P Morgan Chase & Co,20180119,Factbox: Big U.S. banks' fourth-quarter results muddied by new tax law ,Morgan Stanley reported quarterly results on Thursday  rounding off an earnings season for big U.S. banks marked by across-the-board hit to profits from the U.S. tax overhaul.,topStory
JPM,J P Morgan Chase & Co,20180119,RPT-Nigeria sues JP Morgan for $875 mln over Malabu oilfield deal ,LONDON  Jan 18 Nigeria has filed a claim against JP Morgan Chase for more than $875 million  accusing it of negligence in transferring funds from a disputed 2011 oilfield deal to a company controlled by the country's former oil minister.,normal
JCAP,Jernigan Capital Inc,20180119,BRIEF-Jernigan Capital Announces Pricing Of Public Offering ,* JERNIGAN CAPITAL  INC. ANNOUNCES PRICING OF PUBLIC OFFERING OF 7.00% SERIES B CUMULATIVE REDEEMABLE PERPETUAL PREFERRED STOCK,topStory
JCI,Johnson Controls International plc,20180119,BRIEF-Johnson Controls International Provides CEO George Oliver's 2017 Total Compensation ,* JOHNSON CONTROLS INTERNATIONAL PLC CEO GEORGE OLIVER'S 2017 TOTAL COMPENSATION WAS $12.6 MILLION – SEC FILING‍​,topStory
KSU,Kansas City Southern,20180119,Kansas City Southern reports results for the quarter ended December 31 - summary ,Jan 19 * Kansas City Southern  posted quarterly adjusted earnings of $1.38 per share. The mean expectation of 18 analysts for the quarter ended December 31 was for earnings of $1.37 per share. * Revenue rose 10.34 percent to $660.40 million from a year ago; analysts expected $656.28 million. * Kansas City Southern's Reported EPS for the quarter was $5.33. * The mean earnings estimate of analysts had risen by about 0.6 percent in the last three months. * In the last 30 days six analys,topStory
KSU,Kansas City Southern,20180119,NAFTA future clouds Kansas City Southern earnings beat ,Kansas City Southern  a U.S. railroad with extensive operations in Mexico  sought to ease investor fears on Friday over the future of the North American Free Trade Agreement  touting forecasts of solid freight volumes and a stronger economy in 2018.,normal
KSU,Kansas City Southern,20180119,UPDATE 3-NAFTA future clouds Kansas City Southern earnings beat ,Jan 19 Kansas City Southern  a U.S. railroad with extensive operations in Mexico  sought to ease investor fears on Friday over the future of the North American Free Trade Agreement  touting forecasts of solid freight volumes and a stronger economy in 2018.,normal
KSU,Kansas City Southern,20180119,Kansas City Southern quarterly profit rises on commodity volumes ,Jan 19 Kansas City Southern  a regional U.S. railroad with extensive operations in Mexico  reported a higher quarterly net profit on Friday  driven by revenue growth in 2017 in all six of the commodities it hauls. The Kansas City  Missouri-based company posted fourth-quarter net income of $552 million  or $5.33 per diluted share  up from $130 million  or $1.21 per diluted share a year earlier.,normal
KSU,Kansas City Southern,20180119,BRIEF-Kansas City Southern Reports Q4 EPS $5.33 ,* Q4 EARNINGS PER SHARE VIEW $1.38 -- THOMSON REUTERS I/B/E/S,normal
KMI,Kinder Morgan Inc,20180119,UPDATE 1-Canada regulator sets out process for pipeline permit disputes ,VANCOUVER  Jan 18 The National Energy Board on Thursday set out a process for resolving permit disputes related to Kinder Morgan Canada's Trans Mountain pipeline expansion project  which has faced repeated delays due to difficulty in obtaining permits.,topStory
KR,Kroger Company (The),20180119,BRIEF-Kroger Declares Quarterly Dividend of 12.5¢ Per Share ,* KROGER CO - ‍DECLARED A QUARTERLY DIVIDEND OF 12.5¢ PER SHARE TO BE PAID ON MARCH 1  2018​ Source text for Eikon: Further company coverage:,topStory
LNC,Lincoln National Corporation,20180119,Lincoln Financial to buy Liberty Life Assurance Co for $3.3 billion ,Lincoln Financial Group  said on Friday it would buy fellow insurer Liberty Life Assurance Co of Boston for about $3.3 billion from Liberty Mutual to boost its presence in the group benefits market.,topStory
LNC,Lincoln National Corporation,20180119,UPDATE 1-Lincoln Financial to buy Liberty Life Assurance Co for $3.3 bln ,Jan 19 Lincoln Financial Group said on Friday it would buy fellow insurer Liberty Life Assurance Co of Boston for about $3.3 billion from Liberty Mutual to boost its presence in the group benefits market.,normal
LNC,Lincoln National Corporation,20180119,BRIEF-Lincoln Financial Signs Agreement To Acquire Liberty Life Assurance Company Of Boston ,* LINCOLN FINANCIAL GROUP SIGNS AGREEMENT TO ACQUIRE LIBERTY LIFE ASSURANCE COMPANY OF BOSTON,normal
LNC,Lincoln National Corporation,20180119,Lincoln Financial to buy Liberty Life Assurance Company for $3.3 bln ,Jan 19 Lincoln Financial Group said on Friday it would acquire Liberty Life Assurance Company of Boston for around $3.3 billion from Liberty Mutual.,normal
LNC,Lincoln National Corporation,20180119,BRIEF-Protective Enters Agreement To Reinsure Liberty Life  Annuity Business ,* PROTECTIVE ENTERS AGREEMENT TO REINSURE LIBERTY LIFE AND ANNUITY BUSINESS,normal
LMT,Lockheed Martin Corporation,20180119,U.S. approves possible sale of F-35 jets to Belgium for $6.5 billion ,WASHINGTON The U.S. State Department on Friday said it has approved the possible sale of 34 Lockheed Martin Corp  F-35 jets to Belgium for $6.53 billion  a potential new customer for the No. 1 U.S. defense contractor's most important product.,topStory
LMT,Lockheed Martin Corporation,20180119,UPDATE 2-U.S. approves possible sale of F-35 jets to Belgium for $6.5 bln ,WASHINGTON  Jan 19 The U.S. State Department on Friday said it has approved the possible sale of 34 Lockheed Martin Corp F-35 jets to Belgium for $6.53 billion  a potential new customer for the No. 1 U.S. defense contractor's most important product.,normal
LMT,Lockheed Martin Corporation,20180119,U.S. approves possible sale of 34 F-35s to Belgium for $6.53 bln- Pentagon ,WASHINGTON  Jan 19 The U.S. State Department has approved the possible sale of 34 Lockheed Martin Corp F-35 Joint Strike Fighters to Belgium for $6.53 billion  the Pentagon said on Friday.,normal
LOW,Lowe&#39;s Companies Inc,20180119,UPDATE 3-Lowe's nominates directors after 'constructive' talks with D.E. Shaw ,Jan 19 Home improvement chain Lowe's Cos Inc said it has nominated two independent board members and plans to add a third following "constructive" talks with hedge fund D.E. Shaw Group  which has taken an activist stake  sending shares up 3 percent on Friday.,topStory
LOW,Lowe&#39;s Companies Inc,20180119,Lowe's names two directors after talks with activist investor ,Jan 19 Lowe's Cos Inc said on Friday it added two board members  a week after reports that hedge fund D.E. Shaw & Co had built an active stake in the home improvement chain  sending its shares up 2 percent.,normal
MFC,Manulife Financial Corp,20180119,BRIEF-Manulife Announces Intention To Redeem 2.819 Pct Fixed/Floating Subordinated Debentures ,* MANULIFE ANNOUNCES INTENTION TO REDEEM 2.819% FIXED/FLOATING SUBORDINATED DEBENTURES Source text for Eikon: Further company coverage:,topStory
MCD,McDonald&#39;s Corporation,20180119,UPDATE 1-McDonald's 'joint employment' trial delayed amid settlement talks ,Jan 19 McDonald's Corp and a U.S. labor board are in talks to settle a case claiming the fast food company is liable for purported labor law violations by its franchisees  leading a judge on Friday to pause a trial that began in 2015.,topStory
MCD,McDonald&#39;s Corporation,20180119,McDonald's 'joint employment' trial delayed amid settlement talks ,Jan 19 McDonald's Corp and a U.S. labor board are in talks to settle a case claiming the fast food company is liable for purported labor law violations by its franchisees  leading a judge on Friday to pause a longrunning trial.,normal
MRK,Merck & Company Inc,20180119,BRIEF-Merck says First-Time Data For Keytruda In Patients With Previously Treated Advanced Hepatocellular Carcinoma To Be Presented At 2018 ASCO GI Symposium ,* FIRST-TIME DATA FOR MERCK'S KEYTRUDA® (PEMBROLIZUMAB) IN PATIENTS WITH PREVIOUSLY TREATED ADVANCED HEPATOCELLULAR CARCINOMA (HCC) TO BE PRESENTED AT 2018 ASCO GI SYMPOSIUM,topStory
MET,MetLife Inc,20180119,MetLife  U.S. regulators agree to set aside legal fight ,WASHINGTON The U.S. government and MetLife Inc  announced on Thursday they would jointly seek to dismiss an appeal over whether the insurance company should face stricter oversight as a key part of the financial system.,topStory
MET,MetLife Inc,20180119,UPDATE 1-MetLife  U.S. regulators agree to set aside legal fight ,WASHINGTON  Jan 18 The U.S. government and MetLife Inc announced on Thursday they would jointly seek to dismiss an appeal over whether the insurance company should face stricter oversight as a key part of the financial system.,normal
MET,MetLife Inc,20180119,MetLife  U.S. regulators agree to set aside legal fight ,WASHINGTON  Jan 18 The U.S. government and MetLife announced on Thursday they would jointly be seeking to dismiss an appeal over whether the insurance company should face stricter oversight as a key part of the financial system.,normal
MON,Monsanto Company,20180119,Arkansas restricts controversial Monsanto  BASF farm chemical ,CHICAGO In a blow to manufacturers Monsanto Co and BASF SE  Arkansas state lawmakers voted on Friday to bar sprayings of a controversial weed killer after mid-April to protect farmers from potential crop damage.,topStory
MON,Monsanto Company,20180119,Arkansas restricts controversial Monsanto  BASF farm chemical ,CHICAGO  Jan 19 In a blow to manufacturers Monsanto Co and BASF SE  Arkansas state lawmakers voted on Friday to bar sprayings of a controversial weed killer after mid-April to protect farmers from potential crop damage.,normal
MS,Morgan Stanley,20180119,BRIEF-Morgan Stanley CFO Pruzan Granted 31 691.39 Restricted Stock Units As Part Of 2017 Year-End Compensation ,* MORGAN STANLEY - CFO JONATHAN PRUZAN GRANTED 31 691.39 RESTRICTED STOCK UNITS IN 2018 AS PART OF 2017 YEAR-END COMPENSATION - SEC FILING,topStory
MS,Morgan Stanley,20180119,BRIEF-Morgan Stanley CEO Gorman Granted 20 791.84 Restricted Stock Units As Part Of 2017 Year-End Compensation ,* MORGAN STANLEY - CEO JAMES GORMAN GRANTED 20 791.84 RESTRICTED STOCK UNITS IN 2018 AS PART OF 2017 YEAR-END COMPENSATION - SEC FILING,normal
MS,Morgan Stanley,20180119,Factbox: Big U.S. banks' fourth-quarter results muddied by new tax law ,Morgan Stanley reported quarterly results on Thursday  rounding off an earnings season for big U.S. banks marked by across-the-board hit to profits from the U.S. tax overhaul.,normal
MS,Morgan Stanley,20180119,Morgan Stanley raises targets  but Wall Street wants more ,Morgan Stanley raised key profitability and efficiency targets on Thursday  but those loftier goals failed to impress Wall Street analysts  who repeatedly asked Chief Executive Officer James Gorman why the bank could not do even better. | Video ,normal
MS,Morgan Stanley,20180119,UPDATE 5-Morgan Stanley raises targets  but Wall Street wants more ,Jan 18 Morgan Stanley raised key profitability and efficiency targets on Thursday  but those loftier goals failed to impress Wall Street analysts  who repeatedly asked Chief Executive Officer James Gorman why the bank could not do even better.,normal
NFG,National Fuel Gas Company,20180119,BRIEF-National Fuel Gas Co Says CEO Ronald Tanski's FY 2017 Total Compensation Was $7.6 Mln ,* NATIONAL FUEL GAS CO SAYS CEO RONALD TANSKI'S FY 2017 TOTAL COMPENSATION WAS $7.6 MILLION VERSUS $7.1 MILLION IN FY 2016 - SEC FILING Source text : http://bit.ly/2rq1TwQ Further company coverage:,topStory
NCS,NCI Building Systems Inc,20180119,BRIEF-NCI Building Systems Announces Redemption Notice For Senior Notes Conditioned Upon Refinancing ,* NCI BUILDING SYSTEMS ANNOUNCES REDEMPTION NOTICE FOR SENIOR NOTES CONDITIONED UPON REFINANCING,topStory
NKE,Nike Inc,20180119,Nike at two-year high as analysts tout margin benefits of direct sales ,Nike Inc's  shares surged to a two-year high on Friday after two Wall Street brokerages said the footwear maker's profitability would soon reap the benefits of its recent move to sell directly to consumers.,topStory
NOK,Nokia Corporation,20180119,Nokia signs its first official 5G equipment deal with NTT DoCoMo ,FRANKFURT Finland's Nokia said on Friday it signed its first major deal to supply new 5G wireless radio base stations to Japanese telecom operator NTT DoCoMo  which boasts nearly half of the country's mobile subscribers.,topStory
NOK,Nokia Corporation,20180119,Nokia signs its first official 5G equipment deal with NTT DoCoMo ,FRANKFURT  Jan 19 Finland's Nokia said on Friday it signed its first major deal to supply new 5G wireless radio base stations to Japanese telecom operator NTT DoCoMo  which boasts nearly half of the country's mobile subscribers.,normal
NOK,Nokia Corporation,20180119,BRIEF-Nokia Wins Network Order From Nepal's Worldlink ,* NOKIA OYJ - NOKIA AND WORLDLINK TO BUILD NEPAL'S LARGEST FIBER-TO-THE-HOME NETWORK FOR DELIVERY OF SUPER-FAST CONSUMER AND BUSINESS BROADBAND SERVICES Source text for Eikon: [https://www.nokia.com/en_int/news/releases/2018/01/19/nokia-and-worldlink-to-build-nepals-largest-fiber-to-the-home-network-for-delivery-of-super-fast-consumer-and-business-broadband-services ] Further company coverage: (Helsinki Newsroom),normal
NOA,North American Energy Partners Inc,20180119,UPDATE 5-Schlumberger profit beats  sees stronger year for oil sector ,HOUSTON Jan 19 Schlumberger on Friday posted a fourth quarter loss on charges but beat Wall Street forecasts and gave an upbeat outlook  predicting its international operations would grow in 2018 for the first time in four years.,normal
DCM,NTT DOCOMO Inc,20180119,Nokia signs its first official 5G equipment deal with NTT DoCoMo ,FRANKFURT Finland's Nokia said on Friday it signed its first major deal to supply new 5G wireless radio base stations to Japanese telecom operator NTT DoCoMo  which boasts nearly half of the country's mobile subscribers.,topStory
DCM,NTT DOCOMO Inc,20180119,Nokia signs its first official 5G equipment deal with NTT DoCoMo ,FRANKFURT  Jan 19 Finland's Nokia said on Friday it signed its first major deal to supply new 5G wireless radio base stations to Japanese telecom operator NTT DoCoMo  which boasts nearly half of the country's mobile subscribers.,normal
OCN,Ocwen Financial Corporation,20180119,BRIEF-Ocwen Financial Says Entered Into Additional Agreements To Resolve Regulatory Actions Brought By North Carolina  South Dakota ,* OCWEN FINANCIAL SAYS ENTERED INTO ADDITIONAL AGREEMENTS TO RESOLVE REGULATORY ACTIONS BROUGHT BY NORTH CAROLINA AND SOUTH DAKOTA - SEC FILING,topStory
PBR,Petroleo Brasileiro SA- Petrobras,20180119,Braskem shareholders agree on migration to single class of stock- filing ,SAO PAULO  Jan 19 Brazil state-controlled oil company Petroleo Brasileiro SA and construction conglomerate Odebrecht SA have agreed on a transaction to migrate all Braskem shares into a single class of stock  the oil company said in a securities filing on Friday.,topStory
PBR,Petroleo Brasileiro SA- Petrobras,20180119,Petrobras owes Brazil billions  unlikely to pay in 2018  minister says ,BRASILIA Brazilian state-controlled oil company Petróleo Brasileiro SA  owes the government billions of dollars tied to offshore exploration rights but is unlikely to pay this year  a cabinet minister said.,normal
PJC,Piper Jaffray Companies,20180119,UPDATE 1-U.S. oil drillers cut rigs for 2nd week in three -Baker Hughes , (Adds Permian rigs and production)     By Scott DiSavino     Jan 19 U.S. energy companies this week cut oil rigs for the second time in three weeks even though crude prices traded near their highest level since 2014.     Drillers cut five oil rigs in the week to Jan. 19  bringing the total count down to 747  General Electric Co's        Baker Hughes energy services firm said in its closely followed report on Friday.          The U.S. rig count  an early indicat,normal
PJC,Piper Jaffray Companies,20180119,U.S. oil drillers cut rigs for 2nd week in three -Baker Hughes ,    Jan 19 U.S. energy companies this week cut oil rigs for the second time in three weeks even though crude prices traded near their highest level since 2014.     Drillers cut five oil rigs in the week to Jan. 19  bringing the total count down to 747  General Electric Co's        Baker Hughes energy services firm said in its closely followed report on Friday.          The U.S. rig count  an early indicator of future output  is much higher than a year ago when o,normal
PQG,PQ Group Holdings Inc,20180119,BRIEF-PQ Group Holdings Announces Successful Pricing Of Term Loan Facility  Entry Into Swap Arrangements ,* PQ GROUP HOLDINGS ANNOUNCES SUCCESSFUL PRICING OF TERM LOAN FACILITY AND ENTRY INTO SWAP ARRANGEMENTS,topStory
PB,Prosperity Bancshares Inc,20180119,BRIEF-Prosperity Bancshares Announces Stock Repurchase Program ,* PROSPERITY BANCSHARES  INC.® ANNOUNCES STOCK REPURCHASE PROGRAM,topStory
PFK,Prudential Financial Inc,20180119,BRIEF-Prudential Financial Reports 7.3 Pct Passive Stake In Albemarle Corp As Of Dec 31  2017 ,* PRUDENTIAL FINANCIAL INC REPORTS A 7.3 PERCENT PASSIVE STAKE IN ALBEMARLE CORP AS OF DEC 31  2017 - SEC FILING Source text: [http://bit.ly/2rpvEOq] Further company coverage:,topStory
PJH,Prudential Financial Inc,20180119,BRIEF-Prudential Financial Reports 7.3 Pct Passive Stake In Albemarle Corp As Of Dec 31  2017 ,* PRUDENTIAL FINANCIAL INC REPORTS A 7.3 PERCENT PASSIVE STAKE IN ALBEMARLE CORP AS OF DEC 31  2017 - SEC FILING Source text: [http://bit.ly/2rpvEOq] Further company coverage:,topStory
PRH,Prudential Financial Inc,20180119,BRIEF-Prudential Financial Reports 7.3 Pct Passive Stake In Albemarle Corp As Of Dec 31  2017 ,* PRUDENTIAL FINANCIAL INC REPORTS A 7.3 PERCENT PASSIVE STAKE IN ALBEMARLE CORP AS OF DEC 31  2017 - SEC FILING Source text: [http://bit.ly/2rpvEOq] Further company coverage:,topStory
PRU,Prudential Financial Inc,20180119,BRIEF-Prudential Financial Reports 7.3 Pct Passive Stake In Albemarle Corp As Of Dec 31  2017 ,* PRUDENTIAL FINANCIAL INC REPORTS A 7.3 PERCENT PASSIVE STAKE IN ALBEMARLE CORP AS OF DEC 31  2017 - SEC FILING Source text: [http://bit.ly/2rpvEOq] Further company coverage:,topStory
RF,Regions Financial Corporation,20180119,Regions Financial Corp reports results for the quarter ended December 31 - summary ,Jan 19 * Regions Financial Corp  posted quarterly adjusted earnings of 36 cents per share. The mean expectation of 27 analysts for the quarter ended December 31 was for earnings of 26 cents per share. * Revenue rose 11.91 percent to $1.49 billion from a year ago; analysts expected $1.44 billion. * Regions Financial Corp's Reported EPS for the quarter was 27 cents. * The mean earnings estimate of analysts had risen by about 0.1 percent in the last three months. * In the last 30 days s,topStory
RF,Regions Financial Corporation,20180119,Regions  SunTrust top profit estimates on higher interest rates ,Regions Financial Corp  and SunTrust Banks Inc  reported quarterly earnings on Friday that topped Wall Street expectations  benefiting from higher interest rates amid sluggish lending.,normal
RF,Regions Financial Corporation,20180119,CORRECTED-UPDATE 2-Regions  SunTrust top profit estimates on higher interest rates ,Jan 19 Regions Financial Corp and SunTrust Banks Inc reported quarterly earnings on Friday that topped Wall Street expectations  benefiting from higher interest rates amid sluggish lending.,normal
RF,Regions Financial Corporation,20180119,BRIEF-Regions reports Q4 Earnings Per Share $0.27 From Continuing Operations ,* REGIONS REPORTS FULL YEAR 2017 EARNINGS OF $1.2 BILLION  UP 9 PERCENT OVER THE PRIOR YEAR  AND EARNINGS PER SHARE OF $1.00  UP 15 PERCENT,normal
RF,Regions Financial Corporation,20180119,REFILE-Regions Financial's fourth-quarter profit rises 14.3 pct ,Jan 19 Regions Financial Corp's fourth-quarter profit rose 14.3 percent  as it earned more interest income.,normal
RBS,Royal Bank Scotland plc (The),20180119,RBS offers support to customers hit by collapse of Carillion ,LONDON  Jan 19 The Royal Bank of Scotland on Friday announced a range of measures for individual customers hit by the collapse of construction outsourcing company Carillion.,topStory
RBS,Royal Bank Scotland plc (The),20180119,BRIEF-Royal Bank Of Scotland Says 75 Mln Stg For Impacted Small Businesses In Carillion's Supply Chain​ ,* RBS ANNOUNCES £75M FOR IMPACTED SMALL BUSINESSES IN CARILLION'S SUPPLY CHAIN​,normal
SNY,Sanofi,20180119,BRIEF-Sanofi appoints new EVP  in charge of business transformation ,* says appoints Dominique Carouge as executive vice president head of business transformation and member of the executive committee  effective Feb. 15 Further company coverage: (Paris Newsroom),topStory
SNY,Sanofi,20180119,LPC-European leveraged loan market starts year with a bang ,LONDON  Jan 19 Europe’s leveraged loan market has started with a bang with over €10bn of loans in syndication  prompting one of the busiest Januarys since the financial crisis in terms of new issue volume.,normal
SLB,Schlumberger NV,20180119,Schlumberger profit beats  sees stronger year for oil sector ,HOUSTON Schlumberger  on Friday posted a fourth quarter loss on charges but beat Wall Street forecasts and gave an upbeat outlook  predicting its international operations would grow in 2018 for the first time in four years. | Video ,topStory
SLB,Schlumberger NV,20180119,UPDATE 5-Schlumberger profit beats  sees stronger year for oil sector ,HOUSTON Jan 19 Schlumberger on Friday posted a fourth quarter loss on charges but beat Wall Street forecasts and gave an upbeat outlook  predicting its international operations would grow in 2018 for the first time in four years.,normal
