SANM,Sanmina Corporation,20180119,BRIEF-Sanmina Sees Q1 Gaap Loss Per Share $1.85 To $2.27 ,* SANMINA ANNOUNCES PRELIMINARY FIRST QUARTER FISCAL 2018 RESULTS,topStory
SHPG,Shire plc,20180119,BRIEF-Shire Says ‍Thomas Dittrich Will Assume Role As CFO ,* ‍THOMAS DITTRICH WILL ASSUME HIS ROLE AS CHIEF FINANCIAL OFFICER​,topStory
STRA,Strayer Education Inc,20180119,BRIEF-Strayer Education Stockholders Approve Merger With Capella Education ,* STRAYER EDUCATION  INC. STOCKHOLDERS APPROVE PROPOSED MERGER WITH CAPELLA EDUCATION COMPANY,topStory
STRA,Strayer Education Inc,20180119,BRIEF-Capella Education Shareholders Approve Merger With Strayer Education ,* CAPELLA EDUCATION COMPANY SHAREHOLDERS APPROVE PROPOSED MERGER WITH STRAYER EDUCATION  INC. Source text for Eikon: Further company coverage:,normal
STKL,SunOpta Inc,20180119,BRIEF-Tejnaksh Healthcare Acquires Stake In Tejvedaant Healthcare For 10 Mln Rupees ,* ACQUIRES ADDITIONAL 15 PERCENT STAKE IN TEJVEDAANT HEALTHCARE PRIVATE LIMITED FOR 10 MILLION RUPEES Source text for Eikon: Further company coverage:,topStory
TELL,Tellurian Inc,20180119,Panama says sunken Iranian tanker had papers in order ,PANAMA CITY The Iranian tanker that sank after a collision in the East China Sea  causing the worst oil ship disaster in years  had its paperwork in order  according an initial review by maritime authorities in Panama  whose flag it was sailing under.,topStory
TELL,Tellurian Inc,20180119,Panama says sunken Iranian tanker had papers in order ,PANAMA CITY  Jan 19 The Iranian tanker that sank after a collision in the East China Sea  causing the worst oil ship disaster in years  had its paperwork in order  according an initial review by maritime authorities in Panama  whose flag it was sailing under.,normal
CG,The Carlyle Group LP,20180119,BRIEF-Carlyle Group Reports 6 Pct Passive Stake In Union Bankshares ,* THE CARLYLE GROUP L.P REPORTS 6.0 PERCENT PASSIVE STAKE IN UNION BANKSHARES CORP AS OF JANUARY 1  2018 - SEC FILING‍​ Source text: (http://bit.ly/2mXGaYr),topStory
TCGP,The Carlyle Group LP,20180119,BRIEF-Carlyle Group Reports 6 Pct Passive Stake In Union Bankshares ,* THE CARLYLE GROUP L.P REPORTS 6.0 PERCENT PASSIVE STAKE IN UNION BANKSHARES CORP AS OF JANUARY 1  2018 - SEC FILING‍​ Source text: (http://bit.ly/2mXGaYr),topStory
UBSH,Union Bankshares Corporation,20180119,BRIEF-Carlyle Group Reports 6 Pct Passive Stake In Union Bankshares ,* THE CARLYLE GROUP L.P REPORTS 6.0 PERCENT PASSIVE STAKE IN UNION BANKSHARES CORP AS OF JANUARY 1  2018 - SEC FILING‍​ Source text: (http://bit.ly/2mXGaYr),topStory
URGN,UroGen Pharma Ltd,20180119,BRIEF-Urogen Pharma Announces Pricing Of Public Offering Of Ordinary Shares ,* UROGEN PHARMA ANNOUNCES PRICING OF PUBLIC OFFERING OF ORDINARY SHARES,topStory
VALU,Value Line Inc,20180119,BRIEF-Value Line ‍Announces Quarterly Cash Dividend Of $0.18/SHR ,* VALUE LINE ‍ANNOUNCES QUARTERLY CASH DIVIDEND OF $0.18 PER COMMON SHARE   A SPECIAL DIVIDEND OF $0.20 PER SHARE AND REAFFIRMS SHARE BUYBACK PROGRAM​ Source text - http://bit.ly/2DUq0Xn Further company coverage:,topStory
VEON,VEON Ltd,20180119,BRIEF-Veon Appoints Alexander Pertsovsky As Alternate Director For Alexey Reznikovich ,* VEON APPOINTS ALEXANDER PERTSOVSKY AS ALTERNATE DIRECTOR FOR ALEXEY REZNIKOVICH Source text for Eikon: Further company coverage: (Gdynia Newsroom),topStory
VRNT,Verint Systems Inc,20180119,BRIEF-Verint Systems Says Reaffirming Non-GAAP Outlook For Year Ending Jan 31 ,* VERINT SYSTEMS - INTEND TO REAFFIRM  AND HEREBY REAFFIRMING  NON-GAAP OUTLOOK FOR YEAR ENDING JAN 31  2018 ON CALL WITH EXISTING  POTENTIAL LENDERS Source text: (http://bit.ly/2DRS6Ct) Further company coverage: (Bengaluru Newsroom: +91 806 749 1136),topStory
VIA,Viacom Inc,20180119,BRIEF-Viacom CEO Robert Bakish's 2017 Total Compensation Was $20.3 Mln ,* VIACOM INC - CEO ROBERT M. BAKISH 'S 2017 TOTAL COMPENSATION WAS $20.3 MILLION - SEC FILING‍​,topStory
VIAB,Viacom Inc,20180119,BRIEF-Viacom CEO Robert Bakish's 2017 Total Compensation Was $20.3 Mln ,* VIACOM INC - CEO ROBERT M. BAKISH 'S 2017 TOTAL COMPENSATION WAS $20.3 MILLION - SEC FILING‍​,topStory
WLFC,Willis Lease Finance Corporation,20180119,BRIEF-Willis Lease Says It Gave All Non-Executive Employees One-Time Bonus Of $1 000 ,* WILLIS LEASE FINANCE GIVES EMPLOYEE BONUS DRIVEN BY NEW TAX LAWS,topStory
WTFC,Wintrust Financial Corporation,20180119,BRIEF-Wintrust Raises Minium Wage Due To Tax Reform Legislation​ ,* WINTRUST FINANCIAL - DUE TO TAX REFORM LEGISLATION  CO TO RAISE MINIMUM WAGE PAID TO ELIGIBLE NON-COMMISSIONED HOURLY EMPLOYEES TO $15 PER HOUR​ Source text for Eikon: Further company coverage:,topStory
WTFCM,Wintrust Financial Corporation,20180119,BRIEF-Wintrust Raises Minium Wage Due To Tax Reform Legislation​ ,* WINTRUST FINANCIAL - DUE TO TAX REFORM LEGISLATION  CO TO RAISE MINIMUM WAGE PAID TO ELIGIBLE NON-COMMISSIONED HOURLY EMPLOYEES TO $15 PER HOUR​ Source text for Eikon: Further company coverage:,topStory
XPLR,Xplore Technologies Corp,20180119,BRIEF-Xplore Improves Full-Year Revenue Outlook ,* XPLORE IMPROVES FULL-YEAR REVENUE OUTLOOK ON STRONG DECEMBER QUARTER SALES  CUSTOMER WINS AND ROBUST BACKLOG,topStory
ZEAL,Zealand Pharma A/S,20180119,BRIEF-Zealand Pharma Announces Progress To Phase 3 With Dasiglucagon For The Treatment Of Congenital Hyperinsulinism ,* ZEALAND PHARMA ANNOUNCES PROGRESS TO PHASE 3 WITH DASIGLUCAGON FOR THE TREATMENT OF CONGENITAL HYPERINSULINISM IN FIRST HALF 2018,topStory
ABBV,AbbVie Inc,20180119,Plaintiffs granted subpoena of AbbVie CEO in upcoming Depakote trial ,A federal judge in Illinois overseeing parts of the mass litigation over antiepileptic drug Depakote denied a request by AbbVie Inc to quash a subpoena for the unit's chief executive to appear in an upcoming trial over allegations the drug causes birth defects.,topStory
GOLF,Acushnet Holdings Corp,20180119,BRIEF-Acushnet Holdings Acquires Links & Kings ,* ACUSHNET HOLDINGS CORP. ACQUIRES LINKS & KINGS  MAKER OF HANDCRAFTED LEATHER GOLF PRODUCTS Source text for Eikon: Further company coverage:,topStory
ALB,Albemarle Corporation,20180119,BRIEF-Prudential Financial Reports 7.3 Pct Passive Stake In Albemarle Corp As Of Dec 31  2017 ,* PRUDENTIAL FINANCIAL INC REPORTS A 7.3 PERCENT PASSIVE STAKE IN ALBEMARLE CORP AS OF DEC 31  2017 - SEC FILING Source text: [http://bit.ly/2rpvEOq] Further company coverage:,topStory
BABA,Alibaba Group Holding Limited,20180119,BRIEF-Alibaba Pictures Group Says Shanghai TPP Enters Advertising Services Framework Agreements ,* SHANGHAI TPP ENTERS ADVERTISING SERVICES FRAMEWORK AGREEMENTS WITH UNITS OF ALIBABA GROUP HOLDING LTD Source text for Eikon: Further company coverage: (bangalore.newsroom@thomsonreuters.com),topStory
BABA,Alibaba Group Holding Limited,20180119,BRIEF-Controlling shareholder of New Huadu Supercenter sells stake to Alibaba's unit and its party acting in concert ,* Says controlling shareholder of the company completed sale of 10 percent stake in the company to Alibaba Group Holding's unit and its party acting in concert,normal
AGN,Allergan plc,20180119,Allergan loses bid to avoid Asacol antitrust trial after appellate order ,Allergan PLC on Friday lost a last-minute bid to delay an upcoming trial in a class action lawsuit claiming it suppressed generic competition for its ulcerative colitis drug Asacol.,topStory
ABC,AmerisourceBergen Corporation (Holding Co),20180119,BRIEF-AmerisourceBergen Corp Says CEO Steven Collis' FY 2017 Total Compensation Was $9.9 Mln Vs $10.0 Mln In FY 2016 ,* AMERISOURCEBERGEN CORP SAYS CEO STEVEN COLLIS' FY 2017 TOTAL COMPENSATION WAS $9.9 MILLION VERSUS $10.0 MILLION IN FY 2016 - SEC FILING Source text: (http://bit.ly/2mONZyU) Further company coverage:,topStory
AP,Ampco-Pittsburgh Corporation,20180119,BRIEF-Ampco-Pittsburgh Says Selling Shareholders May Sell Up To 1.8 Mln Shares ,* AMPCO-PITTSBURGH CORP FILES TO SAY SELLING SHAREHOLDERS MAY SELL UP TO 1.8 MILLION SHARES OF CO'S COMMON STOCK - SEC FILING‍​ Source text: (http://bit.ly/2BeaId3) Further company coverage:,topStory
APO,Apollo Global Management LLC,20180119,Apollo-owned security firm ADT's IPO prices below target ,U.S. security company ADT Corp   owned by private equity firm Apollo Global Management LLC   said on Thursday its initial public offering (IPO) was priced well below its expected range  signaling investors are being picky about new offerings.,topStory
APO,Apollo Global Management LLC,20180119,Apollo-owned security firm ADT's IPO prices below target ,Jan 18 U.S. security company ADT Corp  owned by private equity firm Apollo Global Management LLC   said on Thursday its initial public offering (IPO) was priced well below its expected range  signalling investors are being picky about new offerings.,normal
ADM,Archer-Daniels-Midland Company,20180119,BRIEF-Archer Daniels Midland Has Made Takeover Approach To Bunge- WSJ ,* ARCHER DANIELS MIDLAND CO HAS MADE A TAKEOVER APPROACH TO BUNGE LTD - WSJ  CITING SOURCES‍​ Source text : http://on.wsj.com/2mQwBcV Further company coverage:,topStory
AZN,Astrazeneca PLC,20180119,BRIEF-AstraZeneca's asthma treatment ‍Fasenra approved In Japan​ ,* ‍FASENRA RECEIVES APPROVAL IN JAPAN​ Source text for Eikon: Further company coverage: (Reporting By London Bureau),topStory
AZN,Astrazeneca PLC,20180119,BRIEF-AstraZeneca's ovarian cancer drug ‍Lynparza approved in Japan ,* ‍LYNPARZA RECEIVES APPROVAL IN JAPAN FOR TREATMENT OF ADVANCED OVARIAN CANCER​ Source text for Eikon: Further company coverage: (Reporting By London Bureau),normal
AZN,Astrazeneca PLC,20180119,At AstraZeneca  fewer drug projects bring big productivity jump ,LONDON A focus on fewer diseases  together with cuts in laboratories and staff  has delivered a more than fourfold increase in research productivity at drugmaker AstraZeneca   based on one key measure of success.    The analysis published on Friday comes at a time of soul-searching among large pharmaceutical companies as they compete with smaller biotech firms  which are getting new drugs to market more efficiently.    The turnaround evident this decade at AstraZeneca fo,normal
AZN,Astrazeneca PLC,20180119,At AstraZeneca  fewer drug projects bring big productivity jump ,LONDON  Jan 19 A focus on fewer diseases  together with cuts in laboratories and staff  has delivered a more than fourfold increase in research productivity at drugmaker AstraZeneca  based on one key measure of success.,normal
BK,Bank Of New York Mellon Corporation (The),20180119,Brazilian prosecutors ask BNY Mellon unit to return $2.5 billion to local fund , (This story corrects seventh paragraph to say 'fiduciary manager'  not 'fiduciary administrator'  in BNY Mellon statement.),topStory
BK,Bank Of New York Mellon Corporation (The),20180119,CORRECTED-UPDATE 2-Brazilian prosecutors ask BNY Mellon unit to return $2.5 bln to local fund ,SAO PAULO  Jan 18 Brazilian prosecutors asked on Thursday that the local unit of Bank of New York Mellon Corp return 8.2 billion reais ($2.56 billion) to local pension fund Postalis  according to a statement.,normal
BERY,Berry Global Group Inc,20180119,BRIEF-Berry Global Group Prices $500 Million Second Priority Senior Secured Notes Private Offering ,* BERRY GLOBAL GROUP  INC. PRICES $500 MILLION SECOND PRIORITY SENIOR SECURED NOTES PRIVATE OFFERING,topStory
BERY,Berry Global Group Inc,20180119,BRIEF-Berry Global Group Unit Plans To Issue $400 Mln Of Second Priority Senior Secured Notes Due 2026 ,* BERRY GLOBAL GROUP  INC. ANNOUNCES PROPOSED OFFERING OF SECOND PRIORITY SENIOR SECURED NOTES,normal
BAK,Braskem SA,20180119,Braskem shareholders agree on migration to single class of stock- filing ,SAO PAULO  Jan 19 Brazil state-controlled oil company Petroleo Brasileiro SA and construction conglomerate Odebrecht SA have agreed on a transaction to migrate all Braskem shares into a single class of stock  the oil company said in a securities filing on Friday.,topStory
BT,BT Group plc,20180119,BRIEF-BT Group Says Court Rules On Index For BTPS Pension Increases ,* ‍HIGH COURT HANDED DOWN JUDGMENT ON FRIDAY WHICH CONFIRMS THAT IT IS CURRENTLY NOT POSSIBLE TO CHANGE FROM RPI TO ANOTHER INDEX​,topStory
BG,Bunge Limited,20180119,BRIEF-Archer Daniels Midland Has Made Takeover Approach To Bunge- WSJ ,* ARCHER DANIELS MIDLAND CO HAS MADE A TAKEOVER APPROACH TO BUNGE LTD - WSJ  CITING SOURCES‍​ Source text : http://on.wsj.com/2mQwBcV Further company coverage:,topStory
BG,Bunge Limited,20180119,EU mergers and takeovers (Jan 19) ,BRUSSELS  Jan 19 The following are mergers under review by the European Commission and a brief guide to the EU merger process:,normal
CHU,China Unicom (Hong Kong) Ltd,20180119,BRIEF-China Unicom Hong Kong Says Dec Aggregate Number Of Mobile Billing Subscribers 284.2 Mln ,* DEC AGGREGATE NUMBER OF MOBILE BILLING SUBSCRIBERS 284.163 MILLION,topStory
C,Citigroup Inc,20180119,LIVE MARKETS-Woodford sees best opportunities among UK domestics ,    * Euro zone shares hit ten year high     * STOXX 600 at 2 1/2 year peak     * Carpetright  Dignity drop after profit warnings      Jan 19 Welcome to the home for real time coverage of European equity markets brought to you by Reuters stocks reporters and anchored today by Danilo Masoni. Reach him on Messenger to share your thoughts on market moves: danilo.masoni.thomsonreuters.com@reuters.net                 WOODFORD SEES BEST OPPORTUNITIES AMONG UK DOMESTICS (1536 GMT)     In co,normal
C,Citigroup Inc,20180119,LIVE MARKETS-Carpetright stains to spread? ,    * Euro zone shares hit ten year high     * STOXX 600 at 2 1/2 year peak     * Carpetright  Dignity drop after profit warnings      Jan 19 Welcome to the home for real time coverage of European equity markets brought to you by Reuters stocks reporters and anchored today by Danilo Masoni. Reach him on Messenger to share your thoughts on market moves: danilo.masoni.thomsonreuters.com@reuters.net               CARPETRIGHT STAINS TO SPREAD? (1512 GMT)     "Carpetright's update indicat,normal
C,Citigroup Inc,20180119,LIVE MARKETS-Backwardation should drive energy stocks forward ,    * Euro zone shares hit ten year high     * STOXX 600 at 2 1/2 year peak     * Carpetright  Dignity drop after profit warnings      Jan 19 Welcome to the home for real time coverage of European equity markets brought to you by Reuters stocks reporters and anchored today by Danilo Masoni. Reach him on Messenger to share your thoughts on market moves: danilo.masoni.thomsonreuters.com@reuters.net               BACKWARDATION SHOULD DRIVE ENERGY STOCKS FORWARD (1400 GMT)     The oil ma,normal
C,Citigroup Inc,20180119,LIVE MARKETS-Half session update: Europe on a high ,    * Euro zone shares hit ten year high     * STOXX 600 at 2 1/2 year peak     * Carpetright  Dignity drop after profit warnings      Jan 19 Welcome to the home for real time coverage of European equity markets brought to you by Reuters stocks reporters and anchored today by Danilo Masoni. Reach him on Messenger to share your thoughts on market moves: danilo.masoni.thomsonreuters.com@reuters.net               HALF SESSION UPDATE: EUROPE ON A HIGH (1320 GMT)     After a rather subdue,normal
C,Citigroup Inc,20180119,LIVE MARKETS-So Greek sovereign bonds recovered  are shares next? ,    * Euro zone shares hit ten year high     * STOXX at 2 1/2 year peak     * Carpetright  Dignity drop after profit warnings      Jan 19 Welcome to the home for real time coverage of European equity markets brought to you by Reuters stocks reporters and anchored today by Danilo Masoni. Reach him on Messenger to share your thoughts on market moves: danilo.masoni.thomsonreuters.com@reuters.net               SO GREEK SOVEREIGN BONDS RECOVERED  ARE SHARES NEXT? (1235 GMT)      Greek sov,normal
C,Citigroup Inc,20180119,LIVE MARKETS-High risk premia preserve dominance of stocks over bonds ,    * Euro zone shares hit ten year high     * STOXX at 2 1/2 year peak     * Carpetright  Dignity drop after profit warnings      Jan 19 Welcome to the home for real time coverage of European equity markets brought to you by Reuters stocks reporters and anchored today by Danilo Masoni. Reach him on Messenger to share your thoughts on market moves: danilo.masoni.thomsonreuters.com@reuters.net               HIGH RISK PREMIA PRESERVE DOMINANCE OF STOCKS OVER BONDS (1208 GMT)     With e,normal
CFG,Citizens Financial Group Inc,20180119,BRIEF-Citizens Financial Group Sees FY2018 Provision Expense $425 Mln - $475 Mln Vs. Underlying 2017‍​ ,* CITIZENS FINANCIAL GROUP SEES FY2018 PROVISION EXPENSE $425 MILLION - $475 MILLION VERSUS. UNDERLYING 2017‍​,topStory
CFG,Citizens Financial Group Inc,20180119,BRIEF-Citizens Financial Group Q4 Earnings Per Share $1.35 ,* CITIZENS FINANCIAL GROUP  INC. REPORTS FOURTH QUARTER NET INCOME OF $666 MILLION AND DILUTED EPS OF $1.35,normal
CIVI,Civitas Solutions Inc,20180119,BRIEF-Stadium Capital Management LLC Reports 5.9 Percent Passive Stake In Civitas Solutions ,* STADIUM CAPITAL MANAGEMENT LLC REPORTS 5.9 PERCENT PASSIVE STAKE IN CIVITAS SOLUTIONS INC AS OF JAN 9 - SEC FILING Source text : http://bit.ly/2rq0Z3D Further company coverage:,topStory
CS,Credit Suisse Group,20180119,UPDATE 1-Credit Suisse Asia Pacific investment banking co-head leaving - sources ,* Chow likely leaving to pursue opportunities outside the bank (Adds details  Credit Suisse league table ranking),topStory
CS,Credit Suisse Group,20180119,Credit Suisse top Asia Pacific dealmaker Mervyn Chow leaving - sources ,HONG KONG  Jan 19 Credit Suisse's Asia Pacific co-head of investment banking and capital markets  Mervyn Chow  is leaving after working with the bank for nearly two decades  people familiar with the move said.,normal
DAL,Delta Air Lines Inc,20180119,Delta Air to tighten rules for onboard service animals ,NEW YORK Delta Air Lines is tightening the requirements for passengers traveling with onboard service and emotional support animals  the carrier said on Friday  following a sharp uptick in pet-related safety issues in recent years. | Video ,topStory
DAL,Delta Air Lines Inc,20180119,Delta Air to tighten onboard emotional support animal requirements ,NEW YORK  Jan 19 Delta Air Lines is tightening the requirements for passengers traveling with onboard service and emotional support animals  the carrier said on Friday  following a sharp uptick in animal-related safety issues over the last several years.,normal
DB,Deutsche Bank AG,20180119,LIVE MARKETS-Further euro strength could dent earnings  says Deutsche ,    * European shares edge higher     * STOXX at 2 1/2 year peak     * Carpetright  Dignity drop after profit warnings      Jan 19 Welcome to the home for real time coverage of European equity markets brought to you by Reuters stocks reporters and anchored today by Danilo Masoni. Reach him on Messenger to share your thoughts on market moves: danilo.masoni.thomsonreuters.com@reuters.net               FURTHER EURO STRENGTH COULD DENT EARNINGS  SAYS DEUTSCHE  (0943 GMT)     With the eur,topStory
ERJ,Embraer-Empresa Brasileira de Aeronautica,20180119,EMERGING MARKETS-Brazil stocks hold near all-time highs; Embraer jumps ,    By Bruno Federowski     BRASILIA  Jan 19 Brazilian stocks hovered near all-time highs on Friday as optimism over the nation's economic prospects sustained demand for local assets  while hopes of a tie-up with Boeing Co boosted shares of Embraer SA .     The benchmark Bovespa stock index rose 0.2 percent  supported by blue chips such as Vale SA and lenders Banco Bradesco SA and Itaú Unibanco Holding SA .     Emerging markets kicked off the year with a rally as several reports show,topStory
E,ENI SpA,20180119,RPT-Nigeria sues JP Morgan for $875 mln over Malabu oilfield deal ,LONDON  Jan 18 Nigeria has filed a claim against JP Morgan Chase for more than $875 million  accusing it of negligence in transferring funds from a disputed 2011 oilfield deal to a company controlled by the country's former oil minister.,topStory
EXR,Extra Space Storage Inc,20180119,BRIEF-Nuuvera And Aphria Finalize Offtake Agreement For Extra 60 000 Kgs Of Cannabis Production ,* NUUVERA AND APHRIA FINALIZE OFFTAKE AGREEMENT FOR EXTRA 60 000 KGS OF CANNABIS PRODUCTION Source text for Eikon: Further company coverage:,topStory
XOM,Exxon Mobil Corporation,20180119,BRIEF-Exxonmobil To Change Presentation Of Some Line Items‍​ In Upcoming Earnings ,* EXXONMOBIL -  WISHES TO NOTIFY INVESTORS THAT UPCOMING EARNINGS REPORT WILL REFLECT A CHANGE IN THE FORM OF PRESENTATION OF CERTAIN LINE ITEMS‍​,topStory
FHN,First Horizon National Corporation,20180119,BRIEF-First Horizon National Corp Qtrly ‍Loss Per Share $0.20​ ,* QTRLY TOTAL REVENUE $‍375.3 MILLION VERSUS $319.6 MILLION LAST YEAR,topStory
GEH,General Electric Capital Corporation,20180119,GE shares stumble to worst week since financial crisis ,NEW YORK General Electric  shares tumbled for a fifth straight session on Friday  sending the stock to its biggest weekly percentage drop since the financial crisis  after the company flagged a possible breakup and more than $11 billion in charges earlier in the week.,topStory
GEH,General Electric Capital Corporation,20180119,General Electric shares drop for fifth straight session ,NEW YORK  Jan 19 General Electric shares tumbled for a fifth straight session on Friday  flirting with their biggest weekly percentage drop since the financial crisis  after the company flagged a possible breakup and more than $11 billion in charges earlier in the week.,normal
GEK,General Electric Capital Corporation,20180119,GE shares stumble to worst week since financial crisis ,NEW YORK General Electric  shares tumbled for a fifth straight session on Friday  sending the stock to its biggest weekly percentage drop since the financial crisis  after the company flagged a possible breakup and more than $11 billion in charges earlier in the week.,topStory
GEK,General Electric Capital Corporation,20180119,General Electric shares drop for fifth straight session ,NEW YORK  Jan 19 General Electric shares tumbled for a fifth straight session on Friday  flirting with their biggest weekly percentage drop since the financial crisis  after the company flagged a possible breakup and more than $11 billion in charges earlier in the week.,normal
GE,General Electric Company,20180119,GE shares stumble to worst week since financial crisis ,NEW YORK General Electric  shares tumbled for a fifth straight session on Friday  sending the stock to its biggest weekly percentage drop since the financial crisis  after the company flagged a possible breakup and more than $11 billion in charges earlier in the week.,topStory
GE,General Electric Company,20180119,General Electric shares drop for fifth straight session ,NEW YORK  Jan 19 General Electric shares tumbled for a fifth straight session on Friday  flirting with their biggest weekly percentage drop since the financial crisis  after the company flagged a possible breakup and more than $11 billion in charges earlier in the week.,normal
GEB,General Electric Company,20180119,GE shares stumble to worst week since financial crisis ,NEW YORK General Electric  shares tumbled for a fifth straight session on Friday  sending the stock to its biggest weekly percentage drop since the financial crisis  after the company flagged a possible breakup and more than $11 billion in charges earlier in the week.,topStory
GEB,General Electric Company,20180119,General Electric shares drop for fifth straight session ,NEW YORK  Jan 19 General Electric shares tumbled for a fifth straight session on Friday  flirting with their biggest weekly percentage drop since the financial crisis  after the company flagged a possible breakup and more than $11 billion in charges earlier in the week.,normal
GM,General Motors Company,20180119,Judge tosses GM settlement on ignition switch ,NEW YORK A federal bankruptcy judge on Thursday said a settlement agreement that would require General Motors Co to pay $1 billion in stock to car owners suing the company over faulty ignition switches was not enforceable.,topStory
GWR,Genesee & Wyoming Inc,20180119,BRIEF-Genesee & Wyoming's Traffic in Dec. 2017 Was 255 199 Carloads  Decrease Of 15 344 Carloads  Compared With Dec. 2016 ,* GENESEE & WYOMING INC - G&W'S TRAFFIC IN DECEMBER 2017 WAS 255 199 CARLOADS  A DECREASE OF 15 344 CARLOADS  OR 5.7%  COMPARED WITH DECEMBER 2016,topStory
GS,Goldman Sachs Group Inc (The),20180119,MOVES-Goldman  Credit Suisse  Stifel Financial ,Jan 19 The following financial services industry appointments were announced on Friday. To inform us of other job changes  email moves@thomsonreuters.com.,topStory
GS,Goldman Sachs Group Inc (The),20180119,UPDATE 1-Rajiv Shah leaves BNP Paribas for Goldman Sachs ,LONDON  Jan 19 (IFR) - Rajiv Shah has left BNP Paribas where he was head of debt capital markets for the Middle East  Turkey and Africa in order to take up a role as senior originator for the Middle East and North Africa financing business at Goldman Sachs.,normal
HDB,HDFC Bank Limited,20180119,UPDATE 2-India's HDFC Bank  Kotak report strong profit growth in Q3 ,* IDFC Bank profit falls as non-performing loans rise (Adds Kotak Mahindra  IDFC Bank results  executive and analyst comments),topStory
HDB,HDFC Bank Limited,20180119,BRIEF-India's HDFC Bank Exec Says Loan Growth Came From Both Wholesale And Retail ,Jan 19 India's HDFC Bank deputy managing director Paresh Sukthankar:,normal
HDB,HDFC Bank Limited,20180119,India's HDFC Bank posts record quarterly profit ,Jan 19 HDFC Bank Ltd  India's second-biggest lender by assets  on Friday reported a record-high quarterly profit  helped by an increase in interest and fee incomes.,normal
HDB,HDFC Bank Limited,20180119,BRIEF-HDFC Bank Says Divergence In Gross NPA As At March 31  2017 Is 20.52 Bln Rupees ,* SAYS DIVERGENCE IN GROSS NPA AS AT MARCH 31  2017 IS 20.52 BILLION RUPEES,normal
