SLB,Schlumberger NV,20180119,BRIEF-Schlumberger Q4 Earnings Per Share $0.48 Excluding Items ,* Q4 EARNINGS PER SHARE VIEW $0.46 -- THOMSON REUTERS I/B/E/S,normal
SLB,Schlumberger NV,20180119,Schlumberger posts bigger fourth-quarter loss on charges ,Jan 19 Oilfield services provider Schlumberger Ltd on Friday posted a bigger quarterly loss than a year earlier as the company took charges of $2.7 billion for restructuring and a handful of other impairments.,normal
SMG,Scotts Miracle-Gro Company (The),20180119,BRIEF-Scotts Miracle-Gro Adopts Resolution to Reduce Board Size From 11 To 10 Members​ ,* SCOTTS MIRACLE-GRO- ON JAN. 19  BOARD ADOPTED RESOLUTION PURSUANT TO CODE OF REGULATIONS OF CO TO REDUCE SIZE OF BOARD FROM 11 TO 10 MEMBERS​ Source text: (http://bit.ly/2rolu0s) Further company coverage:,topStory
SJR,Shaw Communications Inc,20180119,BRIEF-The City of Vancouver Partners With Shaw Communications To Expand Public’S Access To Free Wi-Fi ,* CITY PARTNERS WITH SHAW TO EXPAND PUBLIC’S ACCESS TO FREE WI-FI Source text for Eikon: Further company coverage:,topStory
SJI,South Jersey Industries Inc,20180119,BRIEF-South Jersey Industries To Postpone Investor Day Presentation ,* SOUTH JERSEY INDUSTRIES: SJI TO POSTPONE INVESTOR DAY PRESENTATION,topStory
SJI,South Jersey Industries Inc,20180119,BRIEF-South Jersey Industries Issues Medium Term Notes Of $50 Million ,* SOUTH JERSEY INDUSTRIES INC - ‍ON JANUARY 16  2018  CO ISSUED AN AGGREGATE OF $50 MILLION AGGREGATE PRINCIPAL AMOUNT OF MEDIUM TERM NOTES - SEC FILING​,normal
SUN,Sunoco LP,20180119,Parent company of 7-Eleven agrees to divest some U.S. stores in Sunoco deal ,WASHINGTON Seven & i Holdings Co Ltd   the Tokyo-based parent company of the 7-Eleven network of stores  agreed to sell and divest some of its stores in its proposed $3.3 billion acquisition of 1 100 Sunoco LP  outlets  the U.S. Federal Trade Commission said Friday.,topStory
SUN,Sunoco LP,20180119,UPDATE 1-Parent company of 7-Eleven agrees to divest some U.S. stores in Sunoco deal ,WASHINGTON  Jan 19 Seven & i Holdings Co Ltd   the Tokyo-based parent company of the 7-Eleven network of stores  agreed to sell and divest some of its stores in its proposed $3.3 billion acquisition of 1 100 Sunoco LP outlets  the U.S. Federal Trade Commission said Friday.,normal
SUN,Sunoco LP,20180119,Parent company of 7-Eleven agrees to divest some U.S. stores in Sunoco deal ,WASHINGTON  Jan 19 Seven & i Holdings Co Ltd   the Tokyo-based parent company of the 7-Eleven network of stores  agreed to sell and divest some fuel outlets in its proposed $3.3 billion acquisition of 1 100 Sunoco LP outlets  the U.S. Federal Trade Commission said Friday.,normal
STI,SunTrust Banks Inc,20180119,Regions  SunTrust top profit estimates on higher interest rates ,Regions Financial Corp  and SunTrust Banks Inc  reported quarterly earnings on Friday that topped Wall Street expectations  benefiting from higher interest rates amid sluggish lending.,topStory
STI,SunTrust Banks Inc,20180119,CORRECTED-UPDATE 2-Regions  SunTrust top profit estimates on higher interest rates ,Jan 19 Regions Financial Corp and SunTrust Banks Inc reported quarterly earnings on Friday that topped Wall Street expectations  benefiting from higher interest rates amid sluggish lending.,normal
STI,SunTrust Banks Inc,20180119,BRIEF-Suntrust Says Scott Case Will Succeed Anil Cheriyan As CIO And Begin Role Effective February 5  2018​ ,* SUNTRUST ANNOUNCES CHIEF INFORMATION OFFICER RETIREMENT  APPOINTMENT,normal
STI,SunTrust Banks Inc,20180119,BRIEF-SunTrust Q4 Earnings Per Share $1.48 ,* - ‍NET INTEREST MARGIN WAS 3.17% IN CURRENT QUARTER  UP 2 BASIS POINTS SEQUENTIALLY AND UP 17 BASIS POINTS COMPARED TO PRIOR YEAR​,normal
SPN,Superior Energy Services Inc,20180119,Schlumberger profit beats  sees stronger year for oil sector ,HOUSTON Schlumberger  on Friday posted a fourth quarter loss on charges but beat Wall Street forecasts and gave an upbeat outlook  predicting its international operations would grow in 2018 for the first time in four years. | Video ,topStory
SYF,Synchrony Financial,20180119,Synchrony Financial reports results for the quarter ended December 31 - summary ,Jan 19 * Synchrony Financial  posted quarterly adjusted earnings of 70 cents  per share. The mean expectation of 20 analysts for the quarter ended December 31 was for earnings of 63 cents per share. * Revenue rose 7.94 percent to $3.92 billion from a year ago; analysts expected $3.96 billion. * Synchrony Financial's Reported EPS for the quarter was 49 cents. * The mean earnings estimate of analysts had risen by about 9.4 percent in the last three months. * In the last 30 days twelve ,topStory
SYF,Synchrony Financial,20180119,BRIEF-Synchrony Financial Q4 Earnings Per Share $0.49 ,* REPORTS FOURTH QUARTER NET EARNINGS OF $385 MILLION OR $0.49 PER DILUTED SHARE INCLUDING IMPACT FROM TAX CUTS AND JOBS ACT; $545 MILLION OR $0.70 EXCLUDING IMPACT,normal
TSM,Taiwan Semiconductor Manufacturing Company Ltd,20180119,BRIEF-TSMC Orders Machinery Equipment Worth T$372 Million From Siemens Ltd ,Jan 19 Taiwan Semiconductor Manufacturing Co Ltd :,topStory
TSM,Taiwan Semiconductor Manufacturing Company Ltd,20180119,Shares in Taiwan's TSMC open up 2.01 percent ,TAIPEI  Jan 19 Shares in Taiwan Semiconductor Manufacturing Co Ltd opened up 2.01 percent on Friday morning.,normal
BX,The Blackstone Group LP,20180119,Exclusive: Blackstone's Hill hands hedge fund reins to McCormick ,BOSTON After nearly two decades of growing Blackstone Group  into the world's biggest hedge fund investor with some $74 billion in assets  J. Tomilson Hill is passing the baton.,topStory
SCHW,The Charles Schwab Corporation,20180119,Judge rejects Schwab's bid to arbitrate ERISA lawsuit ,A federal judge in Oakland  California has denied a bid by Charles Schwab Corp to force arbitration of a proposed class action accusing it of loading its employees' retirement plan with its own high-cost funds to profit from fees.,topStory
TMO,Thermo Fisher Scientific Inc,20180119,Japan's TEPCO invests in UK blockchain company Electron ,* Japanese utility Tokyo Electric Power Company Holdings (TEPCO) has invested an undisclosed sum in Electron  a British technology company which specialises in blockchain technology,topStory
TM,Toyota Motor Corp Ltd Ord,20180119,Toyota to invest 400 million euros in northern France - report ,PARIS  Jan 19 Japan's Toyota Motor will invest 400 million euros ($488.96 million) in its plant of Onnaing  northern France  business newspaper Les Echos reported on Friday.,topStory
TM,Toyota Motor Corp Ltd Ord,20180119,BRIEF-R&I affirms Toyota Motor's rating at "AA+" and says stable outlook-R&I ,* Rating and Investment Information  Inc. (R&I) affirmed the company's rating at "AA+"-R&I,normal
RIG,Transocean Ltd,20180119,BRIEF-Transocean: Shareholders Approve Acquisition Of Songa Offshore ,* TRANSOCEAN LTD. SHAREHOLDERS APPROVE ACQUISITION OF SONGA OFFSHORE SE Source text for Eikon: Further company coverage: (Gdynia Newsroom),topStory
TRQ,Turquoise Hill Resources Ltd,20180119,METALS-Shanghai aluminium prices climb after China GDP boost ,    BEIJING  Jan 19 Shanghai aluminium prices rose on Friday  buoyed by the first acceleration in China's GDP growth in seven years  even as the country's output of the metal posted a surprise jump for December.     FUNDAMENTALS     * SHFE ALUMINIUM: The most-traded aluminium contract  on the Shanghai Futures Exchange (ShFE) was up 1 percent at 14 770 yuan ($2 307.56) a tonne at 0202 GMT  but still on course for a weekly drop of 2.3 percent.       * LME ALUMINIUM: In London  three mo,normal
TRQ,Turquoise Hill Resources Ltd,20180119,PRECIOUS-Gold inches up  but heads for first weekly loss in six ,    Jan 19 Gold prices edged up on Friday  supported by a weaker dollar and worries about a possible U.S. government shutdown  but the precious metal was still on track for its first weekly drop in six weeks.          FUNDAMENTALS         * Spot gold        was up 0.1 percent at $1 328.98 an ounce by 0111 GMT. Gold on Thursday touched its weakest level since Jan. 12 at $1 323.70 on Thursday  having fallen from recent four-month highs.     * Spot gold has fallen 0.8 percent so far thi,normal
TSN,Tyson Foods Inc,20180119,UPDATE 2-United States wins WTO chicken ruling against China ,GENEVA  Jan 19 The United States largely won a World Trade Organization ruling on Thursday that China had failed to comply with an earlier ruling against its punitive tariffs on U.S. broiler chickens.,normal
UMC,United Microelectronics Corporation,20180119,BRIEF-United Microelectronics' Unit Acquires United Semiconductor (Xiamen) For 2.45 Bln Yuan ,* SAYS UNIT UNITED MICROCHIP ACQUIRES UNITED SEMICONDUCTOR (XIAMEN) FOR 2.45 BILLION YUAN  ($383.47 million) Source text for Eikon: Further company coverage: ($1 = 6.3890 Chinese yuan renminbi) (Reporting by Hong Kong newsroom),topStory
VOYA,Voya Financial Inc,20180119,BRIEF-Voya Financial Prices Offering Of $350 Mln Of Junior Subordinated Notes ,* VOYA FINANCIAL PRICES OFFERING OF $350 MILLION OF JUNIOR SUBORDINATED NOTES,topStory
WHR,Whirlpool Corporation,20180119,BRIEF-Whirlpool ‍Estimates One-Time  Non-Cash Charge Of About $425 Mln In Q4 ,* WHIRLPOOL - ‍ESTIMATES WILL RECORD U.S. GAAP ONE-TIME  NON-CASH CHARGE OF ABOUT $425 MILLION TO TAX EXPENSE IN Q4 DUE TO TAX CUTS AND JOBS ACT​ Source text: (http://bit.ly/2rli3aR) Further company coverage:,topStory
WIT,Wipro Limited,20180119,UPDATE 2-India's Wipro upbeat on 2018 after quarterly profit dip ,* Predicts client spending boost in 2018 (Recasts  adds management and analyst comment),topStory
WIT,Wipro Limited,20180119,BRIEF-Wipro CEO Sees Large Digital Deal In Pipeline ,Jan 19 Wipro Ltd CEO Abidali Neemuchwala and Chief Human Resources Officer Saurabh Govil:,normal
WIT,Wipro Limited,20180119,BRIEF-Wipro Says CY18 Commentary From Clients Looks Positive ,* SAYS WHILE THERE ARE SOME CUSTOMER SPECIFIC UNCERTAINITIES  CY18 COMMENTARY FROM CLIENTS LOOKS POSITIVE Further company coverage:,normal
WIT,Wipro Limited,20180119,UPDATE 1-India's Wipro posts surprise fall in Q3 profit on higher costs ,Jan 19 Indian IT firm Wipro Ltd's posted a surprise fall in third-quarter profit as higher costs weighed.,normal
WIT,Wipro Limited,20180119,Indian software services company Wipro posts Q3 profit fall ,Jan 19 India's third-largest software services exporter Wipro posted an 8.5 percent drop in third-quarter net profit on Friday  hurt by higher costs.,normal
WIT,Wipro Limited,20180119,BRIEF-Wipro Expects March-Qtr Revenues From IT Services To Be In Range Of $2.03 Bln-$2.07 Bln ,* EXPECT MARCH QUARTER REVENUES FROM IT SERVICES TO BE IN THE RANGE OF $2 033 MILLION TO $2 073 MILLION Source text - http://bit.ly/2BcvfOR Further company coverage:,normal
WIT,Wipro Limited,20180119,BRIEF-India's Wipro Dec Qtr Consol Profit Down About 8.5 Pct ,* DEC QUARTER CONSOL NET PROFIT 19.31 BILLION RUPEES VERSUS 21.10 BILLION RUPEES LAST YEAR,normal
WPX,WPX Energy Inc,20180119,BRIEF-Selz Capital Reports 7.1 Pct Passive Stake In WPX Energy As Of Dec 31  2017 ,* SELZ CAPITAL REPORTS 7.1 PERCENT PASSIVE STAKE IN WPX ENERGY AS OF DEC 31  2017 - SEC FILING Source text (http://bit.ly/2FXnpfS) Further company coverage:,topStory
WPXP,WPX Energy Inc,20180119,BRIEF-Selz Capital Reports 7.1 Pct Passive Stake In WPX Energy As Of Dec 31  2017 ,* SELZ CAPITAL REPORTS 7.1 PERCENT PASSIVE STAKE IN WPX ENERGY AS OF DEC 31  2017 - SEC FILING Source text (http://bit.ly/2FXnpfS) Further company coverage:,topStory
XRX,Xerox Corporation,20180119,Xerox-Fujifilm deal should have been changed long ago: Icahn ,Hedge fund investor Carl Icahn has called for the termination or renegotiation of Xerox Corp's  long-running photocopier joint venture with Fujifilm Holdings   reiterating demands for a change of leadership at Xerox.,topStory
XRX,Xerox Corporation,20180119,REFILE-UPDATE 4-Xerox-Fujifilm deal should have been changed long ago -Icahn ,* Icahn says current Xerox management incapable of renegotiation,normal
XRX,Xerox Corporation,20180119,CORRECTED-UPDATE 3-Xerox-Fujifilm deal should have been changed long ago -Icahn ,Jan 18 Hedge fund investor Carl Icahn has called for the termination or renegotiation of Xerox Corp's long-running photocopier joint venture with Fujifilm Holdings   reiterating demands for a change of leadership at Xerox.,normal
ZAYO,Zayo Group Holdings Inc,20180119,BRIEF-Zayo Acquires Optic Zoo Networks ,* ZAYO GROUP HOLDINGS INC - ‍EXPECTS TO ACHIEVE APPROXIMATELY CAD $0.5M IN ANNUALIZED COST SYNERGIES BY YEAR-END 2018 AFTER INTEGRATION PROCESS​,topStory
CMT,Core Molding Technologies Inc,20180119,BRIEF-Core Molding And Subsidiary Entered Into Amended And Restated Credit Agreement - SEC Filing​ ,* CORE MOLDING TECHNOLOGIES INC - ‍ON JANUARY 16  2018  COMPANY AND SUBSIDIARY ENTERED INTO AN AMENDED AND RESTATED CREDIT AGREEMENT - SEC FILING​,topStory
EMAN,eMagin Corporation,20180119,BRIEF-Emagin Corp Says Preliminary Revenues In Q4 Estimated To Be Between $6.2 Mln To $6.4 Mln ,* EMAGIN CORPORATION COMMENTS ON PRELIMINARY FOURTH QUARTER 2017 REVENUES,topStory
