GOOG,Alphabet Inc,20151007,Alphabet launches code for fast loading of heavy mobile content ,Alphabet Inc  formerly Google Inc  announced a new open source code that allows faster loading of Web pages with heavy content such as video  animation and graphics on smartphones and tablets.,topStory
GOOG,Alphabet Inc,20151007,Twitter  Alphabet launch code for fast loading of heavy mobile content , ,normal
GOOGL,Alphabet Inc,20151007,Alphabet launches code for fast loading of heavy mobile content ,Alphabet Inc  formerly Google Inc  announced a new open source code that allows faster loading of Web pages with heavy content such as video  animation and graphics on smartphones and tablets.,topStory
GOOGL,Alphabet Inc,20151007,Twitter  Alphabet launch code for fast loading of heavy mobile content , ,normal
AMZN,Amazoncom Inc,20151007,Amazon considering online TV service: Bloomberg ,Amazon.com Inc is considering the creation of a live online TV service and has reached out to networks such as CBS Corp and Comcast's NBCUniversal to express interest in carrying their channels  Bloomberg reported.,topStory
AMZN,Amazoncom Inc,20151007,UPDATE 2-Amazon considering online TV service - Bloomberg ,Oct 7 Amazon.com Inc is considering the creation of a live online TV service and has reached out to networks such as CBS Corp and Comcast's  NBCUniversal to express interest in carrying their channels  Bloomberg reported.,normal
AMZN,Amazoncom Inc,20151007,Amazon rolls out new services for cloud ,Amazon.com Inc's cloud business  Amazon Web Services  launched a service on Wednesday to help companies analyze their data  as well as a suitcase-like product that will let them ship large amounts of data for storage on the cloud.,normal
AMZN,Amazoncom Inc,20151007,UPDATE 2-Amazon rolls out new services for cloud ,Oct 7 Amazon.com Inc's cloud business  Amazon Web Services  launched a service on Wednesday to help companies analyse their data  as well as a suitcase-like product that will let them ship large amounts of data for storage on the cloud.,normal
AMZN,Amazoncom Inc,20151007,Amazon launches data analytics service QuickSight ,Oct 7 Amazon.com Inc's cloud operations  Amazon Web Services (AWS)  has launched QuickSight  a cloud-based service to help companies analyse their data.,normal
AMZN,Amazoncom Inc,20151007,UPDATE 1-U.S. FAA says it will test ways to track rogue drone flights ,WASHINGTON  Oct 7 The Federal Aviation Administration will test new technology to detect and track rogue drone flights around U.S. airports through a partnership with Arlington  Virginia-based CACI International Inc  the agency said on Wednesday.,normal
CMCSA,Comcast Corporation,20151007,Amazon considering online TV service: Bloomberg ,Amazon.com Inc is considering the creation of a live online TV service and has reached out to networks such as CBS Corp and Comcast's NBCUniversal to express interest in carrying their channels  Bloomberg reported.,topStory
CMCSA,Comcast Corporation,20151007,UPDATE 2-Amazon considering online TV service - Bloomberg ,Oct 7 Amazon.com Inc is considering the creation of a live online TV service and has reached out to networks such as CBS Corp and Comcast's  NBCUniversal to express interest in carrying their channels  Bloomberg reported.,normal
CTIC,CTI BioPharma Corp,20151007,BRIEF-India's Cipla says unit in definitive agreement with Biopharma SPA for JV in Algeria ,* Says unit Cipla (EU) Ltd in definitive agreement with Biopharma SPA for JV in Algeria  Source text for Eikon: http://bit.ly/1RtLw4O Further company coverage:,topStory
IEP,Icahn Enterprises LP,20151007,Freeport shares soar as Icahn execs gain seats on miner's board ,U.S. miner Freeport-McMoRan Inc said on Wednesday it will add two new directors to its board under an agreement with billionaire Carl Icahn  bowing to pressure from the activist investor  who is the company's largest shareholder.,topStory
IEP,Icahn Enterprises LP,20151007,UPDATE 2-Freeport shares soar as Icahn execs gain seats on miner's board ,Oct 7 U.S. miner Freeport-McMoRan Inc  said on Wednesday it will add two new directors to its board under an agreement with billionaire Carl Icahn  bowing to pressure from the activist investor  who is the company's largest shareholder.,normal
LBTYA,Liberty Global plc,20151007,EU mergers and takeovers (Oct 7) ,BRUSSELS  Oct 7 The following are mergers under review by the European Commission and a brief guide to the EU merger process:,topStory
LBTYA,Liberty Global plc,20151007,EU regulators extend Liberty Global  KPN deal probe to March 3 ,BRUSSELS  Oct 7 - European Union antitrust regulators have extended their investigation into U.S. cable company Liberty Global's  bid for Dutch peer KPN's Belgian unit to March 3.,normal
LBTYB,Liberty Global plc,20151007,EU mergers and takeovers (Oct 7) ,BRUSSELS  Oct 7 The following are mergers under review by the European Commission and a brief guide to the EU merger process:,topStory
LBTYB,Liberty Global plc,20151007,EU regulators extend Liberty Global  KPN deal probe to March 3 ,BRUSSELS  Oct 7 - European Union antitrust regulators have extended their investigation into U.S. cable company Liberty Global's  bid for Dutch peer KPN's Belgian unit to March 3.,normal
LBTYK,Liberty Global plc,20151007,EU mergers and takeovers (Oct 7) ,BRUSSELS  Oct 7 The following are mergers under review by the European Commission and a brief guide to the EU merger process:,topStory
LBTYK,Liberty Global plc,20151007,EU regulators extend Liberty Global  KPN deal probe to March 3 ,BRUSSELS  Oct 7 - European Union antitrust regulators have extended their investigation into U.S. cable company Liberty Global's  bid for Dutch peer KPN's Belgian unit to March 3.,normal
LILA,Liberty Global plc,20151007,EU mergers and takeovers (Oct 7) ,BRUSSELS  Oct 7 The following are mergers under review by the European Commission and a brief guide to the EU merger process:,topStory
LILA,Liberty Global plc,20151007,EU regulators extend Liberty Global  KPN deal probe to March 3 ,BRUSSELS  Oct 7 - European Union antitrust regulators have extended their investigation into U.S. cable company Liberty Global's  bid for Dutch peer KPN's Belgian unit to March 3.,normal
LILAK,Liberty Global plc,20151007,EU mergers and takeovers (Oct 7) ,BRUSSELS  Oct 7 The following are mergers under review by the European Commission and a brief guide to the EU merger process:,topStory
LILAK,Liberty Global plc,20151007,EU regulators extend Liberty Global  KPN deal probe to March 3 ,BRUSSELS  Oct 7 - European Union antitrust regulators have extended their investigation into U.S. cable company Liberty Global's  bid for Dutch peer KPN's Belgian unit to March 3.,normal
ODP,Office Depot Inc,20151007,FTC may delay decision on Staples-Office Depot deal: WSJ ,The U.S. Federal Trade Commission is likely to delay a decision on approving Staples Inc's  $6.3 billion takeover of rival Office Depot Inc   the Wall Street Journal reported on Wednesday.,topStory
ODP,Office Depot Inc,20151007,UPDATE 1-U.S. FTC may delay decision on Staples-Office Depot deal - WSJ ,Oct 7 The U.S. Federal Trade Commission is likely to delay a decision on approving Staples Inc's  $6.3 billion takeover of rival Office Depot Inc  the Wall Street Journal reported on Wednesday.,normal
TROW,T Rowe Price Group Inc,20151007,MOVES-T. Rowe Price names Elsie Chan as head of intermediary sales in Asia ,Oct 7 Investment manager T. Rowe Price Inc  appointed Elsie Chan as the head of intermediary sales for Asia  excluding Japan and Australia.,topStory
URBN,Urban Outfitters Inc,20151007,Urban Outfitters to end on-call shifts for New York employees ,Apparel retailer Urban Outfitters Inc has agreed to end on-call shifts for employees at all its New York stores  New York state's Attorney General Eric Schneiderman said.,topStory
URBN,Urban Outfitters Inc,20151007,Urban Outfitters to end on-call shifts for New York employees ,Oct 7 Apparel retailer Urban Outfitters Inc  has agreed to end on-call shifts for employees at all its New York stores  New York state's Attorney General Eric Schneiderman said.,normal
VOD,Vodafone Group Plc,20151007,Vodafone goes back to basics after failed Liberty deal ,LONDON With a $120 billion merger with Liberty Global  off the table  Vodafone  boss Vittorio Colao needs his strategy of higher network investments and acquisitions of European cable companies to start paying off  quickly.,topStory
VOD,Vodafone Group Plc,20151007,Vodafone goes back to basics after failed Liberty deal ,LONDON  Oct 7 With a $120 billion merger with Liberty Global off the table  Vodafone boss Vittorio Colao needs his strategy of higher network investments and acquisitions of European cable companies to start paying off  quickly.,normal
WDC,Western Digital Corporation,20151007,Pentagon says remains vigilant on security of electronics supply chain ,WASHINGTON  Oct 6 The Pentagon's chief arms buyer on Tuesday issued a reminder that the U.S. Defense Department remains watchful on the security of electronic components used in weapons  when asked about a $3.78 billion Chinese plan to invest in U.S. data storage company Western Digital Corp.,topStory
ABT,Abbott Laboratories,20151007,PharMerica to pay $9.25 million over allegations of kickbacks from Abbott Labs: DOJ ,WASHINGTON Nursing home pharmacy PharMerica Corp will pay $9.25 million "to resolve allegations that it solicited and received kickbacks" to promote Abbott Labs' psychiatric drug Depakote for nursing home patients  the Department of Justice said on Wednesday.,topStory
ABT,Abbott Laboratories,20151007,CORRECTED-(Official) PharMerica to pay $9.25 mln over allegations of kickbacks from Abbott Labs -DOJ ,WASHINGTON  Oct 7 Nursing home pharmacy PharMerica Corp will pay $9.25 million "to resolve allegations that it solicited and received kickbacks" to promote Abbott Labs' psychiatric drug Depakote for nursing home patients  the Department of Justice said on Wednesday.,normal
AA,Alcoa Corporation,20151007,Patriot Coal withdraws Alcoa deal as bankruptcy talks continue ,WASHINGTON A $22 million deal between the Aluminum Company of America and Patriot Coal Corp has been abandoned as the coal company seeks to finalize its bankruptcy plan  which U.S. Democratic presidential candidate Hillary Clinton criticized last week as "outrageous.",topStory
AA,Alcoa Corporation,20151007,Patriot Coal withdraws Alcoa deal as bankruptcy talks continue ,WASHINGTON A $22 million deal between the Aluminum Company of America and Patriot Coal Corp has been abandoned as the coal company seeks to finalize its bankruptcy plan  which U.S. Democratic presidential candidate Hillary Clinton criticized last week as "outrageous.",normal
AA,Alcoa Corporation,20151007,Patriot Coal withdraws Alcoa deal as bankruptcy talks continue ,WASHINGTON  Oct 7 A $22 million deal between the Aluminum Company of America and Patriot Coal Corp has been abandoned as the coal company seeks to finalize its bankruptcy plan  which U.S. Democratic presidential candidate Hillary Clinton criticized last week as "outrageous.",normal
AA,Alcoa Corporation,20151007,Alcoa wins $1.1 billion contract for Lockheed's F-35 fighter jets ,Alcoa Inc said it had got a contract to supply titanium to Lockheed Martin Corp's F-35 Lightning II aircraft.,normal
AA,Alcoa Corporation,20151007,Alcoa wins $1.1 bln contract for Lockheed's F-35 fighter jets ,Oct 7 Alcoa Inc said it had got a contract to supply titanium to Lockheed Martin Corp's  F-35 Lightning II aircraft.,normal
MO,Altria Group,20151007,BUZZ-SABMiller: AB InBev raises takeover offer to 42.15 stg/shr ,** SABMiller's London-listed shares rise as much as 4.4 pct in heavy volumes  before paring some gains  on Anheuser-Busch InBev  the world's largest brewer  raising its cash offer for SAB to £42.15/shr,topStory
MO,Altria Group,20151007,AB InBev CEO delays talk of hostile bid for SABMiller ,LONDON  Oct 7 Anheuser-Busch InBev  Chief Executive Carlos Brito does not want to talk about making a hostile bid for rival brewer SABMiller  saying he hopes shareholders will urge the board to engage concerning the existing offer.,normal
BUD,Anheuser-Busch Inbev SA,20151007,SABMiller rejects AB InBev's $104 billion takeover approach ,BRUSSELS/LONDON SABMiller   the world's second largest brewer  has promptly rejected an improved takeover proposal from Anheuser-Busch InBev   saying its 68 billion-pound ($104 billion) valuation was "very substantially" under par. | Video ,topStory
BUD,Anheuser-Busch Inbev SA,20151007,UPDATE 5-SABMiller rejects AB InBev's $104 bln takeover approach ,* Top shareholder Altria supports offer  No. 2 does not   (Adds comments by AB InBev CEO),normal
BUD,Anheuser-Busch Inbev SA,20151007,Fitch Solutions: Anheuser-Busch InBev CDS Widen to Three-Year Highs ,(The following statement was released by the rating agency) NEW YORK  October 07 (Fitch) Anheuser-Busch InBev's ongoing pursuit of  British-South African beer brewer SABMiller is weighing on the company's credit  default swap (CDS) spreads  according to Fitch Solutions in its latest CDS Case  Study snapshot. Five-year CDS on Anheuser-Busch InBev have widened out 25% over the past month  to price at the widest levels observed in three years. After pricing  consistently in line with 'A/A-' levels ,normal
BUD,Anheuser-Busch Inbev SA,20151007,Fitch Places Anheuser-Busch InBev and SABMiller plc on Rating Watch Negative ,(The following statement was released by the rating agency) LONDON/MOSCOW  October 07 (Fitch) Fitch Ratings has placed Anheuser-Busch  InBev's (ABI) and SABMiller plc's (SABM) Long-term Issuer Default Ratings (IDR)  and senior unsecured ratings on Rating Watch Negative (RWN) following today's  announcement by ABI that it has made an offer to take over SABMiller plc. A full  list of rating actions is shown at the end of this commentary. The rating action reflects likely higher leverage for both A,normal
BUD,Anheuser-Busch Inbev SA,20151007,AB InBev continues talks with lenders on jumbo acquisition loan ,LONDON Anheuser-Busch InBev is continuing talks with its relationship banks about a financing of up to $70 billion to back an improved all-cash proposed bid for SABMiller  after offering just over 68 billion pounds($104 billion)for its largest rival on Wednesday.,normal
BUD,Anheuser-Busch Inbev SA,20151007,Factbox: SABMiller  from South African gold rush to brewing giant ,SABMiller  the world's second largest brewer  rejected a revised offer from bigger rival Anheuser-Busch InBev on Wednesday  citing the proposal  which values its equity at up to $104 billion  "very substantially" undervalued the company.,normal
BUD,Anheuser-Busch Inbev SA,20151007,AB InBev CEO delays talk of hostile bid for SABMiller ,LONDON Anheuser-Busch InBev Chief Executive Carlos Brito does not want to talk about making a hostile bid for rival brewer SABMiller  saying he hopes shareholders will urge the board to engage concerning the existing offer.,normal
BUD,Anheuser-Busch Inbev SA,20151007,LPC-AB InBev continues talks with lenders on jumbo acquisition loan ,LONDON  Oct 7 Anheuser-Busch InBev is continuing talks with its relationship banks about a financing of up to $70 billion to back an improved all-cash proposed bid for SABMiller  after offering just over 68 billion pounds($104 billion)for its largest rival on Wednesday.,normal
BUD,Anheuser-Busch Inbev SA,20151007,AB InBev CEO delays talk of hostile bid for SABMiller ,LONDON  Oct 7 Anheuser-Busch InBev  Chief Executive Carlos Brito does not want to talk about making a hostile bid for rival brewer SABMiller  saying he hopes shareholders will urge the board to engage concerning the existing offer.,normal
BUD,Anheuser-Busch Inbev SA,20151007,Investors concerned as Adidas declines to join Blatter exit call ,MUNICH  Germany Investors in Adidas are increasingly worried that the FIFA corruption scandal risks tarnishing the German sportswear brand after the company declined to join other major sponsors and demand the immediate departure of President Sepp Blatter.,normal
SAN,Banco Santander SA,20151007,Spain's Santander sought to delay news of fine  court says ,MADRID  Oct 7 Santander was fined 1 million euros ($1.12 million) in June for breaching laws on preventing money laundering and terrorism financing  a Spanish court said on Wednesday  adding the bank had sought to delay news of the sanction getting out.,topStory
BBL,BHP Billiton plc,20151007,UPDATE 1-S.Africa's rand hits two-week high  stocks gain on resources ,* Shares up on Anglo  BHP Billiton rally   (Adds closing levels),topStory
BBL,BHP Billiton plc,20151007,UPDATE 1-Franco-Nevada  Teck Resources reach streaming deal for Antamina mine ,Oct 7 Franco-Nevada Corp said it agreed to pay Teck Resources Ltd $610 million to help fund operations at the Antamina mine in Peru in exchange for a share of silver production.,normal
BLK,BlackRock Inc,20151007,BlackRock to boost shareholders' power after backing reform elsewhere ,BOSTON Top asset manager BlackRock Inc said on Wednesday it plans to give shareholders new rights to nominate directors  bringing its corporate governance in line with policies it has backed elsewhere.,topStory
BLK,BlackRock Inc,20151007,BlackRock to boost shareholders' power after backing reform elsewhere ,BOSTON  Oct 7 Top asset manager BlackRock Inc  said on Wednesday it plans to give shareholders new rights to nominate directors  bringing its corporate governance in line with policies it has backed elsewhere.,normal
BLK,BlackRock Inc,20151007,Market rules behind Aug ETF trading issues -BlackRock ,NEW YORK  Oct 7 U.S. stock exchange rules designed to protect investors from market routs backfired on Aug. 24  exacerbating a selloff in exchange traded funds  BlackRock Inc said in a report published Wednesday.,normal
BLK,BlackRock Inc,20151007,Investors must get realistic on returns in sluggish markets: Blackrock ,LONDON The most challenging global market environment in years will see annual investment returns slashed to just 4-5 percent over the next five years  strategists at investment firm Blackrock said on Wednesday.,normal
BLK,BlackRock Inc,20151007,Formula One could be sold this year: Ecclestone ,LONDON Formula One could have new owners by the end of the year with three parties currently interested  the sport's commercial supremo Bernie Ecclestone said on Tuesday.,normal
BAM,Brookfield Asset Management Inc,20151007,UPDATE 1-Brookfield Asset Management to spin off and list unit ,Oct 7 Canada's Brookfield Asset Management Inc   said it would spin off 35 percent of Brookfield Business Partners LP   which will own almost all of the asset manager's business services and industrial operations assets.,topStory
BAM,Brookfield Asset Management Inc,20151007,Brookfield Asset Management to spin off 35 pct of unit ,Oct 7 Canada's Brookfield Asset Management Inc  said it would spinoff 35 percent of Brookfield Business Partners LP  the asset manager's business services and industrial operations in its private equity unit.,normal
BT,BT Group plc,20151007,EU mergers and takeovers (Oct 7) ,BRUSSELS  Oct 7 The following are mergers under review by the European Commission and a brief guide to the EU merger process:,topStory
CACI,CACI International Inc,20151007,UPDATE 1-U.S. FAA says it will test ways to track rogue drone flights ,WASHINGTON  Oct 7 The Federal Aviation Administration will test new technology to detect and track rogue drone flights around U.S. airports through a partnership with Arlington  Virginia-based CACI International Inc  the agency said on Wednesday.,topStory
CCV,Comcast Corporation,20151007,Amazon considering online TV service: Bloomberg ,Amazon.com Inc is considering the creation of a live online TV service and has reached out to networks such as CBS Corp and Comcast's NBCUniversal to express interest in carrying their channels  Bloomberg reported.,topStory
CCV,Comcast Corporation,20151007,UPDATE 2-Amazon considering online TV service - Bloomberg ,Oct 7 Amazon.com Inc is considering the creation of a live online TV service and has reached out to networks such as CBS Corp and Comcast's  NBCUniversal to express interest in carrying their channels  Bloomberg reported.,normal
STZ,Constellation Brands Inc,20151007,Corona  Modelo beers power Constellation's profit beat ,Constellation Brands Inc's  quarterly profit blew past Street estimates as sales of beers under its Corona and Modelo brands rose and a strong dollar helped cut production costs.,topStory
STZ,Constellation Brands Inc,20151007,UPDATE 3-Corona  Modelo beers power Constellation's profit beat ,* Shares rise 3 pct to a record high of $135.30   (Adds analyst comments  details  updates shares),normal
STZ,Constellation Brands Inc,20151007,Constellation Brands revenue rises 8 pct as beer sales jump ,Oct 7 Constellation Brands Inc reported an 8.1 percent rise in quarterly net sales  helped by higher demand for beer under its Corona and Modelo brands.,normal
DB,Deutsche Bank AG,20151007,UPDATE 2-Deutsche Bank flags 6 bln euro loss on writedowns ,FRANKFURT  Oct 7 Deutsche Bank is bracing for a record pre-tax loss of 6 billion euros (US$6.7 billion) in the third quarter  as new boss John Cryan is drawing a line under his predecessor's performance.,topStory
DB,Deutsche Bank AG,20151007,Deutsche Bank sees Q3 pretax loss of 6 bln eur ,FRANKFURT  Oct 7 Deutsche Bank is bracing for a loss before taxes of 6 billion euros ($6.7 billion) in the third quarter due to massive writedowns at its investment banking unit and on the value it expects to extract from the divestment of its Postbank retail bank.,normal
DB,Deutsche Bank AG,20151007,Ex-Deutsche Bank trader files wrongful dismissal suit ,MOSCOW  Oct 7 The ex-head of trading at Deutsche Bank's Russian operation  Tim Wiswell  has filed a suit against his former employer for wrongful dismissal  his lawyer said on Wednesday.,normal
DB,Deutsche Bank AG,20151007,MOVES-Murphy leaves Deutsche Bank's SSA syndicate desk ,LONDON  Oct 7 (IFR) - Brendan Murphy has left Deutsche Bank's global risk syndicate desk in London  where he worked as a vice president specialising in the bank's US dollar-denominated SSA trades.,normal
DEO,Diageo plc,20151007,Diageo sells stakes in two brewers to Heineken for $780.5 million ,Diageo Plc   the world's largest spirits company  said it had sold its stakes in Jamaican brewer Desnoes & Geddes Ltd  and GAPL Pte Ltd  the majority owner of Malaysia's Guinness Anchor Berhad   to Heineken NV  for $780.5 million.,topStory
DEO,Diageo plc,20151007,UPDATE 1-Diageo sells stakes in two brewers to Heineken for $780.5 mln ,Oct 7 Diageo Plc  the world's largest spirits company  said it had sold its stakes in Jamaican brewer Desnoes & Geddes Ltd and GAPL Pte Ltd  the majority owner of Malaysia's Guinness Anchor Berhad  to Heineken NV for $780.5 million.,normal
DEO,Diageo plc,20151007,CORRECTED-BRIEF-Diageo buys interest in GGBL from Heineken ,* Acquisition by Diageo of Heineken's 20 pct shareholding in Guinness Ghana Breweries Limited (GGBL) which will increase Diageo's shareholding in GGBL to 72.42 pct,normal
DEO,Diageo plc,20151007,Diageo sells stakes in Jamaican  Malaysian brewers to Heineken ,Oct 7 Diageo Plc  the world's largest spirits company  said it had sold its stakes in Jamaican brewer Desnoes & Geddes Ltd (D&G) and Malaysian beer producer Guinness Anchor Bhd to Heineken NV.,normal
DEO,Diageo plc,20151007,BRIEF-Heineken realigns ownership interests in Jamaica  Malaysia  Singapore and Ghana ,* Heineken realigns ownership interests in Jamaica  Malaysia  Singapore and Ghana,normal
ENB,Enbridge Inc,20151007,Canada's Enbridge plans C$38 billion in new investments through 2019 ,CALGARY Enbridge Inc  Canada's largest pipeline company  is planning C$38 billion ($29.09 billion) in new capital investments over the next four years  Chief Executive Al Monaco said on Wednesday.,topStory
ENB,Enbridge Inc,20151007,Canada's Enbridge plans C$38 bln in new investments through 2019 ,CALGARY  Oct 7 Enbridge Inc  Canada's largest pipeline company  is planning C$38 billion ($29.09 billion) in new capital investments over the next four years  Chief Executive Al Monaco said on Wednesday.,normal
FCAU,Fiat Chrysler Automobiles NV,20151007,Fiat Chrysler  U.S. union UAW at table as strike looms ,DETROIT With a threatened strike hanging over them  negotiators from Fiat Chrysler Automobiles NV and the United Auto Workers union continued to meet on Wednesday afternoon  a Fiat Chrysler spokeswoman said.,topStory
FCAU,Fiat Chrysler Automobiles NV,20151007,UPDATE 2-Fiat Chrysler  U.S. union UAW at table as strike looms ,* Company could lose $1 bln of revenue per week -analyst   (Adds number of workers who could be affected by strike  details on contract sticking points  updates share price),normal
FCAU,Fiat Chrysler Automobiles NV,20151007,Fiat Chrysler  U.S. union UAW at table as strike looms ,DETROIT  Oct 7 As the threat of a strike hangs over them  negotiators from Fiat Chrysler Automobiles NV   and the United Auto Workers union continued to meet on Wednesday morning  a union spokesman said.,normal
FCAU,Fiat Chrysler Automobiles NV,20151007,Fiat Chrysler to halt production at Maserati plant Nov. 2-8: source ,TURIN  Italy Fiat Chrysler Automobiles will halt production of its Maserati Ghibli and Quattroporte sedans at a plant near Turin during the first week of November to adjust output to market conditions  a company source said on Wednesday.,normal
F,Ford Motor Company,20151007,UPDATE 2-Fiat Chrysler  U.S. union UAW at table as strike looms ,* Company could lose $1 bln of revenue per week -analyst   (Adds number of workers who could be affected by strike  details on contract sticking points  updates share price),normal
