SNE,Sony Corp Ord,20151007,ESPN joins hands with India's MSM to launch channels ,MUMBAI Sports fans in the Indian subcontinent will be spoilt for choice after Indian Premier League (IPL) rights holder Multi Screen Media (MSM) and sports broadcaster ESPN announced plans on Wednesday to launch new channels and foray into digital market.,normal
SNE,Sony Corp Ord,20151007,ESPN joins hands with India's MSM to launch channels ,MUMBAI Sports fans in the Indian subcontinent will be spoilt for choice after Indian Premier League (IPL) rights holder Multi Screen Media (MSM) and sports broadcaster ESPN announced plans on Wednesday to launch new channels and foray into digital market.,normal
SNE,Sony Corp Ord,20151007,Sports-ESPN joins hands with India's MSM to launch channels ,MUMBAI  Oct 7 Sports fans in the Indian subcontinent will be spoilt for choice after Indian Premier League (IPL) rights holder Multi Screen Media (MSM) and sports broadcaster ESPN announced plans on Wednesday to launch new channels and foray into digital market.,normal
SNE,Sony Corp Ord,20151007,Sony may consider options for smartphone unit if no profit next year ,TOKYO  Oct 7 Sony Corp Chief Executive Kazuo Hirai said on Wednesday the company would consider options for its smartphone unit if it failed to turn a profit in the next business year.,normal
BID,Sotheby&#39;s,20151007,Sapphire and diamond ring fetches $6.7 million at Hong Kong auction ,HONG KONG - A 27.68-carat sapphire and diamond ring known as the "Jewel of Kashmir" sold for $6.7 million and a necklace of 42 rare gray pearls was snapped up for $5.27 million at auction  Sotheby's said on Wednesday. | Video ,topStory
STE,STERIS plc,20151007,U.S. formally ends fight with Steris over Synergy merger ,WASHINGTON U.S. antitrust enforcers on Wednesday formally dropped opposition to U.S. medical technology firm Steris Corp's plan to merge with British sterilization services provider Synergy Health Plc.,topStory
STE,STERIS plc,20151007,U.S. formally ends fight with Steris over Synergy merger ,WASHINGTON  Oct 7 U.S. antitrust enforcers on Wednesday formally dropped opposition to U.S. medical technology firm Steris Corp's plan to merge with British sterilization services provider Synergy Health Plc.,normal
SU,Suncor Energy  Inc,20151007,Canadian Oil Sands adopts poison pill to fend off Suncor ,CALGARY Canadian Oil Sands Ltd on Wednesday announced a new poison pill to try to thwart Suncor Energy Inc's hostile takeover bid  setting the stage for a drawn-out battle that could reshape Alberta's high-cost oil sands industry.,topStory
SU,Suncor Energy  Inc,20151007,UPDATE 2-Canadian Oil Sands adopts poison pill to fend off Suncor ,CALGARY  Oct 7 Canadian Oil Sands Ltd  on Wednesday announced a new poison pill to try to thwart Suncor Energy Inc's hostile takeover bid  setting the stage for a drawn-out battle that could reshape Alberta's high-cost oil sands industry.,normal
SU,Suncor Energy  Inc,20151007,Canadian Oil Sands adopts poison pill after Suncor's hostile bid ,Oct 7 Canadian Oil Sands Ltd said it adopted a poison pill in response to Suncor Energy Inc's  hostile takeover bid.,normal
TGNA,TEGNA Inc,20151007,Gannett Co to buy Journal Media for $280 million ,Gannett Co Inc  publisher of USA Today  said on Wednesday it will buy Journal Media Group for $280 million.,topStory
TGNA,TEGNA Inc,20151007,Gannett Co to buy Journal Media for $280 million ,Oct 7 Gannett Co Inc  publisher of USA Today  said on Wednesday it will buy Journal Media Group  for $280 million.,normal
TEF,Telefonica SA,20151007,BRIEF-Astellia signs global framework contract with Telefónica ,* Says the two-year agreement recognizes Astellia as preferred supplier for Telefónica network optimization  Further company coverage:    (Gdynia Newsroom),topStory
BX,The Blackstone Group LP,20151007,Blackstone to pay about $39 mln to settle SEC charges over fees ,WASHINGTON Blackstone Group  the world's largest private equity firm  will pay about $39 million to settle civil charges over disclosure failures in connection with certain types of fees it charged its portfolio companies  U.S. regulators said on Wednesday.,topStory
BX,The Blackstone Group LP,20151007,Blackstone to pay about $39 million to settle SEC charges over fees ,WASHINGTON Blackstone Group  the world's largest private equity firm  will pay about $39 million to settle civil charges over disclosure failures in connection with certain types of fees it charged its portfolio companies  U.S. regulators said on Wednesday.,normal
BX,The Blackstone Group LP,20151007,UPDATE 2-Blackstone to pay about $39 mln to settle SEC charges over fees ,WASHINGTON  Oct 7 Blackstone Group  the world's largest private equity firm  will pay about $39 million to settle civil charges over disclosure failures in connection with certain types of fees it charged its portfolio companies  U.S. regulators said on Wednesday.,normal
BX,The Blackstone Group LP,20151007,Blackstone to pay about $39 mln to settle SEC charges over fees ,WASHINGTON  Oct 7 Blackstone Group  the world's largest private equity firm  will pay about $39 million to settle civil charges over disclosure failures in connection with certain types of fees it charged its portfolio companies  U.S. regulators said on Wednesday.,normal
TSU,TIM Participacoes SA,20151007,TIM Brasil says not in talks over potential tie-up with rivals ,SAO PAULO  Oct 7 TIM Participações SA   Brazil's second-largest wireless carrier  says it is currently not in talks with any rivals over possible consolidation moves  as reported by local media this week.,topStory
TJX,TJX Companies Inc (The),20151007,UPDATE 1-TJX Cos says Ernie Herrman to become CEO ,Oct 7 Off-price retailer TJX Cos Inc  said its board intends to elect Ernie Herrman as chief executive  effective Jan. 31.,topStory
TJX,TJX Companies Inc (The),20151007,TJX Cos says Ernie Herrman to become CEO ,Oct 7 Off-price retailer TJX Cos Inc  said its board intends to elect Ernie Herrman as chief executive  effective Jan. 31.,normal
TM,Toyota Motor Corp Ltd Ord,20151007,UPDATE 2-Fiat Chrysler  U.S. union UAW at table as strike looms ,* Company could lose $1 bln of revenue per week -analyst   (Adds number of workers who could be affected by strike  details on contract sticking points  updates share price),normal
TKC,Turkcell Iletisim Hizmetleri AS,20151007,Turkcell borrows $500 mln at 5.95 pct with 10-year eurobond - bankers ,ISTANBUL  Oct 7 Turkey's largest mobile operator Turkcell borrowed $500 million through a 10-year eurobond on Wednesday at a yield of 5.95 percent  in an issue that was almost four times oversubscribed  bankers told Reuters.,topStory
TKC,Turkcell Iletisim Hizmetleri AS,20151007,Final guidance for Turkcell's 10-year eurobond issue around 6 pct - bankers ,ISTANBUL  Oct 7 The final yield in the debut 10-year dollar-denominated eurobond issue by Turkey's largest mobile operator Turkcell is expected at around 6 percent and the firm is expected to borrow $500 million  bankers told Reuters on Wednesday.,normal
TKC,Turkcell Iletisim Hizmetleri AS,20151007,Price guidance for Turkcell's debut eurobond issue at 6-6.125 pct - bankers ,ISTANBUL  Oct 7 Price guidance in Turkey's largest mobile operator Turkcell's 10-year dollar-denominated debut eurobond issue will be between 6 to 6.125 percent  bankers told Reuters on Wednesday.,normal
TKC,Turkcell Iletisim Hizmetleri AS,20151007,Initial price target in Turkcell's debut eurobond issue around 6.25 pct - bankers ,ISTANBUL  Oct 7 The initial price target in Turkey's largest mobile operator Turkcell's 10-year dollar-denominated debut eurobond issue is expected at around 6.25 percent  bankers told Reuters on Wednesday.,normal
TWTR,Twitter Inc,20151007,Saudi Prince Alwaleed's Kingdom Holding raises Twitter stake ,DUBAI Saudi Arabian billionaire Prince Alwaleed bin Talal and his investment firm Kingdom Holding now together own more than 5 percent of Twitter Inc  the prince's office said on Wednesday.,topStory
TWTR,Twitter Inc,20151007,UPDATE 1-Saudi Prince Alwaleed's Kingdom Holding raises Twitter stake ,DUBAI  Oct 7 Saudi Arabian billionaire Prince Alwaleed bin Talal and his investment firm Kingdom Holding  now together own more than 5 percent of Twitter Inc   the prince's office said on Wednesday.,normal
TWTR,Twitter Inc,20151007,Saudi's Kingdom Holding pays $50 mln to raise Twitter stake to 0.72 pct ,DUBAI  Oct 7 Saudi Arabia's Kingdom Holding  has paid $50 million to double its stake in microblogging site Twitter Inc  the Riyadh-based company said on Wednesday.,normal
DIS,Walt Disney Company (The),20151007,ESPN joins hands with India's MSM to launch channels ,MUMBAI Sports fans in the Indian subcontinent will be spoilt for choice after Indian Premier League (IPL) rights holder Multi Screen Media (MSM) and sports broadcaster ESPN announced plans on Wednesday to launch new channels and foray into digital market.,topStory
DIS,Walt Disney Company (The),20151007,ESPN joins hands with India's MSM to launch channels ,MUMBAI Sports fans in the Indian subcontinent will be spoilt for choice after Indian Premier League (IPL) rights holder Multi Screen Media (MSM) and sports broadcaster ESPN announced plans on Wednesday to launch new channels and foray into digital market.,normal
XPO,XPO Logistics Inc,20151007,BRIEF-XPO Logistics wins deal from Finmeccanica's AgustaWestland ,* Says part of Italy's Finmeccanica  AgustaWestland  has appointed XPO Logistics to coordinate handling  storage and transportation of eight LYNX Mk21A helicopters from Brazil to the UK  Source text: http://bit.ly/1Nmigyw Further company coverage:    (Gdynia Newsroom),topStory
YUM,Yum! Brands Inc,20151007,Fast food rivals expand  hitting Yum sales in India ,MUMBAI Aggressive expansion by foreign rivals is eating into sales at Yum Brands Inc  in India  and there is little letup in sight for its KFC and Pizza Hut restaurants that are struggling to keep pace.,topStory
YUM,Yum! Brands Inc,20151007,RPT-UPDATE 1-Fast food rivals expand  hitting Yum sales in India ,MUMBAI  Oct 7 Aggressive expansion by foreign rivals is eating into sales at Yum Brands Inc in India  and there is little letup in sight for its KFC and Pizza Hut restaurants that are struggling to keep pace.,normal
YUM,Yum! Brands Inc,20151007,Yum's China missteps amplify calls for spinoff  other change ,LOS ANGELES Yum Brands Inc's  disappointing results from restaurants in China including KFC and Pizza Hut add pressure on Chief Executive Greg Creed to make swift changes to the business that is its main driver of sales and profit  analysts said on Wednesday. | Video ,normal
YUM,Yum! Brands Inc,20151007,UPDATE 2-Yum's China missteps amplify calls for spinoff  other change ,LOS ANGELES  Oct 7 Yum Brands Inc's  disappointing results from restaurants in China including KFC and Pizza Hut add pressure on Chief Executive Greg Creed to make swift changes to the business that is its main driver of sales and profit  analysts said on Wednesday.,normal
YUM,Yum! Brands Inc,20151007,US STOCKS-S&P 500 reaches three-week high as health stocks rally ,* Indexes close up: Dow 0.73 pct  S&P 0.8 pct  Nasdaq 0.9 pct   (Updates to close),normal
YUM,Yum! Brands Inc,20151007,Fast food rivals expand  hitting Yum sales in India ,MUMBAI Aggressive expansion by foreign rivals is eating into sales at Yum Brands Inc in India  and there is little letup in sight for its KFC and Pizza Hut restaurants that are struggling to keep pace.,normal
YUM,Yum! Brands Inc,20151007,US STOCKS-Wall St rises as health care rebounds ,* Indexes up: Dow 0.29 pct  S&P 0.37 pct  Nasdaq 0.41 pct   (Updates to afternoon),normal
YUM,Yum! Brands Inc,20151007,UPDATE 1-Fast food rivals expand  hitting Yum sales in India ,* Food apps changing consumer landscape   (Adds graphic link),normal
YUM,Yum! Brands Inc,20151007,Fast food rivals expand  hitting Yum sales in India ,MUMBAI  Oct 7 Aggressive expansion by foreign rivals is eating into sales at Yum Brands Inc in India  and there is little letup in sight for its KFC and Pizza Hut restaurants that are struggling to keep pace.,normal
YUM,Yum! Brands Inc,20151007,US STOCKS-Wall St opens higher as oil prices continue rise ,* Indexes up: Dow 0.79 pct  S&P 0.69 pct  Nasdaq 0.49 pct   (Updates to open),normal
BTG,B2Gold Corp,20151007,Policeman dies amid labor dispute at Nicaragua gold mine ,MANAGUA  Oct 6 A policeman died and 23 other officers were injured in clashes with protesters on Tuesday  the Nicaraguan police said  part of an ongoing labor dispute that has shut down operations at a Nicaraguan gold mine owned by Canada's B2Gold Corp.,topStory
