AMCN,AirMedia Group Inc,20150407,REFILE-BRIEF-Shenzhen Liantronics to acquire 5 pct stake in AirMedia ,* Says to acquire 5 percent stake in AirMedia group for 150 million yuan ($24.21 million),topStory
AMZN,Amazoncom Inc,20150407,Jeff Bezos' rocket company to begin suborbital test flights this year ,CAPE CANAVERAL  Fla. A space company owned by Amazon.com founder Jeff Bezos has finished work on a rocket engine for a suborbital spaceship and expects to begin flight tests this year  Blue Origin officials said on Tuesday.,topStory
AMZN,Amazoncom Inc,20150407,Jeff Bezos' rocket company to begin suborbital test flights this year ,CAPE CANAVERAL  Fla.  April 7 A space company owned by Amazon.com founder Jeff Bezos has finished work on a rocket engine for a suborbital spaceship and expects to begin flight tests this year  Blue Origin officials said on Tuesday.,normal
TAPR,Barclays Inverse US Treasury Composite ETN,20150407,MOVES-Barclays  BofA Merrill Lynch  U.S. Bank  Standard Chartered ,April 7 The following financial services industry appointments were announced on Tuesday. To inform us of other job changes  email moves@thomsonreuters.com.,topStory
TAPR,Barclays Inverse US Treasury Composite ETN,20150407,Barclays' head of markets Eric Felder to leave bank -memo ,LONDON  April 7 Barclays head of markets Eric Felder is leaving the bank  less than a year after he was appointed to supervise its global sales and trading businesses  according to an internal memo.,normal
DCOM,Dime Community Bancshares Inc,20150407,Fitch Affirms Dime Community's Ratings at 'BBB'; Outlook Stable ,(The following statement was released by the rating agency) NEW YORK  April 07 (Fitch) Fitch Ratings has affirmed the long- and short-term  Issuer Default Ratings (IDRs) for Dime Community Bancshares  Inc. (DCOM) and its  principal banking subsidiary  Dime Savings Bank of Williamsburgh at 'BBB'/'F2'.  The Rating Outlook is Stable. A full list of ratings actions is provided at the  end of this release. Fitch reviewed DCOM as part of its Niche Bank Peer Review  which also includes  Astoria Financi,topStory
DLTR,Dollar Tree Inc,20150407,Dollar Tree says FTC wants 340 stores sold ahead of Family Dollar deal ,Dollar Tree Inc said the U.S. Federal Trade Commission has identified about 340 stores to be divested for the $8.5 billion takeover of Family Dollar Stores Inc to go through.,topStory
DLTR,Dollar Tree Inc,20150407,UPDATE 1-Dollar Tree says FTC wants 340 stores sold ahead of Family Dollar deal ,April 7 Dollar Tree Inc said the U.S. Federal Trade Commission has identified about 340 stores to be divested for the $8.5 billion takeover of Family Dollar Stores Inc to go through.,normal
DLTR,Dollar Tree Inc,20150407,Dollar Tree says FTC wants 340 stores sold ahead of Family Dollar deal ,April 7 Dollar Tree Inc said the U.S. Federal Trade Commission has identified about 340 stores to be divested for the $8.5 billion takeover of Family Dollar Stores Inc to go through.,normal
FLIR,FLIR Systems Inc,20150407,BRIEF-Electrocomponents enters distribution pact with Flir Systems ,* Pact for distribution of high-performing  portable thermal imaging instruments  Source text: http://bit.ly/1DftpL3 Further company coverage:    (Bengaluru Newsroom: +91 80 6749 1136),topStory
FMI,Foundation Medicine Inc,20150407,BRIEF-Roche gives results of tender offer for Foundation Medicine ,* Roche announced preliminary results of a tender offer for up to 15.6 million shares of common stock of Foundation Medicine  Inc. (FMI) at $50.00 per share in cash,topStory
MSFT,Microsoft Corporation,20150407,Microsoft  Getty Images settle dispute over online photo tool ,NEW YORK Getty Images has dropped its lawsuit against Microsoft Corp over alleged "massive" copyright infringement  announcing on Tuesday a plan to amicably bring Getty's photos to Microsoft's Internet search engine and devices.,topStory
MSFT,Microsoft Corporation,20150407,Microsoft  Getty Images settle dispute over online photo tool ,NEW YORK Getty Images has dropped its lawsuit against Microsoft Corp over alleged "massive" copyright infringement  announcing on Tuesday a plan to amicably bring Getty's photos to Microsoft's Internet search engine and devices.,normal
MSFT,Microsoft Corporation,20150407,Microsoft  Getty Images settle dispute over online photo tool ,NEW YORK  April 7 Getty Images has dropped its lawsuit against Microsoft Corp over alleged "massive" copyright infringement  announcing on Tuesday a plan to amicably bring Getty's photos to Microsoft's Internet search engine and devices.,normal
MSFT,Microsoft Corporation,20150407,BRIEF-Bloober Team unit signs distribution deal with Microsoft ,* Its unit iFun4all Sp. z o.o. signs deal with Microsoft Corporation for distribution of Blind'n'Bluff game on Xbox One platform  Source text for Eikon:  Further company coverage:    (Gdynia Newsroom),normal
PACW,PacWest Bancorp,20150407,Fitch Affirms PacWest Bancorp at 'BB+/B'; Outlook Stable ,(The following statement was released by the rating agency) CHICAGO  April 07 (Fitch) Fitch Ratings has affirmed the Issuer Default Ratings  (IDRs) for PacWest Bancorp (PACW) at 'BB+/B'. The Rating Outlook remains Stable.  Fitch has also upgraded the short-term deposit ratings and assigned issue-level  ratings to PACW's senior unsecured and trust preferred securities. A full list  of ratings follows at the end of this release. KEY RATING DRIVERS - IDRs  VRs and SENIOR DEBT PACW's ratings are sup,topStory
RYAAY,Ryanair Holdings plc,20150407,BRIEF-Ryanair March traffic rises 28 pct ,* March rolling annual traffic to march grew 11 pct to 90.5 mln customers  Source text for Eikon:  Further company coverage:    (Bengaluru Newsroom; +44 207 542 1810),topStory
SHPG,Shire plc,20150407,Shire agrees regulatory path for ADHD drug for adults ,LONDON  April 7 Pharmaceutical firm Shire  said on Tuesday it had agreed with U.S. regulators the steps it would take to submit a candidate drug to treat hyperactivity in adults for clearance.,topStory
SINA,Sina Corporation,20150407,BRIEF-Dongxing Securities  Sina in strategic cooperation ,* Says in strategic cooperation with Sina Corp on online and big data development,topStory
SINA,Sina Corporation,20150407,Dongxing Securities  Sina to partner on Internet banking ,SHANGHAI  April 7 China's Dongxing Securities  said it had formed an Internet banking partnership with Sina Corp  operator of a major web portal and microblogging service Weibo Corp.,normal
CG,The Carlyle Group LP,20150407,Berkshire takes 8.7 percent stake in Carlyle-controlled Axalta ,Paint maker Axalta Coating Systems Ltd  said Berkshire Hathaway Inc  would buy an 8.7 percent stake in the company from controlling shareholder Carlyle Group  for $560 million.,topStory
CG,The Carlyle Group LP,20150407,UPDATE 1-Berkshire takes 8.7 pct stake in Carlyle-controlled Axalta ,April 7 Paint maker Axalta Coating Systems Ltd  said Berkshire Hathaway Inc would buy an 8.7 percent stake in the company from controlling shareholder Carlyle Group for $560 million.,normal
CG,The Carlyle Group LP,20150407,Berkshire takes 8.7 pct stake in Carlyle-controlled Axalta ,April 7 Paints company Axalta Coating Systems Ltd said Berkshire Hathaway Inc would buy an 8.7 percent stake in the company from controlling shareholder Carlyle Group for $560 million.,normal
TCGP,The Carlyle Group LP,20150407,Berkshire takes 8.7 percent stake in Carlyle-controlled Axalta ,Paint maker Axalta Coating Systems Ltd  said Berkshire Hathaway Inc  would buy an 8.7 percent stake in the company from controlling shareholder Carlyle Group  for $560 million.,topStory
TCGP,The Carlyle Group LP,20150407,UPDATE 1-Berkshire takes 8.7 pct stake in Carlyle-controlled Axalta ,April 7 Paint maker Axalta Coating Systems Ltd  said Berkshire Hathaway Inc would buy an 8.7 percent stake in the company from controlling shareholder Carlyle Group for $560 million.,normal
TCGP,The Carlyle Group LP,20150407,Berkshire takes 8.7 pct stake in Carlyle-controlled Axalta ,April 7 Paints company Axalta Coating Systems Ltd said Berkshire Hathaway Inc would buy an 8.7 percent stake in the company from controlling shareholder Carlyle Group for $560 million.,normal
VIA,Viacom Inc,20150407,Viacom shares slip on bigger-than-expected charge  buyback halt ,April 7 Shares of MTV owner Viacom Inc  slipped on Tuesday  a day after the company hit the pause button on a $20 billion share buyback program and announced slew of restructuring steps that will result in a charge of $785 million.,topStory
VIAB,Viacom Inc,20150407,Viacom shares slip on bigger-than-expected charge  buyback halt ,April 7 Shares of MTV owner Viacom Inc  slipped on Tuesday  a day after the company hit the pause button on a $20 billion share buyback program and announced slew of restructuring steps that will result in a charge of $785 million.,topStory
WB,Weibo Corporation,20150407,Dongxing Securities  Sina to partner on Internet banking ,SHANGHAI  April 7 China's Dongxing Securities  said it had formed an Internet banking partnership with Sina Corp  operator of a major web portal and microblogging service Weibo Corp.,topStory
ACN,Accenture plc,20150407,BRIEF-Alcatel-Lucent and Accenture announce four-year agreement with Telefonica ,* Accenture and Alcatel-Lucent announce four-year agreement with Telefonica to deploy Alcatel-Lucent's motive customer experience management software,topStory
AZN,Astrazeneca PLC,20150407,Appeals court cuts damages to Astra Zeneca over Prilosec generic ,NEW YORK A U.S. appeals court said Tuesday that the $76 million in damages awarded to AstraZeneca in a patent infringement case involving its heartburn drug Prilosec must be cut back because of an improper calculation by the district court judge in the case.,topStory
AXTA,Axalta Coating Systems Ltd,20150407,Berkshire takes 8.7 percent stake in Carlyle-controlled Axalta ,Paint maker Axalta Coating Systems Ltd  said Berkshire Hathaway Inc  would buy an 8.7 percent stake in the company from controlling shareholder Carlyle Group  for $560 million.,topStory
AXTA,Axalta Coating Systems Ltd,20150407,UPDATE 1-Berkshire takes 8.7 pct stake in Carlyle-controlled Axalta ,April 7 Paint maker Axalta Coating Systems Ltd  said Berkshire Hathaway Inc would buy an 8.7 percent stake in the company from controlling shareholder Carlyle Group for $560 million.,normal
AXTA,Axalta Coating Systems Ltd,20150407,Berkshire takes 8.7 pct stake in Carlyle-controlled Axalta ,April 7 Paints company Axalta Coating Systems Ltd said Berkshire Hathaway Inc would buy an 8.7 percent stake in the company from controlling shareholder Carlyle Group for $560 million.,normal
BBD,Banco Bradesco Sa,20150407,Improving investor sentiment may spur Brazilian deals -Bradesco ,SAO PAULO  April 7 Banco Bradesco SA's investment-banking arm is confident that improved investor sentiment may unleash a flurry of local bond and stock offerings that murky market conditions have held back for months  a senior executive said on Tuesday.,topStory
BBDO,Banco Bradesco Sa,20150407,Improving investor sentiment may spur Brazilian deals -Bradesco ,SAO PAULO  April 7 Banco Bradesco SA's investment-banking arm is confident that improved investor sentiment may unleash a flurry of local bond and stock offerings that murky market conditions have held back for months  a senior executive said on Tuesday.,topStory
BAC,Bank of America Corporation,20150407,MOVES-Barclays  BofA Merrill Lynch  U.S. Bank  Standard Chartered ,April 7 The following financial services industry appointments were announced on Tuesday. To inform us of other job changes  email moves@thomsonreuters.com.,topStory
BAC,Bank of America Corporation,20150407,MOVES-BofA Merrill Lynch hires Michael Casey from Morgan Stanley ,April 7 Bank of America Merrill Lynch hired Michael Casey from Morgan Stanley as director of its Nevada Boise complex.,normal
BCS,Barclays PLC,20150407,MOVES-Barclays  BofA Merrill Lynch  U.S. Bank  Standard Chartered ,April 7 The following financial services industry appointments were announced on Tuesday. To inform us of other job changes  email moves@thomsonreuters.com.,topStory
BCS,Barclays PLC,20150407,Barclays' head of markets Eric Felder to leave bank -memo ,LONDON  April 7 Barclays head of markets Eric Felder is leaving the bank  less than a year after he was appointed to supervise its global sales and trading businesses  according to an internal memo.,normal
BCE,BCE Inc,20150407,Canada privacy watchdog raps BCE knuckles over targeted ads ,TORONTO  April 7 Canada's largest telecom company will scale back its profiling of customers  which BCE Inc uses to sell targeted advertising services  after a rebuke from the country's privacy commission.,topStory
BBL,BHP Billiton plc,20150407,Australia chases BHP  Rio Tinto on Singapore tax shelter: AFR ,MELBOURNE Australia is pursuing global miners BHP Billiton and Rio Tinto for shifting billions of dollars in iron ore profits through marketing hubs in Singapore that pay almost no tax  the Australian Financial Review reported on Tuesday.,topStory
BBL,BHP Billiton plc,20150407,UPDATE 1-Australia chases BHP  Rio Tinto on Singapore tax shelter - AFR ,* Australia pursuing multibillion-dollar claims on BHP  Rio -AFR,normal
BA,Boeing Company (The),20150407,Boeing beats Airbus in first quarter net orders  deliveries ,PARIS U.S. planemaker Boeing  beat European rival Airbus  in net new orders and deliveries in the first quarter  according to figures released on Tuesday.,topStory
BA,Boeing Company (The),20150407,UPDATE 2-Boeing beats Airbus in Q1 net orders  deliveries ,PARIS  April 7 U.S. planemaker Boeing  beat European rival Airbus in net new orders and deliveries in the first quarter  according to figures released on Tuesday.,normal
BTI,British American Tobacco plc,20150407,Top British diplomat in cigarette lobbying row: FT ,Britain's high commissioner to Pakistan  Philip Barton  has drawn harsh criticism from medical experts and campaigners for attending a lobbying meeting by British American Tobacco in Pakistan  the Financial Times reported.,topStory
BTI,British American Tobacco plc,20150407,Top British diplomat in cigarette lobbying row -FT ,April 7 Britain's high commissioner to Pakistan  Philip Barton  has drawn harsh criticism from medical experts and campaigners for attending a lobbying meeting by British American Tobacco in Pakistan  the Financial Times reported.,normal
SNP,China Petroleum & Chemical Corporation,20150407,Yasref refinery in Saudi Arabia loads first petcoke cargo ,KHOBAR  Saudi Arabia  April 7 The Yasref refinery in Saudi Arabia  a joint venture between Saudi Aramco  and China's Sinopec has exported its first shipment of petroleum coke  the company said on Tuesday.,topStory
DCI,Donaldson Company Inc,20150407,Woods grouped with Walker and Donaldson for first round ,AUGUSTA  Georgia Tiger Woods  set to attract huge crowds on his much hyped return to the Masters  has been grouped with fellow American Jimmy Walker and Welshman Jamie Donaldson for Thursday's first round at Augusta National.,topStory
EC,Ecopetrol SA,20150407,Colombia's public credit director Janna to join Ecopetrol unit ,BOGOTA  April 7 Colombia's public credit director  who manages the nation's sovereign debt sales  will leave his post at the finance ministry on Tuesday to join a unit of state-run Ecopetrol  four government sources told Reuters.,topStory
EC,Ecopetrol SA,20150407,Colombia's Ecopetrol to focus on offshore exploration  key fields ,BOGOTA  April 7 Colombian state-owned oil company Ecopetrol will cope with falling oil prices by bolstering exploration offshore  as well as focusing on production of high-yield wells  the company's new president said on Tuesday.,normal
EPR,EPR Properties,20150407,UPDATE 2-Weak spots found in steel of Areva's French EPR reactor ,* Regulator has warned other countries where EPRs are built   (Adds EDF  Areva comment  background),topStory
XOM,Exxon Mobil Corporation,20150407,Shell seeking to buy BG in first oil super-merger in over a decade ,Royal Dutch Shell is in advanced talks to buy BG Group in the first oil super-merger since early 2000s to extend its global lead in gas production and close the gap with the world's biggest oil major U.S. ExxonMobil.,topStory
XOM,Exxon Mobil Corporation,20150407,UPDATE 3-Shell seeking to buy BG in first oil super-merger in over a decade ,April 7 Royal Dutch Shell is in advanced talks to buy BG Group in the first oil super-merger since early 2000s to extend its global lead in gas production and close the gap with the world's biggest oil major U.S. ExxonMobil.,normal
FDX,FedEx Corporation,20150407,Wall Street ends down  dollar gains offset deal news optimism ,NEW YORK U.S. stocks ended slightly lower on Tuesday  reversing course late in the session as strength in the dollar offset optimism about deal news.,topStory
FDX,FedEx Corporation,20150407,U.S. dollar rallies  eroding Wall Street gains ,NEW YORK The U.S. dollar rose more than 1 percent on Tuesday  resuming a recent upward trend and weighing on Wall Street stocks as investors fretted the currency's strength would hurt multinational corporate profits.,normal
FDX,FedEx Corporation,20150407,US STOCKS-Wall St ends down  dollar gains offset deal news optimism ,* Indexes down: Dow 0.03 pct  S&P 0.2 pct  Nasdaq 0.1 pct   (Updates to close),normal
FDX,FedEx Corporation,20150407,Deals of the day- Mergers and acquisitions ,April 7 The following bids  mergers  acquisitions and disposals were reported by 2000 GMT on Tuesday:,normal
FDX,FedEx Corporation,20150407,FedEx to buy TNT for $4.8 billion to take on rivals in Europe ,AMSTERDAM FedEx Corp  is to buy Dutch package delivery firm TNT Express  for an agreed 4.4 billion euros ($4.8 billion)  stepping up the challenge to rivals United Parcel Service  and Deutsche Post  in Europe. | Video ,normal
FDX,FedEx Corporation,20150407,In TNT  FedEx may get last major package target UPS once sought ,CHICAGO FedEx Corp's $4.8 billion bid Tuesday for TNT Express took the world's last large potential package delivery acquisition target off the table  marking a victory in FedEx's battle to gain market share from rival United Parcel Service Inc.,normal
FDX,FedEx Corporation,20150407,In TNT  FedEx may get last major package target UPS once sought ,CHICAGO  April 7 FedEx Corp's $4.8 billion bid Tuesday for TNT Express took the world's last large potential package delivery acquisition target off the table  marking a victory in FedEx's battle to gain market share from rival United Parcel Service Inc.,normal
FDX,FedEx Corporation,20150407,US STOCKS-Wall St gains on deal news; biotechs jump ,* Indexes up: Dow 0.4 pct  S&P 0.3 pct  Nasdaq 0.5 pct   (Updates to early afternoon),normal
FDX,FedEx Corporation,20150407,CORRECTED-US STOCKS-Wall St up on deals  biotech boost ,NEW YORK  April 7 U.S. stocks rose on Tuesday  extending two sessions of gains for the S&P 500  with deals including a bid from FedEx for a Dutch peer indicating companies still see value in the market.,normal
FDX,FedEx Corporation,20150407,Europe shares rise as FedEx/TNT bid feeds M&A fever ,* France's CAC  Italy's MIB  Spain's IBEX hit multi-year highs,normal
F,Ford Motor Company,20150407,BRIEF-Ford Motor says March China vehicle sales up 1 pct y/y vs 9 pct rise in Feb ,* March China vehicle sales +1.0 percent y/y  versus +9 percent in Feb,topStory
FSM,Fortuna Silver Mines Inc,20150407,BRIEF-Fortuna says to pay no dividend in 2015  policy under review ,* Czech betting firm Fortuna says board decided to pay no dividend in 2015,topStory
GM,General Motors Company,20150407,US STOCKS-Futures tick up with eyes on FedEx ,NEW YORK  April 7 U.S. stock index futures ticked up on Tuesday  following two sessions of gains on the S&P 500  with FedEx's multibillion dollar transatlantic acquisition expected to lift the transports sector.,topStory
GM,General Motors Company,20150407,BRIEF-GM says March China vehicle sales up 8 pct y/y  vs 1.3 pct rise in Feb ,* March China vehicle sales +8.0 percent y/y  versus +1.3 percent in Feb,normal
HDB,HDFC Bank Limited,20150407,India's HDFC Bank to cut base lending rate by 15 bps - exec ,MUMBAI  April 7 India's HDFC Bank Ltd  the country's second-biggest private sector lender by assets  will reduce its base lending rate by 15 basis points to 9.85 percent  effective April 13  an executive at the bank said on Tuesday.,topStory
HES,Hess Corporation,20150407,Oil prices could be $5-$15 lower in 2016 if Iran sanctions lifted: EIA ,NEW YORK World oil prices could be $5 to $15 a barrel lower than forecast next year if oil-related sanctions against Iran are lifted  the U.S. government's energy agency said on Tuesday.,topStory
HES,Hess Corporation,20150407,Hess is mirroring Toyota manufacturing process to slash well costs ,DENVER Oil producer Hess Corp has turned to a manufacturing process developed by automaker Toyota Motor Corp to cut costs and boost production as crude oil prices lag.,normal
HES,Hess Corporation,20150407,CORRECTED (OFFICIAL)-Hess is mirroring Toyota manufacturing process to slash well costs ,DENVER  April 2 Oil producer Hess Corp  has turned to a manufacturing process developed by automaker Toyota Motor Corp to cut costs and boost production as crude oil prices lag.,normal
HUM,Humana Inc,20150407,Humana expects Medicare Advantage payments to create funding increase ,NEW YORK  April 7 Humana Inc  a health insurer that manages Medicare Advantage health plans for the elderly and disabled  said on Tuesday that it believes the government's final plan payment rates represent a 0.8 percent increase in funding to it.,topStory
IBN,ICICI Bank Limited,20150407,India's ICICI Bank says to cut base lending rate by 25 bps ,MUMBAI  April 7 ICICI Bank Ltd  India's biggest private sector lender by assets  will cut its base lending rate by 25 basis points to 9.75 percent  effective Friday  it said on Tuesday.,topStory
JPM,J P Morgan Chase & Co,20150407,Scandal-hit Petrobras may issue earnings in April: JP Morgan ,RIO DE JANEIRO Petróleo Brasileiro SA  struggling with fallout from a corruption scandal and a decline in oil prices  could release audited financial information this month despite facing "a perfect storm " analysts at JPMorgan Securities said on Tuesday.,topStory
LMT,Lockheed Martin Corporation,20150407,U.S. Air Force eyes future F-35 engine and arms upgrades ,WASHINGTON The U.S. Air Force is on track to declare Lockheed Martin Corp's F-35 fighter jet ready for initial combat use by August or September 2016  and officials are already looking at possible future upgrades to its weapons  propulsion and avionics.,topStory
LMT,Lockheed Martin Corporation,20150407,U.S. Air Force eyes future F-35 engine and arms upgrades ,WASHINGTON  April 7 The U.S. Air Force is on track to declare Lockheed Martin Corp's F-35 fighter jet ready for initial combat use by August or September 2016  and officials are already looking at possible future upgrades to its weapons  propulsion and avionics.,normal
MMC,Marsh & McLennan Companies Inc,20150407,MOVES-Marsh appoints new director of risk and governance ,April 7 Insurance broking and risk management company Marsh  a wholly owned subsidiary of Marsh & McLennan Co   appointed Sally Williams to its board as director of risk and governance.,topStory
MUX,McEwen Mining Inc,20150407,UPDATE 1-McEwen Mining says robbers stole 7 000 ozs of gold from Mexico mine ,April 7 Armed robbers on Tuesday made off with 7 000 ounces of gold contained in some 900 kilograms of gold-bearing concentrate from McEwen Mining Inc's El Gallo 1 mine in Mexico  the Canadian-based miner said.,topStory
MS,Morgan Stanley,20150407,MOVES-BofA Merrill Lynch hires Michael Casey from Morgan Stanley ,April 7 Bank of America Merrill Lynch hired Michael Casey from Morgan Stanley as director of its Nevada Boise complex.,topStory
NYCB,New York Community Bancorp Inc,20150407,Fitch Affirms New York Community's Ratings at 'BBB+'; Outlook Stable ,(The following statement was released by the rating agency) NEW YORK  April 07 (Fitch) Fitch Ratings has affirmed the ratings for New York  Community Bancorp  Inc. (NYCB) at 'BBB+/F2'. The Rating Outlook remains Stable.  . A full list of rating actions follows at the end of this release. Fitch reviewed NYCB as part of its Niche Bank Peer Review  which also includes  Astoria Financial Corporation  Inc.  Dime Community Bancshares  Inc. and  Emigrant Bancorp Inc. Niche banks are defined by their na,topStory
NYCB,New York Community Bancorp Inc,20150407,Fitch Affirms Astoria Fin'l's IDRs at 'BBB-'/'F3' Following Peer Review; Outlook Stable ,(The following statement was released by the rating agency) NEW YORK  April 07 (Fitch) Fitch Ratings has affirmed the long- and short-term  Issuer Default Ratings (IDRs) of Astoria Financial Corporation and its principal  banking subsidiary  Astoria Bank  at 'BBB-'/'F3'. The Rating Outlook is Stable.  A full list of ratings actions is provided at the end of this release. Fitch reviewed AF as part of its Niche Bank Peer Review  which also includes  Dime Community Bancshares  Inc.  Emigrant Bancor,normal
NYT,New York Times Company (The),20150407,India seeks to settle Rafale dispute ahead of France trip -report ,NEW DELHI India has asked France's Dassault Aviation SA to stick to the original price tag for fighter jets or risk losing one of the world's biggest military aircraft deals  the Times of India reported on Tuesday.,topStory
NYT,New York Times Company (The),20150407,UPDATE 1-India seeks to settle Rafale dispute ahead of France trip -report ,NEW DELHI  April 7 India has asked France's Dassault Aviation SA to stick to the original price tag for fighter jets or risk losing one of the world's biggest military aircraft deals  the Times of India reported on Tuesday.,normal
