ADBE,Adobe Systems Incorporated,20151130,U.S. Cyber Monday sales up 14 pct  on track for record -Adobe ,CHICAGO  Nov 30 Sales on Cyber Monday  the busiest day of the year for internet shopping  were up 14 percent from a year earlier  totalling $490 million between midnight and 10 a.m. ET  according to estimates by Adobe Digital Index.,topStory
GOOG,Alphabet Inc,20151130,INSIGHT-On China's fringes  cyber spies raise their game ,* HK police say drop in reported "unauthorised access" cases   (Adds TV link.),normal
GOOGL,Alphabet Inc,20151130,INSIGHT-On China's fringes  cyber spies raise their game ,* HK police say drop in reported "unauthorised access" cases   (Adds TV link.),normal
AMZN,Amazoncom Inc,20151130,UPDATE 2-Target website stumbles on Cyber Monday  rivals out of stock ,CHICAGO  Nov 30 U.S. shoppers seeking to avoid the holiday crowds at bricks-and-mortar stores and snare deals on Cyber Monday came face-to-face with traffic jams and product sellouts  with some customers of Target Corp forced to wait in a virtual line.,normal
AAL,American Airlines Group Inc,20151130,American Airlines  union reach deal to hike agents' pay ,Members of the association representing American Airlines Group Inc's reservations and gate agents approved a new five-year contract that includes an immediate 30 percent average wage hike.,topStory
AAL,American Airlines Group Inc,20151130,American Airlines  union reach deal to hike agents' pay ,Members of the association representing American Airlines Group Inc's  reservations and gate agents approved a new five-year contract that includes an immediate 30 percent average wage hike.,normal
AAL,American Airlines Group Inc,20151130,UPDATE 1-American Airlines  union reach deal to hike agents' pay ,Nov 30 Members of the association representing American Airlines Group Inc's reservations and gate agents approved a new five-year contract that includes an immediate 30 percent average wage hike.,normal
CELG,Celgene Corporation,20151130,FDA approves new Bristol-Myers treatment for multiple myeloma ,Nov 30 The U.S. Food and Drug Administration said on Monday it had approved a drug to be sold by Bristol-Myers Squibb Co as a treatment for a form of blood cancer.,normal
KANG,iKang Healthcare Group Inc,20151130,BRIEF-Sanyou's consortium to submit proposal to acquire Nasdaq-listed iKang ,* Says it and partners' consortium plan to submit preliminary non-binding proposal to acquire Nasdaq-listed iKang Healthcare Group Inc,topStory
NXPI,NXP Semiconductors NV,20151130,NXP Semiconductor names Freescale exec as new CFO ,Nov 30 NXP Semiconductors NV said on Monday that Dan Durn  financial chief of Freescale Semiconductor Ltd  will be its new chief financial officer.,topStory
ODP,Office Depot Inc,20151130,FTC preparing to block Staples-Office Depot deal: NY Post ,U.S. antitrust regulators are preparing to block Staples Inc's  acquisition of smaller rival Office Depot Inc   the New York Post reported on Sunday.,topStory
ODP,Office Depot Inc,20151130,UPDATE 3-FTC preparing to block Staples-Office Depot deal - NY Post ,* Shares of Staples  Office Depot down   (Adds Office Depot response  updates shares),normal
TSLA,Tesla Inc ,20151130,UPDATE 1-Goldman backs low-emissions stocks as climate talks start ,MILAN/NEW YORK  Nov 30 Electric carmaker Tesla Motors  lithium supplier Albemarle and solar-panel efficiency specialist SolarEdge Technologies  are among winners from a growing focus on emissions as climate-change talks get under way  Goldman Sachs told clients.,normal
FOX,Twenty-First Century Fox Inc,20151130,Tribune Publishing says not in talks to sell itself ,Nov 30 Tribune Publishing Co said it was not in talks or in the process of selling itself  after a tweet by News Corp's Rupert Murdoch on Friday that suggested its newspaper group would be sold.,topStory
FOXA,Twenty-First Century Fox Inc,20151130,Tribune Publishing says not in talks to sell itself ,Nov 30 Tribune Publishing Co said it was not in talks or in the process of selling itself  after a tweet by News Corp's Rupert Murdoch on Friday that suggested its newspaper group would be sold.,topStory
VIA,Viacom Inc,20151130,U.S. media mogul Redstone's ex-girlfriend loses motion in mental competence suit ,LOS ANGELES  Nov 30 A California court on Monday rejected a request from the former girlfriend of Sumner Redstone for the 92-year-old media mogul  who controls CBS Corp  and Viacom Inc  to undergo an immediate medical evaluation.,topStory
VIAB,Viacom Inc,20151130,U.S. media mogul Redstone's ex-girlfriend loses motion in mental competence suit ,LOS ANGELES  Nov 30 A California court on Monday rejected a request from the former girlfriend of Sumner Redstone for the 92-year-old media mogul  who controls CBS Corp  and Viacom Inc  to undergo an immediate medical evaluation.,topStory
ALB,Albemarle Corporation,20151130,UPDATE 1-Goldman backs low-emissions stocks as climate talks start ,MILAN/NEW YORK  Nov 30 Electric carmaker Tesla Motors  lithium supplier Albemarle and solar-panel efficiency specialist SolarEdge Technologies  are among winners from a growing focus on emissions as climate-change talks get under way  Goldman Sachs told clients.,normal
ALB,Albemarle Corporation,20151130,Goldman backs low-emissions stocks as climate talks start ,MILAN  Nov 30 Electric carmaker Tesla  lithium supplier Albemarle and tyremaker Continental  are among relative winners from a growing focus on emissions as climate-change talks get underway  Goldman Sachs told clients.,normal
BABA,Alibaba Group Holding Limited,20151130,BRIEF-Hua Xia Bank in strategic agreement with Alibaba's Ant Financial ,* Says signs strategic agreement with Alibaba's Ant Financial on Internet payment service,topStory
BABA,Alibaba Group Holding Limited,20151130,South Korea gives initial approval for first online-only banks ,SEOUL South Korea's financial regulator has given preliminary approval to two consortia backed by Kakao Corp and an affiliate of China's Alibaba Group Holding Ltd to set up the country's first online-only banks.,normal
BABA,Alibaba Group Holding Limited,20151130,CORRECTED-(OFFICIAL)-S.Korea gives initial approval for first online-only banks ,SEOUL  Nov 30 South Korea's financial regulator has given preliminary approval to two consortia backed by Kakao Corp and an affiliate of China's Alibaba Group Holding Ltd to set up the country's first online-only banks.,normal
BUD,Anheuser-Busch Inbev SA,20151130,Senate calls hearing in Anheuser-Busch InBev mega beer deal ,WASHINGTON Anheuser-Busch InBev's bid to buy its biggest rival  SABMiller  will be the subject of a U.S. Senate hearing next week  the Senate Judiciary Committee said on Monday.,topStory
BUD,Anheuser-Busch Inbev SA,20151130,U.S. senate calls hearing in Anheuser-Busch InBev mega beer deal ,WASHINGTON  Nov 30 Anheuser-Busch InBev's  bid to buy its biggest rival  SABMiller  will be the subject of a U.S. Senate hearing next week  the Senate Judiciary Committee said on Monday.,normal
BUD,Anheuser-Busch Inbev SA,20151130,Anheuser-Busch InBev to sell Peroni  Grolsch to smooth merger: FT ,Anheuser-Busch InBev is planning to sell the Peroni and Grolsch brands it would gain from its acquisition of SABMiller to head off European regulatory concerns over the 71 billion pounds ($107 billion) brewery merger  the Financial Times said on Sunday.,normal
BUD,Anheuser-Busch Inbev SA,20151130,Anheuser-Busch InBev to sell Peroni  Grolsch to smooth merger -FT ,Nov 29 Anheuser-Busch InBev is planning to sell the Peroni and Grolsch brands it would gain from its acquisition of SABMiller to head off European regulatory concerns over the 71 billion pounds ($107 billion) brewery merger  the Financial Times said on Sunday.,normal
BLL,Ball Corporation,20151130,BRIEF-Ball says commenced public offering of about 1.5 bln euros ,* Has commenced an underwritten ll public offering of approximately eur 1.5 billion in aggregate principal amount  consisting of us dollar- and euro- denominated senior notes,topStory
BBD,Banco Bradesco Sa,20151130,Brazil's Bradesco not approached to buy BTG Pactual assets: CEO ,SAO PAULO Brazilian lender Banco Bradesco SA has not been approached about buying assets from investment bank BTG Pactual SA  its chief executive said on Monday.,topStory
BBD,Banco Bradesco Sa,20151130,Brazil's Bradesco not approached to buy BTG Pactual assets -CEO ,SAO PAULO  Nov 30 Brazilian lender Banco Bradesco SA has not been approached about buying assets from investment bank BTG Pactual SA  its chief executive said on Monday.,normal
BBDO,Banco Bradesco Sa,20151130,Brazil's Bradesco not approached to buy BTG Pactual assets: CEO ,SAO PAULO Brazilian lender Banco Bradesco SA has not been approached about buying assets from investment bank BTG Pactual SA  its chief executive said on Monday.,topStory
BBDO,Banco Bradesco Sa,20151130,Brazil's Bradesco not approached to buy BTG Pactual assets -CEO ,SAO PAULO  Nov 30 Brazilian lender Banco Bradesco SA has not been approached about buying assets from investment bank BTG Pactual SA  its chief executive said on Monday.,normal
BBL,BHP Billiton plc,20151130,BHP shares sink on Brazil's plan to sue over mine disaster ,SYDNEY/LONDON BHP Billiton shares dropped more than 5 percent to a seven-year low on Monday after Brazil announced plans to sue the mining company and its partners for 20 billion reais ($5.2 billion) over the bursting of a dam.,topStory
BBL,BHP Billiton plc,20151130,Britain's FTSE lags euro zone  pulled down by BHP and Aberdeen ,* Aberdeen AM down on emerging market outflows   (Updates prices),normal
BBL,BHP Billiton plc,20151130,Britain's FTSE lags euro zone  pulled down by BHP and Aberdeen ,* Aberdeen AM down on emerging market outflows   (Recasts  adds quote  detail),normal
BBL,BHP Billiton plc,20151130,UPDATE 1-BHP shares sink on Brazil's plan to sue over mine disaster ,SYDNEY/LONDON  Nov 30 BHP Billiton  shares dropped more than 5 percent to a seven-year low on Monday after Brazil announced plans to sue the mining company and its partners for 20 billion reais ($5.2 billion) over the bursting of a dam.,normal
BBL,BHP Billiton plc,20151130,Britain's FTSE edges lower  pulled down by BHP and Aberdeen ,LONDON  Nov 30 Britain's top share index edged lower on Monday  with mining company BHP Billiton falling on the prospect of a hefty fine in Brazil and Aberdeen Asset Management slipping after it reported outflows from its emerging market funds.,normal
BBL,BHP Billiton plc,20151130,European shares fall; BHP Billiton  Delta Lloyd weigh ,MILAN  Nov 30 European shares opened lower on Monday  led by BHP Billiton after news Brazil could seek damages for the burst of a dam  while Delta Lloyd slumped on capital raising plans.,normal
BBL,BHP Billiton plc,20151130,BHP names chairman  board members to oversee Samarco disaster ,SYDNEY  Nov 30 BHP Billiton   said on Monday its chairman and three other board members would oversee its response to the Samarco mine disaster in Brazil as clean-up efforts continue amid confirmation arsenic had been found in river water.,normal
BLK,BlackRock Inc,20151130,U.S. inflation expectations are 'unrealistically low': BlackRock's Koesterich ,BlackRock Inc's  top investment strategist said on Monday his team prefers debt protected against rising inflation to traditional U.S. Treasuries  given a market that has grown "too sanguine" about the potential for rising prices.,topStory
BLK,BlackRock Inc,20151130,U.S. inflation expectations are 'unrealistically low' - BlackRock's Koesterich ,Nov 30 BlackRock Inc's top investment strategist said on Monday his team prefers debt protected against rising inflation to traditional U.S. Treasuries  given a market that has grown "too sanguine" about the potential for rising prices.,normal
BA,Boeing Company (The),20151130,U.S. to propose safety fixes for certain Boeing  Embraer jets: WSJ ,U.S. aviation regulators are to propose on Monday mandatory inspections and  potentially  the replacement of suspect parts on nearly 1 600 jetliners to prevent serious flight failures  the Wall Street Journal reported.,topStory
BA,Boeing Company (The),20151130,European Factors to Watch-Shares seen flat to lower ,MILAN  Nov 30 European shares were expected to open flat to lower on Monday  following losses in Asia overnight  with investors cautious ahead of a much-anticipated policy decision by the European Central Bank on Thursday.,normal
BA,Boeing Company (The),20151130,French and Benelux stocks-Factors to watch on Nov 30 ,PARIS  Nov 30 Below are company-related news and stories from French and Benelux media which could have an impact on the region's markets or individual stocks.,normal
BA,Boeing Company (The),20151130,Morning News Call - India  November 30 ,To access the newsletter  click on the link:    http://share.thomsonreuters.com/assets/newsletters/Indiamorning/MNC_IN_11302015.pdf               FACTORS TO WATCH     11:00 am: Winter session of parliament continues.     5:00 pm: Government to release October infrastructure output data.     5:30 pm: Government to release July-September GDP data.          EMEA-FX WEEK AHEAD: Join Reuters FX analyst Jeremy Boulton at 1530 GMT for a look at the week's top topics and implications for the FX market. ,normal
BMY,Bristol-Myers Squibb Company,20151130,FDA approves new Bristol-Myers treatment for multiple myeloma ,The U.S. Food and Drug Administration said on Monday it had approved a drug to be sold by Bristol-Myers Squibb Co as a treatment for a form of blood cancer.,topStory
BMY,Bristol-Myers Squibb Company,20151130,FDA approves new Bristol-Myers treatment for multiple myeloma ,Nov 30 The U.S. Food and Drug Administration said on Monday it had approved a drug to be sold by Bristol-Myers Squibb Co as a treatment for a form of blood cancer.,normal
C,Citigroup Inc,20151130,Fed to take up 'too big to fail' emergency lending curb ,WASHINGTON  Nov 30 The Federal Reserve Board will consider on Monday a proposal to curb its emergency lending powers  a change demanded by Congress after the central bank's controversial decision to aid AIG  Citigroup and others in 2008.,normal
ERJ,Embraer-Empresa Brasileira de Aeronautica,20151130,U.S. to propose safety fixes for certain Boeing  Embraer jets: WSJ ,U.S. aviation regulators are to propose on Monday mandatory inspections and  potentially  the replacement of suspect parts on nearly 1 600 jetliners to prevent serious flight failures  the Wall Street Journal reported.,topStory
EQT,EQT Corporation,20151130,EQT to launch mandatory bid for Swedish software firm IFS ,STOCKHOLM  Nov 30 Private equity firm EQT has bought 63 percent of the shares in Swedish enterprise software maker IFS  and will make a mandatory bid for the remaining shares in the coming weeks  it said on Monday.,topStory
RACE,Ferrari NV,20151130,Ferrari gets 2.5 billion euros in funding ,MILAN Luxury sports car maker Ferrari  has signed contracts to raise 2.5 billion euros in debt which will use in part to refinance debt owed to Fiat Chrysler Automobiles  as it moves towards separation from its parent company.,topStory
RACE,Ferrari NV,20151130,Ferrari gets 2.5 bln euros in funding ,MILAN  Nov 30 Luxury sports car maker Ferrari  has signed contracts to raise 2.5 billion euros in debt which will use in part to refinance debt owed to Fiat Chrysler Automobiles as it moves towards separation from its parent company.,normal
FCAU,Fiat Chrysler Automobiles NV,20151130,Ferrari gets 2.5 billion euros in funding ,MILAN Luxury sports car maker Ferrari  has signed contracts to raise 2.5 billion euros in debt which will use in part to refinance debt owed to Fiat Chrysler Automobiles  as it moves towards separation from its parent company.,topStory
FCAU,Fiat Chrysler Automobiles NV,20151130,Ferrari gets 2.5 bln euros in funding ,MILAN  Nov 30 Luxury sports car maker Ferrari  has signed contracts to raise 2.5 billion euros in debt which will use in part to refinance debt owed to Fiat Chrysler Automobiles as it moves towards separation from its parent company.,normal
F,Ford Motor Company,20151130,Foreign carmakers to keep price edge as Ford faces higher labor costs ,DETROIT Foreign automakers with plants in the United States will be able to offer lower vehicle prices as Ford Motor Co faces continued higher labor costs under a new four-year contract with its U.S. union workers.,topStory
F,Ford Motor Company,20151130,Ford says to incur $600 mln expense in 2015 from U.S. union pact ,DETROIT  Nov 30 Ford Motor Co said on Monday it will incur a $600 million expense this year tied to its new four-year contract with the United Auto Workers union in the United States.,normal
GZT,Gazit-Globe Ltd,20151130,Israeli real estate developer Gazit-Globe Q3 loss widens ,TEL AVIV  Nov 30 Gazit-Globe  Israel's largest real estate investment company  posted a wider net loss in the third quarter due to one-off items  including for the reorganisation of its Canadian subsidiary FCR.,topStory
GS,Goldman Sachs Group Inc (The),20151130,Goldman backs low-emissions stocks as climate talks start ,MILAN/NEW YORK Electric carmaker Tesla Motors   lithium supplier Albemarle  and solar-panel efficiency specialist SolarEdge Technologies  are among winners from a growing focus on emissions as climate-change talks get under way  Goldman Sachs told clients.,topStory
GS,Goldman Sachs Group Inc (The),20151130,UPDATE 1-Goldman backs low-emissions stocks as climate talks start ,MILAN/NEW YORK  Nov 30 Electric carmaker Tesla Motors  lithium supplier Albemarle and solar-panel efficiency specialist SolarEdge Technologies  are among winners from a growing focus on emissions as climate-change talks get under way  Goldman Sachs told clients.,normal
GS,Goldman Sachs Group Inc (The),20151130,Goldman backs low-emissions stocks as climate talks start ,MILAN  Nov 30 Electric carmaker Tesla  lithium supplier Albemarle and tyremaker Continental  are among relative winners from a growing focus on emissions as climate-change talks get underway  Goldman Sachs told clients.,normal
HSBC,HSBC Holdings plc,20151130,Brazil's Bradesco not approached to buy BTG Pactual assets -CEO ,SAO PAULO  Nov 30 Brazilian lender Banco Bradesco SA has not been approached about buying assets from investment bank BTG Pactual SA  its chief executive said on Monday.,normal
HSEA,HSBC Holdings plc,20151130,Brazil's Bradesco not approached to buy BTG Pactual assets -CEO ,SAO PAULO  Nov 30 Brazilian lender Banco Bradesco SA has not been approached about buying assets from investment bank BTG Pactual SA  its chief executive said on Monday.,normal
HSEB,HSBC Holdings plc,20151130,Brazil's Bradesco not approached to buy BTG Pactual assets -CEO ,SAO PAULO  Nov 30 Brazilian lender Banco Bradesco SA has not been approached about buying assets from investment bank BTG Pactual SA  its chief executive said on Monday.,normal
IGT,International Game Technology,20151130,BRIEF-EQT VII acquires 68% of votes  63% of capital in IFS ,* EQT VII acquires 68% of votes and 63% of capital in IFS for sek 362.50 per share,topStory
ITUB,Itau Unibanco Banco Holding SA,20151130,BTG Pactual in talks over $1 billion loan sale to Itaú  Bradesco  sources say ,SAO PAULO Grupo BTG Pactual SA  is negotiating the sale of around 4 billion reais ($1.03 billion) in loans to rivals Itaú Unibanco Holding SA  and Banco Bradesco SA   two sources with direct knowledge of the situation said on Monday.,topStory
JPM,J P Morgan Chase & Co,20151130,JP Morgan leaves bonus pool unchanged from 2014 - Bloomberg ,Nov 29 JPMorgan Chase & Co is leaving its bonus pool for bankers and traders nearly unchanged from 2014  Bloomberg reported  citing people familiar with the matter.,topStory
LMT,Lockheed Martin Corporation,20151130,Lockheed's Sikorsky wins $940 million in Army contracts ,WASHINGTON Sikorsky Aircraft  a unit of Lockheed Martin Corp   has won two separate contracts worth $940 million to carry out maintenance  logistics and other work aimed at supporting U.S. Army weapons systems  the Pentagon said on Monday.,topStory
LMT,Lockheed Martin Corporation,20151130,Lockheed's Sikorsky wins $940 mln in U.S. Army contracts ,WASHINGTON  Nov 30 Sikorsky Aircraft  a unit of Lockheed Martin Corp  has won two separate contracts worth $940 million to carry out maintenance  logistics and other work aimed at supporting U.S. Army weapons systems  the Pentagon said on Monday.,normal
LMT,Lockheed Martin Corporation,20151130,Lockheed wins $279 million in U.S. Navy funding for next LCS ship ,WASHINGTON Lockheed Martin Corp  on Monday said it had received $279 million in remaining funding from the U.S. Navy for the construction of the future USS Cooperstown  the 23rd Littoral Combat Ship.,normal
LMT,Lockheed Martin Corporation,20151130,Lockheed wins $279 mln in U.S. Navy funding for next LCS ship ,WASHINGTON  Nov 30 Lockheed Martin Corp  on Monday said it had received $279 million in remaining funding from the U.S. Navy for the construction of the future USS Cooperstown  the 23rd Littoral Combat Ship.,normal
MA,Mastercard Incorporated,20151130,Apparel demand up  electronics flat over U.S. Black Friday weekend: MasterCard ,Apparel-focused U.S. retailers saw sales perk up over the four-day promotional period that kicked off on Thanksgiving Day  though department-store and electronics revenue was roughly flat  a MasterCard executive told Reuters in an interview Monday.,topStory
MA,Mastercard Incorporated,20151130,Apparel demand up  electronics flat over U.S. Black Friday weekend: MasterCard ,Nov 30 Apparel-focused U.S. retailers saw sales perk up over the four-day promotional period that kicked off on Thanksgiving Day  though department-store and electronics revenue was roughly flat  a MasterCard executive told Reuters in an interview Monday.,normal
MFG,Mizuho Financial Group Inc,20151130,MOVES- Mizuho International  AXA IM  Prime Partners ,Nov 30 The following financial services industry appointments were announced on Monday. To inform us of other job changes  email moves@thomsonreuters.com.,normal
MFG,Mizuho Financial Group Inc,20151130,MOVES-Mizuho International names A.J. Davidson managing director ,Nov 30 Mizuho Financial Group Inc's  UK-based securities and investment banking arm  Mizuho International Plc  named A.J. Davidson as managing director  head of EMEA financial institutions and risk solutions.,normal
MS,Morgan Stanley,20151130,Morgan Stanley to cut up to 25 percent of fixed-income jobs ,Morgan Stanley  plans to cut up to 25 percent of its fixed-income jobs  according to a person familiar with the matter.,topStory
MS,Morgan Stanley,20151130,UPDATE 2-Morgan Stanley to cut up to 25 pct of fixed-income jobs ,Nov 30 Morgan Stanley plans to cut up to 25 percent of its fixed-income jobs  according to a person familiar with the matter.,normal
SID,National Steel Company,20151130,Brazil's CSN forms new joint venture with Asian partners ,SAO PAULO Brazil's biggest diversified steelmaker Cia Siderurgica Nacional (CSN)  said on Monday it signed a deal giving it a consolidated 87.52 percent stake in a new joint venture  Congonhas Minerios SA  with a group of Asian partners.,topStory
ORAN,Orange,20151130,Orange says not in talks with Telecom Italia  studying sector ,PARIS  Nov 30 French telecoms group Orange  said on Monday it was not in talks with Italian peer Telecom Italia but had hired advisory banks to finetune its assessment of the European telecoms sector.,topStory
ORAN,Orange,20151130,Telecom Italia CEO says no contacts with Orange  other operators ,ROME  Nov 30 Telecom Italia has had no contacts with France's Orange or any other telecoms operators  the Italian phone company's Chief Executive Marco Patuano said on Monday.,normal
PBR,Petroleo Brasileiro SA- Petrobras,20151130,Vale CEO Ferreira quits as chairman of Brazil's Petrobras ,SAO PAULO Murilo Ferreira quit as chairman of Brazil's Petroleo Brasileiro SA  the state-controlled oil company said on Monday  without disclosing the reason for his decision.,topStory
PBR,Petroleo Brasileiro SA- Petrobras,20151130,RPT-UPDATE 2-BTG Pactual may sell part of commodities unit after CEO held- source ,* Commodities unit's success makes it candidate for part sale,normal
PBR,Petroleo Brasileiro SA- Petrobras,20151130,LATAM WRAP-BTG bonds under pressure after Esteves departure ,NEW YORK  Nov 30 (IFR) - BTG Pactual's bonds were lower on Monday as investors scrambled to assess the impact on the Brazilian bank's liquidity and fretted about the prospect of more negative headlines after Andre Esteves stepped down as CEO over the weekend.,normal
PBR,Petroleo Brasileiro SA- Petrobras,20151130,BTG Pactual may sell part of commodities unit after CEO held: source ,LONDON Brazil's Grupo BTG Pactual SA is reviewing its assets and may sell part of its commodities unit to raise capital after the arrest of the bank's chief executive  a source familiar with the matter said on Monday.,normal
PBR,Petroleo Brasileiro SA- Petrobras,20151130,UPDATE 1-Vale CEO Ferreira quits as chairman of Brazil's Petrobras ,SAO PAULO  Nov 30 Murilo Ferreira quit as chairman of Brazil's Petroleo Brasileiro SA  the state-controlled oil company said on Monday  without disclosing the reason for his decision.,normal
PBR,Petroleo Brasileiro SA- Petrobras,20151130,Vale CEO Ferreira quits as chairman of Brazil's Petrobras ,SAO PAULO  Nov 30 Murilo Ferreira has quit as chairman of Brazilian state-controlled Petroleo Brasileiro SA  the company said on Monday  without disclosing the reason for his decision.,normal
PJC,Piper Jaffray Companies,20151130,MOVES-Piper Jaffray  Mizuho International  AXA IM  Prime Partners ,Nov 30 The following financial services industry appointments were announced on Monday. To inform us of other job changes  email moves@thomsonreuters.com.,topStory
