PJC,Piper Jaffray Companies,20151130,MOVES-Piper Jaffray names managing director for healthcare team ,Nov 30 Investment bank and asset management company Piper Jaffray Cos hired Keith Anderson as managing director for its healthcare investment banking group.,normal
SNY,Sanofi,20151130,French and Benelux stocks-Factors to watch on Nov 30 ,PARIS  Nov 30 Below are company-related news and stories from French and Benelux media which could have an impact on the region's markets or individual stocks.,normal
SAIC,SCIENCE APPLICATIONS INTERNATIONAL CORPORATION,20151130,Trio lose appeal of New York City payroll project fraud convictions ,NEW YORK A U.S. appeals court on Monday rejected three men's bids to reverse their convictions for scheming to defraud New York City while implementing a payroll system whose costs ballooned to $700 million.,normal
SAIC,SCIENCE APPLICATIONS INTERNATIONAL CORPORATION,20151130,UPDATE 1-Trio lose appeal of New York City payroll project fraud convictions ,NEW YORK  Nov 30 A U.S. appeals court on Monday rejected three men's bids to reverse their convictions for scheming to defraud New York City while implementing a payroll system whose costs ballooned to $700 million.,normal
SAIC,SCIENCE APPLICATIONS INTERNATIONAL CORPORATION,20151130,Trio lose appeal of New York City payroll project fraud convictions ,NEW YORK  Nov 30 A U.S. appeals court on Monday rejected three men's bids to reverse their convictions for lining their own pockets while overhauling New York City's payroll system.,normal
SU,Suncor Energy  Inc,20151130,UPDATE 2-COS investors given extra month to assess Suncor bid ,* Lawyer says commission 'met everyone halfway'   (Adds comment from Suncor and COS),topStory
SU,Suncor Energy  Inc,20151130,CANADA STOCKS-TSX rises on gains for resource stocks  financials ,TORONTO  Nov 30 Canada's main stock index rallied on Monday  led by strength in resource stocks and as financials rose ahead of bank earnings reports this week but the index lost 0.4 percent in November.,normal
SU,Suncor Energy  Inc,20151130,Regulator says COS shareholders have until Jan. 4 to consider Suncor bid ,CALGARY  Alberta  Nov 30 Canadian Oil Sands  shareholders should have until Jan. 4  2016 to consider a hostile takeover bid from Suncor Energy Inc  the Alberta Securities Commission said on Monday.,normal
SNV,Synovus Financial Corp,20151130,Fitch Expects to Rate Synovus' Subordinated Debt Issuance 'BB+' ,(The following statement was released by the rating agency) CHICAGO  November 30 (Fitch) Fitch Ratings expects to rate Synovus Financial  Corp.'s (SNV) subordinated debt issuance due in 2025 'BB+'. Proceeds of the  issuance are for general corporate purposes. Fitch recently upgraded SNV's long-term Issuer Default Rating and viability  rating (VR) to 'BBB-/bbb-' from 'BB+/bb+'. For more information pertaining to  that rating action  please see the press release titled 'Fitch Upgrades Synovus  Fin,topStory
TSM,Taiwan Semiconductor Manufacturing Company Ltd,20151130,BRIEF-TSMC's units to sell Xnitec  Motech shares ,* Says unit Visera sells Xnitec shares for T$328 million  ($10.04 million)  unit TSMC Solar sells Motech shares for T$ 1.2 billion,topStory
TGT,Target Corporation,20151130,Target website down on Cyber Monday traffic ,Discount retailer Target Corp's website was down due to heavy traffic on Cyber Monday.,topStory
TGT,Target Corporation,20151130,UPDATE 2-Target website down on Cyber Monday traffic ,* Shares down about 1 pct   (Adds Target response  details  background),normal
TGT,Target Corporation,20151130,Target website down on Cyber Monday due to heavy traffic ,Nov 30 Target Corp's website was down due to heavy traffic on Cyber Monday.,normal
TI,Telecom Italia SPA,20151130,ISS opposes Vivendi's bid to win Telecom Italia board seats ,MILAN Institutional Shareholder Services (ISS) has advised shareholders in Telecom Italia to vote against the proposed appointment of four new board members to represent top investor Vivendi.,topStory
TI,Telecom Italia SPA,20151130,UPDATE 2-ISS opposes Vivendi's bid to win Telecom Italia board seats ,MILAN  Nov 30 Institutional Shareholder Services (ISS) has advised shareholders in Telecom Italia to vote against the proposed appointment of four new board members to represent top investor Vivendi.,normal
TI,Telecom Italia SPA,20151130,BRIEF-Telecom Italia fund investors ask Vivendi to unveil aim - document ,* Association of Italian funds and some foreign funds that are investors in the Italian group have asked top shareholder Vivendi to clarify what its goal is in requesting the appointment of four board members at Telecom Italia - document,normal
TI,Telecom Italia SPA,20151130,BRIEF-ISS tells Telecom Italia investors to vote against Vivendi proposals ,* Proxy adviser ISS recommends shareholders in Telecom Italia vote in favour of savings share conversion and against proposals by Vivendi at mid-December shareholder meeting - document  Further company coverage:     (Reporting by Milan Newsroom),normal
TI,Telecom Italia SPA,20151130,Orange says not in talks with Telecom Italia  studying sector ,PARIS  Nov 30 French telecoms group Orange  said on Monday it was not in talks with Italian peer Telecom Italia but had hired advisory banks to finetune its assessment of the European telecoms sector.,normal
TI,Telecom Italia SPA,20151130,Telecom Italia CEO says no contacts with Orange  other operators ,ROME  Nov 30 Telecom Italia has had no contacts with France's Orange or any other telecoms operators  the Italian phone company's Chief Executive Marco Patuano said on Monday.,normal
TI,Telecom Italia SPA,20151130,ISS suggests vote against proposed Vivendi members on Telecom Italia board- source ,MILAN  Nov 30 Proxy adviser ISS is advising shareholders in Telecom Italia to vote against the appointment of four board members at the Italian group proposed by Vivendi  a source close the matter said.,normal
TI,Telecom Italia SPA,20151130,ISS recommends vote against Vivendi's bid to win Telecom Italia board seats-source ,MILAN  Nov 30 Proxy adviser ISS is advising shareholders in Telecom Italia vote against a request by top investor Vivendi to raise the number of board members at the Italian group so that four of its representatives can be appointed  a fund industry source said.,normal
TEF,Telefonica SA,20151130,Spain's Telefonica aims to grow revenues  core profits and cash flow ,MADRID  Nov 30 Spain's Telefonica plans to grow revenues  core profits and cash flow in the years to 2020  Chairman Cesar Alierta said on Monday.,topStory
TEVA,Teva Pharmaceutical Industries Limited,20151130,Teva to partner with Takeda to bring generic drugs to Japan ,JERUSALEM  Nov 30 Israel's Teva Pharmaceutical  has agreed a deal with Osaka-based Takeda to bring its portfolio of generic drugs to Japan  where a rapidly aging population is in need of affordable medications.,topStory
TMO,Thermo Fisher Scientific Inc,20151130,Fitch Rates Thermo Fisher's Senior Notes 'BBB'; Outlook Stable ,(The following statement was released by the rating agency) NEW YORK  November 30 (Fitch) Fitch Ratings has assigned a 'BBB' rating to  Thermo Fisher Scientific Inc.'s (Thermo Fisher) USD800 million 3- and 10-year  senior notes offering. The proceeds of the issue will be used to redeem the  outstanding $900 million aggregate principal amount of the company's 3.20%  senior notes due March 1  2016. The Rating Outlook is Stable. The ratings apply to $13.2 billion of debt at Sept. 26  2015. The rati,topStory
TM,Toyota Motor Corp Ltd Ord,20151130,UPDATE 2-Foreign carmakers to keep price edge as Ford faces higher labor costs ,DETROIT  Nov 30 Foreign automakers with plants in the United States will be able to offer lower vehicle prices as Ford Motor Co faces continued higher labor costs under a new four-year contract with its U.S. union workers.,normal
VALE,VALE SA,20151130,Vale CEO Ferreira quits as chairman of Brazil's Petrobras ,SAO PAULO Murilo Ferreira quit as chairman of Brazil's Petroleo Brasileiro SA  the state-controlled oil company said on Monday  without disclosing the reason for his decision.,topStory
VALE,VALE SA,20151130,Britain's FTSE lags euro zone  pulled down by BHP and Aberdeen ,* Aberdeen AM down on emerging market outflows   (Updates prices),normal
VALE,VALE SA,20151130,Britain's FTSE lags euro zone  pulled down by BHP and Aberdeen ,* Aberdeen AM down on emerging market outflows   (Recasts  adds quote  detail),normal
VALE,VALE SA,20151130,UPDATE 1-Vale CEO Ferreira quits as chairman of Brazil's Petrobras ,SAO PAULO  Nov 30 Murilo Ferreira quit as chairman of Brazil's Petroleo Brasileiro SA  the state-controlled oil company said on Monday  without disclosing the reason for his decision.,normal
VALE,VALE SA,20151130,BHP shares sink on Brazil's plan to sue over mine disaster ,SYDNEY/LONDON BHP Billiton shares dropped more than 5 percent to a seven-year low on Monday after Brazil announced plans to sue the mining company and its partners for 20 billion reais ($5.2 billion) over the bursting of a dam.,normal
VALE,VALE SA,20151130,Vale CEO Ferreira quits as chairman of Brazil's Petrobras ,SAO PAULO  Nov 30 Murilo Ferreira has quit as chairman of Brazilian state-controlled Petroleo Brasileiro SA  the company said on Monday  without disclosing the reason for his decision.,normal
VALE,VALE SA,20151130,UPDATE 1-BHP shares sink on Brazil's plan to sue over mine disaster ,SYDNEY/LONDON  Nov 30 BHP Billiton  shares dropped more than 5 percent to a seven-year low on Monday after Brazil announced plans to sue the mining company and its partners for 20 billion reais ($5.2 billion) over the bursting of a dam.,normal
VALE,VALE SA,20151130,Britain's FTSE edges lower  pulled down by BHP and Aberdeen ,LONDON  Nov 30 Britain's top share index edged lower on Monday  with mining company BHP Billiton falling on the prospect of a hefty fine in Brazil and Aberdeen Asset Management slipping after it reported outflows from its emerging market funds.,normal
VALE,VALE SA,20151130,BHP names chairman  board members to oversee Samarco disaster ,SYDNEY  Nov 30 BHP Billiton   said on Monday its chairman and three other board members would oversee its response to the Samarco mine disaster in Brazil as clean-up efforts continue amid confirmation arsenic had been found in river water.,normal
WHR,Whirlpool Corporation,20151130,Case to Watch: Whirlpool to defend 'moldy washer' bellwether verdict ,Whirlpool is headed to a federal appeals court in Ohio to try to thwart a bid to overturn its class-action trial victory against a class of Ohio consumers who said its front-loading washers had a defect that made them prone to develop a smelly mold.,topStory
