SRE,Sempra Energy,20150702,INSIGHT-California's push for cleaner buses could edge out natural gas ,LOS ANGELES  July 2 Fifteen years ago  California led the way to cleaner transit buses with strict tailpipe emissions standards that effectively ushered out diesel as the primary fuel for buses in the state and replaced it with natural gas.,normal
BID,Sotheby&#39;s,20150702,Sotheby's sees record London contemporary art sale despite Bacon failure ,LONDON Andy Warhol's "One Dollar"  the first in his dollar bill series  fetched 20.9 million pounds ($32.4 million) at Sotheby's on Wednesday  the top-seller in what the auction house said was its highest ever total sales for an auction of contemporary art in London. | Video ,topStory
S,Sprint Corporation,20150702,Dixons Carphone in deal with Sprint to open U.S. stores ,LONDON British electrical goods and mobile phone retailer Dixons Carphone  has sealed a deal with Sprint Corp.   the U.S. mobile network operator  that could see it open and manage up to 500 Sprint-branded stores in the United States.,topStory
S,Sprint Corporation,20150702,UPDATE 1-Dixons Carphone in deal with Sprint to open U.S. stores ,LONDON  July 2 British electrical goods and mobile phone retailer Dixons Carphone has sealed a deal with Sprint Corp.  the U.S. mobile network operator  that could see it open and manage up to 500 Sprint-branded stores in the United States.,normal
S,Sprint Corporation,20150702,Dixons Carphone unit in deal with Sprint Corp to open U.S. stores ,LONDON  July 2 British electrical goods and mobile phone retailer Dixons Carphone said its Connected World Services (CWS) division has signed a deal with Sprint Corp.  the U.S. mobile network operator  to open and manage Sprint-branded stores in the U.S..,normal
S,Sprint Corporation,20150702,BRIEF-Dixons Carphone arm in deal with Sprint Corp to open U.S. stores ,* Connected World Services signs agreement with Sprint Corporation to open U.S. stores.,normal
TGNA,TEGNA Inc,20150702,BRIEF-Cxense signs contract with US media company Gannett ,* Contract includes Cxense insight  Cxense DMP  and Cxense Content,topStory
TDOC,Teladoc Inc,20150702,Wall St. edged down on Greece worries  tepid U.S. data ,U.S. stocks closed down slightly on Thursday after the International Monetary Fund warned Greece ahead of its Sunday referendum that it faces a huge financial hole  and mixed jobs data dampened the U.S. economic outlook.,topStory
TI,Telecom Italia SPA,20150702,JP Morgan has 7 percent of Telecom Italia as part of Telefonica bond deal ,MILAN U.S. investment bank JP Morgan  has a 7 percent stake in Telecom Italia  as part of a deal with Spain's Telefonica   according to a filing by Italian market watchdog Consob.,topStory
TI,Telecom Italia SPA,20150702,JP Morgan has 7 pct of Telecom Italia as part of Telefonica bond deal ,MILAN  July 2 U.S. investment bank JP Morgan  has a 7 percent stake in Telecom Italia as part of a deal with Spain's Telefonica  according to a filing by Italian market watchdog Consob.,normal
TEF,Telefonica SA,20150702,JP Morgan has 7 percent of Telecom Italia as part of Telefonica bond deal ,MILAN U.S. investment bank JP Morgan  has a 7 percent stake in Telecom Italia  as part of a deal with Spain's Telefonica   according to a filing by Italian market watchdog Consob.,topStory
TEF,Telefonica SA,20150702,JP Morgan has 7 pct of Telecom Italia as part of Telefonica bond deal ,MILAN  July 2 U.S. investment bank JP Morgan  has a 7 percent stake in Telecom Italia as part of a deal with Spain's Telefonica  according to a filing by Italian market watchdog Consob.,normal
TM,Toyota Motor Corp Ltd Ord,20150702,CORRECTED-UPDATE 4-Strong truck  SUV demand helped Ford  GM raise prices in June ,* GM  Ford  Toyota report drop in car sales  rise in SUV sales,topStory
TM,Toyota Motor Corp Ltd Ord,20150702,UPDATE 1-Toyota prices 'Model AA' shares at top of range as investors flock ,* Underwriter Nomura sees strong demand from retail investors,normal
TM,Toyota Motor Corp Ltd Ord,20150702,Toyota prices 'Model AA' shares at 30 pct premium as investors flock ,TOKYO  July 2 Toyota Motor Corp set the price for its "Model AA" class stock at about a 30 percent premium  a regulatory filing showed  as retail investors flocked to the no-risk shares that the automaker hopes will help it secure longer-term shareholders.,normal
TM,Toyota Motor Corp Ltd Ord,20150702,Nikkei gains more than 1 pct; automakers up on strong U.S. sales  weak yen ,* Nissan outperforms peers after posting outstanding U.S. sales     * Construction stocks attract buy on strong domestic demand hope      By Ayai Tomisawa     TOKYO  July 2 Japan's Nikkei share average rose more than 1 percent on Thursday  led by automakers which reported strong June sales in the U.S. market  and broadly supported by a weaker yen.     The Nikkei share average gained 1.2 percent to 20 568.65 by mid-morning.     The market has been pressure by Greece's festering debt c,normal
UN,Unilever NV,20150702,Deals of the day- Mergers and acquisitions ,July 2 The following bids  mergers  acquisitions and disposals were reported by 2000 GMT on Thursday:,topStory
UN,Unilever NV,20150702,Unilever to acquire Murad to expand skincare business ,LONDON Anglo-Dutch consumer goods giant Unilever  is to buy U.S. skincare company Murad  its fourth premium skincare deal in recent months.,normal
UN,Unilever NV,20150702,Unilever to acquire Murad to expand skincare business ,LONDON  July 2 Anglo-Dutch consumer goods giant Unilever is to buy U.S. skincare company Murad  its fourth premium skincare deal in recent months.,normal
UMC,United Microelectronics Corporation,20150702,BRIEF-UMC's unit orders machinery equipment worth T$2.03 bln ,* Says unit United Semiconductor (Xiamen) Co Ltd orders machinery equipment worth T$2.03 billion ($65.66 million) from ASML Hong Kong Ltd,topStory
UNH,UnitedHealth Group Incorporated,20150702,UPDATE 3-Health insurer Centene adds muscle with $6.3 bln Health Net deal ,* Deal to create leader in government health insurance programs,normal
VRX,Valeant Pharmaceuticals International Inc,20150702,CANADA STOCKS-TSX climbs as investors seek safety in defensive shares ,OTTAWA  July 2 Canada's main stock index rose on Thursday as market choppiness due to uncertainty in Greece sent investors looking for safety in healthcare shares and other defensive sectors  offsetting weakness in commodity-sensitive stocks.,topStory
VRX,Valeant Pharmaceuticals International Inc,20150702,CANADA STOCKS-TSX rises as investors buy up defensive shares ,OTTAWA  July 2 Canada's main stock index rose modestly on Thursday as investors pushed into healthcare shares and other defensive sectors  offsetting weakness in commodity-sensitive stocks.,normal
YELP,Yelp Inc,20150702,Deals of the day- Mergers and acquisitions ,July 2 The following bids  mergers  acquisitions and disposals were reported by 2000 GMT on Thursday:,topStory
YELP,Yelp Inc,20150702,Yelp temporarily decides not to pursue a sale: Bloomberg ,Yelp Inc  operator of consumer review website yelp.com  had temporarily decided not to pursue a sale  Bloomberg reported  citing people with knowledge of the matter.,normal
YELP,Yelp Inc,20150702,CORRECTED-Yelp temporarily decides not to pursue a sale - Bloomberg ,July 2 Yelp Inc  operator of consumer review website yelp.com  had temporarily decided not to pursue a sale  Bloomberg reported  citing people with knowledge of the matter.,normal
