TRNO,Terreno Realty Corporation,20171201,BRIEF-Terreno Realty Corp Acquires Property In Carson  CA For $12.9 Mln ,* TERRENO REALTY CORPORATION ACQUIRES PROPERTY IN CARSON  CA FOR $12.9 MILLION Source text for Eikon: Further company coverage:,topStory
NDP,Tortoise Energy Independence Fund Inc,20171201,BRIEF-Tortoise Energy Independence Fund Says As Of Nov. 30  Unaudited Total Assets Were About $255.3 Million ,* TORTOISE ENERGY INDEPENDENCE FUND  INC. PROVIDES UNAUDITED PRELIMINARY BALANCE SHEET INFORMATION AND ASSET COVERAGE RATIO UPDATE AS OF NOV. 30  2017,topStory
NTG,Tortoise MLP Fund Inc,20171201,BRIEF-Tortoise MLP Fund  Inc. Provides Unaudited Preliminary Balance Sheet Information And Asset Coverage Ratio Update ,* TORTOISE MLP FUND  INC. PROVIDES UNAUDITED PRELIMINARY BALANCE SHEET INFORMATION AND ASSET COVERAGE RATIO UPDATE AS OF NOV. 30  2017,topStory
TTP,Tortoise Pipeline & Energy Fund Inc,20171201,BRIEF-Tortoise Pipeline & Energy Fund Provides Unaudited Preliminary Balance Sheet Information And Asset Coverage Ratio Update ,* TORTOISE PIPELINE & ENERGY FUND  INC. PROVIDES UNAUDITED PRELIMINARY BALANCE SHEET INFORMATION AND ASSET COVERAGE RATIO UPDATE AS OF NOV. 30  2017,topStory
TM,Toyota Motor Corp Ltd Ord,20171201,TABLE- Top 20 vehicles sold in U.S. in November ,    Dec 1 The following are the 20 top-selling vehicles in the U.S. in November as reported by the automakers and ranked by total units.      Top 20 selling vehicles in the U.S. in November:        RANK   VEHICLE                       Nov-17      Nov-16   PCT CHNG  1      Ford F-Series P/U             72 769      72 089       +0.9  2      Chevy Silverado-C/K P/U       46 441      45 280       +2.6  3      Ram P/U                       36 714      36 885       -0.5  4      Toyota Camr,topStory
TRP,TransCanada Corporation,20171201,TransCanada hikes some tariffs on Keystone pipeline: FERC ,NEW YORK TransCanada Corp has raised some rates for committed and spot shippers on its Keystone crude oil pipeline effective from Jan. 1  according to a filing with the U.S. Federal Energy Regulatory Commission on Friday.,topStory
TREC,Trecora Resources,20171201,BRIEF-Fahad Mohammad Saleh Al-Athel Sells 30 000 Shares Of Trecora Resources Common Stock ,* FAHAD MOHAMMAD SALEH AL-ATHEL REPORTS OPEN MARKET SALE OF 30 000 SHARES OF TRECORA RESOURCES COMMON STOCK ON NOV 30 AT $12.54 PER SHARE - SEC FILING‍​ Source text: (http://bit.ly/2AvDNEm) Further company coverage:,topStory
UAL,United Continental Holdings Inc,20171201,BRIEF-United Continental Holdings Inc Files For A Potential Mixed Shelf Offering ‍​ ,* UNITED CONTINENTAL HOLDINGS INC FILES FOR A POTENTIAL MIXED SHELF OFFERING; SIZE UNDISCLOSED - SEC FILING ‍​ Source text - (http://bit.ly/2BAVDTY) Further company coverage:,topStory
UPS,United Parcel Service Inc,20171201,BRIEF-Isuzu Motors India To Hike Prices Of Pick-Ups And SUV From 01 Jan 2018 ,* ISUZU MOTORS INDIA TO INCREASE PRICES OF PICK-UPS AND SUV FROM 01 JANUARY 2018,topStory
URI,United Rentals Inc,20171201,BRIEF-United Rentals Says Co  Units Entered Into Amendment No. 7 To Third Amended & Restated Receivables Purchase Agreement ,* UNITED RENTALS INC - ON DECEMBER 1  CO  UNITS ENTERED INTO AMENDMENT NO. 7 TO THIRD AMENDED & RESTATED RECEIVABLES PURCHASE AGREEMENT,topStory
DIS,Walt Disney Company (The),20171201,Too cold for a theme park  Disney looks to toy stores in Russia ,MOSCOW Though too cold for a theme park  Russia's underserved toy market makes it an attractive business prospect for Walt Disney Co   the head of its Russian operations said on Friday.,topStory
DIS,Walt Disney Company (The),20171201,Too cold for a theme park  Disney looks to toy stores in Russia ,MOSCOW  Dec 1 Though too cold for a theme park  Russia's underserved toy market makes it an attractive business prospect for Walt Disney Co  the head of its Russian operations said on Friday.,normal
WAC,Walter Investment Management Corp,20171201,BRIEF-Walter Investment Management Files Prepackaged Chapter 11 Plan ,* WALTER INVESTMENT MANAGEMENT CORP. FILES PREPACKAGED CHAPTER 11 PLAN TO CONTINUE IMPLEMENTATION OF ITS PREVIOUSLY ANNOUNCED FINANCIAL RESTRUCTURING,topStory
WFC,Wells Fargo & Company,20171201,In a push upmarket  Wells Fargo gives top brokers raises in 2018 ,NEW YORK  Dec 1 Wells Fargo & Co is giving its top brokers and advisory teams as much as a $40 000 raise next year in a broad strategy to go after wealthier clients  company executives said Friday.,normal
WMLP,Westmoreland Resource Partners LP,20171201,BRIEF-Westmoreland Resource Partners Says Co Entered Into Fourth Amendment To Services Agreement ,* WESTMORELAND RESOURCE PARTNERS SAYS ‍ON NOV 30  CO ENTERED INTO FOURTH AMENDMENT TO SERVICES AGREEMENT DATED AS OF JANUARY 1  2015 - SEC FILING​,topStory
WIT,Wipro Limited,20171201,India's Wipro faces lawsuit by National Grid US ,Wipro Ltd   India's No.3 software exporter  said on Friday that it would challenge a lawsuit filed by National Grid US seeking damages of over $140 million related to a project that dates back to 2009.,topStory
WIT,Wipro Limited,20171201,UPDATE 1-India's Wipro faces lawsuit by National Grid US ,Dec 1 Wipro Ltd  India's No.3 software exporter  said on Friday that it would challenge a lawsuit filed by National Grid US seeking damages of over $140 million related to a project that dates back to 2009.,normal
WIT,Wipro Limited,20171201,India's Wipro faces lawsuit from National Grid US ,Dec 1 Wipro Ltd  India's No.3 software exporter  said on Friday that it would challenge a lawsuit filed by National Grid US seeking damages of over $140 million related to a project that dates back to 2009.,normal
WIT,Wipro Limited,20171201,BRIEF-Wipro Subject Of Litigation With Customer Relating‍​ To ERP Implementation Project ,* SAYS CO IS SUBJECT OF LITIGATION WITH CUSTOMER RELATING‍​ TO ERP IMPLEMENTATION PROJECT  WHICH BEGAN IN 2009,normal
WPX,WPX Energy Inc,20171201,BRIEF-WPX Energy Named Clay Gaspar As President ,* WPX ENERGY INC - NAMED CLAY GASPAR AS PRESIDENT EFFECTIVE DEC. 1  2017  IN ADDITION TO HIS CURRENT ROLE AS COMPANY'S CHIEF OPERATING OFFICER Source text for Eikon: Further company coverage:,topStory
WPXP,WPX Energy Inc,20171201,BRIEF-WPX Energy Named Clay Gaspar As President ,* WPX ENERGY INC - NAMED CLAY GASPAR AS PRESIDENT EFFECTIVE DEC. 1  2017  IN ADDITION TO HIS CURRENT ROLE AS COMPANY'S CHIEF OPERATING OFFICER Source text for Eikon: Further company coverage:,topStory
XIN,Xinyuan Real Estate Co Ltd,20171201,BRIEF-Xinyuan Real Estate Co.  Ltd. Announces Issuance Of Us$100 Million Of 8.875% Senior Notes Due 2020 ,* XINYUAN REAL ESTATE CO.  LTD. ANNOUNCES ISSUANCE OF US$100 MILLION OF 8.875% SENIOR NOTES DUE 2020 Source text for Eikon: Further company coverage:,topStory
YUM,Yum! Brands Inc,20171201,Australian delivery software startup inks Amazon  Yum deals; shares leap ,An Australian software startup said it signed global deals with Amazon.com Inc  and Yum! Brands Inc   sending its shares soaring and enriching its ex-footballer founders amid hopes the firm would benefit from its clients' vast reach.,topStory
YUM,Yum! Brands Inc,20171201,UPDATE 2-Australian delivery software startup inks Amazon  Yum deals; shares leap ,* Expects over 250 mln deliveries a year through Yum deal (Recasts; adds investor comment  company background),normal
YUM,Yum! Brands Inc,20171201,Australia's GetSwift shares surge after deals with Amazon.com  Yum Brands ,Dec 1 Australian logistics company GetSwift Ltd said on Friday it had entered into an agreement with Amazon.com Inc and a multi-year partnership with Yum Brands Inc  sending its share up sharply.,normal
BAA,BANRO CORPORATION,20171201,BRIEF-Banro Exercises Contractual Right To Defer Interest Payment On Secured Notes ,* BANRO ANNOUNCES EXERCISE OF CONTRACTUAL RIGHT TO DEFER INTEREST PAYMENT ON SECURED NOTES,topStory
UQM,UQM Technologies Inc,20171201,BRIEF-UQM Technologies signs joint venture agreement with China National Heavy Duty Truck Group ,* ‍UQM TECHNOLOGIES- INITIAL TOTAL CAPITAL OF JOINT VENTURE WILL BE $24 MILLION  WITH UQM CONTRIBUTING $6 MILLION IN THREE INSTALLMENTS OVER NEXT YEAR ​,topStory
