RBPAA,Royal Bancshares of Pennsylvania Inc,20171201,BRIEF-Bryn Mawr Bank Corp Receives Regulatory Approval For The Acquisition Of Royal Bancshares Of Pennsylvania ,* BRYN MAWR BANK CORPORATION RECEIVES REGULATORY APPROVAL FOR THE ACQUISITION OF ROYAL BANCSHARES OF PENNSYLVANIA  INC.,topStory
RYAAY,Ryanair Holdings plc,20171201,UPDATE 1-Ryanair seeks aircraft slots at Berlin-Tegel airport ,* EasyJet says looks forward to offering Tegel connections (Adds further Ryanair comment  easyJet comment  background),topStory
RYAAY,Ryanair Holdings plc,20171201,Ryanair seeks aircraft slots at Berlin-Tegel airport ,FRANKFURT  Dec 1 Ryanair said it had applied for slots to base nine aircraft at Berlin-Tegel airport to further cement its position in Germany's capital and compete with rival easyJet  which took over parts of Air Berlin's Tegel operations.,normal
SANW,S&W Seed Company,20171201,BRIEF-S&W Seed Says ‍On Nov 30  Co Entered Secured Note Financing Transaction With Conterra Agricultural Capital LLC For $12.5 Mln ,* S&W SEED SAYS ‍ON NOV 30  CO ENTERED SECURED NOTE FINANCING TRANSACTION WITH CONTERRA AGRICULTURAL CAPITAL LLC FOR $12.5 MILLION - SEC FILING​,topStory
STKL,SunOpta Inc,20171201,BRIEF-Prosten Health Holdings Says Brilliant Chapter Acquires Stake in Co ,* ‍DYNAMIC PEAK LIMITED TO SELL 294.3 MILLION SHARES OF CO TO BRILLIANT CHAPTER LIMITED FOR HK$82.4 MILLION ​,topStory
TESO,Tesco Corporation,20171201,BRIEF-Tesco Corp Shareholders Vote To Approve Acquisition By Nabors ,* TESCO CORPORATION SHAREHOLDERS VOTE TO APPROVE ACQUISITION BY NABORS,topStory
TSLA,Tesla Inc ,20171201,Germany removes Tesla from subsidies list as too pricey ,BERLIN A German government agency has removed Tesla from the list of electric cars eligible for subsidies  sparking a row with the U.S. company over whether its Model S is too expensive to qualify for the scheme.,topStory
TSLA,Tesla Inc ,20171201,UPDATE 1-Germany removes Tesla from subsidies list as too pricey ,* Tesla denies this  says drivers can buy no-frills version (Recasts  adds Tesla response  background on subsidy programme),normal
TSLA,Tesla Inc ,20171201,BRIEF-Tesla denies Model S base version not available in Germany ,* SAYS IT IS "COMPLETELY FALSE" THAT ITS MODEL S IS NOT AVAILABLE IN BASE VERSION IN GERMANY Further company coverage:,normal
TSLA,Tesla Inc ,20171201,Tesla switches on giant battery to shore up Australia's grid ,HORNSDALE  Australia Tesla Inc switched on the world's biggest lithium ion battery on Friday in time to feed Australia's shaky power grid for the first day of summer  meeting a promise by Elon Musk to build it in 100 days or give it free. | Video ,normal
TSLA,Tesla Inc ,20171201,Tesla switches on giant battery to shore up Australia's grid ,HORNSDALE  Australia  Dec 1 Tesla Inc switched on the world's biggest lithium ion battery on Friday in time to feed Australia's shaky power grid for the first day of summer  meeting a promise by Elon Musk to build it in 100 days or give it free.,normal
CG,The Carlyle Group LP,20171201,Nippon Life to buy 25 percent of U.S. asset manager TCW from Carlyle ,TOKYO Nippon Life Insurance Co has reached a deal to acquire 24.75 percent of U.S. investment firm TCW Group Inc from U.S. asset manager Carlyle Group LP   the companies said on Friday.,topStory
CG,The Carlyle Group LP,20171201,UPDATE 2-Nippon Life to buy 25 pct of U.S. asset manager TCW from Carlyle ,* Comes as Japan finance firms seek asset manager deals (Adds details on Carlyle investment),normal
CG,The Carlyle Group LP,20171201,BRIEF-TCW Group Says Nippon Life To Acquire 24.75 Pct Stake In Co From Carlyle Group ,* NIPPON LIFE INSURANCE COMPANY TO MAKE STRATEGIC INVESTMENT IN TCW GROUP,normal
TCGP,The Carlyle Group LP,20171201,Nippon Life to buy 25 percent of U.S. asset manager TCW from Carlyle ,TOKYO Nippon Life Insurance Co has reached a deal to acquire 24.75 percent of U.S. investment firm TCW Group Inc from U.S. asset manager Carlyle Group LP   the companies said on Friday.,topStory
TCGP,The Carlyle Group LP,20171201,UPDATE 2-Nippon Life to buy 25 pct of U.S. asset manager TCW from Carlyle ,* Comes as Japan finance firms seek asset manager deals (Adds details on Carlyle investment),normal
TCGP,The Carlyle Group LP,20171201,BRIEF-TCW Group Says Nippon Life To Acquire 24.75 Pct Stake In Co From Carlyle Group ,* NIPPON LIFE INSURANCE COMPANY TO MAKE STRATEGIC INVESTMENT IN TCW GROUP,normal
TSG,The Stars Group Inc,20171201,BRIEF-Stars Group Files For Mixed Shelf Of Up To $3 Billion ,* STARS GROUP INC FILES FOR MIXED SHELF OF UP TO $3.0 BILLION - SEC FILING‍​ Source text: [http://bit.ly/2j6i8IW] Further company coverage:,topStory
ULTA,Ulta Beauty Inc,20171201,Ulta Beauty fades as growth story seen showing cracks ,Dec 1 Ulta Beauty Inc shares dipped 9 percent on Friday after the cosmetics retailer gave a disappointing earnings forecast for the crucial holiday selling season  bruised by higher discounts and mounting competition.,topStory
WEN,Wendy&#39;s Company (The),20171201,BRIEF-Wendy's And Doordash Announce New Delivery Partnership ,* WENDY'S AND DOORDASH ANNOUNCE NEW DELIVERY PARTNERSHIP Source text for Eikon: Further company coverage:,topStory
WDC,Western Digital Corporation,20171201,Toshiba  Western Digital nearing deal over chip unit sale dispute: media ,TOKYO Toshiba Corp  and Western Digital Corp  are close to settling a legal dispute that has threatened to become a major stumbling block in the embattled Japanese conglomerate's plans to sell its $18 billion semiconductor unit  media reported. | Video ,topStory
WDC,Western Digital Corporation,20171201,UPDATE 1-Toshiba  Western Digital nearing deal over chip unit sale dispute - media ,* Toshiba's shares up 1.8 pct (Recasts with additional report from Jiji news agency),normal
WDC,Western Digital Corporation,20171201,BRIEF-Toshiba: Always Open For Settlement With Western Digital  But Nothing Concrete Decided Yet ,* ALWAYS OPEN FOR SETTLEMENT WITH WESTERN DIGITAL  BUT NOTHING CONCRETE DECIDED YET Further company coverage: (Reporting by Sam Nussey),normal
WDC,Western Digital Corporation,20171201,Toshiba  Western Digital to settle dispute - Bloomberg ,Nov 30 Toshiba Corp and Western Digital Corp are said to be close to settling their legal dispute  Bloomberg reported on Thursday.,normal
WDC,Western Digital Corporation,20171201,BRIEF-Toshiba Near Resolution To Dispute With Western Digital - Bloomberg  Citing Sources ,* TOSHIBA NEAR RESOLUTION TO DISPUTE WITH WESTERN DIGITAL - BLOOMBERG  CITING SOURCES Source text: https://bloom.bg/2ke8GGP Further company coverage:,normal
WINS,Wins Finance Holdings Inc,20171201,BRIEF-Wins Finance Holdings To Resume Trading On Nasdaq ,* WINS FINANCE HOLDINGS INC - ‍EXPECTS THAT ITS ORDINARY SHARES WILL RESUME TRADING ON NASDAQ STOCK MARKET ON DECEMBER 4  2017​ Source text for Eikon: Further company coverage:,topStory
YGYI,Youngevity International Inc,20171201,BRIEF-Youngevity International Files For Offering Of Up To $10 Million Of Co's Series B Convertible Preferred Stock ,* YOUNGEVITY INTERNATIONAL INC FILES FOR OFFERING OF UP TO $10 MILLION OF CO'S SERIES B CONVERTIBLE PREFERRED STOCK ON A BEST EFFORTS BASIS - SEC FILING Source text : (http://bit.ly/2AiovCi) Further company coverage:,topStory
AET,Aetna Inc,20171201,Exclusive: CVS eyes major expansion of health clinics with Aetna deal - sources ,NEW YORK CVS Health Corp  is planning to significantly expand health services at its retail pharmacies if it completes a more than $66 billion deal for insurer Aetna Inc   a move that could save more than $1 billion annually  people familiar with the matter said.,topStory
BABA,Alibaba Group Holding Limited,20171201,BRIEF-China Vanke's unit to set up fund worth 7.5 bln yuan with Alibaba's venture capital affiliate  partners ,* SAYS UNIT INVESTS 1.05 BILLION YUAN  ($158.92 million) TO SET UP CULTURAL INVESTMENT FUND WORTH 7.5 BILLION YUAN WITH PARTNERS INCLUDING ALIBABA'S VENTURE CAPITAL AFFILIATE Source text in Chinese: http://bit.ly/2noeW02 Further company coverage: ($1 = 6.6070 Chinese yuan renminbi) (Reporting by Hong Kong newsroom),topStory
BABA,Alibaba Group Holding Limited,20171201,ASIA CREDIT CLOSE- Alibaba's long end outperforms ,HONG KONG  Dec 1 (IFR) - Alibaba's bonds of 20  30 and 40 years continued to find buyers in secondary trade  versus the notes of 5.5 and 10 years  which were less popular due to tight pricing.,normal
AGN,Allergan plc,20171201,Tech firms tell patent court to ignore Allergan deal with tribe ,Over 30 technology companies including Alphabet Inc   Amazon.com Inc  and Facebook Inc.  on Friday urged a U.S. patent court to disregard drugmaker Allergan Plc's  contention that its transfer of some of its patents to a Native American tribe shields them from the court's review.,topStory
AGN,Allergan plc,20171201,Tech firms tell patent court to ignore Allergan deal with tribe ,Dec 1 Over 30 technology companies including Alphabet Inc  Amazon.com Inc and Facebook Inc. on Friday urged a U.S. patent court to disregard drugmaker Allergan Plc's contention that its transfer of some of its patents to a Native American tribe shields them from the court's review.,normal
AMOV,America Movil SAB de CV,20171201,UPDATE 1-Slim's America Movil acquires some 2018-2024 Olympics TV rights ,MEXICO CITY  Nov 30 Mexican telecommunications firm America Movil said on Thursday that it had acquired the rights to show the Olympic Games from 2018 to 2024 in some Latin American countries  marking the company's latest bid to boost its presence in television.,topStory
AMX,America Movil SAB de CV,20171201,UPDATE 1-Slim's America Movil acquires some 2018-2024 Olympics TV rights ,MEXICO CITY  Nov 30 Mexican telecommunications firm America Movil said on Thursday that it had acquired the rights to show the Olympic Games from 2018 to 2024 in some Latin American countries  marking the company's latest bid to boost its presence in television.,topStory
AWI,Armstrong World Industries Inc,20171201,BRIEF-Armstrong World Industries Says Entered A Consent Between Co  Units  Others  Amending Existing Amended Agreement  Dated As Of April 1  2016​ ,* ARMSTRONG WORLD INDUSTRIES- ‍ON NOV 27  CO ENTERED A CONSENT BETWEEN CO  UNITS  OTHERS  AMENDING EXISTING AMENDED AGREEMENT  DATED AS OF APRIL 1  2016​,topStory
AJG,Arthur J Gallagher & Co,20171201,BRIEF-Arthur J. Gallagher & Co Acquires Weiss Insurance Agencies ,* ARTHUR J. GALLAGHER & CO. ACQUIRES WEISS INSURANCE AGENCIES  INC.,topStory
T,AT&T Inc,20171201,Federal Circuit nixes network patent asserted against AT&T and Sprint ,A federal appeals court on Thursday ruled invalid a patent AIP Acquisition LLC has asserted against major telecom companies.,topStory
BHGE,Baker Hughes a GE company,20171201,BRIEF-Valueact Capital Management LP Reports 4.5 Pct Stake In Baker Hughes A GE Co As Of Nov 29 ,* VALUEACT CAPITAL MANAGEMENT LP REPORTS 4.5 PERCENT STAKE IN BAKER HUGHES A GE CO AS OF NOVEMBER 29 VERSUS A STAKE OF 7.3 P‍​CT AS OF JULY 28 - SEC FILING Source text: [http://bit.ly/2i8TK8O] Further company coverage:,topStory
SAN,Banco Santander SA,20171201,Santander sells TotalBank to Chile's BCI for $528 million ,MADRID  Dec 1 Banco Santander said on Friday it had sold its U.S. unit Totalbank to Chile's BCI for $528 million as part of moves to sell non-core assets it inherited when it bought Banco Popular.,topStory
BAC,Bank of America Corporation,20171201,UPDATE 1-Mednax fielding takeover interest from buyout firms -sources ,Dec 1 Mednax Inc  a U.S. healthcare network operator targeted by activist hedge fund Elliott Management Corp  is fielding acquisition interest from several private equity firms  according to people familiar with the matter.,normal
BCS,Barclays PLC,20171201,BRIEF-Barclays To Cut Stake In Barclays Africa To 14.9 Pct ,* ‍REDUCTION OF BARCLAYS' SHAREHOLDING IN BARCLAYS AFRICA GROUP LIMITED​,topStory
ABX,Barrick Gold Corporation,20171201,BRIEF-Barrick Announces Investment In Reunion Gold Corporation ,* BARRICK ANNOUNCES INVESTMENT IN REUNION GOLD CORPORATION Source text for Eikon: Further company coverage:,topStory
BIG,Big Lots Inc,20171201,BRIEF-Big Lots Reports Q3 EPS Of $0.10 Per Share ,* SEES FY 2017 ADJUSTED NON-GAAP EARNINGS PER SHARE $4.23 TO $4.28,topStory
APRN,Blue Apron Holdings Inc,20171201,US STOCKS-Wall St lower as deficit concerns stall tax bill progress ,* Indexes down: Dow 0.1 pct  S&P 0.07 pct  Nasdaq 0.28 pct (Updates to open),topStory
APRN,Blue Apron Holdings Inc,20171201,US STOCKS-Deficit doubts on tax bill cool Wall Street rally ,* Futures down: Dow 5 pts  S&P 2.75 pts  Nasdaq 24 pts (Adds comment  details on companies  updates prices),normal
BR,Broadridge Financial Solutions Inc,20171201,BRIEF-Pamela Carter Elected To The Board Of Directors Of Broadridge ,* PAMELA L. CARTER ELECTED TO THE BOARD OF DIRECTORS OF BROADRIDGE,topStory
COF,Capital One Financial Corporation,20171201,Capital One must face overdraft fee lawsuit: U.S. appeals court ,NEW YORK A federal appeals court on Friday revived a proposed class-action lawsuit accusing Capital One Financial Corp  of imposing illegal overdraft fees on customers.,topStory
COF,Capital One Financial Corporation,20171201,UPDATE 1-Capital One must face overdraft fee lawsuit-U.S. appeals court ,NEW YORK  Dec 1 A federal appeals court on Friday revived a proposed class-action lawsuit accusing Capital One Financial Corp of imposing illegal overdraft fees on customers.,normal
COF,Capital One Financial Corporation,20171201,Capital One must face overdraft fee lawsuit -U.S. appeals court ,NEW YORK  Dec 1 A federal appeals court on Friday revived a proposed class-action lawsuit accusing Capital One Financial Corp of imposing illegal overdraft fees on customers.,normal
BXMT,Capital Trust Inc,20171201,BRIEF-Blackstone Mortgage Trust Announces Pricing Of Public Offering Of Class A Common Stock ,* BLACKSTONE MORTGAGE TRUST ANNOUNCES PRICING OF PUBLIC OFFERING OF CLASS A COMMON STOCK,topStory
CE,Celanese Corporation,20171201,BRIEF-Celanese ‍Files Patent Infringement Lawsuit Against Falken Trade Polska​ ,* ‍FILED A PATENT INFRINGEMENT LAWSUIT IN POLAND AGAINST FALKEN TRADE POLSKA SP. Z O.O. SP.K.​ Source text for Eikon: Further company coverage: (Bengaluru Newsroom: +91 806 749 1136),topStory
CNP,CenterPoint Energy Inc,20171201,BRIEF-CenterPoint Energy Terminated Discussions about Unit's Interest In Enable Midstream ,* CENTERPOINT ENERGY - CO  UNIT TERMINATED DISCUSSIONS REGARDING TRANSACTION ABOUT UNIT'S INTEREST IN ENABLE MIDSTREAM PARTNERS,topStory
CC,Chemours Company (The),20171201,BRIEF-Chemours Updates 2017 Forecast  Provides 2018 Outlook  2020 Key Financial Targets ,* CHEMOURS CO - BOARD OF DIRECTORS AUTHORIZED A $500 MILLION SHARE REPURCHASE PLAN,topStory
CPK,Chesapeake Utilities Corporation,20171201,BRIEF-Chesapeake Utilities Entered $40 Million Credit Agreement With Branch Banking And Trust Company ,* CHESAPEAKE UTILITIES - ON NOV 28  CO ENTERED INTO $40 MILLION COMMITTED UNSECURED  SHORT-TERM CREDIT AGREEMENT WITH BRANCH BANKING AND TRUST COMPANY,topStory
CVX,Chevron Corporation,20171201,Chevron to study Mexican oil block  no drilling seen in first four years ,MEXICO CITY U.S. oil major Chevron Corp will focus on studying the geology of its block in Mexico's deepwater Gulf during the first four-year phase of its contract  rather than drilling new wells  a senior executive said on Thursday.,topStory
CVX,Chevron Corporation,20171201,UPDATE 1-Chevron to study Mexican oil block  no drilling seen in first 4 years ,MEXICO CITY  Nov 30 U.S. oil major Chevron Corp will focus on studying the geology of its block in Mexico's deepwater Gulf during the first four-year phase of its contract  rather than drilling new wells  a senior executive said on Thursday.,normal
CMG,Chipotle Mexican Grill Inc,20171201,BRIEF-Chipotle Says Upon Appointment As Executive Chairman  Steve Ells To Have Annualized Base Salary For Fiscal 2018 Of $900 000 ,* CHIPOTLE SAYS UPON APPOINTMENT AS EXECUTIVE CHAIRMAN  STEVE ELLS TO HAVE ANNUALIZED BASE SALARY FOR FISCAL 2018 OF $900 000 - SEC FILING Source text: [http://bit.ly/2BBGguB] Further company coverage:,topStory
CCO,Clear Channel Outdoor Holdings Inc,20171201,BRIEF-Clear Channel Outdoor Holdings - Co And Iheartcommunications Amended Revolving Promissory Note ,* CLEAR CHANNEL OUTDOOR HOLDINGS - ON NOVEMBER 29  CO AND IHEARTCOMMUNICATIONS AMENDED REVOLVING PROMISSORY NOTE DATED NOVEMBER 10  2005 - SEC FILING,topStory
CIE,Cobalt International Energy Inc,20171201,BRIEF-Cobalt International Energy Elected to Not Make Interest Payment For Convertible Senior Notes ,* COBALT INTERNATIONAL ENERGY-ELECTED TO NOT MAKE INTEREST PAYMENT OF ABT $8.1 MILLION DUE ON DEC 1 FOR OUTSTANDING 2.625% CONVERTIBLE SENIOR NOTES DUE 2019​‍​ Source text: (http://bit.ly/2zDVqOB) Further company coverage:,topStory
CNX,CONSOL Energy Inc,20171201,BRIEF-CNX Resources Says Entered Into Amendment No. 4 With Certain Lenders  Others ,* CNX RESOURCES CORP - ENTERED INTO AMENDMENT NO. 4  DATED AS OF NOVEMBER 27  2017 WITH CERTAIN LENDERS  OTHERS - SEC FILING,topStory
COO,Cooper Companies Inc (The),20171201,BRIEF-The Cooper Companies Acquires Paragon Vision Sciences ,* COOPER COMPANIES - DEAL EXPECTED TO BE NEUTRAL TO EPS IN FISCAL 2018 EXCLUDING ONE-TIME CHARGES AND DEAL-RELATED AMORTIZATION Source text for Eikon: Further company coverage:,topStory
CRY,CryoLife Inc,20171201,BRIEF-Cryolife Says On Dec 1 Co Entered Into A Credit And Guaranty Agreement ,* CRYOLIFE INC SAYS ON DECEMBER 1  2017 CO ENTERED INTO A CREDIT AND GUARANTY AGREEMENT - SEC FILING,topStory
CVS,CVS Health Corporation,20171201,Exclusive: CVS eyes major expansion of health clinics with Aetna deal - sources ,NEW YORK CVS Health Corp  is planning to significantly expand health services at its retail pharmacies if it completes a more than $66 billion deal for insurer Aetna Inc   a move that could save more than $1 billion annually  people familiar with the matter said.,topStory
DECK,Deckers Outdoor Corporation,20171201,Advisory firms split on Deckers' proxy contest vote ,Two proxy advisory firms on Friday weighed in on one of the year's most bitter proxy battles with one backing UGG boot maker Deckers' management and the other giving partial support to activist hedge fund Marcato Capital Management.,topStory
DECK,Deckers Outdoor Corporation,20171201,UPDATE 1-Advisory firms split on Deckers' proxy contest vote ,Dec 1 Two proxy advisory firms on Friday weighed in on one of the year's most bitter proxy battles with one backing UGG boot maker Deckers' management and the other giving partial support to activist hedge fund Marcato Capital Management.,normal
DECK,Deckers Outdoor Corporation,20171201,Proxy advisory firms recommend shareholders back Deckers' nominees ,Dec 1 Deckers Outdoor Corp said on Friday two major independent proxy advisory firms recommended shareholders vote for the footwear maker's board nominees  giving it a leg up in its proxy fight with activist investor Marcato Capital.,normal
DECK,Deckers Outdoor Corporation,20171201,BRIEF-Leading Independent Proxy Advisory Firms Glass Lewis And Iss Recommend Deckers Stockholders Vote Deckers’ White Proxy Card ,* LEADING INDEPENDENT PROXY ADVISORY FIRMS GLASS LEWIS AND ISS RECOMMEND DECKERS STOCKHOLDERS VOTE DECKERS’ WHITE PROXY CARD,normal
D,Dominion Energy Inc,20171201,BRIEF-Dominion Energy Says ‍Sent Blackout Trading Restriction Notice To Its Executive Officers  Directors​ ,* DOMINION ENERGY SAYS ‍SENT BLACKOUT TRADING RESTRICTION NOTICE TO ITS EXECUTIVE OFFICERS  DIRECTORS​ - SEC FILING Source text: [http://bit.ly/2j7D5Dr] Further company coverage:,topStory
DCUD,Dominion Energy Inc,20171201,BRIEF-Dominion Energy Says ‍Sent Blackout Trading Restriction Notice To Its Executive Officers  Directors​ ,* DOMINION ENERGY SAYS ‍SENT BLACKOUT TRADING RESTRICTION NOTICE TO ITS EXECUTIVE OFFICERS  DIRECTORS​ - SEC FILING Source text: [http://bit.ly/2j7D5Dr] Further company coverage:,topStory
DRUA,Dominion Energy Inc,20171201,BRIEF-Dominion Energy Says ‍Sent Blackout Trading Restriction Notice To Its Executive Officers  Directors​ ,* DOMINION ENERGY SAYS ‍SENT BLACKOUT TRADING RESTRICTION NOTICE TO ITS EXECUTIVE OFFICERS  DIRECTORS​ - SEC FILING Source text: [http://bit.ly/2j7D5Dr] Further company coverage:,topStory
DWDP,DowDuPont Inc,20171201,BRIEF-Dow Completes Sale Of Portion Of Its Dow Agrosciences’ Corn Hybrid Seed Business ,* DOW SUCCESSFULLY COMPLETES SALE OF A PORTION OF ITS DOW AGROSCIENCES’ CORN HYBRID SEED BUSINESS TO CITIC AGRI FUND Source text for Eikon: Further company coverage:,topStory
RDY,Dr Reddy&#39;s Laboratories Ltd,20171201,BRIEF-Dr.Reddy's Labs Gets EIR From U.S. FDA ‍​For Facility In Hyderabad ,* SAYS GETS EIR FROM U.S. FDA ‍​FOR CUSTOM PHARMA SERVICES FACILITY IN HYDERABAD Source text - http://bit.ly/2ANfrXj Further company coverage:,topStory
RDY,Dr Reddy&#39;s Laboratories Ltd,20171201,BRIEF-Dr.Reddy's Labs Gets U.S. FDA Nod For Psoriasis Treatment ,* SAYS CO  THROUGH UNIT  GETS NDA NOD FOR PSORIASIS TREATMENT Source text: http://bit.ly/2kd95cA Further company coverage:,normal
ECL,Ecolab Inc,20171201,BRIEF-Ecolab says exchange offer will expire at 11:59 P.M.  New York City Time on December 14  2017 ,* ECOLAB INC - EXCHANGE OFFER WILL EXPIRE AT 11:59 P.M.  NEW YORK CITY TIME  ON DECEMBER 14  2017  UNLESS EXTENDED Source text for Eikon: Further company coverage:,topStory
ENBL,Enable Midstream Partners LP,20171201,BRIEF-CenterPoint Energy Terminated Discussions about Unit's Interest In Enable Midstream ,* CENTERPOINT ENERGY - CO  UNIT TERMINATED DISCUSSIONS REGARDING TRANSACTION ABOUT UNIT'S INTEREST IN ENABLE MIDSTREAM PARTNERS,topStory
ENBL,Enable Midstream Partners LP,20171201,BRIEF-Convergeone Announces Combination With Forum Merger to Become Nasdaq-Listed Co  With Anticipated Enterprise Value Of About $1.2 Bln ,* CONVERGEONE ANNOUNCES COMBINATION WITH FORUM MERGER CORPORATION TO BECOME PUBLICLY LISTED COMPANY,normal
ETM,Entercom Communications Corporation,20171201,BRIEF-Entercom Communications Announces Consent Solicitation for 7.250% Senior Notes Due 2024 ,* ENTERCOM COMMUNICATIONS CORP. ANNOUNCES CONSENT SOLICITATION FOR 7.250% SENIOR NOTES DUE 2024,topStory
XOM,Exxon Mobil Corporation,20171201,Exxon merging oil refining and marketing units ,Exxon Mobil Corp  is merging its refining and marketing divisions to boost profits from its downstream businesses  the first major restructuring under Chief Executive Darren Woods.,topStory
XOM,Exxon Mobil Corporation,20171201,UPDATE 2-Exxon merging oil refining and marketing units ,Dec 1 Exxon Mobil Corp is merging its refining and marketing divisions to boost profits from its downstream businesses  the first major restructuring under Chief Executive Darren Woods.,normal
XOM,Exxon Mobil Corporation,20171201,BRIEF-ExxonMobil Says Increased Annual Salary Of CEO Darren Woods To $1.4 Mln ,* EXXONMOBIL SAYS ON NOV. 29  COMPENSATION COMMITTEE OF BOARD INCREASED ANNUAL SALARY OF CEO DARREN WOODS TO $1.4 MILLION - SEC FILING Source text: (http://bit.ly/2AoNeTA) Further company coverage:,normal
XOM,Exxon Mobil Corporation,20171201,Exxon to merge refining and marketing divisions ,Dec 1 Exxon Mobil Corp said on Friday it would merge its refining and marketing divisions in the first quarter of 2018 and named Bryan Milton president of the combined unit.,normal
XOM,Exxon Mobil Corporation,20171201,BRIEF-ExxonMobil To Merge Refining And Marketing Divisions  Names Milton President ,* EXXONMOBIL TO MERGE REFINING AND MARKETING DIVISIONS  NAMES MILTON PRESIDENT,normal
FE,FirstEnergy Corporation,20171201,BRIEF-FirstEnergy's Ohio Utilities File Proposal to Modernize Electric System and Prepare for Smart Technologies ,* FIRSTENERGY CORP - CO'S OHIO UTILITIES FILED PLAN AT PUBLIC UTILITIES COMMISSION OF OHIO AIMED AT REDUCING FREQUENCY AND DURATION OF POWER OUTAGES,topStory
FLR,Fluor Corporation,20171201,Fluor wins $831 mln contract for Puerto Rico power work -Pentagon ,WASHINGTON  Dec 1 Fluor Enterprises Inc  a subsidiary of Fluor Corp  was awarded an $831 million contract for construction services to help restore electric power to Puerto Rico  the Pentagon said on Friday. Completion date for the time-and-materials contract awarded by the U.S. Army Corps of Engineers with funds from the Department of Homeland Security is Feb. 28  2018  the Pentagon said in a statement. (Reporting by Eric Walsh; Editing by David Alexander),normal
F,Ford Motor Company,20171201,General Motors  Ford report fall in Canada auto sales ,General Motors Co and Ford Motor Co on Friday reported a drop in Canadian auto sales for November.,topStory
F,Ford Motor Company,20171201,UPDATE 1-General Motors  Ford report fall in Canada auto sales ,Dec 1 General Motors Co and Ford Motor Co on Friday reported a drop in Canadian auto sales for November.,normal
F,Ford Motor Company,20171201,Major automakers post mixed November U.S. sales results ,DETROIT  Dec 1 Major automakers posted mixed U.S. November new vehicle sales for November on Friday  with General Motors Co and Fiat Chrysler Automobiles NV (FCA) down largely on lower fleet sales  while Ford Motor Co's sales rose.,normal
F,Ford Motor Company,20171201,BRIEF-Ford U.S. Sales Totaled 210 771 Vehicles For Nov  a 6.7 Pct Gain Over 2016‍​ ,* FORD SALES UP 6.7 PERCENT IN NOVEMBER; F-SERIES ACHIEVES BEST SALES IN 16 YEARS  WHILE FORD SUVS POST BRAND’S BEST NOVEMBER SALES IN 17 YEARS,normal
GCAP,GAIN Capital Holdings Inc,20171201,BRIEF-Gain Capital Launches Bitcoin Trading On City Index ,* GAIN CAPITAL HOLDINGS INC - ‍ANNOUNCED LAUNCH OF BITCOIN TRADING ON CITY INDEX  ITS FCA REGULATED SERVICE IN U.K.​,topStory
