AMZN,Amazoncom Inc,20171201,LPC-Tech disruption hits buyout business models ,Dec 1 Underwriting banks and leveraged loan investors are struggling to analyse the impact of technological disruption on the business models underpinning private equity buyouts  as they try to dodge bullets by avoiding lending to companies that could be rendered obsolete by the ‘Amazon effect’.,topStory
AMZN,Amazoncom Inc,20171201,BRIEF-Getswift Ltd Updates On Deal With Amazon ,* ‍EXTENT OF SERVICES TO BE PROVIDED AND REVENUES TO BE DERIVED WILL BE GENERATED FROM SPECIFIC TRANSACTIONS AGREED WITH AMAZON​,normal
AMZN,Amazoncom Inc,20171201,Australian delivery software startup inks Amazon  Yum deals; shares leap ,An Australian software startup said it signed global deals with Amazon.com Inc  and Yum! Brands Inc   sending its shares soaring and enriching its ex-footballer founders amid hopes the firm would benefit from its clients' vast reach.,normal
AMZN,Amazoncom Inc,20171201,UPDATE 2-Australian delivery software startup inks Amazon  Yum deals; shares leap ,* Expects over 250 mln deliveries a year through Yum deal (Recasts; adds investor comment  company background),normal
AMZN,Amazoncom Inc,20171201,Amazon steps up pace in artificial intelligence race ,LAS VEGAS Amazon.com Inc this week announced a flurry of new machine learning features for its Amazon Web Services cloud computing business  raising its challenge to Silicon Valley's biggest tech firms for the lead in artificial intelligence.,normal
AMZN,Amazoncom Inc,20171201,Amazon steps up pace in artificial intelligence race ,LAS VEGAS  Nov 30 Amazon.com Inc this week announced a flurry of new machine learning features for its Amazon Web Services cloud computing business  raising its challenge to Silicon Valley's biggest tech firms for the lead in artificial intelligence.,normal
AMZN,Amazoncom Inc,20171201,Australia's GetSwift shares surge after deals with Amazon.com  Yum Brands ,Dec 1 Australian logistics company GetSwift Ltd said on Friday it had entered into an agreement with Amazon.com Inc and a multi-year partnership with Yum Brands Inc  sending its share up sharply.,normal
AAL,American Airlines Group Inc,20171201,American Air reaches deal with pilots over scheduling error ,NEW YORK American Airlines has reached an agreement with its pilots union over premium pay for some December flights  both groups said on Friday  after a scheduling snafu gave too many pilots holiday time off and sent the airline scrambling to correct its mistake.,topStory
AAL,American Airlines Group Inc,20171201,American Air reaches deal with pilots over scheduling error ,NEW YORK  Dec 1 American Airlines has reached an agreement with its pilots union over premium pay for some December flights  both groups said on Friday  after a scheduling snafu gave too many pilots holiday time off and sent the airline scrambling to correct its mistake.,normal
AAL,American Airlines Group Inc,20171201,U.S. flight crews ill-equipped for sexual harassment complaints ,NEW YORK Many U.S. flight attendants lack the training in how to deal with complaints of on-board sexual harassment  an industry union and Democratic lawmakers say  raising questions about whether airlines are prepared to protect passengers from predatory men.,normal
AAL,American Airlines Group Inc,20171201,BRIEF-Allied Pilots Association and American Airlines management reach agreement in principle ‍​ ,* Allied Pilots Association and American Airlines management reach agreement in principle - statement‍​,normal
AAL,American Airlines Group Inc,20171201,Hundreds of American Air flights still lack pilots in December ,NEW YORK American Airlines still has hundreds of flights without pilots assigned to them in December  the company said on Thursday  after a scheduling error gave too many pilots time off. | Video ,normal
AMWD,American Woodmark Corporation,20171201,BRIEF-American Woodmark to pay RSI Home Products A Fee of $22.5 Million on Deal Termination ,* AMERICAN WOODMARK-IN EVENT OF TERMINATION OF MERGER AGREEMENT UNDER CERTAIN CIRCUMSTANCES  CO TO PAY RSI HOME PRODUCTS TERMINATION FEE OF $22.5 MILLION Source text : ( http://bit.ly/2j6wiJW ) Further company coverage:,topStory
AMWD,American Woodmark Corporation,20171201,CORRECTED-BRIEF-American Woodmark To Buy Cabinet Manufacturer RSI Home Products ,* AMERICAN WOODMARK CORP TO ACQUIRE CABINET MANUFACTURER RSI HOME PRODUCTS,normal
AMWD,American Woodmark Corporation,20171201,BRIEF-American Woodmark Corporation Reports Q2 Earnings Per Share $1.21 ,* Q2 EARNINGS PER SHARE VIEW $1.26 -- THOMSON REUTERS I/B/E/S Source text for Eikon: Further company coverage:,normal
AMGN,Amgen Inc,20171201,FDA approves heart protection claims for Amgen cholesterol drug ,Amgen Inc can now promote the ability of its potent but expensive cholesterol drug to reduce the risk of heart attacks and strokes  after U.S. health regulators approved adding those benefits to the medicine's prescribing label  the company said on Friday.,topStory
AMGN,Amgen Inc,20171201,FDA approves heart protection claims for Amgen cholesterol drug ,Dec 1 Amgen Inc can now promote the ability of its potent but expensive cholesterol drug to reduce the risk of heart attacks and strokes  after U.S. health regulators approved adding those benefits to the medicine's prescribing label  the company said on Friday.,normal
AAPL,Apple Inc,20171201,BRIEF-Parkervision Says ‍Munich Court Rejected Request By Apple And Certain Of Subsidiaries That Parkervision GmbH Be Required To Post Bond ,* PARKERVISION INC - ‍MUNICH COURT REJECTED REQUEST BY APPLE INC AND CERTAIN OF SUBSIDIARIES THAT PARKERVISION GMBH BE REQUIRED TO POST BOND,topStory
AQMS,Aqua Metals Inc,20171201,BRIEF-Aqua Metals Provides Business Update ,* AQUA METALS EXPECTS TO REPORT Q4 '17 REVENUE AT OR SLIGHTLY BELOW PRIOR REVENUE GUIDANCE RANGE OF $1.2 MILLION TO $1.8 MILLION​,topStory
ARDM,Aradigm Corporation,20171201,BRIEF-Aradigm Announces FDA Advisory Committee Meeting For Linhaliq ,* ARADIGM ANNOUNCES FDA ADVISORY COMMITTEE MEETING FOR LINHALIQ,topStory
ARWR,Arrowhead Pharmaceuticals Inc,20171201,BRIEF-Silence Therapeutics Plc Reports 6.4 Pct Stake In Arrowhead Pharmaceuticals As Of Nov 29 ,* SILENCE THERAPEUTICS PLC REPORTS 6.4 PERCENT STAKE IN ARROWHEAD PHARMACEUTICALS INC AS OF NOVEMBER 29 - SEC FILING,topStory
ASML,ASML Holding NV,20171201,Intel cuts stake in ASML to below 5 percent ,AMSTERDAM Chipmaker Intel  has cut its stake in Dutch semiconductor equipment supplier ASML  to 4.96 percent  according to a filing published by the Dutch Financial Markets Authority on Friday.,topStory
ASML,ASML Holding NV,20171201,Intel cuts stake in ASML to below 5 pct ,AMSTERDAM  Dec 1 Chipmaker Intel has cut its stake in Dutch semiconductor equipment supplier ASML to 4.96 percent  according to a filing published by the Dutch Financial Markets Authority on Friday.,normal
ATNX,Athenex Inc,20171201,BRIEF-Athenex Announces Planned Retirement Of Chief Financial Officer Nick Riehle ,* ATHENEX ANNOUNCES PLANNED RETIREMENT OF CHIEF FINANCIAL OFFICER NICK RIEHLE,topStory
TAPR,Barclays Inverse US Treasury Composite ETN,20171201,BRIEF-Barclays To Cut Stake In Barclays Africa To 14.9 Pct ,* ‍REDUCTION OF BARCLAYS' SHAREHOLDING IN BARCLAYS AFRICA GROUP LIMITED​,topStory
BMTC,Bryn Mawr Bank Corporation,20171201,BRIEF-Bryn Mawr Bank Corp Receives Regulatory Approval For The Acquisition Of Royal Bancshares Of Pennsylvania ,* BRYN MAWR BANK CORPORATION RECEIVES REGULATORY APPROVAL FOR THE ACQUISITION OF ROYAL BANCSHARES OF PENNSYLVANIA  INC.,topStory
BWLD,Buffalo Wild Wings Inc,20171201,BRIEF-Marcato Capital Management​ ​Says Intends To Cover Short Sales On Buffalo Wild Wings Stock Within 20 Days‍​ ,* MARCATO CAPITAL MANAGEMENT​ SAYS IT ENTERED INTO A SHORT SALE AGAINST THE BOX POSITION WITH RESPECT TO 950 000 SHARES OF BUFFALO WILD WINGS INC - SEC FILING,topStory
CASM,CAS Medical Systems Inc,20171201,BRIEF-‍Long Focus Capital Management Reports 6.9 Pct Passive Stake In CAS Medical Systems ,* ‍LONG FOCUS CAPITAL MANAGEMENT LLC REPORTS 6.9 PERCENT PASSIVE STAKE IN CAS MEDICAL SYSTEMS INC ​AS OF NOVEMBER 29 - SEC FILING Source text: (http://bit.ly/2kjeuz3) Further company coverage:,topStory
CREG,China Recycling Energy Corporation,20171201,BRIEF-China Recycling Energy Corp Files For Mixed Shelf Of Upto $50 Million - SEC Filing ‍​ ,* CHINA RECYCLING ENERGY CORP FILES FOR MIXED SHELF OF UPTO $50 MILLION - SEC FILING ‍​ Source text (http://bit.ly/2ixNs6k) Further company coverage: (Bangalore.newsroom@thomsonreuters.com),topStory
CHSCL,CHS Inc,20171201,CHS Inc says permanently closes soy processors in Kansas  Iowa ,Dec 1 CHS Inc  the largest U.S. farmer cooperative  permanently closed soybean processing plants in Hutchinson  Kansas  and Creston  Iowa  as well as a technology and innovation center in Eagan  Minnesota  the company said in a statement on Friday.,topStory
CHSCM,CHS Inc,20171201,CHS Inc says permanently closes soy processors in Kansas  Iowa ,Dec 1 CHS Inc  the largest U.S. farmer cooperative  permanently closed soybean processing plants in Hutchinson  Kansas  and Creston  Iowa  as well as a technology and innovation center in Eagan  Minnesota  the company said in a statement on Friday.,topStory
CHSCN,CHS Inc,20171201,CHS Inc says permanently closes soy processors in Kansas  Iowa ,Dec 1 CHS Inc  the largest U.S. farmer cooperative  permanently closed soybean processing plants in Hutchinson  Kansas  and Creston  Iowa  as well as a technology and innovation center in Eagan  Minnesota  the company said in a statement on Friday.,topStory
CHSCO,CHS Inc,20171201,CHS Inc says permanently closes soy processors in Kansas  Iowa ,Dec 1 CHS Inc  the largest U.S. farmer cooperative  permanently closed soybean processing plants in Hutchinson  Kansas  and Creston  Iowa  as well as a technology and innovation center in Eagan  Minnesota  the company said in a statement on Friday.,topStory
CHSCP,CHS Inc,20171201,CHS Inc says permanently closes soy processors in Kansas  Iowa ,Dec 1 CHS Inc  the largest U.S. farmer cooperative  permanently closed soybean processing plants in Hutchinson  Kansas  and Creston  Iowa  as well as a technology and innovation center in Eagan  Minnesota  the company said in a statement on Friday.,topStory
CTXR,Citius Pharmaceuticals Inc,20171201,BRIEF-Citius Pharmaceuticals Says On Nov 27  Board Appointed Jaime Bartushak As CFO And Principal Financial Officer Of Co ,* CITIUS PHARMACEUTICALS INC - ‍ON NOV 27    BOARD APPOINTED JAIME BARTUSHAK AS CFO AND PRINCIPAL FINANCIAL OFFICER OF COMPANY  EFFECTIVE NOV. 27  2017​ Source text: (http://bit.ly/2iwTNyZ) Further company coverage:,topStory
COWN,Cowen Inc,20171201,BRIEF-Cowen Announces Planned CEO Succession ,* COWEN INC - ‍JEFFREY M. SOLOMON NAMED CHIEF EXECUTIVE OFFICER EFFECTIVE DECEMBER 27  2017​,topStory
COWNL,Cowen Inc,20171201,BRIEF-Cowen Announces Planned CEO Succession ,* COWEN INC - ‍JEFFREY M. SOLOMON NAMED CHIEF EXECUTIVE OFFICER EFFECTIVE DECEMBER 27  2017​,topStory
DZSI,DASAN Zhone Solutions Inc,20171201,BRIEF-Dasan Zhone Solutions Says Co Appointed Mikhail Golomb As CFO ,* DASAN ZHONE SOLUTIONS- ‍ EFFECTIVE AS OF DEC 1  CO APPOINTED MIKHAIL GOLOMB AS CFO  CORPORATE TREASURER AND SECRETARY OF CO - SEC FILING​ Source text: [http://bit.ly/2i8UI4W] Further company coverage:,topStory
DCIX,Diana Containerships Inc,20171201,BRIEF-Diana Containerships Announces Time Charter Contract For M/V Hamburg With Wan Hai Lines ,* DIANA CONTAINERSHIPS INC. ANNOUNCES TIME CHARTER CONTRACT FOR M/V HAMBURG WITH WAN HAI LINES,topStory
DISH,DISH Network Corporation,20171201,BRIEF-Dish reaches retransmission consent agreement with Lilly Broadcasting ,* DISH REACHES RETRANSMISSION CONSENT AGREEMENT WITH LILLY BROADCASTING,topStory
FITB,Fifth Third Bancorp,20171201,Trump taps Fifth Third lawyer McWilliams to lead FDIC ,WASHINGTON U.S. President Donald Trump plans to nominate Jelena McWilliams  Fifth Third Bancorp's top attorney  to serve as the next head of the Federal Deposit Insurance Corporation  the White House said on Thursday.,topStory
FITB,Fifth Third Bancorp,20171201,UPDATE 1-Trump taps Fifth Third lawyer McWilliams to lead FDIC ,WASHINGTON  Nov 30 U.S. President Donald Trump plans to nominate Jelena McWilliams  Fifth Third Bancorp's top attorney  to serve as the next head of the Federal Deposit Insurance Corporation  the White House said on Thursday.,normal
FITB,Fifth Third Bancorp,20171201,Trump taps Fifth Third lawyer McWilliams to lead FDIC ,WASHINGTON  Nov 30 U.S. President Donald Trump plans to nominate Jelena McWilliams  Fifth Third Bancorp's top attorney  to serve as the next head of the Federal Deposit Insurance Corporation  the White House said on Thursday.,normal
FITBI,Fifth Third Bancorp,20171201,Trump taps Fifth Third lawyer McWilliams to lead FDIC ,WASHINGTON U.S. President Donald Trump plans to nominate Jelena McWilliams  Fifth Third Bancorp's top attorney  to serve as the next head of the Federal Deposit Insurance Corporation  the White House said on Thursday.,topStory
FITBI,Fifth Third Bancorp,20171201,UPDATE 1-Trump taps Fifth Third lawyer McWilliams to lead FDIC ,WASHINGTON  Nov 30 U.S. President Donald Trump plans to nominate Jelena McWilliams  Fifth Third Bancorp's top attorney  to serve as the next head of the Federal Deposit Insurance Corporation  the White House said on Thursday.,normal
FITBI,Fifth Third Bancorp,20171201,Trump taps Fifth Third lawyer McWilliams to lead FDIC ,WASHINGTON  Nov 30 U.S. President Donald Trump plans to nominate Jelena McWilliams  Fifth Third Bancorp's top attorney  to serve as the next head of the Federal Deposit Insurance Corporation  the White House said on Thursday.,normal
FMCI,Forum Merger Corporation,20171201,BRIEF-Convergeone Announces Combination With Forum Merger to Become Nasdaq-Listed Co  With Anticipated Enterprise Value Of About $1.2 Bln ,* CONVERGEONE ANNOUNCES COMBINATION WITH FORUM MERGER CORPORATION TO BECOME PUBLICLY LISTED COMPANY,topStory
FOXF,Fox Factory Holding Corp,20171201,BRIEF-Fox Factory Holding Acquires Certain Assets Of Flagship  DBA Tuscany Motor Co ,* FOX FACTORY HOLDING CORP. ACQUIRES CERTAIN ASSETS OF FLAGSHIP INC.  DBA TUSCANY MOTOR COMPANY,topStory
GEOS,Geospace Technologies Corporation,20171201,BRIEF-Lemelson Capital Management Announces 10 Pct Stake In Geospace Technologies ,* LEMELSON CAPITAL MANAGEMENT ANNOUNCES 10 PERCENT STAKE IN GEOSPACE TECHNOLOGIES (NASDAQ: GEOS)  URGES IMMEDIATE SHARE REPURCHASE,topStory
GFED,Guaranty Federal Bancshares Inc,20171201,BRIEF-Guaranty Federal Bancshares Announces Acquisition of Hometown Bancshares ,* GUARANTY FEDERAL BANCSHARES  INC. ANNOUNCES ACQUISITION OF HOMETOWN BANCSHARES  INC.,topStory
HNNA,Hennessy Advisors Inc,20171201,BRIEF-Hennessy Advisors  Inc. Acquires Two Rainier U.S. Equity Funds ,* HENNESSY ADVISORS  INC. ACQUIRES TWO RAINIER U.S. EQUITY FUNDS,topStory
HIBB,Hibbett Sports Inc,20171201,BRIEF-Hibbett Sports- Co Executed New Promissory Note Renewing Existing Unsecured Revolving Credit Facility ,* HIBBETT SPORTS-‍ON NOV. 30  CO EXECUTED NEW PROMISSORY NOTE RENEWING EXISTING UNSECURED REVOLVING CREDIT FACILITY BETWEEN CO ITS UNITS  REGIONS BANK​,topStory
HMST,HomeStreet Inc,20171201,BRIEF-Roaring Blue Lion Capital Management LP Reports A 5.5 Pct Stake In Homestreet As Of Nov 29 ,* ROARING BLUE LION CAPITAL MANAGEMENT L.P REPORTS A 5.5 PERCENT STAKE IN HOMESTREET INC AS OF NOVEMBER 29  2017 - SEC FILING,topStory
IEP,Icahn Enterprises LP,20171201,BRIEF-Icahn Enterprises L.P. Announces Pricing Of Senior Notes ,* ICAHN ENTERPRISES LP - CO TOGETHER WITH ICAHN ENTERPRISES PRICED OFFERING OF $510 MILLION ADDITIONAL 6.250% SENIOR NOTES DUE 2022​,topStory
IEP,Icahn Enterprises LP,20171201,Icahn steps up attack on SandRidge  seeks executive pay records ,HOUSTON Activist investor Carl Icahn has stepped up his attack on SandRidge Energy Inc's proposal to buy a rival oil-and-gas producer  taking aim at the company's top executives and calling for a release of records on the deal and executive pay  according to a regulatory filing on Friday.,normal
IEP,Icahn Enterprises LP,20171201,UPDATE 2-Icahn steps up attack on SandRidge  seeks executive pay records ,HOUSTON  Dec 1 Activist investor Carl Icahn has stepped up his attack on SandRidge Energy Inc's proposal to buy a rival oil-and-gas producer  taking aim at the company's top executives and calling for a release of records on the deal and executive pay  according to a regulatory filing on Friday.,normal
INTC,Intel Corporation,20171201,Intel cuts stake in ASML to below 5 percent ,AMSTERDAM Chipmaker Intel  has cut its stake in Dutch semiconductor equipment supplier ASML  to 4.96 percent  according to a filing published by the Dutch Financial Markets Authority on Friday.,topStory
INTC,Intel Corporation,20171201,Intel cuts stake in ASML to below 5 pct ,AMSTERDAM  Dec 1 Chipmaker Intel has cut its stake in Dutch semiconductor equipment supplier ASML to 4.96 percent  according to a filing published by the Dutch Financial Markets Authority on Friday.,normal
IBKR,Interactive Brokers Group Inc,20171201,BRIEF-Interactive Brokers Reports 795 000 DARTs In Nov  Up 9 Pct ,* INTERACTIVE BROKERS GROUP REPORTS BROKERAGE METRICS AND OTHER FINANCIAL INFORMATION FOR NOVEMBER 2017  INCLUDES REG.-NMS EXECUTION STATISTICS,topStory
KPTI,Karyopharm Therapeutics Inc,20171201,BRIEF-Karyopharm Therapeutics Says Co May Issue & Sell Shares Of Stock ,* KARYOPHARM THERAPEUTICS - CO MAY ISSUE & SELL SHARES OF STOCK  $0.0001 PAR VALUE PER SHARE  HAVING ADDITIONAL OFFERING PRICE OF UP TO $75 MILLION,topStory
LINC,Lincoln Educational Services Corporation,20171201,BRIEF-Lincoln Educational Services Says Co  Units Entered Into A First Amendment Of Credit Agreement Dated As Of March 31 ,* LINCOLN EDUCATIONAL SERVICES  SAYS ON NOV 29  CO   UNITS ENTERED INTO A FIRST AMENDMENT OF CREDIT AGREEMENT DATED AS OF MARCH 31  2017 - SEC FILING,topStory
LMFA,LM Funding America Inc,20171201,BRIEF-LM Funding America Inc Says Richard Russell Joined Co As CFO ,* LM FUNDING AMERICA INC SAYS ON NOV 29  RICHARD RUSSELL JOINED CO AS CHIEF FINANCIAL OFFICER - SEC FILING Source text : (http://bit.ly/2jAhrXX) Further company coverage:,topStory
LTEA,Long Island Iced Tea Corp,20171201,BRIEF-Long Island Iced Tea Corp. Appoints Two New Members To Its Board Of Directors ,* LONG ISLAND ICED TEA CORP. APPOINTS TWO NEW MEMBERS TO ITS BOARD OF DIRECTORS Source text for Eikon: Further company coverage:,topStory
MLVF,Malvern Bancorp Inc,20171201,BRIEF-Malvern Bancorp Reports Q4 Earnings Per Share $0.30 ,* MALVERN BANCORP  INC. REPORTS FOURTH FISCAL QUARTER AND FISCAL 2017 RESULTS,topStory
MARA,Marathon Patent Group Inc,20171201,BRIEF-Marathon Patent Says Entered Into Exchange Agreement With Holder Of Warrant To Purchase 6.6 Mln Shares Of Co's Stock ,* MARATHON PATENT - ON NOV 28 ENTERED INTO EXCHANGE AGREEMENT WITH HOLDER OF WARRANT TO PURCHASE 6.6 MILLION SHARES OF CO'S STOCK - SEC FILING,topStory
MTBC,Medical Transcription Billing Corp,20171201,BRIEF-MTBC Says Mahmud Haq Will Assume Role Of Executive Chairman Of Board Of Directors ,* MEDICAL TRANSCRIPTION BILLING CORP - MAHMUD HAQ WILL ASSUME ROLE OF EXECUTIVE CHAIRMAN OF BOARD OF DIRECTORS,topStory
MTBCP,Medical Transcription Billing Corp,20171201,BRIEF-MTBC Says Mahmud Haq Will Assume Role Of Executive Chairman Of Board Of Directors ,* MEDICAL TRANSCRIPTION BILLING CORP - MAHMUD HAQ WILL ASSUME ROLE OF EXECUTIVE CHAIRMAN OF BOARD OF DIRECTORS,topStory
MEDP,Medpace Holdings Inc,20171201,BRIEF-Medpace Holdings Prices Secondary Offering Of 4 Mln Shares At $31.50 Per Share​ ,* MEDPACE HOLDINGS  INC. ANNOUNCES PRICING OF SECONDARY OFFERING OF COMMON STOCK BY SELLING SHAREHOLDER,topStory
MLCO,Melco Resorts & Entertainment Limited,20171201,Melco pledges headquarters in Japan if it wins casino licence ,TOKYO  Dec 1 Melco Resorts & Entertainment Ltd will shift its headquarters to Japan should it win a licence to run a casino in the world's next frontier for high-stakes gambling  its chief executive said on Friday.,topStory
EBSB,Meridian Bancorp Inc,20171201,BRIEF-Meridian Bancorp Says Board ‍Declared Quarterly Cash Dividend Of $0.05 Per Common Share ,* MERIDIAN BANCORP SAYS BOARD ‍DECLARED QUARTERLY CASH DIVIDEND OF $0.05 PER COMMON SHARE  AN INCREASE OF $0.01 PER COMMON SHARE - SEC FILING​ Source text: (http://bit.ly/2BCxw7l) Further company coverage:,topStory
MPVD,Mountain Province Diamonds Inc,20171201,BRIEF-Mountain Province Diamonds Prices $330 Mln Senior Secured Second Lien Notes ,* MOUNTAIN PROVINCE DIAMONDS PRICES NEW US$330 000 000 SENIOR SECURED SECOND LIEN NOTES,topStory
MYL,Mylan NV,20171201,FDA OKs Mylan's biosimilar of Roche cancer drug Herceptin ,The U.S. Food and Drug Administration on Friday approved Mylan NV's biosimilar of Roche's blockbuster treatment for breast cancer  Herceptin  making it the second copycat cancer drug to be approved in the United States.,topStory
MYL,Mylan NV,20171201,UPDATE 3-FDA OKs Mylan's biosimilar of Roche cancer drug Herceptin ,* Approval ups confidence in Mylan's biosimilar efforts -analysts,normal
MYL,Mylan NV,20171201,BRIEF-FDA Approves Mylan's Heparin Sodium Injection ,* FDA APPROVAL OF HEPARIN SODIUM INJECTION CONTINUES TO DEMONSTRATE MYLAN'S DEEP EXPERTISE IN DEVELOPING COMPLEX PRODUCTS,normal
MYL,Mylan NV,20171201,FDA approves Mylan's biosimilar of Roche's breast cancer treatment ,Dec 1 The U.S. Food and Drug Administration on Friday approved Mylan NV's biosimilar of Roche's blockbuster breast cancer treatment Herceptin.,normal
NDAQ,Nasdaq Inc,20171201,U.S. regulator to allow CME  CBOE to list bitcoin futures ,WASHINGTON The main U.S. derivatives regulator said on Friday it would allow CME Group Inc and CBOE Global Markets Inc to list bitcoin futures contracts  opening the door to added regulation and more mainstream adoption of the cryptocurrency. | Video ,normal
NDAQ,Nasdaq Inc,20171201,UPDATE 2-U.S. regulator to allow CME  CBOE to list bitcoin futures ,WASHINGTON  Dec 1 The main U.S. derivatives regulator said on Friday it would allow CME Group Inc and CBOE Global Markets Inc to list bitcoin futures contracts  opening the door to added regulation and more mainstream adoption of the cryptocurrency.,normal
NDAQ,Nasdaq Inc,20171201,CME Group to launch bitcoin futures contract on Dec. 18 ,Dec 1 CME Group Inc on Friday said it will launch its bitcoin futures contract on Dec. 18 to provide a regulated trading platform for the cryptocurrency futures market.,normal
UEPS,Net 1 UEPS Technologies Inc,20171201,BRIEF-Net1 Appoints Alex Smith As CFO ,* SAYS ‍ALEX REPLACES HERMAN G. KOTZE  WHO WAS APPOINTED AS CHIEF EXECUTIVE OFFICER IN JUNE 2017​ Source text for Eikon: Further company coverage:,topStory
NVCR,NovoCure Limited,20171201,BRIEF-Novocure Receives Reimbursement Approval For Optune In Japan For Treatment Of Glioblastoma ,* NOVOCURE RECEIVES REIMBURSEMENT APPROVAL FOR OPTUNE® IN JAPAN FOR THE TREATMENT OF NEWLY DIAGNOSED GLIOBLASTOMA,topStory
OASM,Oasmia Pharmaceutical AB,20171201,BRIEF-Oasmia Pharmaceutical Q2 operating loss shrinks ,* OASMIA PHARMACEUTICAL AB Q2 ‍CONSOLIDATED NET SALES AMOUNTED TO TSEK 1 651 COMPARED TO TSEK 56 IN THE SECOND QUARTER THE PREVIOUS YEAR ​,topStory
OREX,Orexigen Therapeutics Inc,20171201,BRIEF-Man Group Plc Reports 8.54 Pct Passive Stake In Orexigen Therapeutics ,* MAN GROUP PLC REPORTS 8.54 PERCENT PASSIVE STAKE IN OREXIGEN THERAPEUTICS INC AS OF NOVEMBER 27 - SEC FILING‍​ Source text : http://bit.ly/2AKRpMo Further company coverage:,topStory
OREX,Orexigen Therapeutics Inc,20171201,BRIEF-Orexigen Says Entered Into Exchange Agreements With Holders ,* OREXIGEN - ENTERED INTO EXCHANGE AGREEMENTS WITH HOLDERS OF 2.75% CONVERTIBLE EXCHANGE SENIOR NOTES DUE 2020  2.75% CONVERTIBLE SENIOR NOTES DUE 2020,normal
SEED,Origin Agritech Limited,20171201,BRIEF-Origin Agritech announces resignation Of CEO and suspending of North American Office ,* ORIGIN AGRITECH ANNOUNCES RESIGNATION OF CEO AND SUSPENDING OF NORTH AMERICAN OFFICE,topStory
PRTK,Paratek Pharmaceuticals Inc ,20171201,BRIEF-Paratek Pharmaceuticals Files For Mixed Shelf Offering Of Up To $250 Mln ,* PARATEK PHARMACEUTICALS INC FILES FOR MIXED SHELF OFFERING OF UP TO $250 MILLION - SEC FILING‍​ Source text (http://bit.ly/2BqNSiB) Further company coverage:,topStory
PRKR,ParkerVision Inc,20171201,BRIEF-Parkervision Says ‍Munich Court Rejected Request By Apple And Certain Of Subsidiaries That Parkervision GmbH Be Required To Post Bond ,* PARKERVISION INC - ‍MUNICH COURT REJECTED REQUEST BY APPLE INC AND CERTAIN OF SUBSIDIARIES THAT PARKERVISION GMBH BE REQUIRED TO POST BOND,topStory
PYPL,PayPal Holdings Inc,20171201,BRIEF-Tio Networks Provides Update On Suspension Of Operations ,* PAYPAL - REVIEW OF TIO'S NETWORK HAS IDENTIFIED POTENTIAL COMPROMISE OF PERSONALLY IDENTIFIABLE INFORMATION FOR ABOUT 1.6 MILLION CUSTOMERS,topStory
PBPB,Potbelly Corporation,20171201,BRIEF-Potbelly Corp Says ‍Company's Board Of Directors Increased Size Of Board To Nine Members ,* POTBELLY CORP - ‍COMPANY'S BOARD OF DIRECTORS INCREASED SIZE OF BOARD TO NINE MEMBERS - SEC FILING​ Source text: [http://bit.ly/2Aje8hD] Further company coverage:,topStory
PBPB,Potbelly Corporation,20171201,BRIEF-Potbelly appoints Alan Johnson as President And CEO ,* POTBELLY APPOINTS ALAN JOHNSON AS PRESIDENT AND CHIEF EXECUTIVE OFFICER,normal
ROST,Ross Stores Inc,20171201,GRAPHIC-Lower taxes  big gains: The stocks poised to win from tax cuts ,NEW YORK  Dec 1 A proposal driven by President Donald Trump to overhaul the country's tax system is moving through U.S. Congress  lifting the overall stock market and raising hopes that corporate earnings will get a boost.,normal
