BGC,General Cable Corporation,20171201,Italy's Prysmian lines up binding bid for General Cable: sources ,LONDON/MILAN European cable firm Prysmian  is finalizing an all-cash binding bid for General Cable  which could be worth more than $1.1 billion  sources familiar with the matter said.,topStory
BGC,General Cable Corporation,20171201,UPDATE 1-Italy's Prysmian lines up binding bid for General Cable -sources ,* General Cable to pick bidder for exclusive talks by mid December,normal
BGC,General Cable Corporation,20171201,Italy's Prysmian lines up binding bid for General Cable - sources ,LONDON/MILAN  Dec 1 European cable firm Prysmian is finalising an all-cash binding bid for General Cable which could be worth more than $1.1 billion  sources familiar with the matter said.,normal
GEH,General Electric Capital Corporation,20171201,General Electric lays off workers at power business in New York ,NEW YORK General Electric Co  said on Friday it was laying off workers at its power division in Schenectady  New York  as it tries to reduce costs after a steep profit drop at the division.,topStory
GEH,General Electric Capital Corporation,20171201,General Electric lays off workers at power business in New York ,NEW YORK  Dec 1 General Electric Co said on Friday it was laying off workers at its power division in Schenectady  New York  as it tries to reduce costs after a steep profit drop at the division.,normal
GEK,General Electric Capital Corporation,20171201,General Electric lays off workers at power business in New York ,NEW YORK General Electric Co  said on Friday it was laying off workers at its power division in Schenectady  New York  as it tries to reduce costs after a steep profit drop at the division.,topStory
GEK,General Electric Capital Corporation,20171201,General Electric lays off workers at power business in New York ,NEW YORK  Dec 1 General Electric Co said on Friday it was laying off workers at its power division in Schenectady  New York  as it tries to reduce costs after a steep profit drop at the division.,normal
GE,General Electric Company,20171201,General Electric lays off workers at power business in New York ,NEW YORK General Electric Co  said on Friday it was laying off workers at its power division in Schenectady  New York  as it tries to reduce costs after a steep profit drop at the division.,topStory
GE,General Electric Company,20171201,General Electric lays off workers at power business in New York ,NEW YORK  Dec 1 General Electric Co said on Friday it was laying off workers at its power division in Schenectady  New York  as it tries to reduce costs after a steep profit drop at the division.,normal
GEB,General Electric Company,20171201,General Electric lays off workers at power business in New York ,NEW YORK General Electric Co  said on Friday it was laying off workers at its power division in Schenectady  New York  as it tries to reduce costs after a steep profit drop at the division.,topStory
GEB,General Electric Company,20171201,General Electric lays off workers at power business in New York ,NEW YORK  Dec 1 General Electric Co said on Friday it was laying off workers at its power division in Schenectady  New York  as it tries to reduce costs after a steep profit drop at the division.,normal
GM,General Motors Company,20171201,General Motors  Ford report fall in Canada auto sales ,General Motors Co and Ford Motor Co on Friday reported a drop in Canadian auto sales for November.,topStory
GM,General Motors Company,20171201,UPDATE 1-General Motors  Ford report fall in Canada auto sales ,Dec 1 General Motors Co and Ford Motor Co on Friday reported a drop in Canadian auto sales for November.,normal
GM,General Motors Company,20171201,GM Canada auto sales fall 17.2 pct in November ,Dec 1 General Motors Co said on Friday its total vehicle sales in Canada fell 17.2 percent in November from a year earlier.,normal
GM,General Motors Company,20171201,BRIEF-GM Report 245 387 Deliveries In The United States In November  Down 2.9 Pct ,* GM SAYS REPORTED 245 387 DELIVERIES IN THE UNITED STATES IN NOVEMBER  DOWN 2.9 PERCENT,normal
GM,General Motors Company,20171201,Major automakers post mixed November U.S. sales results ,DETROIT  Dec 1 Major automakers posted mixed U.S. November new vehicle sales for November on Friday  with General Motors Co and Fiat Chrysler Automobiles NV (FCA) down largely on lower fleet sales  while Ford Motor Co's sales rose.,normal
GM,General Motors Company,20171201,GM venture to recall nearly a million vehicles in China: quality watchdog ,BEIJING One of General Motors Co's  China ventures will recall nearly a million vehicles due to fuel tank problems  the country's quality watchdog said on Friday  the latest in a spate of major auto recalls in China over the last few months.,normal
GM,General Motors Company,20171201,SAIC-GM to recall 806 367 vehicles in China: quality watchdog ,BEIJING SAIC General Motors Corp Ltd will recall 806 367 Chevrolet Cruze vehicles in China due to power steering-related issues  the country's quality watchdog said on Friday.,normal
GM,General Motors Company,20171201,SAIC-GM to recall 806 367 vehicles in China - quality watchdog ,BEIJING  Dec 1 SAIC General Motors Corp Ltd will recall 806 367 Chevrolet Cruze vehicles in China due to power steering-related issues  the country's quality watchdog said on Friday.,normal
GM,General Motors Company,20171201,UPDATE 1-GM venture to recall nearly a mln vehicles in China -quality watchdog ,* Follows other major China recalls by GM  VW earlier this year,normal
GCO,Genesco Inc,20171201,BRIEF-Genesco Reports Third Quarter Fiscal 2018 Results ,* Q3 EARNINGS PER SHARE VIEW $1.12 -- THOMSON REUTERS I/B/E/S,topStory
HRTG,Heritage Insurance Holdings Inc,20171201,BRIEF-Heritage Insurance Says Selling Stockholders May Offer And Sell Up To 2.22 Mln Shares Of Co's Common Stock‍​ ,* HERITAGE INSURANCE HOLDINGS INC SAYS SELLING STOCKHOLDERS MAY OFFER AND SELL UP TO 2.22 MILLION SHARES OF CO'S COMMON STOCK‍​ - SEC FILING Source text: (http://bit.ly/2nmZkcO) Further company coverage:,topStory
HMC,Honda Motor Company Ltd,20171201,UPDATE 3-November mixed for U.S. sales as automakers hike discounts ,DETROIT  Dec 1 Major automakers posted mixed U.S. November new vehicle sales on Friday and predicted a competitive December as they rush to sell vehicles and boost their 2017 numbers before the year comes to an end.,normal
IBP,Installed Building Products Inc,20171201,BRIEF-Installed Building Products Announces Successful Repricing ,* INSTALLED BUILDING PRODUCTS INC - ‍COMPANY HAS SUCCESSFULLY REPRICED ITS EXISTING SEVEN-YEAR $299 MILLION TERM LOAN B FACILITY​,topStory
NVTA,Invitae Corporation,20171201,BRIEF-Park West Asset Management LLC Reports 5 Pct Passive Stake In Invitae Corp As Of Nov 21 ,* PARK WEST ASSET MANAGEMENT LLC REPORTS 5.0 PERCENT PASSIVE STAKE IN  INVITAE CORP AS OF NOVEMBER 21  2017 - SEC FILING‍​ Source text: [http://bit.ly/2AAc70V] Further company coverage:,topStory
JNJ,Johnson & Johnson,20171201,Genmab and Johnson & Johnson 'love' partnership as some ponder takeover ,LONDON Genmab  was Europe's second biggest biotech company  until its partner Johnson & Johnson  bought Switzerland's Actelion for $30 billion this year and propelled the Danish antibody specialist to the top spot.,topStory
KND,Kindred Healthcare Inc,20171201,BRIEF-Kindred Provides Update On Additional Transaction Closings For Its Skilled Nursing Facility Business Divestiture ,* KINDRED PROVIDES UPDATE ON ADDITIONAL TRANSACTION CLOSINGS FOR ITS SKILLED NURSING FACILITY BUSINESS DIVESTITURE,topStory
LB,L Brands Inc,20171201,GRAPHIC-Lower taxes  big gains: The stocks poised to win from tax cuts ,NEW YORK  Dec 1 A proposal driven by President Donald Trump to overhaul the country's tax system is moving through U.S. Congress  lifting the overall stock market and raising hopes that corporate earnings will get a boost.,normal
LCI,Lannett Co Inc,20171201,BRIEF-Lannett Reports FDA Acceptance Of 505(B)(2) NDA For Cocaine Hydrochloride Topical Solution ,* LANNETT ANNOUNCES FDA ACCEPTANCE OF 505(B)(2) NEW DRUG APPLICATION FOR COCAINE HYDROCHLORIDE TOPICAL SOLUTION  A PROPRIETARY ANESTHETIC PRODUCT,topStory
WLH,Lyon William Homes,20171201,BRIEF-Israel Englander Reports 5.5 Pct Passive Stake In William Lyon Homes ,* ISRAEL ENGLANDER REPORTS 5.5 PERCENT PASSIVE STAKE IN WILLIAM LYON HOMES AS OF NOVEMBER 21 - SEC FILING‍​ Source text: (http://bit.ly/2iy6AB4) Further company coverage:,topStory
M,Macy&#39;s Inc,20171201,Macy's hires more workers after Black Friday rush ,Macy's Inc  said on Friday it had a strong start to the holiday shopping season and would hire an additional 7 000 temporary workers for its stores to deal with heavy customer numbers in the run up to Christmas. | Video ,topStory
M,Macy&#39;s Inc,20171201,UPDATE 2-Macy's hires more workers after Black Friday rush ,Dec 1 Macy's Inc said on Friday it had a strong start to the holiday shopping season and would hire an additional 7 000 temporary workers for its stores to deal with heavy customer numbers in the run up to Christmas.,normal
M,Macy&#39;s Inc,20171201,Macy's to hire 7 000 more seasonal workers due to strong traffic ,Dec 1 Macy's Inc said on Friday it would hire 7 000 additional temporary workers for the holiday shopping season  citing strong traffic in its stores at the start of the season.,normal
M,Macy&#39;s Inc,20171201,BRIEF-Macy’S To Hire Additional 7 000 Seasonal Associates In 2017 ,* MACY’S  INC. TO HIRE AN ADDITIONAL 7 000 SEASONAL ASSOCIATES IN 2017,normal
MMP,Magellan Midstream Partners LP,20171201,BRIEF-Magellan Midstream Launches Open Season For Proposed Crude Oil Pipeline From The Permian And Eagle Ford Basins To Corpus Christi And Houston ,* MAGELLAN MIDSTREAM LAUNCHES OPEN SEASON FOR PROPOSED CRUDE OIL PIPELINE FROM THE PERMIAN AND EAGLE FORD BASINS TO CORPUS CHRISTI AND HOUSTON,topStory
MD,Mednax Inc,20171201,Deals of the day-Mergers and acquisitions ,Dec 1 The following bids  mergers  acquisitions and disposals were reported by 2100 GMT on Friday:,topStory
MD,Mednax Inc,20171201,Mednax fielding takeover interest from buyout firms: sources ,Mednax Inc  a U.S. healthcare network operator targeted by activist hedge fund Elliott Management Corp  is fielding acquisition interest from several private equity firms  according to people familiar with the matter.,normal
MD,Mednax Inc,20171201,UPDATE 1-Mednax fielding takeover interest from buyout firms -sources ,Dec 1 Mednax Inc  a U.S. healthcare network operator targeted by activist hedge fund Elliott Management Corp  is fielding acquisition interest from several private equity firms  according to people familiar with the matter.,normal
TAP,Molson Coors Brewing  Company,20171201,BRIEF-MillerCoors Purchases Group Annuity Contract to Secure Pension Benefits ,* MOLSON COORS BREWING CO - CO' UNIT MILLERCOORS LLC  CLOSED ON AN AGREEMENT TO PURCHASE A GROUP ANNUITY CONTRACT FROM ATHENE ANNUITY AND LIFE COMPANY,topStory
MON,Monsanto Company,20171201,CFIUS clears Bayer's planned takeover of Monsanto ,FRANKFURT Germany's Bayer  said that the Committee on Foreign Investment in the United States (CFIUS) had no national security concerns about the drugmaker's planned takeover of U.S. seeds group Monsanto   giving its go-ahead.,topStory
MON,Monsanto Company,20171201,CFIUS clears Bayer's planned takeover of Monsanto ,FRANKFURT  Dec 1 Germany's Bayer said that the Committee on Foreign Investment in the United States (CFIUS) had no national security concerns about the drugmaker's planned takeover of U.S. seeds group Monsanto  giving its go-ahead.,normal
NBR,Nabors Industries Ltd,20171201,BRIEF-Tesco Corp Shareholders Vote To Approve Acquisition By Nabors ,* TESCO CORPORATION SHAREHOLDERS VOTE TO APPROVE ACQUISITION BY NABORS,topStory
NBR,Nabors Industries Ltd,20171201,BRIEF-Nabors And Saudi Aramco Commence Joint Venture Operations ,* NABORS INDUSTRIES - CO  SAUDI ARAMCO HAVE MADE CONTRIBUTIONS OF EQUAL VALUE OF CASH AND/OR ASSETS INTO ENTITY,normal
NGG,National Grid Transco PLC,20171201,India's Wipro faces lawsuit by National Grid US ,Wipro Ltd   India's No.3 software exporter  said on Friday that it would challenge a lawsuit filed by National Grid US seeking damages of over $140 million related to a project that dates back to 2009.,topStory
NGG,National Grid Transco PLC,20171201,UPDATE 1-India's Wipro faces lawsuit by National Grid US ,Dec 1 Wipro Ltd  India's No.3 software exporter  said on Friday that it would challenge a lawsuit filed by National Grid US seeking damages of over $140 million related to a project that dates back to 2009.,normal
NGG,National Grid Transco PLC,20171201,India's Wipro faces lawsuit from National Grid US ,Dec 1 Wipro Ltd  India's No.3 software exporter  said on Friday that it would challenge a lawsuit filed by National Grid US seeking damages of over $140 million related to a project that dates back to 2009.,normal
NNN,National Retail Properties,20171201,BRIEF-Group Lease Has Not Come To A Deal With J Trust Regarding ‍​Cancelling Investment Agreements ,* CO HAS NOT COME TO ANY AGREEMENT WITH J TRUST CO REGARDING ‍​CANCELLING INVESTMENT AGREEMENTS,topStory
NOK,Nokia Corporation,20171201,BlackBerry loses payment dispute with Nokia  to pay $137 million ,HELSINKI/TORONTO An arbitration court ordered smartphone pioneer BlackBerry Ltd to pay $137 million to Nokia to settle a payment dispute and the Canadian company said it would pursue a separate patent infringement case against the Finnish firm.,topStory
NOK,Nokia Corporation,20171201,CANADA STOCKS-TSX slips as gold miners  tech stocks weigh; energy stocks  CIBC rise ,TORONTO  Dec 1 Canada's main stock index slipped on Friday  weighed down by losses among some gold miners  technology  telecom and consumer names which offset gains for energy companies as oil prices rose and Canadian Imperial Bank of Commerce's extended post-earnings rally.,normal
NOK,Nokia Corporation,20171201,UPDATE 3-BlackBerry loses payment dispute with Nokia  to pay $137 mln ,HELSINKI/TORONTO  Dec 1 An arbitration court ordered smartphone pioneer BlackBerry Ltd  to pay $137 million to Nokia to settle a payment dispute and the Canadian company said it would pursue a separate patent infringement case against the Finnish firm.,normal
NOK,Nokia Corporation,20171201,CANADA STOCKS-TSX edges up as energy  bank stocks gain; miners weigh ,TORONTO  Dec 1 Canada's main stock index edged higher on Friday as banks and energy companies gained with higher oil prices and surprisingly robust domestic jobs data  while gold mining stocks pulled back.,normal
NOK,Nokia Corporation,20171201,BRIEF-Blackberry Accepts Ruling Of International Chamber Of Commerce International Court Of Arbitration In Payment Dispute Filed By Nokia ,* BLACKBERRY ACCEPTS RULING OF INTERNATIONAL CHAMBER OF COMMERCE INTERNATIONAL COURT OF ARBITRATION IN PAYMENT DISPUTE FILED BY NOKIA,normal
NUE,Nucor Corporation,20171201,BRIEF-Nucor Says Sets Regular Quarterly Cash Dividend Of $0.38 per Share ,* SETS REGULAR QUARTERLY CASH DIVIDEND OF $0.38PER SHARE Source text for Eikon: Further company coverage:,topStory
PTR,PetroChina Company Limited,20171201,Shell  PetroChina jv paves way toward big gas development in Australia ,MELBOURNE Royal Dutch Shell and PetroChina have taken  a big step toward a long awaited gas development in Australia  signing a 27-year deal to supply Shell's Queensland Curtis Liquefied Natural Gas (QCLNG) project.,topStory
PTR,PetroChina Company Limited,20171201,UPDATE 1-Shell  PetroChina jv paves way toward big gas development in Australia ,* Deal could boost Queensland gas supply by 16 pct (Adds Shell comments  market background),normal
PBR,Petroleo Brasileiro SA- Petrobras,20171201,First Libra pre-salt oil shipment likely in early January -Petrobras ,RIO DE JANEIRO  Dec 1 Petróleo Brasileiro SA is likely to begin shipping oil from the Libra pre-salt area early in January  an executive at the Brazilian state-controlled oil company said on Friday.,topStory
PFE,Pfizer Inc,20171201,BRIEF-Pfizer Says Entered Into Agreement To Develop And Commercialize Cresemba In China And Asia Pacific ,* SAYS ‍PFIZER ENTERS INTO AGREEMENT TO DEVELOP AND COMMERCIALIZE CRESEMBA (ISAVUCONAZOLE) IN CHINA AND ASIA PACIFIC REGION​ Source text for Eikon: Further company coverage: ( Bangalore.newsroom@thomsonreuters.com ),topStory
PFE,Pfizer Inc,20171201,BRIEF-Basilea Extends Existing License Agreement With Pfizer For Cresemba ,* BASILEA EXTENDS EXISTING LICENSE AGREEMENT WITH PFIZER FOR ANTIFUNGAL CRESEMBA® (ISAVUCONAZOLE) TO CHINA AND ASIA PACIFIC,normal
DOC,Physicians Realty Trust,20171201,BRIEF-Physicians Realty Trust Issued $350 Mln 3.950 Pct Senior Notes Due 2028​ ,* PHYSICIANS REALTY TRUST - ‍ON DEC 1  2017  PHYSICIANS REALTY L.P.  ISSUED $350.0 MILLION 3.950% SENIOR NOTES DUE 2028​,topStory
PAA,Plains All American Pipeline LP,20171201,BRIEF-Plains All American Pipeline Says Selling Unitholders May Offer About 69.7 Mln Common Units ,* PLAINS ALL AMERICAN PIPELINE - SELLING UNITHOLDERS MAY OFFER AND SELL ABOUT 69.7 MILLION COMMON UNITS REPRESENTING LIMITED PARTNER INTERESTS IN‍​ CO,topStory
PAH,Platform Specialty Products Corporation,20171201,BRIEF-Platform Specialty Products Corp Announces Pricing Of Tack-On Offering Of 5.875 Pct Senior Notes Due 2025 ,* PLATFORM SPECIALTY PRODUCTS CORPORATION ANNOUNCES PRICING OF TACK-ON OFFERING OF 5.875% SENIOR NOTES DUE 2025,topStory
PX,Praxair Inc,20171201,BRIEF-Praxair  GE Aviation Open New Advanced Jet Engine Coatings Facility In Ellisville  Mississippi ,* PRAXAIR AND GE AVIATION OPEN NEW ADVANCED JET ENGINE COATINGS FACILITY IN ELLISVILLE  MISSISSIPPI,topStory
PDS,Precision Drilling Corporation,20171201,BRIEF-Precision Drilling Corporation Announces Addition Of New Director ,* PRECISION DRILLING CORPORATION ANNOUNCES ADDITION OF NEW DIRECTOR,topStory
ROK,Rockwell Automation Inc,20171201,BRIEF-Rockwell Automation Acquires Odos Imaging ,* ROCKWELL AUTOMATION ACQUIRES ODOS IMAGING TO LEVERAGE 3-D TIME-OF-FLIGHT TECHNOLOGY FOR SENSING AND SAFETY APPLICATIONS Source text for Eikon: Further company coverage:,topStory
RBS,Royal Bank Scotland plc (The),20171201,RBS to close a quarter of its UK branches  drawing criticism ,LONDON British state-owned Royal Bank of Scotland (RBS)  said on Friday it will close around a quarter of its branches and cut 680 jobs as it cuts costs and encourages customers to use digital services  drawing criticism from lawmakers. | Video ,topStory
RBS,Royal Bank Scotland plc (The),20171201,RPT-UPDATE 2-RBS to close a quarter of its UK branches  drawing criticism ,* British banks set to close more than 1 000 branches this year,normal
RBS,Royal Bank Scotland plc (The),20171201,UPDATE 2-RBS to close a quarter of its UK branches  drawing criticism ,* British banks set to close more than 1 000 branches this year,normal
RBS,Royal Bank Scotland plc (The),20171201,UPDATE 2-RBS to close a quarter of its UK branches  drawing criticism ,* British banks set to close more than 1 000 branches this year,normal
RBS,Royal Bank Scotland plc (The),20171201,RBS axes further 259 British branches as expands e-banking ,LONDON  Dec 1 British state-owned Royal Bank of Scotland (RBS) said on Friday it will close 259 branches and cut 680 jobs as it reduces costs and encourages customers to use online and mobile services.,normal
SD,SandRidge Energy Inc,20171201,Icahn steps up attack on SandRidge  seeks executive pay records ,HOUSTON Activist investor Carl Icahn has stepped up his attack on SandRidge Energy Inc's proposal to buy a rival oil-and-gas producer  taking aim at the company's top executives and calling for a release of records on the deal and executive pay  according to a regulatory filing on Friday.,topStory
SD,SandRidge Energy Inc,20171201,UPDATE 2-Icahn steps up attack on SandRidge  seeks executive pay records ,HOUSTON  Dec 1 Activist investor Carl Icahn has stepped up his attack on SandRidge Energy Inc's proposal to buy a rival oil-and-gas producer  taking aim at the company's top executives and calling for a release of records on the deal and executive pay  according to a regulatory filing on Friday.,normal
SD,SandRidge Energy Inc,20171201,Icahn seeks to inspect SandRidge Energy books  records ,Dec 1 Activist investor Carl Icahn has asked to inspect certain books and records of SandRidge Energy Inc   according to a regulatory filing on Friday.,normal
SD,SandRidge Energy Inc,20171201,BRIEF-Carl Icahn Makes Demand To Inspect Certain Books And Records Of Sandridge Energy ,* CARL ICAHN - ON DEC 1  ICAHN DELIVERED TO SANDRIDGE ENERGY A DEMAND TO INSPECT CERTAIN BOOKS AND RECORDS OF SANDRIDGE,normal
SNY,Sanofi,20171201,Sanofi ends development of C. difficile vaccine ,Pharmaceutical company Sanofi SA said on Friday that it had ended development of an experimental vaccine for Clostridium difficile infection  after an early look at late-stage trial results indicated a low probability for success.,topStory
SNY,Sanofi,20171201,UPDATE 1-Sanofi ends development of C. difficile vaccine ,Dec 1 Pharmaceutical company Sanofi SA said on Friday that it had ended development of an experimental vaccine for Clostridium difficile infection  after an early look at late-stage trial results indicated a low probability for success.,normal
SNY,Sanofi,20171201,Sanofi ends development of C. difficile vaccine ,Dec 1 Pharmaceutical company Sanofi SA said on Friday that it had ended development of an experimental vaccine for Clostridium difficile infection  after an early look at late-stage trial results indicated a low probability for success.,normal
SNY,Sanofi,20171201,BRIEF-Sanofi Ends Development Of Clostridium Difficile Vaccine ,* SANOFI - IDMC FOR PHASE III CDIFFENSE CLINICAL TRIAL PROGRAM CONCLUDED THAT PROBABILITY THAT STUDY WILL MEET ITS PRIMARY OBJECTIVE IS LOW,normal
SNY,Sanofi,20171201,BRIEF-Sanofi Ends Development Of Clostridium Difficile Vaccine ,* REG-SANOFI ENDS DEVELOPMENT OF CLOSTRIDIUM DIFFICILE VACCINE,normal
SNY,Sanofi,20171201,Nestle  Stada prepare rival bids for Germany's Merck consumer health: sources ,LONDON/FRANKFURT Swiss food giant Nestle and the private equity owners of German drug firm Stada are both preparing tentative bids for Merck KgaA's consumer health unit  several sources told Reuters.,normal
SNY,Sanofi,20171201,Nestle  Stada prepare rival bids for Germany's Merck consumer health - sources ,LONDON/FRANKFURT  Nov 30 Swiss food giant Nestle and the private equity owners of German drug firm Stada are both preparing tentative bids for Merck KgaA's consumer health unit  several sources told Reuters.,normal
SHOP,Shopify Inc,20171201,CANADA STOCKS-TSX slips as gold miners  tech stocks weigh; energy stocks  CIBC rise ,TORONTO  Dec 1 Canada's main stock index slipped on Friday  weighed down by losses among some gold miners  technology  telecom and consumer names which offset gains for energy companies as oil prices rose and Canadian Imperial Bank of Commerce's extended post-earnings rally.,normal
SPG,Simon Property Group Inc,20171201,Fitch Rates Simon Property Group's Notes Offering 'A'; Outlook Stable ,(The following statement was released by the rating agency) NEW YORK  December 01 (Fitch) Fitch Ratings has assigned an 'A' rating to the multi-tranche senior notes issued by Simon Property Group  L.P.  the operating partnership of Simon Property Group  Inc. (NYSE: SPG). The offering is comprised of notes due 2023 and 2027. KEY RATING DRIVERS SPG's 'A' Issuer Default Rating (IDR) reflects the company's continued market-leading access to capital  high quality real estate portfolio  cycle-tested m,topStory
SLG,SL Green Realty Corporation,20171201,BRIEF-SL Green To Increase Common Dividend For Seventh Consecutive Year ,* SL GREEN TO INCREASE COMMON DIVIDEND FOR SEVENTH CONSECUTIVE YEAR,topStory
SLG,SL Green Realty Corporation,20171201,Fitch Upgrades SL Green to 'BBB'; Outlook Stable ,(The following statement was released by the rating agency) NEW YORK  December 01 (Fitch) Fitch Ratings has upgraded the ratings for SL Green (NYSE: SLG)  including the company's Issuer Default Rating (IDR) to 'BBB' from 'BBB-'. The Rating Outlook is Stable. A full list of ratings follows at the end of the release. KEY RATING DRIVERS The upgrade reflects the company's adherence to tighter financial policies  including targeting leverage below 7.0x. It also considers the progress SLG has made aga,normal
SLG,SL Green Realty Corporation,20171201,BRIEF-SL Green Realty Corp Announces $500 Mln Increase To Share Repurchase Program ,* SL GREEN REALTY CORP. ANNOUNCES $500 MILLION INCREASE TO SHARE REPURCHASE PROGRAM,normal
SON,Sonoco Products Company,20171201,BRIEF-Sonoco Estimates 2018 Base EPS To Be In Range Of $3.00 TO $3.10 ,* SONOCO ISSUES 2018 FINANCIAL GUIDANCE AND TARGETS STRATEGIC PRIORITIES,topStory
SMP,Standard Motor Products Inc,20171201,BRIEF-Standard Motor Products Forms JV With Foshan Guangdong Automotive Air Conditioning Co ,* STANDARD MOTOR PRODUCTS INC - FORMED A JOINT VENTURE WITH FOSHAN GUANGDONG AUTOMOTIVE AIR CONDITIONING CO LTD,topStory
TSM,Taiwan Semiconductor Manufacturing Company Ltd,20171201,BRIEF-TSMC orders machinery equipment worth T$5.1 bln ,Dec 1 Taiwan Semiconductor Manufacturing Co Ltd :,topStory
TTM,Tata Motors Ltd,20171201,BRIEF-India's Tata Motors Nov Domestic Sales Up 58 Pct ,* SAYS COMMERCIAL AND PASSENGER VEHICLES SALES IN DOMESTIC MARKET IN NOV AT 52 464  UP 58 PERCENT,topStory
FTI,TechnipFMC plc,20171201,TechnipFMC-led consortium to expand Bahrain refinery ,KHOBAR  Saudi Arabia/SEOUL Dec 1 State-run Bahrain Petroleum Co (Bapco) has awarded a consortium led by UK-based TechnipFMC a contract to expand Bahrain's only oil refinery  sources close to the matter told Reuters on Friday.,topStory
