FB,Facebook Inc,20180531,UPDATE 2-Facebook prevails on shareholder votes  tallies to come later ,BOSTON  May 31 Facebook Inc executives said the company prevailed on all its director nominees and shareholder proposals up for a vote at its annual meeting on Thursday  where activist investors pressed leaders on topics like the oversight of questionable content.,topStory,Sell
SU,Suncor Energy  Inc,20180531,Rising oil prices bring hope to gloomy Canada sector ,CALGARY  Alberta/VANCOUVER  May 31 Years of low oil prices and high costs spurred a stampede by multinational majors out of Canada's oil sands last year  leaving the remaining crude producers struggling to weather painful drops in profit.,normal,Sell
TRI,Thomson Reuters Corp,20180531,Reuters wins GEN 2018 Data Journalism Award for Data Visualization of  the Year ,Reuters has been awarded the Data Visualization of the Year award in GEN’s 2018 Data Journalism Awards contest. Reuters winning entry  ‘Life in the Camps’ by Simon Scarr and Weiyi Cai  provided the first detailed look at the dire living conditions inside the Rohingya refugee camps in Cox’s Bazar. Over the past seven years  the Global Editors Network has organised the Data Journalism Awards competition to celebrate and credit outstanding work in the field of data-driven journalism worldwide. ,topStory,Sell
TWTR,Twitter Inc,20180531,Twitter defeats TWiT trademark lawsuit ,A federal judge has dismissed a lawsuit in which the audio and video content platform TWiT LLC accused Twitter Inc of trademark infringement and breach of contract  following a breakdown of a decade-long "coexistence" agreement between the companies.,topStory,Unknown
UL,Unilever PLC,20180531,Unilever CEO in no rush to quit  prefers internal successor: Bernstein ,Unilever's   outgoing veteran chief executive  Paul Polman  may stay long enough to see the company through to its 2020 targets and would prefer an internal candidate as his replacement  brokerage Bernstein said.,topStory,Sell
X,United States Steel Corporation,20180531,Steel  aluminum stocks gain as U.S. moves ahead with tariffs ,May 31 Shares of U.S. steel and aluminum makers rose on Thursday after the Trump administration moved ahead with tariffs on aluminum and steel imports from Canada  Mexico and the European Union  ending a two-month exemption.,topStory,Unknown
UTX,United Technologies Corporation,20180531,United Technologies wins $2.02 billion U.S. defense contract: Pentagon ,WASHINGTON United Technologies Corp's Pratt & Whitney Military Engines subsidiary is being awarded a $2.02 billion modification to a previously awarded contract in support of the F-35 Lightning II low-rate initial production Lot 11 aircraft  the Pentagon said on Thursday.,topStory,Unknown
UTX,United Technologies Corporation,20180531,United Technologies wins $2.02 bln U.S. defense contract -Pentagon ,WASHINGTON  May 31 United Technologies Corp's Pratt & Whitney Military Engines subsidiary is being awarded a $2.02 billion modification to a previously awarded contract in support of the F-35 Lightning II low-rate initial production Lot 11 aircraft  the Pentagon said on Thursday.,normal,Unknown
VLO,Valero Energy Corporation,20180531,UPDATE 1-Workers sue Valero over April refinery explosion -local media ,HOUSTON  May 31 More than 20 workers filed a lawsuit in Houston on Thursday against Valero Energy Corp seeking damages for injuries sustained in an April 19 explosion at the company's Texas City  Texas  refinery  the Houston Chronicle reported on its website.,topStory,Sell
VLO,Valero Energy Corporation,20180531,Workers sue Valero over April refinery explosion -local media ,HOUSTON  May 31 More than 20 workers filed a lawsuit in Houston on Thursday against Valero Energy Corp seeking damages for injuries sustained in an April 19 explosion at the company's Texas City  Texas  refinery  the Houston Chronicle reported on its website.,normal,Sell
VMW,Vmware Inc,20180531,VMware's profit  revenue beat estimates for fifth straight quarter ,VMware Inc  reported better-than-expected quarterly profit and revenue for the fifth straight quarter on Thursday  as more customers licensed its software products.,topStory,Unknown
VMW,Vmware Inc,20180531,UPDATE 1-VMware's profit  revenue beat estimates for fifth straight quarter ,May 31 VMware Inc reported better-than-expected quarterly profit and revenue for the fifth straight quarter on Thursday  as more customers licensed its software products.,normal,Unknown
VMW,Vmware Inc,20180531,VMware's quarterly profit jumps nearly four-fold ,May 31 Business software maker VMware Inc reported a near four-fold rise in first-quarter profit as it booked a gain of $781 million from Pivotal Software's initial public offering.,normal,Sell
WMT,Walmart Inc,20180531,Walmart launches order-by-text service to challenge Amazon Prime ,BENTONVILLE  Ark. Walmart Inc  is starting a new same-day delivery service where customers can place orders using a text message  another step in its effort to scale up its e-commerce offerings and compete with rival Amazon.com Inc .,topStory,Unknown
WMT,Walmart Inc,20180531,Walmart launches order-by-text service to challenge Amazon Prime ,BENTONVILLE  Ark.  May 31 Walmart Inc is starting a new same-day delivery service where customers can place orders using a text message  another step in its effort to scale up its e-commerce offerings and compete with rival Amazon.com Inc.,normal,Unknown
WMT,Walmart Inc,20180531,Ahead of Sainsbury's takeover  Asda says results on track ,LONDON  May 31 Asda  the British supermarket arm of Walmart that is set to be acquired by Sainsbury's   posted a 13 percent fall in profit in 2017  a performance which it said was in line with expectations and showed its recovery was on track.,normal,Unknown
WSM,Williams-Sonoma Inc,20180531,Ex Williams-Sonoma employee can’t cook up any more claims – Calif. court ,A mid-level California appeals court has ruled that a former Williams-Sonoma Inc employee was barred from suing the retailer for alleged wage-and-hour violations after he participated in an earlier settlement with the company over unpaid wages.,topStory,Unknown
