IONS,Ionis Pharmaceuticals Inc,20180329,UPDATE 2-Pfizer's rare heart disease drug succeeds in late-stage study ,* Brokerage Suntrust estimates sales of $130 mln of drug in 2022,topStory
DTYS,iPath US Treasury 10-year Bear ETN,20180329,Barclays $2 billion fraud fine resolves major U.S. legal issue ,LONDON/WASHINGTON Barclays  will pay $2 billion to settle claims for billions of dollars of losses suffered by investors who bought toxic mortgage-backed securities in the run-up to the 2007 financial crisis  the U.S. Justice Department said on Thursday.,topStory
DTYS,iPath US Treasury 10-year Bear ETN,20180329,UPDATE 2-Barclays $2 bln fraud fine resolves major U.S. legal issue ,* Bank to take 0.45 pct CET1 hit in Q1 (Adds background and analyst comment  updates shares),normal
DTYS,iPath US Treasury 10-year Bear ETN,20180329,BRIEF-‍Barclays Reaches $2 bln RMBS Settlement With United States Department Of Justice ,* ‍BARCLAYS REACHES SETTLEMENT WITH UNITED STATES DEPARTMENT OF JUSTICE IN RELATION TO RESIDENTIAL MORTGAGE-BACKED SECURITIES,normal
DTYS,iPath US Treasury 10-year Bear ETN,20180329,Barclays to pay $2 bln U.S. fine over mortgage fraud claims -Justice Dept. ,WASHINGTON  March 29 Barclays has agreed to pay $2 billion for allegedly causing billions of dollars of losses to investors by engaging in a fraudulent scheme to sell residential mortgage-backed securities between 2005 and 2007  the U.S. Justice Department said on Thursday.,normal
DTUS,iPath US Treasury 2-year Bear ETN,20180329,Barclays $2 billion fraud fine resolves major U.S. legal issue ,LONDON/WASHINGTON Barclays  will pay $2 billion to settle claims for billions of dollars of losses suffered by investors who bought toxic mortgage-backed securities in the run-up to the 2007 financial crisis  the U.S. Justice Department said on Thursday.,topStory
DTUS,iPath US Treasury 2-year Bear ETN,20180329,UPDATE 2-Barclays $2 bln fraud fine resolves major U.S. legal issue ,* Bank to take 0.45 pct CET1 hit in Q1 (Adds background and analyst comment  updates shares),normal
DTUS,iPath US Treasury 2-year Bear ETN,20180329,BRIEF-‍Barclays Reaches $2 bln RMBS Settlement With United States Department Of Justice ,* ‍BARCLAYS REACHES SETTLEMENT WITH UNITED STATES DEPARTMENT OF JUSTICE IN RELATION TO RESIDENTIAL MORTGAGE-BACKED SECURITIES,normal
DTUS,iPath US Treasury 2-year Bear ETN,20180329,Barclays to pay $2 bln U.S. fine over mortgage fraud claims -Justice Dept. ,WASHINGTON  March 29 Barclays has agreed to pay $2 billion for allegedly causing billions of dollars of losses to investors by engaging in a fraudulent scheme to sell residential mortgage-backed securities between 2005 and 2007  the U.S. Justice Department said on Thursday.,normal
DTUL,iPath US Treasury 2-year Bull ETN,20180329,Barclays $2 billion fraud fine resolves major U.S. legal issue ,LONDON/WASHINGTON Barclays  will pay $2 billion to settle claims for billions of dollars of losses suffered by investors who bought toxic mortgage-backed securities in the run-up to the 2007 financial crisis  the U.S. Justice Department said on Thursday.,topStory
DTUL,iPath US Treasury 2-year Bull ETN,20180329,UPDATE 2-Barclays $2 bln fraud fine resolves major U.S. legal issue ,* Bank to take 0.45 pct CET1 hit in Q1 (Adds background and analyst comment  updates shares),normal
DTUL,iPath US Treasury 2-year Bull ETN,20180329,BRIEF-‍Barclays Reaches $2 bln RMBS Settlement With United States Department Of Justice ,* ‍BARCLAYS REACHES SETTLEMENT WITH UNITED STATES DEPARTMENT OF JUSTICE IN RELATION TO RESIDENTIAL MORTGAGE-BACKED SECURITIES,normal
DTUL,iPath US Treasury 2-year Bull ETN,20180329,Barclays to pay $2 bln U.S. fine over mortgage fraud claims -Justice Dept. ,WASHINGTON  March 29 Barclays has agreed to pay $2 billion for allegedly causing billions of dollars of losses to investors by engaging in a fraudulent scheme to sell residential mortgage-backed securities between 2005 and 2007  the U.S. Justice Department said on Thursday.,normal
DFVS,iPath US Treasury 5-year Bear ETN,20180329,Barclays $2 billion fraud fine resolves major U.S. legal issue ,LONDON/WASHINGTON Barclays  will pay $2 billion to settle claims for billions of dollars of losses suffered by investors who bought toxic mortgage-backed securities in the run-up to the 2007 financial crisis  the U.S. Justice Department said on Thursday.,topStory
DFVS,iPath US Treasury 5-year Bear ETN,20180329,UPDATE 2-Barclays $2 bln fraud fine resolves major U.S. legal issue ,* Bank to take 0.45 pct CET1 hit in Q1 (Adds background and analyst comment  updates shares),normal
DFVS,iPath US Treasury 5-year Bear ETN,20180329,BRIEF-‍Barclays Reaches $2 bln RMBS Settlement With United States Department Of Justice ,* ‍BARCLAYS REACHES SETTLEMENT WITH UNITED STATES DEPARTMENT OF JUSTICE IN RELATION TO RESIDENTIAL MORTGAGE-BACKED SECURITIES,normal
DFVS,iPath US Treasury 5-year Bear ETN,20180329,Barclays to pay $2 bln U.S. fine over mortgage fraud claims -Justice Dept. ,WASHINGTON  March 29 Barclays has agreed to pay $2 billion for allegedly causing billions of dollars of losses to investors by engaging in a fraudulent scheme to sell residential mortgage-backed securities between 2005 and 2007  the U.S. Justice Department said on Thursday.,normal
DFVL,iPath US Treasury 5-year Bull ETN,20180329,Barclays $2 billion fraud fine resolves major U.S. legal issue ,LONDON/WASHINGTON Barclays  will pay $2 billion to settle claims for billions of dollars of losses suffered by investors who bought toxic mortgage-backed securities in the run-up to the 2007 financial crisis  the U.S. Justice Department said on Thursday.,topStory
DFVL,iPath US Treasury 5-year Bull ETN,20180329,UPDATE 2-Barclays $2 bln fraud fine resolves major U.S. legal issue ,* Bank to take 0.45 pct CET1 hit in Q1 (Adds background and analyst comment  updates shares),normal
DFVL,iPath US Treasury 5-year Bull ETN,20180329,BRIEF-‍Barclays Reaches $2 bln RMBS Settlement With United States Department Of Justice ,* ‍BARCLAYS REACHES SETTLEMENT WITH UNITED STATES DEPARTMENT OF JUSTICE IN RELATION TO RESIDENTIAL MORTGAGE-BACKED SECURITIES,normal
DFVL,iPath US Treasury 5-year Bull ETN,20180329,Barclays to pay $2 bln U.S. fine over mortgage fraud claims -Justice Dept. ,WASHINGTON  March 29 Barclays has agreed to pay $2 billion for allegedly causing billions of dollars of losses to investors by engaging in a fraudulent scheme to sell residential mortgage-backed securities between 2005 and 2007  the U.S. Justice Department said on Thursday.,normal
FLAT,iPath US Treasury Flattener ETN,20180329,Barclays $2 billion fraud fine resolves major U.S. legal issue ,LONDON/WASHINGTON Barclays  will pay $2 billion to settle claims for billions of dollars of losses suffered by investors who bought toxic mortgage-backed securities in the run-up to the 2007 financial crisis  the U.S. Justice Department said on Thursday.,topStory
FLAT,iPath US Treasury Flattener ETN,20180329,UPDATE 2-Barclays $2 bln fraud fine resolves major U.S. legal issue ,* Bank to take 0.45 pct CET1 hit in Q1 (Adds background and analyst comment  updates shares),normal
FLAT,iPath US Treasury Flattener ETN,20180329,BRIEF-‍Barclays Reaches $2 bln RMBS Settlement With United States Department Of Justice ,* ‍BARCLAYS REACHES SETTLEMENT WITH UNITED STATES DEPARTMENT OF JUSTICE IN RELATION TO RESIDENTIAL MORTGAGE-BACKED SECURITIES,normal
FLAT,iPath US Treasury Flattener ETN,20180329,Barclays to pay $2 bln U.S. fine over mortgage fraud claims -Justice Dept. ,WASHINGTON  March 29 Barclays has agreed to pay $2 billion for allegedly causing billions of dollars of losses to investors by engaging in a fraudulent scheme to sell residential mortgage-backed securities between 2005 and 2007  the U.S. Justice Department said on Thursday.,normal
DLBS,iPath US Treasury Long Bond Bear ETN,20180329,Barclays $2 billion fraud fine resolves major U.S. legal issue ,LONDON/WASHINGTON Barclays  will pay $2 billion to settle claims for billions of dollars of losses suffered by investors who bought toxic mortgage-backed securities in the run-up to the 2007 financial crisis  the U.S. Justice Department said on Thursday.,topStory
DLBS,iPath US Treasury Long Bond Bear ETN,20180329,UPDATE 2-Barclays $2 bln fraud fine resolves major U.S. legal issue ,* Bank to take 0.45 pct CET1 hit in Q1 (Adds background and analyst comment  updates shares),normal
DLBS,iPath US Treasury Long Bond Bear ETN,20180329,BRIEF-‍Barclays Reaches $2 bln RMBS Settlement With United States Department Of Justice ,* ‍BARCLAYS REACHES SETTLEMENT WITH UNITED STATES DEPARTMENT OF JUSTICE IN RELATION TO RESIDENTIAL MORTGAGE-BACKED SECURITIES,normal
DLBS,iPath US Treasury Long Bond Bear ETN,20180329,Barclays to pay $2 bln U.S. fine over mortgage fraud claims -Justice Dept. ,WASHINGTON  March 29 Barclays has agreed to pay $2 billion for allegedly causing billions of dollars of losses to investors by engaging in a fraudulent scheme to sell residential mortgage-backed securities between 2005 and 2007  the U.S. Justice Department said on Thursday.,normal
STPP,iPath US Treasury Steepener ETN,20180329,Barclays $2 billion fraud fine resolves major U.S. legal issue ,LONDON/WASHINGTON Barclays  will pay $2 billion to settle claims for billions of dollars of losses suffered by investors who bought toxic mortgage-backed securities in the run-up to the 2007 financial crisis  the U.S. Justice Department said on Thursday.,topStory
STPP,iPath US Treasury Steepener ETN,20180329,UPDATE 2-Barclays $2 bln fraud fine resolves major U.S. legal issue ,* Bank to take 0.45 pct CET1 hit in Q1 (Adds background and analyst comment  updates shares),normal
STPP,iPath US Treasury Steepener ETN,20180329,BRIEF-‍Barclays Reaches $2 bln RMBS Settlement With United States Department Of Justice ,* ‍BARCLAYS REACHES SETTLEMENT WITH UNITED STATES DEPARTMENT OF JUSTICE IN RELATION TO RESIDENTIAL MORTGAGE-BACKED SECURITIES,normal
STPP,iPath US Treasury Steepener ETN,20180329,Barclays to pay $2 bln U.S. fine over mortgage fraud claims -Justice Dept. ,WASHINGTON  March 29 Barclays has agreed to pay $2 billion for allegedly causing billions of dollars of losses to investors by engaging in a fraudulent scheme to sell residential mortgage-backed securities between 2005 and 2007  the U.S. Justice Department said on Thursday.,normal
LXRX,Lexicon Pharmaceuticals Inc,20180329,BRIEF-‍Lexicon announces EMA acceptance of MAA for Sotagliflozin to treat adults with Type 1 Diabetes​ ,* ‍LEXICON PHARMACEUTICALS ANNOUNCES EMA ACCEPTANCE OF MARKETING AUTHORIZATION APPLICATION (MAA) FOR SOTAGLIFLOZIN TO TREAT ADULTS WITH TYPE 1 DIABETES​ Source text for Eikon: Further company coverage:,topStory
LIVN,LivaNova PLC,20180329,BRIEF-Livanova Bicarbon Aortic Valves Receive CE Mark ,* LIVANOVA BICARBON AORTIC VALVES RECEIVE CE MARK FOR EXPANDED USE LABELING WITH LOWER-DOSE BLOOD THINNERS IN LOW-RISK PATIENTS Source text for Eikon: Further company coverage:,topStory
MBII,Marrone Bio Innovations Inc,20180329,BRIEF-Marrone Bio Innovations Says Q4 Revenue Rose 23.3 Pct To $3.3 Mln ,* MARRONE BIO INNOVATIONS  INC. REPORTS RECORD FULL YEAR 2017 FINANCIAL RESULTS,topStory
MTCH,Match Group Inc,20180329,Dating app Bumble sues rival Match Group ,Dating app Bumble Trading Inc on Wednesday filed a U.S. lawsuit accusing rival Match Group Inc of fraud and trade secrets theft  escalating a court fight that broke out after failed buyout talks.,topStory
MTCH,Match Group Inc,20180329,UPDATE 2-Dating app Bumble sues rival Match Group ,March 29 Dating app Bumble Trading Inc on Wednesday filed a U.S. lawsuit accusing rival Match Group Inc of fraud and trade secrets theft  escalating a court fight that broke out after failed buyout talks.,normal
MTCH,Match Group Inc,20180329,Dating app Bumble sues rival Match Group ,March 29 Dating app Bumble Trading Inc on Wednesday filed a U.S. lawsuit accusing rival Match Group Inc of fraud and trade secrets theft  escalating a court fight that has followed failed buyout talks.,normal
MTSL,MER Telemanagement Solutions Ltd,20180329,BRIEF-MTS Announces Adi Orzel Board Resignation ,* MER TELEMANAGEMENT SOLUTIONS - ADI ORZEL HAS RESIGNED FROM BOARD OF MTS  ALSO FROM POSITION OF CHAIRMAN OF BOARD OF COMPANY'S SUBSIDIARY  VEXIGO LTD Source text for Eikon: Further company coverage:,topStory
MSFT,Microsoft Corporation,20180329,Microsoft's Windows head to leave company amid reorganization ,Microsoft Corp on Thursday said Terry Myerson  executive vice president of its Windows and devices business  will be leaving the company amid a major management reshuffle that increases the company's focus on its cloud products.,topStory
MSFT,Microsoft Corporation,20180329,REFILE-Microsoft's veteran Windows head Terry Myerson to leave company ,March 29 Microsoft Corp on Thursday said Terry Myerson  executive vice president of its Windows and devices business  will be leaving the company amid a major management reshuffle.,normal
MSFT,Microsoft Corporation,20180329,US STOCKS-Wall St up more than 1 pct on last day of tumultuous quarter ,* Indexes up: Dow 1.06 pct  S&P 1.11 pct  Nasdaq 1.22 pct (Updates to early afternoon),normal
MSFT,Microsoft Corporation,20180329,US STOCKS-Wall St surges on last day of turbulent quarter ,* Indexes up: Dow 1.19 pct  S&P 1.18 pct  Nasdaq 1.37 pct (Changes comments  adds details  updates prices),normal
MSFT,Microsoft Corporation,20180329,BRIEF-Microsoft to invest $30 mln in France over 3 years in artificial intelligence sector ,* SAYS TO INVEST $30 MILLION IN FRANCE OVER 3 YEARS TO HELP DEVELOP ARTIFICIAL INTELLIGENCE (AI) SECTOR IN FRANCE,normal
MSFT,Microsoft Corporation,20180329,Ex-Microsoft manager lands Responsible Cobalt Initiative role ,BEIJING A former manager for Microsoft Corp in China has been named as the first executive secretary of the Responsible Cobalt Initiative (RCI)  which works to address social and environmental risks in the cobalt supply chain.,normal
MSFT,Microsoft Corporation,20180329,Ex-Microsoft manager lands Responsible Cobalt Initiative role ,BEIJING  March 29 A former manager for Microsoft Corp in China has been named as the first executive secretary of the Responsible Cobalt Initiative (RCI)  which works to address social and environmental risks in the cobalt supply chain.,normal
MDLZ,Mondelez International Inc,20180329,BRIEF-Mondelēz International Appoints Martin Renaud As Global Chief Marketing Officer ,* MONDELĒZ INTERNATIONAL APPOINTS MARTIN RENAUD AS GLOBAL CHIEF MARKETING OFFICER,topStory
MRCC,Monroe Capital Corporation,20180329,BRIEF-Monroe Capital Hires Karin Kovacic As Managing Director ,* MONROE CAPITAL HIRES KARIN KOVACIC AS MANAGING DIRECTOR Source text for Eikon: Further company coverage:,topStory
NFLX,Netflix Inc,20180329,China's Netflix-like video platform iQiyi dips on Nasdaq debut ,Shares of Chinese streaming platform iQiyi Inc  fell below their initial public offering (IPO) price in the stock's market debut on Thursday  even as the technology sector rebounded from a sharp sell-off ahead of the Good Friday holiday weekend.,topStory
NFLX,Netflix Inc,20180329,FANG stocks' bite has U.S. fund managers looking for alternatives ,NEW YORK Fund managers have begun to ditch so-called FANG stocks that powered the U.S. stock market to record highs in January and are slowly rotating into commodity-related shares and other value stocks which typically outperform in late-cycle recoveries. | Video ,normal
NEWT,Newtek Business Services Corp,20180329,BRIEF-Newtek Announces The Signing Of A Letter Of Intent For New $75.0 Million SBA 504 Credit Facility With Capital One ,* NEWTEK ANNOUNCES THE SIGNING OF A LETTER OF INTENT FOR NEW $75.0 MILLION SBA 504 CREDIT FACILITY WITH CAPITAL ONE,topStory
NEWTZ,Newtek Business Services Corp,20180329,BRIEF-Newtek Announces The Signing Of A Letter Of Intent For New $75.0 Million SBA 504 Credit Facility With Capital One ,* NEWTEK ANNOUNCES THE SIGNING OF A LETTER OF INTENT FOR NEW $75.0 MILLION SBA 504 CREDIT FACILITY WITH CAPITAL ONE,topStory
NMIH,NMI Holdings Inc,20180329,BRIEF-NMI Says CEO Bradley M. Shuster's 2017 Total Compensation Was $4.63 Mln Vs $3.15 Mln ,* NMI HOLDINGS INC SAYS CEO BRADLEY M. SHUSTER'S 2017 TOTAL COMPENSATION WAS $4.63 MILLION VERSUS $3.15 MILLION IN 2016 – SEC FILING‍​ Source text: (https://bit.ly/2pNiDLb) Further company coverage:,topStory
NVFY,Nova Lifestyle Inc,20180329,BRIEF-Nova Lifestyle Q4 Revenue $35.7 Million ,* NOVA LIFESTYLE REPORTS OUTSTANDING FOURTH QUARTER AND FULL YEAR 2017 FINANCIAL RESULTS  HIGHLIGHTED BY Q4 PRE-TAX EPS OF $0.18,topStory
NVDA,NVIDIA Corporation,20180329,Chipmaker Nvidia's CEO says Uber does not use its self-driving processing solution ,Uber Technologies Inc [UBER.UL] does not use the self-driving platform architecture of Nvidia Corp  the chipmaker's Chief Executive Jensen Huang said on Wednesday.,topStory
NVDA,NVIDIA Corporation,20180329,Chipmaker Nvidia's CEO says Uber does not use its self-driving processing solution ,March 28 Uber Technologies Inc does not use the self-driving platform architecture of Nvidia Corp   the chipmaker's Chief Executive Jensen Huang said on Wednesday.,normal
OVAS,OvaScience Inc,20180329,BRIEF-AIGH Investment Partners Reports 6.2 Percent Passive Stake In Ovascience Inc As Of March 28  2018 ‍​ ,* AIGH INVESTMENT PARTNERS  L.P. REPORTS 6.2 PERCENT PASSIVE STAKE IN OVASCIENCE INC AS OF MARCH 28  2018 - SEC FILING‍​ Source text : [https://bit.ly/2pOX7po] Further company coverage:,topStory
OVID,Ovid Therapeutics Inc,20180329,BRIEF-Ovid Therapeutics Reports Q4 Loss Per Share $0.45 ,* OVID THERAPEUTICS REPORTS FOURTH QUARTER AND FULL YEAR 2017 FINANCIAL RESULTS AND CORPORATE PROGRESS,topStory
PRKR,ParkerVision Inc,20180329,BRIEF-Parkervision Q4 Adj Loss Per Share $0.26 ,* PARKERVISION REPORTS FOURTH QUARTER AND FULL YEAR 2017 RESULTS,topStory
PTNR,Partner Communications Company Ltd,20180329,Israel's Partner Comms Q4 net loss widens on one-time expense ,TEL AVIV  March 29 Partner Communications   Israel's second-largest mobile phone operator  reported on Thursday a wider than expected loss in the fourth quarter after it recorded a one-time expense resulting from early loan repayments.,topStory
PYDS,Payment Data Systems Inc,20180329,BRIEF-Payment Data Systems Q4 Loss Per Share $0.13 ,* PAYMENT DATA SYSTEMS ANNOUNCES RECORD REVENUES OF $5.6 MILLION FOR FOURTH QUARTER AND $14.6 MILLION FOR FISCAL 2017,topStory
CNXN,PC Connection Inc,20180329,BRIEF-Stephen Sarno Joins Connection As CFO ,* PC CONNECTION INC - STEPHEN P. SARNO HAS JOINED COMPANY AS SENIOR VICE PRESIDENT  CHIEF FINANCIAL OFFICER Source text for Eikon: Further company coverage:,topStory
PENN,Penn National Gaming Inc,20180329,BRIEF-Penn National Gaming Shareholders Approve Pinnacle Entertainment Acquisition ,* PENN NATIONAL GAMING SHAREHOLDERS APPROVE PINNACLE ENTERTAINMENT ACQUISITION,topStory
PTCT,PTC Therapeutics Inc,20180329,BRIEF-PTC Therapeutics Prices Public Offering Of Common Stock At $27.04 Per Share​ ,* PTC THERAPEUTICS ANNOUNCES PRICING OF PUBLIC OFFERING OF COMMON STOCK,topStory
RETA,Reata Pharmaceuticals Inc,20180329,BRIEF-Reata Announces That Kyowa Hakko Kirin Received Sakigake Priority Review Designation For Bardoxolone Methyl In Japan ,* REATA ANNOUNCES THAT KYOWA HAKKO KIRIN RECEIVED SAKIGAKE PRIORITY REVIEW DESIGNATION FOR BARDOXOLONE METHYL IN JAPAN Source text for Eikon: Further company coverage:,topStory
MARK,Remark Holdings Inc,20180329,BRIEF-Remark Holdings reports Q4 Loss Per Share Of $3.47 ,* REMARK HOLDINGS REPORTS FOURTH QUARTER AND FULL YEAR 2017 RESULTS,topStory
MARK,Remark Holdings Inc,20180329,BRIEF-Remark Holdings Reports Q4 Loss Per Share $3.47 ,* REMARK HOLDINGS REPORTS FOURTH QUARTER AND FULL YEAR 2017 RESULTS,normal
RXII,RXi Pharmaceuticals Corporation,20180329,BRIEF-Rxi Pharmaceuticals Files For Mixed Shelf Of Upto $100 Million ,* RXI PHARMACEUTICALS CORP FILES FOR MIXED SHELF OF UPTO $100 MILLION - SEC FILING Source text: (https://bit.ly/2If6FB2) Further company coverage:,topStory
SHLD,Sears Holdings Corporation,20180329,BRIEF-Sears Holdings CEO's 2017 Total Compensation Was $4.3 Mln ,* SEARS HOLDINGS CORP SAYS CEO EDWARD LAMPERT'S TOTAL COMPENSATION FOR 2017 WAS $4.3 MILLION VERSUS $3.5 MILLION IN 2016 - SEC FILING  ‍​ Source text (https://bit.ly/2Goykiw) Further company coverage:,topStory
SHPG,Shire plc,20180329,Merits of any Takeda bid for Shire questioned  shares slide ,TOKYO A potential acquisition of London-listed Shire  by Takeda Pharmaceutical  was greeted with investor scepticism about its merits on Thursday  with shares in the Japanese drug maker tumbling 7 percent.,topStory
SHPG,Shire plc,20180329,REFILE-UPDATE 2-Merits of any Takeda bid for Shire questioned  shares slide ,TOKYO  March 29 A potential acquisition of London-listed Shire by Takeda Pharmaceutical was greeted with investor scepticism about its merits on Thursday  with shares in the Japanese drug maker tumbling 7 percent.,normal
SHPG,Shire plc,20180329,UPDATE 1-UK Stocks-Factors to watch on March 29 ,March 29 Britain's FTSE 100 index is seen opening 20 points lower at 7 025 on Thursday  according to financial bookmakers  with futures down 0.40 percent ahead of the cash market open.,normal
SHPG,Shire plc,20180329,Nikkei rises  helped by retail  food stocks; Takeda stumbles ,TOKYO  March 29 Japan's Nikkei share average rose on Thursday  helped by gains in domestic-demand stocks  but Takeda Pharmaceutical stumbled after it said it was considering a bid for London-listed Shire that could top $40 billion.,normal
SHPG,Shire plc,20180329,UK Stocks-Factors to watch on March 29 ,    March 29 Britain's FTSE 100 index is seen opening 20 points lower at 7 025 on Thursday  according to financial bookmakers.          * CME/NEX: U.S. exchange operator CME Group is in advanced talks to buy Britain's NEX Group for about 3.8 billion pounds ($5.4 billion) to create a cross-border trading powerhouse.     * SHIRE: Japan's largest drugmaker Takeda Pharmaceutical is considering a bid for London-listed rare disease specialist Shire that could top $40 billion and spark anot,normal
SHPG,Shire plc,20180329,PRESS DIGEST - Wall Street Journal - March 29 ,March 29 The following are the top stories in the Wall Street Journal. Reuters has not verified these stories and does not vouch for their accuracy.,normal
SHPG,Shire plc,20180329,Nikkei rises as weak yen lifts sentiment; Takeda stumbles ,TOKYO  March 29 Japan's Nikkei share average rose on Thursday morning as a weaker yen lifted risk sentiment  but Takeda Pharmaceutical stumbled after it said it was considering a bid for London-listed Shire that could top $40 billion.,normal
SHPG,Shire plc,20180329,Drugmaker Shire soars as Japan's Takeda considers bid ,LONDON/TOKYO Japan's largest drugmaker Takeda Pharmaceutical  is considering a bid for London-listed rare disease specialist Shire  that could top $40 billion and spark another takeover battle in the deal-hungry pharma industry. | Video ,normal
SHPG,Shire plc,20180329,PRESS DIGEST- British Business - March 29 ,March 29 The following are the top stories on the business pages of British newspapers. Reuters has not verified these stories and does not vouch for their accuracy.,normal
SHPG,Shire plc,20180329,Drugmaker Takeda shares tumble as company considers bid for Shire ,TOKYO  March 29 Takeda Pharmaceutical shares sank 5 percent early on Thursday  a day after Japan's largest drugmaker said it was considering a bid for London-listed rare disease specialist Shire that could top $40 billion.,normal
SFBC,Sound Financial Bancorp Inc,20180329,BRIEF-Sound Financial Bancorp Says Laurie Stewart Appointed CFO ,* REPORTING DEPARTURE OF MATTHEW DEINES  SOUND COMMUNITY BANK'S EXECUTIVE VICE PRESIDENT  CFO,topStory
RUN,Sunrun Inc,20180329,BRIEF-Sunrun Says On March 27  Unit Entered Into Amended Credit Agreement ,* SUNRUN - ON MARCH 27  CO'S UNIT ENTERED INTO AMENDED & RESTATED REVOLVING CREDIT AGREEMENT ORIGINALLY ENTERED INTO IN JAN 2016 WITH VARIOUS LENDERS,topStory
SYNC,Synacor Inc,20180329,BRIEF-Synacor Says Co  Google Inc Entered Extension Amendment To Google Services Agreement ,* SYNACOR - ON MARCH 27  CO  GOOGLE INC ENTERED EXTENSION AMENDMENT TO GOOGLE SERVICES AGREEMENT  EFFECTIVE AS OF MARCH 29,topStory
TSLA,Tesla Inc ,20180329,Tesla shareholder lawsuit against SolarCity deal set to proceed ,A class action lawsuit by Tesla Inc shareholders against the electric car maker's chief executive  Elon Musk  and the company's board over the SolarCity deal was set to proceed after a Delaware judge refused to dismiss it.,topStory
TSLA,Tesla Inc ,20180329,UPDATE 1-Tesla shareholder lawsuit against SolarCity deal set to proceed ,March 29 A class action lawsuit by Tesla Inc shareholders against the electric car maker's chief executive  Elon Musk  and the company's board over the SolarCity deal was set to proceed after a Delaware judge refused to dismiss it.,normal
TSLA,Tesla Inc ,20180329,Tesla returned to German subsidies list  ending row ,FRANKFURT/BERLIN Tesla  buyers in Germany can apply for subsidies again because a government agency has ended its dispute with the U.S. carmaker over whether its Model S was too expensive to qualify for the incentives scheme.,normal
TSLA,Tesla Inc ,20180329,Tesla returned to German subsidies list  ending row ,FRANKFURT  March 29 A German government agency has agreed to offer car buyers subsidies for Tesla vehicles again  ending a dispute with the U.S. company over whether the Model S was too expensive to qualify for the scheme.,normal
FINL,The Finish Line Inc,20180329,BRIEF-Finish Line Inc Q4 Sales $561.3 Million ,* FINISH LINE REPORTS FOURTH QUARTER AND FISCAL 2018 FULL YEAR RESULTS,topStory
TITN,Titan Machinery Inc,20180329,BRIEF-Titan Machinery Inc Q4 GAAP Earnings Per Share $0.08 ,* ANNOUNCES RESULTS FOR FISCAL FOURTH QUARTER AND FULL YEAR ENDED JANUARY 31  2018,topStory
