FB,Facebook Inc,20180531,UPDATE 2-Facebook prevails on shareholder votes  tallies to come later ,BOSTON  May 31 Facebook Inc executives said the company prevailed on all its director nominees and shareholder proposals up for a vote at its annual meeting on Thursday  where activist investors pressed leaders on topics like the oversight of questionable content.,topStory,Sell
BOX,Box Inc,20180531,UPDATE 3-Cloud storage firm Box's revenue edges past estimates ,* Shares fall 5 pct in extended trading after Q2 forecast (Adds share fall in first paragraph),normal,Sell
BP,BP plc,20180531,BP Cherry Point refinery resumes normal production after overhaul: sources ,HOUSTON BP Plc's 227 000 barrel per day (bpd) Cherry Point Refinery in Ferndale  Washington  was resuming normal operations on Thursday after completing a planned overhaul of the crude distillation unit (CDU) and coker  said sources familiar with plant operations.,topStory,Unknown
BVN,Buenaventura Mining Company Inc,20180531,Peru's Buenaventura seeks deal with Southern on copper project ,LIMA Peruvian precious metals miner Buenaventura said Southern Copper Corp is evaluating its proposal to jointly develop Southern's $2 billion copper project Michiquillay  Buenaventura's chief executive told Reuters on Wednesday.,topStory,Unknown
BVN,Buenaventura Mining Company Inc,20180531,Peru's Buenaventura seeks deal with Southern on copper project ,LIMA  May 30 Peruvian precious metals miner Buenaventura   said Southern Copper Corp is evaluating its proposal to jointly develop Southern's $2 billion copper project Michiquillay  Buenaventura's chief executive told Reuters on Wednesday.,normal,Unknown
GOOS,Canada Goose Holdings Inc,20180531,UPDATE 1-Luxury retailer Canada Goose to open stores in Beijing  Hong Kong ,May 31 Canada Goose Holdings Inc will open its first stores in Beijing and Hong Kong  reaching directly to customers who have been buying its luxury coats online and at department stores.,topStory,Sell
GOOS,Canada Goose Holdings Inc,20180531,Luxury retailer Canada Goose lays out China expansion plans ,May 31 Luxury coat maker Canada Goose said it would team up with ecommerce company Alibaba Group to tap into the rising consumer demand in Greater China  the world's largest luxury market  in the fall of this year.,normal,Sell
CS,Credit Suisse Group,20180531,Credit Suisse scales back rates team in electronic trade push ,ZURICH Credit Suisse Group will cut around 15 percent of its 60-strong team of rates traders in New York and London to focus on electronic trading.,topStory,Sell
CS,Credit Suisse Group,20180531,Credit Suisse scales back rates team in electronic trade push ,ZURICH  May 31 Credit Suisse Group will cut around 15 percent of its 60-strong team of rates traders in New York and London to focus on electronic trading.,normal,Sell
CS,Credit Suisse Group,20180531,BRIEF-Credit Suisse Group Announces Reverse Splits Of Its VIIZ And TVIX ETNs ,* REVERSE SPLITS WILL BE EFFECTIVE AT OPEN OF TRADING ON JUNE 8  2018,normal,Unknown
DB,Deutsche Bank AG,20180531,Deutsche Bank's U.S. ops deemed "troubled" by Fed a year ago: WSJ ,FRANKFURT The United States Federal Reserve last year designated Deutsche Bank AG's  U.S. operations to be in "troubled condition"  The Wall Street Journal reported on Thursday  citing people familiar with the matter.,topStory,Unknown
DB,Deutsche Bank AG,20180531,UPDATE 4-Deutsche Bank's U.S. ops deemed "troubled" by Fed a year ago -WSJ ,* Deutsche Bank says has adequate liquidity  capital reserves,normal,Sell
DB,Deutsche Bank AG,20180531,UPDATE 2-European shares fall on trade tensions  Deutsche troubles ,* Auto  steel stocks drop on trade war concerns (Adds details  closing prices),normal,Unknown
DB,Deutsche Bank AG,20180531,Cost of insurance against Deutsche Bank default surges after WSJ report ,LONDON The cost of insuring exposure to credit issued by German lender Deutsche Bank jumped on Thursday after the Wall Street Journal reported the U.S. Federal Reserve last year designated the bank's U.S. operations to be in "troubled condition".,normal,Unknown
DB,Deutsche Bank AG,20180531,Cost of insurance against Deutsche Bank default surges after WSJ report ,LONDON  May 31 The cost of insuring exposure to credit issued by German lender Deutsche Bank jumped on Thursday after the Wall Street Journal reported the U.S. Federal Reserve last year designated the bank's U.S. operations to be in "troubled condition".,normal,Unknown
DB,Deutsche Bank AG,20180531,Deutsche Bank's U.S. business deemed 'troubled' by Fed - WSJ ,May 31 The Federal Reserve has designated Deutsche Bank AG's U.S. business in "troubled condition " the Wall Street Journal reported https://www.wsj.com/articles/deutsche-banks-u-s-operations-deemed-troubled-by-fed-1527768310 on Thursday  citing people familiar with the matter.,normal,Unknown
DB,Deutsche Bank AG,20180531,Deutsche Bank's U.S. ops deemed "troubled" by Fed a year ago - WSJ ,FRANKFURT  May 31 The Federal Reserve last year designated Deutsche Bank AG's U.S. operations to be in "troubled condition"  The Wall Street Journal reported  citing people familiar with the matter.,normal,Unknown
DG,Dollar General Corporation,20180531,Dollar Tree  Dollar General same-store sales disappoint  shares fall ,Two of America's biggest dollar store chains missed Wall Street estimates for same-store sales as higher household income encouraged customers to shop more at big box retailers and an unusually cold spring weather crimped demand for seasonal products.,topStory,Sell
DG,Dollar General Corporation,20180531,UPDATE 4-Dollar Tree  Dollar General same-store sales disappoint  shares fall ,May 31 Two of America's biggest dollar store chains missed Wall Street estimates for same-store sales as higher household income encouraged customers to shop more at big box retailers and an unusually cold spring weather crimped demand for seasonal products.,normal,Sell
DG,Dollar General Corporation,20180531,US STOCKS-Wall St lower as fresh tariffs rekindle trade war fears ,* Indexes down: Dow 0.97 pct  S&P 0.46 pct  Nasdaq 0.08 pct (Changes comment  adds details  updates prices),normal,Unknown
DG,Dollar General Corporation,20180531,US STOCKS-Wall Street dips as trade war concerns take center stage ,* Dow down 0.59 pct  S&P down 0.33 pct  Nasdaq up 0.06 pct (Updates to open),normal,Sell
DG,Dollar General Corporation,20180531,US STOCKS-Wall St set to open flat as trade concerns temper Italy optimism ,* Futures up: Dow 6 pts  S&P 1 pt  Nasdaq 7 pts (Adds comment  adds details  updates prices),normal,Unknown
DG,Dollar General Corporation,20180531,Dollar General same-store sales miss estimates ,May 31 Dollar General Corp on Thursday reported first-quarter same-store sales below analysts' forecasts  as the discount store chain faced weaker demand for apparel and home products because of cold weather.,normal,Unknown
E,ENI SpA,20180531,Eni in process of reducing stakes in Mexico  Indonesia oilfields: CFO ,RAPALLO  Italy - Italy's oil and gas major Eni is in the process of reducing its stakes in its oilfields in Mexico and Indonesia  Chief Financial Officer Massimo Mondazzi said on Thursday.,topStory,Unknown
E,ENI SpA,20180531,GRAPHIC-"Buy now or wait?"  Italian sell-off lures back investors ,MILAN  May 31 Some European and U.S. fund managers are stepping back into Italian equities after fresh angst about a break from the euro zone wiped five months of gains off Milan's top share index.,normal,Unknown
RACE,Ferrari NV,20180531,Ferrari and Ray-Ban deemed a safer bet than Italian government bonds ,LONDON Italy's luxury carmaker Ferrari and Exor   the owners of Juventus football club  are among a host of companies that can now borrow money more cheaply than the country's crisis-hit government.,topStory,Unknown
RACE,Ferrari NV,20180531,Ferrari and Ray-Ban deemed a safer bet than Italian government bonds ,LONDON  May 31 Italy's luxury carmaker Ferrari and Exor   the owners of Juventus football club  are among a host of companies that can now borrow money more cheaply than the country's crisis-hit government.,normal,Unknown
FCAU,Fiat Chrysler Automobiles NV,20180531,Waymo to get more than 60 000 cars from Fiat Chrysler for robotaxis ,Fiat Chrysler Automobiles NV will add up to 62 000 more cars to Alphabet Inc's autonomous driving unit Waymo  the companies said on Thursday  as part of Waymo's plan to roll out a robotaxi service in the U.S. later this year.,topStory,Unknown
FCAU,Fiat Chrysler Automobiles NV,20180531,UPDATE 7-SoftBank joins GM in self-driving car race; GM shares soar ,May 31 Japan's SoftBank Group Corp will invest $2.25 billion in General Motors Co's autonomous vehicle unit Cruise  the companies said on Thursday  a deal that validates the venerable Detroit automaker's leadership in self-driving cars and sent GM shares up nearly 13 percent.,normal,Unknown
FCAU,Fiat Chrysler Automobiles NV,20180531,Waymo to get more than 60 000 cars from Fiat Chrysler for robotaxis ,May 31 Fiat Chrysler Automobiles NV will add up to 62 000 more cars to Alphabet Inc's autonomous driving unit Waymo  the companies said on Thursday  as part of Waymo's plan to roll out a robotaxi service in the U.S. later this year.,normal,Unknown
FCAU,Fiat Chrysler Automobiles NV,20180531,UPDATE 2-Britain plans crackdown on spiralling consumer credit costs ,* FCA proposes ban on rent-to-own warranties (Adds government  consumer and industry reaction),normal,Sell
FCAU,Fiat Chrysler Automobiles NV,20180531,UPDATE 1-Does UK FCA's Bailey want the Bank of England's top job? No comment ,LONDON  May 31 The chief of Britain's financial regulator Andrew Bailey on Thursday declined to comment as to whether he was interested in succeeding Mark Carney as the Bank of England governor  saying he had a big job to do already.,normal,Sell
FSM,Fortuna Silver Mines Inc,20180531,Ophir says continues financing search for Fortuna project ,LONDON Ophir Energy  whose chief was replaced amid delays in funding the Fortuna gas project in Equatorial Guinea  is in talks with other potential partners  Ophir said on Thursday.,topStory,Unknown
FSM,Fortuna Silver Mines Inc,20180531,Ophir says continues financing search for Fortuna project ,LONDON  May 31 Ophir Energy  whose chief was replaced amid delays in funding the Fortuna gas project in Equatorial Guinea  is in talks with other potential partners  Ophir said on Thursday.,normal,Unknown
FRO,Frontline Ltd,20180531,Frontline expects scrapping  OPEC output to boost oil tanker demand ,OSLO Increased scrapping of older oil tankers and the potential for higher output of OPEC crude are likely to boost vessel demand and thus rates  Oslo-listed shipper Frontline said on Thursday.,topStory,Unknown
GME,Gamestop Corporation,20180531,GameStop same-store sales miss estimates  shares fall ,.GameStop Corp  on Thursday reported first-quarter same-store sales that missed analysts' estimates due to a drop in sales of video game hardware and software at its outlets.,topStory,Sell
GME,Gamestop Corporation,20180531,REFILE-UPDATE 1-GameStop same-store sales miss estimates  shares fall ,May 31 GameStop Corp on Thursday reported first-quarter same-store sales that missed analysts' estimates due to a drop in sales of video game hardware and software at its outlets.,normal,Sell
GME,Gamestop Corporation,20180531,UPDATE 1-GameStop same-store sales miss estimates  shares fall ,May 31 GameStop Corp on Thursday reported first-quarter same-store sales that missed analysts' estimates due to a drop in sales of video game hardware and software at its outlets,normal,Sell
GME,Gamestop Corporation,20180531,GameStop quarterly profit falls 52.2 pct ,May 31 GameStop Corp  the world's largest video game retailer  reported a 52.2 percent drop in quarterly profit  hurt by lower sales in its core video game retail business.,normal,Unknown
GE,General Electric Company,20180531,Wartsila CFO says GE's Jenbacher would complement business well ,HELSINKI  May 31 Jenbacher  the industrial gas engine business of General Electric (GE)  would complement Wartsila  the chief financial officer of the Finnish company said on Thursday.,topStory,Unknown
GM,General Motors Company,20180531,SoftBank joins GM in self-driving car race; GM shares soar ,Japan's SoftBank Group Corp  will invest $2.25 billion in General Motors Co's  autonomous vehicle unit Cruise  the companies said on Thursday  a deal that validates the venerable Detroit automaker's leadership in self-driving cars and sent GM shares up nearly 13 percent. | Video ,topStory,Unknown
GM,General Motors Company,20180531,UPDATE 7-SoftBank joins GM in self-driving car race; GM shares soar ,May 31 Japan's SoftBank Group Corp will invest $2.25 billion in General Motors Co's autonomous vehicle unit Cruise  the companies said on Thursday  a deal that validates the venerable Detroit automaker's leadership in self-driving cars and sent GM shares up nearly 13 percent.,normal,Unknown
GM,General Motors Company,20180531,Wall St. slips on renewed trade-war worries but posts monthly gains ,NEW YORK U.S. stocks fell on Thursday after the United States moved to impose tariffs on metal imports from Canada  Mexico and the European Union  prompting retaliatory measures from some of its trading partners. | Video ,normal,Unknown
GM,General Motors Company,20180531,US STOCKS-Wall St slips on renewed trade-war worries but posts monthly gains ,* Dow down 1 pct  S&P down 0.7 pct  Nasdaq down 0.3 pct (Updates to close),normal,Unknown
GM,General Motors Company,20180531,Deals of the day-Mergers and acquisitions ,May 31 The following bids  mergers  acquisitions and disposals were reported by 2000 GMT on Thursday: ** Japan's SoftBank Group Corp will invest $2.25 billion in General Motors Co's autonomous vehicle unit Cruise  the companies said  a deal that validates the venerable Detroit automaker's leadership in self-driving cars and sent GM shares up more than 10 percent. ** Orange  France's biggest telecoms operator  is looking to merge its Orange Cinema Series (OCS) arm with Altice Studio t,normal,Unknown
GM,General Motors Company,20180531,US STOCKS-Wall St slips as U.S. tariffs spark trade war worries ,* Dow off 0.9 pct  S&P down 0.6 pct  Nasdaq down 0.2 pct (Updates to late afternoon  changes byline  adds NEW YORK to dateline),normal,Unknown
GM,General Motors Company,20180531,Waymo to get more than 60 000 cars from Fiat Chrysler for robotaxis ,Fiat Chrysler Automobiles NV will add up to 62 000 more cars to Alphabet Inc's autonomous driving unit Waymo  the companies said on Thursday  as part of Waymo's plan to roll out a robotaxi service in the U.S. later this year.,normal,Unknown
GM,General Motors Company,20180531,Waymo to get more than 60 000 cars from Fiat Chrysler for robotaxis ,May 31 Fiat Chrysler Automobiles NV will add up to 62 000 more cars to Alphabet Inc's autonomous driving unit Waymo  the companies said on Thursday  as part of Waymo's plan to roll out a robotaxi service in the U.S. later this year.,normal,Unknown
GM,General Motors Company,20180531,SoftBank Vision Fund to invest $2.25 bln in GM Cruise ,May 31 General Motors Co said on Thursday that Japan's SoftBank Group Corp will invest $2.25 billion through its Vision Fund in GM Cruise Holdings LLC  the carmaker's autonomous vehicle technology.,normal,Unknown
GS,Goldman Sachs Group Inc (The),20180531,UPDATE 3-Goldman Sachs vice president charged with insider trading ,NEW YORK  May 31 Federal prosecutors charged a vice president at Goldman Sachs Group Inc on Thursday with insider trading by illegally using non-public information about several companies that were clients of the investment bank.,topStory,Sell
GS,Goldman Sachs Group Inc (The),20180531,Goldman says market activity ebbs in second quarter ,Goldman Sachs Group Inc  President David Solomon said on Thursday that second-quarter market activity had decreased from the first quarter  when heightened volatility helped Wall Street banks record huge profits.,normal,Unknown
GS,Goldman Sachs Group Inc (The),20180531,UPDATE 1-Goldman says market activity ebbs in second quarter ,May 31 Goldman Sachs Group Inc President David Solomon said on Thursday that second-quarter market activity had decreased from the first quarter  when heightened volatility helped Wall Street banks record huge profits.,normal,Unknown
GS,Goldman Sachs Group Inc (The),20180531,Goldman says second-qtr market activity decreased vs first qtr ,May 31 Goldman Sachs Group Inc President David Solomon said second-quarter market activity has decreased compared to the first quarter  when heightened volatility helped Wall Street banks record huge profits.,normal,Unknown
GS,Goldman Sachs Group Inc (The),20180531,Goldman Sachs vice president charged with insider trading ,May 31 The U.S. Securities and Exchange Commission on Thursday charged a vice president at Goldman Sachs Group Inc with insider trading.,normal,Unknown
HSBC,HSBC Holdings plc,20180531,Judge narrows Cook County's fair housing lawsuit against HSBC ,Cook County  Illinois can proceed with a lawsuit accusing HSBC of targeting minorities for high-cost mortgages that allegedly led to foreclosures  a federal judge in Chicago ruled on Wednesday.,topStory,Sell
HSBC,HSBC Holdings plc,20180531,Outgoing RBS CFO among favourites to succeed HSBC Finance Director - The Times ,May 31 HSBC Holdings Plc has interviewed outgoing Royal Bank of Scotland Chief Finance Officer Ewen Stevenson to replace HSBC Finance Director Iain Mackay  The Times newspaper reported on Thursday.,normal,Unknown
LLL,L3 Technologies Inc,20180531,L3's growth strategy guided by credit rating risk ,WASHINGTON For L3 Technologies Inc  it's not a case of if but when the maker of everything from airport scanners to night vision equipment for the military will get bigger through acquisitions.,topStory,Unknown
LLL,L3 Technologies Inc,20180531,RPT-FOCUS-L3's growth strategy guided by credit rating risk , (Repeats to additional customers with no changes to text)     By Mike Stone     WASHINGTON  May 31 For L3 Technologies Inc          it's not a case of if but when the maker of everything from airport scanners to night vision equipment for the military will get bigger through acquisitions.     The path that recently minted Chairman and CEO Chris Kubasik takes to deliver that growth to investors  however  is the big question. Bankers and industry executives are watching closely to see,normal,Unknown
LLL,L3 Technologies Inc,20180531,FOCUS-L3's growth strategy guided by credit rating risk ,    By Mike Stone     WASHINGTON  May 31 For L3 Technologies Inc          it's not a case of if but when the maker of everything from airport scanners to night vision equipment for the military will get bigger through acquisitions.     The path that recently minted Chairman and CEO Chris Kubasik takes to deliver that growth to investors  however  is the big question. Bankers and industry executives are watching closely to see if L3 risks its investment grade credit rating with a majo,normal,Unknown
MTL,Mechel PAO,20180531,Russia's Mechel says board recommends 2017 dividends of 16.66 rbls/share ,MOSCOW  May 31 Russian metals and mining group Mechel said on Thursday its board had recommended 2017 dividends of 16.66 roubles ($0.2680) per preferred share.,topStory,Strong Buy
MSCI,MSCI Inc,20180531,UPDATE 1-Foreign funds only dip their toes into China stocks on eve of MSCI entry ,* Just $1 bln flowed into Chinese stocks under Connect vs anticipated $10 bln,topStory,Sell
MSCI,MSCI Inc,20180531,What is China's A-share MSCI inclusion on June 1? ,SHANGHAI Global market research and index company MSCI Inc will add roughly 230 China-listed shares to its emerging market benchmark in a two-step process starting on June 1  a move expected to drive a surge of foreign money into the country's stock markets.,normal,Unknown
MSCI,MSCI Inc,20180531,EXPLAINER-What is China's A-share MSCI inclusion on June 1? ,SHANGHAI  May 31 Global market research and index company MSCI Inc will add roughly 230 China-listed shares to its emerging market benchmark in a two-step process starting on June 1  a move expected to drive a surge of foreign money into the country's stock markets.,normal,Unknown
MWA,Mueller Water Products Inc,20180531,Mueller probe spent $4.5 million from October to March: Justice Department ,WASHINGTON U.S. Special Counsel Robert Mueller's team investigating suspected Russian interference in the 2016 U.S. election spent $4.5 million between October last year and March 2018  the Department of Justice said on Thursday.,topStory,Unknown
NKE,Nike Inc,20180531,Adidas takes 12-10 lead over Nike in World Cup shirt deals ,BERLIN Adidas  can declare itself the winner over arch rival Nike  in the upcoming soccer World Cup even before the first match kicks off as it is kitting out the most teams. | Video ,topStory,Unknown
NOK,Nokia Corporation,20180531,Nokia sells digital health venture  executive to leave ,HELSINKI Nokia said on Thursday it had sold its small digital health business  including activity trackers and smartwatches  and the executive who wound down the company's consumer ventures will leave Nokia after less than a year in the job.,topStory,Unknown
NOK,Nokia Corporation,20180531,Nokia sells digital health venture  executive to leave ,HELSINKI  May 31 Nokia said on Thursday it had sold its small digital health business  including activity trackers and smartwatches  and said the head of its Technologies unit would step down.,normal,Unknown
ORAN,Orange,20180531,Orange aiming to merge video arm with Altice Studio: Le Figaro ,PARIS Orange   France's biggest telecoms operator  is looking to merge its Orange Cinema Series (OCS) arm with Altice Studio  to create a new business big enough to challenge the likes of Netflix   Le Figaro newspaper reported.,topStory,Strong Buy
PTR,PetroChina Company Limited,20180531,UPDATE 2-Malaysia's Petronas buys 25 pct stake in LNG Canada project ,* Deal comes year after Petronas cancelled own terminal (Adds comments from Petronas President  analyst and background on Petronas' assets in Canada),normal,Unknown
PM,Philip Morris International Inc,20180531,Japan Tobacco to cut heated tobacco prices in battle with Philip Morris ,TOKYO Japan Tobacco Inc  is set to slash prices on its heated tobacco products early next week after a similar move by bigger rival Philip Morris International Inc   signaling increased competition in Japan's nascent market for alternative cigarettes.,topStory,Sell
PM,Philip Morris International Inc,20180531,Japan Tobacco to cut heated tobacco prices in battle with Philip Morris ,TOKYO  May 31 Japan Tobacco Inc is set to slash prices on its heated tobacco products early next week after a similar move by bigger rival Philip Morris International Inc  signalling increased competition in Japan's nascent market for alternative cigarettes.,normal,Sell
RBS,Royal Bank Scotland plc (The),20180531,Outgoing RBS CFO among favourites to succeed HSBC Finance Director - The Times ,May 31 HSBC Holdings Plc has interviewed outgoing Royal Bank of Scotland Chief Finance Officer Ewen Stevenson to replace HSBC Finance Director Iain Mackay  The Times newspaper reported on Thursday.,topStory,Unknown
SLB,Schlumberger NV,20180531,Equatorial Guinea LNG project stumbles as Schlumberger quits ,LONDON A pioneering liquefied natural gas project in Equatorial Guinea  bogged down by delayed financing  ran into further trouble after U.S. oil services company Schlumberger pulled out of the venture  two other operators said on Thursday.,topStory,Unknown
SLB,Schlumberger NV,20180531,UPDATE 2-Equatorial Guinea LNG project stumbles as Schlumberger quits ,* Fortuna is not dead  says Golar CEO (Adds Golar CEO  analyst comment  industry background),normal,Unknown
SLB,Schlumberger NV,20180531,Ophir says continues financing search for Fortuna project ,LONDON Ophir Energy  whose chief was replaced amid delays in funding the Fortuna gas project in Equatorial Guinea  is in talks with other potential partners  Ophir said on Thursday.,normal,Unknown
SLB,Schlumberger NV,20180531,Ophir says continues financing search for Fortuna project ,LONDON  May 31 Ophir Energy  whose chief was replaced amid delays in funding the Fortuna gas project in Equatorial Guinea  is in talks with other potential partners  Ophir said on Thursday.,normal,Unknown
SBGL,Sibanye Gold Limited,20180531,UPDATE 2-South Africa's Sibanye explores debt-cutting options ,* Shares in Sibanye down 28 percent since start of May (Adds non-debt options),topStory,Unknown
SNE,Sony Corp Ord,20180531,Sony's push into entertainment aims for stability  not splashiness ,TOKYO Sony Corp's  new chief executive is embracing entertainment content  but for now appears to be steering clear of direct competition with tech giants such as Apple Inc  and Netflix Inc .,topStory,Unknown
SNE,Sony Corp Ord,20180531,UPDATE 2-Activist investor ValueAct has $612 mln stake in Japan's Olympus ,* ValueAct says bought Olympus shares as investment (Adds ValueAct statement),normal,Unknown
SNE,Sony Corp Ord,20180531,FOCUS-Sony's push into entertainment aims for stability  not splashiness ,* CEO Yoshida says no plans to go toe-to-toe with Apple  Amazon,normal,Unknown
SCCO,Southern Copper Corporation,20180531,Peru's Buenaventura seeks deal with Southern on copper project ,LIMA Peruvian precious metals miner Buenaventura said Southern Copper Corp is evaluating its proposal to jointly develop Southern's $2 billion copper project Michiquillay  Buenaventura's chief executive told Reuters on Wednesday.,topStory,Unknown
SCCO,Southern Copper Corporation,20180531,Peru's Buenaventura seeks deal with Southern on copper project ,LIMA  May 30 Peruvian precious metals miner Buenaventura   said Southern Copper Corp is evaluating its proposal to jointly develop Southern's $2 billion copper project Michiquillay  Buenaventura's chief executive told Reuters on Wednesday.,normal,Unknown
