ACXM,Acxiom Corporation,20180329,Acxiom shares tank after Facebook cuts ties with data brokers ,Shares of Acxiom Corp plunged as much as 34 percent on Thursday  after Facebook Inc said it would end its partnerships with several large data brokers who help advertisers target people on the social network.,topStory
ACXM,Acxiom Corporation,20180329,UPDATE 1-Acxiom shares tank after Facebook cuts ties with data brokers ,March 29 Shares of Acxiom Corp plunged as much as 34 percent on Thursday  after Facebook Inc said it would end its partnerships with several large data brokers who help advertisers target people on the social network.,normal
ACXM,Acxiom Corporation,20180329,Acxiom shares tank after Facebook cuts ties with data brokers ,March 29 Shares of Acxiom Corp plunged 27 percent on Thursday  after Facebook Inc said it would end its partnerships with several large data brokers who help advertisers target people on the social network.,normal
ACXM,Acxiom Corporation,20180329,BRIEF-Acxiom Announces Change To Facebook Relationship ,* ‍WAS INFORMED BY FACEBOOK  THAT FACEBOOK PARTNER CATEGORIES WILL BE DISCONTINUED OVER NEXT SEVERAL MONTHS​,normal
AMTX,Aemetis Inc,20180329,BRIEF-Aemetis Inc Q4 Revenue $38.9 Million ,* QTRLY ‍LOSS PER SHARE $0.41 - SEC FILING Source text for Eikon: Further company coverage:,topStory
ALKS,Alkermes plc,20180329,BRIEF-Alkermes Says Co  Units Entered Amendment To Amended And Restated Credit Agreement ,* ALKERMES PLC SAYS ON MARCH 26  CO  UNITS  ENTERED AMENDMENT TO AMENDED &  RESTATED CREDIT AGREEMENT  DATED AS OF SEPTEMBER 16  2011 - SEC FILING,topStory
ALNY,Alnylam Pharmaceuticals Inc,20180329,UPDATE 2-Pfizer's rare heart disease drug succeeds in late-stage study ,* Brokerage Suntrust estimates sales of $130 mln of drug in 2022,topStory
GOOG,Alphabet Inc,20180329,Poor first quarter ends on a high note as stocks leap ,NEW YORK Stocks steadied on Thursday  after a woeful week for major technology companies  even as global equities careened towards their first quarterly drop in two years.,topStory
GOOG,Alphabet Inc,20180329,GLOBAL MARKETS-Poor first quarter ends on a high note as stocks leap ,NEW YORK  March 29 Stocks steadied on Thursday  after a woeful week for major technology companies  even as global equities careened towards their first quarterly drop in two years.,normal
GOOG,Alphabet Inc,20180329,US STOCKS-Wall St up more than 1 pct on last day of tumultuous quarter ,* Indexes up: Dow 1.06 pct  S&P 1.11 pct  Nasdaq 1.22 pct (Updates to early afternoon),normal
GOOG,Alphabet Inc,20180329,GLOBAL MARKETS-Stocks edge higher after tech woes  losses loom for first quarter ,NEW YORK  March 29 Riskier assets such as stocks steadied on Thursday  after a woeful week for giant technology companies  even as global equities careened towards their first quarterly drop in two years.,normal
GOOG,Alphabet Inc,20180329,US STOCKS-Wall St surges on last day of turbulent quarter ,* Indexes up: Dow 1.19 pct  S&P 1.18 pct  Nasdaq 1.37 pct (Changes comments  adds details  updates prices),normal
GOOGL,Alphabet Inc,20180329,Poor first quarter ends on a high note as stocks leap ,NEW YORK Stocks steadied on Thursday  after a woeful week for major technology companies  even as global equities careened towards their first quarterly drop in two years.,topStory
GOOGL,Alphabet Inc,20180329,GLOBAL MARKETS-Poor first quarter ends on a high note as stocks leap ,NEW YORK  March 29 Stocks steadied on Thursday  after a woeful week for major technology companies  even as global equities careened towards their first quarterly drop in two years.,normal
GOOGL,Alphabet Inc,20180329,US STOCKS-Wall St up more than 1 pct on last day of tumultuous quarter ,* Indexes up: Dow 1.06 pct  S&P 1.11 pct  Nasdaq 1.22 pct (Updates to early afternoon),normal
GOOGL,Alphabet Inc,20180329,GLOBAL MARKETS-Stocks edge higher after tech woes  losses loom for first quarter ,NEW YORK  March 29 Riskier assets such as stocks steadied on Thursday  after a woeful week for giant technology companies  even as global equities careened towards their first quarterly drop in two years.,normal
GOOGL,Alphabet Inc,20180329,US STOCKS-Wall St surges on last day of turbulent quarter ,* Indexes up: Dow 1.19 pct  S&P 1.18 pct  Nasdaq 1.37 pct (Changes comments  adds details  updates prices),normal
AMZN,Amazoncom Inc,20180329,Trump escalates attack on Amazon  focusing on tax  shipping ,WASHINGTON U.S. President Donald Trump accused Amazon.com Inc  on Thursday of not paying enough tax  taking advantage of the U.S. postal system and putting small retailers out of business  without offering evidence to back up his criticisms or suggesting any specific actions he would take. | Video ,topStory
AMZN,Amazoncom Inc,20180329,Poor first quarter ends on a high note as stocks leap ,NEW YORK Stocks steadied on Thursday  after a woeful week for major technology companies  even as global equities careened towards their first quarterly drop in two years.,normal
AMZN,Amazoncom Inc,20180329,UPDATE 4-Trump escalates attack on Amazon  focusing on tax  shipping ,WASHINGTON  March 29 U.S. President Donald Trump accused Amazon.com Inc on Thursday of not paying enough tax  taking advantage of the U.S. postal system and putting small retailers out of business  without offering evidence to back up his criticisms or suggesting any specific actions he would take.,normal
AMZN,Amazoncom Inc,20180329,Trump adviser ties Amazon criticism to U.S. Supreme Court case ,WASHINGTON  March 29 As President Donald Trump intensified his attacks on Amazon.com Inc  a White House adviser on Thursday pointed to a U.S. Supreme Court case in which the administration has intervened that could force more online retailers to collect state sales taxes.,normal
AMZN,Amazoncom Inc,20180329,Trump 'has no actions' against Amazon: White House ,WASHINGTON U.S. President Donald Trump was voicing concern about Amazon.com Inc  when he commented about the company on Twitter on Thursday  but the administration has no action dealing with the company at this time  the White House said.,normal
AMZN,Amazoncom Inc,20180329,Trump 'has no actions' against Amazon - White House ,WASHINGTON  March 29 U.S. President Donald Trump was voicing concern about Amazon.com Inc when he commented about the company on Twitter on Thursday  but the administration has no action dealing with the company at this time  the White House said.,normal
AMZN,Amazoncom Inc,20180329,Amazon's Washington influence machine built to withstand Trump's attacks ,WASHINGTON Between lobbying  campaign contributions and positioning itself as engaged on policy issues like job creation  Amazon.com  has long courted a positive relationship with both the White House and Congress that will help it withstand the latest attack from U.S. President Donald Trump.,normal
AMZN,Amazoncom Inc,20180329,Amazon's Washington influence machine built to withstand Trump's attacks ,WASHINGTON  March 29 Between lobbying  campaign contributions and positioning itself as engaged on policy issues like job creation  Amazon.com has long courted a positive relationship with both the White House and Congress that will help it withstand the latest attack from U.S. President Donald Trump.,normal
AMZN,Amazoncom Inc,20180329,US STOCKS-Wall St up more than 1 pct on last day of tumultuous quarter ,* Indexes up: Dow 1.06 pct  S&P 1.11 pct  Nasdaq 1.22 pct (Updates to early afternoon),normal
AMZN,Amazoncom Inc,20180329,US STOCKS-Wall St surges on last day of turbulent quarter ,* Indexes up: Dow 1.19 pct  S&P 1.18 pct  Nasdaq 1.37 pct (Changes comments  adds details  updates prices),normal
AETI,American Electric Technologies Inc,20180329,BRIEF-Aeti Reports Qtrly Earnings Per Share $0.26 ,* QUARTER ENDING BACKLOG OF $18.9 MILLION  DOWN 20% FROM $23.5 REPORTED AT END OF Q3 OF 2017 Source text for Eikon: Further company coverage:,topStory
AMGN,Amgen Inc,20180329,FDA expands use of Amgen leukemia drug Blincyto to patients with relapse risk ,The U.S. Food and Drug Administration on Thursday expanded the use of Amgen Inc's leukemia drug Blincyto to include patients who are in remission but still have residual signs of the disease.,topStory
AMGN,Amgen Inc,20180329,UPDATE 1-FDA expands use of Amgen leukemia drug Blincyto to patients with relapse risk ,March 29 The U.S. Food and Drug Administration on Thursday expanded the use of Amgen Inc's leukemia drug Blincyto to include patients who are in remission but still have residual signs of the disease.,normal
AMGN,Amgen Inc,20180329,FDA expands use of Amgen leukemia drug Blincyto to patients with relapse risk ,March 29 The U.S. Food and Drug Administration on Thursday expanded the use of Amgen Inc's leukemia drug Blincyto to include patients who are in remission but still have residual signs of the disease.,normal
ANGO,AngioDynamics Inc,20180329,BRIEF-AngioDynamics Q3 Earnings Per Share $0.37 ,* ANGIODYNAMICS REPORTS FISCAL 2018 THIRD QUARTER FINANCIAL RESULTS,topStory
AAPL,Apple Inc,20180329,Poor first quarter ends on a high note as stocks leap ,NEW YORK Stocks steadied on Thursday  after a woeful week for major technology companies  even as global equities careened towards their first quarterly drop in two years.,topStory
AAPL,Apple Inc,20180329,GLOBAL MARKETS-Poor first quarter ends on a high note as stocks leap ,NEW YORK  March 29 Stocks steadied on Thursday  after a woeful week for major technology companies  even as global equities careened towards their first quarterly drop in two years.,normal
AAPL,Apple Inc,20180329,Apple unveils new privacy tools ahead of EU law ,BRUSSELS Apple is introducing new tools that will allow consumers  to control how their data are used and deactivate their Apple ID accounts  as tech companies strive to bring their services into line with a tough new EU data protection law.,normal
AAPL,Apple Inc,20180329,Apple unveils new privacy tools ahead of EU law ,BRUSSELS  March 29 Apple is introducing new tools that will allow consumers  to control how their data are used and deactivate their Apple ID accounts  as tech companies strive to bring their services into line with a tough new EU data protection law.,normal
AAPL,Apple Inc,20180329,MDL Watch: Panel to consider Apple iPhones and Intel chips ,A federal judicial panel is set to weigh requests to create multidistrict litigation for consumer lawsuits over Apple Inc's slowing iPhones and Intel Corp's computer chip flaws.,normal
APRI,Apricus Biosciences Inc,20180329,BRIEF-Sabby Management LLC Reports 7.68 Pct Passive Stake In Apricus Biosciences ,* SABBY MANAGEMENT LLC REPORTS 7.68 PERCENT PASSIVE STAKE IN APRICUS BIOSCIENCES INC AS OF MARCH 28 - SEC FILING Source text : http://bit.ly/2GhQHcF Further company coverage:,topStory
ARTW,Art&#39;s-Way Manufacturing Co Inc,20180329,BRIEF-Art's Way Manufacturing Reports Q1 Shr Loss From Cont Ops $0.13 ,* ART'S WAY MANUFACTURING ANNOUNCES FIRST QUARTER FISCAL 2018 FINANCIAL RESULTS,topStory
EARS,Auris Medical Holding AG,20180329,BRIEF-Auris Regains Compliance With Nasdaq's Minimum Bid Price Requirement ,* AURIS REGAINS COMPLIANCE WITH NASDAQ'S MINIMUM BID PRICE REQUIREMENT Source text for Eikon: Further company coverage:,topStory
AVGR,Avinger Inc,20180329,BRIEF-Avinger Announces First-In-Patient Use Of Extended Nosecone Version Of Next Generation Pantheris ,* AVINGER ANNOUNCES FIRST-IN-PATIENT USE OF EXTENDED NOSECONE VERSION OF NEXT GENERATION PANTHERIS Source text for Eikon: Further company coverage:,topStory
TAPR,Barclays Inverse US Treasury Composite ETN,20180329,Barclays $2 billion fraud fine resolves major U.S. legal issue ,LONDON/WASHINGTON Barclays  will pay $2 billion to settle claims for billions of dollars of losses suffered by investors who bought toxic mortgage-backed securities in the run-up to the 2007 financial crisis  the U.S. Justice Department said on Thursday.,topStory
TAPR,Barclays Inverse US Treasury Composite ETN,20180329,UPDATE 2-Barclays $2 bln fraud fine resolves major U.S. legal issue ,* Bank to take 0.45 pct CET1 hit in Q1 (Adds background and analyst comment  updates shares),normal
TAPR,Barclays Inverse US Treasury Composite ETN,20180329,BRIEF-‍Barclays Reaches $2 bln RMBS Settlement With United States Department Of Justice ,* ‍BARCLAYS REACHES SETTLEMENT WITH UNITED STATES DEPARTMENT OF JUSTICE IN RELATION TO RESIDENTIAL MORTGAGE-BACKED SECURITIES,normal
TAPR,Barclays Inverse US Treasury Composite ETN,20180329,Barclays to pay $2 bln U.S. fine over mortgage fraud claims -Justice Dept. ,WASHINGTON  March 29 Barclays has agreed to pay $2 billion for allegedly causing billions of dollars of losses to investors by engaging in a fraudulent scheme to sell residential mortgage-backed securities between 2005 and 2007  the U.S. Justice Department said on Thursday.,normal
DLBL,Barclays PLC,20180329,Barclays $2 billion fraud fine resolves major U.S. legal issue ,LONDON/WASHINGTON Barclays  will pay $2 billion to settle claims for billions of dollars of losses suffered by investors who bought toxic mortgage-backed securities in the run-up to the 2007 financial crisis  the U.S. Justice Department said on Thursday.,topStory
DLBL,Barclays PLC,20180329,UPDATE 2-Barclays $2 bln fraud fine resolves major U.S. legal issue ,* Bank to take 0.45 pct CET1 hit in Q1 (Adds background and analyst comment  updates shares),normal
DLBL,Barclays PLC,20180329,BRIEF-‍Barclays Reaches $2 bln RMBS Settlement With United States Department Of Justice ,* ‍BARCLAYS REACHES SETTLEMENT WITH UNITED STATES DEPARTMENT OF JUSTICE IN RELATION TO RESIDENTIAL MORTGAGE-BACKED SECURITIES,normal
DLBL,Barclays PLC,20180329,Barclays to pay $2 bln U.S. fine over mortgage fraud claims -Justice Dept. ,WASHINGTON  March 29 Barclays has agreed to pay $2 billion for allegedly causing billions of dollars of losses to investors by engaging in a fraudulent scheme to sell residential mortgage-backed securities between 2005 and 2007  the U.S. Justice Department said on Thursday.,normal
DTYL,Barclays PLC,20180329,Barclays $2 billion fraud fine resolves major U.S. legal issue ,LONDON/WASHINGTON Barclays  will pay $2 billion to settle claims for billions of dollars of losses suffered by investors who bought toxic mortgage-backed securities in the run-up to the 2007 financial crisis  the U.S. Justice Department said on Thursday.,topStory
DTYL,Barclays PLC,20180329,UPDATE 2-Barclays $2 bln fraud fine resolves major U.S. legal issue ,* Bank to take 0.45 pct CET1 hit in Q1 (Adds background and analyst comment  updates shares),normal
DTYL,Barclays PLC,20180329,BRIEF-‍Barclays Reaches $2 bln RMBS Settlement With United States Department Of Justice ,* ‍BARCLAYS REACHES SETTLEMENT WITH UNITED STATES DEPARTMENT OF JUSTICE IN RELATION TO RESIDENTIAL MORTGAGE-BACKED SECURITIES,normal
DTYL,Barclays PLC,20180329,Barclays to pay $2 bln U.S. fine over mortgage fraud claims -Justice Dept. ,WASHINGTON  March 29 Barclays has agreed to pay $2 billion for allegedly causing billions of dollars of losses to investors by engaging in a fraudulent scheme to sell residential mortgage-backed securities between 2005 and 2007  the U.S. Justice Department said on Thursday.,normal
BIOC,Biocept Inc,20180329,BRIEF-Biocept Inc Obtains Patent For A Certain Technology In China ,* BIOCEPT OBTAINS PATENT FOR ITS TARGET SELECTOR MOLECULAR BIOMARKER TECHNOLOGY IN CHINA Source text for Eikon: Further company coverage:,topStory
BKYI,BIO-key International Inc,20180329,BRIEF-Bio-Key International Q4 Earnings Per Share $0.04 ,* BIOMETRIC AUTHENTICATION AND SECURITY SOLUTIONS PROVIDER BIO-KEY REPORTS 2017 REVENUE OF $6.3M; MORE THAN DOUBLES 2016 PERFORMANCE,topStory
CHRW,CH Robinson Worldwide Inc,20180329,BRIEF-C.H. Robinson Worldwide Says CEO John Wiehoff's 2017 Total Compensation Was $6.8 Mln ,* C.H. ROBINSON WORLDWIDE INC SAYS PRESIDENT AND CEO JOHN WIEHOFF'S FY 2017 TOTAL COMPENSATION WAS $6.8 MILLION VERSUS $6.3 MILLION IN FY 2016 - SEC FILING Source text: (http://bit.ly/2GhEpkE) Further company coverage:,topStory
CSIQ,Canadian Solar Inc,20180329,BRIEF-Canadian Solar Acquires A Solar Power Project In Argentina ,* CANADIAN SOLAR ACQUIRES A 97.6 MWP SOLAR POWER PROJECT IN ARGENTINA,topStory
CASI,CASI Pharmaceuticals Inc,20180329,BRIEF-CASI Pharmaceuticals Q4 Loss Per Share $0.08 ,* CASI PHARMACEUTICALS ANNOUNCES FOURTH QUARTER AND FULL YEAR 2017 FINANCIAL RESULTS,topStory
CPRX,Catalyst Pharmaceuticals Inc,20180329,BRIEF-Catalyst Pharma Submits NDA For Firdapse ,* CATALYST PHARMACEUTICALS ANNOUNCES SUBMISSION OF NEW DRUG APPLICATION FOR FIRDAPSE® FOR TREATMENT OF LAMBERT-EATON MYASTHENIC SYNDROME,topStory
CELG,Celgene Corporation,20180329,Judge allows Celgene whistleblower to be paid after bitter fee fight ,A federal judge has cleared the way for an ex-Celgene Corp employee to collect nearly $72.6 million as her cut of a $280 million settlement with the drugmaker after striking a lien her former law firm Grant & Eisenhofer placed on the payout.,topStory
CYAD,Celyad SA,20180329,BRIEF-Celyad To Present Updates On CYAD-01 At American Association For Cancer Research Annual Meeting ,* CELYAD TO PRESENT UPDATES ON CYAD-01 AT THE AMERICAN ASSOCIATION FOR CANCER RESEARCH (AACR) ANNUAL MEETING 2018,topStory
CMRX,Chimerix Inc,20180329,BRIEF-Chimerix Announces Martha J. Demski As Board Chair ,* CHIMERIX ANNOUNCES MARTHA J. DEMSKI AS BOARD CHAIR; APPOINTS NEW MEMBERS TO BOARD OF DIRECTORS,topStory
CAAS,China Automotive Systems Inc,20180329,BRIEF-China Automotive Systems Q4 Loss Per Share $1.23 ,* CHINA AUTOMOTIVE SYSTEMS REPORTS FOURTH QUARTER AND FISCAL 2017 RESULTS,topStory
CTXR,Citius Pharmaceuticals Inc,20180329,BRIEF-Citius Announces $2 Mln Registered Direct Offering Priced At-The-Market ,* CITIUS ANNOUNCES $2.0 MILLION REGISTERED DIRECT OFFERING PRICED AT-THE-MARKET Source text for Eikon: Further company coverage:,topStory
CMCSA,Comcast Corporation,20180329,UPDATE 1-Britain shrugs off Brexit to enjoy boom in dealmaking ,LONDON  March 29 British companies have been swept up in a global boom in dealmaking that has seen the amount of M&A involving UK firms hit its highest level since 2007.,normal
CMCSA,Comcast Corporation,20180329,Britain shrugs off Brexit to enjoy boom in dealmaking ,LONDON  March 29 British companies have been swept up in a global boom in dealmaking that has seen the amount of M&A involving UK firms hit its highest level since 2007.,normal
CTIB,CTI Industries Corporation,20180329,BRIEF-CTI Industries Reports Q4 Loss Per Share $0.24 ,* ORATION REPORTS RESULTS FOR FULL YEAR AND FOURTH QUARTER 2017,topStory
CONE,CyrusOne Inc,20180329,BRIEF-Cyrusone Announces New $3.0 Bln Unsecured Credit Facility ,* CYRUSONE INC. ANNOUNCES NEW $3.0 BILLION UNSECURED CREDIT FACILITY,topStory
EACQ,Easterly Acquisition Corp,20180329,BRIEF-Easterly Acquisition Extends Time To Complete Business Combination With JH Capital To June 30 ,* EASTERLY ACQUISITION CORP. ANNOUNCES EXTENSION OF TIME TO COMPLETE PREVIOUSLY ANNOUNCED BUSINESS COMBINATION WITH JH CAPITAL,topStory
EACQU,Easterly Acquisition Corp,20180329,BRIEF-Easterly Acquisition Extends Time To Complete Business Combination With JH Capital To June 30 ,* EASTERLY ACQUISITION CORP. ANNOUNCES EXTENSION OF TIME TO COMPLETE PREVIOUSLY ANNOUNCED BUSINESS COMBINATION WITH JH CAPITAL,topStory
ETSY,Etsy Inc,20180329,BRIEF-Etsy Inc Appoints Gary Briggs To The Board Of Directors ,* ETSY INC - BOARD APPOINTED GARY BRIGGS  VICE PRESIDENT AND CHIEF MARKETING OFFICER FOR FACEBOOK  TO CO'S BOARD  EFFECTIVE APRIL 5,topStory
ESRX,Express Scripts Holding Company,20180329,BRIEF-Express Scripts Holding Co CEO Timothy Wentworth's Total Compensation For 2017 Was $15.9 Million Versus $14.5 Million In 2016 - SEC Filing ,* EXPRESS SCRIPTS HOLDING CO CEO TIMOTHY WENTWORTH'S TOTAL COMPENSATION FOR 2017 WAS $15.9 MILLION VERSUS $14.5 MILLION IN 2016 - SEC FILING Source text: (https://bit.ly/2GYE0AV) Further company coverage:,topStory
FB,Facebook Inc,20180329,Acxiom shares tank after Facebook cuts ties with data brokers ,Shares of Acxiom Corp plunged as much as 34 percent on Thursday  after Facebook Inc said it would end its partnerships with several large data brokers who help advertisers target people on the social network.,topStory
FB,Facebook Inc,20180329,UPDATE 1-U.S. stock fund investors pull most cash since February meltdown -Lipper , (Adds details on funds  analyst quote  table  byline)     By Trevor Hunnicutt     NEW YORK  March 29 U.S. fund investors drained the most cash from the stock market since early February's market meltdown  dodging declines while making a tactical bet on fallen technology companies  Lipper data released on Thursday showed.     More than $14 billion rolled out of the funds during the week ended March 28  according to the research service  yet tech sector funds pulled in $101 million as,normal
FB,Facebook Inc,20180329,Poor first quarter ends on a high note as stocks leap ,NEW YORK Stocks steadied on Thursday  after a woeful week for major technology companies  even as global equities careened towards their first quarterly drop in two years.,normal
FB,Facebook Inc,20180329,GLOBAL MARKETS-Poor first quarter ends on a high note as stocks leap ,NEW YORK  March 29 Stocks steadied on Thursday  after a woeful week for major technology companies  even as global equities careened towards their first quarterly drop in two years.,normal
FB,Facebook Inc,20180329,BRIEF-Alliance Data Provides Statement Regarding Facebook ,* ALLIANCE DATA PROVIDES STATEMENT REGARDING FACEBOOK'S ANNOUNCED WIND-DOWN OF DATA PROVIDER RELATIONSHIPS,normal
FB,Facebook Inc,20180329,BRIEF-Facebook was informed privacy breach app might sell user data - FT‍​ ,* FACEBOOK WAS INFORMED THAT THE APP AT THE CENTRE OF A MASSIVE DATA LEAK COULD SELL USER DATA TO THIRD PARTIES - FT ‍​,normal
FB,Facebook Inc,20180329,BRIEF-NY AG Schneiderman Says To Introduce Legislation For Data Misuse ,* NEW YORK AG SCHNEIDERMAN SAYS TO INTRODUCE LEGISLATION TO REQUIRE COMPANIES LIKE FACEBOOK TO PROVIDE NOTIFICATION IF USERS’ PERSONAL INFO IS MISUSED‍​,normal
FB,Facebook Inc,20180329,UPDATE 1-Acxiom shares tank after Facebook cuts ties with data brokers ,March 29 Shares of Acxiom Corp plunged as much as 34 percent on Thursday  after Facebook Inc said it would end its partnerships with several large data brokers who help advertisers target people on the social network.,normal
FB,Facebook Inc,20180329,GLOBAL MARKETS-Stocks edge higher after tech woes  losses loom for first quarter ,NEW YORK  March 29 Riskier assets such as stocks steadied on Thursday  after a woeful week for giant technology companies  even as global equities careened towards their first quarterly drop in two years.,normal
FBIO,Fortress Biotech Inc,20180329,BRIEF-Mustang Bio Reports Q4 Financial Results ,* MUSTANG BIO REPORTS FOURTH QUARTER AND FULL-YEAR 2017 FINANCIAL RESULTS AND RECENT CORPORATE HIGHLIGHTS,topStory
FLL,Full House Resorts Inc,20180329,BRIEF-Full House Resorts Receives Unanimous Recommendation For Bronco Billy's Expansion Project ,* FULL HOUSE RESORTS RECEIVES UNANIMOUS RECOMMENDATION FROM CRIPPLE CREEK HISTORIC PRESERVATION COMMISSION FOR ITS BRONCO BILLY’S EXPANSION PROJECT Source text for Eikon: Further company coverage:,topStory
GALT,Galectin Therapeutics Inc,20180329,BRIEF-Galectin Therapeutics Provides Business Update ,* GALECTIN THERAPEUTICS REPORTS 2017 FINANCIAL RESULTS AND PROVIDES BUSINESS UPDATE,topStory
GPRO,GoPro Inc,20180329,BRIEF-GoPro Launches Entry-Level Hero Camera For $199 ,* GOPRO INC SAYS LAUNCHES ENTRY-LEVEL HERO CAMERA FOR $199 Source text for Eikon: Further company coverage:,topStory
GWGH,GWG Holdings Inc,20180329,BRIEF-GWG Holdings Q4 Net Loss Per Share $2.77 ,* GWG HOLDINGS REPORTS RESULTS FOR FOURTH QUARTER AND FULL YEAR 2017,topStory
HRTX,Heron Therapeutics Inc  ,20180329,BRIEF-Heron Therapeutics Announces Pricing Of Underwritten Public Offering ,* HERON THERAPEUTICS ANNOUNCES PRICING OF UNDERWRITTEN PUBLIC OFFERING OF COMMON STOCK,topStory
HIMX,Himax Technologies Inc,20180329,BRIEF-Himax Decides To Exercise Options To Fully Acquire Emza Visual Sense ,* HIMAX DECIDES TO EXERCISE OPTIONS TO FULLY ACQUIRE EMZA VISUAL SENSE,topStory
HMHC,Houghton Mifflin Harcourt Company,20180329,BRIEF-Houghton Mifflin Says CEO's 2017 Total Compensation $6.47 Mln ,* HOUGHTON MIFFLIN HARCOURT CO SAYS CEO JOHN J. LYNCH'S 2017 TOTAL COMPENSATION WAS $6.47 MILLION – SEC FILING ‍​,topStory
IPXL,Impax Laboratories Inc,20180329,Impax reaches $20 million deal to end trial over generic drug's delay ,BOSTON Impax Laboratories Inc has agreed to pay $20 million to consumers and insurers to resolve claims that the drugmaker entered an anticompetitive deal to delay launching a generic  cheaper version of acne medication Solodyn.,topStory
IPXL,Impax Laboratories Inc,20180329,UPDATE 2-Impax reaches $20 mln deal to end trial over generic drug's delay ,BOSTON  March 29 Impax Laboratories Inc has agreed to pay $20 million to consumers and insurers to resolve claims that the drugmaker entered an anticompetitive deal to delay launching a generic  cheaper version of acne medication Solodyn.,normal
IPXL,Impax Laboratories Inc,20180329,Impax reaches $20 mln deal to end trial over generic drug's delay ,BOSTON  March 29 Impax Laboratories Inc has agreed to pay $20 million to consumers and insurers to resolve claims that the drugmaker entered an anticompetitive deal to delay launching a generic  cheaper version of acne medication Solodyn.,normal
INSM,Insmed Inc,20180329,BRIEF-Insmed Inc Submits NDA To FDA For ALIS ,* INSMED SUBMITS NEW DRUG APPLICATION TO FDA FOR ALIS IN NTM LUNG DISEASE CAUSED BY MAC,topStory
INTC,Intel Corporation,20180329,BRIEF-Intel Announces Judgment For Remaining Mobileye Shares Acquisition ,* INTEL ANNOUNCES JUDGMENT OF THE ENTERPRISE CHAMBER IN COMPULSORY ACQUISITION PROCEEDING FOR REMAINING MOBILEYE SHARES,topStory
