TOWN,Towne Bank,20180329,BRIEF-Towne Bank Appoints Robert Aston As Executive Chairman ,* TOWNE BANK -  ROBERT ASTON ASSUMED NEWLY CREATED POSITION OF EXECUTIVE CHAIRMAN OF BOARD,topStory
FOX,Twenty-First Century Fox Inc,20180329,Britain shrugs off Brexit to enjoy boom in dealmaking ,LONDON  March 29 British companies have been swept up in a global boom in dealmaking that has seen the amount of M&A involving UK firms hit its highest level since 2007.,normal
FOXA,Twenty-First Century Fox Inc,20180329,Britain shrugs off Brexit to enjoy boom in dealmaking ,LONDON  March 29 British companies have been swept up in a global boom in dealmaking that has seen the amount of M&A involving UK firms hit its highest level since 2007.,normal
USCR,U S Concrete Inc,20180329,BRIEF-U.S. Concrete Expands Presence In Philadelphia With Strategic Acquisition ,* U.S. CONCRETE EXPANDS PRESENCE IN PHILADELPHIA WITH STRATEGIC ACQUISITION,topStory
USEG,US Energy Corp,20180329,FirstEnergy calls on US energy secretary to save nuclear  coal plants ,March 29 FirstEnergy Corp called on U.S. Energy Secretary Rick Perry on Thursday to direct the operator of the Mid Atlantic and Midwest power grid to take steps to keep several nuclear and coal-fired power plants in service to maintain the future reliability of the region's electric grid.,topStory
USEG,US Energy Corp,20180329,UPDATE 3-FirstEnergy seeks emergency lifeline for U.S. nuclear  coal plants ,NEW YORK/WASHINGTON  March 29 U.S. power company FirstEnergy Corp urged the federal government on Thursday to evoke little-used emergency powers to help it keep several struggling nuclear and coal-fired power plants open  a move critics blasted as an attempt at a corporate bailout.,normal
VOD,Vodafone Group Plc,20180329,BRIEF-Vodafone Completes Sale Of Vodafone Qatar​ ,* ‍QATAR FOUNDATION COMPLETS ACQUISITION OF VODAFONE EUROPE'S STAKE IN JV COMPANY - VODAFONE  QATAR FOUNDATION - THAT CONTROLS VODAFONE QATAR​,topStory
YGYI,Youngevity International Inc,20180329,BRIEF-Youngevity International Q4 Loss Per Share $0.35​ ,* YOUNGEVITY INTERNATIONAL  INC. REPORTS 2017 FOURTH QUARTER AND FULL YEAR RESULTS,topStory
ZKIN,ZK International Group Co Ltd,20180329,BRIEF-ZK International To Expand Operations In Uganda ,* ZK INTERNATIONAL GROUP SAYS IS LOOKING TO EXPAND ITS BUSINESS OPERATIONS & IS INITIALLY TARGETING UGANDA FOR ITS GROWTH IN OIL AND GAS SECTORS Source text for Eikon: Further company coverage:,topStory
ZSAN,Zosano Pharma Corporation,20180329,BRIEF-Zosano Announces Pricing Of 10 Mln Common Shares At $5 per Share ,* ZOSANO ANNOUNCES PRICING OF PUBLIC OFFERING OF COMMON STOCK,topStory
ABB,ABB Ltd,20180329,ABB on the hunt for acquisitions in artificial intelligence ,ZURICH Swiss engineering company ABB  is considering acquisitions to increase its capabilities in artificial intelligence  Chief Executive Ulrich Spiesshofer said on Thursday.,topStory
ABB,ABB Ltd,20180329,UPDATE 1-ABB on the hunt for acquisitions in artificial intelligence ,ZURICH  March 29 Swiss engineering company ABB is considering acquisitions to increase its capabilities in artificial intelligence  Chief Executive Ulrich Spiesshofer said on Thursday.,normal
ABB,ABB Ltd,20180329,ABB on the hunt for acquisitions in artificial intelligence ,ZURICH  March 29 Swiss engineering company ABB is considering making acquisitions  particularly in artificial intelligence  Chief Executive Ulrich Spiesshofer said on Thursday.,normal
ABB,ABB Ltd,20180329,UPDATE 1-ABB ready to participate in global upswing in 2018 - CEO ,ZURICH  March 29 ABB Chief Executive Ulrich Spiesshofer said the market environment had brightened in 2018 with the Swiss engineering group ready to participate in the expected upswing.,normal
ABB,ABB Ltd,20180329,ABB ready to participate in global upswing in 2018 - CEO ,ZURICH  March 29 ABB Chief Executive Ulrich Spiesshofer said the market environment had brightened in 2018 with the Swiss engineering group ready to participate in the expected upswing.,normal
ABT,Abbott Laboratories,20180329,BRIEF-Abbott Initiates Trial To Evaluate Improved Survival And Outcomes With The Cardiomems Monitor ,* ABBOTT INITIATES TRIAL TO EVALUATE IMPROVED SURVIVAL AND OUTCOMES WITH THE CARDIOMEMS MONITOR,topStory
ACN,Accenture plc,20180329,BRIEF-Meredith Corp To Sell Meredith Xcelerated Marketing To Accenture ,* MEREDITH CORPORATION TO SELL MEREDITH XCELERATED MARKETING TO ACCENTURE,topStory
ACN,Accenture plc,20180329,BRIEF-Accenture To Acquire MXM  A Content-Powered Digital Marketing Agency ,* ACCENTURE TO ACQUIRE MXM  A CONTENT-POWERED DIGITAL MARKETING AGENCY,normal
AGN,Allergan plc,20180329,Federal Circuit halts PTAB review of Allergan patents owned by tribe ,A U.S. appeals court on Wednesday instructed a U.S. patent tribunal to hold off on deciding the validity of patents covering Allergan PLC's drug Restasis  saying it first wanted to consider the novel jurisdictional issues raised by Allergan assigning the patents to a Native American tribe.,topStory
ADS,Alliance Data Systems Corporation,20180329,BRIEF-Alliance Data Provides Statement Regarding Facebook ,* ALLIANCE DATA PROVIDES STATEMENT REGARDING FACEBOOK'S ANNOUNCED WIND-DOWN OF DATA PROVIDER RELATIONSHIPS,topStory
AFB,Alliance National Municipal Income Fund Inc,20180329,BRIEF-AllianceBernstein National Municipal Income Fund Reports Q1 Earnings ,March 29 AllianceBernstein National Municipal Income Fund Inc:,topStory
ALSN,Allison Transmission Holdings Inc,20180329,BRIEF-Allison Transmission Says CEO Dewey's FY 2017 Total Compensation Was $7.9 Mln Versus $6.9 Mln In FY 2016 ,* ALLISON TRANSMISSION HOLDINGS INC SAYS CHAIRMAN AND CEO LAWRENCE DEWEY'S FY 2017 TOTAL COMPENSATION WAS $7.9 MILLION VERSUS $6.9 MILLION IN FY 2016 - SEC FILING Source text: (https://bit.ly/2IcOqfn) Further company coverage:,topStory
AMC,AMC Entertainment Holdings Inc,20180329,AMC is working with Citi on potential $2 billion float of Odeon cinemas: sources ,LONDON AMC Entertainment Holdings  is working with Citi  on an initial public offering (IPO) of Britain's Odeon cinemas group  three sources familiar with the matter said.,topStory
AMC,AMC Entertainment Holdings Inc,20180329,AMC is working with Citi on potential $2 bln float of Odeon cinemas -sources ,* Parent company seeks to capitalise on higher European valuations,normal
AMT,American Tower Corporation (REIT),20180329,BRIEF-American Tower Says Entered Loan Agreement For A New $1.5 Bln Unsecured Term Loan ,* AMERICAN TOWER SAYS ENTERED LOAN AGREEMENT FOR A NEW $1.5 BILLION UNSECURED TERM LOAN - SEC FILING,topStory
AJG,Arthur J Gallagher & Co,20180329,BRIEF-Arthur J. Gallagher & Co. Acquires McGregor & Associates ,* ARTHUR J GALLAGHER & CO - TERMS OF TRANSACTION WERE NOT DISCLOSED. Source text for Eikon: Further company coverage:,topStory
T,AT&T Inc,20180329,AT&T trial hears of consequences if Turner networks go dark ,Twelve percent of subscribers would quit their cable or satellite companies if Time Warner Inc’s  Turner networks were no longer available  a Massachusetts Institute of Technology marketing professor said on Thursday.,topStory
T,AT&T Inc,20180329,UPDATE 1-AT&T trial hears of consequences if Turner networks go dark ,March 29 Twelve percent of subscribers would quit their cable or satellite companies if Time Warner Inc’s Turner networks were no longer available  a Massachusetts Institute of Technology marketing professor said on Thursday.,normal
T,AT&T Inc,20180329,BRIEF-AT&T Inc. Announces Private Exchange Offers For Four Series Of Notes Open To Certain Investors ,* AT&T INC. ANNOUNCES PRIVATE EXCHANGE OFFERS FOR FOUR SERIES OF NOTES OPEN TO CERTAIN INVESTORS,normal
T,AT&T Inc,20180329,BRIEF-AT&T Announces Cash Offers For Four Series Of Notes Open To All Investors ,* AT&T INC. ANNOUNCES CASH OFFERS FOR FOUR SERIES OF NOTES OPEN TO ALL INVESTORS,normal
AZZ,AZZ Inc,20180329,BRIEF-AZZ Says Will Restate Consolidated Financial Statements In Its Qtrly Reports On Form 10-Q For Qtrs Ended May 31 And August 31 ,* AZZ SAYS WILL RESTATE CONSOLIDATED FINANCIAL STATEMENTS IN ITS QTRLY REPORTS ON FORM 10-Q FOR QTRS ENDED MAY 31  2017 AND AUGUST 31  2017 - SEC FILING,topStory
BAC,Bank of America Corporation,20180329,Bank of America to add Merrill Edge offices  advisers ,Bank of America Corp said on Thursday it will grow its wealth management offering for mainstream investors by opening 600 new Merrill Edge centers and adding 300 new brokers in the next two years.,topStory
BAC,Bank of America Corporation,20180329,UPDATE 1-Bank of America to add Merrill Edge offices  advisers ,March 29 Bank of America Corp said on Thursday it will grow its wealth management offering for mainstream investors by opening 600 new Merrill Edge centers and adding 300 new brokers in the next two years.,normal
BAC,Bank of America Corporation,20180329,CORRECTED-Japan regulator says Deutsche  Bank of America violated Japan law in bond-price fixing ,TOKYO  March 29 Japan's Fair Trade Commission on Thursday said Bank of America Merrill Lynch and Deutsche Bank had violated Japan's antitrust laws in alleged bond-price fixing by London-based traders in 2012  because it involved a Japanese bank.,normal
BCS,Barclays PLC,20180329,Barclays $2 billion fraud fine resolves major U.S. legal issue ,LONDON/WASHINGTON Barclays  will pay $2 billion to settle claims for billions of dollars of losses suffered by investors who bought toxic mortgage-backed securities in the run-up to the 2007 financial crisis  the U.S. Justice Department said on Thursday.,topStory
BCS,Barclays PLC,20180329,UPDATE 2-Barclays $2 bln fraud fine resolves major U.S. legal issue ,* Bank to take 0.45 pct CET1 hit in Q1 (Adds background and analyst comment  updates shares),normal
BCS,Barclays PLC,20180329,BRIEF-‍Barclays Reaches $2 bln RMBS Settlement With United States Department Of Justice ,* ‍BARCLAYS REACHES SETTLEMENT WITH UNITED STATES DEPARTMENT OF JUSTICE IN RELATION TO RESIDENTIAL MORTGAGE-BACKED SECURITIES,normal
BCS,Barclays PLC,20180329,Barclays to pay $2 bln U.S. fine over mortgage fraud claims -Justice Dept. ,WASHINGTON  March 29 Barclays has agreed to pay $2 billion for allegedly causing billions of dollars of losses to investors by engaging in a fraudulent scheme to sell residential mortgage-backed securities between 2005 and 2007  the U.S. Justice Department said on Thursday.,normal
BA,Boeing Company (The),20180329,BRIEF-Boeing Says Delivers First 737 Max For SCAT Airlines‍​ ,* BOEING SAYS DELIVERS FIRST 737 MAX FOR SCAT AIRLINES‍​ Source text: https://bit.ly/2pPxBjO Further company coverage: (Reuters.Briefs@thomsonreuters.com),topStory
BA,Boeing Company (The),20180329,Boeing said detected limited intrusion of malware ,U.S. planemaker Boeing Co  "detected a limited intrusion of malware" that affected "a small number of systems " and said certain media reports on the disruptions were "overstated and inaccurate " a company vice president said on Wednesday.,normal
BA,Boeing Company (The),20180329,BOC Aviation says to buy 6 Boeing aircraft worth $1.7 bln ,HONG KONG  March 29 BOC Aviation Ltd said on Thursday it would buy six new Boeing 787-9 aircraft from Boeing worth a combined $1.7 billion at list prices.,normal
BA,Boeing Company (The),20180329,BRIEF-BOC Aviation's Unit To Purchase Six 787-9 Aircrafts From Boeing For $1.69 Bln ,* UNIT AGREED TO PURCHASE SIX 787-9 AIRCRAFTS FROM BOEING FOR US$1.69 BILLION Source text for Eikon: Further company coverage:,normal
BP,BP plc,20180329,RPT-INSIGHT-U.S.-trained engineer takes on Algeria's energy monolith ,ORAN  Algeria  March 29 When the U.S.-educated CEO of Algeria's state energy company Sonatrach ended a speech to staff by seeking questions  an executive sitting next to him quickly picked up the microphone.,topStory
BP,BP plc,20180329,BUZZ-MS  Citi bullish on big oil cos  but differ on Shell ,** Citigroup says integrated oil companies (IOCs) should not be judged only on their improving shareholder returns  but also by their "deconstructed synthetics",normal
BP,BP plc,20180329,BP chief Dudley's 2017 pay rises after previous year's cut ,LONDON BP Chief Executive Bob Dudley's remuneration rose to $13.4 million in 2017  when the oil and gas giant's profits more than doubled and production soared.,normal
BP,BP plc,20180329,INSIGHT-U.S.-trained engineer takes on Algeria's energy monolith ,ORAN  Algeria  March 29 When the U.S.-educated CEO of Algeria's state energy company Sonatrach ended a speech to staff by seeking questions  an executive sitting next to him quickly picked up the microphone.,normal
BP,BP plc,20180329,BP chief Dudley's 2017 pay rises after previous year's cut ,LONDON  March 29 BP Chief Executive Bob Dudley's remuneration rose to $13.4 million in 2017  when the oil and gas giant's profits more than doubled and production soared.,normal
BP,BP plc,20180329,BRIEF-BP ‍Says Paul Anderson To Not Stand For Re-Election As Non-Exec Director​ ,* ‍PAUL ANDERSON WILL NOT BE OFFERING HIMSELF FOR RE-ELECTION AS A NON-EXECUTIVE DIRECTOR​,normal
BP,BP plc,20180329,BRIEF-BP Says CEO Bob Dudley's 2017 Total Remuneration Was $13.4‍​ Mln ,* CEO BOB DUDLEY'S 2017 TOTAL REMUNERATION WAS $13.4‍​ MILLION VERSUS $11.9 MILLION IN 2016,normal
BPL,Buckeye Partners LP,20180329,Pennsylvania judge delivers blow to Buckeye effort to reverse Laurel Pipeline ,NEW YORK A Pennsylvania judge on Thursday urged the state's public utility commission to reject Buckeye Partners LP's proposal to reverse the western portion of a 350-mile (560-km) product pipeline that extends from Philadelphia to Pittsburgh.,topStory
BPL,Buckeye Partners LP,20180329,Pennsylvania judge delivers blow to Buckeye effort to reverse Laurel Pipeline ,NEW YORK  March 29 A Pennsylvania judge on Thursday urged the state's public utility commission to reject Buckeye Partners LP's proposal to reverse the western portion of a 350-mile (560-km) product pipeline that extends from Philadelphia to Pittsburgh.,normal
BG,Bunge Limited,20180329,FOCUS-Pressure builds on Bunge with struggle to give up sugar ,LONDON  March 29 Bunge is struggling to sell its sugar trading operations  according to two sources familiar with the matter  frustrating  the 200-year-old agricultural merchant's strategy of slimming down to focus on core areas and improve profitability.,topStory
BG,Bunge Limited,20180329,Pressure builds on Bunge with struggle to give up sugar ,LONDON Bunge is struggling to sell its sugar trading operations  according to two sources familiar with the matter  frustrating  the 200-year-old agricultural merchant's strategy of slimming down to focus on core areas and improve profitability.,normal
BG,Bunge Limited,20180329,BRIEF-Corbion  Bunge Sign Interim-Agreement On Acquisition Of Bunge's Stake In SB Renewable Oils JV ,* CORBION AND BUNGE SIGN INTERIM-AGREEMENT REGARDING THE ACQUISITION OF BUNGE'S STAKE IN SB RENEWABLE OILS JOINT VENTURE,normal
CWH,Camping World Holdings Inc,20180329,BRIEF-Camping World Holdings Announces Third Amendment To Its Credit Facility ,* CAMPING WORLD HOLDINGS  INC. ANNOUNCED THE THIRD AMENDMENT TO ITS CREDIT FACILITY,topStory
CAT,Caterpillar Inc,20180329,UPDATE 1-Renault shares jump on new Nissan merger reports ,PARIS  March 29 Renault shares rose sharply on Thursday following renewed media reports of merger talks between the French carmaker and its longstanding alliance partner Nissan.,normal
CTL,CenturyLink Inc,20180329,BRIEF-Temasek Holdings Reports 9.7 Pct Stake In Centurylink Inc ,* TEMASEK HOLDINGS (PRIVATE) LIMITED REPORTS 9.7 PERCENT STAKE IN CENTURYLINK INC AS OF MARCH 27  2018 - SEC FILING‍​,topStory
CRL,Charles River Laboratories International Inc,20180329,BRIEF-Charles River Laboratories CEO's 2017 Total Compensation Was $12.6 Mln ,March 29 Charles River Laboratories International Inc:,topStory
CHGG,Chegg Inc,20180329,BRIEF-Chegg prices upsized offering of $300 mln of 0.25 pct convertible senior notes due 2023 ,* CHEGG PRICES UPSIZED OFFERING OF $300.0 MILLION OF 0.25% CONVERTIBLE SENIOR NOTES DUE 2023,topStory
C,Citigroup Inc,20180329,BUZZ-MS  Citi bullish on big oil cos  but differ on Shell ,** Citigroup says integrated oil companies (IOCs) should not be judged only on their improving shareholder returns  but also by their "deconstructed synthetics",topStory
C,Citigroup Inc,20180329,UPDATE 1-Saudi's Kingdom Holding proposes fiscal year dividend ,RIYADH  March 29 Saudi Arabian investment firm Kingdom Holding proposed a cash dividend of 0.50 riyals per share for 2017  the company said on Thursday.,normal
C,Citigroup Inc,20180329,AMC is working with Citi on potential $2 billion float of Odeon cinemas: sources ,LONDON AMC Entertainment Holdings  is working with Citi  on an initial public offering (IPO) of Britain's Odeon cinemas group  three sources familiar with the matter said.,normal
C,Citigroup Inc,20180329,AMC is working with Citi on potential $2 bln float of Odeon cinemas -sources ,* Parent company seeks to capitalise on higher European valuations,normal
CXO,Concho Resources Inc,20180329,U.S. shale producer Concho offers $8 billion for rival RSP Permian ,U.S. shale producer Concho Resources Inc on Wednesday agreed to buy rival RSP Permian Inc in an $8 billion all-stock deal that could trigger a wave of consolidation in the fast-growing Permian Basin oilfield.,topStory
COP,ConocoPhillips,20180329,BRIEF-ConocoPhillips Announces Pricing Of Cash Tender Offer ,* CONOCOPHILLIPS ANNOUNCES PURCHASE UP TO $400 MILLION IN AGGREGATE PRINCIPAL AMOUNT OF OUTSTANDING DEBT SECURITIES​ Source text for Eikon: Further company coverage:,topStory
STZ,Constellation Brands Inc,20180329,Constellation Brands results beat on higher demand for Mexican beers ,Constellation Brands Inc  reported fourth-quarter sales and profit on Thursday above Wall Street estimates  driven by strong demand for high margin Corona and Modelo beers and expensive wines such as Meiomi. | Video ,topStory
STZ,Constellation Brands Inc,20180329,UPDATE 3-Constellation Brands results beat on higher demand for Mexican beers ,March 29 Constellation Brands Inc reported fourth-quarter sales and profit on Thursday above Wall Street estimates  driven by strong demand for high margin Corona and Modelo beers and expensive wines such as Meiomi.,normal
STZ,Constellation Brands Inc,20180329,BRIEF-Constellation Brands Qtrly Comparable EPS $1.90 ,* CONSTELLATION BRANDS REPORTS FISCAL 2018 RESULTS AND FISCAL 2019 OUTLOOK,normal
STZ,Constellation Brands Inc,20180329,Corona maker Constellation Brands's quarterly sales top estimates ,March 29 Constellation Brands Inc reported better-than-expected quarterly sales on Thursday  driven by strong demand for its Corona and Modelo beers.,normal
CUB,Cubic Corporation,20180329,BRIEF-Cubic Corp Awarded Contract To Support Data Link Enterprise ,* CUBIC AWARDED RESEARCH  DEVELOPMENT  TEST AND EVALUATION CONTRACT TO SUPPORT DATA LINK ENTERPRISE,topStory
CB,D/B/A Chubb Limited New,20180329,BRIEF-Chubb Arabia Cooperative Insurance Board Proposes No FY Dividend ,March 29 CHUBB ARABIA COOPERATIVE INSURANCE COMPANY SJSC:,topStory
DAN,Dana Incorporated,20180329,BRIEF-Dana Inc Comments On Decision By GKN PLC Shareholders ,* DANA INC - "APPEARS UNLIKELY THAT OUR PROPOSED COMBINATION WITH GKN DRIVELINE WILL PROCEED",topStory
DB,Deutsche Bank AG,20180329,UPDATE 2-Big Deutsche Bank investors seek clarity on CEO - sources ,* Cryan has said he is "absolutely committed" to bank (Adds quotes from second investor  background),topStory
DB,Deutsche Bank AG,20180329,Big Deutsche Bank investors want clarity on CEO from board -sources ,FRANKFURT  March 29 Large investors in Deutsche Bank said on Thursday that they want a clear signal from the chairman on whether the board backs the lender's embattled chief executive officer or not  according to two people close to the matter.,normal
DB,Deutsche Bank AG,20180329,UPDATE 1-Japan regulator says Deutsche  Bank of America violated antitrust laws ,TOKYO  March 29 Japanese regulators on Thursday said Bank of America Merrill Lynch and Deutsche Bank had violated antitrust laws in the alleged fixing of bond prices.,normal
DB,Deutsche Bank AG,20180329,CORRECTED-Japan regulator says Deutsche  Bank of America violated Japan law in bond-price fixing ,TOKYO  March 29 Japan's Fair Trade Commission on Thursday said Bank of America Merrill Lynch and Deutsche Bank had violated Japan's antitrust laws in alleged bond-price fixing by London-based traders in 2012  because it involved a Japanese bank.,normal
D,Dominion Energy Inc,20180329,Dominion to complete Atlantic Coast natgas pipe by end 2019 ,March 29 Dominion Energy Inc said Thursday it was still on track to finish its $5 billion Atlantic Coast natural gas pipeline from West Virginia to North Carolina in late 2019:,topStory
DCUD,Dominion Energy Inc,20180329,Dominion to complete Atlantic Coast natgas pipe by end 2019 ,March 29 Dominion Energy Inc said Thursday it was still on track to finish its $5 billion Atlantic Coast natural gas pipeline from West Virginia to North Carolina in late 2019:,topStory
DRUA,Dominion Energy Inc,20180329,Dominion to complete Atlantic Coast natgas pipe by end 2019 ,March 29 Dominion Energy Inc said Thursday it was still on track to finish its $5 billion Atlantic Coast natural gas pipeline from West Virginia to North Carolina in late 2019:,topStory
RDY,Dr Reddy&#39;s Laboratories Ltd,20180329,BRIEF-Dr.Reddy's Laboratories Appoints Erez Israeli As Chief Operating Officer ,* CHIEF OPERATING OFFICER ABHIJIT MUKHERJEE TO RETIRE ON MARCH 31,topStory
EW,Edwards Lifesciences Corporation,20180329,BRIEF-Edwards Lifesciences Corp Says CEO Michael Mussallem's FY 2017 Total Compensation Was $10.8 Mln Vs $9.7 Mln In FY 2016 ,* EDWARDS LIFESCIENCES CORP SAYS CEO MICHAEL MUSSALLEM'S FY 2017 TOTAL COMPENSATION WAS $10.8 MILLION VERSUS $9.7 MILLION IN FY 2016 - SEC FILING Source text: (https://bit.ly/2GUuNcF) Further company coverage:,topStory
EGO,Eldorado Gold Corporation,20180329,Eldorado Gold updated Greek mine plan reduces 'footprint' ,TORONTO  March 29 Canada's Eldorado Gold Corp filed a new technical report for its contentious Skouries gold mine project in Greece on Thursday  which said it "significantly" reduces the development's environmental footprint.,topStory
ECA,Encana Corporation,20180329,BRIEF-Encana Says Entered Into First Amending Agreement​ ,* ENCANA CORP SAYS ‍ON MARCH 28  ENTERED INTO A FIRST AMENDING AGREEMENT  TO ITS RESTATED CREDIT AGREEMENT  DATED AS OF JULY 16  2015 - SEC FILING​,topStory
E,ENI SpA,20180329,In Italy  activist investors find a happy hunting ground ,MILAN When U.S. activist investor Elliott Advisers laid siege to Italy's dominant phone company this month  a shiver went through the country's corporate sector.,normal
E,ENI SpA,20180329,In Italy  activist investors find a happy hunting ground ,MILAN  March 29 When U.S. activist investor Elliott Advisers laid siege to Italy's dominant phone company this month  a shiver went through the country's corporate sector.,normal
E,ENI SpA,20180329,Shell targets former executive in Nigeria graft complaint ,LONDON Royal Dutch Shell  has filed a criminal complaint against a former senior employee over suspected bribes in the $390 million sale of an oilfield in Nigeria  where the company is already under investigation over a separate deal.,normal
EPD,Enterprise Products Partners LP,20180329,Enterprise Products Partners to halt some Dixie Pipeline propane in April ,* Enterprise Products Partners will perform hydrostatic testing on a portion of its Dixie Pipeline system east of Hattiesburg  Mississippi around April 30  according to a notice published on Thursday by the Federal Energy Regulatory Commision,topStory
XOM,Exxon Mobil Corporation,20180329,U.S. judge dismisses Exxon lawsuit to stop climate change probes ,NEW YORK A federal judge on Thursday dismissed Exxon Mobil Corp's  lawsuit seeking to stop New York and Massachusetts from probing whether the oil and gas company covered up its knowledge about climate change and lied to investors and the public about it.,topStory
XOM,Exxon Mobil Corporation,20180329,UPDATE 3-U.S. judge dismisses Exxon lawsuit to stop climate change probes ,NEW YORK  March 29 A federal judge on Thursday dismissed Exxon Mobil Corp's lawsuit seeking to stop New York and Massachusetts from probing whether the oil and gas company covered up its knowledge about climate change and lied to investors and the public about it.,normal
XOM,Exxon Mobil Corporation,20180329,U.S. judge dismisses Exxon lawsuit to stop climate change probes ,NEW YORK  March 29 A federal judge on Thursday dismissed Exxon Mobil Corp's lawsuit seeking to stop New York and Massachusetts from probing whether the company misled investors and the public about climate change and the potential effects on its business.,normal
XOM,Exxon Mobil Corporation,20180329,BRIEF-Exxonmobil Bags Eight Deepwater Blocks In Latest Brazil Bid Round ,* EXXONMOBIL WINS EIGHT DEEPWATER BLOCKS IN LATEST BRAZIL BID ROUND,normal
XOM,Exxon Mobil Corporation,20180329,BUZZ-MS  Citi bullish on big oil cos  but differ on Shell ,** Citigroup says integrated oil companies (IOCs) should not be judged only on their improving shareholder returns  but also by their "deconstructed synthetics",normal
FMSA,Fairmount Santrol Holdings Inc,20180329,BRIEF-Unimin And Fairmount Santrol Announce Combined Company Executive Leadership Team To Serve Upon Completion Of Merger ,* UNIMIN AND FAIRMOUNT SANTROL ANNOUNCE COMBINED COMPANY EXECUTIVE LEADERSHIP TEAM TO SERVE UPON COMPLETION OF MERGER,topStory
SFUN,Fang Holdings Limited,20180329,BRIEF-Fang Holdings Q4 ‍fully Diluted Earnings Per ADS $0.03​ ,* ‍ESTIMATES ITS NET INCOME FOR 2018 WILL RANGE FROM APPROXIMATELY $100 MILLION TO APPROXIMATELY $120 MILLION​ Source text for Eikon: Further company coverage:,topStory
