FDC,First Data Corporation,20180329,BRIEF-First Data Corp Says CEO Bisignano's FY 2017 Total Compensation Was $102.2 Mln ,* FIRST DATA CORP SAYS CEO FRANK BISIGNANO'S FY 2017 TOTAL COMPENSATION WAS $102.2 MILLION WHICH INCLUDED $99.9 MILLION IN STOCK AWARDS - SEC FILING,topStory
FE,FirstEnergy Corporation,20180329,FirstEnergy seeks emergency lifeline for U.S. nuclear  coal plants ,NEW YORK/WASHINGTON U.S. power company FirstEnergy Corp  urged the federal government on Thursday to evoke little-used emergency powers to help it keep several struggling nuclear and coal-fired power plants open  a move critics blasted as an attempt at a corporate bailout.,topStory
FE,FirstEnergy Corporation,20180329,UPDATE 3-FirstEnergy seeks emergency lifeline for U.S. nuclear  coal plants ,NEW YORK/WASHINGTON  March 29 U.S. power company FirstEnergy Corp urged the federal government on Thursday to evoke little-used emergency powers to help it keep several struggling nuclear and coal-fired power plants open  a move critics blasted as an attempt at a corporate bailout.,normal
FE,FirstEnergy Corporation,20180329,FirstEnergy calls on US energy secretary to save nuclear  coal plants ,March 29 FirstEnergy Corp called on U.S. Energy Secretary Rick Perry on Thursday to direct the operator of the Mid Atlantic and Midwest power grid to take steps to keep several nuclear and coal-fired power plants in service to maintain the future reliability of the region's electric grid.,normal
FPH,Five Point Holdings LLC,20180329,BRIEF-Five Point Holdings Says Qtrly Revenue $22.3 Mln Vs $16.5 Mln ,* FIVE POINT HOLDINGS  LLC ANNOUNCES FOURTH QUARTER 2017 RESULTS,topStory
FMC,FMC Corporation,20180329,BRIEF-FMC Corp Sees Q1 Adjusted EPS Exceed $1.45 - $1.59 Range ,* FMC GIVES UPDATE ON EXPECTED PERFORMANCE FOR FIRST QUARTER AND FULL YEAR 2018 AHEAD OF SCHEDULED MEETING WITH INVESTORS,topStory
F,Ford Motor Company,20180329,BRIEF-Ford Releases 2018 Proxy Statement ,* FORD RELEASES 2018 PROXY STATEMENT  ANNOUNCES VIRTUAL ANNUAL MEETING DATE AND ISSUES 2017 ANNUAL REPORT,topStory
F,Ford Motor Company,20180329,Ford CEO Jim Hackett earned $16.3 million as profit dropped ,DETROIT Ford Motor Co  Chief Executive Officer Jim Hackett earned salary  bonus and stock awards of $16.3 million in 2017  while adjusted pretax profit for the automaker dropped $1.9 billion from 2016  the company said on Thursday.,normal
F,Ford Motor Company,20180329,UPDATE 1-Ford CEO Jim Hackett earned $16.3 mln as profit dropped ,DETROIT  March 29 Ford Motor Co Chief Executive Officer Jim Hackett earned salary  bonus and stock awards of $16.3 million in 2017  while adjusted pretax profit for the automaker dropped $1.9 billion from 2016  the company said on Thursday.,normal
F,Ford Motor Company,20180329,Ford CEO Jim Hackett earned $16.3 million in 2017 ,DETROIT  March 29 Ford Motor Co Chief Executive Officer Jim Hackett earned salary  bonus and stock awards of $16.3 million in 2017  while adjusted pretax profit for the automaker dropped $1.9 billion from 2016  the company said on Thursday.,normal
F,Ford Motor Company,20180329,Volkswagen unveils concept pickup truck at New York auto show ,NEW YORK Volkswagen AG  unveiled a prototype pickup truck at the New York auto show on Wednesday  a vehicle that would fill a gap in the German company's U.S. product lineup in what is one of the most profitable segments of the American market.,normal
GBL,Gamco Investors Inc,20180329,BRIEF-Gamco Investors Files For Mixed Shelf Of Upto $500 Million ,* GAMCO INVESTORS INC FILES FOR MIXED SHELF OF UPTO $500 MILLION - SEC FILING Source text: (https://bit.ly/2GibQU4) Further company coverage:,topStory
GZT,Gazit-Globe Ltd,20180329,BRIEF-Gazit Globe Board Approves New Share Repurchase Program ,* GAZIT GLOBE LTD SAYS BOARD APPROVED NEW SHARE REPURCHASE PROGRAM - SEC FILING‍​,topStory
GNK,Genco Shipping & Trading Limited Warrants Expiring 12/31/2021 ,20180329,BRIEF-Strategic Value Partners Says John Brantl Intends To Resign From Genco Shipping & Trading's Board ,* STRATEGIC VALUE PARTNERS SAYS ON MARCH 26  JOHN BRANTL  MANAGING DIRECTOR OF SVP  INTENDS TO RESIGN FROM GENCO SHIPPING & TRADING'S BOARD - SEC FILING,topStory
GEK,General Electric Capital Corporation,20180329,GE charge  restatement may help explain cash issues ,NEW YORK General Electric Co is poised to shine light into a sizable part of its financial black box  an area that governs how it estimates revenue from long-term contracts.,topStory
GEK,General Electric Capital Corporation,20180329,GE charge  restatement may help explain cash issues ,NEW YORK  March 29 General Electric Co is poised to shine light into a sizable part of its financial black box  an area that governs how it estimates revenue from long-term contracts.,normal
GE,General Electric Company,20180329,GE charge  restatement may help explain cash issues ,NEW YORK General Electric Co is poised to shine light into a sizable part of its financial black box  an area that governs how it estimates revenue from long-term contracts.,topStory
GE,General Electric Company,20180329,GE charge  restatement may help explain cash issues ,NEW YORK  March 29 General Electric Co is poised to shine light into a sizable part of its financial black box  an area that governs how it estimates revenue from long-term contracts.,normal
GEO,Geo Group Inc (The),20180329,BRIEF-GEOAmey Joint Venture Signs Court Custody And Prisoner Escort Services Contract In Scotland ,* GEOAMEY JOINT VENTURE SIGNS COURT CUSTODY AND PRISONER ESCORT SERVICES CONTRACT IN SCOTLAND,topStory
GFI,Gold Fields Limited,20180329,South Africa's Gold Fields ties up with Canada's Asanko in Ghana ,JOHANNESBURG South Africa's Gold Fields will buy a near 50 percent share of Asanko Gold Inc's Ghana subsidiary and take a stake in the Canadian miner in a $202.6 million deal  it said on Thursday.,topStory
GFI,Gold Fields Limited,20180329,UPDATE 2-South Africa's Gold Fields ties up with Canada's Asanko in Ghana ,* Bullion miner to fund transaction through cash and debt (Adds CEO quote  analyst comment on debt levels),normal
GFI,Gold Fields Limited,20180329,South Africa's Gold Fields to form Ghana joint venture with Canada's Asanko ,JOHANNESBURG  March 29 South Africa's Gold Fields said it will buy a 50 percent stake in Asanko Gold Inc's Ghana subsidiary and take a stake in the Canadian miner in a $202.6 million deal.,normal
GFI,Gold Fields Limited,20180329,BRIEF-Gold Fields Says To Form JV in Ghana with Canada's Asanko Gold ,* ‍ENTERED INTO A DEFINITIVE AGREEMENT WITH ASANKO GOLD TO FORM A 50:50 INCORPORATED JOINT VENTURE​,normal
GFI,Gold Fields Limited,20180329,BRIEF-Asanko Gold To Receive $185 Mln From Gold Fields For 50 Pct JV Interest ,* ASANKO GOLD TO RECEIVE US$185 MILLION FROM GOLD FIELDS FOR 50% JOINT VENTURE INTEREST AND US$17.6 MILLION FOR 9.9% PRIVATE PLACEMENT IN ASANKO GOLD,normal
GG,Goldcorp Inc,20180329,Goldcorp deposits 3 000 ounces of gold in blockchain 'milestone' ,TORONTO Goldcorp Inc made the first gold deposit on Tradewind Markets' new digitized trading platform  the companies said on Thursday  with 3 000 ounces of bullion from its Red Lake mine complex in Ontario.,topStory
GG,Goldcorp Inc,20180329,Goldcorp deposits 3 000 ounces of gold in blockchain 'milestone' ,TORONTO  March 29 Goldcorp Inc made the first gold deposit on Tradewind Markets' new digitized trading platform  the companies said on Thursday  with 3 000 ounces of bullion from its Red Lake mine complex in Ontario.,normal
HAL,Halliburton Company,20180329,INSIGHT-U.S.-trained engineer takes on Algeria's energy monolith ,ORAN  Algeria  March 29 When the U.S.-educated CEO of Algeria's state energy company Sonatrach ended a speech to staff by seeking questions  an executive sitting next to him quickly picked up the microphone.,normal
HOG,Harley-Davidson Inc,20180329,BRIEF-Harley-Davidson CEO's 2017 Total Compensation Was $11.12 Mln ,* HARLEY-DAVIDSON INC SAYS CEO MATTHEW S. LEVATICH'S 2017 TOTAL COMPENSATION WAS $11.12 MILLION VERSUS $9.35 MILLION IN 2016 – SEC FILING ‍​,topStory
HLT,Hilton Worldwide Holdings Inc,20180329,BRIEF-Hilton Worldwide Holdings Says CEO Nassetta's FY'17 Compensation Was $18.8 Mln ,* HILTON WORLDWIDE HOLDINGS INC SAYS CEO CHRISTOPHER NASSETTA'S FY 2017 TOTAL COMPENSATION WAS $18.8 MILLION VERSUS $11.0 MILLION IN FY 2016 - SEC FILING,topStory
HMC,Honda Motor Company Ltd,20180329,UPDATE 2-Toyota  Suzuki to produce cars for each other in India ,* Manufacturing agreement to begin by mid-2019 (Adds analyst comment  details on India market),normal
HON,Honeywell International Inc,20180329,BRIEF-Ontic Signs License Agreement With Honeywell For Cockpit LCD Displays ,* ONTIC SIGNS LICENSE AGREEMENT WITH HONEYWELL FOR COCKPIT LCD DISPLAYS ON MULTIPLE PLATFORMS,topStory
HUM,Humana Inc,20180329,Walmart discussing closer ties with Humana  including possible acquisition -sources ,March 29 Walmart Inc is in early-stage talks with Humana Inc about developing closer ties  with the acquisition of Humana being discussed as one possibility  people familiar with the matter said on Thursday.,topStory
HUM,Humana Inc,20180329,BRIEF-Walmart Is In Early Stage Acquisition Talks With Humana - CNBC  Citing Dow Jones ,* WALMART IS IN EARLY STAGE ACQUISITION TALKS WITH HUMANA - CNBC  CITING DOW JONES,normal
HII,Huntington Ingalls Industries Inc,20180329,BRIEF-Huntington Ingalls Industries Awarded $94 Mln Advance Procurement Contract For A 10th National Security Cutter ,* HUNTINGTON INGALLS INDUSTRIES AWARDED $94 MILLION ADVANCE PROCUREMENT CONTRACT FOR A 10TH NATIONAL SECURITY CUTTER,topStory
IBN,ICICI Bank Limited,20180329,UPDATE 1-India's ICICI Bank fined $9 mln for breach of bonds sale rule ,March 29 India's central bank has fined ICICI Bank Ltd  the country's third biggest lender  589 million rupees ($9.04 million) for not sticking to certain rules about sale of government securities  in a rare move by the banking regulator.,topStory
IBN,ICICI Bank Limited,20180329,BRIEF-ICICI Bank Says RBI Imposed Penalty On Bank For Continued Sale Of Govt Securities Classified As HTM‍​ ,* SAYS RBI HAS IMPOSED A PENALTY ON BANK FOR CONTINUED SALE OF GOVERNMENT SECURITIES CLASSIFIED AS HTM‍​,normal
IBN,ICICI Bank Limited,20180329,India's central bank imposes $9 mln penalty on ICICI Bank ,March 29 India's central bank  in a rare move  imposed a penalty of 589 million rupees ($9.04 million) on ICICI Bank Ltd  the country's third biggest lender  for failure to adhere to held-to-maturity (HTM) guidelines.,normal
ICE,Intercontinental Exchange Inc,20180329,BRIEF-Intercontinental Exchange CEO's 2017 Total Compensation Was $14.5 Mln ,* INTERCONTINENTAL EXCHANGE INC SAYS CHAIRMAN AND CEO JEFFREY SPRECHER'S FY 2017 TOTAL COMPENSATION WAS $14.5 MILLION VERSUS $10.7 MILLION IN FY 2016 - SEC FILING Source text (https://bit.ly/2uwNOPS) Further company coverage:,topStory
IBM,International Business Machines Corporation,20180329,BRIEF-IBM Adopts New FASB Guidance On Pension Reporting Change Effective In 2018 ,* IBM - IBM ADOPTS NEW FASB GUIDANCE ON PENSION REPORTING CHANGE EFFECTIVE IN 2018,topStory
IPG,Interpublic Group of Companies Inc (The),20180329,BRIEF-Interpublic Group Of Companies Names Michael Koziol Global CEO Of Huge ,* SAYS MANAGEMENT SUCCESSION SEES MICHAEL KOZIOL NAMED GLOBAL CEO OF HUGE AS AARON SHAPIRO DEPARTS FOR NEW VENTURE Source text for Eikon: Further company coverage:,topStory
JEC,Jacobs Engineering Group Inc,20180329,BRIEF-Saudi Aramco Selects Jacobs For Zuluf Field Development Program ,* SAUDI ARAMCO SELECTS JACOBS FOR ZULUF FIELD DEVELOPMENT PROGRAM,topStory
JBT,John Bean Technologies Corporation,20180329,BRIEF-John Bean Technologies CEO's 2017 Total Compensation Was $4.8 Million ,* JOHN BEAN TECHNOLOGIES CORP SAYS CEO THOMAS W. GIACOMINI'S 2017 TOTAL COMPENSATION WAS $4.8 MILLION VERSUS $4.5 MILLION IN 2016 – SEC FILING‍​ Source text (https://bit.ly/2E52eWO) Further company coverage:,topStory
KEY,KeyCorp,20180329,BRIEF-Keybank To Sell Key Insurance & Benefits Services ,* KEYBANK ENTERS INTO AGREEMENT TO SELL KEY INSURANCE & BENEFITS SERVICES  INC. TO USI INSURANCE SERVICES,topStory
LNN,Lindsay Corporation,20180329,BRIEF-Lindsay's Road Zipper System To Be Deployed On The Richmond-San Rafael Bridge ,* LINDSAY'S ROAD ZIPPER SYSTEM® TO BE DEPLOYED ON THE RICHMOND-SAN RAFAEL BRIDGE,topStory
LNN,Lindsay Corporation,20180329,BRIEF-Lindsay Corp Reports Q2 EPS $0.16 ,* Q2 EARNINGS PER SHARE VIEW $0.57 -- THOMSON REUTERS I/B/E/S,normal
MMP,Magellan Midstream Partners LP,20180329,BRIEF-Unit Corp To Sell 50 Pct Interest In Midstream Subsidiary ,* PRESS RELEASE - UNIT CORPORATION TO SELL 50% INTEREST IN MIDSTREAM SUBSIDIARY,topStory
MAS,Masco Corporation,20180329,BRIEF-Masco Corp Says CEO Keith Allman's FY 2017 Total Compensation Was $11.5 Mln Versus $9.8 Mln In FY 2016 ,* MASCO CORP SAYS CEO KEITH ALLMAN'S FY 2017 TOTAL COMPENSATION WAS $11.5 MILLION VERSUS $9.8 MILLION IN FY 2016 - SEC FILING Source text: (https://bit.ly/2pRfGcA) Further company coverage:,topStory
MTZ,MasTec Inc,20180329,BRIEF-Mastec Inc Completes Existing Common Stock Repurchase Plan ,* MASTEC COMPLETES EXISTING COMMON STOCK REPURCHASE PLAN AND AUTHORIZES AN ADDITIONAL $100 MILLION SHARE REPURCHASE PLAN,topStory
MRK,Merck & Company Inc,20180329,BRIEF-Merck & Co Inc Files For Potential Debt Shelf Size Not Disclosed ,* MERCK & CO INC FILES FOR POTENTIAL DEBT SHELF; SIZE NOT DISCLOSED - SEC FILING Source text: (https://bit.ly/2uv1RFE) Further company coverage:,topStory
MTOR,Meritor Inc,20180329,BRIEF-Meritor Announces Conversion Option For 7.875 Pct Convertible Senior Notes ,* MERITOR INC ANNOUNCES CONVERSION OPTION FOR 7.875% CONVERTIBLE SENIOR NOTES DUE 2026 Source text for Eikon: Further company coverage:,topStory
MOV,Movado Group Inc,20180329,BRIEF-Movado Group Announces Q4 Loss Per Share Of $1.47 ,* MOVADO GROUP  INC. ANNOUNCES FOURTH QUARTER AND FISCAL YEAR 2018 RESULTS,topStory
MLI,Mueller Industries Inc,20180329,BRIEF-Mueller Industries CEO's 2017 Total Compensation $4.6 Mln ,* MUELLER INDUSTRIES INC SAYS CEO GREGORY L. CHRISTOPHER'S 2017 TOTAL COMPENSATION WAS $4.6 MILLION VERSUS $4.8 MILLION IN 2016 – SEC FILING‍​ Source text: (https://bit.ly/2GoCQxu) Further company coverage:,topStory
MULE,MuleSoft Inc,20180329,BRIEF-New Enterprise Associates 14 Reports 15.3 Pct Stake In Mulesoft ,* NEW ENTERPRISE ASSOCIATES 14  L.P REPORTS 15.3 PERCENT STAKE IN MULESOFT INC AS OF MARCH 20  2018 - SEC FILING‍​ Source text: [https://bit.ly/2pQGbON] Further company coverage:,topStory
NFX,Newfield Exploration Company,20180329,BRIEF-Newfield Exploration CEO's 2017 Total Compensation Was $12.1 Mln ,* NEWFIELD EXPLORATION CO SAYS CEO LEE K. BOOTHBY'S 2017 TOTAL COMPENSATION WAS $12.1 MILLION VERSUS $9.9 MILLION IN 2016 – SEC FILING‍​,topStory
NOK,Nokia Corporation,20180329,BRIEF-Nokia Wins GSM-Railway Contract With Polish PKP Polskie Linie Kolejowe ,* PRESS RELEASE NOKIA WINS ITS LARGEST-EVER GSM-RAILWAY CONTRACT WITH POLISH PKP POLSKIE LINIE KOLEJOWE TO MODERNIZE CRITICAL COMMUNICATIONS NETWORK,topStory
NOK,Nokia Corporation,20180329,Nokia to cut 353 jobs in Finland ,HELSINKI Nokia said on Thursday it had decided to cut 353 jobs in its home market Finland this year due to a weak global network market and as part of its global cost-savings plan.,normal
NOK,Nokia Corporation,20180329,Nokia to cut 353 jobs in Finland ,HELSINKI  March 29 Nokia said on Thursday it had decided to cut 353 jobs in its home market Finland this year due to a weak global network market and as part of its global cost-savings plan.,normal
DCM,NTT DOCOMO Inc,20180329,BRIEF-NTT Docomo says adoption of International Financial Reporting Standards ,* Says it will adopt International Financial Reporting Standards (IFRS) as the new accounting method  to replace the United States-Generally Accepted Accounting Principles,topStory
OI,Owens-Illinois Inc,20180329,BRIEF-Owens-Illinois Says CEO's 2017 Compensation Was $8.1 Mln ,* OWENS-ILLINOIS INC SAYS CEO ANDRES LOPEZ'S FY 2017 TOTAL COMPENSATION WAS $8.1 MILLION VERSUS $6.9 MILLION IN FY 2016 - SEC FILING Source: (https://bit.ly/2GSWzGs) Further company coverage:,topStory
PBR,Petroleo Brasileiro SA- Petrobras,20180329,UPDATE 1-China's Shandong Kerui wins $587 mln deal for Petrobras gas unit ,SAO PAULO  March 29 Brazilian state-controlled oil company Petróleo Brasileiro SA signed a 1.95 billion real ($587 million) contract with China's Shandong Kerui Petroleum Equipment Co to build a natural gas processing unit as part of a push to hire more global contractors.,topStory
PBR,Petroleo Brasileiro SA- Petrobras,20180329,Petrobras signs $587 million agreement to build gas processing unit ,SAO PAULO Brazilian state-controlled oil company Petróleo Brasileiro SA has signed a 1.95 billion real ($587.2 million) contract to build a natural gas processing unit in Rio de Janeiro state  according to a securities filing on Thursday.,normal
PBR,Petroleo Brasileiro SA- Petrobras,20180329,Petrobras signs $587 mln agreement to build gas processing unit ,SAO PAULO  March 29 Brazilian state-controlled oil company Petróleo Brasileiro SA has signed a 1.95 billion real ($587.2 million) contract to build a natural gas processing unit in Rio de Janeiro state  according to a securities filing on Thursday.,normal
PBR,Petroleo Brasileiro SA- Petrobras,20180329,Petrobras CEO says oil auction still appealing despite missing blocks ,RIO DE JANEIRO Pedro Parente  Chief Executive Officer of Brazil's state-controlled oil giant Petroleo Brasileiro  said he still thought there were good blocks on offer in an oil auction on Thursday  even after a court threw out two choice blocks in the Santos basin.,normal
PBR,Petroleo Brasileiro SA- Petrobras,20180329,Petrobras CEO says oil auction still appealing despite missing blocks ,RIO DE JANEIRO  March 29 Pedro Parente  Chief Executive Officer of Brazil's state-controlled oil giant Petroleo Brasileiro  said he still thought there were good blocks on offer in an oil auction on Thursday  even after a court threw out two choice blocks in the Santos basin. (Reporting by Marta Nogueira Editing by Chizu Nomiyama),normal
PBR,Petroleo Brasileiro SA- Petrobras,20180329,BRIEF-Bondholders Owning $8.09 Bln In Petrobras Debt Joined Tender Offer ,* BRAZIL'S PETROBRAS SAYS BONDHOLDERS OWNING $8.09 BILLION WORTH OF DEBT PARTICIPATED IN TENDER OFFER Further company coverage: (Reporting By Bruno Federowski),normal
PFE,Pfizer Inc,20180329,Pfizer's rare heart disease drug succeeds in late-stage study ,Pfizer Inc's experimental drug to treat a rare and fatal disease linked to heart failure reduced deaths and need for hospitalizations in a late-stage study.,topStory
PFE,Pfizer Inc,20180329,UPDATE 2-Pfizer's rare heart disease drug succeeds in late-stage study ,* Brokerage Suntrust estimates sales of $130 mln of drug in 2022,normal
PFE,Pfizer Inc,20180329,Pfizer's rare disease drug succeeds in late-stage study ,March 29 Pfizer Inc said on Thursday its drug for a rare and fatal disease associated with progressive heart failure met the main goal in a late-stage study.,normal
PFE,Pfizer Inc,20180329,BRIEF-Pfizer Announces Tafamidis Phase 3 ATTR-ACT Study Met Its Primary Endpoint ,* PFIZER ANNOUNCES POSITIVE TOPLINE RESULTS FROM PHASE 3 ATTR-ACT STUDY OF TAFAMIDIS IN PATIENTS WITH TRANSTHYRETIN CARDIOMYOPATHY,normal
PM,Philip Morris International Inc,20180329,BRIEF-Philip Morris International Files Proxy Statement For Annual Meeting Of Shareholders ,* PHILIP MORRIS INTERNATIONAL- ‍ON MARCH 29  CO FILED A PROXY STATEMENT FOR ANNUAL MEETING OF SHAREHOLDERS TO BE HELD ON WEDNESDAY  MAY 9 - SEC FILING​,topStory
PM,Philip Morris International Inc,20180329,BRIEF-Philip Morris International CEO André Calantzopoulos' FY 2017 Total Compensation Was $18.98 Mln Versus ,* PHILIP MORRIS INTERNATIONAL INC SAYS CEO ANDRÉ CALANTZOPOULOS' FY 2017 TOTAL COMPENSATION WAS $18.98 MILLION VERSUS $18.1 MILLION IN FY 2016 - SEC FILING,normal
PSX,Phillips 66,20180329,U.S. Dept. Of Energy sells 5.2 mln barrels of oil from SPR ,NEW YORK  March 29 The U.S. Department of Energy sold about 5.2 million barrels of oil from the Strategic Petroleum Reserve (SPR) to five companies including top refiners Valero Energy Corp and Phillips 66  according to a notice on Wednesday:,topStory
PNW,Pinnacle West Capital Corporation,20180329,BRIEF-Pinnacle West Capital Says CEO's 2017 Compensation Was $10.5 Mln ,* PINNACLE WEST CAPITAL CORP SAYS CEO DONALD E. BRANDT'S 2017 TOTAL COMPENSATION WAS $10.5 MILLION VERSUS $11.4 MILLION IN 2016 - SEC FILING‍​ Source text: [https://bit.ly/2GorrO5] Further company coverage:,topStory
PJC,Piper Jaffray Companies,20180329,CORRECTED (OFFICIAL)-U.S. oil drillers cut rigs for first week in three -Baker Hughes , (Company corrects rig count in second paragraph to drillers cut seven (not six) oil rigs ... bringing the total count down to 797 (not 798)     March 29 U.S. energy companies this week cut oil rigs for the first time in three weeks even as crude prices hover near three-year highs.     Drillers cut seven oil rigs in the week to March 29  bringing the total count down to 797  General Electric Co's        Baker Hughes energy services firm said in its closely followed report on Thursday,normal
PJC,Piper Jaffray Companies,20180329,U.S. oil drillers cut rigs for first week in three -Baker Hughes ,    March 29 U.S. energy companies this week cut oil rigs for the first time in three weeks even as crude prices hover near three-year highs.     Drillers cut six oil rigs in the week to March 29  bringing the total count down to 798  General Electric Co's        Baker Hughes energy services firm said in its closely followed report on Thursday.      Baker Hughes published its North American rig count report on Thursday  one day earlier than usual  due to the Goo,normal
POL,PolyOne Corporation,20180329,BRIEF-Polyone Corp Says CEO's 2017 Total Compensation Was $5.7 Mln ,* POLYONE CORP SAYS CEO ROBERT M. PATTERSON'S 2017 TOTAL COMPENSATION WAS $5.7 MILLION VERSUS $3.8 MILLION IN 2016 – SEC FILING‍​ Source text: [https://bit.ly/2Gkmv0A] Further company coverage:,topStory
RTN,Raytheon Company,20180329,Raytheon wins $460 million U.S. defense contract: Pentagon ,WASHINGTON Raytheon Self Protect Systems  a subsidiary of Raytheon Co  has been awarded a $460 million contract for the AN/ALR‐69A digital Radar Warning Receiver system  the Pentagon said on Thursday.,topStory
RTN,Raytheon Company,20180329,Raytheon wins $460 mln U.S. defense contract -Pentagon ,WASHINGTON  March 29 Raytheon Self Protect Systems  a subsidiary of Raytheon Co  has been awarded a $460 million contract for the AN/ALR‐69A digital Radar Warning Receiver system  the Pentagon said on Thursday. (Reporting by Eric Walsh; Editing by Mohammad Zargham),normal
RGS,Regis Corporation,20180329,BRIEF-Regis Corp Announces Closing Of New Five-Year  $260 Mln Unsecured Revolving Credit Facility ,* REGIS CORPORATION ANNOUNCES THE CLOSING OF A NEW FIVE-YEAR  $260 MILLION UNSECURED REVOLVING CREDIT FACILITY AND REDEMPTION OF THE COMPANY’S 5.5% HIGH-YIELD NOTES,topStory
RIO,Rio Tinto Plc,20180329,Swiss prosecutors checking if minister payments linked to Rio's Oyu Tolgoi ,ZURICH Swiss prosecutors on Thursday confirmed they were checking whether "questionable payments" to an ex-Mongolian finance minister were linked to Rio Tinto's Oyu Tolgoi mining project  adding the Anglo-Australian mining company was "not an accused".,topStory
RIO,Rio Tinto Plc,20180329,Swiss prosecutors checking if minister payments linked to Rio's Oyu Tolgoi ,ZURICH  March 29 Swiss prosecutors on Thursday confirmed they were checking whether "questionable payments" to an ex-Mongolian finance minister were linked to Rio Tinto's Oyu Tolgoi mining project  adding the Anglo-Australian mining company was "not an accused".,normal
RSPP,RSP Permian Inc,20180329,U.S. shale producer Concho offers $8 billion for rival RSP Permian ,U.S. shale producer Concho Resources Inc on Wednesday agreed to buy rival RSP Permian Inc in an $8 billion all-stock deal that could trigger a wave of consolidation in the fast-growing Permian Basin oilfield.,topStory
SNY,Sanofi,20180329,BRIEF-Sanofi: EMA to review sotagliflozin as potential treatment for type 1 diabetes ,* The European Medicines Agency (EMA) has accepted for review Sanofi's regulatory submission for sotagliflozin,topStory
SNY,Sanofi,20180329,REFILE-UPDATE 2-Merits of any Takeda bid for Shire questioned  shares slide ,TOKYO  March 29 A potential acquisition of London-listed Shire by Takeda Pharmaceutical was greeted with investor scepticism about its merits on Thursday  with shares in the Japanese drug maker tumbling 7 percent.,normal
SNY,Sanofi,20180329,BRIEF-Ablynx Says Tender Offers By Sanofi To Acquire Co To Commence On April 4 ,* PREVIOUSLY ANNOUNCED TENDER OFFERS BY SANOFI TO ACQUIRE ABLYNX WILL COMMENCE ON APRIL 4  2018,normal
SNY,Sanofi,20180329,Drugmaker Shire soars as Japan's Takeda considers bid ,LONDON/TOKYO Japan's largest drugmaker Takeda Pharmaceutical  is considering a bid for London-listed rare disease specialist Shire  that could top $40 billion and spark another takeover battle in the deal-hungry pharma industry. | Video ,normal
SAIC,SCIENCE APPLICATIONS INTERNATIONAL CORPORATION,20180329,BRIEF-SAIC Announces Q4 Earnings Per Share $1.16 ,March 29 Science Applications International Corp :,topStory
SPB           ,Spectrum Brands Holdings Inc,20180329,BRIEF-Energizer Holdings Expects Acquisition Of Spectrum Brands' Battery Business To Close In H2 2018 ,* ENERGIZER HOLDINGS  INC. AND SPECTRUM BRANDS HOLDINGS ANNOUNCE EXPIRATION OF HART-SCOTT-RODINO WAITING PERIOD FOR THE ACQUISITION OF SPECTRUM BRANDS' BATTERY AND PORTABLE LIGHTING PRODUCTS BUSINESS,topStory
