VNET,21Vianet Group Inc,20161128,BRIEF-21Vianet Group q3 adjusted loss per ADS $0.02 ,* 21Vianet group  inc. Reports third quarter 2016 unaudited financial results,topStory
ACST,Acasti Pharma Inc,20161128,BRIEF-Acasti Pharma appoints Linda O'keefe as chief financial officer ,* Acasti Pharma appoints Linda O'keefe as chief financial officer,topStory
AAAP,Advanced Accelerator Applications SA,20161128,BRIEF-Advanced Accelerator Applications reports 15.4% sales growth ,* Advanced accelerator applications reports 15.4% sales growth in the third quarter of 2016 and feedback from the FDA for lutathera  an investigational treatment for Neuroendocrine tumors,topStory
AIMT,Aimmune Therapeutics Inc,20161128,BRIEF-Nestle Health Science Us Holdings reports 15.12 pct passive stake in Aimmune Therapeutics ,* Nestle Health Science Us Holdings Inc reports 15.12 percent passive stake in Aimmune Therapeutics Inc as of November 23 - sec filing  Source text : http://bit.ly/2fXFe0Z Further company coverage:,topStory
AIMT,Aimmune Therapeutics Inc,20161128,BRIEF-Aimmune Therapeutics expects artemis to enroll 120-160 patients in Europe ,* Aimmune Therapeutics completes global enrollment of phase 3 palisade trial of ar101 for the treatment of peanut allergy,normal
AKRX,Akorn Inc,20161128,BRIEF-Akorn invalidates Durezol patent via inter partes review proceeding ,* On November 22  2016  patent trial and appeal board ruled in favor of Akorn in its inter partes review proceeding,topStory
AMZN,Amazoncom Inc,20161128,Trump adds antitrust expert to Justice transition team ,WASHINGTON  Nov 28 A Republican antitrust veteran has been named on Monday to U.S. President-elect Donald Trump's transition team for the Justice Department  a choice that lawyers say signals a more hands-off approach to antitrust enforcement compared to Democratic President Barack Obama.,normal
AAL,American Airlines Group Inc,20161128,American Airlines  Qantas end bid to grow partnership ,Nov 28 American Airlines Group Inc and Australia's Qantas Airways Ltd have dropped their bid to coordinate prices and flight schedules  according to a filing submitted to the U.S. Transportation Department on Monday.,topStory
AVXL,Anavex Life Sciences Corp,20161128,BRIEF-Anavex life sciences appoints three distinguished researchers to scientific advisory board ,* Anavex life sciences appoints three distinguished researchers to scientific advisory board  Source text for Eikon:  Further company coverage:,topStory
AAPL,Apple Inc,20161128,Australian regulator to block collective bank bargaining on Apple payment system ,SYDNEY  Nov 29 Australia's antitrust regulator said on Tuesday it was planning to deny some banks authorisation to collectively bargain with Apple Inc in relation to its mobile digital payment system.,topStory
APVO,Aptevo Therapeutics Inc,20161128,BRIEF-Aptevo Therapeutics anticipated experiencing supply interruption of Ixinity 1 500 IU dosage form beginning Dec 2016 - SEC filing ,* Aptevo Therapeutics says on Nov 14  reported co anticipated experiencing supply interruption of Ixinity 1 500 IU dosage form beginning Dec 2016 - SEC filing,topStory
ASFI,Asta Funding Inc,20161128,BRIEF-Mangrove Partners notified Asta Funding Inc that it was terminating mutual confidentiality agreement with co ,* Asta Funding Inc says on Nov 21  2016  Mangrove Partners notified co that mangrove was terminating mutual confidentiality agreement with co - SEC filing  Source text for Eikon:  Further company coverage:,topStory
AVEO,AVEO Pharmaceuticals Inc,20161128,BRIEF-Aveo Pharmaceuticals says Eusa Pharma submits its responses to EMA day 120 list of questions ,* Says  its development partner  Eusa Pharma  submitted its responses to European Medicines Agency (EMA) day 120 list of questions,topStory
RILY,B Riley Financial Inc,20161128,BRIEF-B. Riley Financial unit enters into agreement with Unified Logistics ,* Great American Capital Partners provides $10.9 million senior secured credit facility to Unified Logistics Holdings  Source text for Eikon:  Further company coverage:,topStory
RILYL,B Riley Financial Inc,20161128,BRIEF-B. Riley Financial unit enters into agreement with Unified Logistics ,* Great American Capital Partners provides $10.9 million senior secured credit facility to Unified Logistics Holdings  Source text for Eikon:  Further company coverage:,topStory
RILYZ,B Riley Financial Inc,20161128,BRIEF-B. Riley Financial unit enters into agreement with Unified Logistics ,* Great American Capital Partners provides $10.9 million senior secured credit facility to Unified Logistics Holdings  Source text for Eikon:  Further company coverage:,topStory
TAPR,Barclays Inverse US Treasury Composite ETN,20161128,Barclays nets less than expected from Asia wealth business sale ,LONDON  Nov 28 Barclays completed the sale of its Singapore and Hong Kong wealth management businesses for a less-than-expected $225 million  as not all of the bank's customers chose to transfer their business across to the buyer  Oversea-Chinese Banking Corp.,topStory
TAPR,Barclays Inverse US Treasury Composite ETN,20161128,BRIEF-Barclays completes sale of Singapore and Hong Kong wealth units for $225 mln ,* Barclays plc announces that it has completed sale of its wealth and investment management (WIM) business in Singapore and Hong Kong to Bank of Singapore limited,normal
BVXV,BiondVax Pharmaceuticals Ltd,20161128,BRIEF-Biondvax Q3 loss per share NIS 0.02 ,* Biondvax announces third quarter 2016 financial results and update,topStory
BOJA,Bojangles&#39; Inc,20161128,BRIEF-Bojangles' Inc announces proposed secondary offering of common stock ,* Bojangles'  Inc. announces proposed secondary offering of common stock,topStory
CDEV,Centennial Resource Development Inc,20161128,UPDATE 1-Silverback Exploration to sell oil and gas assets for $855 mln ,Nov 28 Privately held Silverback Exploration LLC will sell oil and gas assets in the Delaware Basin  Texas  for $855 million to Centennial Resource Development Inc  which is backed by energy private equity fund Riverstone Holdings LLC.,normal
CFBK,Central Federal Corporation,20161128,BRIEF-Central Federal and unit  CFBank  have received regulatory approvals for CFBank to convert to National Bank Charter ,* Central Federal-co  its wholly-owned banking unit  CFBank  have received necessary regulatory approvals for CFBank to convert to National Bank Charter,topStory
CCOI,Cogent Communications Holdings Inc,20161128,BRIEF-Cogent launches notes offering ,* Cogent Communications Holdings - Unit intends to commence tack-on offering of additional $125 million of its 5.375 percent senior secured notes due 2022,topStory
CTSH,Cognizant Technology Solutions Corporation,20161128,Elliott discloses stake in Cognizant  urges board shakeup ,Activist investor Elliott Management disclosed a stake of more than 4 percent in Cognizant Technology Solutions  and urged the IT services provider in a letter to consider shaking up its board as one of several steps to boost shareholder value.,topStory
CTSH,Cognizant Technology Solutions Corporation,20161128,UPDATE 2-Elliott discloses stake in Cognizant  urges board shakeup ,Nov 28 Activist investor Elliott Management disclosed a stake of more than 4 percent in Cognizant Technology Solutions and urged the IT services provider in a letter to consider shaking up its board as one of several steps to boost shareholder value.,normal
CTSH,Cognizant Technology Solutions Corporation,20161128,BRIEF-Cognizant issues statement in response to Elliott Management letter ,* Cognizant issues statement in response to Elliott Management letter,normal
CTSH,Cognizant Technology Solutions Corporation,20161128,US STOCKS-Wall St falls as consumer  finance stocks weigh ,* Time Inc jumps after report of company rejecting takeover bid,normal
CTSH,Cognizant Technology Solutions Corporation,20161128,Elliott discloses stake in Cognizant  urges changes ,Nov 28 Activist investor Elliott Management Corp disclosed a more than 4 percent stake in Cognizant Technology Solutions and urged the IT services provider to take steps to boost shareholder value.,normal
CTSH,Cognizant Technology Solutions Corporation,20161128,BRIEF-Elliott management sends letter to Cognizant Technology Solutions Corporation ,* Elliott management sends letter to cognizant technology solutions corporation outlining value-enhancement plan,normal
CRIS,Curis Inc,20161128,BRIEF-Curis says announces full approval of Roche's Erivedge in European Union ,* Says announces full approval of Roche's Erivedge in European Union,topStory
DFBG,Differential Brands Group Inc,20161128,BRIEF-Differential Brands announces appointment of Tom Nevell as executive vice president of business development ,* Differential Brands Group Inc announces appointment of Tom Nevell as executive vice president of business development  Source text for Eikon:  Further company coverage:,topStory
EMITF,Elbit Imaging Ltd,20161128,BRIEF-Elbit Imaging says board has decided to reject proposal to convert all outstanding debts of Elbit Medical to co ,* Elbit Imaging Ltd. announces refusal to the debt conversion proposal from its subsidiary Elbit Medical Technologies Ltd and extension to the debt of Elbit Medical Technologies Ltd maturity date,topStory
EPZM,Epizyme Inc,20161128,BRIEF-Epizyme announces fast track designation for Tazemetostat in DLBCL ,* Epizyme announces fast track designation for tazemetostat in DLBCL and provides solid tumor program update,topStory
FDUS,Fidus Investment Corporation,20161128,BRIEF-Fidus Investment announces commencement of public offering of common stock ,* Fidus Investment Corporation announces commencement of public offering of common stock,topStory
FOMX,Foamix Pharmaceuticals Ltd,20161128,BRIEF-Foamix announces completion of patient enrollment in phase 3 acne trials for Minocycline Foam FMX101 ,* Foamix announces completion of patient enrollment in phase 3 acne trials for Minocycline Foam FMX101,topStory
FFHL,Fuwei Films (Holdings) Co Ltd,20161128,BRIEF-Fuwei Films announces its unaudited financial results for the third quarter of 2016 ,* Fuwei Films announces its unaudited financial results for the third quarter of 2016,topStory
GENE,Genetic Technologies Ltd,20161128,BRIEF-Genetic Technologies entered into license agreement with University Of Melbourne ,* Asx alert-license agreement to develop colorectal cancer risk test-GTG.AX,topStory
GILD,Gilead Sciences Inc,20161128,Gilead  Merck to face off before jury over hepatitis C drug patents ,Early next month  Gilead Sciences Inc will try to convince a federal jury in Delaware that a Merck & Co patent on hepatitis C drugs is invalid.,topStory
GBT,Global Blood Therapeutics Inc,20161128,BRIEF-Global Blood Therapeutics to initiate mid-stage trial for the treatment of idiopathic pulmonary fibrosis ,* Global Blood Therapeutics announces initiation of phase 2a trial of GBT440 in idiopathic pulmonary fibrosis (IPF),topStory
GLBS,Globus Maritime Limited,20161128,BRIEF-Globus Maritime announces agreement regarding $5 mln equity private placement and conversion of certain outstanding loans ,* Globus Maritime announces agreement regarding $5 million equity private placement and conversion of certain outstanding loans,topStory
GLBS,Globus Maritime Limited,20161128,BRIEF-Nasdaq Inc says trading was halted in Globus Maritime Limited ,* Nasdaq Inc says trading was halted in Globus Maritime Limited at 13:24:10 ET for "additional information requested" from co at a last price of $7.318  Source text for Eikon:  Further company coverage:,normal
GTXI,GTx Inc,20161128,BRIEF-Gtx's Enobosarm has been well tolerated among patients ,* Enobosarm meets pre-specified primary efficacy endpoint in ongoing phase 2 clinical trial in ER+/AR+ breast cancer,topStory
HOLX,Hologic Inc,20161128,BRIEF-Hologic buys 5.8 pct stake in Hanwha Ace Special Purpose Acquisition 1st ,Nov 28 Hanwha Ace Special Purpose Acquisition 1st Co Ltd :,topStory
IAC,IAC/InterActiveCorp,20161128,BRIEF-Rod Little joins HSN Inc as chief financial officer ,* Little will join company on January 3  reporting to CEO Mindy Grossman  Source text for Eikon:  Further company coverage:,topStory
IDRA,Idera Pharmaceuticals Inc,20161128,BRIEF-Idera Pharmaceuticals and Vivelix Pharmaceuticals  Ltd enter into license agreement ,* Press release - Idera Pharmaceuticals and Vivelix Pharmaceuticals  Ltd. Enter into exclusive license agreement for the worldwide rights to IMO-9200,topStory
KANG,iKang Healthcare Group Inc,20161128,BRIEF-Ikang Healthcare Group extends shareholder rights plan ,* Ikang Healthcare Group  Inc. extends shareholder rights plan,topStory
IPXL,Impax Laboratories Inc,20161128,BRIEF-Impax appoints J. Kevin Buchi to board ,* Impax announces appointment of J. Kevin Buchi to board of directors  Source text for Eikon:  Further company coverage:,topStory
PI,Impinj Inc,20161128,BRIEF-Impinj files for offering 1 mln shares of its common stock ,* Files for offering 1.0 million shares of its common stock - SEC filing,topStory
PI,Impinj Inc,20161128,BRIEF-Impinj launches follow-on public offering of 3.5 mln shares of common stock ,* Launch of a proposed follow-on public offering of 3.5 million shares of its common stock,normal
NTEC,Intec Pharma Ltd,20161128,BRIEF-Intec Pharma enters into agreement with the Michael J. Fox foundation ,* Intec Pharma enters into agreement with the Michael J. Fox foundation around its Phase III trial recruitment  Source text for Eikon:  Further company coverage:,topStory
IDCC,InterDigital Inc,20161128,BRIEF-Interdigital issues revenue guidance for Q4 2016 ,* Interdigital issues revenue guidance for fourth quarter 2016,topStory
TILE,Interface Inc,20161128,BRIEF-Opaleye Management reports 5.12 pct passive stake in Wafergen Bio-Systems ,* Opaleye Management Inc reports 5.12 percent passive stake in Wafergen Bio-Systems Inc as of November 17 - sec filing  Source text : http://bit.ly/2gChrEM Further company coverage:,topStory
ISRG,Intuitive Surgical Inc,20161128,BRIEF-Intuitive Aerial gets order and signs supplier contract with BBC ,Further company coverage:   ($1 = 0.9380 euros)   (Gdynia Newsroom),topStory
JRVR,James River Group Holdings Ltd,20161128,BRIEF-James River Group Holdings announces closing of secondary offering ,* James river group holdings announces closing of secondary offering  Source text for Eikon:  Further company coverage:,topStory
JBLU,JetBlue Airways Corporation,20161128,BRIEF-JetBlue launches in Havana on first day of service between U.S. and Cuban capital ,* JetBlue launches in Havana - its 100th destination - on historic first day of service between the U.S. and Cuban capital,topStory
JBLU,JetBlue Airways Corporation,20161128,U.S. airlines launch flights to Cuba despite doubts from Trump ,Nov 28 U.S. airlines are proceeding with plans to launch new flights to Cuba this week despite doubts that President-elect Donald Trump has raised about the future of ties between the countries.,normal
KNSL,Kinsale Capital Group Inc,20161128,BRIEF-Kinsale Capital Group announces secondary offering of 2.8 mln shares ,* Kinsale Capital Group  Inc. announces secondary offering of common stock  Source text for Eikon:  Further company coverage:,topStory
LSCC,Lattice Semiconductor Corporation,20161128,UPDATE 1-Chicago Stock Exchange tries to ease fears over China deal ,NEW YORK  Nov 28 Chicago Stock Exchange Inc (CHX) has released new information related to its proposed takeover by an investor group led by China's Chongqing Casin Enterprise Group  in part to make clear that the Chinese government is not involved in the deal.,normal
LFVN,Lifevantage Corporation,20161128,BRIEF-Lifevantage submits plan with Nasdaq to regain compliance ,* Lifevantage submits plan with nasdaq to regain compliance  Source text for Eikon:  Further company coverage:,topStory
LKQ,LKQ Corporation,20161128,BRIEF-LKQ corp to acquire equity interest in Mekonomen Group ,* LKQ Corporation to acquire equity interest in Mekonomen Group,topStory
LKQ,LKQ Corporation,20161128,BRIEF-Axel Johnson sells Mekonomen holding to LKQ Corporation ,* Axel Johnson sells its shareholding in Mekonomen Group  to LKQ Corporation,normal
MBVX,MabVax Therapeutics Holdings Inc,20161128,BRIEF-Mabvax Therapeutics enrolls patients in expansion of Phase I clinical trial for pancreatic cancer patients ,* Mabvax Therapeutics enrolls first patients in expansion of Phase I clinical trial treating newly diagnosed pancreatic cancer patients,topStory
MATW,Matthews International Corporation,20161128,BRIEF-Matthews International signs definitive agreement for purchase of Ungricht ,* Matthews international corporation signs definitive agreement for the purchase of ungricht,topStory
MDGS,Medigus Ltd,20161128,BRIEF-Medigus Q3 revenue fell 43 percent to $136 000 ,* Q3 revenue fell 43 percent to $136 000  Source text for Eikon:  Further company coverage:,topStory
MSON,MISONIX Inc,20161128,BRIEF-Misonix reports Nasdaq's acceptance of its plan to regain listing compliance ,* Misonix reports Nasdaq's acceptance of its plan to regain listing compliance  Source text for Eikon:  Further company coverage:,topStory
MYGN,Myriad Genetics Inc,20161128,BRIEF-Camber Capital Management reports 5.53 pct passive stake in Myriad Genetics ,* Camber Capital Management LLC reports 5.53 percent passive stake in Myriad Genetics Inc as of November 16 - sec filing  Source text : http://bit.ly/2fuddBZ Further company coverage:,topStory
NDAQ,Nasdaq Inc,20161128,BRIEF-Nasdaq Inc says trading was halted in Globus Maritime Limited ,* Nasdaq Inc says trading was halted in Globus Maritime Limited at 13:24:10 ET for "additional information requested" from co at a last price of $7.318  Source text for Eikon:  Further company coverage:,topStory
NFLX,Netflix Inc,20161128,BRIEF-TiVo Corp says product and intellectual property agreements with Netflix do not change fiscal year 2016 estimates given by TiVo on November 3  2016 ,* TiVo Corp says product and intellectual property agreements with Netflix do not change fiscal year 2016 estimates given by TiVo on November 3  2016  Source text for Eikon:  Further company coverage:,topStory
NFLX,Netflix Inc,20161128,BRIEF-TiVo and Netflix enter into product and intellectual property agreements ,* TiVo and Netflix enter into product and intellectual property agreements,normal
NUVA,NuVasive Inc,20161128,BRIEF-Nuvasive repurchased about $49.6 mln in aggregate principal amount of its 2.75 PCT convertible senior notes due 2017 ,* Nuvasive-From Nov 11 to nov 28  repurchased about $49.6 million in aggregate principal amount of its 2.75% convertible senior notes due 2017 - SEC filing,topStory
PZRX,PhaseRx Inc,20161128,BRIEF-PhaseRx receives orphan drug designation from FDA for PRX-OTC ,* Phaserx receives orphan drug designation from FDA for PRX-OTC for the treatment of ornithine transcarbamylase deficiency,topStory
PINC,Premier Inc,20161128,BRIEF-Premier Inc agrees to acquire Innovatix LLC and Essensa Ventures LLC ,* Expands GPO position in continuum of care market with agreement to acquire Innovatix  LLC and Essensa Ventures  LLC,topStory
RADA,RADA Electronic Industries Ltd,20161128,BRIEF-Rada Electronic Industries Q3 loss per share $0.06 ,* Q3 loss per share $0.06  Source text for Eikon:  Further company coverage:,topStory
RGCO,RGC Resources Inc,20161128,BRIEF-RGC Resources raises annual dividend 7.4 pct to $0.87 per share ,* RGC Resources  Inc. raises annual dividend 7.4% to $0.87 per share  Source text for Eikon:  Further company coverage:,topStory
SPIL,Siliconware Precision Industries Company Ltd,20161128,BRIEF-Hanmi Semiconductor signs contract worth 2.4 bln won ,* Says it signed contract with SPIL(Siliconware Precision Industries Co. Ltd) on Nov. 25  to provide semiconductor manufacturing equipment in Taiwan,topStory
SVA,Sinovac Biotech Ltd,20161128,BRIEF-Sinovac reports 71.4 pct rise in Q3 revenue ,* Sinovac reports unaudited third quarter 2016 financial results,topStory
SRNE,Sorrento Therapeutics Inc,20161128,BRIEF-Sorrento Therapeutics secures $75 million loan facility ,* Sorrento Therapeutics  Inc. secures $75 million loan facility,topStory
MDCO,The Medicines Company,20161128,BRIEF-Mylan signs sub-license agreement with the Medicines Patent Pool to produce and market DAKLINZA tablets to 112 countries ,* Mylan signs sub-license agreement with the Medicines Patent Pool to increase access to Hepatitis C treatment in developing countries,topStory
TIVO,TiVo Corporation,20161128,BRIEF-TiVo and Netflix enter into product and intellectual property agreements ,* TiVo and Netflix enter into product and intellectual property agreements,topStory
VRSK,Verisk Analytics Inc,20161128,BRIEF-Verisk Analytics buys MarketStance ,* Verisk Analytics Inc - MarketStance will become part of ISO  Fritz Yohn will continue to lead business  Source text for Eikon:  Further company coverage:,topStory
VIA,Viacom Inc,20161128,Viacom CEO looks to improve culture  affiliate relations  amid CBS talk ,The top priorities of Viacom Inc's  acting president and chief executive are improving key relations with affiliates as well as the struggling media company's internal culture  Bob Bakish told Reuters at the end of his first week on the job.,topStory
VIA,Viacom Inc,20161128,Viacom CEO looks to improve culture  affiliate relations  amid CBS talk ,Nov 28 The top priorities of Viacom Inc's  acting president and chief executive are improving key relations with affiliates as well as the struggling media company's internal culture  Bob Bakish told Reuters at the end of his first week on the job.,normal
VIAB,Viacom Inc,20161128,Viacom CEO looks to improve culture  affiliate relations  amid CBS talk ,The top priorities of Viacom Inc's  acting president and chief executive are improving key relations with affiliates as well as the struggling media company's internal culture  Bob Bakish told Reuters at the end of his first week on the job.,topStory
VIAB,Viacom Inc,20161128,Viacom CEO looks to improve culture  affiliate relations  amid CBS talk ,Nov 28 The top priorities of Viacom Inc's  acting president and chief executive are improving key relations with affiliates as well as the struggling media company's internal culture  Bob Bakish told Reuters at the end of his first week on the job.,normal
VIRT,Virtu Financial Inc,20161128,BRIEF-Virtu Financial acquires select strategic Telco assets from Teza Technologies ,* Virtu Financial acquires select strategic Telco assets from Teza Technologies,topStory
VOD,Vodafone Group Plc,20161128,BRIEF-Ingenico  Oberthur Technologies and Vodafone join forces ,* Ingenico Group  Oberthur Technologies and Vodafone join forces to revolutionize payment terminal connectivity with Ingenico connectivity/manager  Source text for Eikon:  Further company coverage:    (Gdynia Newsroom),topStory
WHLR,Wheeler Real Estate Investment Trust Inc,20161128,BRIEF-Wheeler Real Estate Investment Trust to launch Series D preferred stock follow-on offering ,* Announces launch of Series D preferred stock follow-on offering,topStory
WHLRD,Wheeler Real Estate Investment Trust Inc,20161128,BRIEF-Wheeler Real Estate Investment Trust to launch Series D preferred stock follow-on offering ,* Announces launch of Series D preferred stock follow-on offering,topStory
WHLRP,Wheeler Real Estate Investment Trust Inc,20161128,BRIEF-Wheeler Real Estate Investment Trust to launch Series D preferred stock follow-on offering ,* Announces launch of Series D preferred stock follow-on offering,topStory
WIN,Windstream Holdings Inc,20161128,BRIEF-Windstream says lenders to provide up to $600 mln principal amount of incremental term loans-SEC filing ,* Windstream -Lenders to provide up to $600 million principal amount of incremental term loans under unit's existing senior secured credit facilities,topStory
Z,Zillow Group Inc,20161128,BRIEF-Zillow Group entered settlement agreement with U.S. Department of Labor that will resolve DOL's compliance review ,* Zillow Group says on November 28  entered settlement agreement with U.S. Department of Labor (DOL) that will resolve DOL's compliance review,topStory
ZG,Zillow Group Inc,20161128,BRIEF-Zillow Group entered settlement agreement with U.S. Department of Labor that will resolve DOL's compliance review ,* Zillow Group says on November 28  entered settlement agreement with U.S. Department of Labor (DOL) that will resolve DOL's compliance review,topStory
APD,Air Products and Chemicals Inc,20161128,BRIEF-Air Products  Grupa Azoty Zakady Azotowe Kdzierzyn S.A. sign new contract for supply of industrial gases ,* Air products and Grupa Azoty Zakady Azotowe Kdzierzyn S.A. sign new contract for the supply of industrial gases,topStory
ALL,Allstate Corporation (The),20161128,Insurer Allstate to buy SquareTrade for $1.4 billion ,Property and casualty insurer Allstate Corp  said on Monday it would buy SquareTrade Holding Co Inc for about $1.4 billion from a group of shareholders that include Bain Capital.,topStory
ALL,Allstate Corporation (The),20161128,UPDATE 1-Insurer Allstate to buy SquareTrade for $1.4 bln ,Nov 28 Property and casualty insurer Allstate Corp said on Monday it would buy SquareTrade Holding Co Inc for about $1.4 billion from a group of shareholders that include Bain Capital.,normal
ALL,Allstate Corporation (The),20161128,BRIEF-Allstate expands consumer protection offerings with acquisition of rapidly growing SquareTrade ,* Allstate expands consumer protection offerings with acquisition of rapidly growing SquareTrade  Source text for Eikon:  Further company coverage:,normal
ALL,Allstate Corporation (The),20161128,BRIEF-Allstate says to buy SquareTrade Holding for 1.4 bln ,* Allstate - on nov 28  unit of co  entered into agreement and plan of merger with SquareTrade Holding Company  inc for $1.4 billion in cash,normal
