ITUB,Itau Unibanco Banco Holding SA,20161128,Brazil car rental firm Unidas files for IPO  hires banks ,SAO PAULO  Nov 28 Unidas SA and shareholders have filed for an initial public offering  just a month after Enterprise Holdings Inc agreed to buy a 20 percent stake in the Brazilian car rental firm.,normal
JPM,J P Morgan Chase & Co,20161128,MOVES-JP Morgan hires Chambers for FIG bond syndicate ,LONDON  Nov 28 (IFR) - JP Morgan has hired Robert Chambers from Credit Agricole to work on its financial institutions syndicate desk  according to two sources familiar with the matter.,topStory
JNJ,Johnson & Johnson,20161128,Actelion's ambitious independent-minded CEO will drive up takeover price ,ZURICH  Nov 28 Actelion Chief Executive Jean-Paul Clozel's desire to keep Europe's biggest biotech company independent after building it from scratch  means Johnson & Johnson will have to pay a steep premium if a takeover is to succeed.,normal
JCI,Johnson Controls International plc,20161128,BRIEF-Johnson Controls commences exchange offers for Johnson Controls Notes  Tyco International Finance S.A. Notes ,* Johnson controls commences exchange offers for Johnson Controls  Inc notes and Tyco International Finance S.A. Notes,topStory
KMI,Kinder Morgan Inc,20161128,RPT-Canada pipeline opponents ready to take on Kinder Morgan  Ottawa ,VANCOUVER  Nov 28 If Canada approves Kinder Morgan's Trans Mountain pipeline expansion  the company's four-year campaign for the project will be far from over. Next up is a battle against hardening opposition amongst some communities along its planned route.,topStory
LCI,Lannett Co Inc,20161128,BRIEF-Lannett announces approval for Metaxalone Tablets ,* Lannett announces approval for Metaxalone Tablets USP  800 mg,topStory
LEJU,Leju Holdings Limited,20161128,BRIEF-Leju reports third quarter 2016 results ,* Q3 revenue $183.3 million versus i/b/e/s view $174.1 million,topStory
LMT,Lockheed Martin Corporation,20161128,BRIEF-Lockheed Martin refocuses on training and logistics systems business ,* Lockheed Martin Corp - refocusing of training and logistics systems (TLS) business  Source text for Eikon:  Further company coverage:,topStory
LOW,Lowe&#39;s Companies Inc,20161128,BRIEF-Lowe's Companies entered into a $1.75 billion five-year unsecured revolving amended and restated credit agreement ,* Lowe's Companies Inc says on November 23  co entered into a $1.75 billion five-year unsecured revolving amended and restated credit agreement - SEC filing,topStory
MFC,Manulife Financial Corp,20161128,BRIEF-Manulife Financial announces USD senior notes private placement ,* Manulife Financial Corp - entered into an agreement to privately place U.S.$270 million principal amount of 3.527% senior notes due December 2  2026,topStory
MTZ,MasTec Inc,20161128,Cuba-focused closed-end fund rallies in wake of Castro's death ,NEW YORK  Nov 28 The only Cuba-focused stock fund in the United States rallied more than 13 percent Monday  a sign investors expect Fidel Castro's death to continue to open up relations between the United States and the island country despite President-elect Donald Trump's threat to end the normalization process that began under President Obama in 2014.,normal
MBI,MBIA Inc,20161128,BRIEF-MBIA announces financing commitment for MBIA Insurance Corp ,* Announces financing commitment for mbia insurance corporation,topStory
MRK,Merck & Company Inc,20161128,BRIEF-FDA grants priority review to Merck's supplemental biologics license application (SBLA) for Keytruda ,* FDA grants priority review to Merck's supplemental biologics license application (SBLA) seeking approval for Keytruda(pembrolizumab) for new indication in microsatellite instability-high cancer  Source text for Eikon:  Further company coverage:,topStory
MRK,Merck & Company Inc,20161128,Gilead  Merck to face off before jury over hepatitis C drug patents ,Early next month  Gilead Sciences Inc will try to convince a federal jury in Delaware that a Merck & Co patent on hepatitis C drugs is invalid.,normal
MNR,Monmouth Real Estate Investment Corporation,20161128,BRIEF-Monmouth REIT reports Q4 AFFO $0.18 per share ,* Monmouth real estate investment corporation reports results for the fiscal year ended and the fourth quarter ended september 30  2016,topStory
NEM,Newmont Mining Corporation,20161128,BRIEF-Newmont announces final results and settlement of debt tender offer ,* Newmont announces final results and settlement of debt tender offer,topStory
NR,Newpark Resources Inc,20161128,BRIEF-Newpark announces proposed $100 mln convertible notes offering ,* Newpark announces proposed $100.0 million convertible notes offering,topStory
NI,NiSource Inc,20161128,BRIEF-NiSource Finance Corp as borrower & NiSource Inc entered into a fourth amended and restated revolving credit agreement ,* NiSource Inc says on Nov 28  NiSource Finance Corp as borrower & co entered into a fourth amended and restated revolving credit agreement - SEC filing,topStory
NOK,Nokia Corporation,20161128,BRIEF-Nokia wins order for broadband network update from Denmark's TDC ,* Says Danish telecommunications provider TDC Group  and Nokia are upgrading Danish broadband network to deliver ultra-broadband speeds,topStory
NSC,Norfolk Souther Corporation,20161128,BRIEF-Mitchell Daniels and Marcela Donadio elected to Norfolk Southern board ,* Mitchell E. Daniels Jr. and Marcela E. Donadio elected to Norfolk Southern board  Source text for Eikon:  Further company coverage:,topStory
ORA,Ormat Technologies Inc,20161128,BRIEF-Ormat Technologies  unit entered into agreement for purchase of membership interests with Northleaf Geothermal Holdings ,* Ormat Technologies says on Nov 22  unit entered into agreement for purchase of membership interests with Northleaf Geothermal Holdings LLC - SEC filing,topStory
PBR,Petroleo Brasileiro SA- Petrobras,20161128,Petrobras uses proceeds from field sale for early loan repayment ,SAO PAULO  Nov 28 Brazil's state-controlled Petróleo Brasileiro SA has used half the proceeds from the sale of a Brazilian offshore oil field to repay a loan taken from state development bank BNDES  the latest step toward reducing the largest debt burden of any global oil firm.,topStory
PBR,Petroleo Brasileiro SA- Petrobras,20161128,Brazil's shortfall in gasoline  opportunity for ethanol -Petrobras CEO ,SAO PAULO  Nov 28 The chief executive of Brazil's state-run oil company Petrobras said on Monday that the growing deficit in the country's gasoline refining capacity is an opportunity for local ethanol mills.,normal
RDN,Radian Group Inc,20161128,BRIEF-Radian announces redemption of its 2.25% convertible senior notes due 2019 ,* Radian announces redemption of its 2.25% convertible senior notes due 2019,topStory
RTN,Raytheon Company,20161128,BRIEF-Undisclosed member of 13-nation group has awarded co a $225 million contract ,* Raytheon-Undisclosed member of 13-nation group has awarded co a $225 million direct commercial sales contract for additional capability  Source text for Eikon:  Further company coverage:,topStory
RMAX,RE/MAX Holdings Inc,20161128,BRIEF-Re/Max LLC agrees to purchase group of three independent regions ,* Re/Max LLC agrees to purchase group of three independent regions,topStory
RIO,Rio Tinto Plc,20161128,Rio Tinto disposes of iron ore elephant  signals flexibility: Russell ,LAUNCESTON  Australia Almost unnoticed  Rio Tinto Chief Executive Jean Sebastien Jacques has ushered the China iron ore elephant out of the room.,topStory
RIO,Rio Tinto Plc,20161128,RPT-COLUMN-Rio Tinto disposes of iron ore elephant  signals flexibility: Russell ,LAUNCESTON  Australia  Nov 28 Almost unnoticed  Rio Tinto Chief Executive Jean Sebastien Jacques has ushered the China iron ore elephant out of the room.,normal
RIO,Rio Tinto Plc,20161128,COLUMN-Rio Tinto disposes of iron ore elephant  signals flexibility: Russell ,LAUNCESTON  Australia  Nov 28 Almost unnoticed  Rio Tinto Chief Executive Jean Sebastien Jacques has ushered the China iron ore elephant out of the room.,normal
RLJ,RLJ Lodging Trust,20161128,BRIEF-RLJ Lodging Trust announces the appointment of Art Collins to its Board of Trustees ,* RLJ Lodging Trust announces the appointment of Art Collins to its Board of Trustees  Source text for Eikon:  Further company coverage:,topStory
CRM,Salesforcecom Inc,20161128,BRIEF-Salesforce.com's compensation committee approved changes to compensation arrangements of Marc Benioff  principal executive officer ,* Salesforce.com says effective November 22   compensation committee approved changes to compensation arrangements of Marc Benioff  principal executive officer,topStory
TISI,Team Inc,20161128,BRIEF-Team announces $150 mln ATM equity offering program ,* Team Inc announces $150 million ATM equity offering program,topStory
TI,Telecom Italia SPA,20161128,Telecom Italia  Vivendi launch first joint content offering ,MILAN  Nov 28 Telecom Italia and its controlling shareholder Vivendi have agreed their first content partnership which will give the Italian phone company's customers access to short  original series designed for mobile devices.,topStory
TEVA,Teva Pharmaceutical Industries Limited,20161128,Teva Pharm to market medical cannabis inhaler in Israel ,JERUSALEM Israel's Teva Pharmaceuticals has partnered with Tel Aviv-based Syqe Medical to market in Israel medical cannabis for pain management that is administered with an inhaler.,topStory
TEVA,Teva Pharmaceutical Industries Limited,20161128,Teva Pharm to market medical cannabis inhaler in Israel ,JERUSALEM  Nov 28 Israel's Teva Pharmaceuticals  has partnered with Tel Aviv-based Syqe Medical to market in Israel medical cannabis for pain management that is administered with an inhaler.,normal
THO,Thor Industries Inc,20161128,BRIEF-Thor Industries Q1 EPS $1.49 ,* Thor announces record results for fiscal 2017 first quarter,topStory
TIME,Time Inc,20161128,Time Inc owners could yet thank Bronfman ,NEW YORK (Reuters Breakingviews) - Time Inc owners may yet send a note of thanks to Edgar Bronfman Jr. The former Seagram heir teamed up with Warner Music owner Len Blavatnik to make a bid for the $1.4 billion magazine firm - an offer which was rejected  according to the New York Post. The 30 percent mooted premium sounds decent for an indebted publisher with falling sales.,topStory
TIME,Time Inc,20161128,US STOCKS-Wall St slips as banks  discretionary stocks drag ,* Time Inc jumps after report of company rejecting takeover bid,normal
TIME,Time Inc,20161128,US STOCKS-Wall St retreats as financials  discretionary stocks drag ,* Time Inc jumps after report of company rejecting takeover bid,normal
TIME,Time Inc,20161128,US STOCKS-Wall St falls as consumer  finance stocks weigh ,* Time Inc jumps after report of company rejecting takeover bid,normal
TIME,Time Inc,20161128,Time Inc rejects bid from billionaire Bronfman Jr.: NY Post ,Time Inc   the publisher of Time  People and Fortune magazines  has rejected a takeover bid from billionaire investor Edgar Bronfman Jr.  the New York Post reported on Monday.,normal
TIME,Time Inc,20161128,UPDATE 2-Time Inc rejects bid from billionaire Bronfman Jr. - NY Post ,Nov 28 Time Inc  the publisher of Time  People and Fortune magazines  has rejected a takeover bid from billionaire investor Edgar Bronfman Jr.  the New York Post reported on Monday.,normal
TIME,Time Inc,20161128,US STOCKS-Wall St falls as consumer  finance stocks weigh ,* Time Inc jumps after report of company rejecting takeover bid,normal
TIME,Time Inc,20161128,US STOCKS-Wall St opens lower as consumer  finance stocks weigh ,* Time Inc jumps after report of company rejecting takeover bid,normal
TIME,Time Inc,20161128,US STOCKS-Wall St set to open lower after record-setting week ,* Time Inc jumps after report of company rejecting takeover bid,normal
TIME,Time Inc,20161128,Time Inc rejects bid from billionaire Bronfman Jr. - NY Post ,Nov 28 Time Inc  the publisher of People and Fortune magazines  has rejected a takeover bid from billionaire investor Edgar Bronfman Jr.  the New York Post reported on Monday.,normal
UNH,UnitedHealth Group Incorporated,20161128,BRIEF-UnitedHealth Group to discuss 2017 financial outlook at investor conference ,* UnitedHealth Group to discuss 2017 financial outlook at investor conference,topStory
EGY,Vaalco Energy Inc,20161128,BRIEF-VAALCO announces closing of acquisition of additional working interest in Etame Marin Permit Offshore Gabon ,* VAALCO Energy announces closing of acquisition of additional working interest in the Etame Marin Permit Offshore Gabon  Source text for Eikon:  Further company coverage:,topStory
PAY,Verifone Systems Inc,20161128,VeriFone signs payment solutions partnership with UK's Worldpay ,Nov 28 Payment card machine maker VeriFone Systems Inc said it had extended its partnership with British payments processor Worldpay Group Plc  allowing the U.S. firm to bring its payment solutions to Worldpay's UK customers.,topStory
WMT,Wal-Mart Stores Inc,20161128,Wal-Mart  Best Buy winners as holiday shopping season kicks off ,Nov 28 Wal-Mart  Target and Best Buy - and  unsurprisingly  Amazon.com - were early winners as shoppers kicked off the holiday shopping season by splurging on electronics such as ultra-HD TVs and gaming consoles including Sony's PlayStation 4  analysts said.,topStory
WFC,Wells Fargo & Company,20161128,U.S. lawmaker Warren slams Wells Fargo over arbitration position ,NEW YORK Massachusetts Democratic Senator Elizabeth Warren on Monday criticized Wells Fargo & Co's  decision to require customers affected by its unauthorized accounts scandal to go through arbitration rather than allowing them to sue.,topStory
WFC,Wells Fargo & Company,20161128,U.S. lawmaker Warren slams Wells Fargo over arbitration position ,NEW YORK  Nov 28 Massachusetts Democratic Senator Elizabeth Warren on Monday criticized Wells Fargo & Co's  decision to require customers affected by its unauthorized accounts scandal to go through arbitration rather than allowing them to sue.,normal
WFC,Wells Fargo & Company,20161128,Lawsuit accuses Wells Fargo of violating new mortgage rule ,Wells Fargo Bank has been hit with a lawsuit accusing it of refusing requests from Ohio homeowners for information about their home loans  ignoring a Consumer Financial Protection Bureau mortgage servicing rule.,normal
WHR,Whirlpool Corporation,20161128,BRIEF-Whirlpool announces 3-year agreement with Century Communities ,* Whirlpool Corporation announces 3-year agreement with Century Communities  Source text for Eikon:  Further company coverage:,topStory
YGE,Yingli Green Energy Holding Company Limited,20161128,BRIEF-Yingli Green Energy announces Q3 preliminary financial results ,* Yingli Green Energy announces preliminary financial results for third quarter 2016,topStory
ZTO,ZTO Express (Cayman) Inc,20161128,BRIEF-ZTO reports third quarter 2016 unaudited financial results ,* ZTO Express (Cayman) Inc- Adjusted net income for Q4 of 2016 is expected to be in range of RMB720 million (US$108.0 million) to RMB750 million (US$112.5 million)  Source text for Eikon:  Further company coverage:,topStory
AUG,Auryn Resources Inc,20161128,BRIEF-Auryn identifies 17 high priority gold in Till Anomalies across Committee Bay Belt ,* Auryn identifies 17 high priority gold in Till Anomalies across the Committee Bay Belt  Source text for Eikon:  Further company coverage:,topStory
BPMX,BioPharmX Corporation,20161128,BRIEF-Biopharmx Corp announces closing of $12.5 mln unit offering ,* Biopharmx corporation announces closing of a $12.5 million unit offering  Source text for Eikon:  Further company coverage:,topStory
GORO,Gold Resource Corporation,20161128,BRIEF-Gold Resource Corp declares year-end special dividend of one cent ,* Gold resource corporation declares year-end special dividend,topStory
GTE,Gran Tierra Energy Inc,20161128,BRIEF-Gran Tierra Energy announces two acquisitions in the Putumayo Basin ,* Gran Tierra Energy announces two successful strategic acquisitions in the Ecopetrol 2016 bidding round in the Putumayo Basin,topStory
LOV,Spark Networks Inc,20161128,BRIEF-Spark Networks director McConnell sells 20 856 shares of co's common stock on Nov 25 ,* Spark Networks Inc director Michael McConnell reports sale of 20 856 shares of co's common stock on Nov 25 at average price of $1.08 per share - sec filing  Source text: (http://bit.ly/2fWlY3W) Further company coverage:,topStory
