ALL,Allstate Corporation (The),20161128,Insurer Allstate to buy SquareTrade for $1.4 bln ,Nov 28 Property and casualty insurer Allstate Corp said on Monday it would buy SquareTrade Holding Co Inc for about $1.4 billion in cash from a group of shareholders that include Bain Capital.,normal
AMOV,America Movil SAB de CV,20161128,America Movil agrees to buy 60 MHz of spectrum from Grupo MVS ,MEXICO CITY  Nov 28 Billionaire Carlos Slim's America Movil said on Monday that its wireless subsidiary had agreed to buy 60 MHz of spectrum in the 2.5 GHz band from Mexico's Grupo MVS.,topStory
AMX,America Movil SAB de CV,20161128,America Movil agrees to buy 60 MHz of spectrum from Grupo MVS ,MEXICO CITY  Nov 28 Billionaire Carlos Slim's America Movil said on Monday that its wireless subsidiary had agreed to buy 60 MHz of spectrum in the 2.5 GHz band from Mexico's Grupo MVS.,topStory
AEP,American Electric Power Company Inc,20161128,BRIEF-American Electric Power unit AEP Ohio files proposal to extend current electric security plan ,* Unit AEP Ohio has filed proposal with public utilities commission of Ohio to extend current electric security plan to May 2024  Source text for Eikon:  Further company coverage:,topStory
BUD,Anheuser-Busch Inbev SA,20161128,Fitch: AB InBev Dividend Will Limit Post-Merger Deleveraging ,(The following statement was released by the rating agency) Link to Fitch Ratings' Report: Anheuser-Busch InBev: What Investors Want to Know https://www.fitchratings.com/site/re/890825 LONDON  November 28 (Fitch) Anheuser-Busch InBev's (ABI) commitment to  maintaining its large dividend will significantly limit the company's ability to  deleverage in the wake of its GBP79bn acquisition of SABMiller  Fitch Ratings  says.  ABI was downgraded three notches in 2016 as weaker market conditions and th,topStory
AIV,Apartment Investment and Management Company,20161128,BRIEF-Savanna provides update to AIMCo financing ,* Savanna Energy says Alberta Investment Management Corp (AIMCo) has advised it that AIMCo does not intend to consent to a change of control of Savanna,topStory
AGO,Assured Guaranty Ltd,20161128,BRIEF-New york Insurance regulator approves Assured Guaranty's plan to repurchase shares valued at $300 mln ,* New york insurance regulator approves assured guaranty municipal corp. Plan to repurchase shares valued at $300 million from assured guaranty municipal holdings inc.,topStory
T,AT&T Inc,20161128,AT&T unveils DirecTV Now streaming service ahead of Nov 30 launch ,NEW YORK  Nov 28 AT&T Inc  the largest U.S. TV provider  took the wraps off its new DirecTV Now streaming service on Monday  making a foray into the new and crowded online video service market and hoping to win subscribers who shun pay-television subscriptions.,topStory
T,AT&T Inc,20161128,BRIEF-AT&T begins offering 3 video streaming services ,* AT&T Inc says on Nov 30  AT&T begins offering 3 video streaming services - DIRECTV NOW  FreeVIEW and Fullscreen,normal
AXS,Axis Capital Holdings Limited,20161128,BRIEF-Axis Capital announces acquisition of aviabel ,* Axis Capital says Axis will continue to maintain company's locations in Brussels and Amsterdam  Source text for Eikon:  Further company coverage:,topStory
SAN,Banco Santander SA,20161128,Banco Santander fined 1 mln euros for failing to stop money laundering ,MADRID  Nov 28 Spain's Santander has been fined 1 million euros  ($1.1 million) for its "serious failure" to prevent money laundering through an account held by the property group Rumasa between 2007 and 2011  the Spanish Supreme Court said on Monday.,topStory
BK,Bank Of New York Mellon Corporation (The),20161128,BRIEF-BNY Mellon's Pershing launches BMO Gold Deposit Receipts solution for financial needs of high-net-worth investors ,* BNY Mellon's Pershing launches BMO Gold Deposit Receipts solution for clients servicing the high-net-worth and ultra high-net-worth market  Source text for Eikon:  Further company coverage:,topStory
BCS,Barclays PLC,20161128,Barclays nets less than expected from Asia wealth business sale ,LONDON  Nov 28 Barclays completed the sale of its Singapore and Hong Kong wealth management businesses for a less-than-expected $225 million  as not all of the bank's customers chose to transfer their business across to the buyer  Oversea-Chinese Banking Corp.,topStory
BCS,Barclays PLC,20161128,BRIEF-Barclays completes sale of Singapore and Hong Kong wealth units for $225 mln ,* Barclays plc announces that it has completed sale of its wealth and investment management (WIM) business in Singapore and Hong Kong to Bank of Singapore limited,normal
BBL,BHP Billiton plc,20161128,CORRECTED-Mexico certifies bidders for December deep water oil auctions ,MEXICO CITY  Nov 28 Mexico's oil regulator announced on Monday a final list of 17 oil companies representing a dozen countries that have pre-qualified to bid on the country's first-ever deep water oil auctions  set for Dec. 5.,normal
BBL,BHP Billiton plc,20161128,Rio Tinto disposes of iron ore elephant  signals flexibility: Russell ,LAUNCESTON  Australia Almost unnoticed  Rio Tinto Chief Executive Jean Sebastien Jacques has ushered the China iron ore elephant out of the room.,normal
BBL,BHP Billiton plc,20161128,RPT-COLUMN-Rio Tinto disposes of iron ore elephant  signals flexibility: Russell ,LAUNCESTON  Australia  Nov 28 Almost unnoticed  Rio Tinto Chief Executive Jean Sebastien Jacques has ushered the China iron ore elephant out of the room.,normal
BBL,BHP Billiton plc,20161128,Australia watchdog says North West Shelf gas venture underpaying royalties ,MELBOURNE The North West Shelf joint venture  Australia's biggest oil and gas operation  cut royalties it owed by claiming more than A$5 billion ($3.7 billion) in deductions  some of which weren't valid  over the 18 months to December 2015  a government watchdog said on Monday.,normal
BBL,BHP Billiton plc,20161128,UPDATE 1-Australia watchdog says North West Shelf gas venture underpaying royalties ,* NW Shelf says royalty compliance is "robust"   (Adds maximum underpayment  NW Shelf comments),normal
BBL,BHP Billiton plc,20161128,CORRECTED-Australian watchdog says North West Shelf gas jv underpaying royalties ,MELBOURNE  Nov 28 The North West Shelf joint venture  Australia's biggest oil and gas operation  cut royalties it owed by claiming more than A$5 billion ($3.7 billion) in deductions  some of which weren't valid  over the 18 months to December 2015  a government watchdog said on Monday.,normal
BBL,BHP Billiton plc,20161128,COLUMN-Rio Tinto disposes of iron ore elephant  signals flexibility: Russell ,LAUNCESTON  Australia  Nov 28 Almost unnoticed  Rio Tinto Chief Executive Jean Sebastien Jacques has ushered the China iron ore elephant out of the room.,normal
BLK,BlackRock Inc,20161128,BlackRock's Rieder adds exposure to European banks ahead of Italy vote ,NEW YORK A top bond investor for BlackRock Inc  the world's largest asset manager  is bargain-hunting in Europe as investors fret over a coming vote that may shake Italy's government.,topStory
BLK,BlackRock Inc,20161128,BlackRock's Rieder adds exposure to European banks ahead of Italy vote ,NEW YORK  Nov 28 A top bond investor for BlackRock Inc  the world's largest asset manager  is bargain-hunting in Europe as investors fret over a coming vote that may shake Italy's government.,normal
BA,Boeing Company (The),20161128,Boeing confident WTO subsidy ruling will be reversed ,GENEVA/NEW YORK Boeing Co  expressed confidence on Monday that a World Trade Organization ruling against a Washington state tax break for its 777X jetliner would be overturned on appeal  claiming to have the upper hand in the latest round of a long trade dispute placing it at odds with European rival Airbus .,topStory
BA,Boeing Company (The),20161128,WTO rules against tax break for Boeing 777X jet ,The World Trade Organization (WTO) ruled on Monday a tax break from Washington state to help Boeing  develop its new 777X jetliner was a prohibited subsidy  in a setback for the U.S. planemaker as it eyes victory in a parallel case against Airbus.,normal
BA,Boeing Company (The),20161128,UPDATE 1-Boeing confident WTO subsidy ruling will be reversed ,GENEVA/NEW YORK  Nov 28 Boeing Co  expressed confidence on Monday that a World Trade Organization ruling against a Washington state tax break for its 777X jetliner would be overturned on appeal  claiming to have the upper hand in the latest round of a long trade dispute placing it at odds with European rival Airbus.,normal
BA,Boeing Company (The),20161128,UPDATE 2-WTO rules against tax break for Boeing 777X jet ,* Boeing confident ruling will be reversed on appeal   (Adds background  details  shares),normal
BA,Boeing Company (The),20161128,BRIEF-Boeing Co issues statement on WTO ruling on Washington state tax incentives ,* Boeing Co issues statement on WTO ruling on Washington state tax incentives,normal
BA,Boeing Company (The),20161128,Airbus calls for global pact on aircraft aid after WTO ruling ,GENEVA/BRUSSELS Airbus  called on Monday for a global agreement to set rules for the aerospace industry after the World Trade Organization partially ruled in Europe's favor in the latest round of a marathon subsidy dispute with Boeing .,normal
BA,Boeing Company (The),20161128,Boeing confident WTO subsidy ruling will be reversed ,GENEVA  Nov 28 Boeing Co claimed the upper hand on Monday after the World Trade Organization rejected all but one complaints by the European Union against tax breaks for its 777X jetliner  and predicted the WTO's ruling that the remaining measure was a "prohibited subsidy" would be reversed on appeal.,normal
BA,Boeing Company (The),20161128,WTO rules against tax break for Boeing 777X jet ,GENEVA  Nov 28 The World Trade Organization (WTO) ruled on Monday that a tax break from Washington state to help U.S. planemaker Boeing develop its new 777X jetliner was a prohibited subsidy.,normal
BP,BP plc,20161128,UPDATE 1-Eni aiming to cut stake in Egypt's Zohr offshore gas find to 50 pct ,MILAN  Nov 28 Italian oil and gas company Eni  is in talks with various parties to cut its stake in the giant Zohr gas field offshore Egypt to 50 percent  Chief Executive Claudio Descalzi said on Monday.,normal
BP,BP plc,20161128,CORRECTED-Mexico certifies bidders for December deep water oil auctions ,MEXICO CITY  Nov 28 Mexico's oil regulator announced on Monday a final list of 17 oil companies representing a dozen countries that have pre-qualified to bid on the country's first-ever deep water oil auctions  set for Dec. 5.,normal
BP,BP plc,20161128,Australia watchdog says North West Shelf gas venture underpaying royalties ,MELBOURNE The North West Shelf joint venture  Australia's biggest oil and gas operation  cut royalties it owed by claiming more than A$5 billion ($3.7 billion) in deductions  some of which weren't valid  over the 18 months to December 2015  a government watchdog said on Monday.,normal
BP,BP plc,20161128,UPDATE 1-Australia watchdog says North West Shelf gas venture underpaying royalties ,* NW Shelf says royalty compliance is "robust"   (Adds maximum underpayment  NW Shelf comments),normal
BP,BP plc,20161128,CORRECTED-Australian watchdog says North West Shelf gas jv underpaying royalties ,MELBOURNE  Nov 28 The North West Shelf joint venture  Australia's biggest oil and gas operation  cut royalties it owed by claiming more than A$5 billion ($3.7 billion) in deductions  some of which weren't valid  over the 18 months to December 2015  a government watchdog said on Monday.,normal
BT,BT Group plc,20161128,BT Group names McTighe as chairman of Openreach ,Nov 28 BT Group Plc said Mike McTighe  former board member of Ofcom  has been appointed the first chairman of Openreach  BT's fixed network business.,topStory
CTLT,Catalent Inc,20161128,BRIEF-Catalent launches private offering of $400 mln of Euro-denominated senior unsecured notes due 2024 ,* Catalent announces launch of private offering of $400 million (U.S. Dollar equivalent) of Euro-denominated senior unsecured notes due 2024,topStory
CTLT,Catalent Inc,20161128,BRIEF-Catalent acquires Accucaps to expand softgel development and manufacturing capabilities and capacity ,* Catalent acquires Accucaps to expand softgel development and manufacturing capabilities and capacity,normal
CBS,CBS Corporation,20161128,Viacom CEO looks to improve culture  affiliate relations  amid CBS talk ,The top priorities of Viacom Inc's  acting president and chief executive are improving key relations with affiliates as well as the struggling media company's internal culture  Bob Bakish told Reuters at the end of his first week on the job.,topStory
CBS,CBS Corporation,20161128,Viacom CEO looks to improve culture  affiliate relations  amid CBS talk ,Nov 28 The top priorities of Viacom Inc's  acting president and chief executive are improving key relations with affiliates as well as the struggling media company's internal culture  Bob Bakish told Reuters at the end of his first week on the job.,normal
CX,Cemex SAB de CV,20161128,BRIEF-CEMEX says a U.S. unit will divest reinforced concrete business to Quikrete ,* Cemex and Quikrete agree on terms and conditions for sale of u.s. Reinforced concrete pipe manufacturing business,topStory
CX,Cemex SAB de CV,20161128,Cuba-focused closed-end fund rallies in wake of Castro's death ,NEW YORK The only Cuba-focused stock fund in the United States rallied more than 13 percent Monday  a sign investors expect Fidel Castro's death to continue to open up relations between the United States and the island country despite President-elect Donald Trump's threat to end the normalization process that began under President Obama in 2014.,normal
CX,Cemex SAB de CV,20161128,Cuba-focused closed-end fund rallies in wake of Castro's death ,NEW YORK  Nov 28 The only Cuba-focused stock fund in the United States rallied more than 13 percent Monday  a sign investors expect Fidel Castro's death to continue to open up relations between the United States and the island country despite President-elect Donald Trump's threat to end the normalization process that began under President Obama in 2014.,normal
CI,Cigna Corporation,20161128,BRIEF-Cigna expects to reaffirm FY16 consolidated adjusted income from operations ,* Expect to reaffirm projected full year 2016 consolidated adjusted income from operations  which remains in range of $2.025 billion to $2.095 billion  Source text: (http://bit.ly/2gyyGWo) Further company coverage:,topStory
C,Citigroup Inc,20161128,Citigroup 'boys' club' disfavors women  lawsuit claims ,NEW YORK  Nov 28 A former Citigroup Inc  financial adviser on Monday filed a lawsuit accusing the bank of running a "boys' club" that favored men over women  treating her as a "glorified secretary " and firing her in retaliation for whistleblowing activity.,topStory
CBD,Companhia Brasileira de Distribuicao,20161128,GPA says sale of Via Varejo stake is only option on table ,SAO PAULO Brazilian retailer GPA SA  insisted on Monday that a sale of its controlling stake in Via Varejo SA  is its only strategic option  disputing comments by a Via Varejo executive who said other alternatives are available.,topStory
CBD,Companhia Brasileira de Distribuicao,20161128,UPDATE 1-GPA says sale of Via Varejo stake is only option on table ,SAO PAULO  Nov 28 Brazilian retailer GPA SA  insisted on Monday that a sale of its controlling stake in Via Varejo SA is its only strategic option  disputing comments by a Via Varejo executive who said other alternatives are available.,normal
CBD,Companhia Brasileira de Distribuicao,20161128,Via Varejo says GPA has alternatives if stake sale falls through ,SAO PAULO  Nov 28 Brazilian retailer Grupo Pão de Açúcar SA sees a sale of its controlling stake in Via Varejo SA as its best strategic option  but would consider alternatives if a deal falls through  Via Varejo's head of investor relations Alexandre Gonçalves said on Monday.,normal
COTV,Cotiviti Holdings Inc,20161128,BRIEF-Cotiviti Holdings announces secondary public offering ,* Certain stockholders intend to offer 10 million shares of co's common stock  par value $0.001 per share in underwritten public offering  Source text for Eikon:  Further company coverage:,topStory
DKS,Dick&#39;s Sporting Goods Inc,20161128,BRIEF-DICK'S Sporting Goods expands team sports HQ suite of digital offerings with the acquisition of GameChanger Media ,* DICK'S Sporting Goods expands team sports HQ suite of digital offerings with the acquisition of GameChanger Media  Source text for Eikon:  Further company coverage:,topStory
DTE,DTE Energy Company,20161128,BRIEF-DTE Energy announces redemption of 2011 Series I 6.50 pct junior subordinated debentures ,* DTE Energy Company announces redemption of 2011 series I 6.50 pct junior subordinated debentures,topStory
DTE,DTE Energy Company,20161128,BRIEF-DTE Energy announces junior subordinated debentures offering ,* DTE Energy Company announces junior subordinated debentures offering,normal
DTJ,DTE Energy Company,20161128,BRIEF-DTE Energy announces redemption of 2011 Series I 6.50 pct junior subordinated debentures ,* DTE Energy Company announces redemption of 2011 series I 6.50 pct junior subordinated debentures,topStory
DTJ,DTE Energy Company,20161128,BRIEF-DTE Energy announces junior subordinated debentures offering ,* DTE Energy Company announces junior subordinated debentures offering,normal
DTQ,DTE Energy Company,20161128,BRIEF-DTE Energy announces redemption of 2011 Series I 6.50 pct junior subordinated debentures ,* DTE Energy Company announces redemption of 2011 series I 6.50 pct junior subordinated debentures,topStory
DTQ,DTE Energy Company,20161128,BRIEF-DTE Energy announces junior subordinated debentures offering ,* DTE Energy Company announces junior subordinated debentures offering,normal
DTV,DTE Energy Company,20161128,BRIEF-DTE Energy announces redemption of 2011 Series I 6.50 pct junior subordinated debentures ,* DTE Energy Company announces redemption of 2011 series I 6.50 pct junior subordinated debentures,topStory
DTV,DTE Energy Company,20161128,BRIEF-DTE Energy announces junior subordinated debentures offering ,* DTE Energy Company announces junior subordinated debentures offering,normal
DTY,DTE Energy Company,20161128,BRIEF-DTE Energy announces redemption of 2011 Series I 6.50 pct junior subordinated debentures ,* DTE Energy Company announces redemption of 2011 series I 6.50 pct junior subordinated debentures,topStory
DTY,DTE Energy Company,20161128,BRIEF-DTE Energy announces junior subordinated debentures offering ,* DTE Energy Company announces junior subordinated debentures offering,normal
KODK,Eastman Kodak Company,20161128,Nanoco Group buys quantum dot patents from Eastman Kodak ,Nov 28 Nanoco Group Plc  a technology company spun out of the University of Manchester  said it bought a group of quantum dot patents from Eastman Kodak Co  for an undisclosed sum.,topStory
KODK,Eastman Kodak Company,20161128,BRIEF-Nanoco says buys quantum dot patents from Eastman Kodak ,* Commercial terms of patent acquisition are undisclosed  Source text for Eikon:  Further company coverage:    (Bengaluru Newsroom: +91 806 749 1136),normal
EC,Ecopetrol SA,20161128,BRIEF-Gran Tierra Energy announces two acquisitions in the Putumayo Basin ,* Gran Tierra Energy announces two successful strategic acquisitions in the Ecopetrol 2016 bidding round in the Putumayo Basin,topStory
EW,Edwards Lifesciences Corporation,20161128,Edwards Lifesciences to buy Israel's Valtech for up to $690 million ,JERUSALEM Edwards Lifesciences Corp  on Monday said it has agreed to buy Israel's Valtech Cardio for $340 million in stock and cash  with the potential for an additional $350 million in pre-specified milestone-driven payments over the next 10 years.,topStory
EW,Edwards Lifesciences Corporation,20161128,UPDATE 1-Edwards Lifesciences to buy Israel's Valtech for up to $690 mln ,JERUSALEM  Nov 28 Edwards Lifesciences Corp  on Monday said it has agreed to buy Israel's Valtech Cardio for $340 million in stock and cash  with the potential for an additional $350 million in pre-specified milestone-driven payments over the next 10 years.,normal
EW,Edwards Lifesciences Corporation,20161128,Edwards Lifesciences to buy Israel's Valtech for up to $690 mln ,JERUSALEM  Nov 28 Edwards Lifesciences Corp  on Monday said it has agreed to buy Israel's Valtech Cardio for $340 million in stock and cash  with the potential for an additional $350 million in pre-specified milestone-driven payments over the next 10 years.,normal
EW,Edwards Lifesciences Corporation,20161128,BRIEF-Edwards enters into agreement to acquire Valtech Cardio ,* Purchase price of Valtech is $340 million in stock and cash at closing ,normal
ERJ,Embraer-Empresa Brasileira de Aeronautica,20161128,UPDATE 1-Embraer says most Brazil unions agree to 5 pct raise next year ,SAO PAULO  Nov 28 Embraer SA said on Monday that unions for workers at most Brazil-based operations approved collective bargaining agreements providing for an average 5 percent pay raise next year  with the exception of one metalworkers union at the aircraft maker's largest factory.,topStory
ERJ,Embraer-Empresa Brasileira de Aeronautica,20161128,Embraer says most Brazil unions agree to 5 pct raise in 2017 ,SAO PAULO  Nov 28 Brazilian planemaker Embraer SA on Monday said unions at most of its operations in Brazil had signed collective bargaining agreements  however a metalworkers union at its biggest factory had held off on formalizing the deal.,normal
E,ENI SpA,20161128,Deals of the day-Mergers and acquisitions ,Nov 28 The following bids  mergers  acquisitions and disposals were reported by 2100 GMT on Monday:,topStory
E,ENI SpA,20161128,UPDATE 1-Eni aiming to cut stake in Egypt's Zohr offshore gas find to 50 pct ,MILAN  Nov 28 Italian oil and gas company Eni  is in talks with various parties to cut its stake in the giant Zohr gas field offshore Egypt to 50 percent  Chief Executive Claudio Descalzi said on Monday.,normal
E,ENI SpA,20161128,UPDATE 2-EDF's Edison says could buy Eni's Italian energy retail business ,* Wants to become number one wind operator in Italy   (Adds CEO's comments about opportunities in Italian market),normal
E,ENI SpA,20161128,EDF unit seeks to triple retail base in Italy  eyes ENI portfolio ,PARIS  Nov 28 Italian energy group Edison   a unit of French utility EDF  wants to triple its Italian customer base and would be ready to buy Italian energy group Eni's retail base  said Edison chief executive Marc Benayoun.,normal
EVHC,Envision Healthcare Corporation,20161128,BRIEF-Envision Healthcare and Amsurg shareholders approve merger ,* Envision - holders of over 82% of shares of co's common stock outstanding and entitled to vote  or over 96% of votes cast  voted to approve merger,topStory
SFUN,Fang Holdings Limited,20161128,BRIEF-Fang announces third quarter 2016 results ,* Q3 revenue $250.1 million versus i/b/e/s view $293.3 million,topStory
BEN,Franklin Resources Inc,20161128,Franklin Templeton cautious on Chinese banks and real estate ,LONDON  Nov 28 Bad loans in China's banking system and a risk of overleverage and regulation in Chinese real estate are reasons to remain cautious on these segments in 2017  asset manager Franklin Templeton said on Monday.,topStory
GNRT,Gener8 Maritime Inc,20161128,BRIEF-Gener8 Maritime announces delivery of the Gener8 Theseus ,* Gener8 Maritime  Inc. announces delivery of the Gener8 Theseus  Source text for Eikon:  Further company coverage:,topStory
GNRC,Generac Holdlings Inc,20161128,BRIEF-Generac to acquire Motortech ,* Generac Holdings Inc - transaction  subject to regulatory approval  is expected to close in q1 of 2017,topStory
GM,General Motors Company,20161128,U.S. letter reveals details of GM self-driving vehicle system ,WASHINGTON General Motors Co's semi-autonomous "Super Cruise" system will allow drivers to take their hands off the steering wheel for extended periods  but will stop the vehicle automatically if drivers are not attentive  according to a government letter made public on Monday.,topStory
GM,General Motors Company,20161128,U.S. letter reveals details of GM self-driving vehicle system ,WASHINGTON  Nov 28 General Motors Co's  semi-autonomous "Super Cruise" system will allow drivers to take their hands off the steering wheel for extended periods  but will stop the vehicle automatically if drivers are not attentive  according to a government letter made public on Monday.,normal
HAL,Halliburton Company,20161128,Trump adds antitrust expert to Justice transition team ,WASHINGTON  Nov 28 A Republican antitrust veteran has been named on Monday to U.S. President-elect Donald Trump's transition team for the Justice Department  a choice that lawyers say signals a more hands-off approach to antitrust enforcement compared to Democratic President Barack Obama.,normal
HSC,Harsco Corporation,20161128,BRIEF-Harsco lands contract expansion for steel mill services projected revenues of $50 million ,* Harsco lands contract expansion for steel mill services; projected revenues of $50 million,topStory
HF,HFF Inc,20161128,BRIEF-HFF Inc arranged $156 million in construction financing for phase II of Ritz-Carlton residences ,* Arranged $156 million in construction financing for phase II of Ritz-Carlton residences  Long Island  North Hills  Source text for Eikon:  Further company coverage:,topStory
ICE,Intercontinental Exchange Inc,20161128,BRIEF-Intercontinental Exchange appoints Lee Yi Shyan chairman of ICE Futures Singapore ,* Intercontinental exchange announces appointment of lee yi shyan as chairman of ICE Futures Singapore and ICE Clear Singapore,topStory
IVC,Invacare Corporation,20161128,BRIEF-Invacare Corp appoints Susan Alexander to its Board ,* Invacare Corporation appoints Susan Alexander to board of directors  Source text for Eikon:  Further company coverage:,topStory
