SBUX,Starbucks Corporation,20170130,Starbucks CEO Schultz plans to hire 10 000 refugees after Trump ban ,NEW YORK Starbucks Corp Chief Executive Officer Howard Schultz said on Sunday that the company planned to hire 10 000 refugees over five years in 75 countries  two days after U.S. President Donald Trump's executive order banning refugees from certain countries. | Video ,topStory
SBUX,Starbucks Corporation,20170130,BRIEF-Starbucks launches voice ordering in mobile app  Amazon Alexa platform ,* Starbucks - launching voice ordering capabilities within the Starbucks mobile iOS app and the popular Amazon Alexa platform  Source text : http://bit.ly/2kj21JI,normal
SBUX,Starbucks Corporation,20170130,Starbucks CEO Schultz plans to hire 10 000 refugees after Trump ban ,NEW YORK  Jan 29 Starbucks Corp Chief Executive Officer Howard Schultz said on Sunday that the company planned to hire 10 000 refugees over five years in 75 countries  two days after U.S. President Donald Trump's executive order banning refugees from certain countries.,normal
STLR,Stellar Acquisition III Inc,20170130,BRIEF-Hudson Bay Capital Management  L.P. reports 6.94 percent passive stake in Stellar Acquisition III Inc as of Dec 31  2016 ,Jan 30 Source: Hudson Bay Capital Management  L.P.,topStory
STLRU,Stellar Acquisition III Inc,20170130,BRIEF-Hudson Bay Capital Management  L.P. reports 6.94 percent passive stake in Stellar Acquisition III Inc as of Dec 31  2016 ,Jan 30 Source: Hudson Bay Capital Management  L.P.,topStory
SMMF,Summit Financial Group Inc,20170130,BRIEF-Summit Financial Group Q4 EPS $0.44 ,* Summit Financial Group reports fourth quarter and full year 2016 results,topStory
SUPN,Supernus Pharmaceuticals Inc,20170130,BRIEF-Supernus wins seventh patent for epilepsy drug Trokendi ,* Supernus announces issuance of seventh u.s. Patent  protecting Trokendi XR  Source text for Eikon:  Further company coverage:,topStory
TLF,Tandy Leather Factory Inc,20170130,BRIEF-Tandy Leather Factory reopens store in Harrisburg  PA ,* Tandy leather factory announces reopening of store in harrisburg  pa  Source text for Eikon:  Further company coverage:,topStory
TESS,TESSCO Technologies Incorporated,20170130,BRIEF-Tessco reports Q3 2017 financial results ,* Tessco Technologies Inc - Not providing earnings guidance at this time for fiscal 2017 due to uncertainty that persists,topStory
CG,The Carlyle Group LP,20170130,MOVES-Former KKR capital markets head Farr joins Carlyle ,NEW YORK  Jan 30 (IFR) - Carlyle Group has hired Craig Farr  KKR's former global head of capital markets  as a senior advisor for its credit business  the private equity giant said on Monday.,topStory
TCGP,The Carlyle Group LP,20170130,MOVES-Former KKR capital markets head Farr joins Carlyle ,NEW YORK  Jan 30 (IFR) - Carlyle Group has hired Craig Farr  KKR's former global head of capital markets  as a senior advisor for its credit business  the private equity giant said on Monday.,topStory
XONE,The ExOne Company,20170130,BRIEF-ExOne plans to consolidate or exit certain North American operations ,* On Jan 30.  co announced plan to consolidate or exit certain of its North American operations - SEC filing  Source: (http://bit.ly/2juuoAw) Further company coverage:,topStory
TRNS,Transcat Inc,20170130,BRIEF-Transcat Inc reports Q3 earnings per share $0.18 ,* Transcat achieves 40% operating income growth on record revenue for fiscal 2017 third quarter,topStory
TGA,Transglobe Energy Corp,20170130,BRIEF-TransGlobe Energy Corp announces an operations update ,* In Canada  production has averaged approximately 2 804 boepd in January,topStory
QURE,uniQure NV,20170130,BRIEF-uniQure announces FDA breakthrough therapy designation for AMT-060 in hemophilia B ,* uniQure announces FDA breakthrough therapy designation for AMT-060 in hemophilia B  Source text for Eikon:  Further company coverage:,topStory
USLM,United States Lime & Minerals Inc,20170130,BRIEF-United States Lime & Minerals reports Q4 EPS $0.70 ,* Reports fourth quarter and full-year 2016 results and declares increased regular quarterly cash dividend,topStory
USAK,USA Truck Inc,20170130,BRIEF-USA Truck appoints James Reed as president and CEO ,* USA Truck appoints James D. Reed as president and chief executive officer,topStory
VRAY,ViewRay Inc,20170130,BRIEF-Viewray files for mixed shelf of up to $75.0 Mln ,* Files for mixed shelf of up to $75.0 million - sec filing  Source text : http://bit.ly/2jMGg4d Further company coverage:,topStory
VOD,Vodafone Group Plc,20170130,As price war rages  Vodafone India seeks merger with rival Idea Cellular ,LONDON/MUMBAI Britain's Vodafone Group  confirmed on Monday it was in talks to merge its Indian subsidiary with local rival Idea Cellular  in an all-share deal that would create a new market leader better able to contest a brutal new price war.,topStory
VOD,Vodafone Group Plc,20170130,UPDATE 3-As price war rages  Vodafone India seeks merger with rival Idea Cellular ,* Deal would reduce intense competition in India - analysts   (Updates with analyst quote  share prices details  background),normal
VOD,Vodafone Group Plc,20170130,Deals of the day-Mergers and acquisitions ,Jan 30 The following bids  mergers  acquisitions and disposals were reported by 1115 GMT on Monday:,normal
VOD,Vodafone Group Plc,20170130,BRIEF-Idea Cellular says co has been in preliminary discussions with Vodafone ,* Idea Cellular Ltd clarifies on news item "merger may be the best idea for Vodafone  sir ji!" ,normal
VOD,Vodafone Group Plc,20170130,Vodafone says in Indian merger talks with Idea Cellular ,LONDON  Jan 30 Vodafone said on Monday it was in talks to merge its Indian operations with rival Idea Cellular in an all-share deal that could help the groups counter the fierce competition in the market.,normal
WBA,Walgreens Boots Alliance Inc,20170130,Walgreens delays Rite Aid deal again  cuts offer price ,Drugstore chain Walgreens Boots Alliance Inc  said its deal to buy smaller rival Rite Aid Corp  would now take six months longer to close and also reduced its offer price as it expects to divest more stores to gain regulatory approval.,topStory
WBA,Walgreens Boots Alliance Inc,20170130,UPDATE 4-Walgreens delays Rite Aid deal again  cuts offer price ,Jan 30 Drugstore chain Walgreens Boots Alliance Inc said its deal to buy smaller rival Rite Aid Corp  would now take six months longer to close and also reduced its offer price as it expects to divest more stores to gain regulatory approval.,normal
WBA,Walgreens Boots Alliance Inc,20170130,Walgreens pushes Rite Aid deal close by 6 months  reduces offer price ,Jan 30 Walgreens Boots Alliance Inc said its deal to buy smaller rival Rite Aid Corp will now close six months later than expected and could include the divestiture of up to 1 200 stores to gain regulatory approval.,normal
WBA,Walgreens Boots Alliance Inc,20170130,BRIEF-Walgreens Boots Alliance and Rite Aid enter into amendment and extension to merger agreement ,* Walgreens Boots Alliance and Rite Aid enter into amendment and extension to merger agreement,normal
WERN,Werner Enterprises Inc,20170130,BRIEF-Werner Enterprises Q4 earnings per share $0.30 ,* Werner Enterprises reports fourth quarter and annual 2016 revenues and earnings,topStory
WHLR,Wheeler Real Estate Investment Trust Inc,20170130,BRIEF-Wheeler REIT says unaudited Q4 2016 pro forma AFFO per share run rate of $0.21 on an annualized basis ,Jan 30 Wheeler Real Estate Investment Trust Inc  :,topStory
WHLRD,Wheeler Real Estate Investment Trust Inc,20170130,BRIEF-Wheeler REIT says unaudited Q4 2016 pro forma AFFO per share run rate of $0.21 on an annualized basis ,Jan 30 Wheeler Real Estate Investment Trust Inc  :,topStory
WHLRP,Wheeler Real Estate Investment Trust Inc,20170130,BRIEF-Wheeler REIT says unaudited Q4 2016 pro forma AFFO per share run rate of $0.21 on an annualized basis ,Jan 30 Wheeler Real Estate Investment Trust Inc  :,topStory
AMG,Affiliated Managers Group Inc,20170130,BRIEF-AMG reports Q4 earnings per share $2.67 ,* AMG reports financial and operating results for the fourth quarter and full year 2016,topStory
AMG,Affiliated Managers Group Inc,20170130,BRIEF-AMG announces initiation of cash dividend  increase in share repurchase authorization ,* AMG announces initiation of cash dividend and increase in share repurchase authorization,normal
ARE,Alexandria Real Estate Equities Inc,20170130,BRIEF-ALEXANDRIA REAL ESTATE EQUITIES INC QTRLY LOSS PER SHARE $0.31 ,* ALEXANDRIA REAL ESTATE EQUITIES  INC. REPORTS FOURTH QUARTER AND YEAR ENDED DECEMBER 31  2016 FINANCIAL AND OPERATING RESULTS,topStory
AMC,AMC Entertainment Holdings Inc,20170130,BRIEF-AMC Entertainment Holdings sees FY 2016 earnings per share $1.13 to $1.21 ,* Diluted earnings per share for 2016 are expected to be between $1.13 and $1.21,topStory
AMOV,America Movil SAB de CV,20170130,UPDATE 1-Persistent price pressure take toll on Slim's Telekom Austria ,VIENNA  Jan 30 Telekom Austria  a unit of Mexican tycoon Carlos Slim's America Movil  confirmed a fall in its full-year core profit  largely due to tough price competition which it expects to persist in 2017.,topStory
AMX,America Movil SAB de CV,20170130,UPDATE 1-Persistent price pressure take toll on Slim's Telekom Austria ,VIENNA  Jan 30 Telekom Austria  a unit of Mexican tycoon Carlos Slim's America Movil  confirmed a fall in its full-year core profit  largely due to tough price competition which it expects to persist in 2017.,topStory
ANTM,Anthem Inc,20170130,Health insurer Anthem could rise 30 percent on earnings potential: Barron's ,NEW YORK Anthem Inc  shares could rise by 30 percent as the U.S. health insurer is undervalued and has the most room for improvement in profit margins and earnings among its peers  Barron's reported.,topStory
ANTX,Anthem Inc,20170130,Health insurer Anthem could rise 30 percent on earnings potential: Barron's ,NEW YORK Anthem Inc  shares could rise by 30 percent as the U.S. health insurer is undervalued and has the most room for improvement in profit margins and earnings among its peers  Barron's reported.,topStory
ADM,Archer-Daniels-Midland Company,20170130,ADM to sell crop insurance business to Validus Holdings ,CHICAGO U.S. agricultural commodities trader Archer Daniels Midland Co  has agreed to sell its Crop Risk Services (CRS) insurance business for $127.5 million to Validus Holdings Ltd   the companies announced on Monday.,topStory
ADM,Archer-Daniels-Midland Company,20170130,ADM to sell crop insurance business to Validus Holdings ,CHICAGO  Jan 30 U.S. agricultural commodities trader Archer Daniels Midland Co has agreed to sell its Crop Risk Services (CRS) insurance business for $127.5 million to Validus Holdings Ltd  the companies announced on Monday.,normal
ADM,Archer-Daniels-Midland Company,20170130,BRIEF-Validus Holdings says deal to acquire ADM's crop risk services business ,* Validus Holdings announces agreement with Archer Daniels Midland to acquire ADM crop risk services business,normal
ADM,Archer-Daniels-Midland Company,20170130,BRIEF-ADM says agreement for sale of Crop Risk Services business to Validus ,* Archer Daniels Midland Co - expects to record a book gain upon deal closing,normal
ARNC,Arconic Inc,20170130,Investors urge Arconic to oust CEO Klaus Kleinfeld: WSJ ,Some of Arconic Inc's biggest shareholders are pressing the company to remove Chief Executive Klaus Kleinfeld  the Wall Street Journal reported on Monday  citing people familiar with the matter.,topStory
ARNC,Arconic Inc,20170130,UPDATE 2-Investors urge Arconic to oust CEO Klaus Kleinfeld -WSJ ,Jan 30 Some of Arconic Inc's biggest shareholders are pressing the company to remove Chief Executive Klaus Kleinfeld  the Wall Street Journal reported on Monday  citing people familiar with the matter.,normal
ARNC,Arconic Inc,20170130,Arconic says CEO Kleinfeld 'has unanimous support' of its board ,Arconic Inc said on Monday that Chief Executive Officer Klaus Kleinfeld "has the unanimous support" of its board  responding to a report of pressure from some of the Alcoa Corp spinoff's biggest shareholders for a leadership change.,normal
ARNC,Arconic Inc,20170130,Arconic says CEO Kleinfeld 'has unanimous support' of its board ,Jan 30 Arconic Inc said on Monday that Chief Executive Officer Klaus Kleinfeld "has the unanimous support" of its board  responding to a report of pressure from some of the Alcoa Corp spinoff's biggest shareholders for a leadership change.,normal
ARNC,Arconic Inc,20170130,Several investors urge Arconic to oust CEO Klaus Kleinfeld - WSJ ,Jan 30 Arconic Inc's several biggest shareholders are pressing the company to remove Chief Executive Klaus Kleinfeld  the Wall Street Journal reported on Monday  citing people familiar with the matter.,normal
ARNC,Arconic Inc,20170130,BRIEF-Several of Arconic's largest investors are pressing co to oust CEO Kleinfeld after Alcoa separation - CNBC ,* Several of Arconic's largest investors are pressing co to oust CEO Klaus Kleinfeld after Alcoa separation - CNBC  citing DJ   Source text: http://bit.ly/2jLaLas,normal
AJG,Arthur J Gallagher & Co,20170130,BRIEF-Arthur J. Gallagher & Co acquires Eagle Insurance Agency Llc ,* Arthur J. Gallagher & Co acquires Eagle Insurance Agency  Llc,topStory
AHL,Aspen Insurance Holdings Limited,20170130,BRIEF-Aspen provides update on actions to improve returns  reduce volatility in its insurance segment ,* Aspen provides update on actions to improve returns and reduce volatility in its insurance segment,topStory
AZN,Astrazeneca PLC,20170130,BRIEF-FibroGen's Roxadustat (FG-4592) meets primary endpoints in two phase 3 anemia studies in China ,* FibroGen's Roxadustat (FG-4592) meets primary endpoints in two phase 3 anemia studies in China,topStory
T,AT&T Inc,20170130,BRIEF-AT&T  CWA reach tentative agreement covering former DIRECTV employees in seven states ,* AT&T  CWA reach tentative agreement covering former DIRECTV employees in seven states,topStory
BANC,Banc of California Inc,20170130,BRIEF-Banc of california reports Q4 EPS $0.54 ,* Consolidated assets totaled $11.0 billion at December 31  2016  a decrease of $186.6 million compared to prior quarter  Source text for Eikon:  Further company coverage:,topStory
BAC,Bank of America Corporation,20170130,Carrefour seeks Brazil unit IPO in second quarter  sources say ,SAO PAULO  Jan 30 France's Carrefour SA  aims to price the initial public offering of its fast-growing Brazilian unit as early as the second quarter  two people with direct knowledge of the plan said on Monday  a sign demand for new equity offerings in Latin America's No. 1 economy is gaining traction rapidly.,normal
BCE,BCE Inc,20170130,BRIEF-Dominion Diamond Corporation announces CEO transition ,* Bell has agreed to continue to serve in his role as CEO of company until June 30  2017,topStory
BHLB,Berkshire Hills Bancorp Inc,20170130,BRIEF-Berkshire Hills reports Q4 core earnings per share $0.56 ,* Berkshire Hills reports record annual earnings; dividend increased,topStory
BBG,Bill Barrett Corporation,20170130,BRIEF-Bill Barrett expects to realize Q4 cash commodity derivative gain of $17.2 mln ,* Bill Barrett Corporation provides fourth quarter 2016 commodity price and derivatives update,topStory
BLK,BlackRock Inc,20170130,BRIEF-Blackrock discloses 5.2 percent stake in Amec Foster ,* Blackrock Inc discloses 5.2 percent stake in Amec Foster Wheeler - filing  Source text for Eikon:  Further company coverage:    (Bengaluru Newsroom),topStory
BAH,Booz Allen Hamilton Holding Corporation,20170130,BRIEF-Booz Allen Hamilton reports Q3 earnings per share $0.37 ,* Booz Allen Hamilton announces third quarter fiscal 2017 results,topStory
BOX,Box Inc,20170130,UPDATE 1-Dropbox targets deep-pocketed businesses to increase revenue ,By Heather Somerville     SAN FRANCISCO  Jan 30 A decade after its founding as a file-sharing business  Dropbox Inc is trying to become a new kind of company.    On Monday  the highly valued digital storage firm unveiled two new products - file synch and content collaboration tools - as part of a years-long effort to build up its business offerings.     The effort appears to have bolstered the company's bottom line. Dropbox Chief Executive Officer Drew Houston said on Monday the comp,normal
BPI,Bridgepoint Education Inc,20170130,UPDATE 1-HgCapital to sell vehicle rental firm Zenith to Bridgepoint ,Jan 30 London-based private equity firm HgCapital Trust Plc has agreed to sell Zenith  a British vehicle leasing business  to peer Bridgepoint in a deal valued at 750 million pounds ($942.08 million)  its manager HgCapital said on Monday.,topStory
BPI,Bridgepoint Education Inc,20170130,HgCapital to sell auto leasing firm Zenith to Bridgepoint for 750 mln stg ,Jan 30 London-based private equity firm HgCapital Trust Plc has agreed to sell Zenith  a British vehicle leasing business  to peer Bridgepoint in a deal valued at 750 million pounds ($942.08 million)  its manager HgCapital said on Monday.,normal
BPI,Bridgepoint Education Inc,20170130,BRIEF-HgCapital announces sale of Zenith to Bridgepoint ,* Has agreed sale of Zenith  largest independent vehicle leasing business in UK  to Bridgepoint in a transaction totalling 750 million stg,normal
CBT,Cabot Corporation,20170130,BRIEF-Cabot CEO FY 2016 total compensation was $3.33 million ,* CEO Sean Keohane's FY 2016 total compensation was $3.33 million - SEC filing  Source text: (http://bit.ly/2kNijaB) Further company coverage:,topStory
CBL,CBL & Associates Properties Inc,20170130,BRIEF-Cbl & Associates Properties acquires five sears stores for future redevelopment through sale-leaseback ,* CBL & Associates Properties Inc acquires five sears stores for future redevelopment through sale-leaseback,topStory
CVX,Chevron Corporation,20170130,Bangladesh to bid for Chevron gas fields after assessing reserves ,DHAKA Bangladesh is hiring an international firm to assess reserves at Chevron Corp's natural gas fields in the country before  placing a formal bid to buy the assets  its energy minister told Reuters on Monday.,topStory
CVX,Chevron Corporation,20170130,Bangladesh to bid for Chevron gas fields after assessing reserves ,DHAKA  Jan 30 Bangladesh is hiring an international firm to assess reserves at Chevron Corp's  natural gas fields in the country before  placing a formal bid to buy the assets  its energy minister told Reuters on Monday.,normal
CVX,Chevron Corporation,20170130,Chevron says to give CEO fewer stock options ,Oil and natural gas producer Chevron Corp  said it would give its top executive fewer stock options after shareholders expressed concern about executive pay.,normal
CVX,Chevron Corporation,20170130,Chevron says to give CEO fewer stock options ,Jan 30 Oil and natural gas producer Chevron Corp  said it would give its top executive fewer stock options after shareholders expressed concern about executive pay.,normal
CVX,Chevron Corporation,20170130,BRIEF-Chevron Corp says to decrease percentage of compensation awarded as stock options to "reduce excessive volatility" ,* Chevron Corp says to decrease percentage of compensation awarded as stock options to "reduce excessive volatility" - SEC filing,normal
CVX,Chevron Corporation,20170130,BRIEF-Chevron says approved annual base salary of $1.9 million for CEO John Watson  no increase from prior year ,* Chevron says approved annual base salary of $1.9 million for CEO John Watson  no increase from prior year  Source text for Eikon: (http://bit.ly/2kJNrM3) Further company coverage:,normal
C,Citigroup Inc,20170130,Citigroup to exit U.S. mortgage servicing operations by 2018 ,Citigroup Inc  said on Monday it would speed up the transformation of its U.S. mortgage business by exiting servicing operations by the end of 2018.,topStory
C,Citigroup Inc,20170130,Jailed Libor trader Hayes launches fresh appeal against conviction ,LONDON  Jan 30 Tom Hayes  the first person worldwide to be jailed for conspiring to manipulate Libor interest rates  on Monday night launched a last-ditch appeal against his conviction and 11-year sentence in Britain  alleging his trial was unfair.,normal
C,Citigroup Inc,20170130,Resurgent Tesco surprises with $4.6 billion swoop for wholesaler Booker ,LONDON Britain's biggest retailer Tesco  agreed a surprise 3.7 billion pound ($4.6 billion) takeover of food supplier Booker  on Friday  increasing its exposure to the fast growing catering sector.,normal
C,Citigroup Inc,20170130,UPDATE 1-Citigroup to exit U.S. mortgage servicing operations by 2018 ,Jan 30 Citigroup Inc said on Monday it would speed up the transformation of its U.S. mortgage business by exiting servicing operations by the end of 2018.,normal
C,Citigroup Inc,20170130,BRIEF-CitiMortgage announces strategic exit of mortgage servicing operations by end of 2018 ,* CitiMortgage Inc announces strategic exit of mortgage servicing operations by end of 2018,normal
C,Citigroup Inc,20170130,Citigroup plans to exit U.S. mortgage servicing operations by 2018 ,Jan 30 Citigroup Inc said on Monday that it would speed up the transformation of its U.S. mortgage business by effectively exiting servicing operations by the end of 2018.,normal
CNXC,CNX Coal Resources LP,20170130,BRIEF-CNX Coal Resources LP re-affirms 2017 guidance ranges ,* CNX Coal Resources LP announces results for the fourth quarter 2016,topStory
CIE,Cobalt International Energy Inc,20170130,BRIEF-Carlson Capital reports 6.87 pct passive stake in Cobalt International Energy - SEC filing ,* Carlson Capital  L.P. reports 6.87 percent passive stake in Cobalt International Energy Inc as of Dec 31  2016 - SEC filing  Source text: (http://bit.ly/2kGukPX) Further company coverage:    (Bengaluru Newsroom: +91 806 749 1136),topStory
CL,Colgate-Palmolive Company,20170130,Negative effective of currency rates on company results fall in third quarter ,NEW YORK Currency market fluctuations in the third quarter of 2016 had the smallest negative impact on North American companies' financial results since 2014  FIREapps said in a report on Monday.,topStory
CNDT,Conduent Incorporated,20170130,BRIEF-Darwin A. Deason reports 6.08 pct passive stake in Conduent Inc - SEC filing ,* Darwin A. Deason reports 6.08 percent passive stake in Conduent Inc as of December 31  2016 - SEC filing  Source text: (http://bit.ly/2jvkBu0) Further company coverage:    (Bengaluru Newsroom: +91 806 749 1136),topStory
CR,Crane Company,20170130,BRIEF-CRANE CO REPORTS Q4 GAAP LOSS PER SHARE $1.09 ,* CRANE CO. REPORTS 2016 RESULTS  PROVIDES 2017 GUIDANCE  AND EXTENDS ASBESTOS LIABILITY ESTIMATE THROUGH 2059,topStory
CMI,Cummins Inc,20170130,BRIEF-Konica Minolta and Pioneer set to merge OLED lighting ops - Nikkei ,* Konica Minolta and Pioneer are concluding talks to merge their OLED lighting businesses under a 50-50 joint venture - Nikkei,topStory
DK,Delek US Holdings Inc,20170130,BRIEF-DELEK US AND DELEK LOGISTICS ANNOUNCE KEVIN KREMKE WILL JOIN THE COMPANIES AS EVP ON APRIL 1 ,* DELEK US AND DELEK LOGISTICS ANNOUNCE KEVIN KREMKE WILL JOIN THE COMPANIES AS EVP ON APRIL 1,topStory
DAL,Delta Air Lines Inc,20170130,BRIEF-Delta systems return to normal; some flight cancellations linger ,* "Approximately 80 flights scheduled for today have been canceled with additional cancellations possible",topStory
DAL,Delta Air Lines Inc,20170130,Delta resumes limited U.S. domestic operations after systems outage ,NEW YORK Delta Air Lines Inc said it had resumed limited operations after a systems outage grounded its domestic U.S. flights on Sunday evening.,normal
DAL,Delta Air Lines Inc,20170130,UPDATE 2-Delta resumes limited U.S. domestic operations after systems outage ,* Delta says canceled 150 flights to depart Sunday/early Monday   (Updates with website back up),normal
DAL,Delta Air Lines Inc,20170130,BRIEF-Delta says flights are departing and ground stop has been lifted ,* Delta flights are departing and ground stop has been lifted as the airline's IT systems begin to return to normal - website,normal
DAL,Delta Air Lines Inc,20170130,Delta grounds domestic U.S. flights after 'automation issue' -FAA ,NEW YORK  Jan 29 The Federal Aviation Administration on Sunday said all Delta Air Lines Inc's  domestic flights were grounded until 0100 GMT after a request from the company due to an "automation issue.",normal
DB,Deutsche Bank AG,20170130,Deutsche to pay $425 mln to N.Y. regulator over Russian 'mirror trades' ,NEW YORK/FRANKFURT  Jan 30 Deutsche Bank AG  has agreed to pay $425 million to New York's banking regulator over a "mirror trading" scheme that moved $10 billion out of Russia between 2011 and 2015  the regulator said on Monday.,topStory
DB,Deutsche Bank AG,20170130,EXCLUSIVE-Deutsche poised to settle over Russian "mirror trades" - sources ,* Deutsche Bank  DFS  FCA decline to comment   (Adds further details  background),normal
DB,Deutsche Bank AG,20170130,Deutsche Bank's future capital needs uncertain - Handelsblatt ,FRANKFURT  Jan 30 There is still some uncertainty over whether Deutsche Bank may need to increase its capital  management board member Christian Sewing was quoted as saying in German daily newspaper Handelsblatt.,normal
DHT,DHT Holdings Inc,20170130,BRIEF-DHT Holdings reports Q4 earnings per share $0.19 ,* Q4 earnings per share view $0.11 -- Thomson Reuters I/B/E/S,topStory
DHT,DHT Holdings Inc,20170130,Frontline must raise bid to overcome DHT poison pill  analysts say ,OSLO Crude oil tanker firm Frontline  which has made an unsolicited offer to buy competitor DHT Holdings  must raise its bid for the attempted takeover to succeed  analysts said on Monday.,normal
DHT,DHT Holdings Inc,20170130,Frontline must raise bid to overcome DHT poison pill  analysts say ,OSLO  Jan 30 Crude oil tanker firm Frontline   which has made an unsolicited offer to buy competitor DHT Holdings  must raise its bid for the attempted takeover to succeed  analysts said on Monday.,normal
