RZB,Reinsurance Group of America Incorporated,20170130,BRIEF-Reinsurance Group of America reports Q4 EPS $2.92 ,* Reinsurance Group of America reports fourth-quarter results,topStory
RAD,Rite Aid Corporation,20170130,Walgreens delays Rite Aid deal again  cuts offer price ,Drugstore chain Walgreens Boots Alliance Inc  said its deal to buy smaller rival Rite Aid Corp  would now take six months longer to close and also reduced its offer price as it expects to divest more stores to gain regulatory approval.,topStory
RAD,Rite Aid Corporation,20170130,UPDATE 4-Walgreens delays Rite Aid deal again  cuts offer price ,Jan 30 Drugstore chain Walgreens Boots Alliance Inc said its deal to buy smaller rival Rite Aid Corp  would now take six months longer to close and also reduced its offer price as it expects to divest more stores to gain regulatory approval.,normal
RAD,Rite Aid Corporation,20170130,BRIEF-Fred's Pharmacy comments on extension to merger agreement ,* Fred's Inc - Fred's Pharmacy affirms that asset purchase agreement it entered into on December 19  2016 with Walgreens and Rite Aid remains in effect,normal
RAD,Rite Aid Corporation,20170130,Walgreens pushes Rite Aid deal close by 6 months  reduces offer price ,Jan 30 Walgreens Boots Alliance Inc said its deal to buy smaller rival Rite Aid Corp will now close six months later than expected and could include the divestiture of up to 1 200 stores to gain regulatory approval.,normal
RAD,Rite Aid Corporation,20170130,BRIEF-Walgreens Boots Alliance and Rite Aid enter into amendment and extension to merger agreement ,* Walgreens Boots Alliance and Rite Aid enter into amendment and extension to merger agreement,normal
SNY,Sanofi,20170130,Sanofi  Novo Nordisk and Lilly named in patients' price fixing suit ,NEW YORK Three of the biggest makers of diabetes treatments  Sanofi SA  Novo Nordisk and Eli Lilly & Co  were named in a proposed class action lawsuit by a group of patients alleging price-fixing.,topStory
SNY,Sanofi,20170130,Sanofi  Novo Nordisk and Lilly named in patients' price fixing suit ,NEW YORK Three of the biggest makers of diabetes treatments  Sanofi SA  Novo Nordisk and Eli Lilly and Co  were named in a class action lawsuit about price fixing filed by a group of patients.,normal
SNY,Sanofi,20170130,UPDATE 2-Sanofi  Novo Nordisk and Lilly named in patients' price fixing suit ,NEW YORK  Jan 30 Three of the biggest makers of diabetes treatments  Sanofi SA  Novo Nordisk  and Eli Lilly & Co  were named in a proposed class action lawsuit by a group of patients alleging price-fixing.,normal
SNY,Sanofi,20170130,Sanofi  Novo Nordisk and Lilly named in patients' price fixing suit ,NEW YORK  Jan 30 Three of the biggest makers of diabetes treatments  Sanofi SA  Novo Nordisk  and Eli Lilly & Co  were named in a class action lawsuit about price fixing filed by a group of patients.,normal
SNE,Sony Corp Ord,20170130,Sony takes $976 mln charge on film segment in Oct-Dec ,TOKYO  Jan 30 Sony Corp said on Monday it booked an impairment charge of 112.1 billion yen ($976 million) on the goodwill value of its film segment in October-December.,topStory
SNE,Sony Corp Ord,20170130,BRIEF-Sony to cut stake in M3 Inc to 34 pct from 39.3 pct ,* Says the co plans to cut stake in M3 Inc to 34 percent from 39.3 percent,normal
STT,State Street Corporation,20170130,State Street hit with securities lawsuit over trading charges ,Boston-based State Street Corp has been hit with a securities fraud lawsuit accusing it of misleading shareholders by failing to disclose improper trading commissions that led to a $64.6 million government penalty earlier this month.,topStory
SYK,Stryker Corporation,20170130,Ex-Stryker salesman to challenge $745 000 verdict over non-compete agreement ,A former salesman for medical device maker Stryker Corp who was ordered to pay $745 000 after a jury found he violated a non-compete agreement will challenge the verdict in federal appeals court Wednesday  claiming that Stryker concealed evidence.,topStory
SMLP,Summit Midstream Partners LP,20170130,BRIEF-Summit Midstream Partners LP announces secondary public offering of common units by Summit Midstream Partners Holdings LLC ,* Summit Midstream Partners  LP announces secondary public offering of common units by Summit Midstream Partners Holdings  LLC,topStory
TMHC,Taylor Morrison Home Corporation,20170130,BRIEF-Taylor Morrison reports Q4 revenue of $1.2 bln and EPS of $0.63 ,* Taylor Morrison reports fourth quarter revenue of $1.2 billion and earnings per share of $0.63,topStory
TMHC,Taylor Morrison Home Corporation,20170130,BRIEF-Taylor Morrison Home announces public offering of Class A common stock ,* Taylor Morrison Home Corporation announces public offering of Class A common stock,normal
TECK,Teck Resources Ltd,20170130,BRIEF-Teck Resources Ltd & Fort Mckay Métis announced signing of participation agreement for Teck's proposed frontier oil sands project ,* Teck Resources Ltd - Fort Mckay Métis  co announced signing of participation agreement for Teck's proposed frontier oil sands project  Source text for Eikon:  Further company coverage:,topStory
TI,Telecom Italia SPA,20170130,REFILE-Italy - Factors to watch on Jan. 30 ,(Clarifies role of Telecom Italia in Mediaset item) The following factors could affect Italian markets on Monday.,topStory
TPX,Tempur Sealy International Inc,20170130,Tempur Sealy scraps contracts with biggest customer Mattress Firm ,Mattress maker Tempur Sealy International Inc  said on Monday it terminated its contracts with Mattress Firm Holdings  Corp  its biggest customer  after disagreements over proposed changes that required "significant economic concessions.",topStory
TPX,Tempur Sealy International Inc,20170130,UPDATE 3-Tempur Sealy scraps contracts with biggest customer Mattress Firm ,Jan 30 Mattress maker Tempur Sealy International Inc said on Monday it terminated its contracts with Mattress Firm Holdings  Corp  its biggest customer  after disagreements over proposed changes that required "significant economic concessions.",normal
TPX,Tempur Sealy International Inc,20170130,Tempur Sealy terminates contracts with Mattress Firm Holdings ,Jan 30 Mattress maker Tempur Sealy International Inc said it terminated its contracts with U.S. mattress retailer Mattress Firm Holdings Corp  after disagreements over changes in their contracts  which asked for "significant economic concessions.",normal
TPX,Tempur Sealy International Inc,20170130,BRIEF-Tempur Sealy announces termination of Mattress Firm contracts ,* Tempur Sealy announces termination of Mattress Firm contracts,normal
TEVA,Teva Pharmaceutical Industries Limited,20170130,As Teva wins U.S. approval for GSK Advair copy  main fight yet to come ,LONDON Israel's Teva Pharmaceutical Industries has won U.S. approval to market a copy of GlaxoSmithKline's best-selling Advair inhaler  although the real battle is still to come.,topStory
TEVA,Teva Pharmaceutical Industries Limited,20170130,As Teva wins US approval for GSK Advair copy  main fight yet to come ,LONDON  Jan 30 Israel's Teva Pharmaceutical Industries has won U.S. approval to market a copy of GlaxoSmithKline's best-selling Advair inhaler  although the real battle is still to come.,normal
TEVA,Teva Pharmaceutical Industries Limited,20170130,BRIEF-Teva announces FDA approval of two new RespiClick maintenance inhalers for the treatment of asthma ,* Teva announces FDA approval of two new RespiClick maintenance inhalers for the treatment of asthma  Source text for Eikon:  Further company coverage:,normal
AES,The AES Corporation,20170130,Chile regulator says to sanction AES Gener's Alto Maipo project ,SANTIAGO Chile's SMA environmental authority said on Monday that it had initiated a sanctioning process against AES Gener's Alto Maipo hydroelectric project  located near the capital city of Santiago.,topStory
AES,The AES Corporation,20170130,Chile regulator says to sanction AES Gener's Alto Maipo project ,SANTIAGO  Jan 30 Chile's SMA environmental authority said on Monday that it had initiated a sanctioning process against AES Gener's Alto Maipo hydroelectric project  located near the capital city of Santiago.,normal
TM,Toyota Motor Corp Ltd Ord,20170130,Toyota relinquishes top global sales spot to VW in 2016 ,TOKYO Toyota Motor Corp's  four-year run as the world's top-selling automaker has ended as the Japanese company said on Monday its global sales for 2016 fell short of Volkswagen AG's .,topStory
TM,Toyota Motor Corp Ltd Ord,20170130,Toyota relinquishes top global sales spot to VW in 2016 ,TOKYO  Jan 30 Toyota Motor Corp's  four-year run as the world's top-selling automaker has ended as the Japanese company said on Monday its global sales for 2016 fell short of Volkswagen AG's.,normal
TM,Toyota Motor Corp Ltd Ord,20170130,Japan PM Abe to meet with Toyota CEO this week - sources ,TOKYO  Jan 30 Japanese Prime Minister Shinzo Abe and Toyota Motor Corp Chief Executive Akio Toyoda are planning to meet this week  sources familiar with the matter told Reuters.,normal
TWTR,Twitter Inc,20170130,Short sellers giving up on Twitter trade ,SAN FRANCISCO Short sellers have been closing their bets against Twitter Inc  so far in 2017  possibly frustrated by a lack of volatility in the social network's stock price.,topStory
TWTR,Twitter Inc,20170130,Short sellers giving up on Twitter trade ,SAN FRANCISCO  Jan 30 Short sellers have been closing their bets against Twitter Inc so far in 2017  possibly frustrated by a lack of volatility in the social network's stock price.,normal
UL,Unilever PLC,20170130,BRIEF-Unilever issues bonds worth 350 mln stg ,* Bonds comprise 350 000 000 stg of 1.125 per cent fixed rate notes due February 2022,topStory
UDR,United Dominion Realty Trust Inc,20170130,BRIEF-UDR announces fourth quarter and full-year 2016 results ,* Same-store NOI increased 5.3 percent year-over-year in q4 of 2016,topStory
VR,Validus Holdings Ltd,20170130,ADM to sell crop insurance business to Validus Holdings ,CHICAGO U.S. agricultural commodities trader Archer Daniels Midland Co  has agreed to sell its Crop Risk Services (CRS) insurance business for $127.5 million to Validus Holdings Ltd   the companies announced on Monday.,topStory
VR,Validus Holdings Ltd,20170130,ADM to sell crop insurance business to Validus Holdings ,CHICAGO  Jan 30 U.S. agricultural commodities trader Archer Daniels Midland Co has agreed to sell its Crop Risk Services (CRS) insurance business for $127.5 million to Validus Holdings Ltd  the companies announced on Monday.,normal
VR,Validus Holdings Ltd,20170130,BRIEF-Validus Holdings says deal to acquire ADM's crop risk services business ,* Validus Holdings announces agreement with Archer Daniels Midland to acquire ADM crop risk services business,normal
VR,Validus Holdings Ltd,20170130,BRIEF-ADM says agreement for sale of Crop Risk Services business to Validus ,* Archer Daniels Midland Co - expects to record a book gain upon deal closing,normal
WFC,Wells Fargo & Company,20170130,Wells Fargo asset-based lending head resigns ,Wells Fargo & Co's  asset-based lending head Guy Fuchs has decided to resign and will leave the bank March 31  according to bank spokeswoman Trisha Schultz.,topStory
WFC,Wells Fargo & Company,20170130,UPDATE 2-Wells Fargo asset-based lending head resigns ,Jan 30 Wells Fargo & Co's asset-based lending head Guy Fuchs has decided to resign and will leave the bank March 31  according to bank spokeswoman Trisha Schultz.,normal
WFC,Wells Fargo & Company,20170130,Wells Fargo replaces asset-based lending head ,Jan 30 Wells Fargo & Co's asset-based lending head Guy Fuchs will resign  according to a bank spokesman.,normal
WFC,Wells Fargo & Company,20170130,11th Circuit rules for Wells Fargo in lawsuit over Ponzi scheme ,A federal appeals court has declined to revive a lawsuit accusing Wells Fargo of negligence for not halting a $168 million Ponzi scheme by the late Florida hedge fund manager Arthur Nadel.,normal
WIT,Wipro Limited,20170130,BRIEF-Wipro partners with Tradeshift ,* Says Wipro partners with and invests in Tradeshift to increase digitalization and automation across source-to-pay processes  Source text: http://bit.ly/2kiRxdc Further company coverage:,topStory
WIT,Wipro Limited,20170130,BRIEF-Wipro and PATH partner to improve health in developing countries ,* Says Wipro and PATH announce partnership to improve health in developing countries  Source text: http://bit.ly/2jm8Dr9 Further company coverage:,normal
XRX,Xerox Corporation,20170130,BRIEF-Darwin A. Deason reports 6.08 pct passive stake in Xerox Corp - SEC filing ,* Darwin A. Deason reports 6.08 percent passive stake in Xerox Corp as of December 31  2016 - SEC filing  Source text: (http://bit.ly/2kLX48W) Further company coverage:    (Bengaluru Newsroom: +91 806 749 1136),topStory
USAS,Americas Silver Corporation,20170130,BRIEF-Americas Silver Corporation announces 2016 production and costs  2017 guidance  and Glencore pre-payment facility ,* Americas Silver Corporation announces 2016 production and costs  2017 guidance  and Glencore pre-payment facility,topStory
CTO,Consolidated-Tomoka Land Co,20170130,BRIEF-Consolidated-Tomoka Land Co says issues response to Wintergreen Advisers ,* Consolidated-Tomoka Land Co says issues response to Wintergreen Advisers,topStory
GORO,Gold Resource Corporation,20170130,BRIEF-Gold Resource Corp suspends operations for up to 48 hours after two accidents ,* Gold Resource Corporation voluntarily suspends operations for up to 48 hours following two recent accidents,topStory
GTE,Gran Tierra Energy Inc,20170130,BRIEF-GRAN TIERRA ENERGY INC ANNOUNCES NOTICE OF INTENTION TO MAKE A NORMAL COURSE ISSUER BID ,* GRAN TIERRA ENERGY INC ANNOUNCES NOTICE OF INTENTION TO MAKE A NORMAL COURSE ISSUER BID,topStory
NGD,New Gold Inc,20170130,UPDATE 1-New Gold expects higher mine costs  Rainy River production delay ,Jan 30 Canadian miner New Gold Inc said first production from its Rainy River mine in Ontario would be delayed by three months and that it would cost $195 million more to bring the project online.,topStory
NGD,New Gold Inc,20170130,New Gold warns of higher mine build cost  production delay at Rainy River ,Jan 30 Canadian miner New Gold Inc said on Monday first production from its Rainy River mine in Ontario would be delayed by three months and that it would cost $195 million more to bring the project online.,normal
NGD,New Gold Inc,20170130,BRIEF-New Gold achieves 2016 production guidance at lower costs  provides rainy river update  2017 guidance and announces board and management changes ,* New Gold achieves 2016 production guidance at lower costs  provides rainy river update  2017 guidance and announces board and management changes,normal
