DHT,DHT Holdings Inc,20170130,BRIEF-Frontline bids for DHT  aims to make largest listed tanker firm ,* Has approached DHT Holdings with a non-binding proposal for a possible business combination where Frontline would acquire all outstanding shares of common stock of DHT in a stock-for-stock transaction at a ratio of 0.725 frontline shares for each DHT share,normal
DHT,DHT Holdings Inc,20170130,NORDIC STOCKS - Factors to watch on Jan 30 ,(Adds Neste) The following stocks may be affected by newspaper reports and other factors on Monday:,normal
DDC,Dominion Diamond Corporation,20170130,Dominion Diamond CEO quits; successor sought ,Jan 30 Dominion Diamond Corp Chief Executive Officer Brendan Bell has resigned  saying he did not want to relocate to the Canadian miner's new headquarters  the company said on Monday.,topStory
DDC,Dominion Diamond Corporation,20170130,BRIEF-Dominion Diamond Corporation announces CEO transition ,* Bell has agreed to continue to serve in his role as CEO of company until June 30  2017,normal
LPG,Dorian LPG Ltd,20170130,BRIEF-Dorian LPG Q3 adjusted loss per share $0.36 ,* Dorian LPG LTD. Announces third quarter fiscal year 2017 financial results,topStory
LLY,Eli Lilly and Company,20170130,Sanofi  Novo Nordisk and Lilly named in patients' price fixing suit ,NEW YORK Three of the biggest makers of diabetes treatments  Sanofi SA  Novo Nordisk and Eli Lilly and Co  were named in a class action lawsuit about price fixing filed by a group of patients.,topStory
LLY,Eli Lilly and Company,20170130,Sanofi  Novo Nordisk and Lilly named in patients' price fixing suit ,NEW YORK  Jan 30 Three of the biggest makers of diabetes treatments  Sanofi SA  Novo Nordisk  and Eli Lilly & Co  were named in a class action lawsuit about price fixing filed by a group of patients.,normal
EGL,Engility Holdings Inc,20170130,BRIEF-Engility launches seeks to reprice $195 mln current principal outstanding B1 term loan maturing in 2020 ,* Engility launches offering to reprice term loans and reaffirms fiscal year 2016 guidance  excluding impact of irg sale,topStory
EBF,Ennis Inc,20170130,BRIEF-Ennis acquires Independent Printing Company Inc in stock purchase transaction ,* Ennis acquires independent printing company  inc. In a stock purchase transaction,topStory
ETR,Entergy Corporation,20170130,BRIEF-Entergy approved amendment  restatement of company's bylaws ,* Entergy Corp - approved an amendment and restatement of company's bylaws,topStory
EPD,Enterprise Products Partners LP,20170130,BRIEF-Enterprise to build isobutane dehydrogenation unit ,* Enterprise products - plans to construct new isobutane dehydrogenation unit in texas with capability to produce 425 000 tons/year of isobutylene,topStory
EPD,Enterprise Products Partners LP,20170130,BRIEF-Enterprise Products Partners LP Qtrly fully diluted earnings per unit $0.31 ,* Enterprise Products Partners LP qtrly fully diluted earnings per unit $0.31,normal
FBR,Fibria Celulose SA,20170130,UPDATE 1-Brazil's Fibria posts loss on currency  wood pulp prices ,SAO PAULO  Jan 30 Brazil's Fibria Celulose SA   the world's largest eucalyptus pulp producer  posted a quarterly loss on Monday as weaker prices and a stronger local currency undermined its export-focused business.,topStory
FBR,Fibria Celulose SA,20170130,Brazil wood pulp producer Fibria posts quarterly loss ,SAO PAULO  Jan 30 Brazil's Fibria Celulose SA   the world's largest eucalyptus pulp producer  reported a fourth-quarter net loss of 92 million reais ($29 million) on Monday  compared to a net profit of 910 million reais a year earlier.,normal
FIT,Fitbit Inc,20170130,Fitbit estimates lower fourth-quarter revenue  to cut jobs ,Fitness-band maker Fitbit Inc said it would cut about 6 percent of its workforce and estimated fourth-quarter revenue well below its own forecast  hurt by weaker-than-expected demand during the holiday shopping season  especially Black Friday.,topStory
FIT,Fitbit Inc,20170130,UPDATE 2-Fitbit estimates lower fourth-quarter revenue  to cut jobs ,* Shares slide 14.42 pct to record low of $6.17   (Adds details  background  analysts' comments  updates shares),normal
FIT,Fitbit Inc,20170130,BRIEF-Fitbit to cut 6 percent of its workforce ,* Fitbit Inc says  for full-year 2016  fitbit expects annual revenue growth to be approximately 17pct from previous forecasted growth of 25pct to 26pct,normal
FTK,Flotek Industries Inc,20170130,BRIEF-Flotek appoints Michelle Adams to its board ,* Announced appointment of Michelle Adams to Flotek's board of directors,topStory
F,Ford Motor Company,20170130,WRAPUP 1-Ford  Goldman CEOs criticize Trump travel curbs ,Jan 30 The chief executives of Goldman Sachs Group and Ford Motor Co joined the criticism of President Donald Trump's order to halt arrivals from several Muslim-majority countries  as equity markets fell and the dollar slipped on Monday.,topStory
F,Ford Motor Company,20170130,Ford Motor criticizes Trump immigration order ,WASHINGTON Ford Motor Co  on Monday criticized President Donald Trump's controversial immigration order  becoming one of the highest profile U.S. manufacturers to question the decision to temporarily ban travelers coming from seven predominantly Muslim countries.,normal
F,Ford Motor Company,20170130,UPDATE 2-Ford Motor criticizes Trump immigration order ,WASHINGTON  Jan 30 Ford Motor Co on Monday criticized President Donald Trump's controversial immigration order  becoming one of the highest profile U.S. manufacturers to question the decision to temporarily ban travelers coming from seven predominantly Muslim countries.,normal
F,Ford Motor Company,20170130,Ford Motor criticizes Trump immigration order ,WASHINGTON  Jan 30 Ford Motor Co on Monday criticized President Donald Trump's controversial immigration order  becoming one of the highest profile U.S. manufacturers to question the order temporary banning travelers coming from seven predominantly Muslim countries.,normal
FCX,Freeport-McMoran Inc,20170130,Rain in Peru may affect copper output at Cerro Verde -Freeport ,LIMA  Jan 30 Copper output at Freeport-McMoRan Inc's Cerro Verde mine in southern Peru might be temporarily affected by heavy rains that have blocked roads in the region  the company's local unit said on Monday.,topStory
FRO,Frontline Ltd,20170130,Frontline must raise bid to overcome DHT poison pill  analysts say ,OSLO Crude oil tanker firm Frontline  which has made an unsolicited offer to buy competitor DHT Holdings  must raise its bid for the attempted takeover to succeed  analysts said on Monday.,topStory
FRO,Frontline Ltd,20170130,Frontline must raise bid to overcome DHT poison pill  analysts say ,OSLO  Jan 30 Crude oil tanker firm Frontline   which has made an unsolicited offer to buy competitor DHT Holdings  must raise its bid for the attempted takeover to succeed  analysts said on Monday.,normal
FRO,Frontline Ltd,20170130,BRIEF-Frontline bids for DHT  aims to make largest listed tanker firm ,* Has approached DHT Holdings with a non-binding proposal for a possible business combination where Frontline would acquire all outstanding shares of common stock of DHT in a stock-for-stock transaction at a ratio of 0.725 frontline shares for each DHT share,normal
GBL,Gamco Investors Inc,20170130,BRIEF-Gamco Investors comments on Sevcon Proxy Contest ,* Gamco Investors Inc - intends to vote against expedited declassification and to vote for election of all five candidates nominated by board of Sevcon  Source text for Eikon:  Further company coverage:,topStory
GNRT,Gener8 Maritime Inc,20170130,BRIEF-Gener8 Maritime estimates interest expense to be about $18.3 mln for three months ended Dec. 31 ,* Estimates its interest expense to be approximately $18.3 million for three months ended December 31  2016  Source text: [http://bit.ly/2kkFJXW] Further company coverage:,topStory
GM,General Motors Company,20170130,Honda  GM to jointly produce fuel cell power systems in U.S. from 2020 ,TOKYO/DETROIT Honda Motor Co Ltd and General Motors Co (GM) will jointly produce pollution-free hydrogen fuel cell power systems in the United States from around 2020  the companies said Monday  despite President Donald Trump's promises to dismantle U.S. environmental regulations intended to spur green car demand.,topStory
GM,General Motors Company,20170130,Honda  GM to jointly produce fuel cell power systems in U.S. from 2020 ,TOKYO  Jan 30 Honda Motor Co Ltd and General Motors Co (GM) will jointly produce hydrogen fuel cell power systems in the United States from around 2020  to cut costs and ramp up output in the hope of increasing take-up of the zero-emission cars.,normal
GM,General Motors Company,20170130,RPT-U.S. auto dealers look to Trump to ease vehicle emissions rules ,NEW ORLEANS  Jan 29 U.S. auto dealers gathered for their annual convention in New Orleans said they want President Donald Trump to ease federal regulation of vehicle emissions and consumer lending  reversing action taken by his predecessor.,normal
GSK,GlaxoSmithKline PLC,20170130,BRIEF-Innoviva says GSK announces launch of Anoro in France ,* Innoviva Inc - on January 28  2017  Glaxosmithkline (GSK) announced launch of Anoro (umeclidinium/vilanterol) in France  Source text - http://bit.ly/2jnKvV8 Further company coverage:,topStory
GSK,GlaxoSmithKline PLC,20170130,As Teva wins U.S. approval for GSK Advair copy  main fight yet to come ,LONDON Israel's Teva Pharmaceutical Industries has won U.S. approval to market a copy of GlaxoSmithKline's best-selling Advair inhaler  although the real battle is still to come.,normal
GSK,GlaxoSmithKline PLC,20170130,As Teva wins US approval for GSK Advair copy  main fight yet to come ,LONDON  Jan 30 Israel's Teva Pharmaceutical Industries has won U.S. approval to market a copy of GlaxoSmithKline's best-selling Advair inhaler  although the real battle is still to come.,normal
GS,Goldman Sachs Group Inc (The),20170130,UPDATE 7-Goldman CEO takes lead on Wall St. in slamming Trump travel ban ,Jan 30 Goldman Sachs Group Inc Chief Executive Lloyd Blankfein became the first major Wall Street leader to speak out against President Donald Trump's order to halt arrivals from several Muslim-majority countries.,topStory
GS,Goldman Sachs Group Inc (The),20170130,Goldman CEO takes lead on Wall St. in slamming Trump travel ban ,Goldman Sachs Group Inc Chief Executive Lloyd Blankfein became the first major Wall Street leader to speak out against President Donald Trump's order to halt arrivals from several Muslim-majority countries.,normal
GS,Goldman Sachs Group Inc (The),20170130,Goldman CEO takes lead on Wall St. in slamming Trump travel ban ,Goldman Sachs Group Inc Chief Executive Lloyd Blankfein became the first major Wall Street leader to speak out against President Donald Trump's order to halt arrivals from several Muslim-majority countries.,normal
GS,Goldman Sachs Group Inc (The),20170130,Goldman Sachs CEO says bank does not support Trump travel ban ,Goldman Sachs Group Inc Chief Executive Lloyd Blankfein became the first major Wall Street leader to speak out against President Donald Trump's order to halt arrivals from several Muslim-majority countries.,normal
GS,Goldman Sachs Group Inc (The),20170130,Nigeria asks Goldman  Stanbic to help sell debut "diaspora bond" ,LAGOS  Jan 30 Nigeria has asked Goldman Sachs  and the local unit of South Africa's Standard Bank  to advise it on the sale of a debut "diaspora bond" targeted at Nigerians living abroad  Stanbic IBTC Bank  said on Monday.,normal
GS,Goldman Sachs Group Inc (The),20170130,BRIEF-Goldman Sachs CEO on Trump's immigration order says co does not support policy ,* Goldman Sachs' Lloyd Blankfein on President Trump's immigration order says will work to minimize disruption to extent that co can within the law - internal memo,normal
GS,Goldman Sachs Group Inc (The),20170130,Goldman Sachs CEO says bank does not support Trump travel ban ,Jan 30 Goldman Sachs Group Inc CEO Lloyd Blankfein told employees that President Donald Trump's order to halt arrivals from seven Muslim-majority countries was not a policy the bank endorsed  according to a source familiar with the matter.,normal
GGG,Graco Inc,20170130,BRIEF-Graco Q4 loss per share $1.83 ,* Sees full-year 2017 outlook of low single-digit organic sales growth on a constant currency basis worldwide,topStory
FUL,H B Fuller Company,20170130,BRIEF-H.B. Fuller company acquires Wisdom Worldwide Adhesives ,* Says H.B. Fuller expects transaction to be modestly accretive to earnings in first year,topStory
HAL,Halliburton Company,20170130,BRIEF-Halliburton Co says selected Sandbox Logistics as provider for containerized sand delivery  pursuant to a long-term agreement ,* Halliburton Co - co selected Sandbox Logistics   as its provider for containerized sand delivery  pursuant to a long-term agreement  Source text for Eikon:  Further company coverage:,topStory
HMC,Honda Motor Company Ltd,20170130,Honda  GM to jointly produce fuel cell power systems in U.S. from 2020 ,TOKYO/DETROIT Honda Motor Co Ltd and General Motors Co (GM) will jointly produce pollution-free hydrogen fuel cell power systems in the United States from around 2020  the companies said Monday  despite President Donald Trump's promises to dismantle U.S. environmental regulations intended to spur green car demand.,topStory
HMC,Honda Motor Company Ltd,20170130,UPDATE 1-Honda  GM to jointly produce fuel cell power systems in U.S. from 2020 ,TOKYO/DETROIT  Jan 30 Honda Motor Co Ltd  and General Motors Co (GM) will jointly produce pollution-free hydrogen fuel cell power systems in the United States from around 2020  the companies said Monday  despite President Donald Trump's promises to dismantle U.S. environmental regulations intended to spur green car demand.,normal
HMC,Honda Motor Company Ltd,20170130,Honda  GM to jointly produce fuel cell power systems in U.S. from 2020 ,TOKYO  Jan 30 Honda Motor Co Ltd and General Motors Co (GM) will jointly produce hydrogen fuel cell power systems in the United States from around 2020  to cut costs and ramp up output in the hope of increasing take-up of the zero-emission cars.,normal
HSBC,HSBC Holdings plc,20170130,MOVES-Ray Doody to join HSBC ,Jan 30 JP Morgan veteran Ray Doody is expected leave the firm to take up a senior role in the leveraged finance team at HSBC  a source familiar with the matter said.,topStory
HSEA,HSBC Holdings plc,20170130,MOVES-Ray Doody to join HSBC ,Jan 30 JP Morgan veteran Ray Doody is expected leave the firm to take up a senior role in the leveraged finance team at HSBC  a source familiar with the matter said.,topStory
HSEB,HSBC Holdings plc,20170130,MOVES-Ray Doody to join HSBC ,Jan 30 JP Morgan veteran Ray Doody is expected leave the firm to take up a senior role in the leveraged finance team at HSBC  a source familiar with the matter said.,topStory
IEX,IDEX Corporation,20170130,BRIEF-IDEX REPORTS FOURTH QUARTER EARNINGS OF $0.75 PER SHARE ,* IDEX REPORTS FOURTH QUARTER AND FULL YEAR RESULTS; Q4 ORDERS UP 10 PERCENT WITH SALES UP 6 PERCENT,topStory
IHC,Independence Holding Company,20170130,BRIEF-Independence Holding says repurchased 290 000 shares for $5.8 mln ,* Independence holding co says repurchased 290 000 shares of its common stock for $5.8 million in a private transaction,topStory
KEYS,Keysight Technologies Inc,20170130,Deals of the day-Mergers and acquisitions ,Jan 30 The following bids  mergers  acquisitions and disposals were reported by 2040 GMT on Monday:,topStory
KEYS,Keysight Technologies Inc,20170130,Keysight Technologies to buy Ixia for $1.6 billion ,Keysight Technologies Inc   a provider of software and equipment to the electronics industry  said on Monday it would buy U.S. data technology company Ixia  for about $1.6 billion in cash in a bid to increase its software and security portfolio.,normal
KEYS,Keysight Technologies Inc,20170130,UPDATE 2-Keysight Technologies to buy Ixia for $1.6 billion ,Jan 30 Keysight Technologies Inc  a provider of software and equipment to the electronics industry  said on Monday it would buy U.S. data technology company Ixia  for about $1.6 billion in cash in a bid to increase its software and security portfolio.,normal
KEYS,Keysight Technologies Inc,20170130,Electronic measurement tool maker Keysight to buy Ixia for $1.6 bln ,Jan 30 Keysight Technologies Inc  a provider of software and equipment to the electronics industry  said it would buy U.S. data technology company Ixia for about $1.6 billion  net of cash.,normal
LPI,Laredo Petroleum Inc,20170130,BRIEF-Laredo Petroleum expects to report a loss on derivatives of nearly $43.6 mln for Q4 ,* Laredo Petroleum Inc - For Q4 of 2016  company expects to report a loss on derivatives of approximately $43.6 million,topStory
LYG,Lloyds Banking Group Plc,20170130,UPDATE 1-British government cuts stake in Lloyds to below 5 percent ,LONDON  Jan 30 The British government has reduced its stake in Lloyds Banking Group to just below 5 percent as it aims to return the bank to full private ownership in the next few months.,topStory
LYG,Lloyds Banking Group Plc,20170130,British government cuts stake in Lloyds to below 5 percent ,LONDON  Jan 30 The British government has cut its stake in Lloyds Banking Group to just below 5 percent as it aims to return the bank to full private ownership in the next few months.,normal
LMT,Lockheed Martin Corporation,20170130,Trump says shaves $600 million from cost of 90 Lockheed F-35 aircraft ,WASHINGTON President Donald Trump said on Monday his administration had been able to cut some $600 million from the latest U.S. deal to buy about 90 F-35 Joint Strike Fighters  the Lockheed Martin aircraft the president has criticized for cost overruns. | Video ,topStory
LMT,Lockheed Martin Corporation,20170130,UPDATE 1-Trump says shaves $600 mln from cost of 90 Lockheed F-35 aircraft ,WASHINGTON  Jan 30 President Donald Trump said on Monday his administration had been able to cut some $600 million from the latest U.S. deal to buy about 90 F-35 Joint Strike Fighters  the Lockheed Martin aircraft the president has criticized for cost overruns.,normal
LMT,Lockheed Martin Corporation,20170130,Trump says cost of Lockheed's F-35 has been cut by $600 mln ,WASHINGTON  Jan 30 President Donald Trump said on Monday his administration had been able to cut $600 million from the latest U.S. contract for the F-35 Joint Strike Fighter  the Lockheed Martin aircraft that he has sharply criticized for its cost overruns.,normal
M,Macy&#39;s Inc,20170130,BRIEF-Macy's Inc sells ownership of Frango to Garrett Brands ,* Says Garrett Brands will develop  create  sell and distribute Frango products consistent with brand's legacy,topStory
MNK,Mallinckrodt plc,20170130,BRIEF-Mallinckrodt to sell intrathecal therapy business for about $203 mln ,* Mallinckrodt to sell intrathecal therapy business to Piramal Enterprises Limited for approximately $203 million,topStory
MCD,McDonald&#39;s Corporation,20170130,Judge signs off on $3.75 mln deal for McDonald's franchise workers ,A federal judge has given preliminary approval to a $3.75 million settlement between McDonald's Corp and about 800 employees of a California franchisee who said the company was jointly liable for wage-and-hour violations.,topStory
MDP,Meredith Corporation,20170130,BRIEF-Meredith board of directors raises dividend 5.1 percent ,* Meredith board of directors raises dividend 5.1 percent to $2.08 per share,topStory
MCRN,Milacron Holdings Corp,20170130,BRIEF-Milacron Holdings Corp says expects to report sales for fiscal quarter ended December 31  2016 of between $287.0 million and $289.0 million - SEC filing ,* Milacron Holdings Corp says expects to report sales for fiscal quarter ended December 31  2016 of between $287.0 million and $289.0 million - SEC filing,topStory
MON,Monsanto Company,20170130,Monsanto sees prolonged delay on GMO corn permits in Mexico ,MEXICO CITY  Jan 30 A ban on planting genetically modified corn in Mexico is likely to continue for years as a slow-moving legal battle grinds on  said a top executive of U.S.-based seed and agrochemical company Monsanto Co.,topStory
MSG,MSG Networks Inc,20170130,BRIEF-The Madison Square Garden Company and Lexus announce renewed  expanded signature partnership ,* The madison Square Garden Company and Lexus  announce renewed and expanded signature partnership,topStory
MWA,MUELLER WATER PRODUCTS,20170130,BRIEF-Mueller Water Products to acquire Singer Valve ,* Mueller Water Products Inc - deal for c$34 million in cash.,topStory
NVGS,Navigator Holdings Ltd,20170130,BRIEF-Navigator contemplating new senior unsecured bond issue ,* Navigator Holdings Ltd. contemplating new senior unsecured bond issue,topStory
NAV,Navistar International Corporation,20170130,BRIEF-Navistar to reprice about $1 bln senior secured term loan ,* Navistar announces intention to reprice approximately $1.0 billion senior secured term loan,topStory
NRZ,New Residential Investment Corp,20170130,BRIEF-New Residential announces acquisition of MSRS ,* New residential announces acquisition of MSRS  estimated preliminary financial results and increase in 1Q17 dividend,topStory
NRZ,New Residential Investment Corp,20170130,BRIEF-New Residential says offering 49.2 mln common shares ,* New residential investment- to use proceeds to fund portion of acquisition of unpaid principal balance of conventional mortgage servicing rights  Source text for Eikon:  Further company coverage:,normal
NOK,Nokia Corporation,20170130,BRIEF-Nokia  Orange Group collaborate on 5G services ,* joint definition and test platform deployment of 5G-based applications for new services for consumer and vertical markets   Source text for Eikon:  Further company coverage:    (Helsinki Newsroom),topStory
NVO,Novo Nordisk A/S,20170130,Sanofi  Novo Nordisk and Lilly named in patients' price fixing suit ,NEW YORK Three of the biggest makers of diabetes treatments  Sanofi SA  Novo Nordisk and Eli Lilly and Co  were named in a class action lawsuit about price fixing filed by a group of patients.,topStory
NVO,Novo Nordisk A/S,20170130,Sanofi  Novo Nordisk and Lilly named in patients' price fixing suit ,NEW YORK  Jan 30 Three of the biggest makers of diabetes treatments  Sanofi SA  Novo Nordisk  and Eli Lilly & Co  were named in a class action lawsuit about price fixing filed by a group of patients.,normal
NVO,Novo Nordisk A/S,20170130,BRIEF-Novo Nordisk to invest $144 mln in University of Oxford research centre ,* Says enters collaboration with University of Oxford on type 2 diabetes and invests 115 million pounds ($144.52 million)in new research centre,normal
NVO,Novo Nordisk A/S,20170130,Drugmaker Novo Nordisk bets $145 mln on post-Brexit UK science ,LONDON  Jan 30 Novo Nordisk  the world's top maker of diabetes drugs  is investing 115 million pounds ($145 million) in a new research centre in Britain  undeterred by Brexit.,normal
NRG,NRG Energy Inc,20170130,BRIEF-Carlson Capital reports 5.41 pct passive stake in NRG Energy ,* Carlson Capital L P reports 5.41 percent passive stake in NRG Energy Inc as of December 31  2016 - sec filing  Source text : http://bit.ly/2jNBIIk Further company coverage:,topStory
PKG,Packaging Corporation of America,20170130,BRIEF-Packaging Corporation of America Q4 reported EPS $1.17 ,* Packaging Corporation of America reports fourth quarter and full year 2016 results,topStory
PSO,Pearson Plc,20170130,UPDATE 1-Brazil's SEB considers IPO after buying back Pueri unit from Pearson ,SAO PAULO  Jan 30 Grupo SEB do Brasil could seek an initial public offering following the repurchase of a learning system division from Pearson Plc  to fund growth of the profitable business unit across privately owned elite schools  Chief Executive Officer Chaim Zaher said on Monday.,topStory
PSO,Pearson Plc,20170130,Brazil's Grupo SEB reacquires Pueri Domus learning systems from UK's Pearson ,SAO PAULO  Jan 30 Brazil's Grupo SEB has reacquired Pueri Domus learning systems from Britain's Pearson Plc for an undisclosed value on Monday  the Brazilian company said.,normal
PM,Philip Morris International Inc,20170130,BRIEF-PHILIP MORRIS INTERNATIONAL ENTERS INTO AGREEMENT TO EXTEND TERM OF ITS EXISTING $2.0 BLN REVOLVING CREDIT FACILITY ,* PHILIP MORRIS INTERNATIONAL - ENTERED INTO AGREEMENT  EFFECTIVE FEBRUARY 7  2017  TO EXTEND TERM OF ITS EXISTING $2.0 BILLION REVOLVING CREDIT FACILITY,topStory
PNC,PNC Financial Services Group Inc (The),20170130,BRIEF-PNC announces $300 mln increase to planned share repurchases ,* PNC announces $300 million increase to planned share repurchases,topStory
PFG,Principal Financial Group Inc,20170130,BRIEF-Principal Financial Group reports Q4 operating earnings per share $1.27 ,* Principal announces fourth quarter and full-year 2016 results,topStory
QTS,QTS Realty Trust Inc,20170130,BRIEF-QTS expands in Dallas with acquisition of 53-acre mega data center campus from Health Care Service Corp ,* QTS expands in Dallas with acquisition of 53-acre mega data center campus from Health Care Service Corporation,topStory
RJF,Raymond James Financial Inc,20170130,Raymond James to roll out robo-adviser in 2017 ,NEW YORK  Jan 30 Raymond James Financial  is rolling out a new digital platform with robo-adviser-like technology this year  the St. Petersburg  Florida-based firm said on Monday.,topStory
RYAM,Rayonier Advanced Materials Inc,20170130,BRIEF-Rayonier Advanced Materials Q4 earnings per share view $0.16 -- Thomson Reuters I/B/E/S ,* Q4 earnings per share view $0.16 -- Thomson Reuters I/B/E/S,topStory
RGA,Reinsurance Group of America Incorporated,20170130,BRIEF-Reinsurance Group of America reports Q4 EPS $2.92 ,* Reinsurance Group of America reports fourth-quarter results,topStory
RZA,Reinsurance Group of America Incorporated,20170130,BRIEF-Reinsurance Group of America reports Q4 EPS $2.92 ,* Reinsurance Group of America reports fourth-quarter results,topStory
