MRK,Merck & Company Inc,20170421,BRIEF-Atara bio announces collaboration with Merck ,* Atara Bio announces collaboration with Merck to evaluate keytruda (pembrolizumab) in combination with ATA129 in nasopharyngeal carcinoma (NPC),normal
MS,Morgan Stanley,20170421,MOVES-Klaus Kleinfeld resigns from Morgan Stanley board -filing ,NEW YORK  April 21 Klaus Kleinfeld has resigned from Morgan Stanley's board  effective immediately  and will not stand for election at its annual meeting  the Wall Street bank said in a filing on Friday.,topStory
MS,Morgan Stanley,20170421,BRIEF-Morgan Stanley says Klaus Kleinfeld resigned from co's board ,* Morgan Stanley says on April 21  2017  Klaus Kleinfeld resigned from Morgan Stanley's board of directors  effective immediately Source text - http://bit.ly/2oSo2kh Further company coverage:,normal
NFG,National Fuel Gas Company,20170421,BRIEF-National Fuel Gas Co says filed in U.S. Court of appeals for second circuit petition ,* National Fuel Gas Co - on april 21  units of co  filed in u.s. Court of appeals for second circuit petition  - sec filing,topStory
NEE,NextEra Energy Inc,20170421,BRIEF-Nextera Energy reports Q1 adj EPS $1.75 ,* Reports Q1 2017 net income attributable to Nextera Energy on a GAAP basis of $3.37 per share,topStory
NOMD,Nomad Foods Limited,20170421,BRIEF-Nomad Foods announces pricing of senior secured notes ,* Nomad Foods Ltd says has priced its private offering of eur 400.0 million aggregate principal amount of 3.25% senior secured notes due 2024,topStory
JWN,Nordstrom Inc,20170421,U.S. retailers bet on Congress over Bolivia to thwart Trump  border tax issue ,CHICAGO Target Corp   Wal-Mart Stores Inc  and other retailers are shelving considerations to move supply bases closer to the United States in the face of a possible border tax  banking instead on killing support for the tax idea in Congress.,normal
JWN,Nordstrom Inc,20170421,UPDATE 1-U.S. retailers bet on Congress over Bolivia to thwart Trump  border tax issue ,CHICAGO  April 21 Target Corp  Wal-Mart Stores Inc and other retailers are shelving considerations to move supply bases closer to the United States in the face of a possible border tax  banking instead on killing support for the tax idea in Congress.,normal
JWN,Nordstrom Inc,20170421,U.S. retailers bet on Congress over Bolivia to thwart Trump border tax issue ,CHICAGO  April 21 Target Corp  Wal-Mart Stores Inc and other retailers are shelving considerations to move supply bases closer to the United States in the face of a possible border tax  banking instead on killing support for the tax idea in Congress. President Donald Trump's administration plans to impose a 20 percent tax on imports  a levy that  industry officials said  could raise U.S. consumer prices by as much as 25 percent. Last week  the President said he favored an 'import tax,normal
NVS,Novartis AG,20170421,Novartis to defend Gilenya patent rights against generic challengers ,Swiss drugmaker Novartis AG will go to court on Monday to defend its blockbuster multiple sclerosis drug Gilenya against would-be generic competitors.,topStory
NVO,Novo Nordisk A/S,20170421,BRIEF-Xoma receieves notice to terminate license agreement from Novo Nordisk ,* Xoma -on april 20  2017 co received notice from Novo Nordisk a/s  relating to termination of exclusive license agreement with co due to strategic and business reasons,topStory
OCN,Ocwen Financial Corporation,20170421,BRIEF-Ocwen financial says disputes key allegations made in state regulators' orders ,* Ocwen Financial - disputes key allegations made in state regulators' orders that co's mortgage loan servicing practices have caused substantial consumer harm,topStory
OFG,OFG Bancorp,20170421,BRIEF-OFG BANCORP Q1 EARNINGS PER SHARE $0.26 ,* Q1 EARNINGS PER SHARE VIEW $0.26 -- THOMSON REUTERS I/B/E/S,topStory
IX,Orix Corp Ads,20170421,BRIEF-Orix completes share repurchase ,* Says it completed repurchase of 30 million shares of its common stock  for 50 billion yen on April 21,topStory
BTU,Peabody Energy Corporation,20170421,BRIEF-Peabody Energy reports consolidated income from continuing operations ,* Peabody Energy Corp - consolidated income from continuing operations  net of income taxes of $16.8 million for the month ended March 31  2017 Source text - http://bit.ly/2oShVwr Further company coverage:,topStory
PEN,Penumbra Inc,20170421,BRIEF-Penumbra appoints Bridget O'Rourke to board of directors ,* Penumbra  Inc. appoints Bridget O'Rourke to its board of directors,topStory
PFE,Pfizer Inc,20170421,BRIEF-EU Medicines Agency recommendations for April 2017 ,* EU Medicines Agency recommends approval granting of a marketing authorisation for Sandoz's Rixathon Non-Hodgkin's Lymphoma (NHL)  chronic lymphocytic leukaemia,topStory
PGTI,PGT Innovations Inc,20170421,BRIEF-PGT Innovations announces expansion plans for manufacturing facility in Miami ,* PGT Innovations Inc - announced expansion plans for a new manufacturing facility in Miami  Florida,topStory
PJC,Piper Jaffray Companies,20170421,U.S. drillers add oil rigs for 14th week in a row -Baker Hughes ,    April 21 U.S. drillers added oil rigs for a 14th week in a row  extending an 11-month recovery that is expected to boost U.S. shale production in May in the biggest monthly increase in more than two years.     Drillers added five oil rigs in the week to April 21  bringing the total count up to 688  the most since April 2015  energy services firm Baker Hughes Inc         said on Friday.       That is more than double the same week a year ago when there were o,normal
PKX,POSCO,20170421,RPT-UPDATE 4-S.Korea to raise issue of U.S. steel import restrictions at WTO ,* S.Korea's trade ministry plans to raise issue at WTO meeting,topStory
PKX,POSCO,20170421,UPDATE 4-S.Korea to raise issue of U.S. steel import restrictions at WTO ,* S.Korea's trade ministry plans to raise issue at WTO meeting (Rewrites to add comments from trade ministry statement),normal
RAS,RAIT Financial Trust,20170421,BRIEF-RAIT Financial Trust says purported notice of nomination from HCM does not comply with bylaws ,* Rait Financial Trust -board of trustees determined purported notice of nomination from Highland Capital Management does not comply with bylaws in various respects,topStory
RFT,RAIT Financial Trust,20170421,BRIEF-RAIT Financial Trust says purported notice of nomination from HCM does not comply with bylaws ,* Rait Financial Trust -board of trustees determined purported notice of nomination from Highland Capital Management does not comply with bylaws in various respects,topStory
RFTA,RAIT Financial Trust,20170421,BRIEF-RAIT Financial Trust says purported notice of nomination from HCM does not comply with bylaws ,* Rait Financial Trust -board of trustees determined purported notice of nomination from Highland Capital Management does not comply with bylaws in various respects,topStory
RTN,Raytheon Company,20170421,BRIEF-Raytheon's CEO Thomas A. Kennedy's 2016 total compensation $20.5 mln ,* CEO Thomas A. Kennedy's 2016 total compensation $20.5 million versus $20.4 million 2015 - SEC filing Source text (http://bit.ly/2otKOfC) Further company coverage:,topStory
RMP,Rice Midstream Partners LP,20170421,BRIEF-RICE MIDSTREAM PARTNERS APPROVES CASH DISTRIBUTION OF $0.2608/UNIT ,* RICE MIDSTREAM PARTNERS LP SAYS BOARD OF DIRECTORS OF ITS GENERAL PARTNER HAS APPROVED A CASH DISTRIBUTION OF $0.2608 PER UNIT,topStory
COL,Rockwell Collins Inc,20170421,Rockwell Collins lifts FY sales outlook to reflect B/E Aerospace deal ,Rockwell Collins Inc's  second-quarter revenue beat analysts' estimates and the aircraft components maker raised its full-year revenue forecast to reflect the impact of its recently closed acquisition of aircraft interiors maker B/E Aerospace.,topStory
COL,Rockwell Collins Inc,20170421,UPDATE 3-Rockwell Collins lifts FY sales outlook to reflect B/E Aerospace deal ,April 21 Rockwell Collins Inc's second-quarter revenue beat analysts' estimates and the aircraft components maker raised its full-year revenue forecast to reflect the impact of its recently closed acquisition of aircraft interiors maker B/E Aerospace.,normal
COL,Rockwell Collins Inc,20170421,CORRECTED-UPDATE 2-Rockwell Collins raises fiscal-year revenue forecast ,April 21 Aircraft component maker Rockwell Collins Inc raised its fiscal-year revenue forecast but gave a lower-than-expected profit outlook as it incorporated the acquisition of aircraft interiors maker B/E Aerospace into its results.,normal
COL,Rockwell Collins Inc,20170421,BRIEF-Rockwell Collins Q2 EPS $1.27 from continuing operations ,* Rockwell Collins reports second quarter financial results and provides updated fiscal year 2017 financial guidance,normal
COL,Rockwell Collins Inc,20170421,REFILE-Rockwell Collins revenue rises 2.4 pct ,April 21 Aircraft component maker Rockwell Collins Inc reported a 2.4 percent rise in quarterly revenue  helped by higher sales in its government systems and information management services units.,normal
RBS,Royal Bank Scotland plc (The),20170421,British ministry may join investor suit against state-owned RBS ,LONDON A British government department has applied to join a class action suit to represent some shareholders who are among those state-owned Royal Bank of Scotland  is alleged to have misled in 2008  a document seen by Reuters shows.,topStory
RBS,Royal Bank Scotland plc (The),20170421,British ministry may join investor suit against state-owned RBS ,LONDON  April 21 A British government department has applied to join a class action suit to represent some shareholders who are among those state-owned Royal Bank of Scotland is alleged to have misled in 2008  a document seen by Reuters shows.,normal
SNY,Sanofi,20170421,EMA panel recommends nod for Sanofi  Regeneron's arthritis drug ,A European Medicines Agency panel said on Friday it recommended granting marketing approval to Sanofi and Regeneron's experimental drug to treat rheumatoid arthritis.,topStory
SNY,Sanofi,20170421,EMA panel recommends nod for Sanofi  Regeneron's arthritis drug ,April 21 A European Medicines Agency panel said on Friday it recommended granting marketing approval to Sanofi and Regeneron's experimental drug to treat rheumatoid arthritis.,normal
SNY,Sanofi,20170421,BRIEF-EU Medicines Agency recommendations for April 2017 ,* EU Medicines Agency recommends approval granting of a marketing authorisation for Sandoz's Rixathon Non-Hodgkin's Lymphoma (NHL)  chronic lymphocytic leukaemia,normal
SLB,Schlumberger NV,20170421,Schlumberger expects reactivation costs to squeeze margins ,Schlumberger NV  warned on Friday that margins would remain under pressure as the oilfield services provider spends more to bring back idled equipment to meet rising demand from North American shale producers after a two-year lull.,topStory
SLB,Schlumberger NV,20170421,UPDATE 4-Schlumberger expects reactivation costs to squeeze margins ,* Q2  Q3 margin growth to lag Q1 - analyst (Adds Breakingviews link),normal
SLB,Schlumberger NV,20170421,BRIEF-Schlumberger says "activity has now reached bottom in all regions" ,* Schlumberger says "activity has now reached bottom in all regions" - conf call,normal
SLB,Schlumberger NV,20170421,BRIEF-Schlumberger says do not expect significant sequential growth from Middle East over coming quarters ,* Schlumberger sees strength in activity in North Sea  Russia and Caspian regions in coming quarters as the winter season ends  new projects start up,normal
SLB,Schlumberger NV,20170421,BRIEF-Schlumberger says continued to experience payment delays  primarily from customers in Latin America ,* Schlumberger says continued to experience payment delays  primarily from customers in Latin America,normal
SLB,Schlumberger NV,20170421,Schlumberger posts first revenue rise in 9 quarters as drilling recovers ,April 21Schlumberger NV reported a 5.7 percent rise in revenue  the first increase after eight quarters  as a recovery in crude prices spurred shale drilling after a more than two-year slump.,normal
SMI,Semiconductor  Manufacturing International Corporation,20170421,BRIEF-Semiconductor Manufacturing International updates on proposed share premium reduction ,April 21 Semiconductor Manufacturing International Corp:,topStory
SBGL,Sibanye Gold Limited,20170421,South Africa's Sibanye declares war on illegal gold miners ,* Thousands of "zama zamas" mine gold illegally in South Africa,topStory
SLG,SL Green Realty Corporation,20170421,BRIEF-Sl Green Realty's CEO Marc Holliday's total compensation for 2016 was $17.3 mln ,* Sl Green Realty Corp - CEO Marc Holliday's total compensation for 2016 was $17.3 million versus $23 million in 2015 - sec filing Source text: (http://bit.ly/2pMWco2) Further company coverage:,topStory
SNE,Sony Corp Ord,20170421,Sony lifts annual profit estimate on lower amortization costs ,TOKYO Japan's Sony Corp  raised its operating profit estimate for the year ended March 31 thanks to lower amortization costs for its financial services segment.,topStory
SNE,Sony Corp Ord,20170421,Sony lifts annual profit estimate on lower amortisation costs ,TOKYO  April 21 Japan's Sony Corp raised its operating profit estimate for the year ended March 31 thanks to lower amortisation costs for its financial services segment.,normal
SWJ,Stanley Black & Decker Inc,20170421,BRIEF-Stanley Black & Decker Q1 GAAP earnings per share $2.59 ,* Reaffirms FY 2017 GAAP earnings per share view $7.95 to $8.15,topStory
SWK,Stanley Black & Decker Inc,20170421,BRIEF-Stanley Black & Decker Q1 GAAP earnings per share $2.59 ,* Reaffirms FY 2017 GAAP earnings per share view $7.95 to $8.15,topStory
SWP,Stanley Black & Decker Inc,20170421,BRIEF-Stanley Black & Decker Q1 GAAP earnings per share $2.59 ,* Reaffirms FY 2017 GAAP earnings per share view $7.95 to $8.15,topStory
STT,State Street Corporation,20170421,BRIEF-State Street Global Advisors says received a paymentfrom class action settlement ,* State Street Global Advisors says received a payment as authorized claimant from a class action settlement related to Weatherford International Ltd Source text for Eikon: Further company coverage:,topStory
STT,State Street Corporation,20170421,High-stakes vote on Wells Fargo board also tests proxy adviser ISS ,BOSTON A high-stakes shareholder vote at Wells Fargo & Co  next week will determine whether the bank has done enough to retain investor confidence after its phony-account scandal  and whether a leading proxy adviser wields enough clout to help oust most of its board.,normal
TI,Telecom Italia SPA,20170421,BRIEF-Vivendi says to remain long-term Telecom Italia shareholder ,* Vivendi reaffirms its desire to be a long term committed shareholder to add value to telecom italia,topStory
TRNO,Terreno Realty Corporation,20170421,BRIEF-Terreno Realty Corp acquires property in Lynwood  CA for $31.4 mln ,* Terreno Realty Corporation acquires property in Lynwood  CA for $31.4 million,topStory
BLD,TopBuild Corp,20170421,BRIEF-Topbuild acquires superior insulation products ,* Topbuild Corp - owner and founder of insulation products  Bob Olson  will join company Source text for Eikon: Further company coverage:,topStory
USB,US Bancorp,20170421,Exclusive: U.S. offers to fund Mexico heroin fight as 2016 output jumps - U.S. official ,MEXICO CITY The United States has offered to help fund Mexico's efforts to eradicate opium poppies  the U.S. assistant secretary for International Narcotics and Law Enforcement Affairs (INL) said on Friday  as Mexican heroin output increased again last year.,topStory
UAL,United Continental Holdings Inc,20170421,UPDATE 2-United CEO Munoz will not chair board in 2018 following passenger furor ,NEW YORK  April 21 United Continental Holdings Inc said on Friday Chief Executive Oscar Munoz will not become chairman in 2018  under an amendment to his employment agreement approved after an uproar over the treatment of a passenger.,topStory
UAL,United Continental Holdings Inc,20170421,BRIEF-United Continental Holdings CEO's 2016 compensation was $18.7 mln ,* United Continental Holdings Inc - CEO Oscar Munoz's 2016 total compensation was $18.7 million which includes stock awards of $13.8 million - sec filing,normal
UAL,United Continental Holdings Inc,20170421,BRIEF-United Airlines enters second amendment to employment agreement with CEO Oscar Munoz ,* United Continental Holdings - on april 21  co  united airlines entered second amendment to employment agreement with ceo oscar munoz - sec filing,normal
X,United States Steel Corporation,20170421,U.S. steel shares jump as Trump orders probe of imports ,NEW YORK U.S. steel stocks rallied on Thursday as President Donald Trump began a probe into whether imports of foreign-made steel are a national security risk.,topStory
UNH,UnitedHealth Group Incorporated,20170421,BRIEF-UnitedHealth Group CEO's 2016 compensation was $17.8 mln ,* CEO Stephen Hemsley's 2016 total compensation $17.8 million versus $14.5 million in 2015 - sec filing Source text - http://bit.ly/2pMAQXW Further company coverage:,topStory
UHS,Universal Health Services Inc,20170421,BRIEF-UK's CMA looks into acqusition by Cygnet Health Care  Universal Health Services ,April 21 UK's Competition and Markets Authority (CMA):,topStory
VRX,Valeant Pharmaceuticals International Inc,20170421,UPDATE 2-Valeant prices psoriasis treatment at $3 500 per month ,April 21 Canadian drugmaker Valeant Pharmaceuticals International Inc  said it had priced its recently approved plaque psoriasis treatment at $3 500 per month  ahead of an expected U.S. launch in the second half of 2017.,topStory
VRX,Valeant Pharmaceuticals International Inc,20170421,Valeant prices psoriasis treatment at $3 500 per month ,April 21 Embattled Canadian drugmaker Valeant Pharmaceuticals International Inc  said on Friday that it had priced its recently approved plaque psoriasis treatment at $3 500 per month.,normal
VRX,Valeant Pharmaceuticals International Inc,20170421,BRIEF-Valeant announces pricing for Siliq ,April 21 Valeant Pharmaceuticals International Inc,normal
V,Visa Inc,20170421,Ohio investigates Visa's debit card transactions ,Visa Inc said on Friday it was being investigated on rules related to acceptance of its debit cards  cardholder verification methods and routing of debit transactions.,topStory
V,Visa Inc,20170421,Ohio investigates Visa's debit card transactions ,April 21 Visa Inc said on Friday it was being investigated on rules related to acceptance of its debit cards  cardholder verification methods and routing of debit transactions.,normal
VC,Visteon Corporation,20170421,BRIEF-VISTEON AWARDED SMARTCORE COCKPIT DOMAIN CONTROLLER PROGRAM BY DONGFENG MOTOR ,* DONGFENG MOTOR SELECTED SMARTCORE  COCKPIT DOMAIN CONTROLLER TECHNOLOGY FROM CO FOR A FUTURE DOMESTIC CHINESE LIGHT VEHICLE PROGRAM Source text for Eikon: Further company coverage:,topStory
WMT,Wal-Mart Stores Inc,20170421,Judge tees up 2018 trial in Wal-Mart employee seating case ,A federal judge in California said on Thursday that a trial in a long-running class action claiming Wal-Mart Stores Inc violated California law by failing to provide seating to its cashiers will start in the fall of 2018.,topStory
WMT,Wal-Mart Stores Inc,20170421,U.S. retailers bet on Congress over Bolivia to thwart Trump border tax issue ,CHICAGO Target Corp  Wal-Mart Stores Inc and other retailers are shelving considerations to move supply bases closer to the United States in the face of a possible border tax  banking instead on killing support for the tax idea in Congress. President Donald Trump's administration plans to impose a 20 percent tax on imports  a levy that  industry officials said  could raise U.S. consumer prices by as much as 25 percent. Last week  the President said he favored an 'import tax' that cou,normal
WMT,Wal-Mart Stores Inc,20170421,U.S. retailers bet on Congress over Bolivia to thwart Trump  border tax issue ,CHICAGO Target Corp   Wal-Mart Stores Inc  and other retailers are shelving considerations to move supply bases closer to the United States in the face of a possible border tax  banking instead on killing support for the tax idea in Congress.,normal
WMT,Wal-Mart Stores Inc,20170421,U.S. retailers bet on Congress over Bolivia to thwart Trump border tax issue ,CHICAGO  April 21 Target Corp  Wal-Mart Stores Inc and other retailers are shelving considerations to move supply bases closer to the United States in the face of a possible border tax  banking instead on killing support for the tax idea in Congress. President Donald Trump's administration plans to impose a 20 percent tax on imports  a levy that  industry officials said  could raise U.S. consumer prices by as much as 25 percent. Last week  the President said he favored an 'import tax,normal
WBS,Webster Financial Corporation,20170421,BRIEF-WEBSTER FINANCIAL Q1 EARNINGS PER SHARE $0.62 ,* Q1 EARNINGS PER SHARE VIEW $0.57 -- THOMSON REUTERS I/B/E/S,topStory
WFC,Wells Fargo & Company,20170421,Calpers says will oppose nine directors at Wells Fargo ,BOSTON  April 21 Officials of the California Public Employees' Retirement System said Friday they are voting against nine of 15 Wells Fargo & Co directors up for election at the bank's annual meeting next week  citing the bank's phony-account scandal.,topStory
WFC,Wells Fargo & Company,20170421,National Bank invests C$6 million in robo-adviser Nest Wealth ,TORONTO National Bank of Canada is investing C$6 million in Canadian robo-adviser startup Nest Wealth and will license the financial technology company's digital wealth management platform  the companies said on Friday.,normal
WFC,Wells Fargo & Company,20170421,National Bank invests C$6 mln in robo-adviser Nest Wealth ,TORONTO  April 21 National Bank of Canada is investing C$6 million in Canadian robo-adviser startup Nest Wealth and will license the financial technology company's digital wealth management platform  the companies said on Friday.,normal
WFC,Wells Fargo & Company,20170421,Wells Fargo expands settlement to include more customer accounts ,Wells Fargo & Co  said it would expand its class action settlement related to the lender's retail sales practices to include customer accounts as early as May 2002.,normal
WFC,Wells Fargo & Company,20170421,Wells Fargo expands settlement to include more customer accounts ,April 21 Wells Fargo & Co said it would expand its class action settlement related to the lender's retail sales practices to include customer accounts as early as May 2002.,normal
WFC,Wells Fargo & Company,20170421,BRIEF-Wells Fargo expands class-action settlement for retail sales practices ,* Wells Fargo expands class-action settlement for retail sales practices to $142 million  adds accounts as early as May 2002,normal
WFC,Wells Fargo & Company,20170421,High-stakes vote on Wells Fargo board also tests proxy adviser ISS ,BOSTON A high-stakes shareholder vote at Wells Fargo & Co  next week will determine whether the bank has done enough to retain investor confidence after its phony-account scandal  and whether a leading proxy adviser wields enough clout to help oust most of its board.,normal
YPF,YPF Sociedad Anonima,20170421,BRIEF-Schlumberger posts qtrly GAAP EPS of $0.20 ,* Qtrly GAAP EPS  including Cameron integration charges of $0.05 per share  was $0.20,topStory
PRK,Park National Corporation,20170421,BRIEF-Park National Corp Q1 earnings per share $1.31 ,* Park National Corporation reports first quarter 2017 financial results,topStory
VII,Vicon Industries Inc,20170421,BRIEF-Vicon Industries amends credit facility  increasing borrowing availability ,* Vicon Industries amends credit facility  increasing borrowing availability,topStory
