SHLM,A Schulman Inc,20170908,BRIEF-A. Schulman to add Carol Eicher and Allen Spizzo to board ,* A. Schulman to add Carol Eicher and Allen Spizzo to the board of directors; Dr. William H. Joyce appointed as advisor to board,topStory
AMZN,Amazoncom Inc,20170908,PRESS DIGEST- New York Times business news - Sept 8 ,Sept 8 The following are the top stories on the New York Times business pages. Reuters has not verified these stories and does not vouch for their accuracy.,normal
ANSS,ANSYS Inc,20170908,BRIEF-The Vanguard Group discloses 10.09 pct passive stake in Ansys Inc - SEC filing ,* The Vanguard Group discloses 10.09 percent passive stake in Ansys Inc as of August 31  2017 - SEC filing,topStory
AAPL,Apple Inc,20170908,Apple moves to ward Western Digital off control of Toshiba chips: sources ,TOKYO Apple Inc  has sought to stop Western Digital Corp  from taking control of Toshiba Corp's  chip business by threatening not to buy its products in the future  people with knowledge of the deal said.,topStory
AAPL,Apple Inc,20170908,UPDATE 2-Apple moves to ward Western Digital off control of Toshiba chips -sources ,* Toshiba seeking deal on chip unit sale by Wednesday (Recasts with Apple threat to stop buying chips),normal
AAPL,Apple Inc,20170908,Apple lawsuits against Qualcomm can proceed  U.S. judge rules ,Apple Inc's  11 foreign lawsuits against Qualcomm Inc  can proceed while the company's dispute plays out in the United States  a U.S. federal judge in San Diego ruled Sept. 7.,normal
AAPL,Apple Inc,20170908,Apple lawsuits against Qualcomm can proceed  U.S. judge rules ,Sept 8 Apple Inc's 11 foreign lawsuits against Qualcomm Inc can proceed while the company's dispute plays out in the United States  a U.S. federal judge in San Diego ruled Sept. 7.,normal
AAPL,Apple Inc,20170908,Western Digital seeks Y50 bln from Apple to help finance Toshiba chip bid -Kyodo ,TOKYO  Sept 8 A group including Western Digital is seeking around 50 billion yen ($464 million) from Apple Inc to help finance a bid for Toshiba Corp's memory chip unit  Kyodo news agency reported on Friday.,normal
ASV,ASV Holdings Inc,20170908,BRIEF-Gilder  Gagnon  Howe & Co LLC reports 11.24 percent passive stake in ASV Holdings Inc as on Aug. 31  2017 - SEC filing‍​ ,* Gilder  Gagnon  Howe & Co LLC reports 11.24 percent passive stake in ASV Holdings Inc as on August 31  2017 - SEC filing‍​ Source text - (http://bit.ly/2wNFZo8) Further company coverage:,topStory
BCBP,BCB Bancorp Inc (NJ),20170908,BRIEF-BCB Bancorp  Inc. Announces pricing of common stock offering ,* BCB Bancorp  Inc. Announces pricing of common stock offering,topStory
BGCP,BGC Partners Inc,20170908,BRIEF-Bgc Partners Inc Says drew $400 mln under revolving credit facility and $575 mln under term loan facility​ ,* Bgc Partners Inc - ‍on september 8  2017  company drew $400 million under revolving credit facility and $575 million under term loan facility​ Source text for Eikon: Further company coverage:,topStory
BIOS,BioScrip Inc,20170908,BRIEF-Coliseum Capital reports 14.6 pct stake in Bioscrip ,* Coliseum Capital Management LLC reports 14.6 percent stake in Bioscrip Inc as of September 7  2017 - SEC filing‍​,topStory
BLKB,Blackbaud Inc,20170908,BRIEF-Uk's CMA investigates and cleares anticipated acquisition by Blackbaud Inc of Giving Ltd ,* INVESTIGATED AND CLEARED THE ANTICIPATED ACQUISITION BY BLACKBAUD  INC. OF GIVING LIMITED Further company coverage: (Bangalore.newsroom@thomsonreuters.com),topStory
CELG,Celgene Corporation,20170908,BRIEF-Celgene's ESMO data further evaluates drug's potential to treat various cancers ,* Data presented at ESMO 2017 further evaluate role of Abraxane® for patients with historically challenging cancers Source text for Eikon: Further company coverage:,topStory
CMCSA,Comcast Corporation,20170908,Disney  Comcast shares fall on disappointing forecasts ,Shares of Walt Disney Co  and Comcast Corp  tumbled on Thursday after Disney warned of stagnant earnings and No. 1 cable operator Comcast forecast more subscriber losses. | Video ,topStory
COMM,CommScope Holding Company Inc,20170908,BRIEF-Capital Research Global Investors reports 12.2 percent passive stake in Commscope Holding Company ,* Capital Research Global Investors reports a 12.2 percent passive stake in Commscope Holding Company Inc as of August 31  2017 - SEC filing‍​ Source text for Eikon: [ID:http://bit.ly/2eTghZc] Further company coverage:,topStory
CHCI,Comstock Holding Companies Inc,20170908,BRIEF-Comstock Holding Companies confirms further extension of offer deadline ,* Deadline for Select Sands Corp to respond to offer to purchase 20 mln shares of co extended to 5 pm (Toronto time) on Sept 15 Source text for Eikon: Further company coverage:,topStory
CNCE,Concert Pharmaceuticals Inc,20170908,BRIEF-Concert Pharma pays total of $30.8 mln to Hercules Capital ,* Concert Pharmaceuticals- ‍on Sept 7  paid total of $30.8 million to hercules capital outstanding under loan and security agreement with Hercules dated June 8,topStory
CSX,CSX Corporation,20170908,Factbox: Key railroad assets in Hurricane Irma's path ,Major eastern U.S. railroads CSX Corp and Norfolk Southern Corp are rerouting rail cars and locomotives  holding traffic in yards out of harm's way  relocating workers  and putting repair equipment into place as Hurricane Irma barrels toward Florida.,topStory
DISCA,Discovery Communications Inc,20170908,BRIEF-Discovery Communications announces pricing of Senior Notes ,* Discovery Communications Inc - ‍Notes were priced at 99.875% of their principal amount to yield 2.504% to maturity​,topStory
DISCA,Discovery Communications Inc,20170908,BRIEF-Discovery Communications announces debt offering ,* Discovery Communications announces debt offering Source text for Eikon: Further company coverage:,normal
DISCA,Discovery Communications Inc,20170908,BRIEF-Discovery Communications announces pricing of senior notes ,* Discovery Communications  LLC priced offering of $400 million floating rate senior notes due 2019,normal
DISCB,Discovery Communications Inc,20170908,BRIEF-Discovery Communications announces pricing of Senior Notes ,* Discovery Communications Inc - ‍Notes were priced at 99.875% of their principal amount to yield 2.504% to maturity​,topStory
DISCB,Discovery Communications Inc,20170908,BRIEF-Discovery Communications announces debt offering ,* Discovery Communications announces debt offering Source text for Eikon: Further company coverage:,normal
DISCB,Discovery Communications Inc,20170908,BRIEF-Discovery Communications announces pricing of senior notes ,* Discovery Communications  LLC priced offering of $400 million floating rate senior notes due 2019,normal
DISCK,Discovery Communications Inc,20170908,BRIEF-Discovery Communications announces pricing of Senior Notes ,* Discovery Communications Inc - ‍Notes were priced at 99.875% of their principal amount to yield 2.504% to maturity​,topStory
DISCK,Discovery Communications Inc,20170908,BRIEF-Discovery Communications announces debt offering ,* Discovery Communications announces debt offering Source text for Eikon: Further company coverage:,normal
DISCK,Discovery Communications Inc,20170908,BRIEF-Discovery Communications announces pricing of senior notes ,* Discovery Communications  LLC priced offering of $400 million floating rate senior notes due 2019,normal
DVCR,Diversicare Healthcare Services Inc,20170908,BRIEF-Osmium Partners issues letter to Diversicare urging dividend increase ,* Osmium Partners Llc - Osmium Partners issues letter to Diversicare board urging a substantial increase in dividends​,topStory
EACQ,Easterly Acquisition Corp,20170908,BRIEF-‍Leucadia National reports 12.1 percent passive stake in Easterly Acquisition Corp ​ ,* ‍Leucadia National Corp reports 12.1 percent passive stake in Easterly Acquisition Corp as of Aug 31 - SEC filing​ Source text: (http://bit.ly/2wfn8id) Further company coverage:,topStory
EACQU,Easterly Acquisition Corp,20170908,BRIEF-‍Leucadia National reports 12.1 percent passive stake in Easterly Acquisition Corp ​ ,* ‍Leucadia National Corp reports 12.1 percent passive stake in Easterly Acquisition Corp as of Aug 31 - SEC filing​ Source text: (http://bit.ly/2wfn8id) Further company coverage:,topStory
ESES,Eco-Stim Energy Solutions Inc,20170908,BRIEF-Eco-Stim Energy files for resale of up to 19.6 mln shares of co's common stock ,* Eco-Stim Energy Solutions files for resale of up to 19.6 million shares of co's common stock by selling stockholders‍​ - SEC filing,topStory
FB,Facebook Inc,20170908,German competition watchdog to announce Facebook findings by year-end ,FLORENCE The initial findings of Germany's investigation of U.S. social network company Facebook over possible market abuse will be announced by the end of the year  the country's cartel office said on Friday.,topStory
FB,Facebook Inc,20170908,German competition watchdog to announce Facebook findings by year-end ,FLORENCE  Sept 8 The initial findings of Germany's investigation of U.S. social network company Facebook over possible market abuse will be announced by the end of the year  the country's cartel office said on Friday.,normal
FLDM,Fluidigm Corporation,20170908,BRIEF-Neuberger Berman Group LLC reports 13.65 percent passive stake in Fluidigm ,* Neuberger Berman Group LLC reports a 13.65 percent passive stake in Fluidigm Corp as of August 31  2017 - sec filing‍​ Source text : [ID:http://bit.ly/2eL1ifW] Further company coverage:,topStory
FTR,Frontier Communications Corporation,20170908,BRIEF-Frontier Communications work schedules  service order impacts from Hurricane Irma ,* Frontier Communications work schedules  service order impacts from Hurricane Irma Source text for Eikon: Further company coverage:,topStory
FTRPR,Frontier Communications Corporation,20170908,BRIEF-Frontier Communications work schedules  service order impacts from Hurricane Irma ,* Frontier Communications work schedules  service order impacts from Hurricane Irma Source text for Eikon: Further company coverage:,topStory
FSBW,FS Bancorp Inc,20170908,BRIEF-FS Bancorp's upsized public offering of 510 638 shares priced at $47/shr ,* FS Bancorp Inc announces pricing of upsized public offering of common stock,topStory
FLL,Full House Resorts Inc,20170908,BRIEF-Full House Resorts files for common stock offering ,* Full House Resorts Inc files for common stock offering of about 1 million shares of common stock held by Daniel R. Lee  president  ceo‍​ Source text: [http://bit.ly/2eTUTCV] Further company coverage:,topStory
GALE,Galena Biopharma Inc,20170908,Galena settles U.S. kickback charges related to opioid drug ,Galena Biopharma Inc will pay more than $7.55 million to resolve charges it paid kickbacks to doctors to induce them to prescribe its opioid-based pain medication Abstral to patients  the U.S. Department of Justice said on Friday.,topStory
GALE,Galena Biopharma Inc,20170908,UPDATE 1-Galena settles U.S. kickback charges related to opioid drug ,Sept 8 Galena Biopharma Inc will pay more than $7.55 million to resolve charges it paid kickbacks to doctors to induce them to prescribe its opioid-based pain medication Abstral to patients  the U.S. Department of Justice said on Friday.,normal
GALE,Galena Biopharma Inc,20170908,BRIEF-U.S. DOJ says Galena Biopharma to pay over $7.55 mln to resolve alleged claims ,* Department of Justice says "Galena Biopharma Inc to pay more than $7.55 million to resolve alleged false claims related to opioid drug",normal
GRMN,Garmin Ltd,20170908,BRIEF-Garmin announces verdict in another Navico patent lawsuit ,* Garmin Ltd - ‍jury found that Garmin had "willfully infringed" two Navico "downscan" patents and awarded damages in amount of $38 million​,topStory
LAND,Gladstone Land Corporation,20170908,BRIEF-Gladstone Land Corporation announces pricing of common stock offering ,* Gladstone Land Corporation announces pricing of common stock offering,topStory
LANDP,Gladstone Land Corporation,20170908,BRIEF-Gladstone Land Corporation announces pricing of common stock offering ,* Gladstone Land Corporation announces pricing of common stock offering,topStory
HURC,Hurco Companies Inc,20170908,BRIEF-Hurco Companies reports Q3 earnings per share of $0.58 ,* Hurco Companies Inc - ‍orders for Q3 of fiscal 2017 were $62.55 million  an increase of 31 percent compared to corresponding period in fiscal 2016​,topStory
IMMY,Imprimis Pharmaceuticals Inc,20170908,BRIEF-Allergan USA files suits against Imprimis  Prescriber's Choice and Sincerus Florida ,* Allergan files suits against Imprimis Pharmaceuticals  Inc.  Prescriber's Choice  Inc.  and Sincerus Florida  LLC,topStory
INCY,Incyte Corporation,20170908,BRIEF-Incyte announces pricing of public offering of 4 945 000 shares ,* Incyte announces pricing of public offering of 4 945 000 shares of common stock Source text for Eikon: Further company coverage:,topStory
IOSP,Innospec Inc,20170908,BRIEF-Innospec announces establishment of wholly-owned enterprise in China ,* Innospec announces establishment of wholly-owned enterprise in China,topStory
NTEC,Intec Pharma Ltd,20170908,BRIEF-Acuta Capital Partners reports 10.5 pct passive stake in Intec Pharma ,* Acuta Capital Partners reports 10.5 pct passive stake in Intec Pharma Ltd as of Aug 31 - SEC filing Source text: (http://bit.ly/2gRgBs0) Further company coverage:,topStory
IBKR,Interactive Brokers Group Inc,20170908,BRIEF-Interactive Brokers plans to join Tel Aviv Stock Exchange as a remote member ,* Interactive Brokers Group Inc - ‍plans to join Tel Aviv Stock Exchange through its Interactive Brokers UK subsidiary as a remote member​ Source text for Eikon: Further company coverage:,topStory
INAP,Internap Corporation,20170908,BRIEF-Internap Corp expands Dallas Data Center to meet increased demand for services​ ,* Internap Corp - ‍announced a large-scale expansion at its Dallas Data Center  in order to meet an increased demand for services​ Source text for Eikon: Further company coverage:,topStory
KPTI,Karyopharm Therapeutics Inc,20170908,BRIEF-Karyopharm presents selinexor  KPT-9274 clinical data ,* Karyopharm announces presentation of selinexor and KPT-9274 clinical data at the European Society of Medical Oncology 2017 annual meeting,topStory
LAUR,Laureate Education Inc,20170908,BRIEF-Waddell & Reed Financial Inc reports 10.4 percent passive stake in Laureate Education Inc‍​ ,* Waddell & Reed Financial Inc reports 10.4 percent passive stake in Laureate Education Inc  as of August 31  2017 - SEC filing ‍​ Source text: (http://bit.ly/2eMbK71) Further company coverage:,topStory
LPTX,LEAP THERAPEUTICS INC,20170908,BRIEF-Leap Therapeutics announces collaboration with EORTC ,* Leap Therapeutics announces collaboration with EORTC to evaluate DKN-01 in combination with PD-l1 cancer immunotherapy and chemotherapy in esophagogastric and biliary tract cancers,topStory
LXRX,Lexicon Pharmaceuticals Inc,20170908,BRIEF-Lexicon Pharma reports positive pooled continuous glucose monitoring data ,* Lexicon Pharmaceuticals reports positive pooled continuous glucose monitoring data from pivotal phase 3 intandem1 and intandem2 studies of sotagliflozin,topStory
TAX,Liberty Tax Inc,20170908,BRIEF-Liberty Tax Service announces appointment of CEO ,* Says Ed Brunot appointed CEO Source text for Eikon: Further company coverage:,topStory
MARA,Marathon Patent Group Inc,20170908,BRIEF-Mark Groussman reports 9.99 pct passive stake in Marathon Patent Group ,* Mark Groussman reports 9.99 percent passive stake in Marathon Patent Group Inc ‍​as of September 7 - SEC filing Source: (http://bit.ly/2eSvQ37) Further company coverage:,topStory
MDLZ,Mondelez International Inc,20170908,Kellogg defeats Mondelez in cookie-packaging patent fight ,A federal appeals court on Thursday upheld the dismissal of a patent infringement case Mondelez International Inc brought against rival food company Kellogg Co.,topStory
NBIX,Neurocrine Biosciences Inc,20170908,BRIEF-Perceptive Advisors reports 5.3 pct passive stake in Neurocrine Biosciences ,* Perceptive Advisors LLC reports 5.3 percent passive stake in Neurocrine Biosciences Inc as of September 6  2017 - SEC filing‍​ Source: (http://bit.ly/2wOUVQY) Further company coverage:,topStory
OPTT,Ocean Power Technologies Inc,20170908,BRIEF-Ocean Power Technologies Q1 revenue $195 000 ,* Ocean power technologies announces results for the first quarter of fiscal year 2018 ended July 31  2017,topStory
PAYX,Paychex Inc,20170908,BRIEF-Paychex says CEO Martin Mucci's FY 2017 total compensation was $8.6 mln‍​ ,* Paychex Inc says CEO Martin Mucci's FY 2017 total compensation was $8.6 million versus $5.8 million in FY 2016 - sec filing‍​,topStory
PYPL,PayPal Holdings Inc,20170908,U.S. banks move to broaden reach of Zelle instant payments app ,NEW YORK  Sept 8 A consortium of U.S. banks is taking another step next week to attract a critical mass of users to their Zelle network  a rival to PayPal's Venmo for handling instant payments between individuals with smartphones.,normal
PBMD,Prima BioMed Ltd,20170908,BRIEF-Prima Biomed Prima secures Japanese patent grant for IMP731 antibody ,* Prima secures Japanese patent grant for imp731 antibody Source text for Eikon: Further company coverage:,topStory
QCOM,QUALCOMM Incorporated,20170908,Apple lawsuits against Qualcomm can proceed  U.S. judge rules ,Apple Inc's  11 foreign lawsuits against Qualcomm Inc  can proceed while the company's dispute plays out in the United States  a U.S. federal judge in San Diego ruled Sept. 7.,topStory
QCOM,QUALCOMM Incorporated,20170908,Apple lawsuits against Qualcomm can proceed  U.S. judge rules ,Sept 8 Apple Inc's 11 foreign lawsuits against Qualcomm Inc can proceed while the company's dispute plays out in the United States  a U.S. federal judge in San Diego ruled Sept. 7.,normal
REGN,Regeneron Pharmaceuticals Inc,20170908,Sanofi says Cemiplimab skin cancer treatment gets FDA "Breakthrough Designation" ,PARIS  Sept 8 Sanofi and Regeneron Pharmaceuticals said on Friday that the U.S. Food and Drug Administration (FDA) has granted "Breakthrough Therapy" designation status to their skin cancer treatment Cemiplimab.,topStory
REGN,Regeneron Pharmaceuticals Inc,20170908,BRIEF-Sanofi  Regeneron say Cemiplimab receives U.S. FDA breakthrough designation for advanced cutaneous squamous cell carcinoma ,* Sanofi  Regeneron: Cemiplimab receives FDA breakthrough designation for advanced cutaneous squamous cell carcinoma,normal
RTRX,Retrophin Inc,20170908,UPDATE 1-Martin Shkreli seeks to overturn part of his conviction ,NEW YORK  Sept 8 Former drug company executive Martin Shkreli on Friday asked a judge to throw out part of his criminal conviction  a day after prosecutors sought to have him jailed until his sentencing.,normal
RMTI,Rockwell Medical Inc,20170908,BRIEF-‍Richmond Brothers responds to Rockwell Medical's board appointment ,* ‍Richmond Brothers Inc issues statement in response to Rockwell Medical Inc's appointment of John Cooper to its board of directors​,topStory
STFC,State Auto Financial Corporation,20170908,State Auto considers sale of E&S insurance business ,Property and casualty insurer State Auto Financial Corp  said on Friday it was considering options for its excess and surplus lines business  including a sale.,topStory
STFC,State Auto Financial Corporation,20170908,UPDATE 1-State Auto considers sale of E&S insurance business ,Sept 8 Property and casualty insurer State Auto Financial Corp said on Friday it was considering options for its excess and surplus lines business  including a sale.,normal
STFC,State Auto Financial Corporation,20170908,P&C insurer State Auto considering sale of E&S business ,Sept 8 Property and casualty insurer State Auto Financial Corp said on Friday it was considering options  including a sale  for its Excess and Surplus (E&S) Lines business.,normal
STFC,State Auto Financial Corporation,20170908,BRIEF-State Auto reviews strategic alternatives for E&S business ,* State Auto Insurance Group announces review of strategic alternatives for its E&S business,normal
BANX,StoneCastle Financial Corp,20170908,BRIEF-Stonecastle Financial board increases quarterly cash distribution ,* Stonecastle Financial Corp - Board of directors increased quarterly cash distribution $0.01 to $0.38 per share for Q3 of 2017​ Source text for Eikon: Further company coverage:,topStory
SCMP,Sucampo Pharmaceuticals Inc,20170908,BRIEF-Sucampo Pharmaceuticals and Four Irvington Centre Associates enters into second amendment ,* Sucampo Pharmaceuticals - On Sept 5  2017  Co and Four Irvington Centre Associates  LLC entered into a second amendment to lease agreement- SEC filing,topStory
SYKE,Sykes Enterprises Incorporated,20170908,BRIEF-Clearlink acquires Portent Inc ,* Clearlink - Clearlink  a Sykes company  announced it acquired Portent Inc  a 22-year-old digital marketing agency Source text for Eikon: Further company coverage:,topStory
GT,The Goodyear Tire & Rubber Company,20170908,BRIEF-Goodyear to expand fleet management solution for semi-autonomous fleet ,* Goodyear announces intelligent tire trial  expands fleet management solution for semi-autonomous fleet Source text for Eikon: Further company coverage:,topStory
KHC,The Kraft Heinz Company,20170908,BRIEF-Kraft Heinz announces management changes ,* Kraft Heinz - ‍Appointed Paulo Basilio currently executive vice president and CFO  as zone president of United States business,topStory
KHC,The Kraft Heinz Company,20170908,Kraft Heinz names 3G Capital partner David Knopf as CFO ,Heinz ketchup maker Kraft Heinz Co  said on Friday 3G Capital partner David Knopf would replace Paulo Basilio as its chief financial officer  starting in October.,normal
KHC,The Kraft Heinz Company,20170908,Kraft Heinz names 3G Capital partner David Knopf as CFO ,Sept 8 Heinz ketchup maker Kraft Heinz Co said on Friday 3G Capital partner David Knopf would replace Paulo Basilio as its chief financial officer  starting in October.,normal
KHC,The Kraft Heinz Company,20170908,BRIEF-Kraft Heinz announces management changes ,* Kraft Heinz - ‍appointment of Paulo Basili currently executive vice president and chief financial officer  as zone president of United States business​,normal
USCR,U S Concrete Inc,20170908,BRIEF-U.S. Concrete hires John Kunz as CFO ,* U.S. Concrete Inc-  Kunz was most recently vice president  corporate controller and principal accounting officer of Tenneco Inc Source text for Eikon: Further company coverage:,topStory
VIA,Viacom Inc,20170908,UPDATE 1-Paramount has not received payment from Chinese studios -studio CEO ,Sept 8 Viacom Inc's  Paramount Pictures movie studio still has not received payments from the Chinese studios it entered into a financing deal with in January  Paramount Chief Executive Jim Gianopulos told investors on Friday.,topStory
VIA,Viacom Inc,20170908,Paramount still has not received payment from Chinese studio -studio CEO ,Sept 8 Viacom Inc's  Paramount Pictures movie studio still has not received payments from at least one of the Chinese studios it entered into a financing deal with in January  Paramount Chief Executive Jim Gianopulos told investors on Friday.,normal
VIAB,Viacom Inc,20170908,UPDATE 1-Paramount has not received payment from Chinese studios -studio CEO ,Sept 8 Viacom Inc's  Paramount Pictures movie studio still has not received payments from the Chinese studios it entered into a financing deal with in January  Paramount Chief Executive Jim Gianopulos told investors on Friday.,topStory
VIAB,Viacom Inc,20170908,Paramount still has not received payment from Chinese studio -studio CEO ,Sept 8 Viacom Inc's  Paramount Pictures movie studio still has not received payments from at least one of the Chinese studios it entered into a financing deal with in January  Paramount Chief Executive Jim Gianopulos told investors on Friday.,normal
WDC,Western Digital Corporation,20170908,Apple moves to ward Western Digital off control of Toshiba chips: sources ,TOKYO Apple Inc  has sought to stop Western Digital Corp  from taking control of Toshiba Corp's  chip business by threatening not to buy its products in the future  people with knowledge of the deal said.,topStory
WDC,Western Digital Corporation,20170908,UPDATE 2-Apple moves to ward Western Digital off control of Toshiba chips -sources ,* Toshiba seeking deal on chip unit sale by Wednesday (Recasts with Apple threat to stop buying chips),normal
WDC,Western Digital Corporation,20170908,Western Digital seeks Y50 bln from Apple to help finance Toshiba chip bid -Kyodo ,TOKYO  Sept 8 A group including Western Digital is seeking around 50 billion yen ($464 million) from Apple Inc to help finance a bid for Toshiba Corp's memory chip unit  Kyodo news agency reported on Friday.,normal
WLDN,Willdan Group Inc,20170908,BRIEF-Willdan awarded two $60 mln contracts with California's DGS ,* Willdan awarded two new $60 million contracts with California Department of General Services,topStory
Z,Zillow Group Inc,20170908,BRIEF-Zillow Group acquires New Home Feed ,* Zillow Group acquires New Home Feed Source text for Eikon: Further company coverage:,topStory
ZG,Zillow Group Inc,20170908,BRIEF-Zillow Group acquires New Home Feed ,* Zillow Group acquires New Home Feed Source text for Eikon: Further company coverage:,topStory
ABBV,AbbVie Inc,20170908,BRIEF-Abbvie Inc says sets quarterly cash dividend of $0.64/shr ,* Says ‍board of directors of Abbvie Inc declared a quarterly cash dividend of $0.64 per share​,topStory
ABM,ABM Industries Incorporated,20170908,BRIEF-ABM refinances existing credit agreement with secured credit facility of $900 mln ,* On September 1  co refinanced  replaced existing credit agreement dated November 30  2010 with new syndicated  senior secured credit facility​,topStory
