ANCX,Access National Corporation,20170421,BRIEF-ACCESS NATIONAL Q1 EARNINGS PER SHARE $0.13 ,* Q1 EARNINGS PER SHARE VIEW $0.39 -- THOMSON REUTERS I/B/E/S,topStory
ACRS,Aclaris Therapeutics Inc,20170421,BRIEF-Aclaris Therapeutics says sold 635 000 shares of stock for $31.50/shr ,* Aclaris Therapeutics-sold 635 000 shares of its stock at a weighted average price per share of $31.50  for aggregate gross proceeds of about $20.0 million,topStory
ATVI,Activision Blizzard Inc,20170421,BRIEF-Activision Blizzard CEO's 2016 compensation was $33.1 mln ,* Activision Blizzard Inc - CEO Robert A. Kotick's 2016 total compensation was $33.1 million which includes stock awards of $24.9 million,topStory
ADMP,Adamis Pharmaceuticals Corporation,20170421,BRIEF-Adamis Pharmaceuticals announces pricing of public offering of common stock ,* Adamis Pharmaceuticals announces pricing of public offering of common stock,topStory
AMMA,Alliance MMA Inc,20170421,BRIEF-Alliance MMA says intends to defend against the lawsuit filed by shareholders ,* Alliance MMA-shareholder has filed a lawsuit against company and two of its current officers in united states district court for district of new jersey,topStory
AMZN,Amazoncom Inc,20170421,BRIEF-Amazon to create over 2 500 full-time jobs in New Jersey ,* Amazon to create more than 2 500 full-time jobs at three additional New Jersey fulfillment centers,topStory
ABCB,Ameris Bancorp,20170421,BRIEF-Ameris Bancorp Q1 earnings per share $0.59 ,* Ameris Bancorp announces 20% increase in operating results for first quarter 2017,topStory
APRI,Apricus Biosciences Inc,20170421,CORRECTED-BRIEF-Apricus Biosciences sees offering of up to 5 mln units (April 20) ,* Now sees offering of up to 5 million units consisting of one share of common stock and warrant,topStory
ATRA,Atara Biotherapeutics Inc,20170421,BRIEF-Bridger Management Llc reports a 5.2 pct passive stake in Atara Biotherapeutics ,* Bridger Management Llc reports a 5.2 percent passive stake in Atara Biotherapeutics inc as of april 11 - sec filing Source text - http://bit.ly/2p0x8JW Further company coverage:,topStory
ATRA,Atara Biotherapeutics Inc,20170421,BRIEF-Atara bio announces collaboration with Merck ,* Atara Bio announces collaboration with Merck to evaluate keytruda (pembrolizumab) in combination with ATA129 in nasopharyngeal carcinoma (NPC),normal
AFH,Atlas Financial Holdings Inc,20170421,BRIEF-Atlas Financial Holdings Prices $25 mln of senior notes ,* Atlas Financial Holdings  Inc. Prices $25.0 million of senior notes,topStory
AFHBL,Atlas Financial Holdings Inc,20170421,BRIEF-Atlas Financial Holdings Prices $25 mln of senior notes ,* Atlas Financial Holdings  Inc. Prices $25.0 million of senior notes,topStory
BOTJ,Bank of the James Financial Group Inc,20170421,BRIEF-BANK OF THE JAMES Q1 EARNINGS PER SHARE $0.17 ,* BANK OF THE JAMES ANNOUNCES FIRST QUARTER 2017 FINANCIAL RESULTS AND DECLARATION OF DIVIDEND,topStory
BEBE,bebe stores inc,20170421,Struggling apparel retailer Bebe to shut all stores ,Struggling apparel retailer Bebe Stores Inc  said on Friday it would close all its stores by the end of May  barely a month after announcing it was exploring strategic alternatives following four years of losses. | Video ,topStory
BEBE,bebe stores inc,20170421,Struggling apparel retailer Bebe Stores to shut all stores ,Struggling apparel retailer Bebe Stores Inc said on Friday it would close all its stores by the end of May  barely a month after announcing it was exploring strategic alternatives following four years of losses.,normal
BEBE,bebe stores inc,20170421,UPDATE 3-Struggling apparel retailer Bebe to shut all stores ,* To liquidate merchandise and store fixtures (Adds lawyers' comments),normal
BEBE,bebe stores inc,20170421,Apparel retailer Bebe Stores says to shut all stores ,April 21 Struggling apparel retailer Bebe Stores Inc said it will close all its stores by the end of May  barely a month after announcing it was exploring strategic alternatives.,normal
BEBE,bebe stores inc,20170421,BRIEF-Bebe Stores entered into consulting agreement to sell all merchandise and inventory owned by company  certain units in existing retail stores ,* Bebe Stores-On April 18 entered into consulting agreement to  sell all merchandise and inventory owned by co  certain units in existing retail stores,normal
BGNE,BeiGene Ltd,20170421,BRIEF-BEIGENE INITIATES FIRST PIVOTAL STUDY IN CHINA OF PD-1 ANTIBODY BGB-A317 ,* BEIGENE ANNOUNCES INITIATION OF FIRST PIVOTAL STUDY IN CHINA OF PD-1 ANTIBODY BGB-A317,topStory
BNCL,Beneficial Bancorp Inc,20170421,BRIEF-BENEFICIAL BANCORP Q1 EARNINGS PER SHARE $0.11 ,* BENEFICIAL BANCORP  INC. ANNOUNCES FIRST QUARTER RESULTS AND CASH DIVIDEND TO SHAREHOLDERS,topStory
BIIB,Biogen Inc,20170421,BRIEF-EU Medicines Agency recommendations for April 2017 ,* EU Medicines Agency recommends approval granting of a marketing authorisation for Sandoz's Rixathon Non-Hodgkin's Lymphoma (NHL)  chronic lymphocytic leukaemia,topStory
BLUE,bluebird bio Inc,20170421,BRIEF-Bluebird Bio CEO's 2016 compensation was $4.9 mln ,* CEO Nick Leschly's 2016 total compensation was $4.9 million versus $11.2 million in 2015 - sec filing Source text - http://bit.ly/2pmsOYK Further company coverage:,topStory
CBF,Capital Bank Financial Corp,20170421,BRIEF-Capital Bank Financial reports Q1 GAAP earnings per share $0.39 ,* Q1 earnings per share view $0.44 -- Thomson Reuters I/B/E/S,topStory
CDNA,CareDx Inc,20170421,BRIEF-CareDx appoints Michael Bell chief financial officer ,* CareDx Inc -  constanti will remain with company until june 30th to facilitate a smooth transition Source text for Eikon: Further company coverage:,topStory
CDNA,CareDx Inc,20170421,BRIEF-CareDx reports Q4 loss per share $0.73 ,* CareDx Inc - for full year 2017  company continues to expect revenue to be in range of $45 million to $50 million  excluding any potential allosure revenue,normal
DRNA,Dicerna Pharmaceuticals Inc,20170421,BRIEF-Cormorant Asset Management reports 9.99 pct passive stake in Dicerna Pharmaceuticals ,* Cormorant Asset Management llc reports 9.99 percent passive stake in Dicerna Pharmaceuticals inc as of april 11  2017 - sec filing Source text - http://bit.ly/2p0do9r Further company coverage:,topStory
EIGR,Eiger BioPharmaceuticals Inc,20170421,BRIEF-Eiger announces additional phase 2 clinical trial results ,* Eiger announces additional phase 2 clinical trial results for lonafarnib at the international liver congress 2017,topStory
ENTA,Enanta Pharmaceuticals Inc,20170421,BRIEF-Enanta announces eight weeks of treatment with Abbvie's investigational drug achieved high SVR rates in challenging-to-treat genotype 3 chronic HCV patients ,* Enanta announces eight weeks of treatment with Abbvie's investigational  pan-genotypic  ribavirin-free HCV regimen of glecaprevir/pibrentasvir (g/p) achieved high SVR rates in challenging-to-treat genotype 3 chronic HCV patients,topStory
EQIX,Equinix Inc,20170421,BRIEF-Equinix CEO's 2016 compensation was $12 mln ,* CEO Stephen Smith's 2016 total compensation was $12 million versus $11.1 million in 2015 - sec filing,topStory
ETSY,Etsy Inc,20170421,BRIEF-Etsy CEO's 2016 compensation was $1.8 mln vs $2.7 mln in 2015 ,* CEO Chad Dickerson 2016 total compensation was $1.8 million versus $2.7 million in 2015 Source text - http://bit.ly/2oStmUz Further company coverage:,topStory
EYEG,Eyegate Pharmaceuticals Inc,20170421,BRIEF-EyeGate Pharmaceuticals files for common stock offering ,* EyeGate Pharmaceuticals Inc files for common stock offering of up to $11.5 million - sec filing Source text: (http://bit.ly/2q0nCWB) Further company coverage:,topStory
GNTX,Gentex Corporation,20170421,BRIEF-GENTEX Q1 EARNINGS PER SHARE $0.33 ,* Q1 EARNINGS PER SHARE VIEW $0.31 -- THOMSON REUTERS I/B/E/S,topStory
GILD,Gilead Sciences Inc,20170421,BRIEF-Gilead announces results from 2 Phase 2 studies evaluating Harvoni tablets in chronic hepatitis C infected patient populations ,* Results from 2 Phase 2 studies evaluating Harvoni tablets in chronic hepatitis C infected patient populations,topStory
GOGO,Gogo Inc,20170421,BRIEF-Barry Rowan to join GOGO as CFO ,* Says Rowan will assume position of chief financial officer (CFO) on May 4  2017 following company's Q1 earnings report Source text for Eikon: Further company coverage:,topStory
GCBC,Greene County Bancorp Inc,20170421,BRIEF-Greene County Bancorp reports 25 pct increase in net income for the nine months ended March 31 ,* Greene County Bancorp  Inc. reports 25% increase in net income for the nine months ended March 31  2017,topStory
HTLD,Heartland Express Inc,20170421,BRIEF-Heartland Express reports Q1 EPS $0.17 ,* Reports revenues and earnings for the first quarter of 2017,topStory
INCY,Incyte Corporation,20170421,EMA panel recommends nod for Sanofi  Regeneron's arthritis drug ,April 21 A European Medicines Agency panel said on Friday it recommended granting marketing approval to Sanofi and Regeneron's experimental drug to treat rheumatoid arthritis.,normal
IONS,Ionis Pharmaceuticals Inc,20170421,BRIEF-Ionis Pharmaceuticals files for potential stock shelf offering ,* Files for potential stock shelf offering; amount undisclosed Source text for Eikon: Further company coverage:,topStory
FSTR,LB Foster Company,20170421,BRIEF-L.B. Foster says Christopher Scanlon to perform as CFO until permanent CFO appointed - SEC filing ,* In connection with David Russo's departure as CFO on March 29  Christopher Scanlon will be performing as CFO until permanent CFO is appointed Source text: (http://bit.ly/2oy19iD) Further company coverage:,topStory
LXRX,Lexicon Pharmaceuticals Inc,20170421,BRIEF-Lexicon Pharmaceuticals enters into sixth amendment to loan and security agreement ,* Lexicon Pharmaceuticals-on April 20  units entered into sixth amendment to loan and security agreement and to other loan documents with istar lex lender,topStory
LTBR,Lightbridge Corporation,20170421,BRIEF-General International Holdings reports 9.8 pct stake in Lightbridge ,* General International Holdings  Inc reports 9.8 percent stake in Lightbridge Corp as of  August 2  2016 - sec filing Source text - http://bit.ly/2p4KOWC Further company coverage:,topStory
MAT,Mattel Inc,20170421,Mattel cuts sales forecast after inventory overhang slams results ,Mattel Inc  reported a far bigger-than-expected quarterly loss and drop in sales on Thursday  hurt by poor demand by retailers for key brands Barbie and Fisher-Price and due to big discounts to move inventory left after weak holiday sales. | Video ,topStory
MDVX,Medovex Corp,20170421,BRIEF-Medovex files for mixed shelf offering of up to $20 mln - SEC filing ,* Medovex Corp files for mixed shelf offering of up to $20 million - SEC filing Source text (http://bit.ly/2oShGRW) Further company coverage:,topStory
NFLX,Netflix Inc,20170421,PRESS DIGEST- British Business - April 21 ,April 21 The following are the top stories on the business pages of British newspapers. Reuters has not verified these stories and does not vouch for their accuracy.,normal
ODP,Office Depot Inc,20170421,BRIEF-Fairpointe Capital LLC reports 6.4 pct passive stake in Office Depot Inc ,* Fairpointe Capital LLC reports 6.4 percent passive stake in Office Depot Inc as on March 31  2017 - SEC Filing Source text (http://bit.ly/2pmzp5y) Further company coverage:,topStory
ONTX,Onconova Therapeutics Inc,20170421,BRIEF-ONCONOVA THERAPEUTICS PRICES PUBLIC OFFERING OF COMMON STOCK AT $2.10/SHARE ,* ONCONOVA THERAPEUTICS ANNOUNCES PRICING OF PUBLIC OFFERING OF COMMON STOCK,topStory
QCOM,QUALCOMM Incorporated,20170421,Tech companies urge Trump to continue FTC case against Qualcomm ,A coalition of technology companies including Samsung Electronics Co and Intel Corp have urged President Donald Trump not to interfere with an Obama administration antitrust case against Qualcomm Inc over its patent licensing practices.,topStory
REGN,Regeneron Pharmaceuticals Inc,20170421,BRIEF-EU Medicines Agency recommendations for April 2017 ,* EU Medicines Agency recommends approval granting of a marketing authorisation for Sandoz's Rixathon Non-Hodgkin's Lymphoma (NHL)  chronic lymphocytic leukaemia,topStory
REGN,Regeneron Pharmaceuticals Inc,20170421,EMA panel recommends nod for Sanofi  Regeneron's arthritis drug ,April 21 A European Medicines Agency panel said on Friday it recommended granting marketing approval to Sanofi and Regeneron's experimental drug to treat rheumatoid arthritis.,normal
RGNX,REGENXBIO Inc,20170421,BRIEF-Adverum Biotechnologies says delivered notice to Regenxbio ,* Adverum Biotechnologies - on april 19  co delivered a notice to Regenxbio Inc to terminate license agreement dated october 20  2015 - sec filing,topStory
RMTI,Rockwell Medical Inc,20170421,BRIEF-Richmond Bros. and Mark H. Ravich send letter to Rockwell Medical Shareholders ,* Richmond Brothers and Mark H. Ravich send letter to Rockwell Medical Inc Shareholders Source text for Eikon: Further company coverage:,topStory
SBGI,Sinclair Broadcast Group Inc,20170421,BRIEF-Sinclair Broadcast Group announces agreement to purchase Bonten Media tv stations ,* Sinclair broadcast group announces agreement to purchase Bonten Media Group tv stations,topStory
SSB,South State Corporation,20170421,BRIEF-SOUTH STATE CORP Q1 EARNINGS PER SHARE $0.63 ,* SOUTH STATE CORPORATION REPORTS FIRST QUARTER 2017 RESULTS AND QUARTERLY CASH DIVIDEND,topStory
SBUX,Starbucks Corporation,20170421,Starbucks' Unicorn Frappuccino sparks backlash from baristas ,NEW YORK Starbucks baristas have taken to social media to complain about  the coffee chain's entry into the latest food craze: Unicorn Frappuccino.,topStory
SBUX,Starbucks Corporation,20170421,UPDATE 1-Starbucks' Unicorn Frappuccino sparks backlash from baristas ,NEW YORK  April 21 Starbucks baristas have taken to social media to complain about  the coffee chain's entry into the latest food craze: Unicorn Frappuccino.,normal
SBUX,Starbucks Corporation,20170421,REFILE -Starbucks Unicorn Frappuccino sparks backlash from baristas ,NEW YORK  April 21 Starbucks baristas have taken to social media to complain about  the coffee chain's entry into the latest food craze: Unicorn Frappuccino.,normal
SYRS,Syros Pharmaceuticals Inc,20170421,BRIEF-Syros announces $35 mln private placement ,* Syros Pharmaceuticals Inc - private placement of 2.6 million shares of common stock at a purchase price of $13.50 per share,topStory
AMTD,TD Ameritrade Holding Corporation,20170421,BRIEF-TD Ameritrade Holding says entered into a credit agreement with lenders ,* TD Ameritrade Holding Corp - on April 21  2017  co entered into a credit agreement with lenders - sec filing,topStory
TSLA,Tesla Inc ,20170421,Elon Musk on mission to link human brains with computers in four years: report ,Tesla Inc  founder and Chief Executive Elon Musk said his latest company Neuralink Corp is working to link the human brain with a machine interface by creating micron-sized devices.,topStory
TSLA,Tesla Inc ,20170421,Elon Musk on mission to link human brains with computers in 4 yrs -report ,April 21 Tesla Inc founder and Chief Executive Elon Musk said his latest company Neuralink Corp is working to link the human brain with a machine interface by creating micron-sized devices.,normal
TPIC,TPI Composites Inc,20170421,BRIEF-TPI Composites files for offering of up to $100 mln ,* TPI Composites files for common stock offering of up to $100 million  being offered by selling stockholders  which include certain of co's executive officers Source text - http://bit.ly/2p4Gdnk Further company coverage:,topStory
TRST,TrustCo Bank Corp NY,20170421,BRIEF-Trustco Q1 earnings per share $0.114 ,* Trustco Bank Corp N Y says  q1 return on average assets (roa) of 0.91 pct compared to 0.89 pct in Q1 of 2016,topStory
USEG,US Energy Corp,20170421,Australian court dismisses Chevron appeal in landmark tax case ,MELBOURNE Chevron Corp lost an appeal on Friday against the Australian tax office in a landmark case in which the U.S. energy giant contested a tax bill of A$340 million ($260 million)  including penalties and interest.,topStory
UCBI,United Community Banks Inc,20170421,BRIEF-United Community Banks deal provides termination fee $2 million be payable by HCSB upon termination of merger ,* Deal provides termination fee $2 million be payable by HCSB upon termination of merger under certain circumstances - SEC filing Source text for Eikon: Further company coverage:,topStory
VALU,Value Line Inc,20170421,BRIEF-Value Line announces a 5.88 pct increase in quarterly dividend ,* Value Line Inc announces a 5.88 pct increase in its quarterly cash dividend to $0.18 per common share and reaffirms share buyback program,topStory
VIA,Viacom Inc,20170421,BRIEF-Viacom names Julia Phelps Senior Vice President  Communications & Culture ,* Viacom names Julia Phelps senior vice president  communications & culture,topStory
VIAB,Viacom Inc,20170421,BRIEF-Viacom names Julia Phelps Senior Vice President  Communications & Culture ,* Viacom names Julia Phelps senior vice president  communications & culture,topStory
VRAY,ViewRay Inc,20170421,BRIEF-Viewray files for mixed shelf of up to $100 mln ,* Viewray Inc files for mixed shelf of up to $100 million - sec filing Source text: (http://bit.ly/2od3BQd) Further company coverage:,topStory
VIRT,Virtu Financial Inc,20170421,BRIEF-KCG holdings says Virtu Financial must pay co fee of $45 mln in case of deal termination ,* KCG Holdings - in certain circumstances in connection with termination of deal with Virtu Financial  co must pay virtu termination fee of $45 million Source text - http://bit.ly/2p4LpHG Further company coverage:,topStory
VIRT,Virtu Financial Inc,20170421,BRIEF-Virtu Financial  in connection with termination of merger  KCG must pay termination fee of $45 mln ,* Virtu Financial - in certain circumstances in connection with termination of merger agreement  KCG Holdings must pay to co termination fee of $45 million Source text for Eikon: (http://bit.ly/2p2zSJ4) Further company coverage:,normal
WBA,Walgreens Boots Alliance Inc,20170421,Walgreens to pay $9.86 million to resolve false billing claims ,Walgreens Boots Alliance has agreed to pay $9.86 million to resolve allegations that it billed California's Medicaid program for claims in which it falsely certified drugs had been properly prescribed for particular diagnoses.,topStory
WLTW,Willis Towers Watson Public Limited Company,20170421,MOVES-Willis Towers names Joe Peiser head of broking  North America ,April 21 Advisory and broking firm Willis Towers Watson Plc named Joe Peiser head of broking  North America.,topStory
XOMA,XOMA Corporation,20170421,BRIEF-Xoma receieves notice to terminate license agreement from Novo Nordisk ,* Xoma -on april 20  2017 co received notice from Novo Nordisk a/s  relating to termination of exclusive license agreement with co due to strategic and business reasons,topStory
ABB,ABB Ltd,20170421,ABB  Schneider Electric bid for General Electric unit: sources ,European engineering groups ABB Ltd  and Schneider Electric SE  are competing for General Electric Co's  industrial solutions division  which could fetch as much as $3 billion  according to people familiar with the matter.,topStory
ABB,ABB Ltd,20170421,ABB  Schneider Electric bid for General Electric unit -sources ,April 21 European engineering groups ABB Ltd and Schneider Electric SE are competing for General Electric Co's industrial solutions division  which could fetch as much as $3 billion  according to people familiar with the matter.,normal
ABBV,AbbVie Inc,20170421,BRIEF-Enanta announces eight weeks of treatment with Abbvie's investigational drug achieved high SVR rates in challenging-to-treat genotype 3 chronic HCV patients ,* Enanta announces eight weeks of treatment with Abbvie's investigational  pan-genotypic  ribavirin-free HCV regimen of glecaprevir/pibrentasvir (g/p) achieved high SVR rates in challenging-to-treat genotype 3 chronic HCV patients,topStory
BABA,Alibaba Group Holding Limited,20170421,UPDATE 2-Netmarble Games raises $2.3 bln in S.Korea's second-biggest IPO ,* S.Korea's biggest mobile games maker prices IPO at top of range,normal
ADS,Alliance Data Systems Corporation,20170421,BRIEF-Alliance Data Systems CEO's 2016 compensation was $7.8 mln ,* CEO Edward Heffernan's 2016 total compensation was $7.8 million versus $8.7 million in 2015 - sec filing Source text - http://bit.ly/2ocTgnu Further company coverage:,topStory
AWK,American Water Works,20170421,BRIEF-AMERICAN WATER SETS QUARTERLY CASH DIVIDEND OF $0.415/SHARE ,* AMERICAN WATER INCREASES QUARTERLY DIVIDEND BY 10.7 PERCENT,topStory
AON,Aon plc,20170421,UPDATE 3-Britain investigates five insurance brokers over aviation business ,* Probe is one of the first of its kind by FCA (Updates number of brokers  adds UIB statement  potential sanction),topStory
ARNC,Arconic Inc,20170421,Fitch: Arconic/Elliot Proxy Battle Underscores Activism Trend ,(The following statement was released by the rating agency) NEW YORK  April 21 (Fitch) Elliott Management's proxy battle with Arconic  Inc.  the parts manufacturer formed from the 2016 breakup of Alcoa  Inc.  could evolve into one of the most notable examples of shareholder activism this year  according to Fitch Ratings. U.S. corporations have become increasingly inclined to enter into amicable settlements with dissident investors in lieu of drawn-out proxy battles due to the time and costs invo,topStory
BBVA,Banco Bilbao Viscaya Argentaria SA,20170421,Fitch Plans to Withdraw Ratings on Banco Bilbao Vizcaya Argentaria S.A.  Taipei Branch ,(The following statement was released by the rating agency) TAIPEI  April 21 (Fitch) Fitch Ratings plans to withdraw the ratings on Banco Bilbao Vizcaya Argentaria S.A.  Taipei Branch on or about 17 May 2017 for commercial reasons. Fitch currently rates Banco Bilbao Vizcaya Argentaria S.A.  Taipei Branch as follows: --National Long-Term Rating at 'AA(twn)'; Outlook Stable --National Short-Term Rating 'F1+(twn)' Fitch reserves the right in its sole discretion to withdraw or maintain any rating at,topStory
ABX,Barrick Gold Corporation,20170421,Argentina mulls $500 million safety plan for Barrick's Veladero mine ,BUENOS AIRES Barrick Gold Corp and its new Chinese partner presented a $500 million plan on Friday to make safety and environmental improvements to the Veladero gold mine in Argentina after a third cyanide spill in 18 months  a company executive said.,topStory
ABX,Barrick Gold Corporation,20170421,UPDATE 3-Argentina mulls $500 mln safety plan for Barrick's Veladero mine ,BUENOS AIRES  April 21 Barrick Gold Corp and its new Chinese partner presented a $500 million plan on Friday to make safety and environmental improvements to the Veladero gold mine in Argentina after a third cyanide spill in 18 months  a company executive said.,normal
BP,BP plc,20170421,BRIEF-Fitch affirms BP at 'A'  outlook stable ,* Fitch affirms BP at 'A'  outlook stable Source text for Eikon: Further company coverage:,topStory
BP,BP plc,20170421,CANADA STOCKS-TSX flat as SNC-Lavalin gains  miners weigh ,TORONTO  April 21 Canada's main stock index was nearly unchanged on Friday as SNC-Lavalin rose on an acquisition move and Home Capital Group recouped steep losses  while some miners and energy stocks weighed.,normal
BP,BP plc,20170421,UPDATE 1-UK Stocks-Factors to watch on April 21 ,April 21 Britain's FTSE 100 index is seen opening up 7 points on Friday  according to financial bookmakers  with futures up 0.05 percent ahead of the cash market open.,normal
BP,BP plc,20170421,UK Stocks-Factors to watch on April 21 ,    April 21 Britain's FTSE 100 index is seen opening up 7 points on Friday  according to financial bookmakers.          * DIAGEO: Alcoholic drinks giant Diageo plans to cut roughly 100 jobs in Scotland  at a time when Britain's workforce is facing uncertainty over the nation's impending exit from the European Union.     * SHELL: Canada's federal government wants to delay the implementation of its new methane regulations by up to three years to 2020 and expects to fully implement it ,normal
BMY,Bristol-Myers Squibb Company,20170421,BRIEF-Bristol-Myers gets positive CHMP opinion recommending approval of Opdivo for treatment of a type of bladder cancer ,* Bristol-Myers Squibb receives positive CHMP opinion recommending approval of Opdivo (Nivolumab) for the treatment of patients with previously treated locally advanced or metastatic urothelial carcinoma  a type of bladder cancer,topStory
BAM,Brookfield Asset Management Inc,20170421,BRIEF-SunEdison Shareholder Group opposes proposed yieldco sale to Brookfield Asset Management ,* SunEdison Shareholder Group: SunEdison equity shareholders needed to help stop fire sale of assets and total loss of investments,topStory
BT,BT Group plc,20170421,Exclusive: BT files criminal complaint over Italy accounting scandal ,MILAN British Telecom  has filed a criminal complaint with Italian prosecutors over an accounting scandal at its Italian unit and has handed them computer records and also dispatched its head of compliance to Milan to give evidence.,topStory
CVX,Chevron Corporation,20170421,DEALTALK-Canada's oil sands acquisition pool dwindles as global firms flee ,CALGARY  Alberta/TORONTO April 21 As international energy companies retreat from the Canadian oil sands sector because of depressed oil prices  a fast-shrinking universe of potential buyers may leave some stranded in the high-cost  capital-intensive sector.,normal
CHL,China Mobile (Hong Kong) Ltd,20170421,China Mobile  others approached for buying into Singapore telco M1: sources ,SINGAPORE Top shareholders in Singapore telecoms company M1 Ltd  have approached potential buyers China Mobile  and global private equity firms  among others  to sell their combined majority stake in the firm  sources familiar with the matter said.,topStory
