ATV,Acorn International Inc,20170908,BRIEF-Acorn International reports Q2 revenue $4.6 million  up 20.5 percent ,* Acorn International reports financial results for the second quarter and first half of 2017,topStory
AGN,Allergan plc,20170908,Allergan pays Mohawk Tribe to protect patents from challenges ,Allergan Plc will transfer to the Saint Regis Mohawk Tribe the rights to its blockbuster Restasis dry-eye treatment  the drugmaker said on Friday  in an unusual deal to protect it from patent challenges.,topStory
AGN,Allergan plc,20170908,UPDATE 1-Allergan pays Mohawk Tribe to protect patents from challenges ,Sept 8 Allergan Plc will transfer to the Saint Regis Mohawk Tribe the rights to its blockbuster Restasis dry-eye treatment  the drugmaker said on Friday  in an unusual deal to protect it from patent challenges.,normal
AGN,Allergan plc,20170908,Allergan pays Mohawk Tribe to protect patents from challenges ,Sept 8 Allergan Plc will transfer to the Saint Regis Mohawk Tribe rights to its blockbuster Restasis dry-eye treatment  the drugmaker said on Friday  in an unusual deal to protect it from patent challenges.,normal
AGN,Allergan plc,20170908,BRIEF-Allergan and Saint Regis Mohawk Tribe announce agreements regarding RESTASIS patents ,* Allergan and Saint Regis Mohawk Tribe announce agreements regarding restasis® patents,normal
AGN,Allergan plc,20170908,BRIEF-Allergan USA files suits against Imprimis  Prescriber's Choice and Sincerus Florida ,* Allergan files suits against Imprimis Pharmaceuticals  Inc.  Prescriber's Choice  Inc.  and Sincerus Florida  LLC,normal
ALE,Allete Inc,20170908,BRIEF-Allete subsidiary U.S. Water acquires Tonka Water ,* Allete subsidiary U.S. Water acquires Tonka Water  a minnesota-based supplier of water treatment systems Source text for Eikon: Further company coverage:,topStory
ADS,Alliance Data Systems Corporation,20170908,New York City comptroller wields new clout in boardroom diversity drive ,BOSTON  Sept 8 New York City Comptroller Scott Stringer is wielding more clout as he presses more than 150 U.S. companies to detail plans to diversify their boardrooms.,normal
ATUS,Altice USA Inc,20170908,BRIEF-Nanoco signs license deal with a U.S. medical devices group ,* ‍HAS SIGNED A COMMERCIAL SUPPLY AND LICENSE AGREEMENT WITH A US CORPORATION IN FIELD OF MEDICAL DEVICES​,topStory
AXP,American Express Company,20170908,Fitch Affirms American Express at 'A/F1'; Outlook Revised to Stable ,(The following statement was released by the rating agency) NEW YORK  September 08 (Fitch) Fitch Ratings has affirmed American Express Company's (AXP) Long-Term Issuer Default Rating (IDR) at 'A'  Viability Rating (VR) at 'a' and Short-Term IDR at 'F1'. The Rating Outlook has been revised to Stable from Negative. A full list of ratings follows at the end of this release. Today's rating actions have been taken as part of Fitch's periodic peer review of U.S. consumer lending-focused internet banks,topStory
AWI,Armstrong World Industries Inc,20170908,BRIEF-Armstrong World Industries says believes Roxul USA Inc allegations are "simply without merit​" ,* Armstrong World Industries Inc - ‍on September 8  co issued statement in response to litigation filed against it by Roxul USA Inc.​,topStory
ASB,Associated Banc-Corp,20170908,BRIEF-Associated Banc-Corp to acquire Whitnell & Co. ,* Associated Banc-Corp to acquire wealth management family services firm Whitnell & Co.,topStory
AZN,Astrazeneca PLC,20170908,AstraZeneca rebuilds cancer drug hopes with new lung data ,MADRID  Sept 9 Two AstraZeneca drugs tackling lung cancer in different ways delivered encouraging results on Saturday  helping the British group offset July's big clinical trial setback in the disease.,topStory
T,AT&T Inc,20170908,BRIEF-AT&T  Sprint  T-Mobile and Verizon team up to develop mobile authentication solution ,* Says co  Sprint  T-Mobile and Verizon are joining forces to create a mobile authentication taskforce​,topStory
AN,AutoNation Inc,20170908,BRIEF-AutoNation CEO on CNBC says "probably lost 5-6 pct of inventory" in Houston ,* AutoNation CEO Mike Jackson on CNBC says "probably lost 5-6 percent of inventory" in Houston,topStory
AGR,Avangrid Inc,20170908,TransCanada may abandon Energy East pipe facing tougher review ,CALGARY  Alberta TransCanada Corp  seeks to suspend the application for its Energy East pipeline for 30 days and may abandon the project  the company said on Thursday  weeks after Canada's National Energy Board (NEB) announced a tougher review process.,topStory
AGR,Avangrid Inc,20170908,UPDATE 3-TransCanada may abandon Energy East pipe facing tougher review ,CALGARY  Alberta  Sept 7 TransCanada Corp seeks to suspend the application for its Energy East pipeline for 30 days and may abandon the project  the company said on Thursday  weeks after Canada's National Energy Board (NEB) announced a tougher review process.,normal
AVA,Avista Corporation,20170908,BRIEF-Avista announces change in its officer team ,* Avista announces change in its officer team Source text for Eikon: Further company coverage:,topStory
BW,Babcock,20170908,BRIEF-Lonestar Capital Management LLC reports 7.4 pct passive stake in Babcock & Wilcox Enterprises Inc ‍​as of Sept. 5 - SEC filing ,* Lonestar Capital Management Llc reports 7.4 percent passive stake in Babcock & Wilcox Enterprises Inc ‍​as of September 5 - SEC filing Source text - (http://bit.ly/2wdSohC) Further company coverage:,topStory
BMI,Badger Meter Inc,20170908,BRIEF-Kenneth Bockhorst appointed chief operating officer of Badger Meter ,* Kenneth Bockhorst appointed chief operating officer of Badger Meter,topStory
BHGE,Baker Hughes a GE company,20170908,BRIEF-Baker Hughes  A GE Company announces August 2017 rig counts ,* Baker Hughes  A GE Company announces August 2017 rig counts,topStory
BXE,Bellatrix Exploration Ltd,20170908,BRIEF-Polar Asset Management Partners reports 10.06 pct passive stake in Bellatrix Exploration ,* Polar Asset Management Partners reports 10.06 pct passive stake in Bellatrix Exploration Ltd as of Aug 31 - SEC filing Source text: (http://bit.ly/2jafaph) Further company coverage:,topStory
BGCA,BGC Partners Inc,20170908,BRIEF-Bgc Partners Inc Says drew $400 mln under revolving credit facility and $575 mln under term loan facility​ ,* Bgc Partners Inc - ‍on september 8  2017  company drew $400 million under revolving credit facility and $575 million under term loan facility​ Source text for Eikon: Further company coverage:,topStory
BIOA,BioAmber Inc,20170908,BRIEF-NN Group N.V. reports 15.91 pct passive stake in Bioamber ,* NN Group N.V. reports 15.91 percent passive stake in Bioamber Inc as of Aug 31 - SEC filing‍​ Source text: [http://bit.ly/2wNus9e] Further company coverage:,topStory
BLK,BlackRock Inc,20170908,CalPERS in talks with BlackRock to outsource private equity business: source ,The California Public Employees' Retirement System (CalPERS) is in talks to outsource its private equity business to BlackRock Inc   according to a person familiar with the matter.,topStory
BLK,BlackRock Inc,20170908,UPDATE 1-CalPERS in talks with BlackRock to outsource private equity business -source ,Sept 7 The California Public Employees' Retirement System (CalPERS) is in talks to outsource its private equity business to BlackRock Inc  according to a person familiar with the matter.,normal
APRN,Blue Apron Holdings Inc,20170908,BRIEF-Capital World Investors​ dissolves its share stake in Blue Apron Holdings ,* Capital World Investors​ dissolves its share stake in Blue Apron Holdings Inc as of Aug 31 versus 12.9 percent passive stake as of June 30 - SEC filing Source text: (http://bit.ly/2wP6FoB) Further company coverage:,topStory
BP,BP plc,20170908,Exclusive: BP's stake in giant Azeri oilfields set to fall: sources ,TBILISI/BAKU BP's stake in Azerbaijan's vast oilfields is expected to shrink under a new production-sharing agreement with state energy company SOCAR  two industry sources familiar with the talks told Reuters.,topStory
BP,BP plc,20170908,Azerbaijan's SOCAR to boost its share in new deal with BP on oil fields ,TBILISI/BAKU  Sept 8 Azeri state energy company SOCAR is expected to increase its share in a new production sharing agreement with oil major BP for development of the country's biggest oilfields  two industry sources familiar with the content of talks on the deal told Reuters.,normal
BGG,Briggs & Stratton Corporation,20170908,BRIEF-Briggs & Stratton Corp says CEO T.J. Teske's total compensation for 2017 $3.2 mln ,* Briggs & Stratton Corp says CEO T.J. Teske's total compensation for 2017 $3.2 million versus $5.9 million last year - sec filing‍​ Source text (http://bit.ly/2gRhTTJ) Further company coverage:,topStory
BC,Brunswick Corporation,20170908,Fitch Affirms Brunswick's IDR at 'BBB'; Outlook Stable ,(The following statement was released by the rating agency) CHICAGO  September 08 (Fitch) Fitch Ratings has affirmed Brunswick Corporation's (BC) Issuer Default Rating (IDR) at 'BBB'. Fitch has also affirmed BC's senior unsecured revolver and senior unsecured notes at 'BBB'. The Rating Outlook is Stable. KEY RATING DRIVERS Downturn Cushion: BC took steps since the last recession to reduce operating leverage and improve its financial health. The business mix is less exposed to materially cyclical,topStory
CVX,Chevron Corporation,20170908,Kazakhstan seeks better offer from oil majors to end Karachaganak gas row ,ASTANA Kazakhstan wants oil majors led by Shell and ENI to improve their offer for ending a dispute over profit sharing in the Karachaganak gas project  Kazakh Energy Minister Kanat Bozumbayev said on Friday.,normal
CVX,Chevron Corporation,20170908,Exclusive: BP's stake in giant Azeri oilfields set to fall: sources ,TBILISI/BAKU BP's stake in Azerbaijan's vast oilfields is expected to shrink under a new production-sharing agreement with state energy company SOCAR  two industry sources familiar with the talks told Reuters.,normal
CVX,Chevron Corporation,20170908,Azerbaijan's SOCAR to boost its share in new deal with BP on oil fields ,TBILISI/BAKU  Sept 8 Azeri state energy company SOCAR is expected to increase its share in a new production sharing agreement with oil major BP for development of the country's biggest oilfields  two industry sources familiar with the content of talks on the deal told Reuters.,normal
CVX,Chevron Corporation,20170908,Lebanon extends deadline for offshore oil exploration bids: NNA ,BEIRUT Lebanon's energy ministry has extended a deadline for bids in its first licensing round for offshore oil and gas exploration by four weeks to Oct. 12  the state-run National News Agency (NNA) reported on Friday.,normal
CVX,Chevron Corporation,20170908,Lebanon extends deadline for offshore oil exploration bids - NNA ,BEIRUT  Sept 8 Lebanon's energy ministry has extended a deadline for bids in its first licensing round for offshore oil and gas exploration by four weeks to Oct. 12  the state-run National News Agency (NNA) reported on Friday.,normal
SNP,China Petroleum & Chemical Corporation,20170908,UPDATE 1-China's teapot plants form new club to beat rivals  but will it work? ,* New alliance to have 1 mln bpd crude oil import quotas -exec,normal
SNP,China Petroleum & Chemical Corporation,20170908,China's teapot plants form new club to beat rivals  but will it work? ,* New alliance to have 1 mln bpd crude oil import quotas -exec,normal
C,Citigroup Inc,20170908,BRIEF-Citigroup announces about C$481.5 mln redemption of 4.650% fixed rate / floating rate subordinated notes ,* Citigroup announces approximately C$481.5 million redemption of 4.650% fixed rate / floating rate subordinated notes due october 2022,topStory
CBA           ,ClearBridge American Energy MLP Fund Inc,20170908,BRIEF-Clearbridge American says fund's net asset value/shr was $9.02  as of Aug 31​ ,* Clearbridge American Energy MLP Fund Inc - ‍ as of August 31  2017  fund's net asset value per share was $9.02​ Source text for Eikon: Further company coverage:,topStory
CCV,Comcast Corporation,20170908,Disney  Comcast shares fall on disappointing forecasts ,Shares of Walt Disney Co  and Comcast Corp  tumbled on Thursday after Disney warned of stagnant earnings and No. 1 cable operator Comcast forecast more subscriber losses. | Video ,topStory
CMA,Comerica Incorporated,20170908,BRIEF-Comerica extends closure of Florida banking centers  offices ,* Comerica extends closure of Florida banking centers and offices as Hurricane Irma approaches landfall Source text for Eikon: Further company coverage:,topStory
CMC,Commercial Metals Company,20170908,BRIEF-Commercial Metals Company provides update regarding exit of international marketing and distribution segment ,* Commercial Metals Company provides update regarding exit of international marketing and distribution segment,topStory
CIG,Comp En De Mn Cemig ADS,20170908,Exclusive - Brazil's Classico  AGC in talks for Cemig stake: sources ,SAO PAULO AGC Energia SA is in advanced talks to sell the 20.1 percent voting stake it holds in Cia Energética de Minas Gerais SA to investment bank Banco Classico SA  which could in turn be invited to share control of Brazil's No. 3 power utility  two people with knowledge of the matter said on Friday.,topStory
CIG,Comp En De Mn Cemig ADS,20170908,UPDATE 1-Brazil's Andrade Gutierrez walks out of Cemig shareholder accord ,SAO PAULO  Sept 7 In a surprise move  a unit of Andrade Gutierrez SA  a Brazilian infrastructure and energy conglomerate  decided to leave the controlling bloc of Cia Energetica de Minas Gerais SA  putting an end to months of tension with the Brazilian power utility's largest shareholder.,normal
CIG,Comp En De Mn Cemig ADS,20170908,Brazil's Andrade Gutierrez walks out of Cemig shareholder accord ,BRASILIA  Sept 7 In a surprise move  a unit of Andrade Gutierrez SA  a Brazilian infrastructure and energy conglomerate  decided to leave the controlling bloc of Cia Energetica de Minas Gerais SA  putting an end to months of tension with the Brazilian power utility's largest shareholder.,normal
CS,Credit Suisse Group,20170908,Benetton's Edizione readying bid for packaging firm Guala Closures - sources ,LONDON  Sept 8 Italy's Edizione Holding  the investment vehicle of the Benetton family  is preparing a bid for Italian packaging manufacturer Guala Closures  valued at more than 1 billion euros ($1.2 billion) including debt  three sources said.,normal
CCK,Crown Holdings Inc,20170908,BRIEF-Crown Holdings to build new plant in Valencia region of Spain ,* Crown Holdings Inc - ‍that it will build a new plant in Valencia region of Spain to produce aluminum beverage cans​,topStory
DF,Dean Foods Company,20170908,Fitch Affirms Dean Foods' IDR at 'BB-'; Withdraws All Ratings ,(The following statement was released by the rating agency) CHICAGO  September 08 (Fitch) Fitch Ratings has affirmed and withdrawn all its ratings for Dean Foods Company and its subsidiary  Dean Holding Company: Dean Foods Company (Parent) --Long-term Issuer Default Rating (IDR) 'BB-'; --Secured bank credit facility 'BB+/RR1'; --Senior unsecured notes 'BB-/RR4'. Dean Holding Company (Operating Subsidiary) --Long-term IDR 'BB-'; --Senior Unsecured notes 'BB-/RR4'. The Outlook is Stable. Fitch has,topStory
DLPH,Delphi Automotive plc,20170908,BRIEF-Delphi announces $750 mln private offering of senior notes ,* Delphi announces $750 million private offering of senior notes by its powertrain systems spin-off subsidiary  Delphi Jersey Holdings Plc,topStory
DEO,Diageo plc,20170908,BRIEF-Diageo updates on 1.5 bln pound share repurchase programme ,* ‍ON 26 JULY 2017  BOARD OF DIAGEO PLC APPROVED A SHARE BUY-BACK PROGRAMME TO RETURN UP TO £1.5 BILLION TO SHAREHOLDERS DURING FISCAL YEAR ENDING 30 JUNE 2018​,topStory
DRH,Diamondrock Hospitality Company,20170908,BRIEF-DiamondRock provides update on impact from Hurricane Irma ,* Portions of Frenchman's Reef & Morning Star Marriott Beach resort to be closed until final assessment is concluded,topStory
DSX,Diana Shipping inc,20170908,BRIEF-Diana Shipping announces time charter contract for M/V Ismene with DHL ,* Diana Shipping Inc announces time charter contract for M/V Ismene with DHL,topStory
DSXN,Diana Shipping inc,20170908,BRIEF-Diana Shipping announces time charter contract for M/V Ismene with DHL ,* Diana Shipping Inc announces time charter contract for M/V Ismene with DHL,topStory
DFS,Discover Financial Services,20170908,Fitch Affirms Discover Financial Services at 'BBB+/F2'; Outlook Stable ,(The following statement was released by the rating agency) NEW YORK  September 08 (Fitch) Fitch Ratings has affirmed Discover Financial Services' (DFS) Long-Term Issuer Default Rating (IDR) at 'BBB+'  Viability Rating (VR) at 'bbb+'  and Short-Term IDR at 'F2'. The Rating Outlook is Stable. See the full list of rating actions at the end of this release. Today's rating actions have been taken as part of Fitch's periodic review of U.S. consumer-focused internet banks  which contains four publicly,topStory
RDY,Dr Reddy&#39;s Laboratories Ltd,20170908,India's Dr Reddy's says German regulator makes 6 observations on unit ,Sept 8 Dr. Reddy's Laboratories said on Friday a German regulator has made six major observations about its Duvvada drug making facility in the southern Indian state of Andhra Pradesh  sending shares down as much as 7.1 percent.,topStory
RDY,Dr Reddy&#39;s Laboratories Ltd,20170908,BRIEF-Dr.Reddy's Laboratories says Regulatory Authority of Germany concludes audit of facility ,* Regulatory Authority of Germany concluded audit of formulations manufacturing facility in Vishakapatnam,normal
EMR,Emerson Electric Company,20170908,BRIEF-Griffon's unit to pay Emerson reverse termination fee of $13 mln if certain conditions not met ,* Griffon Corp - If Emerson terminates deal due to co's unit's failure to consummate deal under some conditions  unit to pay Emerson reverse termination fee of $13 million,topStory
E,ENI SpA,20170908,Kazakhstan seeks better offer from oil majors to end Karachaganak gas row ,ASTANA Kazakhstan wants oil majors led by Shell and ENI to improve their offer for ending a dispute over profit sharing in the Karachaganak gas project  Kazakh Energy Minister Kanat Bozumbayev said on Friday.,normal
E,ENI SpA,20170908,Italy - Factors to watch on Sept. 8 ,The following factors could affect Italian markets on Monday.,normal
EFX,Equifax Inc,20170908,Criticism of Equifax data breach response mounts  shares tumble ,Equifax Inc faced a storm of criticism on Friday over a hack that may have compromised personal data for some 143 million Americans  with consumers clamoring for answers and cyber security experts questioning the response to the massive breach.,topStory
EFX,Equifax Inc,20170908,Equifax: First the hacking  then the lawsuits ,Seven hours is all it took for Equifax Inc  to be hit with two lawsuits over a hacking that may have compromised personal information for 143 million American consumers.,normal
EFX,Equifax Inc,20170908,UPDATE 2-Equifax: First the hacking  then the lawsuits ,Sept 8 Seven hours is all it took for Equifax Inc to be hit with two lawsuits over a hacking that may have compromised personal information for 143 million American consumers.,normal
EFX,Equifax Inc,20170908,U.S. House panels to hold hearings on Equifax data breach ,WASHINGTON Two committees in the U.S. House of Representatives will hold hearings on the Equifax Inc  data breach that may have exposed personal information of many as 143 million U.S. consumers  committee spokesmen said on Friday.,normal
EFX,Equifax Inc,20170908,UPDATE 3-U.S. House panels to hold hearings on Equifax data breach ,WASHINGTON  Sept 8 Two committees in the U.S. House of Representatives will hold hearings on the Equifax Inc data breach that may have exposed personal information of many as 143 million U.S. consumers  committee spokesmen said on Friday.,normal
EFX,Equifax Inc,20170908,BRIEF-‍Moody's says Equifax security breach is credit negative  Baa1 rating unaffected​ ,* Says Equifax's security breach is credit negative but Baa1 rating unaffected​,normal
EFX,Equifax Inc,20170908,Breakingviews - Equifax hack provides an Exxon Valdez moment ,NEW YORK (Reuters Breakingviews) - When Americans are hacked  they turn to three big consumer-credit agencies for help with identity theft. What happens when one of them  Equifax  is hit by hackers who steal sensitive personal information on 143 million people?,normal
EFX,Equifax Inc,20170908,COLUMN-Equifax data breach liability could hinge on where case is tried: Frankel ,NEW YORK  Sept 8 Less than a day after Equifax revealed one of the biggest data breaches in U.S. corporate history  the credit reporting company has already been hit with two proposed class actions in federal court – and one of those cases was filed by consumer lawyers who just won the right to move forward with gargantuan data breach litigation against Yahoo.,normal
EFX,Equifax Inc,20170908,Equifax data breach liability could hinge on where case is tried ,Less than a day after Equifax revealed one of the biggest data breaches in U.S. corporate history  the credit reporting company has already been hit with two proposed class actions in federal court – and one of those cases was filed by consumer lawyers who just won the right to move forward with gargantuan data breach litigation against Yahoo.,normal
EFX,Equifax Inc,20170908,Equifax data breach spurs lawsuits ,Sept 8 At least two proposed federal class-action lawsuits have been filed against Equifax Inc after the credit reporting company disclosed a hacking that may have compromised personal information for 143 million American consumers.,normal
XOM,Exxon Mobil Corporation,20170908,Exxon  other refiners buy fuel as plants recover slowly from Harvey ,Refiners including Exxon Mobil Corp  and Motiva Enterprises purchased fuel on Thursday to compensate for lost output from plants that have been shut since Hurricane Harvey hit the U.S. Gulf Coast last month  traders said.,topStory
BEN,Franklin Resources Inc,20170908,UPDATE 1-Fondul fund may sell Hidroelectrica stake as IPO drags ,BUCHAREST  Sept 8 Romanian investment fund Fondul Proprietatea is considering selling its 20 percent stake in state-owned hydro power producer Hidroelectrica  a move it said was triggered by lack of government progress in listing it.,normal
FMS,Fresenius Medical Care Corporation,20170908,BRIEF-Eurotech wins order from Fresenius Medical Care for IoT project​ ,* ‍DESIGN WIN WITH FRESENIUS MEDICAL CARE TO SUPPLY HARDWARE AND SOFTWARE BUILDING BLOCKS FOR THEIR IOT PROJECT​,topStory
GEH,General Electric Capital Corporation,20170908,BRIEF-GE CEO Flannery's Form 4 discloses grant of 600 000 employee stock options - SEC filing ,* General Electric Co CEO John Flannery's Form 4 with U.S. SEC discloses grant of 600 000 employee stock options - SEC filing,topStory
GEK,General Electric Capital Corporation,20170908,BRIEF-GE CEO Flannery's Form 4 discloses grant of 600 000 employee stock options - SEC filing ,* General Electric Co CEO John Flannery's Form 4 with U.S. SEC discloses grant of 600 000 employee stock options - SEC filing,topStory
GE,General Electric Company,20170908,BRIEF-GE CEO Flannery's Form 4 discloses grant of 600 000 employee stock options - SEC filing ,* General Electric Co CEO John Flannery's Form 4 with U.S. SEC discloses grant of 600 000 employee stock options - SEC filing,topStory
GEB,General Electric Company,20170908,BRIEF-GE CEO Flannery's Form 4 discloses grant of 600 000 employee stock options - SEC filing ,* General Electric Co CEO John Flannery's Form 4 with U.S. SEC discloses grant of 600 000 employee stock options - SEC filing,topStory
GS,Goldman Sachs Group Inc (The),20170908,RPT-UPDATE 1-Goldman Sachs commodities trading co-head Greg Agran to leave bank -memo ,Sept 8 Goldman Sachs Group Inc commodities trading co-head Greg Agran is leaving the bank after 26 years  according to an internal memo on Friday.,topStory
GS,Goldman Sachs Group Inc (The),20170908,Goldman Sachs commodities trading co-head Greg Agran to leave bank: memo ,Goldman Sachs Group Inc commodities trading co-head Greg Agran is leaving the bank after 26 years  according to an internal memo on Friday.,normal
GS,Goldman Sachs Group Inc (The),20170908,UPDATE 1-Goldman Sachs commodities trading co-head Greg Agran to leave bank -memo ,Sept 8 Goldman Sachs Group Inc commodities trading co-head Greg Agran is leaving the bank after 26 years  according to an internal memo on Friday.,normal
GS,Goldman Sachs Group Inc (The),20170908,India's second largest state seeks to quash Goldman-backed solar project ,NEW DELHI India's second largest state has appealed to the country's top court to quash a Goldman Sachs-backed solar project  highlighting the challenges faced by solar companies looking to expand in Asia's third largest economy.,normal
GS,Goldman Sachs Group Inc (The),20170908,India's 2nd largest state seeks to quash Goldman-backed solar project ,NEW DELHI  Sept 8 India's second largest state has appealed to the country's top court to quash a Goldman Sachs-backed solar project  highlighting the challenges faced by solar companies looking to expand in Asia's third largest economy.,normal
GFF,Griffon Corporation,20170908,BRIEF-Griffon's unit to pay Emerson reverse termination fee of $13 mln if certain conditions not met ,* Griffon Corp - If Emerson terminates deal due to co's unit's failure to consummate deal under some conditions  unit to pay Emerson reverse termination fee of $13 million,topStory
HOG,Harley-Davidson Inc,20170908,BRIEF-Harley-Davidson India announces price cuts on Fat Boy and Heritage Softail Classic ,* Harley-Davidson India announces price cuts on Fat Boy and Heritage Softail Classic,topStory
