AEIS,Advanced Energy Industries Inc,20170130,BRIEF-Advanced Energy reports Q4 GAAP EPS $1.01 from continuing operations ,* Advanced Energy announces fourth quarter and full year 2016 results,topStory
AHGP,Alliance Holdings GP LP,20170130,BRIEF-Alliance Holdings GP LP reports quarterly and full year financial results; maintains quarterly distribution of $0.55 per unit ,* Alliance Holdings GP LP reports quarterly and full year financial results; maintains quarterly distribution of $0.55 per unit,topStory
ASPS,Altisource Portfolio Solutions SA,20170130,BRIEF-Deer Park Road Management Company reports 5.3 percent passive stake in Altisource Portfolio Solutions SA as of Dec 31  2016 ,* Deer Park Road Management Company  reports 5.3 percent passive stake in Altisource Portfolio Solutions SA as of Dec 31  2016- SEC filing  Source text for Eikon:  Further company coverage:,topStory
AAL,American Airlines Group Inc,20170130,BRIEF-American Airlines Group adopts an amendment and restatement of company's bylaws ,* On Jan 25  board of directors of American Airlines Group Inc adopted an amendment and restatement of company's bylaws,topStory
AAOI,Applied Optoelectronics Inc,20170130,BRIEF-Applied Optoelectronics enters early termination agreement ,* Applied Optoelectronics Inc- on Jan 25 company entered early termination agreement with Chailease Finance Company Ltd - SEC filing,topStory
AREX,Approach Resources Inc,20170130,BRIEF-Approach Resources announces exchange offer for remaining 7 pct senior notes due 2021 ,* Announces exchange offer for remaining 7.00 pct senior notes due 2021,topStory
TEAM,Atlassian Corporation Plc,20170130,UPDATE 1-Dropbox targets deep-pocketed businesses to increase revenue ,By Heather Somerville     SAN FRANCISCO  Jan 30 A decade after its founding as a file-sharing business  Dropbox Inc is trying to become a new kind of company.    On Monday  the highly valued digital storage firm unveiled two new products - file synch and content collaboration tools - as part of a years-long effort to build up its business offerings.     The effort appears to have bolstered the company's bottom line. Dropbox Chief Executive Officer Drew Houston said on Monday the comp,normal
LIFE,aTyr Pharma Inc,20170130,BRIEF-Ecor1 Capital reports 8.3 pct passive stake in Atyr Pharma ,* Ecor1 Capital LLC reports 8.3 percent passive stake in Atyr Pharma Inc as of Jan 18 - SEC filing  Source text: (http://bit.ly/2kkPDsu) Further company coverage:,topStory
BFIN,BankFinancial Corporation,20170130,BRIEF-BankFinancial Corp reports Q4 EPS $0.12 ,* BankFinancial Corporation reports financial results for 2016 and will host conference call and webcast on January 31  2017,topStory
BYBK,Bay Bancorp Inc,20170130,BRIEF-Bay Bancorp reports Q4 earnings per share $0.07 ,* Announces increase in 4th quarter income along with full year 2016 results,topStory
BCRX,BioCryst Pharmaceuticals Inc,20170130,BRIEF-Biocryst announces acceptance of Peramivir MAA filing by the European Medicines Agency ,* Biocryst announces the acceptance of Peramivir MAA filing by the European Medicines Agency  Source text for Eikon:  Further company coverage:,topStory
BOFI,BofI Holding Inc,20170130,BRIEF-Bofi Holding Q2 earnings per share $0.50 ,* Bofi Holding  Inc. Announces second quarter net income  up 14.7%,topStory
BOFIL,BofI Holding Inc,20170130,BRIEF-Bofi Holding Q2 earnings per share $0.50 ,* Bofi Holding  Inc. Announces second quarter net income  up 14.7%,topStory
BWEN,Broadwind Energy Inc,20170130,BRIEF-Broadwind Energy reaches agreement to acquire Red Wolf Company Llc ,* Broadwind Energy reaches agreement to acquire Red Wolf Company Llc,topStory
CAMP,CalAmp Corp,20170130,BRIEF-Falcon Point Capital reports 5.6 percent passive stake in Calamp Corp as of Dec 31 2016 ,* Falcon Point Capital  LLC reports 5.6 percent passive stake in Calamp Corp as of Dec 31 2016 - SEC filing  Source text for Eikon:  Further company coverage:,topStory
CALA,Calithera Biosciences Inc,20170130,BRIEF-Incyte and Calithera Biosciences announce global collaboration  to develop and commercialize CB-1158 ,* Incyte and calithera biosciences announce global collaboration  to develop and commercialize CB-1158  a first-in-class  small molecule arginase inhibitor,topStory
CFCO,CF Corporation,20170130,BRIEF-Hudson Bay Capital Management reports 5.99 pct passive stake in CF Corp ,* Hudson Bay Capital Management LP reports 5.99 percent passive stake in CF Corp as of December 31  2016 - sec filing  Source text : http://bit.ly/2jNAQn7 Further company coverage:,topStory
CFCOU,CF Corporation,20170130,BRIEF-Hudson Bay Capital Management reports 5.99 pct passive stake in CF Corp ,* Hudson Bay Capital Management LP reports 5.99 percent passive stake in CF Corp as of December 31  2016 - sec filing  Source text : http://bit.ly/2jNAQn7 Further company coverage:,topStory
CDTI,Clean Diesel Technologies Inc,20170130,BRIEF-CDTi appoints Peter J. Chase chief operating officer ,* CDTi appoints Peter J. Chase chief operating officer  Source text for Eikon:  Further company coverage:,topStory
CORT,Corcept Therapeutics Incorporated,20170130,BRIEF-Corcept Therapeutics reports Q4 preliminary GAAP earnings per share $0.04 ,* Corcept Therapeutics announces preliminary fourth quarter and full-year 2016 financial results and corporate update; provides 2017 revenue guidance,topStory
CSX,CSX Corporation,20170130,UPDATE 1-CSX in talks to reach deal with activist  ex-CP CEO -source ,Jan 30 CSX Corp is in early discussions with an activist investor over changes to its board and installing turnaround expert Hunter Harrison as the U.S. rail operator's CEO  according to a person familiar with the matter.,topStory
CSX,CSX Corporation,20170130,CSX  outgoing Canadian Pacific CEO in settlement talks - WSJ ,Jan 29 U.S. railroad operator CSX Corp  is discussing a settlement with Hunter Harrison  the outgoing chief executive of Canadian Pacific Railway Ltd  and activist investor Paul Hilal that could make Harrison CSX's CEO  the Wall Street Journal reported.,normal
CSX,CSX Corporation,20170130,BRIEF-CSX in settlement talks with Hunter Harrison & activist investor- CNBC citing DJ ,* CSX in settlement talks with Hunter Harrison & activist investor that could make him ceo only 2 weeks after coming after the co- CNBC citing DJ,normal
DGLY,Digital Ally Inc,20170130,BRIEF-American Medical Response awards Digital Ally the largest commercial order in its history ,* American Medical Response awards Digital Ally the largest commercial order in its history,topStory
DRRX,DURECT Corporation,20170130,BRIEF-Durect says working with clinical advisors to design phase 2 studies on dur-928 development program ,* Durect corporation announces update on dur-928 development program,topStory
ENPH,Enphase Energy Inc,20170130,BRIEF-Enphase Energy says expects to incur about $2 mln in cash-based termination costs and related benefits as a result of restructuring-related action ,* Enphase Energy Inc -  estimates will incur about $2 million in cash-based termination costs and related benefits as a result of restructuring-related action  Source text - http://bit.ly/2jwjKsS Further company coverage:,topStory
ENPH,Enphase Energy Inc,20170130,BRIEF-Enphase Energy says reducing work force by about 18 pct ,* Enphase Energy Inc - Restructuring will include an approximately 18 percent reduction in force  Source text for Eikon:  Further company coverage:,normal
EVGN,Evogene Ltd,20170130,BRIEF-Migdal Insurance & Financial Holdings Ltd reports a 7.68 percent passive stake in Evogene Ltd as of Dec 31  2016 - SEC filing ,* Migdal Insurance & Financial Holdings Ltd reports a 7.68 percent passive stake in Evogene Ltd as of Dec 31  2016 - SEC filing  Source text for Eikon:  Further company coverage:,topStory
EVOL,Evolving Systems Inc,20170130,BRIEF-Evolving Systems signs multi-year managed services deal for customer acquisition  activation with Latin America wireless carrier ,* Evolving systems signs multi-year managed services deal for customer acquisition and activation with Latin America wireless carrier  Source text for Eikon:  Further company coverage:,topStory
EXEL,Exelixis Inc,20170130,BRIEF-Exelixis and Takeda enter into exclusive licensing agreement ,* Exelixis and Takeda enter into exclusive licensing agreement to commercialize and develop novel cancer therapy cabozantinib in Japan,topStory
FFIV,F5 Networks Inc,20170130,BRIEF-F5 Networks names François Locoh-Donou CEO ,* F5 networks appoints François Locoh-Donou as President and CEO,topStory
FGEN,FibroGen Inc,20170130,BRIEF-FibroGen's Roxadustat (FG-4592) meets primary endpoints in two phase 3 anemia studies in China ,* FibroGen's Roxadustat (FG-4592) meets primary endpoints in two phase 3 anemia studies in China,topStory
FRGI,Fiesta Restaurant Group Inc,20170130,BRIEF-FIESTA RESTAURANT GROUP CONFIRMS RECEIPT OF DIRECTOR NOMINATIONS NOTICE ,* FIESTA RESTAURANT GROUP  INC. CONFIRMS RECEIPT OF DIRECTOR NOMINATIONS NOTICE,topStory
FRGI,Fiesta Restaurant Group Inc,20170130,Activist investor JCP to nominate three members to Fiesta board ,Activist investor JCP Investment Management said it would nominate three members to Fiesta Restaurant Group Inc's  board of directors.,normal
FRGI,Fiesta Restaurant Group Inc,20170130,Activist investor JCP to nominate 3 members to Fiesta board ,Jan 30 Activist investor JCP Investment Management said it would nominate three members to Fiesta Restaurant Group Inc's board of directors.,normal
FRGI,Fiesta Restaurant Group Inc,20170130,BRIEF-JCP says it has nominated John Morlock  James Pappas and Joshua Schechter  for election to Fiesta restaurant's board ,* Jcp announces dissident slate for election at fiesta restaurant group's upcoming annual meeting,normal
FHB,First Hawaiian Inc,20170130,BRIEF-First Hawaiian announces launch of secondary common stock offering ,* Says secondary offering 25 million shares of company's common stock in an underwritten public offering,topStory
FMI,Foundation Medicine Inc,20170130,BRIEF-Discovery Group I LLC reports 5.2 pct stake in Foundation Medicine as of Jan 19 - SEC Filing ,* Discovery Group I LLC reports 5.2 percent stake in Foundation Medicine Inc as of Jan 19 - SEC Filing,topStory
FRED,Fred&#39;s Inc,20170130,BRIEF-Fred's Pharmacy comments on extension to merger agreement ,* Fred's Inc - Fred's Pharmacy affirms that asset purchase agreement it entered into on December 19  2016 with Walgreens and Rite Aid remains in effect,topStory
GEMP,Gemphire Therapeutics Inc,20170130,BRIEF-Gemphire announces interim data from COBALT-1 clinical trial ,* Gemphire announces interim LDL-C lowering data from COBALT-1  phase 2b clinical trial,topStory
INFO,IHS Markit Ltd,20170130,BRIEF-IHS Markit modifies share repurchase authorization ,* IHS Markit Ltd - increases size of authorization; extends through may 2018,topStory
INCY,Incyte Corporation,20170130,BRIEF-Incyte and Calithera Biosciences announce global collaboration  to develop and commercialize CB-1158 ,* Incyte and calithera biosciences announce global collaboration  to develop and commercialize CB-1158  a first-in-class  small molecule arginase inhibitor,topStory
IDTI,Integrated Device Technology Inc,20170130,BRIEF-Integrated Device Technology Q3 GAAP EPS $0.24 from continuing operations ,* Q3 GAAP earnings per share $0.24 from continuing operations,topStory
INTC,Intel Corporation,20170130,BRIEF-Intel promotes three corporate officers ,* Aicha Evans promoted to Senior Vice President; Steven Rodgers promoted to EVP; Leslie Culbertson promoted to SVP  Director of Human Resources  Source text for Eikon:  Further company coverage:,topStory
IPAR,Inter Parfums Inc,20170130,BRIEF-Inter Parfums affirms 2017 guidance ,* Reports better than expected 2016 fourth quarter and full year sales,topStory
SNAK,Inventure Foods Inc,20170130,BRIEF-Falcon Point Capital reports 7.9 percent passive stake in Inventure Foods Inc as of December 31  2016 ,* Falcon Point Capital  LLC reports 7.9 percent passive stake in inventure foods inc as of December 31  2016 - SEC filing  Source text for Eikon:  Further company coverage:,topStory
IRWD,Ironwood Pharmaceuticals Inc,20170130,BRIEF-Astellas and Ironwood report positive top-line results from phase III Linaclotide trial in Japan ,* Astellas and Ironwood report positive top-line results from phase III Linaclotide trial for patients with chronic constipation conducted in Japan,topStory
JAKK,JAKKS Pacific Inc,20170130,BRIEF-Pine River Capital Management LP reports 6.2 pct passive stake in Jakks Pacific ,* Pine River Capital Management LP reports 6.2 percent passive stake in Jakks Pacific Inc as of January 26 - sec filing  Source text : http://bit.ly/2jMigy3 Further company coverage:,topStory
JSYN,Jensyn Acquistion Corp,20170130,BRIEF-Hudson Bay Capital Management reports 7.54 pct passive stake in Jensyn Acquisition - SEC filing ,* Hudson Bay Capital Management L.P. reports 7.54 percent passive stake in Jensyn Acquisition Corp as of Dec 31  2016 - SEC filing  Source text : (http://bit.ly/2kGVCFP) Further company coverage:,topStory
JSYNU,Jensyn Acquistion Corp,20170130,BRIEF-Hudson Bay Capital Management reports 7.54 pct passive stake in Jensyn Acquisition - SEC filing ,* Hudson Bay Capital Management L.P. reports 7.54 percent passive stake in Jensyn Acquisition Corp as of Dec 31  2016 - SEC filing  Source text : (http://bit.ly/2kGVCFP) Further company coverage:,topStory
LCA,Landcadia Holdings Inc,20170130,BRIEF-Hudson Bay Capital Management L.P reports 8 percent passive stake in Landcadia Holdings as of Dec 31  2016 ,Jan 30 Source: Hudson Bay Capital Management  L.P,topStory
LCAHU,Landcadia Holdings Inc,20170130,BRIEF-Hudson Bay Capital Management L.P reports 8 percent passive stake in Landcadia Holdings as of Dec 31  2016 ,Jan 30 Source: Hudson Bay Capital Management  L.P,topStory
LARK,Landmark Bancorp Inc,20170130,BRIEF-Landmark Bancorp quarterly earnings per share $0.53 ,* Landmark Bancorp Inc - net interest income was $6.5 million for quarter ended December 31  2016  a decrease of $50 000  or 0.8%  from Q4 of 2015,topStory
LPLA,LPL Financial Holdings Inc,20170130,Massachusetts orders LPL to pay $3.7 million in relief for older investors ,BOSTON Massachusetts' top securities regulator said on Monday he ordered LPL Financial Holdings Inc to offer about $2.5 million in restitution to older investors over the sale of unsuitable insurance products.,topStory
LPLA,LPL Financial Holdings Inc,20170130,Massachusetts orders LPL to pay $3.7 mln in relief for older investors ,BOSTON  Jan 30 Massachusetts' top securities regulator said on Monday he ordered LPL Financial Holdings Inc  to offer about $2.5 million in restitution to older investors over the sale of unsuitable insurance products.,normal
MCBC,Macatawa Bank Corporation,20170130,BRIEF-Macatawa Bank sets quarterly cash dividend of $0.04 per share ,* Sets quarterly cash dividend of $0.04per share  Source text for Eikon:  Further company coverage:,topStory
MAT,Mattel Inc,20170130,BRIEF-Mattel's board amends and restates its amended and restated bylaws ,* Mattel - on Jan 24  2017  board amended and restated co's amended and restated bylaws to implement proxy access - SEC filing,topStory
CASH,Meta Financial Group Inc,20170130,BRIEF-Meta Financial Group reports Q1 earnings per share $0.14 ,* Q1 earnings per share view $0.53 -- Thomson Reuters I/B/E/S,topStory
MSFT,Microsoft Corporation,20170130,Microsoft working with Washington State on suit against Trump immigration order ,Microsoft Corp said it has been cooperating with the Washington State Attorney General's Office  which is suing in federal court to stop President Donald Trump's order restricting immigration from several Muslim countries.,topStory
MSFT,Microsoft Corporation,20170130,Microsoft working with Washington State on suit against Trump immigration order ,Jan 30 Microsoft Corp said it has been cooperating with the Washington State Attorney General's Office  which is suing in federal court to stop President Donald Trump's order restricting immigration from several Muslim countries.,normal
MSFT,Microsoft Corporation,20170130,UPDATE 1-Dropbox targets deep-pocketed businesses to increase revenue ,By Heather Somerville     SAN FRANCISCO  Jan 30 A decade after its founding as a file-sharing business  Dropbox Inc is trying to become a new kind of company.    On Monday  the highly valued digital storage firm unveiled two new products - file synch and content collaboration tools - as part of a years-long effort to build up its business offerings.     The effort appears to have bolstered the company's bottom line. Dropbox Chief Executive Officer Drew Houston said on Monday the comp,normal
MSFT,Microsoft Corporation,20170130,TREASURIES-Bonds steady ahead of heavy data week  Fed meeting ,(Adds details on Microsoft deal  quotes  updates prices)     * Fed will conclude January meeting on Wednesday     * Heavy week of data including January jobs figures     * Microsoft debt sale weighs on long bonds      By Karen Brettell     NEW YORK  Jan 30 Most U.S. Treasury prices were steady on Monday before the Federal Reserve meets on Tuesday and Wednesday and ahead of a heavy week of data  while long-dated bonds were weighed down by Microsoft's $17 billion debt sale.     Frid,normal
MSFT,Microsoft Corporation,20170130,Silicon Valley puts money and muscle into fighting Trump immigrant curbs ,SAN FRANCISCO Silicon Valley took the lead over the weekend in corporate resistance to President Donald Trump's clampdown on immigration  financing legal opposition  criticizing the plan  as well as helping employees ensnared by his executive order.,normal
MDLZ,Mondelez International Inc,20170130,Ackman's Pershing Square raises Mondelez stake ,Jan 30 Billionaire investor William Ackman's Pershing Square Capital Management has raised its stake in snack maker Mondelez to 6.4 percent.,topStory
MDLZ,Mondelez International Inc,20170130,BRIEF-Pershing Square Capital Management reports 6.4 pct stake in Mondelez International ,* Pershing Square Capital Management Lp reports 6.4 percent stake in Mondelez International Inc as of Jan 27 - SEC filing,normal
MDLZ,Mondelez International Inc,20170130,Canada's Saputo seeks to mop up Australia's Warrnambool Cheese and Butter ,SYDNEY Canadian dairy company Saputo Inc said on Monday it will make an all-cash takeover offer for the 12 percent of Australia's Warrnambool Cheese and Butter it does not already own  valuing the company at A$682 million ($515 million).,normal
MYL,Mylan NV,20170130,BRIEF-Mylan says it received information request from FTC as part of preliminary investigation ,* Mylan received an information request from the FTC months ago as part of a preliminary investigation- Mylan spokeswoman,topStory
MYL,Mylan NV,20170130,BRIEF-Mylan faces US anti-trust probe over Epipen practices- CNBC  citing report ,* Mylan faces US anti-trust probe over its Epipen practices- CNBC  citing report,normal
NBN,Northeast Bancorp,20170130,BRIEF-Northeast Bancorp reports quarterly EPS $0.35 ,* Northeast Bancorp reports record quarterly results  surpasses $1 billion in assets and declares dividend,topStory
OCRX,Ocera Therapeutics Inc,20170130,BRIEF-Ocera announces top-line results for phase 2b study in hepatic encephalopathy ,* Ocera announces top-line results for phase 2b study in hepatic encephalopathy,topStory
ODP,Office Depot Inc,20170130,BRIEF-Office Depot incoming ceo Smith Will receive an annual base salary of $1.1 million ,* Office Depot Inc - incoming ceo smith will receive an annual base salary of $1.1 million,topStory
ODP,Office Depot Inc,20170130,Office Depot names Lenovo senior executive Gerry Smith as CEO ,Office Depot Inc   No. 2 U.S. office supplies retailer  appointed Lenovo Group Ltd  senior executive Gerry Smith as its chief executive and board member Joseph Vassalluzzo as chairman from Feb. 27.,normal
ODP,Office Depot Inc,20170130,Office Depot names Lenovo senior exec Gerry Smith as CEO ,Jan 30 Office Depot Inc  No. 2 U.S. office supplies retailer  appointed Lenovo Group Ltd  senior executive Gerry Smith as its chief executive and board member Joseph Vassalluzzo as chairman from Feb. 27.,normal
OSTK,Overstockcom Inc,20170130,BRIEF-Overstock to buy 604 229 shares from units of Fairfax Financial at $16.55/shr ,* Says on Jan 27  entered into oral deal to buy 604 229 shares from one or more units of Fairfax Financial Holdings at $16.55/share,topStory
PYPL,PayPal Holdings Inc,20170130,Negative effective of currency rates on company results fall in third quarter ,NEW YORK Currency market fluctuations in the third quarter of 2016 had the smallest negative impact on North American companies' financial results since 2014  FIREapps said in a report on Monday.,topStory
PLUG,Plug Power Inc,20170130,BRIEF-Hudson Bay Capital Management  L.P. reports 9.99 percent passive stake in Plug Power Inc as of Dec 31 2016 ,Jan 30 Source: Hudson Bay Capital Management  L.P.,topStory
COOL,PolarityTE Inc,20170130,BRIEF-Polarityte files for secondary offering of up to 759 333 shares of common stock ,* Files for secondary offering of up to 759 333 shares of common stock - sec filing  Source text : http://bit.ly/2jMyXcM Further company coverage:,topStory
PBIP,Prudential Bancorp Inc,20170130,BRIEF-Prudential Bancorp announces Q1 EPS $0.09 ,* For three months ended Dec 31  2016  net interest income increased to $3.6 million as compared to $3.3 million for same period in 2015  Source text for Eikon:  Further company coverage:,topStory
PULM,Pulmatrix Inc,20170130,BRIEF-Pulmatrix announces $5 million registered direct offering ,* Pulmatrix inc- company agreed to sell an aggregate of approximately 2 million shares of common stock  at a price of $2.50 per share,topStory
RMBS,Rambus Inc,20170130,BRIEF-Rambus reports Q4 loss per share $0.03 ,* Rambus reports fourth quarter and fiscal year 2016 financial results,topStory
GOLD,Randgold Resources Limited,20170130,UPDATE 1-Gold miner Randgold says talking to Tongon mine employees to end sit-in ,Jan 30 Gold miner Randgold Resources Ltd  said it was in talks with some of its employees to end their illegal sit-in at its Tongon mine in Ivory Coast over demands to make some additional annual payments.,topStory
GOLD,Randgold Resources Limited,20170130,Gold miner Randgold says talking to Tongon mine employees to end sit-in ,Jan 30 Gold miner Randgold Resources Ltd  said it is negotiating with some of its employees to end their illegal sit-in at its Tongon mine in Ivory Coast demanding annual ex-gratia payments.,normal
RGSE,Real Goods Solar Inc,20170130,BRIEF-Hudson Bay Capital Management reports 7.58 percent passive stake in Real Goods Solar Inc as of Dec 31 2016 ,Jan 30 Source: Hudson Bay Capital Management  L.P.,topStory
RCII,Rent-A-Center Inc,20170130,BRIEF-Engaged Capital Llc purchased Rent-A-Center shares ,* Engaged Capital Llc - purchased rent-a-center shares based on belief that the shares  when purchased  were undervalued,topStory
RIGL,Rigel Pharmaceuticals Inc,20170130,BRIEF-Rigel announces proposed public offering of common stock ,* Rigel Pharmaceuticals Inc- Proceeds to be used to fund research and development activities  commercial preparation and for general corporate purposes  Source text for Eikon:  Further company coverage:,topStory
RIGL,Rigel Pharmaceuticals Inc,20170130,BRIEF-Rigel Pharmaceuticals announces updates from clinical program of Fostamatinib in patients with chronic immune thrombocytopenic purpura ,* Rigel Pharmaceuticals announces updates from clinical program of Fostamatinib in patients with chronic immune thrombocytopenic purpura,normal
RYAAY,Ryanair Holdings plc,20170130,Lufthansa deal to lease Air Berlin planes approved by German watchdog ,BERLIN The German cartel office on Monday approved plans by Lufthansa  to lease 38 crewed planes from smaller rival Air Berlin   a deal which had drawn criticism from rival Ryanair .,topStory
RYAAY,Ryanair Holdings plc,20170130,Lufthansa deal to lease Air Berlin planes approved by German watchdog ,BERLIN  Jan 30 The German cartel office on Monday approved plans by Lufthansa to lease 38 crewed planes from smaller rival Air Berlin  a deal which had drawn criticism from rival Ryanair.,normal
SCVL,Shoe Carnival Inc,20170130,BRIEF-Shoe Carnival enters into stock repurchase plan ,* Shoe Carnival Inc - on January 27  2017  Shoe Carnival  Inc. entered into a stock repurchase plan,topStory
SIFI,SI Financial Group Inc,20170130,BRIEF-SI Financial Group reports results for the quarter and year ended Dec 31 ,* SI Financial Group  Inc. reports results for the quarter and year ended December 31  2016,topStory
SILC,Silicom Ltd,20170130,BRIEF-Silicom reports Q4 revenue $28.3 million ,* Silicom reports all-time record revenues for Q4 & full year 2016,topStory
SRAX,Social Reality Inc,20170130,BRIEF-Social Reality sees FY17 expects total revenues to be between $45 mln and $50 mln ,* Social Reality reports preliminary unaudited operating results for fourth quarter and full year 2016,topStory
SFM,Sprouts Farmers Market Inc,20170130,BRIEF-Sprouts Farmers Market's board approved amendments to company's bylaws to implement proxy access - SEC Filing ,* Sprouts Farmers Market Inc- On Jan 30 board approved amendments to company's bylaws to implement proxy access - SEC Filing,topStory
STLY,Stanley Furniture Company Inc,20170130,BRIEF-STANLEY FURNITURE CO APPROVED REDUCING BOARD BACK TO SIX DIRECTORS EFFECTIVE AT 2017 ANNUAL MEETING ,* STANLEY FURNITURE COMPANY INC - BOARD HAS APPROVED REDUCING BOARD BACK TO SIX DIRECTORS EFFECTIVE AT 2017 ANNUAL MEETING - SEC FILING  Source text - http://bit.ly/2johjNJ Further company coverage:,topStory
STLY,Stanley Furniture Company Inc,20170130,BRIEF-Stanley Furniture appoints Steven A. Hale II to board ,* Stanley Furniture appoints Steven A. Hale II to board of directors,normal
