HBM,Hudbay Minerals Inc,20170908,BRIEF-Hudbay announces C$242 million bought deal financing ,* Says underwriters agreed to purchase  on a bought deal basis 24 million common shares of co at a price of C$10.10 per share,topStory
INFY,Infosys Limited,20170908,BRIEF-India's Infosys inducted into Dow Jones Sustainability indices ,* Says co inducted into Dow Jones Sustainability indices Source text - [Infosys Inducted into the Index Component of Dow Jones Sustainability Indices (DJSI) Bangalore - September 8  2017: Infosys has been inducted into the prestigious Dow Jones Sustainability Indices (DJSI) announced on September 7  2017 and is now part of the DJSI World and DJSI Emerging Markets Indices.] Further company coverage:,topStory
ITG,Investment Technology Group Inc,20170908,ITG's Selway drops out of running for key SEC job ,Jamie Selway  the leading candidate to head the U.S. Securities and Exchange Commission's Division of Trading and Markets  has withdrawn his name from consideration  according to a person with direct knowledge of the matter.,topStory
ITG,Investment Technology Group Inc,20170908,UPDATE 1-ITG's Selway drops out of running for key U.S. SEC job ,Sept 8 Jamie Selway  the leading candidate to head the U.S. Securities and Exchange Commission's Division of Trading and Markets  has withdrawn his name from consideration  according to a person with direct knowledge of the matter.,normal
ITG,Investment Technology Group Inc,20170908,ITG's Selway drops out of running to head U.S. SEC markets unit ,Sept 8 Jamie Selway  the leading candidate to head the Trading and Markets division at the U.S. Securities and Exchange Commission   has withdrawn his name from consideration  according to a source with direct knowledge of the matter.,normal
JPM,J P Morgan Chase & Co,20170908,BRIEF-Bicapital says added J.P. Morgan‍​ as a joint bookrunner for U.S. IPO of up to $345 mln ,* Bicapital Corp says added J.P. Morgan‍​ as a joint bookrunner for U.S. IPO of up to $345 million - SEC filng Source text: [http://bit.ly/2gS62Fb] Further company coverage:,topStory
JPM,J P Morgan Chase & Co,20170908,UPDATE 1-Germany's Merck hires JP Morgan to sell consumer health ,* Pfizer not interested in more consumer health -source (Adds previous talks with Nestle  deal value),normal
JPM,J P Morgan Chase & Co,20170908,Germany's Merck hires JP Morgan to advise on consumer health review ,FRANKFURT  Sept 8 Merck KGaA has hired investment bank JP Morgan as a financial adviser to evaluate strategic options for its consumer health business  a spokesman for the German company said on Friday.,normal
JKS,JinkoSolar Holding Company Limited,20170908,BRIEF-JinkoSolar supplies 17 MWdc of solar PV modules to Brooks Solar Project in Canada ,* JinkoSolar Holding Co Ltd - ‍subsidiary will supply approximately 17 MW dc of its solar PV modules to Borea Construction ULC​ Source text for Eikon: Further company coverage:,topStory
K,Kellogg Company,20170908,Kellogg defeats Mondelez in cookie-packaging patent fight ,A federal appeals court on Thursday upheld the dismissal of a patent infringement case Mondelez International Inc brought against rival food company Kellogg Co.,topStory
KEM,Kemet Corporation,20170908,BRIEF-Kemet Corporation announces pricing of secondary offering by selling securityholder ,* Kemet Corporation announces pricing of secondary offering by selling securityholder,topStory
KKR,KKR & Co LP,20170908,LPC: KKR's Covenant Surgical Partners buy supported by US$195m loan ,NEW YORK  Sept 8 US private equity firm KKR & Co will finance its acquisition of US ambulatory surgery center operator Covenant Surgical Partners with a US$195m term loan  two sources close to the matter said.,topStory
KR,Kroger Company (The),20170908,Kroger results hit by grocery price war  shares slide ,Kroger Co  on Friday reported a quarterly profit drop after an intensifying grocery price war hit its bottom line  and warned that same-store sales and operating margins would be lower than expected for the remainder of the year. | Video ,topStory
KR,Kroger Company (The),20170908,UPDATE 6-Kroger results hit by grocery price war  shares slide ,Sept 8 Kroger Co on Friday reported a quarterly profit drop after an intensifying grocery price war hit its bottom line  and warned that same-store sales and operating margins would be lower than expected for the remainder of the year.,normal
KR,Kroger Company (The),20170908,BRIEF-Kroger reports Q2 earnings per share of $0.39 ,* Q2 earnings per share view $0.39 -- Thomson Reuters I/B/E/S,normal
KR,Kroger Company (The),20170908,BRIEF-Kroger Q2 earnings per share $0.39 ,* Q2 earnings per share view $0.39 -- Thomson Reuters I/B/E/S,normal
KR,Kroger Company (The),20170908,Kroger's profit dips 7.8 pct on aggressive price cuts ,Sept 8 Kroger Co  the biggest U.S. supermarket company  reported a 7.8 percent fall in quarterly profit on Friday as it discounted aggressively to fend off competition from Wal-Mart Stores Inc and other retailers.,normal
LUK,Leucadia National Corporation,20170908,BRIEF-‍Leucadia National reports 12.1 percent passive stake in Easterly Acquisition Corp ​ ,* ‍Leucadia National Corp reports 12.1 percent passive stake in Easterly Acquisition Corp as of Aug 31 - SEC filing​ Source text: (http://bit.ly/2wfn8id) Further company coverage:,topStory
LMT,Lockheed Martin Corporation,20170908,UPDATE 2-U.S. State Dept approves $3.8 bln in arms sales to Bahrain -Pentagon ,WASHINGTON  Sept 8 The U.S. State Department has approved arms sales packages worth more than $3.8 billion to Bahrain including F-16 jets  upgrades  missiles and patrol boats  the Pentagon said on Friday.,normal
LMT,Lockheed Martin Corporation,20170908,U.S. State Dept approves $3.8 bln in arms sales to Bahrain-U.S. official ,WASHINGTON Sept 8 The U.S. State Department has approved a package of potential arms sales worth more than $3.8 billion for Bahrain including F-16 jets  upgrades  missiles and patrol boats  a U.S. Official said on Friday.,normal
MGA,Magna International Inc,20170908,BRIEF-Magna expands in Alabama with aluminum casting facility ,* Magna International Inc - ‍expanding operations to add aluminum casting capabilities at its Kamtek facility in Birmingham  Alabama​,topStory
MCC,Medley Capital Corporation,20170908,BRIEF-Medley Capital amends credit facility and partially prepays term loan ,* Medley Capital Corp amends credit facility and partially prepays term loan,topStory
MCV,Medley Capital Corporation,20170908,BRIEF-Medley Capital amends credit facility and partially prepays term loan ,* Medley Capital Corp amends credit facility and partially prepays term loan,topStory
MCX,Medley Capital Corporation,20170908,BRIEF-Medley Capital amends credit facility and partially prepays term loan ,* Medley Capital Corp amends credit facility and partially prepays term loan,topStory
MDT,Medtronic plc,20170908,BRIEF-Medtronic announces Japanese regulatory approval for IN.PACT Admiral drug-coated balloon ,* Medtronic announces japanese regulatory approval for the IN.PACT Admiral drug-coated balloon,topStory
MON,Monsanto Company,20170908,Monsanto fights to sell Arkansas farmers herbicide linked to crop damage ,CHICAGO Monsanto Co  filed a petition on Thursday asking Arkansas agricultural officials to reject a proposed date next year that would end sprayings of the herbicide dicamba  which has been linked to crop damage across the U.S. farm belt.,topStory
MON,Monsanto Company,20170908,UPDATE 3-Monsanto fights to sell Arkansas farmers herbicide linked to crop damage ,CHICAGO  Sept 7 Monsanto Co filed a petition on Thursday asking Arkansas agricultural officials to reject a proposed date next year that would end sprayings of the herbicide dicamba  which has been linked to crop damage across the U.S. farm belt.,normal
MS,Morgan Stanley,20170908,BRIEF-Diageo updates on 1.5 bln pound share repurchase programme ,* ‍ON 26 JULY 2017  BOARD OF DIAGEO PLC APPROVED A SHARE BUY-BACK PROGRAMME TO RETURN UP TO £1.5 BILLION TO SHAREHOLDERS DURING FISCAL YEAR ENDING 30 JUNE 2018​,topStory
NBLX,Noble Midstream Partners LP,20170908,BRIEF-Noble Midstream files prospectus related to offer  sale of 3.5 mln units ,* Noble Midstream Partners LP- files prospectus related to offer  sale of 3.5 million common units representing limited partner interests of co by selling unitholders‍​ Source: (http://bit.ly/2wNKtMg) Further company coverage:,topStory
NSC,Norfolk Souther Corporation,20170908,Factbox: Key railroad assets in Hurricane Irma's path ,Major eastern U.S. railroads CSX Corp and Norfolk Southern Corp are rerouting rail cars and locomotives  holding traffic in yards out of harm's way  relocating workers  and putting repair equipment into place as Hurricane Irma barrels toward Florida.,topStory
OFG,OFG Bancorp,20170908,BRIEF-OFG Bancorp reports operations normal ,* Ofg bancorp - ‍after hurricane irma struck puerto rico  all but two of its 48 financial centers open for business as usual​ Source text for Eikon: Further company coverage:,topStory
PFSI,PennyMac Financial Services Inc,20170908,BRIEF-Pennymac Financial Services entered into amendment to terms of its mortgage loan participation purchase and sale agreement ,* Pennymac Financial Services Inc - Entered into an amendment to the terms of its mortgage loan participation purchase and sale agreement  dated Aug 13  2014,topStory
PKI,PerkinElmer Inc,20170908,BRIEF-PerkinElmer launches QSight210 MD system for clinical laboratories ,* PerkinElmer Inc - launches QSight210 MD system for clinical laboratories Source text for Eikon: Further company coverage:,topStory
PTR,PetroChina Company Limited,20170908,UPDATE 1-China's teapot plants form new club to beat rivals  but will it work? ,* New alliance to have 1 mln bpd crude oil import quotas -exec,normal
PTR,PetroChina Company Limited,20170908,China's teapot plants form new club to beat rivals  but will it work? ,* New alliance to have 1 mln bpd crude oil import quotas -exec,normal
PJC,Piper Jaffray Companies,20170908,U.S. oil drillers cut rigs for 3rd week in four as recovery stalls -Baker Hughes ,    Sept 8 U.S. energy firms cut oil rigs for a third time in the past four weeks as a 14-month drilling recovery stalls with energy firms reducing spending plans in response to recent crude price declines.     Drillers cut three oil rigs in the week to Sept. 8  bringing the total count down to 756  the least since June  General Electric Co's        Baker Hughes energy services firm said in its closely followed report on Friday.      That compares with 414 activ,normal
PPG,PPG Industries Inc,20170908,Akzo abandons profit forecast made during PPG takeover battle ,AMSTERDAM Dutch paintmaker Akzo Nobel   which angered investors by fending off a $32 billion takeover approach three months ago  warned on Friday it would not hit the 2017 profit target it promised during an acrimonious battle. | Video ,topStory
PPG,PPG Industries Inc,20170908,UPDATE 4-Akzo abandons profit forecast made during PPG takeover battle ,* CFO to step aside on health grounds (Adds quotes from shareholder meeting),normal
PPL,PPL Corporation,20170908,BRIEF-PPL Corp enters deal to offer $500 mln of 4.000 pct senior notes due 2047 ,* PPL Capital Funding  PPL Corp entered underwriting deal to offering and sale by PPL Capital Funding of $500 million of 4.000% senior notes due 2047 Source text - (http://bit.ly/2eLpSgX) Further company coverage:,topStory
PG,Procter & Gamble Company (The),20170908,BRIEF-Trian Partners Nelson Peltz on CNBC says P&G needs to figure out how to regain market share ,* Trian Partners Nelson Peltz on CNBC says P&G needs to figure out how to regain market share,topStory
PG,Procter & Gamble Company (The),20170908,UPDATE 1-Germany's Merck hires JP Morgan to sell consumer health ,* Pfizer not interested in more consumer health -source (Adds previous talks with Nestle  deal value),normal
PUMP,ProPetro Holding Corp,20170908,BRIEF-ProPetro Holding files to offer and sale 17.4 mln shares of common stock ,* ProPetro Holding Corp files to offer and sale 17.4 million shares of common stock by the selling shareholders - SEC filing‍​ Source text: [http://bit.ly/2jcypyj] Further company coverage:,topStory
PUK,Prudential Public Limited Company,20170908,Direct Line Insurance names Prudential executive as CFO ,UK-based general insurer Direct Line Insurance Group said Prudential Plc  executive Penny James will replace John Reizenstein as its chief financial officer  starting from March.,topStory
PUK,Prudential Public Limited Company,20170908,MOVES-Direct Line Insurance names Prudential exec as CFO ,Sept 8 UK-based general insurer Direct Line Insurance Group said Prudential Plc executive Penny James will replace John Reizenstein as its chief financial officer  starting from March.,normal
PUK,Prudential Public Limited Company,20170908,CORRECTED-BRIEF-Direct Line brings on Prudential exec as new finance head ,* ‍Penny James to succeed John Reizenstein as CFO of Direct Line Group​,normal
RYAM,Rayonier Advanced Materials Inc,20170908,BRIEF-Rayonier Advanced Materials temporarily suspends operations due to Hurricane Irma ,* Rayonier Advanced Materials Inc temporarily suspends operations due to Hurricane Irma,topStory
RS,Reliance Steel & Aluminum Co,20170908,BRIEF-Reliance Steel & Aluminum Co provides update on Hurricane Harvey impact ,* Reliance Steel & Aluminum Co - ‍as of September 5  2017  all facilities have been reopened and are operational​,topStory
CRM,Salesforcecom Inc,20170908,BRIEF-Salesforce appoints Bernard Tyson to its board of directors ,* Salesforce announces appointment of Bernard J Tyson to its board of directors,topStory
SNY,Sanofi,20170908,BRIEF-Sanofi  Regeneron say Cemiplimab receives U.S. FDA breakthrough designation for advanced cutaneous squamous cell carcinoma ,* Sanofi  Regeneron: Cemiplimab receives FDA breakthrough designation for advanced cutaneous squamous cell carcinoma,topStory
SNY,Sanofi,20170908,Germany's Merck hires JP Morgan to sell consumer health ,FRANKFURT/LONDON Germany's Merck KGaA has hired JP Morgan to sell its consumer health business  which includes brands such as Seven Seas vitamins and could be worth around $4.5 billion.,normal
SNY,Sanofi,20170908,UPDATE 1-Germany's Merck hires JP Morgan to sell consumer health ,* Pfizer not interested in more consumer health -source (Adds previous talks with Nestle  deal value),normal
SLB,Schlumberger NV,20170908,RPT-INSIGHT-The next oil major? Service firm Schlumberger's big bet on production ,HOUSTON  Sept 8 The world's largest oilfield services company  Schlumberger NV  is spending billions of dollars buying stakes in its customers' oil and gas projects - investing in the same ventures it supplies with equipment and expertise.,topStory
SLB,Schlumberger NV,20170908,The next oil major? Service firm Schlumberger's big bet on production ,HOUSTON The world's largest oilfield services company  Schlumberger NV   is spending billions of dollars buying stakes in its customers' oil and gas projects - investing in the same ventures it supplies with equipment and expertise.,normal
SLB,Schlumberger NV,20170908,INSIGHT-The next oil major? Service firm Schlumberger's big bet on production ,HOUSTON  Sept 8 The world's largest oilfield services company  Schlumberger NV  is spending billions of dollars buying stakes in its customers' oil and gas projects - investing in the same ventures it supplies with equipment and expertise.,normal
SDRL,Seadrill Limited,20170908,BRIEF-Seadrill increases credit facility to North Atlantic Drilling ,* Has increased the capacity of the revolving credit facility provided to North Atlantic Drilling Ltd.  a majority owned subsidiary  from $150 million to $200 million,topStory
SEAS,SeaWorld Entertainment Inc,20170908,BRIEF-SeaWorld Entertainment says SeaWorld Orlando to remain closed Sunday  Monday for Hurricane Irma- tweet ,* SeaWorld Entertainment Inc says SeaWorld Olando closing Sturday at 5 PM; will remain closed Sunday & Monday for Hurricane Irma - tweet Further company coverage:,topStory
SIG,Signet Jewelers Limited,20170908,BRIEF-Capital Research Global Investors 10.2 pct passive stake in Signet Jewelers ,* Capital Research Global Investors 10.2 percent passive stake in Signet Jewelers Ltd as of August 31 - sec filing Source text : http://bit.ly/2eM8V62 Further company coverage:,topStory
LUV,Southwest Airlines Company,20170908,BRIEF-Southwest Airlines reports August traffic ,* Southwest Airlines Co - ‍available seat miles (asms) increased 4.9 percent to 13.3 billion in august 2017  compared with august 2016 asms of 12.7 billion​,topStory
S,Sprint Corporation,20170908,BRIEF-Sprint names Ivo Rook Senior VP of IoT ,* Sprint names Ivo Rook Senior VP of IoT Source text for Eikon: Further company coverage:,topStory
TSM,Taiwan Semiconductor Manufacturing Company Ltd,20170908,BRIEF-Taiwan's TSMC orders equipment for T$1.1 bln ,* Says it orders equipment for T$1.1 billion  ($36.80 million) from Lam Research International Sarl,topStory
TSM,Taiwan Semiconductor Manufacturing Company Ltd,20170908,BRIEF-TSMC's sales down 2.5 pct y/y in August ,* Says August sales T$91.92 billion ($3.07 billion)(July T$71.61 billion  Aug 2016 sales T$94.31 billion),normal
TGT,Target Corporation,20170908,Target slashes prices on thousands of items  shares falter ,Target Corp  said on Friday that it lowered prices on thousands of items  from cereal to baby formula  further  hurting retail stocks already pressured by Kroger Co's   disappointing quarterly results spurred by price cuts.,topStory
TGT,Target Corporation,20170908,Target slashes prices on thousands of items  shares falter ,Sept 8 Target Corp said on Friday that it lowered prices on thousands of items  from cereal to baby formula  further  hurting retail stocks already pressured by Kroger Co's  disappointing quarterly results spurred by price cuts.,normal
TTM,Tata Motors Ltd,20170908,BRIEF-Tata Motors total JLR retail sales in August was 38 519 vehicles  up 4.3 pct y-o-y ,* Says total retail sales for Jaguar Land Rover were 38 519 vehicles in August  up 4.3 percent compared to August 2016,topStory
TEN,Tenneco Inc,20170908,BRIEF-Tenneco Inc files amendment to its 10-Q - SEC filing ,* Tenneco Inc files amendment to its Form 10-Q with U.S. SEC - SEC filing,topStory
TRP,TransCanada Corporation,20170908,Canada regulator's plan for review of Energy East pipeline under fire ,CALGARY  Alberta A Canadian regulator's plan to assess indirect carbon emissions when considering TransCanada Corp's  Energy East pipeline application sets a harsh precedent for future projects  the Alberta government and supporters of the pipeline said on Friday.,topStory
TRP,TransCanada Corporation,20170908,TransCanada may abandon Energy East pipe facing tougher review ,CALGARY  Alberta TransCanada Corp  seeks to suspend the application for its Energy East pipeline for 30 days and may abandon the project  the company said on Thursday  weeks after Canada's National Energy Board (NEB) announced a tougher review process.,normal
TRP,TransCanada Corporation,20170908,UPDATE 3-TransCanada may abandon Energy East pipe facing tougher review ,CALGARY  Alberta  Sept 7 TransCanada Corp seeks to suspend the application for its Energy East pipeline for 30 days and may abandon the project  the company said on Thursday  weeks after Canada's National Energy Board (NEB) announced a tougher review process.,normal
TRTN,Triton International Limited,20170908,BRIEF-Triton International announces public offering price of shares ,* Triton International Limited announces pricing of public offering of common shares,topStory
UAL,United Continental Holdings Inc,20170908,BRIEF-United Continental reports August 2017 operational performance ,* United Continental Holdings Inc - preliminary ‍Aug consolidated rpms 20.39 billion  up 2.3 pct​,topStory
UMC,United Microelectronics Corporation,20170908,BRIEF-Taiwan UMC's Aug sales up 0.9 pct y/y ,* Says August sales up 0.9 percent y/y at T$13.0 billion ($434.74 million),topStory
URI,United Rentals Inc,20170908,BRIEF-United Rentals announces pricing of offering of $750 million of senior notes due 2025 ,* United Rentals announces pricing of offering of $750 million of senior notes due 2025 and $750 million of senior notes due 2028,topStory
UVE,UNIVERSAL INSURANCE HOLDINGS INC,20170908,Options market seeks cover  and exposure  as Hurricane Irma nears ,NEW YORK  Sept 8 Equity option traders are seeking ways to profit from and protect their investments against expected damage caused by Hurricane Irma  one of the most powerful Atlantic storms in a century as it closes in on Florida.,normal
VZ,Verizon Communications Inc,20170908,BRIEF-AT&T  Sprint  T-Mobile and Verizon team up to develop mobile authentication solution ,* Says co  Sprint  T-Mobile and Verizon are joining forces to create a mobile authentication taskforce​,topStory
VZA,Verizon Communications Inc,20170908,BRIEF-AT&T  Sprint  T-Mobile and Verizon team up to develop mobile authentication solution ,* Says co  Sprint  T-Mobile and Verizon are joining forces to create a mobile authentication taskforce​,topStory
V,Visa Inc,20170908,BRIEF-Visa Inc files for three-part senior notes offering of up to $2.5 bln ,* Visa Inc says files for three-part senior notes offering of up to $2.5 billion - SEC filing‍​,topStory
WNC,Wabash National Corporation,20170908,BRIEF-Wabash National announces launch of $325 million private placement ,* Wabash National announces launch of $325 million private placement,topStory
WDR,Waddell & Reed Financial Inc,20170908,BRIEF-Waddell & Reed Financial Inc reports 10.4 percent passive stake in Laureate Education Inc‍​ ,* Waddell & Reed Financial Inc reports 10.4 percent passive stake in Laureate Education Inc  as of August 31  2017 - SEC filing ‍​ Source text: (http://bit.ly/2eMbK71) Further company coverage:,topStory
DIS,Walt Disney Company (The),20170908,Orlando theme parks brace for Hurricane Irma ,Sept 8 Walt Disney World said its theme park in Florida would remained closed on Sunday and Monday  joining a growing list of top Orlando attractions that are bracing for Hurricane Irma  which is poised to strike the state on Sunday.,topStory
DIS,Walt Disney Company (The),20170908,UPDATE 1-TV viewership drops for NBC'S first NFL game ,Sept 8 The NFL kickoff game broadcast on Thursday night on NBC  a win by the Kansas City Chiefs over the New England Patriots  attracted 21.8 million TV viewers  down more than 13 percent from last year's opening game  data from NBC and Nielsen showed.,normal
DIS,Walt Disney Company (The),20170908,BRIEF-Walt Disney says Disney World Resort will remain closed through Sept 11 ,* Walt Disney says Walt Disney World Resort will remain closed through Sept 11; hope to resume normal operations on Sept 12 Source text : http://bit.ly/2xbB5ls Further company coverage: (Reporting by Philip  George),normal
DIS,Walt Disney Company (The),20170908,BRIEF-Walt Disney World in Orlando  Florida to close for at least 2 days due to hurricane Irma- CNBC ,* Walt Disney world in Orlando  Florida to close for at least 2 days due to hurricane Irma- CNBC Further company coverage: (Reporting by Philip  George),normal
DIS,Walt Disney Company (The),20170908,Disney  Comcast shares fall on disappointing forecasts ,Shares of Walt Disney Co  and Comcast Corp  tumbled on Thursday after Disney warned of stagnant earnings and No. 1 cable operator Comcast forecast more subscriber losses. | Video ,normal
WMLP,Westmoreland Resource Partners LP,20170908,BRIEF-Westmoreland Resource Partners - on Sept 1 co and Westmoreland Resources GP  LLC entered second amendment to services agreement ,* Westmoreland Resource Partners - on Sept 1 co and Westmoreland Resources GP  LLC entered second amendment to services agreement dated as of Jan 1  2015‍​,topStory
XHR,Xenia Hotels & Resorts Inc,20170908,BRIEF-Xenia Hotels & Resorts files for potential mixed shelf offering ,* Xenia Hotels & Resorts Inc files for potential mixed shelf offering; size not disclosed - SEC filing Source text: (http://bit.ly/2wfimkC) Further company coverage:,topStory
TPHS,Trinity Place Holdings Inc,20170908,BRIEF-Marcato Capital reports 12.4 pct stake in Trinity Place Holdings ,* Marcato Capital Management LP reports 12.4 percent stake in Trinity Place Holdings Inc ‍​as of September 6 versus a 14.1 percent stake as of March 31 - SEC filing Source: (http://bit.ly/2f93ezu) Further company coverage:,topStory
UEC,Uranium Energy Corp,20170908,BRIEF-Uranium Energy files for resale of up to 26.5 mln common stock shares ,* Uranium Energy Corp files for resale of up to 26.5 million shares of co's common stock that may be offered by selling securityholders - SEC filing Source text: [http://bit.ly/2vKWIp1] Further company coverage:,topStory
