AMED,Amedisys Inc,20131112,Home healthcare provider Amedisys reports loss  cuts forecast ,Amedisys Inc  reported a surprise quarterly loss due to higher costs per patient visit and lower admissions at its centers  and the home healthcare provider cut its full-year earnings forecast.,topStory
AMED,Amedisys Inc,20131112,UPDATE 2-Home healthcare provider Amedisys reports loss  cuts forecast ,* Third-qtr adj loss 1 cent/share vs est. profit 13 cents/share,normal
AMED,Amedisys Inc,20131112,Home healthcare provider Amedisys reports quarterly loss ,Nov 12 Home healthcare provider Amedisys Inc  reported a quarterly loss  mainly due to a $150 million charge for the tentative settlement of an investigation by the U.S. Department of Justice.,normal
AAPL,Apple Inc,20131112,Hon Hai's consumer-led shift to boost margins  cut costs ,TAIPEI  Nov 13 Hon Hai Precision Industry's  decision to move away from major client Apple Inc  and the lower-value electronics contract manufacturing business is a long-term bet that will improve margins and offset rising labour costs.,topStory
AAPL,Apple Inc,20131112,Apple's iPad Mini with retina display to go on sale Tuesday ,Apple Inc said its iPad Mini with retina display will be available beginning Tuesday starting at $399 in the United States.,normal
AAPL,Apple Inc,20131112,Apple's iPad Mini with retina display to go on sale from Tuesday ,Nov 12 Apple Inc said its iPad Mini with retina display will be available beginning Tuesday starting at $399 in the United States.,normal
TAPR,Barclays Inverse US Treasury Composite ETN,20131112,Barclays heads to Asia with around USD4.5bn in orders ,By Danielle Robinson Barclays is heading into the Asian trading day Wednesday with a solid book of around USD4.5bn for its perpetual non-call five-year Alternative Tier 1 Contingent Convertible capital security.,topStory
TAPR,Barclays Inverse US Treasury Composite ETN,20131112,UPDATE 1-Barclays markets new bond to beef up capital ,LONDON  Nov 12 (IFR) - Barclays began testing investor interest on Tuesday for a US dollar perpetual non-call five-year bond in the low 8%s  as part of plans to beef up its leverage ratio.,normal
TAPR,Barclays Inverse US Treasury Composite ETN,20131112,Barclays tests investor interest for US dollar additional Tier 1 Bond at low 8%s - lead ,LONDON  Nov 12 (IFR) - Barclays is testing investor interest for its USD-denominated Additional Tier 1 issue at initial price thoughts of low 8%s  with pricing targeted for tomorrow.,normal
TAPR,Barclays Inverse US Treasury Composite ETN,20131112,RPT-Klesch awards German refinery supply deal to Barclays ,DAKAR/LONDON  Nov 11 Swiss industrial group Klesch has agreed that Barclays will supply crude oil to its German refinery in a deal worth hundreds of millions of dollars a month that boosts the bank's drive to increase its commodities business.,normal
BIIB,Biogen Inc,20131112,Belgium's Galapagos signs deal with U.S. group Biogen ,BRUSSELS  Nov 12 Belgian biotech group Galapagos  said its unit Biofocus signed a 3-year research deal with U.S. firm Biogen Idec to find new treatments for scleroderma.,topStory
CHTR,Charter Communications Inc,20131112,UPDATE 4-Dish says closer to deal to keep Disney networks on board ,(Adds comments from conference call  new analyst comments),normal
CSCO,Cisco Systems Inc,20131112,Exclusive: Cisco rival Arista Networks picks banks for IPO - sources ,NEW YORK Arista Networks  a maker of network switches that competes with much bigger rival Cisco Systems Inc  has selected banks to lead a proposed initial public offering for next year  according to people familiar with the matter.,topStory
CME,CME Group Inc,20131112,CME Group hikes transaction fees for 2014 ,CHICAGO CME Group Inc   the largest U.S. futures exchange operator  on Tuesday said it would increase transaction fees for nearly all its major products next year after making investments in resources and technology.,topStory
CMCSA,Comcast Corporation,20131112,UPDATE 4-Dish says closer to deal to keep Disney networks on board ,(Adds comments from conference call  new analyst comments),normal
DISH,DISH Network Corporation,20131112,US STOCKS-Wall St dips after 2-day rise; eyes on Fed's taper timing ,* Fed presidents Lockhart  Kocherlakota urge accommodative policy,topStory
DISH,DISH Network Corporation,20131112,US STOCKS-Wall St dips after 2 days of gains; eyes on Fed's next move ,* Fed presidents Lockhart  Kocherlakota urge accommodative policy,normal
DISH,DISH Network Corporation,20131112,Dish says closer to deal to keep Disney networks on board ,Dish Network Corp is closer to reaching a large-scale programming deal with Disney that would help the satellite TV provider avoid a possible blackout of popular networks such as ABC and ESPN  Chairman Charlie Ergen said on Tuesday.,normal
DISH,DISH Network Corporation,20131112,UPDATE 4-Dish says closer to deal to keep Disney networks on board ,(Adds comments from conference call  new analyst comments),normal
DISH,DISH Network Corporation,20131112,US STOCKS-Wall Street lower  led by energy and financials ,* Fed presidents Lockhart  Kocherlakota urge accommodative policy,normal
DISH,DISH Network Corporation,20131112,BRIEF-Dish network chairman says he won't rule out an acquisition of T-mobile ,* Chairman says he won't rule out an acquisition of t-mobile    Source text for Eikon:  Further company coverage:,normal
DISH,DISH Network Corporation,20131112,CORRECTED-UPDATE 1-Dish Network adds pay-TV customers  defying expectations ,(Corrects fourth bullet point to compare with year-earlier figure instead of estimate  which is not comparable because of tax benefit. Removes reference to earnings estimate in penultimate paragraph. The error did not appear in later versions of the story.),normal
DISH,DISH Network Corporation,20131112,US STOCKS-Wall St lower in muted trading on uncertainty about Fed ,* District Fed presidents Kocherlakota  Lockhart due to speak,normal
DISH,DISH Network Corporation,20131112,US STOCKS-Wall St slips as Dow retreats from record  focus on Fed ,* District Fed presidents Kocherlakota  Lockhart due to speak,normal
DISH,DISH Network Corporation,20131112,US STOCKS-Wall St set to open lower followed by more Fed speakers ,* China vows "decisive" role for markets  results seen by 2020,normal
FB,Facebook Inc,20131112,STOCK NEWS US-Bearish action is seen in Facebook options ,Real-time equity news [E U] U.S. stock market report   1414 ET 12Nov2013 Bearish action is seen in Facebook options -------------------------------------------------------------------------------  Shares in Facebook Inc rose 0.58 percent to $46.47 on Tuesday afternoon. But options activity on the stock this morning suggests some traders are positioning for the price of the underlying shares to continue lower in the near term  said Interactive Brokers Group equity options analyst Caitlin Duffy in,topStory
INTC,Intel Corporation,20131112,STOCK NEWS US-Traders eye later term Intel call options ,Real-time equity news [E U] U.S. stock market report   1452 ET 12Nov2013 Traders eye later term Intel call options  -------------------------------------------------------------------------------      Some players on Intel Corp appear to be shedding near-term calls and initiating new positions in longer-term options for upside exposure.,topStory
JAZZ,Jazz Pharmaceuticals plc,20131112,Nuggets' late surge keeps Jazz winless ,SALT LAKE CITY -- A rough start to the season keeps getting rougher for the Utah Jazz.,topStory
JBLU,JetBlue Airways Corporation,20131112,STOCK NEWS US-Bearish action is seen in Facebook options ,Real-time equity news [E U] U.S. stock market report   1414 ET 12Nov2013 Bearish action is seen in Facebook options -------------------------------------------------------------------------------  Shares in Facebook Inc rose 0.58 percent to $46.47 on Tuesday afternoon. But options activity on the stock this morning suggests some traders are positioning for the price of the underlying shares to continue lower in the near term  said Interactive Brokers Group equity options analyst Caitlin Duffy in,normal
MSFT,Microsoft Corporation,20131112,STOCK NEWS US-Bearish action is seen in Facebook options ,Real-time equity news [E U] U.S. stock market report   1414 ET 12Nov2013 Bearish action is seen in Facebook options -------------------------------------------------------------------------------  Shares in Facebook Inc rose 0.58 percent to $46.47 on Tuesday afternoon. But options activity on the stock this morning suggests some traders are positioning for the price of the underlying shares to continue lower in the near term  said Interactive Brokers Group equity options analyst Caitlin Duffy in,normal
MSFT,Microsoft Corporation,20131112,STOCK NEWS US-Call options on JetBlue Airways take off ,Real-time equity news [E U] U.S. stock market report   1337 ET 12Nov2013 Calls on JetBlue fly on broad strength in the airline sector  -------------------------------------------------------------------------------,normal
MSFT,Microsoft Corporation,20131112,STOCK NEWS US-Volatility ETN VXX draws large long-term put play ,Real-time equity news [E U] U.S. stock market report   1114 ET 12Nov2013 Volatility ETN VXX draws large long-term put purchase  -------------------------------------------------------------------------------      A large put buyer on the iPath S&P 500 VIX Short-Term Futures exchange-traded note appears to be speculating that the fund's shares will be pared by more than half by early 2016.,normal
MSFT,Microsoft Corporation,20131112,STOCK NEWS US-Strategists highlight key option trades this week ,Real-time equity news [E U] U.S. stock market report   1036 ET 12Nov2013 Strategists highlight key options trades this week  -------------------------------------------------------------------------------      Option order flow was muted on Monday  but there was interest to roll out protection from November to year-end in the emerging markets space  strategists said on Tuesday. About 640 000 puts traded in the iShares MSCI Emerging Market Fund on Monday versus 156 000 calls  according to Trade A,normal
SRPT,Sarepta Therapeutics Inc,20131112,Sarepta shares plunge 60 percent after FDA questions drug trial ,Sarepta Therapeutics Inc lost more than 60 percent of its market value after it was advised by the U.S. health regulator to find new ways to test its flagship treatment for a rare muscle disorder.,topStory
SRPT,Sarepta Therapeutics Inc,20131112,UPDATE 2-Sarepta shares plunge 60 pct after FDA questions drug trial ,* FDA questions drug trial design  says approval application premature,normal
SRPT,Sarepta Therapeutics Inc,20131112,Sarepta says FDA raises doubt about drug trial  shares drop 39 pct ,Nov 12 Sarepta Therapeutics Inc said the U.S. Food and Drug Administration had raised concerns about the trial for the company's experimental muscle disorder drug and considered the marketing application for the treatment to be premature.,normal
SINA,Sina Corporation,20131112,Sina Q3 profit more than doubles from year ago ,SAN FRANCISCO Chinese Internet company Sina Corp reported profit in the third quarter more than doubled from a year ago  due to strong revenue growth from its Weibo microblogging service.,topStory
SINA,Sina Corporation,20131112,Sina Q3 profit more than doubles from year ago ,SAN FRANCISCO  Nov 12 Chinese Internet company Sina Corp reported profit in the third quarter more than doubled from a year ago  due to strong revenue growth from its Weibo microblogging service.,normal
SBUX,Starbucks Corporation,20131112,Starbucks to pay $2.76 billion in Kraft grocery rift ,Starbucks Corp must pay Kraft Foods $2.76 billion after it ended the companies' grocery deal at least three years early  the coffee chain said on Tuesday.,topStory
SBUX,Starbucks Corporation,20131112,UPDATE 2-Starbucks to pay $2.76 bln in Kraft grocery rift ,(Rewrites first paragraph; adds analyst and Mondelez comment),normal
SBUX,Starbucks Corporation,20131112,Arbitrator says Starbucks must pay Kraft in grocery fight ,Nov 12 Starbucks Corp said on Tuesday an arbitrator has concluded that it must pay Kraft Foods Group Inc $2.23 billion in damages plus $527 million in prejudgment interest and attorneys fees after the coffee chain's early termination of the companies' grocery deal.,normal
TSLA,Tesla Inc ,20131112,Tesla car fires 'definitely' will not lead to recall: CEO ,DETROIT Tesla Motors Inc  will not recall its Model S electric car despite three vehicle fires that raised safety questions and hurt the automaker's stock price  CEO Elon Musk said on Tuesday.,topStory
TSLA,Tesla Inc ,20131112,UPDATE 1-Tesla car fires 'definitely' will not lead to recall -CEO ,DETROIT  Nov 12 Tesla Motors Inc will not recall its Model S electric car despite three vehicle fires that raised safety questions and hurt the automaker's stock price  CEO Elon Musk said on Tuesday.,normal
TSLA,Tesla Inc ,20131112,Tesla CEO says no recall for Model S electric car after fires ,DETROIT  Nov 12 Tesla Motors Inc Chief Executive Elon Musk said on Tuesday the company's Model S electric car will not be recalled despite three vehicle fires that raised safety questions and hurt the automaker's stock price.,normal
TSLA,Tesla Inc ,20131112,George Clooney not happy with Tesla Roadster he used to own ,DETROIT  Nov 12 Tesla Motors Inc got more bad news this week following the third fire in its Model S electric sedan as actor George Clooney complained about being stuck on the side of the road in the Roadster sports car he used to own.,normal
VNDA,Vanda Pharmaceuticals Inc,20131112,U.S. FDA review supports Vanda sleep drug; shares surge ,An experimental sleep-disorder drug made by Vanda Pharmaceuticals Inc is safe and effective enough to warrant approval  a U.S. Food and Drug Administration review found  sending the company's stock up as much as 88 percent on Tuesday.,topStory
VNDA,Vanda Pharmaceuticals Inc,20131112,UPDATE 2-U.S. FDA review supports Vanda sleep drug; shares surge ,Nov 12 An experimental sleep-disorder drug made by Vanda Pharmaceuticals Inc is safe and effective enough to warrant approval  a U.S. Food and Drug Administration review  found  sending the company's stock up as much as 88 percent on Tuesday.,normal
VNDA,Vanda Pharmaceuticals Inc,20131112,U.S. FDA review supports Vanda's sleep disorder drug ,Nov 12 An experimental sleep disorder drug made by Vanda Pharmaceuticals Inc is safe and effective enough to warrant approval  a U.S. Food and Drug Administration review  found.,normal
VOD,Vodafone Group Plc,20131112,UK shares close little changed as financials weigh ,* FTSE 100 closes marginally lower at 6 726.79 points     * RBS drops 2.4 pct after Goldman Sachs downgrade     * China reform worries dent miners     * Vodafone bounces as M&A speculation outweighs mixed update      By David Brett     LONDON  Nov 12 Financial stocks kept a lid on Britain's top share index on Tuesday after Goldman Sachs downgraded Royal Bank of Scotland.      While the FTSE 100 closed little changed  banks  and insurers combined to take 6.1 points off the index  hand,topStory
VOD,Vodafone Group Plc,20131112,Vodafone to ramp up investment as trading suffers ,LONDON Britain's Vodafone will spend 7 billion pounds - more than expected and earlier than expected - to increase the speed and coverage of its networks and reverse a record fall in revenues resulting from its struggling European business. | Video ,normal
VOD,Vodafone Group Plc,20131112,RBS leads financials retreat as Britain's FTSE falls ,LONDON Financials dragged Britain's top share index lower late on Tuesday after Goldman Sachs downgraded Royal Bank of Scotland  while China's economic reform plans hit mining stocks.,normal
VOD,Vodafone Group Plc,20131112,RBS leads financials retreat as Britain's FTSE falls ,* Vodafone bounces as M&A speculation outshines mixed update,normal
VOD,Vodafone Group Plc,20131112,UPDATE 3-Vodafone to ramp up investment as trading suffers ,LONDON  Nov 12 Britain's Vodafone will spend 7 billion pounds - more than expected and earlier than expected - to increase the speed and coverage of its networks and reverse a record fall in revenues resulting from its struggling European business.,normal
VOD,Vodafone Group Plc,20131112,China reform jitters hit miners as UK shares extend falls ,* FTSE 100 down 0.2 percent     * Concerns that Chinese reforms may be toned down rattle miners     * GlaxoSmithKline miss in heart drug study hits healthcare sector     * Vodafone rallies as M&A play after mixed update      By David Brett     LONDON  Nov 12 Concerns over pending economic reforms in China weighed on mining stocks on Tuesday  dragging the FTSE 100 further from five-month highs  and drugmaker GlaxoSmithKline fell after missing a goal in a major study.     Miners took 4,normal
VOD,Vodafone Group Plc,20131112,European shares dip as earnings continue to disappoint ,LONDON  Nov 12 European shares fell on Tuesday  drifting away from near five-year highs after a poor revenue report from German chip maker Infineon highlighted weak domestic demand  which is weighing on this quarterly earnings season.,normal
VOD,Vodafone Group Plc,20131112,Vodafone says could IPO Indian unit once tax case settled ,LONDON Vodafone  said it will look at listing its Indian unit once it resolves a more than $2 billion tax dispute with the country's government.,normal
VOD,Vodafone Group Plc,20131112,Vodafone says could IPO Indian unit once tax case settled ,LONDON  Nov 12 Vodafone said it will look at listing its Indian unit once it resolves a more than $2 billion tax dispute with the country's government.,normal
VOD,Vodafone Group Plc,20131112,Drugmakers  miners drag down Britain's FTSE 100 index ,LONDON  Nov 12 Britain's top share index dipped in early trading on Tuesday  with GlaxoSmithKline  leading pharmaceutical companies lower after one of its experimental heart drugs failed to meet targets in a first study.,normal
AMG,Affiliated Managers Group Inc,20131112,MOVES-Citi  Affiliated Managers Group  Deutsche Bank  BNY Mellon  RBC ,Nov 12 The following financial services industry appointments were announced on Tuesday. To inform us of other job changes  email to moves@thomsonreuters.com.,topStory
ARW,Arrow Electronics Inc,20131112,Arrow LNG a likely target in Shell spending rethink ,* Dropping Queensland export project could save $5 billion -analysts,topStory
BBVA,Banco Bilbao Viscaya Argentaria SA,20131112,Fitch Revises Rating Outlooks on BBVA and Santander Latam Subs' Ratings ,(The following statement was released by the rating agency) NEW YORK  November 12 (Fitch) Fitch Ratings has revised the Rating Outlook to  Stable from Negative and affirmed the ratings of some Latin American  subsidiaries of Banco Bilbao Vizcaya Argentaria (BBVA) and Banco Santander   following the Nov. 8 affirmation of BBVA's and Santander's Issuer Default  Ratings (IDRs) and Viability Rating (VR) which followed a similar rating action  on the Sovereign. (For more information  see 'Fitch Affirm,topStory
SAN,Banco Santander SA,20131112,Fitch Revises Rating Outlooks on BBVA and Santander Latam Subs' Ratings ,(The following statement was released by the rating agency) NEW YORK  November 12 (Fitch) Fitch Ratings has revised the Rating Outlook to  Stable from Negative and affirmed the ratings of some Latin American  subsidiaries of Banco Bilbao Vizcaya Argentaria (BBVA) and Banco Santander   following the Nov. 8 affirmation of BBVA's and Santander's Issuer Default  Ratings (IDRs) and Viability Rating (VR) which followed a similar rating action  on the Sovereign. (For more information  see 'Fitch Affirm,topStory
BAC,Bank of America Corporation,20131112,BofA  Freddie Mac in talks to settle mortgage dispute - WSJ ,Nov 12 Bank of America is in talks with Freddie Mac to resolve disputes involving more than $1.4 billion in defective mortgages that Freddie wants the bank to take back  the Wall Street Journal reported  citing people familiar with the matter.,topStory
BAC,Bank of America Corporation,20131112,UPDATE 3-New swaps regulator must prove mettle in Wall Street reform ,WASHINGTON  Nov 12 President Barack Obama on Tuesday named Timothy Massad  a lawyer who oversaw the U.S. government's $700 billion bank bailout program  as the next head of one of Wall Street's most powerful supervisors.,normal
BAC,Bank of America Corporation,20131112,Analysis: Wall Street sees social-impact bonds as way to do good and do well ,NEW YORK Wall Street banks are eyeing a nascent market that improves their public image at a low risk and still offers them a reasonable return on capital.,normal
BAC,Bank of America Corporation,20131112,CORRECTED-Wall St sees social-impact bonds as way to do good and do well ,(Corrects time span of Goldman loan in Utah to five years  not seven years  and clarifies that payback is over seven years  last two paragraphs),normal
BAC,Bank of America Corporation,20131112,Obama picks Massad as new head of US swaps regulator ,WASHINGTON  Nov 12 President Barack Obama plans to name Timothy Massad as the next head of the U.S. swaps regulator  a White House official said  picking a lawyer who earned his spurs at the nation's bank bailout program.,normal
BK,Bank Of New York Mellon Corporation (The),20131112,MOVES-Citi  Affiliated Managers Group  Deutsche Bank  BNY Mellon  RBC ,Nov 12 The following financial services industry appointments were announced on Tuesday. To inform us of other job changes  email to moves@thomsonreuters.com.,topStory
BCS,Barclays PLC,20131112,Barclays heads to Asia with around USD4.5bn in orders ,By Danielle Robinson Barclays is heading into the Asian trading day Wednesday with a solid book of around USD4.5bn for its perpetual non-call five-year Alternative Tier 1 Contingent Convertible capital security.,topStory
BCS,Barclays PLC,20131112,UPDATE 1-Barclays markets new bond to beef up capital ,LONDON  Nov 12 (IFR) - Barclays began testing investor interest on Tuesday for a US dollar perpetual non-call five-year bond in the low 8%s  as part of plans to beef up its leverage ratio.,normal
BCS,Barclays PLC,20131112,Barclays tests investor interest for US dollar additional Tier 1 Bond at low 8%s - lead ,LONDON  Nov 12 (IFR) - Barclays is testing investor interest for its USD-denominated Additional Tier 1 issue at initial price thoughts of low 8%s  with pricing targeted for tomorrow.,normal
BCS,Barclays PLC,20131112,RPT-Klesch awards German refinery supply deal to Barclays ,DAKAR/LONDON  Nov 11 Swiss industrial group Klesch has agreed that Barclays will supply crude oil to its German refinery in a deal worth hundreds of millions of dollars a month that boosts the bank's drive to increase its commodities business.,normal
BA,Boeing Company (The),20131112,Mitsubishi proposes to build 777X wings in Japan: source ,TOKYO Japan's Mitsubishi Heavy  has suggested a cost-saving way to build the wings of Boeing Co's  newest jet that could offer the planemaker a "Plan B" should its own workers reject a labor deal  a person with knowledge of the proposal said.,topStory
BA,Boeing Company (The),20131112,UPDATE 2-Mitsubishi proposes to build 777X wings in Japan -source ,* Japan co would build 777X wings next to 787 plant-source,normal
BA,Boeing Company (The),20131112,Mitsubishi makes proposal to build 777X wings in Japan -source ,Nov 12 Japan's Mitsubishi Heavy has suggested significant cost savings as part of a behind-the-scenes proposal to Boeing to build the wings of its next jetliner in Japan  a person with knowledge of the proposal said.,normal
BA,Boeing Company (The),20131112,Analysis: Boeing  Washington machinists may find compromise on 777X ,NEW YORK Boeing's biggest union rallied against a proposed labor contract on Monday  calling the offer "destructive and divisive" and vowing to reject it at the ballot box on Wednesday.,normal
BA,Boeing Company (The),20131112,Boeing hopeful of 777X deal  may build wings in Japan if rejected ,TOKYO Boeing Co  is hopeful its key machinist union will vote for a labor contract to secure production of the 777X in Washington State  but will look at alternatives  including building the wings in Japan if the deal is rejected  an executive said on Tuesday,normal
BA,Boeing Company (The),20131112,UPDATE 1-Boeing hopeful of 777X deal  may build wings in Japan if rejected ,TOKYO  Nov 12 Boeing Co is hopeful its key machinist union will vote for a labour contract to secure production of the 777X in Washington State  but will look at alternatives  including building the wings in Japan if the deal is rejected  an executive said on Tuesday,normal
BA,Boeing Company (The),20131112,Boeing hopeful of 777X union deal  but may build wings in Japan if rejected ,TOKYO  Nov 12 Boeing Co is hopeful its key machinist union will vote for a labour contract to secure production of the 777X in Washington State  but will look at alternatives  including building the wings in Japan if the deal is rejected  an executive said on Tuesday,normal
BP,BP plc,20131112,Deals of the day- Mergers and acquisitions ,(Adds US Airways Group  ProsiebenSat.1  Men's Wearhouse; Updates Western Refining),topStory
CAT,Caterpillar Inc,20131112,GE pushes gas power for drill rigs  Caterpillar's diesel turf ,* Caterpillar has dominant position in market for rig engines,topStory
CVX,Chevron Corporation,20131112,Chevron makes its case in trial over $19 billion Ecuadorean judgment ,NEW YORK Chevron Corp  is bringing its enormous resources to bear in a court case in New York in which it has accused a U.S. lawyer of using fraud to win a $19 billion environmental judgment against it.,topStory
CVX,Chevron Corporation,20131112,Chevron makes its case in trial over $19 bln Ecuadorean judgment ,NEW YORK  Nov 12 Chevron Corp is bringing its enormous resources to bear in a court case in New York in which it has accused a U.S. lawyer of using fraud to win a $19 billion environmental judgment against it.,normal
