SNP,China Petroleum & Chemical Corporation,20131112,Flush with fuel  China targets new markets from Africa to Australia ,* Sinopec exploring Africa and Australia; building storage in Indonesia,topStory
CNK,Cinemark Holdings Inc,20131112,Mexico watchdog OKs Cinemex acquisition of Cinemark subsidiary ,MEXICO CITY Mexico's competition watchdog on Tuesday approved movie theater chain Cinemex's purchase of the operations of U.S. group Cinemark's local subsidiary  after blocking the deal earlier in the year.,topStory
CNK,Cinemark Holdings Inc,20131112,Mexico watchdog OKs Cinemex acquisition of Cinemark subsidiary ,MEXICO CITY  Nov 12 Mexico's competition watchdog on Tuesday approved movie theater chain Cinemex's purchase of the operations of U.S. group Cinemark's  local subsidiary  after blocking the deal earlier in the year.,normal
CEO,CNOOC Limited,20131112,Flush with fuel  China targets new markets from Africa to Australia ,* Sinopec exploring Africa and Australia; building storage in Indonesia,topStory
CEO,CNOOC Limited,20131112,Arrow LNG a likely target in Shell spending rethink ,* Dropping Queensland export project could save $5 billion -analysts,normal
CEO,CNOOC Limited,20131112,Brazil set to become major global oil supplier -IEA ,LONDON  Nov 12 Brazil is set to become a net oil exporter and top 10 producer from 2015 if it overcomes hurdles to developing its giant offshore discoveries  the West's energy agency said on Tuesday.,normal
DHI,DR Horton Inc,20131112,D.R. Horton home sales rise in October as mortgage rates ease ,D.R. Horton Inc  said home sales picked up in October as mortgage rates eased from two-year highs and the effects of policy paralysis in Washington faded.,topStory
DHI,DR Horton Inc,20131112,UPDATE 2-D.R. Horton home sales rise in October as mortgage rates ease ,* Shares rise 2 pct premarket   (Adds analyst comment  details; updates shares),normal
DHI,DR Horton Inc,20131112,D.R. Horton orders fall 2 pct as housing demand slows ,Nov 12 U.S. homebuilder D.R. Horton Inc  said its orders fell 2 percent in the fourth quarter due to rising mortgage rates and policy uncertainty in Washington.,normal
DHR,Danaher Corporation,20131112,Update-Moody's has assigned definitive ratings to notes issued by Closed Joint Stock Company "Mortgage agent ITB 2013"  Russian RMBS ,For the full text of this story please click the following link:,topStory
KODK,Eastman Kodak Company,20131112,Eastman Kodak posts adjusted loss after bankruptcy exit ,Eastman Kodak Co   the once mighty photography pioneer that emerged from bankruptcy protection in September  reported a quarterly loss of $155 million after stripping off reorganization items and discontinued operations.,topStory
KODK,Eastman Kodak Company,20131112,Eastman Kodak posts adjusted loss after bankruptcy exit ,Nov 12 Eastman Kodak Co  the once mighty photography pioneer that emerged from bankruptcy protection in September  reported a quarterly loss of $155 million after stripping off reorganization items and discontinued operations.,normal
E,ENI SpA,20131112,UPDATE 1-EnBW's profit hurt by low wholesale power prices ,* Nine-month adjusted EBITDA down 2.5 pct at 1.816 billion euros,topStory
XOM,Exxon Mobil Corporation,20131112,Exxon Mobil granted extension to work on shut Pegasus oil pipe ,NEW YORK  Nov 12 Exxon Mobil has been granted a 90-day extension to submit a plan to repair its 70-year-old Pegasus oil pipeline that ruptured in Arkansas in March this year  guaranteeing the line will be closed until at least January  according to a filing from the Pipeline and Hazardous Materials Safety Administration (PHMSA).,topStory
FDX,FedEx Corporation,20131112,Third Point's Loeb owns FedEx stock  bullish on Japan: CNBC ,NEW YORK Activist investor Dan Loeb  founder of hedge fund Third Point LLC  said Tuesday that his investment firm owns shares of FedEx Corp  and remains bullish on Japan.,topStory
FIG,Fortress Investment Group LLC,20131112,Fortress-owned Intrawest Resorts files to go public ,Mountain resort operator Intrawest Resorts Holdings  owned by private equity firm Fortress Investment Group LLC   filed with U.S. regulators to raise up to $100 million in an initial public offering of common stock.,topStory
FIG,Fortress Investment Group LLC,20131112,Fortress-owned Intrawest Resorts files to go public ,Nov 12 Mountain resort operator Intrawest Resorts Holdings  owned by private equity firm Fortress Investment Group LLC  filed with U.S. regulators to raise up to $100 million in an initial public offering of common stock.,normal
GFA,Gafisa SA,20131112,UPDATE 1-Brazil builder MRV sees Q4 project launches speeding up ,SAO PAULO  Nov 12 Brazilian homebuilder MRV Engenharia e Participações SA plans to increase the pace of new project launches in the fourth quarter and beyond as the company sells off existing inventory  Chief Executive Officer Rubens Menin said on Tuesday.,topStory
GFA,Gafisa SA,20131112,Brazil builder MRV posts lower profit  debt and cancellations drop ,SAO PAULO  Nov 11 MRV Engenharia e Participacoes SA  one of Brazil's biggest homebuilders  posted a 13.2 percent decline in quarterly profit from a year earlier  although strong cash generation helped reduce debt levels and cancellations declined.,normal
GEH,General Electric Capital Corporation,20131112,GE pushes gas power for drill rigs  Caterpillar's diesel turf ,* Caterpillar has dominant position in market for rig engines,topStory
GEK,General Electric Capital Corporation,20131112,GE pushes gas power for drill rigs  Caterpillar's diesel turf ,* Caterpillar has dominant position in market for rig engines,topStory
GE,General Electric Company,20131112,GE pushes gas power for drill rigs  Caterpillar's diesel turf ,* Caterpillar has dominant position in market for rig engines,topStory
GEB,General Electric Company,20131112,GE pushes gas power for drill rigs  Caterpillar's diesel turf ,* Caterpillar has dominant position in market for rig engines,topStory
GSK,GlaxoSmithKline PLC,20131112,RBS leads financials retreat as Britain's FTSE falls ,* Vodafone bounces as M&A speculation outshines mixed update,topStory
GSK,GlaxoSmithKline PLC,20131112,China reform jitters hit miners as UK shares extend falls ,* FTSE 100 down 0.2 percent     * Concerns that Chinese reforms may be toned down rattle miners     * GlaxoSmithKline miss in heart drug study hits healthcare sector     * Vodafone rallies as M&A play after mixed update      By David Brett     LONDON  Nov 12 Concerns over pending economic reforms in China weighed on mining stocks on Tuesday  dragging the FTSE 100 further from five-month highs  and drugmaker GlaxoSmithKline fell after missing a goal in a major study.     Miners took 4,normal
GSK,GlaxoSmithKline PLC,20131112,GlaxoSmithKline heart drug misses goal in major study ,LONDON An experimental GlaxoSmithKline drug  designed to fight heart disease in a new way  failed to meet its main goal in a major late-stage clinical study  dealing a blow to one of the company's biggest new treatment hopes.,normal
GSK,GlaxoSmithKline PLC,20131112,UPDATE 2-GlaxoSmithKline heart drug misses goal in major study ,* GSK says some success in secondary goals needs analysis,normal
GSK,GlaxoSmithKline PLC,20131112,Drugmakers  miners drag down Britain's FTSE 100 index ,LONDON  Nov 12 Britain's top share index dipped in early trading on Tuesday  with GlaxoSmithKline  leading pharmaceutical companies lower after one of its experimental heart drugs failed to meet targets in a first study.,normal
GSK,GlaxoSmithKline PLC,20131112,GlaxoSmithKline heart drug misses goal in major study ,LONDON  Nov 12 An experimental drug from GlaxoSmithKline  designed to fight heart disease in a new way  failed to meet its main goal in the first of two big late-stage clinical studies  the company said on Tuesday.,normal
GLP,Global Partners LP,20131112,CME Group hikes transaction fees for 2014 ,CHICAGO CME Group Inc   the largest U.S. futures exchange operator  on Tuesday said it would increase transaction fees for nearly all its major products next year after making investments in resources and technology.,topStory
GOL,Gol Linhas Aereas Inteligentes SA,20131112,Brazil airline Gol posts smaller quarterly net loss ,SAO PAULO  Nov 12 Brazilian airline Gol Linhas Aereas  reported on Tuesday a net loss of 197 million reais ($84.58 million) in the third quarter  compared to a loss of 309.4 million reais a year earlier  according to a securities filing.,topStory
GS,Goldman Sachs Group Inc (The),20131112,Big bonuses in good times help Goldman cut pay in bad times -CEO ,NEW YORK  Nov 12 Goldman Sachs Group Inc  can cut pay dramatically and maintain staff when times are tough because it pays so well in good times  Chief Executive Lloyd Blankfein said on Tuesday.,topStory
ICE,Intercontinental Exchange Inc,20131112,ICE completes takeover of NYSE ,NEW YORK IntercontinentalExchange Inc's  takeover of NYSE Euronext  is complete and stock of the combined company will begin trading under the symbol ICE on Wednesday  said the head of ICE  an exchange and clearing house operator.,topStory
ICE,Intercontinental Exchange Inc,20131112,ICE completes takeover of NYSE ,NEW YORK  Nov 12 IntercontinentalExchange Inc's  takeover of NYSE Euronext is complete and stock of the combined company will begin trading under the symbol ICE on Wednesday  said the head of ICE  an exchange and clearing house operator.,normal
ITUB,Itau Unibanco Banco Holding SA,20131112,UPDATE 1-Itau's Setubal says loan risk strategy shift bearing fruit ,SAO PAULO  Nov 12 Itau Unibanco Holding SA is achieving every goal of a strategy to reduce its lending risks that it set about two years ago  Chief Executive Officer Roberto Egydio Setubal said on Tuesday  a sign that Brazil's largest private-sector lender will not grow aggressively in coming years.,topStory
ITUB,Itau Unibanco Banco Holding SA,20131112,Itau shifted loan strategy due to uncertain Brazil economy -CEO ,SAO PAULO  Nov 12 Itau Unibanco Holding SA started a "massive" reduction in the riskiness of its loans about two years ago  a change in strategy that was chiefly prompted by uncertainty about long-term Brazilian economic growth  Chief Executive Roberto Egydio Setubal said on Tuesday.,normal
JNJ,Johnson & Johnson,20131112,J&J reaches $4 billion deal on hip implant lawsuits: report ,Johnson & Johnson will pay more than $4 billion to settle thousands of lawsuits over its recalled defective hip implants  Bloomberg reported late on Tuesday  citing three people familiar with the deal.,topStory
JNJ,Johnson & Johnson,20131112,UPDATE 1-J&J reaches $4 bln deal on hip implant lawsuits -report ,Nov 12 Johnson & Johnson will pay more than $4 billion to settle thousands of lawsuits over its recalled defective hip implants  Bloomberg reported late on Tuesday  citing three people familiar with the deal.,normal
JNJ,Johnson & Johnson,20131112,J&J said to reach $4 bln deal on hip implant lawsuits: report ,Nov 12 Johnson & Johnson will pay more than $4 billion to settle thousands of lawsuits over its recalled defective hip implants  Bloomberg reported late on Tuesday  citing three people familiar with the deal.,normal
KEX,Kirby Corporation,20131112,TV pitchman Trudeau found guilty of criminal contempt ,CHICAGO A federal jury found pitchman Kevin Trudeau guilty of criminal contempt on Tuesday for exaggerating the contents of his weight-loss book in infomercials  and he was taken into custody  prosecutors said.,topStory
KEX,Kirby Corporation,20131112,U.S. TV pitchman Trudeau found guilty of criminal contempt ,CHICAGO  Nov 12 A federal jury found pitchman Kevin Trudeau guilty of criminal contempt on Tuesday for exaggerating the contents of his weight-loss book in infomercials  and he was taken into custody  prosecutors said.,normal
KKR,KKR & Co LP,20131112,KKR mulls 1.5 billion pounds Pets at Home float: Sky News ,Private equity firm KKR & Co LP  is considering a 1.5 billion pound ($2.4 billion) initial public offering of British pet products retailer Pets at Home  Sky News reported on Tuesday  citing insiders.,topStory
KKR,KKR & Co LP,20131112,KKR mulls 1.5 bln stg Pets at Home float -Sky News ,Nov 12 Private equity firm KKR & Co LP  is considering a 1.5 billion pound ($2.4 billion) initial public offering of British pet products retailer Pets at Home  Sky News reported on Tuesday  citing insiders.,normal
LYG,Lloyds Banking Group Plc,20131112,UKFI says resisted government attempt to cut RBS  Lloyds pay ,LONDON The body that owns Britain's bank stakes resisted proposals by the government to cut bonuses at Royal Bank of Scotland  and Lloyds  more sharply  its boss said on Tuesday.,topStory
MSI,Motorola Solutions Inc,20131112,Motorola plans lower-cost phone amid weak sales of Moto X - WSJ ,Nov 11 Google Inc's Motorola unit is expected to unveil a relatively low-cost phone on Wednesday  amid weak sales of its flagship Moto X model  the Wall Street Journal reported  citing people familiar with the matter.,topStory
NYT,New York Times Company (The),20131112,U.S. exchanges outline plans to address Nasdaq trading halt ,NEW YORK U.S. stock and option exchanges said on Tuesday they reached a general agreement on how to strengthen securities markets after federal regulators ordered them to come up with new rules in the wake of Nasdaq's three-hour trading halt in August.,topStory
NFX,Newfield Exploration Company,20131112,RLPC-Malaysia's Sapurakencana in talks with banks for $5.8 bln loan ,LONDON  Nov 12 Malaysian oilfield service provider SapuraKencana Bhd is raising a syndicated loan of up to $5.8 billion  which would be one of the largest loans ever raised for a Malaysian company  banking sources said on Tuesday.,normal
NMR,Nomura Holdings Inc ADR,20131112,Nomura announces six hires to boost banking business ,Asian investment bank Nomura Holdings Inc  said on Tuesday it had made a number of hires as it seeks to strengthen its investment banking division.,topStory
NMR,Nomura Holdings Inc ADR,20131112,Nomura announces six hires to boost banking business ,Nov 12 Asian investment bank Nomura Holdings Inc  said on Tuesday it had made a number of hires as it seeks to strengthen its investment banking division.,normal
NS,Nustar Energy LP,20131112,UPDATE 1-NuStar approves Phase II of South Texas pipeline project ,HOUSTON  Nov 12 Nustar Energy LP will move forward with the second phase of its South Texas Crude Oil Pipeline System expansion  Chief Executive Curt Anastasio told analysts on Tuesday.,topStory
NS,Nustar Energy LP,20131112,NuStar approves Phase II of South Texas crude pipeline project ,HOUSTON  Nov 12 Nustar Energy LP will move forward with the second phase of its South Texas Crude Oil Pipeline System project  Chief Executive Curt Anastasio told analysts on Tuesday.,normal
ORAN,Orange,20131112,France's Orange telecoms group sees huge growth in Iraq ,CAPE TOWN  Nov 12 France's Orange SA  expects rapid customer and revenue growth in Iraq  where it holds a 20 percent stake in mobile operator Korek  as it gears up for a 3G licence expected early next year  a senior official said on Tuesday.,topStory
P,Pandora Media Inc,20131112,UPDATE 1-Denmark's Pandora confirms third-quarter profit jump ,* Sales grew more than 50 percent in Europe and Asia Pacific,topStory
P,Pandora Media Inc,20131112,Denmark's Pandora confirms third-quarter profit jump ,COPENHAGEN  Nov 12 Danish jewellery maker Pandora confirmed preliminary third-quarter results published in late October  when it raised its full-year results forecasts after sales growth in all its major regions.,normal
PTR,PetroChina Company Limited,20131112,Flush with fuel  China targets new markets from Africa to Australia ,* Sinopec exploring Africa and Australia; building storage in Indonesia,topStory
PBR,Petroleo Brasileiro SA- Petrobras,20131112,EMERGING MARKETS-Brazil stocks drop as state-run firms sink ,* Brazil's Bovespa falls 1.56 pct  Mexico's IPC down 0.23 pct,topStory
PBR,Petroleo Brasileiro SA- Petrobras,20131112,EMERGING MARKETS-Brazil stocks drop as state-run firms sink ,* Brazil's Bovespa falls 0.96 pct  Mexico's IPC down 0.15 pct      SAO PAULO  Nov 12 Brazilian stocks slipped for the third session in four on Tuesday  due mostly to a fall in shares of state-run companies Banco do Brasil and Petrobras.     Mexico's IPC index edged lower  while Chile's bourse  rose its most in nearly two weeks.     Brazil's benchmark Bovespa stock index fell 0.96 percent to 52 117.81  a level it has not closed below in over two months.     Shares of state-run oil com,normal
PBR,Petroleo Brasileiro SA- Petrobras,20131112,Petrobras meeting will not deal with fuel price hike -Mantega ,BRASILIA  Nov 12 Brazil's state-run oil firm Petrobras will not discuss the adjustment of fuel prices in an extraordinary board meeting called for the afternoon  Finance Minister Guido Mantega  who is the company's board chairman  said on Tuesday.,normal
POT,Potash Corporation of Saskatchewan Inc,20131112,Potash slump raises stakes in Russia legal battle ,* Eurochem seeks $800 mln from London-listed Shaft Sinkers,topStory
RBS,Royal Bank Scotland plc (The),20131112,RBS leads financials retreat as Britain's FTSE falls ,LONDON Financials dragged Britain's top share index lower late on Tuesday after Goldman Sachs downgraded Royal Bank of Scotland  while China's economic reform plans hit mining stocks.,topStory
RBS,Royal Bank Scotland plc (The),20131112,RBS leads financials retreat as Britain's FTSE falls ,* Vodafone bounces as M&A speculation outshines mixed update,normal
RBS,Royal Bank Scotland plc (The),20131112,RBS must tackle capital issues before share sale: UKFI ,LONDON Part-nationalized Royal Bank of Scotland  must address issues over its capital and future strategy before the government can start selling its shares  the new head of the agency managing Britain's bank stakes told lawmakers.,normal
RBS,Royal Bank Scotland plc (The),20131112,UPDATE 2-RBS must tackle capital issues before share sale -UKFI ,* Restructuring may accelerate sale process-New UKFI head,normal
RBS,Royal Bank Scotland plc (The),20131112,RBS must tackle capital issues before share sale: UKFI ,LONDON Part-nationalized Royal Bank of Scotland  must address issues over its capital and future strategy before the government can start selling its shares  the new head of the agency managing Britain's bank stakes told lawmakers.,normal
RBS,Royal Bank Scotland plc (The),20131112,BRIEF-UKFI says RBS share sale could be accelerated by restructuring ,Nov 12 RBS:  * Ukfi's chairman says Lloyds made it aware of challenges co-op was facing in,normal
RBS,Royal Bank Scotland plc (The),20131112,UKFI says resisted government attempt to cut RBS  Lloyds pay ,LONDON The body that owns Britain's bank stakes resisted proposals by the government to cut bonuses at Royal Bank of Scotland  and Lloyds  more sharply  its boss said on Tuesday.,normal
RBS,Royal Bank Scotland plc (The),20131112,UKFI says resisted government attempt to cut RBS  Lloyds pay ,LONDON  Nov 12 The body that owns Britain's bank stakes resisted proposals by the government to cut bonuses at Royal Bank of Scotland and Lloyds more sharply  its boss said on Tuesday.,normal
SEAS,SeaWorld Entertainment Inc,20131112,Killer whale proximity to trainer key to shows  SeaWorld tells court ,WASHINGTON Putting killer whales and their trainers together in close proximity is an important part of SeaWorld's shows  the marine park operator said on Tuesday in asking a federal court to overturn an order to put more space between orcas and humans.,topStory
SEAS,SeaWorld Entertainment Inc,20131112,Killer whale proximity to trainer key to shows  SeaWorld tells court ,WASHINGTON  Nov 12 Putting killer whales and their trainers together in close proximity is an important part of SeaWorld's shows  the marine park operator said on Tuesday in asking a federal court to overturn an order to put more space between orcas and humans.,normal
SMFG,Sumitomo Mitsui Financial Group Inc,20131112,UPDATE 1-SMFG lifts full-year profit forecast on back of Nikkei's gains ,* Lifts full-year net profit forecast 750 bln yen from 580 bln yen earlier,topStory
SMFG,Sumitomo Mitsui Financial Group Inc,20131112,SMFG first-half profit jumps 53 pct  boosted by Japan stocks rally ,TOKYO  Nov 12Sumitomo Mitsui Financial Group's  reported a 53-percent jump in net profit for the six months ended in September  as a rally in Japanese stocks boosted the value of its equities holdings.,normal
TSM,Taiwan Semiconductor Manufacturing Company Ltd,20131112,TSMC appoints president and co-CEO as expected ,Nov 12 Taiwan Semiconductor Manufacturing Co Ltd    the world's No. 1 contract chip maker  said on Tuesday it has appointed Mark Liu and C.C. Wei as president and co-CEO  taking over from 82-year-old Morris Chang who stays as chairman.,topStory
TI,Telecom Italia SPA,20131112,Mediaset CFO says no tower deal on table with Telecom Italia ,MILAN Mediaset's  CFO Marco Giordani said on Tuesday that the company's EI Towers  unit would take part in an expected consolidation of the market but added there was no agreement for a possible purchase of Telecom Italia's  towers.,topStory
TI,Telecom Italia SPA,20131112,Mediaset CFO says no tower deal on table with Telecom Italia ,MILAN  Nov 12 Mediaset's CFO Marco Giordani said on Tuesday that the company's EI Towers  unit would take part in an expected consolidation of the market but added there was no agreement for a possible purchase of Telecom Italia's towers.,normal
TI,Telecom Italia SPA,20131112,Italy regulator making checks on Telecom Italia's plans - source ,MILAN  Nov 12 Italian market regulator Consob is carrying out checks on Telecom Italia's asset sales plan and on the 1.3 billion euros ($1.74 billion) convertible bond the company sold last week  a source close to Consob told Reuters.,normal
BX,The Blackstone Group LP,20131112,BRIEF-Blackstone expects BCP V to be 1.5 to 2 times fund ,Nov 12 Blackstone Group LP President Tony James at the Bank of America Merrill Lynch Banking and Financial Services conference:  * Expects BCP V to yield 1.5 to 2 times investors'money on a gross basis.,topStory
DIS,Walt Disney Company (The),20131112,UPDATE 4-Dish says closer to deal to keep Disney networks on board ,(Adds comments from conference call  new analyst comments),topStory
DIS,Walt Disney Company (The),20131112,REFILE-UPDATE 2-Disney games co-president named consultant as unit consolidates ,LOS ANGELES  Nov 11 Walt Disney Co said on Monday it has consolidated the video games and online businesses in its interactive unit and that co-President John Pleasants has left his post to become a consultant for the division.,normal
XRX,Xerox Corporation,20131112,Fitch Affirms Xerox's IDR at 'BBB'; Outlook Stable ,(The following statement was released by the rating agency) NEW YORK  November 12 (Fitch) Fitch Ratings has affirmed the following ratings  for Xerox Corp. (Xerox) and its wholly-owned subsidiary  Affiliated Computer  Services  Inc. (ACS):  Xerox --Long-term Issuer Default Rating (IDR) at 'BBB'; --Short-term IDR at 'F2'; --Revolving credit facility (RCF) at 'BBB'; --Senior unsecured debt at 'BBB'; --Commercial paper (CP) at 'F2'. ACS --IDR at 'BBB'; --Senior notes at 'BBB'. The Rating Outlook is,topStory
YGE,Yingli Green Energy Holding Company Limited,20131112,Solar company Yingli pushes into China as demand rises ,Yingli Green Energy Holding  posted a sharp fall in third-quarter loss due to robust demand from solar power plants in China and said it expects the country to account for nearly half of its shipments in the current quarter.,topStory
YGE,Yingli Green Energy Holding Company Limited,20131112,UPDATE 2-Solar company Yingli pushes into China as demand rises ,* Third-quarter net loss $0.25/share vs $0.98/share year ago,normal
YGE,Yingli Green Energy Holding Company Limited,20131112,Yingli's loss narrows as solar panel price rises ,Nov 12 Yingli Green Energy Holding  posted a narrower third-quarter loss as improved selling prices for solar panels and lower costs propped up margins.,normal
YUM,Yum! Brands Inc,20131112,Yum China sales down 5 percent in October ,KFC and Pizza Hut parent Yum Brands Inc  on Tuesday said October sales at established restaurants in China fell 5 percent  as it fights to recover from a chicken safety scare and bird flu outbreak in its top market.,topStory
YUM,Yum! Brands Inc,20131112,UPDATE 2-Yum China sales down 5 percent in October ,Nov 12 KFC and Pizza Hut parent Yum Brands Inc  on Tuesday said October sales at established restaurants in China fell 5 percent  as it fights to recover from a chicken safety scare and bird flu outbreak in its top market.,normal
YUM,Yum! Brands Inc,20131112,UPDATE 1-Yum China sales down less than expected in October ,Nov 12 KFC and Pizza Hut parent Yum Brands  on Tuesday said October sales at established restaurants in China fell 5 percent  a smaller-than-expected drop  as it fights to recover from a chicken safety scare and bird flu in its top market for sales.,normal
