AMZN,Amazoncom Inc,20151218,UPDATE 1-Amazon in talks to lease Boeing jets to launch air-cargo business-report ,Dec 18 Amazon.com Inc is negotiating to lease 20 Boeing Co 767 jets to start its own air-delivery service next month  seeking to avoid delays from third-party carriers  the Seattle Times reported  citing cargo-industry executives.,normal
AMZN,Amazoncom Inc,20151218,Amazon in talks to lease Boeing jets to launch air-cargo business-report ,Dec 18 Amazon.com Inc is negotiating to lease 20 Boeing Co 767 jets to start its own air-delivery service next month  seeking to avoid delays from third-party carriers  the Seattle Times reported  citing cargo-industry executives.,normal
AAPL,Apple Inc,20151218,Tim Cook calls notion of Apple avoiding U.S. taxes 'political crap' ,SAN FRANCISCO/BENGALURU Apple Inc Chief Executive Tim Cook dismissed as "total political crap" the notion that the tech giant was avoiding taxes.,topStory
AAPL,Apple Inc,20151218,UPDATE 2-Tim Cook calls notion of Apple avoiding US taxes 'political crap' ,SAN FRANCISCO/BENGALURU  Dec 18 Apple Inc  Chief Executive Tim Cook dismissed as "total political crap" the notion that the tech giant was avoiding taxes.,normal
AAPL,Apple Inc,20151218,Apple hit with proposed class suit over iPhone data usage ,A proposed class action filed against Apple Inc in federal court in California claims that a defect in certain iPhone models caused them to eat up excessive amounts of cellular data  leading to massive bills for users.,normal
AAPL,Apple Inc,20151218,Apple to launch Apple Pay in China  take on Alibaba  Tencent ,SHANGHAI Apple Inc said it will launch its payment service in China as soon as 2016  pitting it against entrenched Chinese rivals Alibaba Group Holding and Tencent Holdings.,normal
AAPL,Apple Inc,20151218,UPDATE 2-Apple to launch Apple Pay in China  take on Alibaba  Tencent ,* China online payments soar on high smartphone use   (Adds analyst comment),normal
AAPL,Apple Inc,20151218,Apple partners with UnionPay to launch payment service in China ,Dec 17 Apple Inc said on Thursday it had partnered with China UnionPay to launch payment service Apple Pay in China for China UnionPay cardholders by early 2016.,normal
ABY,Atlantica Yield plc,20151218,RPT-UPDATE 1-Abengoa Yield's dividend in the spotlight ,LONDON  Dec 17 (IFR) - Abengoa Yield's later-than-expected payment of its quarterly dividend has rattled some investors and put under scrutiny the sustainability of the company's distributions to shareholders.,topStory
TAPR,Barclays Inverse US Treasury Composite ETN,20151218,UPDATE 1-DBS  Julius Baer seen likely bidders Barclays Asia wealth unit-sources ,* Follows sale of several smaller banks in Asia   (Adds information from sources  background on wealth),topStory
TAPR,Barclays Inverse US Treasury Composite ETN,20151218,DBS  Julius Baer emerge as potential bidders for Barclays Asia wealth unit -sources ,SINGAPORE/MUMBAI  Dec 18 Singapore's DBS Group Holdings and Julius Baer have emerged as potential bidders for Barclays Asian private wealth business valued at around $600 million  sources familiar with the matter told Reuters.,normal
BMRN,BioMarin Pharmaceutical Inc,20151218,FDA delays BioMarin drug approval  gives investors hope ,The U.S. Food and Drug Administration pushed back its deadline to decide on drug developer BioMarin Pharmaceutical Inc's lead drug  not rejecting it outright  making shareholders optimistic.,topStory
BMRN,BioMarin Pharmaceutical Inc,20151218,UPDATE 2-FDA delays BioMarin drug approval  gives investors hope ,* Delay could mean higher chances of approval - analysts   (Adds analysts' comments; updates shares),normal
BMRN,BioMarin Pharmaceutical Inc,20151218,BioMarin says FDA to delay deciding on approval of DMD drug ,Dec 18 Drug developer BioMarin Pharmaceutical Inc said it was notified by the U.S. Food and Drug Administration that it would not be able to decide on the marketing of the company's lead drug as scheduled.,normal
HIBB,Hibbett Sports Inc,20151218,U.S. RESEARCH ROUNDUP-Accenture  Dick's Sporting  Pentair ,Dec 18 Wall Street securities analysts revised their ratings and price targets on several U.S.-listed companies  including Knight Transportation  Hibbett Sports and Pentair  on Friday.                HIGHLIGHTS     * Accenture : BMO raises price target to $110 from $105; rating market perform     * Delta Air Lines Inc : Deutsche Bank  Evercore ISI raise price target     * Dick's Sporting  Hibbett Sports : B. Riley starts coverage with neutral      * Pentair : RBC  Canaccord Genuity c,topStory
JMBA,Jamba Inc,20151218,Jamba to close underperforming juice stores in Chicago  New York ,Jamba Inc  which operates a chain of juice stores  said it would close some underperforming stores in Chicago and New York  leading to 104 job cuts  to lower operating costs.,topStory
JMBA,Jamba Inc,20151218,Jamba to close underperforming juice stores in Chicago  New York ,Dec 18 Jamba Inc  which operates a chain of juice stores  said it would close some underperforming stores in Chicago and New York  leading to 104 job cuts  to lower operating costs.,normal
POWI,Power Integrations Inc,20151218,Power Integrations says wins $139.8 mln in damages from Fairchild Semiconductor ,Power Integrations Inc said a jury awarded the company 139.8 million in damages from Fairchild Semiconductor International Inc for infringing two of its patents after a trial in a San Francisco federal court.,topStory
POWI,Power Integrations Inc,20151218,UPDATE 1-Power Integrations says wins $139.8 mln in damages from Fairchild Semiconductor ,Dec 17 Power Integrations Inc said a jury awarded the company 139.8 million in damages from Fairchild Semiconductor International Inc for infringing two of its patents after a trial in a San Francisco federal court.,normal
POWI,Power Integrations Inc,20151218,Power Integrations says wins $139.8 mln in damages from Fairchild Semiconductor ,Dec 17 Power Integrations Inc said a jury awarded the company 139.8 million in damages from Fairchild Semiconductor International Inc for infringing two of its patents after a trial in a federal court in San Francisco.,normal
CG,The Carlyle Group LP,20151218,Hilcorp  Carlyle form oil and gas partnership ,HOUSTON  Dec 18 Hilcorp Energy Co  a closely held U.S. independent exploration and production company  on Friday said it had formed a partnership with private equity firm Carlyle Group LP to acquire and develop North American oil and gas properties.,topStory
TCGP,The Carlyle Group LP,20151218,Hilcorp  Carlyle form oil and gas partnership ,HOUSTON  Dec 18 Hilcorp Energy Co  a closely held U.S. independent exploration and production company  on Friday said it had formed a partnership with private equity firm Carlyle Group LP to acquire and develop North American oil and gas properties.,topStory
TOUR,Tuniu Corporation,20151218,BRIEF-Hna-Caissa Travel's controlling shareholder scraps plan to invest in Tuniu ,* Says controlling shareholder scraps plan to invest in Nasdaq-listed Tuniu Corp,topStory
BABA,Alibaba Group Holding Limited,20151218,Alibaba avoids being named on U.S. blacklist for fakes ,WASHINGTON/SHANGHAI Chinese e-commerce giant Alibaba Group Holding Ltd has avoided being named on a U.S. blacklist for sites hosting the sale of fake goods  a victory for the firm after lobbying hard to avoid inclusion on the list.,topStory
BABA,Alibaba Group Holding Limited,20151218,UPDATE 1-Alibaba avoids being named on U.S. blacklist for fakes ,* U.S. body "concerned" by weak enforcement   (Recasts  adds Alibaba comment),normal
AMOV,America Movil SAB de CV,20151218,Mexico telecoms regulator backs AT&T and Telefonica spectrum deal ,MEXICO CITY Mexico's telecoms regulator on Thursday said it had approved swaps of frequency blocks and a spectrum rental deal between AT&T Inc and Telefonica SA  the main competitors to the country's dominant player  Carlos Slim's America Movil.,topStory
AMOV,America Movil SAB de CV,20151218,Mexico telecoms regulator backs AT&T and Telefonica spectrum deal ,MEXICO CITY  Dec 17 Mexico's telecoms regulator on Thursday said it had approved swaps of frequency blocks and a spectrum rental deal between AT&T Inc and Telefonica SA   the main competitors to the country's dominant player  Carlos Slim's America Movil.,normal
AMX,America Movil SAB de CV,20151218,Mexico telecoms regulator backs AT&T and Telefonica spectrum deal ,MEXICO CITY Mexico's telecoms regulator on Thursday said it had approved swaps of frequency blocks and a spectrum rental deal between AT&T Inc and Telefonica SA  the main competitors to the country's dominant player  Carlos Slim's America Movil.,topStory
AMX,America Movil SAB de CV,20151218,Mexico telecoms regulator backs AT&T and Telefonica spectrum deal ,MEXICO CITY  Dec 17 Mexico's telecoms regulator on Thursday said it had approved swaps of frequency blocks and a spectrum rental deal between AT&T Inc and Telefonica SA   the main competitors to the country's dominant player  Carlos Slim's America Movil.,normal
AXP,American Express Company,20151218,American Express can enforce anti-steering rules: court ,American Express Co  can once again enforce its rules prohibiting merchants from steering customers to other credit cards after an appeals court temporarily lifted an earlier court order on Friday.,topStory
AXP,American Express Company,20151218,American Express can enforce anti-steering rules -court ,American Express Co can once again enforce its rules prohibiting merchants from steering customers to other credit cards after an appeals court temporarily lifted an earlier court order on Friday.,normal
AXP,American Express Company,20151218,UPDATE 1-American Express can enforce anti-steering rules -court ,Dec 18 American Express Co can once again enforce its rules prohibiting merchants from steering customers to other credit cards after an appeals court temporarily lifted an earlier court order on Friday.,normal
AXP,American Express Company,20151218,Court stays order barring American Express anti-steering rules ,Dec 18 A federal appeals court has temporarily lifted an order barring American Express Co from enforcing rules prohibiting its merchants from steering customers to other credit cards.,normal
AGO,Assured Guaranty Ltd,20151218,Puerto Rico utility in tentative agreement to restructure debt -sources ,Puerto Rico's debt-laden power utility  PREPA  has a tentative agreement with its bond insurers on a restructuring of its debt  according to two sources familiar with negotiations  but the deal is not official and still needs approval by PREPA's board.,normal
AGO,Assured Guaranty Ltd,20151218,UPDATE 2-Puerto Rico utility in tentative agreement to restructure debt -sources ,SAN JUAN/NEW YORK  Dec 18 Puerto Rico's debt-laden power utility  PREPA  has a tentative agreement with its bond insurers on a restructuring of its debt  according to two sources familiar with negotiations  but the deal is not official and still needs approval by PREPA's board.,normal
AZN,Astrazeneca PLC,20151218,BRIEF-EU Medicines Agency recommends approval of AstraZeneca's gout drug ,* Recommends granting a conditional marketing authorisation for AstraZeneca's lung cancer drug Osimertinib,topStory
T,AT&T Inc,20151218,Mexico telecoms regulator backs AT&T and Telefonica spectrum deal ,MEXICO CITY Mexico's telecoms regulator on Thursday said it had approved swaps of frequency blocks and a spectrum rental deal between AT&T Inc and Telefonica SA  the main competitors to the country's dominant player  Carlos Slim's America Movil.,topStory
T,AT&T Inc,20151218,Mexico telecoms regulator backs AT&T and Telefonica spectrum deal ,MEXICO CITY  Dec 17 Mexico's telecoms regulator on Thursday said it had approved swaps of frequency blocks and a spectrum rental deal between AT&T Inc and Telefonica SA   the main competitors to the country's dominant player  Carlos Slim's America Movil.,normal
ALV,Autoliv Inc,20151218,BRIEF-Autoliv says board declared dividend of 56 cents/share for Q1 2016 ,* Autoliv says board declared a quarterly dividend of 56 cents per share for Q1 2016,topStory
ALV,Autoliv Inc,20151218,BRIEF-Autoliv appoints Volvo truck boss Bratt as new head of Passive Safety ,* Says has appointed Mikael Bratt as president of its Passive Safety business,normal
AVP,Avon Products Inc,20151218,Fitch Affirms Avon's IDR at 'B+'; Outlook Negative ,(The following statement was released by the rating agency) NEW YORK  December 18 (Fitch) Fitch Ratings affirms Avon Products  Inc.'s (Avon)  Long term Issuer Default Rating (IDR) of 'B+' with a Negative Outlook upon  today's announcement that Cerberus Capital Management (Cerberus) will (i) make a  $435 million 5% convertible preferred equity investment in Avon  which  represents 16.6% of diluted shares outstanding on an as-converted basis  and  (ii) invest $170 million for an 80% ownership in A,topStory
BNS,Bank of Nova Scotia (The),20151218,UPDATE 2-Scotiabank weighing $1.7 bln sale of Thanachart stake ,* Thanachart says will cooperate with Scotiabank if stake is sold,topStory
BNS,Bank of Nova Scotia (The),20151218,Thanachart Capital says to work with Scotiabank  on stake sale options ,BANGKOK  Dec 18 Thailand's Thanachart Capital Pcl said on Friday it will work with Scotiabank to find a new partner if the Canadian bank decided to sell its 49 percent stake in the Southeast Asian nation's sixth-largest lender Thanachart Bank.,normal
BCS,Barclays PLC,20151218,UPDATE 1-DBS  Julius Baer seen likely bidders Barclays Asia wealth unit-sources ,* Follows sale of several smaller banks in Asia   (Adds information from sources  background on wealth),topStory
BCS,Barclays PLC,20151218,DBS  Julius Baer emerge as potential bidders for Barclays Asia wealth unit -sources ,SINGAPORE/MUMBAI  Dec 18 Singapore's DBS Group Holdings and Julius Baer have emerged as potential bidders for Barclays Asian private wealth business valued at around $600 million  sources familiar with the matter told Reuters.,normal
BA,Boeing Company (The),20151218,Amazon in talks to lease Boeing jets to launch air-cargo business-report ,Dec 18 Amazon.com Inc is negotiating to lease 20 Boeing Co 767 jets to start its own air-delivery service next month  seeking to avoid delays from third-party carriers  the Seattle Times reported  citing cargo-industry executives.,topStory
BA,Boeing Company (The),20151218,UPDATE 1-Amazon in talks to lease Boeing jets to launch air-cargo business-report ,Dec 18 Amazon.com Inc is negotiating to lease 20 Boeing Co 767 jets to start its own air-delivery service next month  seeking to avoid delays from third-party carriers  the Seattle Times reported  citing cargo-industry executives.,normal
BP,BP plc,20151218,BP buys New Mexico oil and gas assets from Devon Energy ,HOUSTON BP Plc  on Friday said its U.S. onshore unit has acquired all of Devon Energy Corp's  oil and gas properties in the San Juan Basin in New Mexico for an undisclosed price.,topStory
BP,BP plc,20151218,BP buys New Mexico oil and gas assets from Devon Energy ,HOUSTON  Dec 18 BP Plc on Friday said its U.S. onshore unit has acquired all of Devon Energy Corp's  oil and gas properties in the San Juan Basin in New Mexico for an undisclosed price.,normal
BMY,Bristol-Myers Squibb Company,20151218,GSK to buy HIV drugs from Bristol-Myers Squibb ,LONDON  Dec 18 British pharmaceutical company GlaxoSmithKline said it would buy HIV drugs at different stages of development from U.S. rival Bristol-Myers Squibb  in a deal which would boost its ViiV Healthcare unit.,topStory
CACI,CACI International Inc,20151218,Exclusive: CACI in the lead to buy Lockheed's IT business - sources ,Defense contractor CACI International Inc  has emerged as the top contender for Lockheed Martin Corp's  government information technology (IT) business  as the interest of rival bidders fades  people familiar with the matter said.,topStory
CRI,Carter&#39;s Inc,20151218,Pentagon chief Carter calls use of personal email account 'a mistake' ,WASHINGTON U.S. Defense Secretary Ash Carter said on Thursday his occasional use of a personal email account for work-related matters was "a mistake" that he stopped a few months ago when it became clear to him it was against policy. | Video ,topStory
C,Citigroup Inc,20151218,Citi to cut 2 000 jobs starting next month - Bloomberg ,Dec 18 Citigroup Inc plans to cut at least 2 000 jobs starting next month as the lender restructures its businesses  Bloomberg reported.,topStory
DVN,Devon Energy Corporation,20151218,BP buys New Mexico oil and gas assets from Devon Energy ,HOUSTON BP Plc  on Friday said its U.S. onshore unit has acquired all of Devon Energy Corp's  oil and gas properties in the San Juan Basin in New Mexico for an undisclosed price.,topStory
DVN,Devon Energy Corporation,20151218,BP buys New Mexico oil and gas assets from Devon Energy ,HOUSTON  Dec 18 BP Plc on Friday said its U.S. onshore unit has acquired all of Devon Energy Corp's  oil and gas properties in the San Juan Basin in New Mexico for an undisclosed price.,normal
DEO,Diageo plc,20151218,BRIEF-CMA says not to refer completed acquisition by Heineken of some assets of Diageo's beer business to phase 2 investigation ,* Has decided not to refer completed acquisition by Heineken N.V. Of some assets associated with Diageo Plc's beer business to a phase 2 investigation,topStory
DKS,Dick&#39;s Sporting Goods Inc,20151218,U.S. RESEARCH ROUNDUP-Accenture  Dick's Sporting  Pentair ,Dec 18 Wall Street securities analysts revised their ratings and price targets on several U.S.-listed companies  including Knight Transportation  Hibbett Sports and Pentair  on Friday.                HIGHLIGHTS     * Accenture : BMO raises price target to $110 from $105; rating market perform     * Delta Air Lines Inc : Deutsche Bank  Evercore ISI raise price target     * Dick's Sporting  Hibbett Sports : B. Riley starts coverage with neutral      * Pentair : RBC  Canaccord Genuity c,topStory
ETP,Energy Transfer Partners LP,20151218,BG  Energy Transfer get approval for U.S. Lake Charles LNG project ,LONDON  Dec 18 BG Group and Energy Transfer Partners have gained approval from the U.S. energy regulator for their liquefied natural gas (LNG) production and export plant in Lake Charles  Louisiana  the companies said.,topStory
ETP,Energy Transfer Partners LP,20151218,RPT-BRIEF-BG says Lake Charles LNG project approved by U.S. regulator ,* Final investment decisions from both BG Group and Energy Transfer are expected to be taken in 2016,normal
EXC,Exelon Corporation,20151218,UPDATE 1-GSA asks regulators to reject Pepco-Exelon deal-Washington Post ,Dec 18 The agency that acts as the U.S. government's landlord and realtor has asked regulators in the District of Columbia to reject the merger of utilities Exelon Corp and Pepco Holdings Inc  unless it provides a better deal for taxpayers  the Washington Post reported.,topStory
EXC,Exelon Corporation,20151218,Deals of the day-Mergers and acquisitions ,Dec 18 The following bids  mergers  acquisitions and disposals were reported by 2100 GMT on Friday:,normal
EXC,Exelon Corporation,20151218,GSA asks regulators to reject Pepco-Exelon deal: Washington Post ,The agency that acts as the U.S. government's landlord and realtor has asked regulators in the District of Columbia to reject the merger of utilities Exelon Corp and Pepco Holdings Inc  unless it provides a better deal for taxpayers  the Washington Post reported.,normal
EXC,Exelon Corporation,20151218,GSA asks regulators to reject Pepco-Exelon deal-Washington Post ,Dec 18 The agency that acts as the U.S. government's landlord and realtor has asked regulators in the District of Columbia to reject the merger of utilities Exelon Corp and Pepco Holdings Inc  unless it provides a better deal for taxpayers  the Washington Post reported.,normal
FIT,Fitbit Inc,20151218,Beyond Fitbit: The quest to develop medical-grade wearables ,CHICAGO A new wave of wearable computing devices that detect and monitor serious diseases is moving from the laboratory to the market  potentially transforming the treatment of conditions ranging from epilepsy to diabetes and creating business opportunities estimated to be worth tens of billions of dollars.,normal
FIT,Fitbit Inc,20151218,RPT-INSIGHT-Beyond Fitbit: The quest to develop medical-grade wearables ,CHICAGO  Dec 18 A new wave of wearable computing devices that detect and monitor serious diseases is moving from the laboratory to the market  potentially transforming the treatment of conditions ranging from epilepsy to diabetes and creating business opportunities estimated to be worth tens of billions of dollars.,normal
FIT,Fitbit Inc,20151218,INSIGHT-Beyond Fitbit: The quest to develop medical-grade wearables ,CHICAGO  Dec 18 A new wave of wearable computing devices that detect and monitor serious diseases is moving from the laboratory to the market  potentially transforming the treatment of conditions ranging from epilepsy to diabetes and creating business opportunities estimated to be worth tens of billions of dollars.,normal
GSK,GlaxoSmithKline PLC,20151218,GSK to buy HIV drugs from Bristol-Myers Squibb for initial $350 million ,LONDON Pharmaceutical group GlaxoSmithKline said its majority-owned HIV business would buy drugs at different stages of development from U.S. rival Bristol-Myers Squibb for an initial $350 million.,topStory
GSK,GlaxoSmithKline PLC,20151218,UPDATE 1-GSK to buy HIV drugs from Bristol-Myers Squibb for initial $350 mln ,LONDON  Dec 18 Pharmaceutical group GlaxoSmithKline said its majority-owned HIV business would buy drugs at different stages of development from U.S. rival Bristol-Myers Squibb for an initial $350 million.,normal
GSK,GlaxoSmithKline PLC,20151218,GSK to buy HIV drugs from Bristol-Myers Squibb ,LONDON  Dec 18 British pharmaceutical company GlaxoSmithKline said it would buy HIV drugs at different stages of development from U.S. rival Bristol-Myers Squibb  in a deal which would boost its ViiV Healthcare unit.,normal
GFI,Gold Fields Limited,20151218,PRECIOUS-Gold holds losses from biggest dip in 5 months after Fed rate hike ,* Gold sees some relief softness in the dollar     * But retains most overnight losses     * SPDR funds at lowest since Sept. 2008   (Updates prices)     By A. Ananthalakshmi     SINGAPORE  Dec 18 Gold steadied on Friday but largely kept losses made a day earlier when the metal suffered its biggest slide in five months after U.S. interest rates were raised for the first time in nearly a decade and the dollar surged.     In a much anticipated move  the Federal Reserve raised the range,topStory
TV,Grupo Televisa SA,20151218,BRIEF-SES signs capacity deal with Televisa ,* Televisa  a Mexican multimedia company  has contracted capacity on SES`s AMC-9 satellite at orbital position of 83 degrees west,topStory
IAG,Iamgold Corporation,20151218,BRIEF-EURO Ressources says IAMGOLD stake at 89.71 pct ,* Announced on Thursday the completion of the simplified public tender offer by IAMGOLD Corp,topStory
JPM,J P Morgan Chase & Co,20151218,JPMorgan to pay $307 mln to settle SEC  CFTC disclosure charges ,WASHINGTON JPMorgan Chase will pay $307 million to settle two U.S. government cases that charged the bank with failing to disclose certain conflicts of interest to some of its wealth management clients  U.S. regulators said on Friday.,topStory
JPM,J P Morgan Chase & Co,20151218,UPDATE 2-JPMorgan to pay $307 mln to settle SEC  CFTC disclosure charges ,WASHINGTON  Dec 18 JPMorgan Chase will pay $307 million to settle two U.S. government cases that charged the bank with failing to disclose certain conflicts of interest to some of its wealth management clients  U.S. regulators said on Friday.,normal
JPM,J P Morgan Chase & Co,20151218,JP Morgan to pay $307 million to settle SEC  CFTC disclosure charges ,WASHINGTON JP Morgan Chase will pay $307 million to settle two U.S. government cases that charged the bank with failing to disclose certain conflicts of interest to some of its wealth management clients  U.S. regulators said on Friday.,normal
JPM,J P Morgan Chase & Co,20151218,JP Morgan to pay $307 mln to settle SEC  CFTC charges over disclosures ,WASHINGTON  Dec 18 JP Morgan Chase will pay $307 million settle two U.S. government cases that charged the bank with failing to disclose certain conflicts of interest to some of its wealth management clients  U.S. regulators said Friday.,normal
JNPR,Juniper Networks Inc,20151218,FBI probes breach at Juniper Networks: CNN ,The U.S. Federal Bureau of Investigation is probing a breach at network gear maker Juniper Networks Inc on suspicion that a foreign government might be responsible for inserting rogue code that could enable spying  CNN reported on Friday   citing unnamed U.S. officials.   ,topStory
LVS,Las Vegas Sands Corp,20151218,Las Vegas Sands CEO Adelson says Macau gaming market near bottom  sees 2016 turnaround ,MACAU Gambling giant Las Vegas Sands Corp's Chief Executive Sheldon Adelson said on Friday that a long-term slide in Macau's gaming market is close to bottoming out  with a turnaround in sight in 2016 after 18 consecutive months of declines.,topStory
LVS,Las Vegas Sands Corp,20151218,Las Vegas Sands CEO Adelson says Macau gaming market near bottom  sees 2016 turnaround ,MACAU  Dec 18 Gambling giant Las Vegas Sands Corp's Chief Executive Sheldon Adelson said on Friday that a long-term slide in Macau's gaming market is close to bottoming out  with a turnaround in sight in 2016 after 18 consecutive months of declines.,normal
LYV,Live Nation Entertainment Inc,20151218,SFX Entertainment bondholders look to Live Nation for possible rescue ,NEW YORK  Dec 18 SFX Entertainment Inc  bondholders  who are looking for a savior for the electronic dance music festival promoter  are pinning their hopes on Live Nation Entertainment Inc  according to people familiar with the matter.,topStory
