MPC,Marathon Petroleum Corporation,20151218,Marathon postpones Garyville maintenance until September - Energy News Today ,HOUSTON  Dec 18 Marathon Petroleum will conduct planned maintenance at its 522 000 barrel-per-day Garyville  Louisiana refinery in September instead of January  Energy News Today reported on Friday.,topStory
MA,Mastercard Incorporated,20151218,BRIEF-Ica Gruppen's bank sells Mastercard stake  to book gain of SEK 81 mln in Q4 ,* Says will recognise capital gain of SEK 81 million in Q4 of 2015  Source text for Eikon:  Further company coverage:    (Stockholm Newsroom),topStory
MBI,MBIA Inc,20151218,PREPA extends deadline for restructuring support agreement ,Dec 18 Puerto Rico Electric Power Authority (PREPA)  the island's debt-laden power utility  said it had extended to Friday a restructuring support agreement to allow a continuation of talks with its monoline bond insurers and supporting creditors.,normal
PBR,Petroleo Brasileiro SA- Petrobras,20151218,CORRECTED-UPDATE 2-Brazil prosecutors charge 12 in SBM Offshore graft scheme ,RIO DE JANEIRO  Dec 17 Brazilian prosecutors on Thursday charged 12 people with a bribery scheme involving Dutch firm SBM Offshore NV  the world's top leaser of oil production ships  and state-run oil company Petroleo Brasileiro SA.,topStory
PBR,Petroleo Brasileiro SA- Petrobras,20151218,Brazil prosecutors charge 12 in SBM Offshore graft scheme ,RIO DE JANEIRO Brazilian prosecutors on Thursday charged 12 people with a bribery scheme involving Dutch firm SBM Offshore NV  the world's top leaser of oil production ships  and state-run oil company Petroleo Brasileiro SA.,normal
PM,Philip Morris International Inc,20151218,UPDATE 1-Australia wins court challenge to tobacco plain packaging ,SYDNEY  Dec 18 A Singapore-based court has refused a challenge by Philip Morris to Australia's landmark plain packaging legislation passed in 2011  which the tobacco giant had brought under a bi-lateral trade treaty with Hong Kong  the company said.,topStory
PM,Philip Morris International Inc,20151218,Australia wins court challenge to tobacco plain packaging ,SYDNEY A Singapore-based court has refused a challenge by Philip Morris to Australia's landmark plain packaging legislation passed in 2011  which the tobacco giant had brought under a bi-lateral trade treaty with Hong Kong  the company said.,normal
PM,Philip Morris International Inc,20151218,Australia wins court challenge to tobacco plain packaging ,SYDNEY  Dec 18 A Singapore-based court has refused a challenge by Philip Morris to Australia's landmark plain packaging legislation passed in 2011  which the tobacco giant had brought under a bi-lateral trade treaty with Hong Kong  the company said.,normal
RTN,Raytheon Company,20151218,Raytheon awarded $2.35 billion contract for SM-3 missiles ,WASHINGTON Raytheon Co  has won a contract worth up to $2.35 billion to build 52 SM-3 Block IB missiles for the U.S. Missile Defense Agency using fiscal 2015 funding  plus three one-year options  the Pentagon said on Friday.,topStory
RTN,Raytheon Company,20151218,UPDATE 1-Raytheon awarded $2.35 billion contract for SM-3 missiles ,WASHINGTON  Dec 18 Raytheon Co has won a contract worth up to $2.35 billion to build 52 SM-3 Block IB missiles for the U.S. Missile Defense Agency using fiscal 2015 funding  plus three one-year options  the Pentagon said on Friday.,normal
RTN,Raytheon Company,20151218,Raytheon awarded $2.35 billion contract for SM-3 missiles ,WASHINGTON  Dec 18 Raytheon Co was awarded a contract worth more than $2.35 billion for 15 52 SM-3 Block IB missiles  the Pentagon said on Friday.   (Reporting by Washington Newsroom; Editing by Dan Grebler),normal
SDLP,Seadrill Partners LLC,20151218,BRIEF-Seadrill Partners to reduce quarterly dividend ,* Seadrill Partners LLC has approved a plan to reduce the quarterly distribution to $0.25 per unit to its common unitholders  down from the current quarterly level of $0.5675.,topStory
STO,Statoil ASA,20151218,UPDATE 1-Statoil may have to rethink plans if low oil prices persist ,OSLO  Dec 18 Statoil would have to reconsider its Norwegian oil and gas field development plans if current low oil prices persist well into next year  the energy company said on Friday.,topStory
STO,Statoil ASA,20151218,Statoil  partners to invest $933 mln in N.Sea Oseberg expansion ,OSLO  Dec 18 Statoil and partners expect to invest some 8.2 billion Norwegian crowns ($933.87 million) in the development of the Oseberg Vestflanken 2 project off Norway  the firm said on Friday.,normal
SHO,Sunstone Hotel Investors Inc,20151218,Sunstone Hotel sells leasehold interest in Times Square hotel ,Dec 18 Sunstone Hotel Investors Inc  a lodging real estate investment trust  said it sold its leasehold interest in a DoubleTree hotel in Times Square for $540 million.,topStory
TGT,Target Corporation,20151218,Exclusive: Target in initial development of own mobile wallet - sources ,Target Corp is in the early stages of developing its own mobile wallet  three people familiar with the matter said  joining Wal-Mart Stores Inc in posing a threat to recent entrants like Apple Pay.,topStory
TI,Telecom Italia SPA,20151218,UPDATE 2-French businessman Niel sees Telecom Italia as predator ,* Telecom Italia most heavily traded stock in Europe by volume   (Adds details  analysts  comment from Telecom Italia CEO  shares),topStory
TI,Telecom Italia SPA,20151218,European Factors to Watch-Equity futures fall ,LONDON  Dec 18 European equity futures fell on Friday  tracking a drop in Asian and U.S. equity markets which settled back after a surge higher in the previous session.,normal
TI,Telecom Italia SPA,20151218,Niel says has ideas on how to improve Telecom Italia - La Stampa ,MILAN  Dec 18 French businessman Xavier Niel has some ideas on how to improve Telecom Italia but will not comment on whether he plans to convert options he bought in the Italian phone group into shares  according to an interview with daily La Stampa.,normal
TI,Telecom Italia SPA,20151218,European Factors to Watch-Shares seen lower at open ,LONDON  Dec 18 European stocks were seen opening lower on Friday  tracking falls in Asian and U.S. equity markets and settling back after a surge higher in the previous session.,normal
TEF,Telefonica SA,20151218,Mexico telecoms regulator backs AT&T and Telefonica spectrum deal ,MEXICO CITY Mexico's telecoms regulator on Thursday said it had approved swaps of frequency blocks and a spectrum rental deal between AT&T Inc and Telefonica SA  the main competitors to the country's dominant player  Carlos Slim's America Movil.,topStory
TEF,Telefonica SA,20151218,Mexico telecoms regulator backs AT&T and Telefonica spectrum deal ,MEXICO CITY  Dec 17 Mexico's telecoms regulator on Thursday said it had approved swaps of frequency blocks and a spectrum rental deal between AT&T Inc and Telefonica SA   the main competitors to the country's dominant player  Carlos Slim's America Movil.,normal
WMT,Wal-Mart Stores Inc,20151218,UPDATE 1-Wal-Mart names Tony Rogers U.S. marketing head ,Dec 18 Wal-Mart Stores Inc said on Friday that Tony Rogers would replace Stephen Quinn as its marketing head in the United States.,topStory
WMT,Wal-Mart Stores Inc,20151218,Wal-Mart names Tony Rogers as U.S. marketing head: Bloomberg ,Wal-Mart Stores Inc  named Tony Rogers as its U.S. marketing head  replacing Stephen Quinn  Bloomberg reported on Friday.,normal
DIS,Walt Disney Company (The),20151218,Disney shares fall after BTIG cuts to 'sell' on ESPN woes ,Walt Disney Co's shares slumped after BTIG analyst Richard Greenfield cuts his rating to "sell" from "neutral"  saying the likely success of the latest Star Wars movie would not be enough to offset the impact of subscriber losses at ESPN.,topStory
DIS,Walt Disney Company (The),20151218,Disney shares fall after BTIG cuts to "sell" on ESPN woes ,Dec 18 Walt Disney Co's shares slumped after BTIG analyst Richard Greenfield cuts his rating to "sell" from "neutral"  saying the likely success of the latest Star Wars movie would not be enough to offset the impact of subscriber losses at ESPN.,normal
YRD,Yirendai Ltd,20151218,Chinese lending platform Yirendai makes tepid U.S. market debut ,Yirendai Ltd  the consumer finance arm of Chinese peer-to-peer (P2P) lender CreditEase  made a tepid U.S. market debut on Friday  with its shares trading as much as 16.5 percent below the offer price.,topStory
YRD,Yirendai Ltd,20151218,CORRECTED-UPDATE 1-Chinese lending platform Yirendai makes tepid U.S. market debut ,Dec 18 Yirendai Ltd  the consumer finance arm of Chinese peer-to-peer (P2P) lender CreditEase  made a tepid U.S. market debut on Friday  with its shares trading around the offer price.,normal
YRD,Yirendai Ltd,20151218,CORRECTED-Chinese online lender Yirendai shares rise about 4 pct in debut ,Dec 18 Shares of Yirendai Ltd  the consumer finance arm of Chinese peer-to-peer (P2P) lender CreditEase  rose as much as 3.9 percent in their first few minutes of trading on Friday  valuing the company at about $607 million.,normal
