AMZN,Amazoncom Inc,20111020,Barnes & Noble expands marketplace beyond books ,Barnes & Noble Inc  is adding new categories including home products and consumer electronics to its online marketplace  the latest move by the retailer to rely less on book sales and compete with e-commerce rivals such as Amazon.com Inc  and eBay Inc .,topStory
AMZN,Amazoncom Inc,20111020,UPDATE 2-Barnes & Noble expands marketplace beyond books ,Oct 20 Barnes & Noble Inc is adding new categories including home products and consumer electronics to its online marketplace  the latest move by the retailer to rely less on book sales and compete with e-commerce rivals such as Amazon.com Inc and eBay Inc .,normal
AMZN,Amazoncom Inc,20111020,LG Display sees Q4 factory utilisation at 80 pct levels ,SEOUL  Oct 20 The CFO of flat-screen maker LG Display said on Thursday that it expected its factory utilisation rate to reach 80 percent levels in the fourth quarter after it fell to 70 percent levels in the previous quarter.,normal
AMZN,Amazoncom Inc,20111020,Market Chatter -- Corporate finance press digest ,BANGALORE  Oct 20The following corporate finance-related stories were reported by media on Thursday:,normal
AMRS,Amyris Inc,20111020,Amyris teams up with ETH to expand Brazil ops ,* Production with ETH expected to begin by 2014     * Amyris to access 15 mln T of cane per year     SAO PAULO  Oct 20 Amyris Inc   which has developed technologies for renewable chemicals  said on Thursday it has signed an agreement with Brazilian ethanol company ETH to produce a cane-based specialty chemical.     Farnesene  which can be used in cosmetics  polymer additives  lubricants  consumer packaged goods and cane diesel  will be produced in a built-in facility in one of the mi,topStory
AAPL,Apple Inc,20111020,Basic phones lift Nokia to surprise Q3 profit ,HELSINKI The world's largest cellphone maker Nokia reported a smaller than expected fall in third quarter profits as price cuts and new models lifted sales of its basic cellphones in key markets like India. | Video ,topStory
AAPL,Apple Inc,20111020,Asia emerges as battlefield for growth-hungry tech firms ,HONG KONG When Google Inc unveiled its latest version of Android  the operating platform powering 50 percent of the global smartphone market  it picked Hong Kong as the destination to show off the new software on Wednesday.,normal
AAPL,Apple Inc,20111020,UPDATE 4-Nokia's surprise profit lifts hopes worst is over ,HELSINKI  Oct 20 The world's largest cellphone maker Nokia reported a smaller than expected fall in third-quarter profits as price cuts and new models lifted sales of its basic cellphones in key markets like India.,normal
AAPL,Apple Inc,20111020,UPDATE 3-LG Display posts record loss  sees price falls slowing ,SEOUL  Oct 20 South Korean flat-screen maker LG Display   a key supplier to Apple Inc   posted its biggest quarterly loss  on Thursday as tepid demand for televisions and computers hit panel prices and one-off losses weighed.,normal
AAPL,Apple Inc,20111020,UPDATE 1-China Mobile Q3 net up 3.4 pct  slightly below f'cast ,* To rely on data  Internet traffic for growth - analysts,normal
AAPL,Apple Inc,20111020,Microsoft to launch Mango smartphones with Nokia  Samsung soon ,HONG KONG Microsoft Corp  which has been trailing Apple Inc and Google Inc in the fast-growing smartphone market  said it will launch Mango-powered handsets from top makers including Nokia Oyj  Samsung Electronics Co Ltd and HTC Corp in coming weeks.,normal
AAPL,Apple Inc,20111020,LG Display sees Q4 factory utilisation at 80 pct levels ,SEOUL  Oct 20 The CFO of flat-screen maker LG Display said on Thursday that it expected its factory utilisation rate to reach 80 percent levels in the fourth quarter after it fell to 70 percent levels in the previous quarter.,normal
AAPL,Apple Inc,20111020,LG Display sees price falls easing after disappointing ,SEOUL South Korean flat-screen maker LG Display   a key supplier to Apple Inc   posted a wider-than-expected quarterly loss on Thursday as tepid demand for TVs and PCs hit panel prices and one-off losses weighed.,normal
AAPL,Apple Inc,20111020,LG Display posts worse-than-expected Q3 loss ,SEOUL  Oct 20 Flat-screen maker LG Display   posted a wider-than-expected quarterly loss on Thursday  as tepid demand for TVs and PCs hit panel prices and one-off losses weighed.,normal
AAPL,Apple Inc,20111020,Microsoft to launch Mango smartphones with Nokia  Samsung soon ,HONG KONG Microsoft Corp  which has been trailing Apple Inc and Google Inc in the fast-growing smartphone market  said it will launch Mango-powered handsets from top makers including Nokia Oyj  Samsung Electronics Co Ltd and HTC Corp in coming weeks.,normal
ATHN,athenahealth Inc,20111020,UPDATE 1-Athenahealth Q3 profit tops est  ups FY outlook ,Oct 20 Athenahealth Inc posted a better-than-expected quarterly profit as more physicians used its Internet-based billing and other services  and raised its full-year earnings outlook.,topStory
TAPR,Barclays Inverse US Treasury Composite ETN,20111020,New Issue-Pernod Ricard sells $1.5 bln notes ,Oct 20 Pernod Ricard on Thursday sold $1.5 billion of senior unsecured notes in the 144a private placement market  said IFR  a Thomson Reuters service.       Barclays Capital and JP Morgan were the active joint bookrunning managers for the sale. BORROWER: PERNOD RICARD AMT $1.5 BLN      COUPON 4.45 PCT     MATURITY 1/15/2022  TYPE SR NTS       ISS PRICE 99.746    FIRST PAY 7/15/2012 MOODY'S Baa3      YIELD 4.482 PCT     SETTLEMENT 10/25/2011 S&P BBB-MINUS     SPREAD 230 BPS      PAY ,topStory
DLBL,Barclays PLC,20111020,New Issue-Pernod Ricard sells $1.5 bln notes ,Oct 20 Pernod Ricard on Thursday sold $1.5 billion of senior unsecured notes in the 144a private placement market  said IFR  a Thomson Reuters service.       Barclays Capital and JP Morgan were the active joint bookrunning managers for the sale. BORROWER: PERNOD RICARD AMT $1.5 BLN      COUPON 4.45 PCT     MATURITY 1/15/2022  TYPE SR NTS       ISS PRICE 99.746    FIRST PAY 7/15/2012 MOODY'S Baa3      YIELD 4.482 PCT     SETTLEMENT 10/25/2011 S&P BBB-MINUS     SPREAD 230 BPS      PAY ,topStory
DTYL,Barclays PLC,20111020,New Issue-Pernod Ricard sells $1.5 bln notes ,Oct 20 Pernod Ricard on Thursday sold $1.5 billion of senior unsecured notes in the 144a private placement market  said IFR  a Thomson Reuters service.       Barclays Capital and JP Morgan were the active joint bookrunning managers for the sale. BORROWER: PERNOD RICARD AMT $1.5 BLN      COUPON 4.45 PCT     MATURITY 1/15/2022  TYPE SR NTS       ISS PRICE 99.746    FIRST PAY 7/15/2012 MOODY'S Baa3      YIELD 4.482 PCT     SETTLEMENT 10/25/2011 S&P BBB-MINUS     SPREAD 230 BPS      PAY ,topStory
BIIB,Biogen Inc,20111020,FDA extends review of Tysabri JC virus label ,U.S. regulators have extended their review of Biogen Idec Inc's application to update the prescribing information for its multiple sclerosis drug Tysabri  the company said on Thursday.,topStory
BIIB,Biogen Inc,20111020,UPDATE 1-U.S. FDA extends review of Tysabri JC virus label ,Oct 20 U.S. regulators have extended their review of Biogen Idec Inc's application to update the prescribing information for its multiple sclerosis drug Tysabri  the company said on Thursday.,normal
CSCO,Cisco Systems Inc,20111020,Polycom plunges on competitor worries ,Polycom Inc  shares fell by more than a third on Thursday  a day after the videoconferencing company forecast dismal fourth-quarter sales in the face of slow corporate spending and increased competition from rivals like Cisco Systems .,topStory
COST,Costco Wholesale Corporation,20111020,Costco contributions to liquor measure top $22 mln ,Oct 19 Contributions by Costco Wholesale Corp to support a ballot measure to privatize liquor sales in Washington state have set a record for contributions by a single entity to an initiative in the state  a spokeswoman for the state's Public Disclosure Commission said on Wednesday.,topStory
CY,Cypress Semiconductor Corporation,20111020,UPDATE 3-Cypress reaffirms touchscreen sales outlook  shares rebound ,Oct 20 Cypress Semiconductor Corp warned of a higher-than-expected revenue decline in the fourth quarter  but backed its full-year touchscreen sales forecast.,topStory
EBAY,eBay Inc,20111020,EBay profit meets Street; shares dip on cautious view ,SAN FRANCISCO EBay Inc reported profit that matched Wall Street estimates and gave a restrained outlook for the rest of the year because of economic uncertainty  sending its shares lower.,topStory
EBAY,eBay Inc,20111020,CORRECTED - UPDATE 5-EBay profit meets Street; shares dip on cautious view ,SAN FRANCISCO  Oct 19 EBay Inc  reported profit that matched Wall Street estimates and gave a restrained outlook for the rest of the year because of economic uncertainty  sending its shares lower.,normal
EBAY,eBay Inc,20111020,CORRECTED - PREVIEW-EBay's Marketplaces growth to dominate ,* Faster pace of growth at Marketplaces division expected,normal
EBAY,eBay Inc,20111020,Barnes & Noble expands marketplace beyond books ,Barnes & Noble Inc  is adding new categories including home products and consumer electronics to its online marketplace  the latest move by the retailer to rely less on book sales and compete with e-commerce rivals such as Amazon.com Inc  and eBay Inc .,normal
EBAY,eBay Inc,20111020,UPDATE 2-Barnes & Noble expands marketplace beyond books ,Oct 20 Barnes & Noble Inc is adding new categories including home products and consumer electronics to its online marketplace  the latest move by the retailer to rely less on book sales and compete with e-commerce rivals such as Amazon.com Inc and eBay Inc .,normal
EBAY,eBay Inc,20111020,US STOCKS-Index futures edge higher; euro bailout fund eyed ,NEW YORK  Oct 20 Stock index futures rose on Thursday as investors looking for an earnings season rally maintained interest in the market after a sharp fall the previous session  but concerns over Europe's debt crisis capped gains.,normal
EBAYL,eBay Inc,20111020,EBay profit meets Street; shares dip on cautious view ,SAN FRANCISCO EBay Inc reported profit that matched Wall Street estimates and gave a restrained outlook for the rest of the year because of economic uncertainty  sending its shares lower.,topStory
EBAYL,eBay Inc,20111020,CORRECTED - UPDATE 5-EBay profit meets Street; shares dip on cautious view ,SAN FRANCISCO  Oct 19 EBay Inc  reported profit that matched Wall Street estimates and gave a restrained outlook for the rest of the year because of economic uncertainty  sending its shares lower.,normal
EBAYL,eBay Inc,20111020,CORRECTED - PREVIEW-EBay's Marketplaces growth to dominate ,* Faster pace of growth at Marketplaces division expected,normal
EBAYL,eBay Inc,20111020,Barnes & Noble expands marketplace beyond books ,Barnes & Noble Inc  is adding new categories including home products and consumer electronics to its online marketplace  the latest move by the retailer to rely less on book sales and compete with e-commerce rivals such as Amazon.com Inc  and eBay Inc .,normal
EBAYL,eBay Inc,20111020,UPDATE 2-Barnes & Noble expands marketplace beyond books ,Oct 20 Barnes & Noble Inc is adding new categories including home products and consumer electronics to its online marketplace  the latest move by the retailer to rely less on book sales and compete with e-commerce rivals such as Amazon.com Inc and eBay Inc .,normal
EBAYL,eBay Inc,20111020,US STOCKS-Index futures edge higher; euro bailout fund eyed ,NEW YORK  Oct 20 Stock index futures rose on Thursday as investors looking for an earnings season rally maintained interest in the market after a sharp fall the previous session  but concerns over Europe's debt crisis capped gains.,normal
ERIC,Ericsson,20111020,UPDATE 4-Ericsson's networks unit spearheads strong Q3 ,STOCKHOLM  Oct 20 Forecast-topping results from Ericsson on Thursday showed the world's top mobile network gear maker can still outmuscle rivals even if global growth slows.,topStory
ERIC,Ericsson,20111020,Ericsson Q3 profit tops f'cast  sees clouds ahead ,STOCKHOLM  Oct 20 Ericsson   the world's biggest mobile network gear maker  posted core profit well above expectations on Thursday but said economic uncertainty meant telecoms operators might rein in future spending.,normal
FITB,Fifth Third Bancorp,20111020,WRAPUP 2-BB&T is latest bank to embrace cost-cutting ,* Fifth Third loan loss reserve down 87 percent; shares up,topStory
FITBI,Fifth Third Bancorp,20111020,WRAPUP 2-BB&T is latest bank to embrace cost-cutting ,* Fifth Third loan loss reserve down 87 percent; shares up,topStory
FLIR,FLIR Systems Inc,20111020,UPDATE 1-FLIR Systems posts higher Q3 profit ,Oct 20 FLIR  Systems Inc   which makes surveillance equipment  posted a rise in quarterly profit  helped by higher demand for its thermal-imaging products.,topStory
GNTX,Gentex Corporation,20111020,UPDATE 1-Gentex profit higher; warns on margins ,Oct 20 Gentex Corp   which makes automatic-dimming rearview mirrors and smoke alarms  posted a higher quarterly profit but warned on supply chain issues denting its margins for the rest of the year.,topStory
IIIN,Insteel Industries Inc,20111020,UPDATE 1-Insteel Industries Q4 profit misses ,Oct 20 Insteel Industries Inc   which makes steel wire reinforcing products  posted fourth-quarter results below Wall Street estimates as demand for its products remained low due to ongoing weakness in the construction sector.,topStory
INTC,Intel Corporation,20111020,CORRECTED-UPDATE 1-Meezan Bank starts Islamic financing for laptops ,KARACHI  Oct 19 Pakistan-based Islamic bank Meezan has started a shariah-compliant hire-purchase scheme for personal computers in collaboration with Intel Corp   a senior official of the bank said on Wednesday.,topStory
IBKR,Interactive Brokers Group Inc,20111020,UPDATE 3-Volatility boosts Interactive Brokers Q3 above Street ,Oct 20 Derivative trader Interactive Brokers Group Inc's  quarterly profit trumped Wall Street estimates as extreme market volatility meant nervous investors made more trades on its platforms.,topStory
DTYS,iPath US Treasury 10-year Bear ETN,20111020,New Issue-Pernod Ricard sells $1.5 bln notes ,Oct 20 Pernod Ricard on Thursday sold $1.5 billion of senior unsecured notes in the 144a private placement market  said IFR  a Thomson Reuters service.       Barclays Capital and JP Morgan were the active joint bookrunning managers for the sale. BORROWER: PERNOD RICARD AMT $1.5 BLN      COUPON 4.45 PCT     MATURITY 1/15/2022  TYPE SR NTS       ISS PRICE 99.746    FIRST PAY 7/15/2012 MOODY'S Baa3      YIELD 4.482 PCT     SETTLEMENT 10/25/2011 S&P BBB-MINUS     SPREAD 230 BPS      PAY ,topStory
DTUS,iPath US Treasury 2-year Bear ETN,20111020,New Issue-Pernod Ricard sells $1.5 bln notes ,Oct 20 Pernod Ricard on Thursday sold $1.5 billion of senior unsecured notes in the 144a private placement market  said IFR  a Thomson Reuters service.       Barclays Capital and JP Morgan were the active joint bookrunning managers for the sale. BORROWER: PERNOD RICARD AMT $1.5 BLN      COUPON 4.45 PCT     MATURITY 1/15/2022  TYPE SR NTS       ISS PRICE 99.746    FIRST PAY 7/15/2012 MOODY'S Baa3      YIELD 4.482 PCT     SETTLEMENT 10/25/2011 S&P BBB-MINUS     SPREAD 230 BPS      PAY ,topStory
DTUL,iPath US Treasury 2-year Bull ETN,20111020,New Issue-Pernod Ricard sells $1.5 bln notes ,Oct 20 Pernod Ricard on Thursday sold $1.5 billion of senior unsecured notes in the 144a private placement market  said IFR  a Thomson Reuters service.       Barclays Capital and JP Morgan were the active joint bookrunning managers for the sale. BORROWER: PERNOD RICARD AMT $1.5 BLN      COUPON 4.45 PCT     MATURITY 1/15/2022  TYPE SR NTS       ISS PRICE 99.746    FIRST PAY 7/15/2012 MOODY'S Baa3      YIELD 4.482 PCT     SETTLEMENT 10/25/2011 S&P BBB-MINUS     SPREAD 230 BPS      PAY ,topStory
DFVS,iPath US Treasury 5-year Bear ETN,20111020,New Issue-Pernod Ricard sells $1.5 bln notes ,Oct 20 Pernod Ricard on Thursday sold $1.5 billion of senior unsecured notes in the 144a private placement market  said IFR  a Thomson Reuters service.       Barclays Capital and JP Morgan were the active joint bookrunning managers for the sale. BORROWER: PERNOD RICARD AMT $1.5 BLN      COUPON 4.45 PCT     MATURITY 1/15/2022  TYPE SR NTS       ISS PRICE 99.746    FIRST PAY 7/15/2012 MOODY'S Baa3      YIELD 4.482 PCT     SETTLEMENT 10/25/2011 S&P BBB-MINUS     SPREAD 230 BPS      PAY ,topStory
DFVL,iPath US Treasury 5-year Bull ETN,20111020,New Issue-Pernod Ricard sells $1.5 bln notes ,Oct 20 Pernod Ricard on Thursday sold $1.5 billion of senior unsecured notes in the 144a private placement market  said IFR  a Thomson Reuters service.       Barclays Capital and JP Morgan were the active joint bookrunning managers for the sale. BORROWER: PERNOD RICARD AMT $1.5 BLN      COUPON 4.45 PCT     MATURITY 1/15/2022  TYPE SR NTS       ISS PRICE 99.746    FIRST PAY 7/15/2012 MOODY'S Baa3      YIELD 4.482 PCT     SETTLEMENT 10/25/2011 S&P BBB-MINUS     SPREAD 230 BPS      PAY ,topStory
FLAT,iPath US Treasury Flattener ETN,20111020,New Issue-Pernod Ricard sells $1.5 bln notes ,Oct 20 Pernod Ricard on Thursday sold $1.5 billion of senior unsecured notes in the 144a private placement market  said IFR  a Thomson Reuters service.       Barclays Capital and JP Morgan were the active joint bookrunning managers for the sale. BORROWER: PERNOD RICARD AMT $1.5 BLN      COUPON 4.45 PCT     MATURITY 1/15/2022  TYPE SR NTS       ISS PRICE 99.746    FIRST PAY 7/15/2012 MOODY'S Baa3      YIELD 4.482 PCT     SETTLEMENT 10/25/2011 S&P BBB-MINUS     SPREAD 230 BPS      PAY ,topStory
DLBS,iPath US Treasury Long Bond Bear ETN,20111020,New Issue-Pernod Ricard sells $1.5 bln notes ,Oct 20 Pernod Ricard on Thursday sold $1.5 billion of senior unsecured notes in the 144a private placement market  said IFR  a Thomson Reuters service.       Barclays Capital and JP Morgan were the active joint bookrunning managers for the sale. BORROWER: PERNOD RICARD AMT $1.5 BLN      COUPON 4.45 PCT     MATURITY 1/15/2022  TYPE SR NTS       ISS PRICE 99.746    FIRST PAY 7/15/2012 MOODY'S Baa3      YIELD 4.482 PCT     SETTLEMENT 10/25/2011 S&P BBB-MINUS     SPREAD 230 BPS      PAY ,topStory
STPP,iPath US Treasury Steepener ETN,20111020,New Issue-Pernod Ricard sells $1.5 bln notes ,Oct 20 Pernod Ricard on Thursday sold $1.5 billion of senior unsecured notes in the 144a private placement market  said IFR  a Thomson Reuters service.       Barclays Capital and JP Morgan were the active joint bookrunning managers for the sale. BORROWER: PERNOD RICARD AMT $1.5 BLN      COUPON 4.45 PCT     MATURITY 1/15/2022  TYPE SR NTS       ISS PRICE 99.746    FIRST PAY 7/15/2012 MOODY'S Baa3      YIELD 4.482 PCT     SETTLEMENT 10/25/2011 S&P BBB-MINUS     SPREAD 230 BPS      PAY ,topStory
MSFT,Microsoft Corporation,20111020,Feeble Windows holds back Microsoft profit ,SEATTLE Microsoft Corp's flagship operating system made only slight gains last quarter  largely due to business and emerging market spending  holding back profit growth for the world's largest software company.,topStory
MSFT,Microsoft Corporation,20111020,UPDATE 4-Feeble Windows holds back Microsoft profit  shares dip ,* Shares fall 0.7 percent after-hours  (Adds CFO comment),normal
MSFT,Microsoft Corporation,20111020,Instant view: Microsoft's Office shines  offsets tepid Windows ,Microsoft Corp's fiscal first-quarter profit rose 6 percent  meeting Wall Street's modest expectations  helped by strong sales of its popular Office applications package but hindered by tepid gains from its flagship Windows operating system.,normal
MSFT,Microsoft Corporation,20111020,US STOCKS-Wall St edges higher; Europe anxiety remains ,NEW YORK  Oct 20 U.S. stocks ended with modest gains on Thursday  shifting back and forth on incremental developments in Europe where leaders sought to reassure investors that a solution to the debt crisis would come soon.,normal
MSFT,Microsoft Corporation,20111020,Microsoft profit rises 6 pct  Office helps ,Oct 20 Microsoft Corp said fiscal first-quarter profit rose 6 percent  helped by strong sales of its popular Office applications package  and a slight increase sales of its flagship Windows operating system.,normal
MSFT,Microsoft Corporation,20111020,Microsoft sued for monopoly abuse by Israeli firm ,Microsoft Corp used its monopoly position in computer operating systems to block the PC-sharing business of MiniFrame Ltd  according to a lawsuit filed by the small Israeli technology company.,normal
MSFT,Microsoft Corporation,20111020,Microsoft sued for monopoly abuse by Israeli firm ,Oct 20 Microsoft Corp used its monopoly position in computer operating systems to block the PC-sharing business of MiniFrame Ltd  according to a lawsuit filed by the small Israeli technology company.,normal
MSFT,Microsoft Corporation,20111020,Yahoo "cross talk" ban jolts bidders ,NEW YORK Some potential buyers of Yahoo Inc are balking at the Internet company's demands for confidentiality that would prevent them from discussing joint bids  according to several people close to the situation.,normal
MSFT,Microsoft Corporation,20111020,PRESS DIGEST - CANADA - Oct 20 ,Oct 20 The following are top stories from selected Canadian newspapers. Reuters has not verified these stories and does not vouch for their accuracy.,normal
MSFT,Microsoft Corporation,20111020,Microsoft to launch Mango smartphones with Nokia  Samsung soon ,HONG KONG Microsoft Corp  which has been trailing Apple Inc and Google Inc in the fast-growing smartphone market  said it will launch Mango-powered handsets from top makers including Nokia Oyj  Samsung Electronics Co Ltd and HTC Corp in coming weeks.,normal
MNRO,Monro Inc ,20111020,UPDATE 3-Monro Muffler sees FY growth slowing ,* Expects impact of high unemployment  higher tire and gas prices  low consumer confidence,topStory
NDAQ,Nasdaq Inc,20111020,Exclusive: Nasdaq hackers spied on company boards ,Hackers who infiltrated the Nasdaq's computer systems last year installed malicious software that allowed them to spy on the directors of publicly held companies  according to two people familiar with an investigation into the matter.,topStory
NFLX,Netflix Inc,20111020,Netflix investors seek clarity amid stumbles ,LOS ANGELES One-time Wall Street superstar Netflix Inc will have some explaining to do when it reports quarterly results on Monday.,topStory
POOL,Pool Corporation,20111020,Lindsay Lohan adds to troubles with morgue mishap ,LOS ANGELES Troubled actress Lindsay Lohan was late to her court-ordered community service at a morgue on Thursday  further jeopardizing her probation only one day after seeing it revoked for missing past appointments. | Video ,topStory
SCHN,Schnitzer Steel Industries Inc,20111020,UPDATE 1-Schnitzer Steel Q4 beats Street; sees strong 2012 ,Oct 20 Schnitzer Steel Industries Inc  posted a fourth-quarter profit above market estimates  helped by higher shipments at its metals recycling business  and the company said it expects 2012 to benefit from growth in developing countries.,topStory
STX,Seagate Technology PLC,20111020,EU mergers and takeovers (Oct 20) ,BRUSSELS  Oct 20 The following are mergers under review by the European Commission and a brief guide to the EU merger process:,topStory
STX,Seagate Technology PLC,20111020,Seoul shares see limited gains supported by tech issues ,SEOUL  Oct 20 Seoul shares inched up on Thursday lifted by solid gains in technology stocks like Samsung Electronics   but rises were limited following fresh reports underscoring that Europe remains far from a solution to its debt crisis.,normal
SIVB,SVB Financial Group,20111020,UPDATE 1-SVB Financial gets China approval for JV bank ,Oct 20 Silicon Valley Bank  the banking unit of SVB Financial Group   said it has received approval from the China Banking Regulatory Commission to form a joint venture bank in China.,topStory
TZOO,Travelzoo,20111020,UPDATE 2-Travelzoo Q3 tops estimates; shares jump ,Oct 20 Travelzoo Inc reported better-than-expected quarterly results  helped by an increase in new subscriptions for its local deals newsletters  sending its shares up 13 percent in pre-market trading.,topStory
VRTX,Vertex Pharmaceuticals Incorporated,20111020,Vertex CEO sees "historic launch" for Hep-C drug ,BOSTON The chief executive of Vertex Pharmaceuticals Inc  Matthew Emmens  said on Thursday that adoption of its recently launched hepatitis C drug  Incivek  has been "very  very fast.",topStory
VRTX,Vertex Pharmaceuticals Incorporated,20111020,UPDATE 1-Vertex CEO sees "historic launch" for Hep-C drug ,BOSTON  Oct 20 The chief executive of Vertex Pharmaceuticals Inc   Matthew Emmens  said on Thursday that adoption of its recently launched hepatitis C drug  Incivek  has been "very  very fast.",normal
VRTX,Vertex Pharmaceuticals Incorporated,20111020,Vertex CEO sees "historic launch" for Hep-C drug ,BOSTON  Oct 20 The chief executive of Vertex Pharmaceuticals Inc   Matthew Emmens  said on Thursday that adoption of its recently-launched hepatitis C drug  Incivek  has been "very very fast.",normal
AEM,Agnico Eagle Mines Limited,20111020,UPDATE 2-Agnico Eagle ups cash component for Grayd offer ,Oct 20 Agnico-Eagle Mines Ltd said it will double the cash component in its offer for Grayd Resource Corp to C$183 million ($181 million)  as the Canadian gold miner moves to expand its footprint in Mexico.,topStory
AMOV,America Movil SAB de CV,20111020,BRIEF-Moody's assigns A2 ratings to America Movil  S.A.B. de C.V.'s proposed Japanese Yen bonds - first series (2011) ,* Moody's assigns A2 ratings to America Movil  S.A.B. de C.V.'s proposed Japanese Yen bonds - first series (2011),topStory
AMX,America Movil SAB de CV,20111020,BRIEF-Moody's assigns A2 ratings to America Movil  S.A.B. de C.V.'s proposed Japanese Yen bonds - first series (2011) ,* Moody's assigns A2 ratings to America Movil  S.A.B. de C.V.'s proposed Japanese Yen bonds - first series (2011),topStory
