AMZN,Amazoncom Inc,20111229,Amazon shares dip on growth concerns ,Amazon.com Inc shares fell to their lowest level since late March on Thursday on concern about sales growth during the online retailer's crucial fourth quarter.,topStory
ESLT,Elbit Systems Ltd,20111229,Elbit gets $35 mln in settlement with Georgia ,JERUSALEM  Dec 29 Israeli defence contractor Elbit Systems said on Thursday it has received $35 million as part of a lawsuit settlement with the Georgian government.,topStory
MAT,Mattel Inc,20111229,Beverly Hillbilly actress settles lawsuit over doll ,The actress who played tomboy Elly May Clampett on 1960s television show "The Beverly Hillbillies" has settled her lawsuit against Mattel over a Barbie doll based on her character.,topStory
NFLX,Netflix Inc,20111229,Netflix  Gap lag in customer satisfaction online ,Netflix Inc and Gap Inc were among the worst performers in customer satisfaction among the largest online retailers this holiday season  according to a survey released on Wednesday. | Video ,topStory
NWS,News Corporation,20111229,News Int'l has 100 mln stg hacking legal fund-report ,LONDON  Dec 29 The British arm of News Corp has increased the legal fund it will use to settle civil litigation cases brought by victims of phone hacking to 100 million pounds ($155 million) from 20 million previously  the Independent newspaper reported on Thursday.,topStory
NWSA,News Corporation,20111229,News Int'l has 100 mln stg hacking legal fund-report ,LONDON  Dec 29 The British arm of News Corp has increased the legal fund it will use to settle civil litigation cases brought by victims of phone hacking to 100 million pounds ($155 million) from 20 million previously  the Independent newspaper reported on Thursday.,topStory
PTEN,Patterson-UTI Energy Inc,20111229,UPDATE 1-Patterson-UTI Energy to retire 31 rigs ,Dec 29 Onshore driller Patterson-UTI Energy Inc said it will retire about 10 percent of its drilling rigs in December and will take a charge.,topStory
SHLD,Sears Holdings Corporation,20111229,Sears lists 79 closings  gets Fitch downgrade ,Sears Holdings Corp  on Thursday identified 79 of the 100 to 120 Sears and Kmart stores it said earlier this week it would close  with the list split almost evenly between the two chains.,topStory
SHLD,Sears Holdings Corporation,20111229,Text-Fitch cuts Sears Holdings IDR to CCC; outlook negative ,NEW YORK  December 29 (Fitch) Fitch Ratings has downgraded its long-term Issuer Default Ratings (IDR) on Sears Holdings Corporation (Holdings) and its various subsidiary entities to 'CCC' from 'B'. The ratings on various tranches of debt have also been downgraded by a notch. The Rating Outlook is Negative. A full rating list is shown below. The downgrades reflect the continued deterioration in EBITDA on worse than expected top-line growth  with both Kmart and Sears running negative mid-single-di,normal
BA,Boeing Company (The),20111229,U.S. Saudi fighter jet sale to help offset Iran ,WASHINGTON The United States has signed a $29.4 billion deal to sell 84 new F-15 fighter jets to Saudi Arabia in a long-expected move that the Obama administration said on Thursday would boost Gulf security amid mounting tension with Iran.,topStory
C,Citigroup Inc,20111229,SEC chided again by judge in Citigroup fraud case ,The U.S. Securities and Exchange Commission got a fresh dressing-down from the judge who rejected its $285 million settlement with Citigroup Inc  as he said the regulator kept him out of the loop on its efforts to salvage the case.,topStory
C,Citigroup Inc,20111229,UPDATE 1-Edgen files for IPO of up to $100 mln ,* Jefferies  Morgan Stanley and Citigroup to underwrite offering,normal
EIX,Edison International,20111229,A2A boards OK preliminary deal on Edison revamp ,MILAN  Dec 29 The boards of Italian regional utility A2A have given the go ahead to a preliminary agreement with France's EDF on the reorganisation of Italy's No. 2 utility Edison  the chairman of A2A's supervisory board Graziano Tarantini said on Thursday.,topStory
EIX,Edison International,20111229,EDF says Edison price is fair -paper ,MILAN  Dec 29 The price that EDF  would pay for taking control of Italy's No. 2 utility Edison  is fair  the chairman of the French utility said on Thursday  adding he was confident about a decision by market watchdog Consob on the deal.,normal
E,ENI SpA,20111229,UPDATE 2-Libya hits ENI but oil deals seem safe ,TRIPOLI  Dec 29 Libya's government told its biggest oil investor  Italy's Eni  to help rebuild the country while it is reviewing some deals although the company said that oil deals were so far safe.,topStory
E,ENI SpA,20111229,Libya Eni review regards two social programmes-Eni spox ,MILAN  Dec 29 A spokeswoman for Italian oil and gas group Eni said on Thursday a contract review announced earlier by Libya regarded two social sustainability programme agreements and not oil contracts.,normal
E,ENI SpA,20111229,Libya interim government says to review ENI contracts ,TRIPOLI  Dec 29 Libya's interim prime minister has told ENI his government would review contracts signed with the Italian firm during Muammar Gaddafi rule before the Italian firm resumes activity in Libya.,normal
E,ENI SpA,20111229,Italy backs Iran sanctions if Eni oil imports excluded ,MILAN  Dec 29 Italy backs sanctions against Iran provided that crude oil imports by Eni relating to existing contracts are excluded  Prime Minister Mario Monti said on Thursday.,normal
XOM,Exxon Mobil Corporation,20111229,Oil rises on shortcovering  market eyes Iran ,NEW YORK Oil rose on Thursday as gains in the stock market and shortcovering helped shake off early losses caused by a rise in U.S. crude stockpiles. | Video ,topStory
GS,Goldman Sachs Group Inc (The),20111229,Amazon shares dip on growth concerns ,Amazon.com Inc shares fell to their lowest level since late March on Thursday on concern about sales growth during the online retailer's crucial fourth quarter.,topStory
HPQ,HP Inc,20111229,Unseal letter in HP Hurd case: court ,An appeals court ruled that a letter linked to Mark Hurd's abrupt departure from his post as chief of Hewlett-Packard Co should be unsealed  potentially revealing new details about his dramatic exit from the technology giant.,topStory
MCO,Moody&#39;s Corporation,20111229,BRIEF-Moody's disclosures on credit ratings of Telenor ASA ,Dec 29 Telenor ASA * Moody's Disclosures on Credit Ratings of Telenor ASA ,topStory
MCO,Moody&#39;s Corporation,20111229,BRIEF-Moody's:Aldar's agreement with Abu Dhabi Government on property transactions is credit-positive ,* Moody's : Aldar's agreement with Abu Dhabi Government on property transactions is credit-positive,normal
MCO,Moody&#39;s Corporation,20111229,BRIEF-Moody's:No rtgs impact from Country Garden's Malaysia investments ,Dec 29 Country Garden Holdings Company Limited,normal
MS,Morgan Stanley,20111229,UPDATE 1-Edgen files for IPO of up to $100 mln ,* Jefferies  Morgan Stanley and Citigroup to underwrite offering,topStory
MOS,Mosaic Company (The),20111229,Analysis: Mosaic may have won skirmish in fertilizer wars ,TORONTO/WINNIPEG Mosaic  a leading North American fertilizer producer  may have won the battle to arrest a plunge in phosphate prices ahead the region's spring planting season  but it still risks losing the war as overseas capacity surges in the coming years.,topStory
NYT,New York Times Company (The),20111229,New York Times sends email to millions by mistake ,Some 8 million people received emails from the New York Times on Wednesday offering a special discount if they would reconsider their decision to cancel their subscriptions.,topStory
NYT,New York Times Company (The),20111229,New York Times sends email to millions by mistake ,Some 8 million people received emails from the New York Times on Wednesday offering a special discount if they would reconsider their decision to cancel their subscriptions.,normal
NYT,New York Times Company (The),20111229,PRESS DIGEST - New York Times business news - Dec 29 ,Dec 29 The following were the top stories on The New York Times business pages on Thursday. Reuters has not verified these stories and does not vouch for their accuracy.,normal
