AMZN,Amazoncom Inc,20111020,Barnes & Noble expands marketplace beyond books ,Barnes & Noble Inc  is adding new categories including home products and consumer electronics to its online marketplace  the latest move by the retailer to rely less on book sales and compete with e-commerce rivals such as Amazon.com Inc  and eBay Inc .,topStory
IR,Ingersoll-Rand plc (Ireland),20111020,UPDATE 2-Ingersoll Rand profit beats but outlook soft ,Oct 20 Ingersoll Rand Plc posted lower quarterly earnings  and its fourth-quarter profit forecast fell short of some Wall Street estimates  due to depressed housing and consumer markets.,normal
JPM,J P Morgan Chase & Co,20111020,New Issue-Sonoco Products sells $500 mln in 2 parts ,Oct 20 Sonoco Products Co   on Thursday sold $500 million notes in two parts  said IFR  a Thomson Reuters service.      Bank of America Merrill Lynch  JP Morgan and Wells Fargo were the joint bookrunning managers for the sale. BORROWER: SONOCO PRODUCTS CO TRANCHE 1 AMT $250 MLN      COUPON 4.375 PCT    MATURITY 11/1/2021  TYPE SR NTS       ISS PRICE 99.543    FIRST PAY 5/1/2012  MOODY'S Baa2      YIELD 4.432 PCT     SETTLEMENT 10/27/2011 S&P BBB-PLUS      SPREAD 225 BPS      PAY FREQ,topStory
JPM,J P Morgan Chase & Co,20111020,New Issue-Pernod Ricard sells $1.5 bln notes ,Oct 20 Pernod Ricard on Thursday sold $1.5 billion of senior unsecured notes in the 144a private placement market  said IFR  a Thomson Reuters service.       Barclays Capital and JP Morgan were the active joint bookrunning managers for the sale. BORROWER: PERNOD RICARD AMT $1.5 BLN      COUPON 4.45 PCT     MATURITY 1/15/2022  TYPE SR NTS       ISS PRICE 99.746    FIRST PAY 7/15/2012 MOODY'S Baa3      YIELD 4.482 PCT     SETTLEMENT 10/25/2011 S&P BBB-MINUS     SPREAD 230 BPS      PAY ,normal
JPM,J P Morgan Chase & Co,20111020,New Issue-IADB prices $500 mln 2041 bond ,Borrower                Inter American Development Bank (IADB),normal
JNJ,Johnson & Johnson,20111020,Hedge fund SAC Capital faces U.S. SEC probe-WSJ ,Oct 20 The U.S. Securities and Exchange Commission is examining whether hedge fund SAC Capital Advisors used insider information to profit from Johnson & Johnson's takeover of Cougar Biotechnology Inc in 2009  the Wall Street Journal said  citing people familiar with the matter.,topStory
KMB,Kimberly-Clark Corporation,20111020,Mexico's Kimber reports lower 3rd-qtr results ,MEXICO CITY  Oct 20 Mexico's leading paper products company  Kimberly Clark de Mexico   on Thursday said its third-quarter profit fell 23 percent  hurt by higher raw-material costs and the depreciation of the peso.,topStory
KMI,Kinder Morgan Inc,20111020,CORRECTED-(OFFICIAL)-Kinder Parkway line almost full ,Oct 19 Kinder Morgan said shippers had committed to about 100 000 barrels per day of its 110 000 bpd capacity for the Parkway Pipeline  its new joint venture oil products pipeline with Valero Energy Corp.,topStory
LPL,LG Display Co Ltd,20111020,UPDATE 3-LG Display posts record loss  sees price falls slowing ,SEOUL  Oct 20 South Korean flat-screen maker LG Display   a key supplier to Apple Inc   posted its biggest quarterly loss  on Thursday as tepid demand for televisions and computers hit panel prices and one-off losses weighed.,topStory
LPL,LG Display Co Ltd,20111020,LG Display sees Q4 factory utilisation at 80 pct levels ,SEOUL  Oct 20 The CFO of flat-screen maker LG Display said on Thursday that it expected its factory utilisation rate to reach 80 percent levels in the fourth quarter after it fell to 70 percent levels in the previous quarter.,normal
LPL,LG Display Co Ltd,20111020,LG Display sees price falls easing after disappointing ,SEOUL South Korean flat-screen maker LG Display   a key supplier to Apple Inc   posted a wider-than-expected quarterly loss on Thursday as tepid demand for TVs and PCs hit panel prices and one-off losses weighed.,normal
LPL,LG Display Co Ltd,20111020,LG Display posts worse-than-expected Q3 loss ,SEOUL Flat-screen maker LG Display  posted a wider-than-expected quarterly loss on Thursday  as tepid demand for TVs and PCs hit panel prices and one-off losses weighed.,normal
LPL,LG Display Co Ltd,20111020,LG Display posts worse-than-expected Q3 loss ,SEOUL  Oct 20 Flat-screen maker LG Display   posted a wider-than-expected quarterly loss on Thursday  as tepid demand for TVs and PCs hit panel prices and one-off losses weighed.,normal
MMI,Marcus & Millichap Inc,20111020,Microsoft to launch Mango smartphones with Nokia  Samsung soon ,HONG KONG Microsoft Corp  which has been trailing Apple Inc and Google Inc in the fast-growing smartphone market  said it will launch Mango-powered handsets from top makers including Nokia Oyj  Samsung Electronics Co Ltd and HTC Corp in coming weeks.,topStory
MDT,Medtronic plc,20111020,Medtronic tests stent for erectile dysfunction ,Medtronic Inc  a manufacturer of pacemakers  heart stents and spine products  has developed a device to tackle another common health problem: erectile dysfunction.,topStory
MDT,Medtronic plc,20111020,Medtronic tests stent for erectile dysfunction ,Medtronic Inc  a manufacturer of pacemakers  heart stents and spine products  has developed a device to tackle another common health problem: erectile dysfunction.,normal
MDT,Medtronic plc,20111020,Medtronic tests stent for erectile dysfunction ,Oct 19 Medtronic Inc   a manufacturer of pacemakers  heart stents and spine products  has developed a device to tackle another common health problem: erectile dysfunction.,normal
MCO,Moody&#39;s Corporation,20111020,BRIEF-Moody's reviews Domino's whole business securitization for possible upgrade ,* Moody's reviews Domino's whole business securitization for possible upgrade,topStory
MCO,Moody&#39;s Corporation,20111020,EU may demand rating blackout for crisis states ,BRUSSELS The European Union's executive may ask for powers to censor credit ratings for countries in crisis  its financial reform chief said on Thursday  describing a ban as one way of stopping fallout from "ill-thought-out" ratings.,normal
MCO,Moody&#39;s Corporation,20111020,UPDATE 3-EU may demand rating blackout for crisis states ,* EU's Barnier says may censor ratings for stricken countries,normal
MCO,Moody&#39;s Corporation,20111020,New Issue-IADB prices $500 mln 2041 bond ,Borrower                Inter American Development Bank (IADB),normal
MS,Morgan Stanley,20111020,MOVES-HighTower Advisors ,Oct 20 The following financial service industry appointment was announced on Thursday. To inform us of other job changes  email to moves@thomsonreuters.com.,topStory
NYT,New York Times Company (The),20111020,NY Times boosts digital subscribers; ad rev drops ,The New York Times Co said the number of subscribers to its flagship digital products increased in the third quarter while overall advertising revenue at the company slid sharply.,topStory
NYT,New York Times Company (The),20111020,UPDATE 3-NY Times boosts digital subscribers; ad rev drops ,Oct 20 The New York Times Co said the number of subscribers to its flagship digital products increased in the third quarter while overall advertising revenue at the company slid sharply.,normal
NFX,Newfield Exploration Company,20111020,UPDATE 1-Newfield Exploration slides on weak Q3  lowered outlook ,Oct 19 Shares of Newfield Exploration Co  dipped 18 percent to their lowest in nearly two years  a day after the independent oil and gas company posted quarterly results below expectations on higher expenses and cut its full-year production.,topStory
NFX,Newfield Exploration Company,20111020,Newfield Exploration shares fall on weak Q3 ,Oct 19 Shares of Newfield Exploration Co  dipped 18 percent to their lowest in nearly two years  a day after the independent oil and gas company posted quarterly results below expectations on higher expenses.,normal
NBL,Noble Energy Inc,20111020,UPDATE 3-Noble Energy profit beats Wall Street expectations ,Oct 20 Noble Energy Inc   a U.S. oil and gas producer  reported a quarterly profit that topped Wall Street expectations  helped by higher-than-expected production and prices.,topStory
NUE,Nucor Corporation,20111020,UPDATE 4-Steelmaker Nucor's Q3 profit up  sees stronger Q1 ,Oct 20 Nucor Corp's third-quarter profit beat Wall Street estimates and although the steelmaker sees market deterioration for the rest of this year  it expects orders to pick up early next year.,topStory
BTU,Peabody Energy Corporation,20111020,Peabody says some Macarthur bid conditions freed ,Oct 21 Peabody Energy and ArcelorMittal's said some conditions which would have defeated its A$4.9 billion ($5.1 billion) bid for Australia's Macarthur Coal had now been freed after major shareholder Citic Resources accepted the bid.,topStory
BTU,Peabody Energy Corporation,20111020,UPDATE 1-Citic accepts $5 bln Peabody offer for Australia's Macarthur ,* Deal with top shareholder takes acceptances above 49 pct,normal
BTU,Peabody Energy Corporation,20111020,Citic accepts Peabody offer for Australia's MacArthur ,Oct 21 China's Citic Resources has accepted Peabody Energy and ArcelorMittal's A$4.9 billion ($5.1 billion) takeover offer for Australia's Macarthur Coal   the companies said on Friday.,normal
PAG,Penske Automotive Group Inc,20111020,Ford sees limited costs  new flexibility in UAW pact ,DETROIT Ford Motor Co  said its new four-year contract with the United Auto Workers union would increase its costs less than 1 percent annually  with higher bonuses offset by newly won flexibility in work rules.,topStory
PAG,Penske Automotive Group Inc,20111020,UPDATE 4-Ford sees limited costs  new flexibility in UAW pact ,* Costs average additional $80 mln per year over 2012-2015,normal
PAG,Penske Automotive Group Inc,20111020,Ford sees limited costs  new flexibility in UAW pact ,DETROIT Ford Motor Co  said its new four-year contract with the United Auto Workers union will increase its costs less than 1 percent annually  with higher bonuses offset by newly won flexibility in work rules.,normal
PKI,PerkinElmer Inc,20111020,New Issue-PerkinElmer sells $500 mln in notes ,Oct 20 PerkinELmer Inc on Thursday sold $500 million of senior unsecured notes  said IFR  a Thomson Reuters service.      Bank of American Merrill Lynch  Barclay's Capital and Deutsche Bank were the joint bookrunning managers for the sale. BORROWER: PERKINELMER INC AMT $500 MLN      COUPON 5.00 PCT     MATURITY 11/15/2021 TYPE SR NTS       ISS PRICE 99.372    FIRST PAY 5/15/2012 MOODY'S Baa3      YIELD 5.08 PCT      SETTLEMENT 10/25/2011 S&P TRIPLE-B      SPREAD 290 BPS      PAY FREQ,topStory
PJC,Piper Jaffray Companies,20111020,Polycom plunges on competitor worries ,Polycom Inc  shares fell by more than a third on Thursday  a day after the videoconferencing company forecast dismal fourth-quarter sales in the face of slow corporate spending and increased competition from rivals like Cisco Systems .,topStory
PG,Procter & Gamble Company (The),20111020,Legendary Entertainment names new board member ,LOS ANGELES (TheWrap.com) - A.G. Lafley  the former chairman  president and CEO of Procter & Gamble  has joined the board of directors of Legendary Entertainment  the company announced Thursday.,topStory
RIO,Rio Tinto Plc,20111020,UPDATE 2-Anglo American Q3 copper dips  2011 seen higher ,* Coal output hit by South African strikes  longwall moves,topStory
RY,Royal Bank Of Canada,20111020,Dexia clears Belgium sale  sets terms for French unit ,BRUSSELS  Oct 20 Bailed out Franco-Belgian financial group Dexia said on Thursday it had finalised the sale of its Belgian banking business to the Belgian state and set terms for the sale of its French public financing arm.,topStory
RBS,Royal Bank Scotland plc (The),20111020,UPDATE 5-Scotiabank to pay $1 bln for Colombian bank stake ,BOGOTA/TORONTO  Oct 20 Bank of Nova Scotia  agreed to pay about $1 billion in cash and stock for a majority stake in Colombia's unlisted Banco Colpatria  expanding the Canadian bank's footprint in the Latin American country.,topStory
SJR,Shaw Communications Inc,20111020,UPDATE 1-Shaw Communications Q4 profit rises ,Oct 20 Shaw Communications said quarterly profit rose helped partly by its new media acquisitions  but forecast a moderate slowdown in free cash flow for 2012.,topStory
SON,Sonoco Products Company,20111020,New Issue-Sonoco Products sells $500 mln in 2 parts ,Oct 20 Sonoco Products Co   on Thursday sold $500 million notes in two parts  said IFR  a Thomson Reuters service.      Bank of America Merrill Lynch  JP Morgan and Wells Fargo were the joint bookrunning managers for the sale. BORROWER: SONOCO PRODUCTS CO TRANCHE 1 AMT $250 MLN      COUPON 4.375 PCT    MATURITY 11/1/2021  TYPE SR NTS       ISS PRICE 99.543    FIRST PAY 5/1/2012  MOODY'S Baa2      YIELD 4.432 PCT     SETTLEMENT 10/27/2011 S&P BBB-PLUS      SPREAD 225 BPS      PAY FREQ,topStory
SNE,Sony Corp Ord,20111020,WRAPUP 3-Thailand struggles to cope with floods  PM wants unity ,* Minister says 90 pct of Bangkok is safe; sluice gates to open,topStory
SNE,Sony Corp Ord,20111020,REFILE-UPDATE 2-Thai floods hit Japan carmaker output  delay Sony launches ,* Unsure when Thai output will be restored - Japan auto group,normal
SNE,Sony Corp Ord,20111020,Sony: camera launches delayed due to Thai flooding ,TOKYO Sony Corp said on Thursday it would delay indefinitely the launches of several new cameras  lens kits and headphones after flooding forced it to halt production at some plants in Thailand.,normal
SNE,Sony Corp Ord,20111020,Sony: camera launches delayed due to Thai flooding ,TOKYO  Oct 20 Sony Corp said on Thursday it would delay indefinitely the launches of several new cameras  lens kits and headphones after flooding forced it to halt production at some plants in Thailand.,normal
LUV,Southwest Airlines Company,20111020,UPDATE 4-Southwest Airlines results top estimates ,Oct 20 Discount carrier Southwest Airlines Co posted a higher-than-expected quarterly profit  excluding special items  and said bookings look strong  sending its shares up over 4 percent.,topStory
TCO,Taubman Centers Inc,20111020,UPDATE 2-Strong sales help boost Taubman's third quarter ,Oct 20 Taubman Centers Inc said quarterly earnings rose as sales at its luxury malls grew nearly 12 percent  underscoring the spending power of richer Americans  and the company raised its forecast for the year.,topStory
BX,The Blackstone Group LP,20111020,Blackstone flexes muscle with new money and deals ,Blackstone Group  is buying more assets and attracting new money from investors  flexing its muscle as losses pile up at private equity firms.,topStory
BX,The Blackstone Group LP,20111020,UPDATE 6-Blackstone flexes muscle with new money and deals ,* Q3 loss 31 cents/share vs Street view loss 5 cents/share,normal
UNP,Union Pacific Corporation,20111020,UPDATE 4-Union Pacific beats estimates; shares rise ,Oct 20 Union Pacific Corp reported record quarterly results that topped estimates because of pricing gains and fuel surcharges  and said re-pricing older contracts will boost profit next year.,topStory
VLO,Valero Energy Corporation,20111020,Valero says prepping Corpus Christi refinery overhaul ,HOUSTON  Oct 20 Valero Energy Corp's  142 000 barrel per day (bpd) Corpus Christi refinery was preparing its east plant for a planned three-week overhaul  a corporate spokesman said on Thursday.,topStory
VLO,Valero Energy Corporation,20111020,CORRECTED-(OFFICIAL)-Kinder Parkway line almost full ,Oct 19 Kinder Morgan said shippers had committed to about 100 000 barrels per day of its 110 000 bpd capacity for the Parkway Pipeline  its new joint venture oil products pipeline with Valero Energy Corp.,normal
VLO,Valero Energy Corporation,20111020,UPDATE 1-Valero reports unit upset at Three Rivers refinery ,Oct 20 Valero Energy Corp reported a process unit upset at its 93 000 barrel-per-day Three Rivers refinery in Texas  due to hydraulic constraints  according to a filing with state environmental regulators.,normal
WMT,Wal-Mart Stores Inc,20111020,Q+A: South African court hears appeal on Wal-Mart  Massmart deal ,JOHANNESBURG/CAPE TOWN South Africa's Competition Appeal Court started hearing an appeal by the government on Thursday aimed at overturning or attaching more conditions to Wal-Mart's  $2.4 billion acquisition of Massmart ,topStory
WMT,Wal-Mart Stores Inc,20111020,Q+A-SAfrican court hears appeal on Wal-Mart  Massmart deal ,JOHANNESBURG/CAPE TOWN Oct 20 South Africa's Competition Appeal Court started hearing an appeal by the government on Thursday aimed at overturning or attaching more conditions to Wal-Mart's $2.4 billion acquisition of Massmart,normal
WFC,Wells Fargo & Company,20111020,New Issue-Sonoco Products sells $500 mln in 2 parts ,Oct 20 Sonoco Products Co   on Thursday sold $500 million notes in two parts  said IFR  a Thomson Reuters service.      Bank of America Merrill Lynch  JP Morgan and Wells Fargo were the joint bookrunning managers for the sale. BORROWER: SONOCO PRODUCTS CO TRANCHE 1 AMT $250 MLN      COUPON 4.375 PCT    MATURITY 11/1/2021  TYPE SR NTS       ISS PRICE 99.543    FIRST PAY 5/1/2012  MOODY'S Baa2      YIELD 4.432 PCT     SETTLEMENT 10/27/2011 S&P BBB-PLUS      SPREAD 225 BPS      PAY FREQ,topStory
WFC,Wells Fargo & Company,20111020,HOW TO PLAY IT: Banking on financial stocks ,ISSUE: While third-quarter earnings reports present a mixed picture for financial services companies  big declines in bank stocks offer tempting bargains for investors.,normal
