AMZN,Amazoncom Inc,20111020,Barnes & Noble expands marketplace beyond books ,Barnes & Noble Inc  is adding new categories including home products and consumer electronics to its online marketplace  the latest move by the retailer to rely less on book sales and compete with e-commerce rivals such as Amazon.com Inc  and eBay Inc .,topStory
AEUA,Anadarko Petroleum Corporation,20111020,UPDATE 1-Mitsubishi buys rights in gas project from Anadarko- Nikkei ,Oct 21 Mitsubishi Corp has bought a 10 percent interest in a petroleum gas exploration project in Liberia from Anadarko Petroleum Corp as the Japanese company looks to explore offshore fields in western Africa  the Nikkei business daily said.,topStory
APC,Anadarko Petroleum Corporation,20111020,UPDATE 1-Mitsubishi buys rights in gas project from Anadarko- Nikkei ,Oct 21 Mitsubishi Corp has bought a 10 percent interest in a petroleum gas exploration project in Liberia from Anadarko Petroleum Corp as the Japanese company looks to explore offshore fields in western Africa  the Nikkei business daily said.,topStory
APA,Apache Corporation,20111020,UPDATE 3-Shell buys LNG site on Canada's Pacific Coast ,CALGARY  Alberta  Oct 20 Royal Dutch Shell Plc has bought a marine terminal on Canada's Pacific Coast as a possible site for a liquefied natural gas export terminal  a company spokesman said on Thursday.,topStory
T,AT&T Inc,20111020,UPDATE 1-Acme Packet Q3 misses Street  backs FY outlook ,Oct 20 Acme Packet Inc   which provides communication infrastructure for telecoms  reported a quarterly profit below estimates  days after it forecast weak results citing delayed orders from key customer AT&T .,topStory
T,AT&T Inc,20111020,MetroPCS is frontrunner for AT&T divestures: report ,MetroPCS Communications  is the first in line to buy assets from AT&T Inc  and T-Mobile USA if they win U.S. regulatory approval for their $39 billion merger  according to a Bloomberg report.,normal
T,AT&T Inc,20111020,AT&T revenue falls short  promises stronger fourth quarter ,AT&T Inc's  quarterly revenue fell short of Wall Street estimates  as wireless customers spent less than expected ahead of the introduction of the latest Apple Inc  iPhone.,normal
T,AT&T Inc,20111020,UPDATE 4-AT&T revenue falls short  promises stronger Q4 ,Oct 20 AT&T Inc's quarterly revenue fell short of Wall Street estimates  as wireless customers spent less than expected ahead of the introduction of the latest Apple Inc iPhone.,normal
AN,AutoNation Inc,20111020,UPDATE 3-AutoNation posts stronger-than-expected profit ,DETROIT  Oct 20 AutoNation Inc   the No. 1 U.S. auto retail group  posted a stronger-than-expected quarterly profit on Thursday  as it rang up higher selling prices for its new and used vehicles.,topStory
BBVA,Banco Bilbao Viscaya Argentaria SA,20111020,UPDATE 1-Mexico's Alfa posts Q3 net loss vs profit year ago ,MEXICO CITY  Oct 20 Mexican conglomerate Alfa posted a third-quarter net loss on Thursday compared with a profit a year ago  dented by a steep weakening of the peso against the dollar during the period.,topStory
BLX,Banco Latinoamericano de Comercio Exterior SA,20111020,Bladex posts $16.3 mln third quarter profit ,PANAMA CITY  Oct 20 Export bank Bladex  reported third quarter profit of $16.3 million on Thursday  up 9 percent from the same quarter a year earlier.,topStory
BAC,Bank of America Corporation,20111020,WRAPUP 2-BB&T is latest bank to embrace cost-cutting ,* Fifth Third loan loss reserve down 87 percent; shares up,topStory
BAC,Bank of America Corporation,20111020,California subpoenas BofA over mortgages: report ,The California attorney general's office subpoenaed Bank of America Corp this week about the sale and marketing of troubled mortgage-backed securities to investors in the state  the Los Angeles Times reported.,normal
BAC,Bank of America Corporation,20111020,UPDATE 1-California subpoenas BofA over mortgages - report ,Oct 20 The California attorney general's office subpoenaed Bank of America Corp this week about the sale and marketing of troubled mortgage-backed securities to investors in the state  the Los Angeles Times reported.,normal
BAC,Bank of America Corporation,20111020,UPDATE 4-US judge takes $8.5 bln BofA deal from state court ,NEW YORK  Oct 19 A judge on Wednesday decided to keep a proposed $8.5 billion settlement over Bank of America Corp's mortgage-backed securities in federal court  potentially dragging out the litigation.,normal
BK,Bank Of New York Mellon Corporation (The),20111020,UPDATE 4-US judge takes $8.5 bln BofA deal from state court ,NEW YORK  Oct 19 A judge on Wednesday decided to keep a proposed $8.5 billion settlement over Bank of America Corp's mortgage-backed securities in federal court  potentially dragging out the litigation.,topStory
BNS,Bank of Nova Scotia (The),20111020,Scotiabank to pay $1 billion for Colombian bank stake ,BOGOTA/TORONTO Bank of Nova Scotia  agreed to pay about $1 billion in cash and stock for a majority stake in Colombia's unlisted Banco Colpatria  expanding the Canadian bank's footprint in the Latin American country.,topStory
BNS,Bank of Nova Scotia (The),20111020,UPDATE 5-Scotiabank to pay $1 bln for Colombian bank stake ,BOGOTA/TORONTO  Oct 20 Bank of Nova Scotia  agreed to pay about $1 billion in cash and stock for a majority stake in Colombia's unlisted Banco Colpatria  expanding the Canadian bank's footprint in the Latin American country.,normal
BNS,Bank of Nova Scotia (The),20111020,UPDATE 1-Canada's Nova Scotia to buy 51 pct in Colombia bank ,Oct 20 Canada's Bank of Nova Scotia  has agreed to buy a 51 percent stake in unlisted Colombian bank Colpatria for $1 billion in cash and shares  marking the foray of Canada's third-largest bank into the South American country.,normal
BNS,Bank of Nova Scotia (The),20111020,Canada's Nova Scotia to buy 51 pct in Colombia bank ,Oct 20 Canada's Bank of Nova Scotia  has agreed to buy a 51 percent stake in unlisted Colombian bank Colpatria for $500 million  the banks said.,normal
BCS,Barclays PLC,20111020,New Issue-Pernod Ricard sells $1.5 bln notes ,Oct 20 Pernod Ricard on Thursday sold $1.5 billion of senior unsecured notes in the 144a private placement market  said IFR  a Thomson Reuters service.       Barclays Capital and JP Morgan were the active joint bookrunning managers for the sale. BORROWER: PERNOD RICARD AMT $1.5 BLN      COUPON 4.45 PCT     MATURITY 1/15/2022  TYPE SR NTS       ISS PRICE 99.746    FIRST PAY 7/15/2012 MOODY'S Baa3      YIELD 4.482 PCT     SETTLEMENT 10/25/2011 S&P BBB-MINUS     SPREAD 230 BPS      PAY ,topStory
BKS,Barnes & Noble Inc,20111020,Barnes & Noble expands marketplace beyond books ,Barnes & Noble Inc  is adding new categories including home products and consumer electronics to its online marketplace  the latest move by the retailer to rely less on book sales and compete with e-commerce rivals such as Amazon.com Inc  and eBay Inc .,topStory
BKS,Barnes & Noble Inc,20111020,UPDATE 2-Barnes & Noble expands marketplace beyond books ,Oct 20 Barnes & Noble Inc is adding new categories including home products and consumer electronics to its online marketplace  the latest move by the retailer to rely less on book sales and compete with e-commerce rivals such as Amazon.com Inc and eBay Inc .,normal
BAX,Baxter International Inc,20111020,Boston Scientific  Baxter results disappoint ,Boston Scientific Corp  reported weak sales of implantable heart defibrillators  its most important product line  and cut its full-year sales forecast  sending shares down as much as 6 percent.,topStory
BAX,Baxter International Inc,20111020,WRAPUP 1-Boston Scientific  Baxter results disappoint ,Oct 20 Boston Scientific Corp reported weak sales of implantable heart defibrillators  its most important product line  and cut its full-year sales forecast  sending shares down as much as 6 percent.,normal
BBT,BB&T Corporation,20111020,WRAPUP 2-BB&T is latest bank to embrace cost-cutting ,* Fifth Third loan loss reserve down 87 percent; shares up,topStory
BBT,BB&T Corporation,20111020,UPDATE 3-BB&T reports higher-than-expected profit ,Oct 20 BB&T Corp reported a higher-than-expected quarterly profit on Thursday as the bank set aside less money for loan losses and earned higher interest income from lending.,normal
BA,Boeing Company (The),20111020,BRIEF-Lufthansa Cargo says not putting order for Boeing freighters on hold ,FRANKFURT  Oct 20 Lufthansa Cargo  head:	 *     says not putting order for Boeing 777 freighters on hold,topStory
BSX,Boston Scientific Corporation,20111020,Boston Scientific  Baxter results disappoint ,Boston Scientific Corp  reported weak sales of implantable heart defibrillators  its most important product line  and cut its full-year sales forecast  sending shares down as much as 6 percent.,topStory
BSX,Boston Scientific Corporation,20111020,WRAPUP 1-Boston Scientific  Baxter results disappoint ,Oct 20 Boston Scientific Corp reported weak sales of implantable heart defibrillators  its most important product line  and cut its full-year sales forecast  sending shares down as much as 6 percent.,normal
BP,BP plc,20111020,Med Crude-Azeri falls to weakest since Libyan war ,LONDON  Oct 20 Urals crude eased in the Mediterranean on Thursday  and Azeri crude slumped to its lowest since January as traders cited healthy supplies from Russia and poor demand from refiners  even for prompt barrels  due to severe run cuts.	     "In a backwardated market you would expect demand for at least prompt barrels to be strong  but in reality we are not seeing this after refiners slashed their runs in the past weeks " said a trader in the Mediterranean.	     Russia also i,topStory
BP,BP plc,20111020,BP shuts Azeri oil platform for maintenance ,BAKU  Oct 20 Oil Major BP   which operates Azeri-Chirag-Guneshli (ACG) in the Caspian Sea  has closed its East Azeri oil drilling platform for maintenance  Tamam Bayatly  a spokesperson of BP-Azerbaijan  told Reuters.,normal
BGG,Briggs & Stratton Corporation,20111020,Text-S&P: Briggs & Stratton upgraded to BB ,-- Briggs & Stratton's credit measures have strengthened over the past 12 months as its operating performance improves and its adjusted debt lowers.      -- We are raising all of our ratings on the company  including our corporate credit rating to 'BB' from 'BB-'.      -- The outlook is stable  reflecting our expectations that Briggs & Stratton will sustain its improved credit protection measures and that operating performance will remain relatively stable. NEW YORK (Standard & Poor's) Oct. 20  ,topStory
COF,Capital One Financial Corporation,20111020,UPDATE 3-Capital One Q3 profit rises on net interest income ,Oct 20 Capital One Financial Corp  reported a better-than-expected quarterly profit on Thursday as net interest income rose and the bank set aside less money for loan losses.,topStory
CVE,Cenovus Energy Inc,20111020,UPDATE 3-Shell buys LNG site on Canada's Pacific Coast ,CALGARY  Alberta  Oct 20 Royal Dutch Shell Plc has bought a marine terminal on Canada's Pacific Coast as a possible site for a liquefied natural gas export terminal  a company spokesman said on Thursday.,topStory
CHL,China Mobile (Hong Kong) Ltd,20111020,UPDATE 1-China Mobile Q3 net up 3.4 pct  slightly below f'cast ,* To rely on data  Internet traffic for growth - analysts,topStory
CHL,China Mobile (Hong Kong) Ltd,20111020,China Mobile says total subscribers rose to 634 mln in Sept ,HONG KONG  Oct 20 China Mobile Ltd   China's largest mobile carrier  said on Thursday that its total mobile subscribers increased to 633.5 million in September  including 43.2 million 3G subscribers.	     China Mobile said on its website that the number of 3G subscribers rose by 2.84 million in September  while total users increased by 5.89 million.	 	  (Reporting by Christina Lo; Editing by Ken Wills),normal
CHL,China Mobile (Hong Kong) Ltd,20111020,China Mobile Q3 net up 3.4 pct  lags f'cast ,HONG KONG  Oct 20 China Mobile   the world's biggest wireless carrier by subscribers  reported a 3.4 percent rise in third-quarter net profit   lagging forecasts  as the company added more subscribers .,normal
CMC,Commercial Metals Company,20111020,Icahn puts slate up for Commercial Metals board ,Billionaire Carl Icahn on Wednesday nominated three directors to the board of steel maker and recycler Commercial Metals Corp. ,topStory
CZZ,Cosan Limited,20111020,Amyris teams up with ETH to expand Brazil ops ,* Production with ETH expected to begin by 2014     * Amyris to access 15 mln T of cane per year     SAO PAULO  Oct 20 Amyris Inc   which has developed technologies for renewable chemicals  said on Thursday it has signed an agreement with Brazilian ethanol company ETH to produce a cane-based specialty chemical.     Farnesene  which can be used in cosmetics  polymer additives  lubricants  consumer packaged goods and cane diesel  will be produced in a built-in facility in one of the mi,topStory
CB,D/B/A Chubb Limited New,20111020,UPDATE 1-Chubb profit falls on Irene losses  cuts outlook ,Oct 20 Property insurer Chubb Corp  reported a smaller third-quarter profit on Thursday  as the effects of August's Hurricane Irene weighed on results  and it slashed its full-year outlook.,topStory
DHR,Danaher Corporation,20111020,WRAPUP 3-U.S. manufacturers sound cautious note on economy ,* Europe in focus when GE reports on Friday  (Adds analyst comment on GE results due Friday  updates stock prices),topStory
DHR,Danaher Corporation,20111020,Manufacturers sound cautious note on economy ,Manufacturers took a cautious tone about prospects for the domestic economy on Thursday  sounding particularly gloomy on construction markets even while reporting quarterly profits that generally beat Wall Street expectations.,normal
DHR,Danaher Corporation,20111020,UPDATE 2-Danaher profit beats Wall Street estimates ,Oct 20 Industrial and healthcare conglomerate Danaher Corp reported a lower quarterly profit on Thursday amid costs for its Beckman Coulter acquisition  but results beat Wall Street forecasts.,normal
DB,Deutsche Bank AG,20111020,New Issue-PerkinElmer sells $500 mln in notes ,Oct 20 PerkinELmer Inc on Thursday sold $500 million of senior unsecured notes  said IFR  a Thomson Reuters service.      Bank of American Merrill Lynch  Barclay's Capital and Deutsche Bank were the joint bookrunning managers for the sale. BORROWER: PERKINELMER INC AMT $500 MLN      COUPON 5.00 PCT     MATURITY 11/15/2021 TYPE SR NTS       ISS PRICE 99.372    FIRST PAY 5/15/2012 MOODY'S Baa3      YIELD 5.08 PCT      SETTLEMENT 10/25/2011 S&P TRIPLE-B      SPREAD 290 BPS      PAY FREQ,topStory
DB,Deutsche Bank AG,20111020,Polkomtel bond tender wrapped up ,LONDON  Oct 20 (IFR) - Spartan Capital Holdings  the bid vehicle of billionaire Zygmunt Solorz-Zak  has received full acceptance from bondholders to tender for cash a PLN1bn bond issued by Polish mobile phone firm Polkomtel.,normal
DB,Deutsche Bank AG,20111020,Food NGO prompts Deutsche Bank commodities review ,FRANKFURT  Oct 20 Deutsche Bank AG  will examine its commodities trading operations to see whether they drive up the price of basic foods after non-profit organisation Foodwatch petitioned Chief Executive Josef Ackermann.,normal
DB,Deutsche Bank AG,20111020,EU bank funding fix is key step in debt crisis plan ,* Pickup in debt deals in last two weeks  but only for strong,normal
DO,Diamond Offshore Drilling Inc,20111020,WRAPUP 1-Downtime dampens deepwater joy for Noble  Diamond ,Oct 20 A long-anticipated surge in deepwater drilling  which suffered a huge setback with the Gulf of Mexico oil well disaster  has given a boost to Diamond Offshore Drilling Inc and Noble Corp that is dampened only by their rig downtime.,topStory
DO,Diamond Offshore Drilling Inc,20111020,UPDATE 2-Diamond Offshore gains from deepwater strength ,Oct 20 Diamond Offshore Drilling Inc  beat Wall Street earnings estimates for the fourth straight quarter as oil demand pushed up daily rates and utilization for its deepwater rigs  and the company declared a special quarterly cash dividend.,normal
DPZ,Domino&#39;s Pizza Inc,20111020,BRIEF-Moody's reviews Domino's whole business securitization for possible upgrade ,* Moody's reviews Domino's whole business securitization for possible upgrade,topStory
EC,Ecopetrol SA,20111020,UPDATE 2-Ecopetrol prices Vasconia  Castilla oil against Brent ,HOUSTON  Oct 20 Colombia's Ecopetrol  has switched the pricing basis for its Vasconia and Castilla grade crude oils from troubled U.S. benchmark West Texas Intermediate to North Sea Brent  market sources said Thursday.,topStory
LLY,Eli Lilly and Company,20111020,UPDATE 4-Eli Lilly profit drops  hurt by higher costs ,Oct 20 Eli Lilly   whose top-selling schizophrenia drug will face cheaper generics this weekend  said quarterly earnings fell due to higher expenses  and the company's shares fell 1 percent.,topStory
ECA,Encana Corporation,20111020,UPDATE 4-Weak gas prices overshadow Encana profit ,Oct 20 Encana Corp's quarterly profit beat expectations  partly because of an unexpectedly large tax recovery  but shares of Canada's top natural gas producer fell as investors stayed bearish on the outlook for gas prices.,topStory
ECA,Encana Corporation,20111020,UPDATE 3-Shell buys LNG site on Canada's Pacific Coast ,CALGARY  Alberta  Oct 20 Royal Dutch Shell Plc has bought a marine terminal on Canada's Pacific Coast as a possible site for a liquefied natural gas export terminal  a company spokesman said on Thursday.,normal
E,ENI SpA,20111020,UPDATE 3-Eni Mozambique find fuels East Africa gas buzz ,* Eni ready to build LNG plant on own   (Releads  adds management comments  shares),topStory
E,ENI SpA,20111020,Eni plans to build LNG plant in Mozambique ,MILAN  Oct 20 Italian oil and gas group Eni  plans to build a liquefied natural gas (LNG) terminal in Mozambique as part of its investments in the country  Chief Executive Paolo Scaroni said on Thursday.,normal
E,ENI SpA,20111020,Eni makes offshore gas discovery in Mozambique-source ,MILAN  Oct 20 Italian oil and gas group Eni  has made a large gas discovery offshore in Mozambique  a source close to the matter said on Thursday.,normal
EPD,Enterprise Products Partners LP,20111020,BP Destin Pipeline to shut Miss. gas plant for maintenance ,NEW YORK  Oct 20 Destin Pipeline Co LLC said it will shut down its natural gas processing plant in Pascagoula  Mississippi  for 17 days beginning on Oct. 24.,topStory
F,Ford Motor Company,20111020,Ford sees limited costs  new flexibility in UAW pact ,DETROIT Ford Motor Co  said its new four-year contract with the United Auto Workers union would increase its costs less than 1 percent annually  with higher bonuses offset by newly won flexibility in work rules.,topStory
F,Ford Motor Company,20111020,UPDATE 4-Ford sees limited costs  new flexibility in UAW pact ,* Costs average additional $80 mln per year over 2012-2015,normal
F,Ford Motor Company,20111020,Ford sees limited costs  new flexibility in UAW pact ,DETROIT Ford Motor Co  said its new four-year contract with the United Auto Workers union will increase its costs less than 1 percent annually  with higher bonuses offset by newly won flexibility in work rules.,normal
F,Ford Motor Company,20111020,TABLE-China Sept car sales up 8.8 pct yr-on-yr ,BEIJING  Oct 20 Car sales in China in September rose 8.8 percent from a year earlier  the China Association of Automobile Manufacturers (CAAM) said.  	 --------------------------------------------------------------- 	    	        	                           Sept   pct change  y-t-d        pct      	 ---------------------------------------------------------------   	 NATIONAL TOTAL BY CAAM                 	 Cars                  1 319 500      8.8  10 537 800      6.4     	 Vehicles  ,normal
FCX,Freeport-McMoran Inc,20111020,UPDATE 2-Freeport Peru concentrator plant halted-workers ,* Company says concentrator stopped for routine maintenance     * Three week old labor strike slows mining operations     * Union says strike talks made no progress      By Caroline Stauffer and Patricia Velez     LIMA  Oct 20 The concentrator plant at Freeport-McMoRan's Cerro Verde copper mine in Peru halted due to technical failure  two workers at the mine said on Thursday  but the company said overall output was not much affected.     Unionized workers at the mine that churns out ,topStory
GDI,Gardner Denver Holdings Inc,20111020,UPDATE 1- Gardner Denver Q3 beats Street  raises FY profit view ,Oct 20 Gardner Denver Inc   a manufacturer of compressors and vacuum products for industrial applications  reported better-than-expected quarterly results  and raised its outlook for the third time this year on improved backlog and order rates.,topStory
GEK,General Electric Capital Corporation,20111020,WRAPUP 3-U.S. manufacturers sound cautious note on economy ,* Europe in focus when GE reports on Friday  (Adds analyst comment on GE results due Friday  updates stock prices),topStory
GEK,General Electric Capital Corporation,20111020,Canada's Nova Scotia to buy 51 pct in Colombia bank ,Oct 20 Canada's Bank of Nova Scotia  has agreed to buy a 51 percent stake in unlisted Colombian bank Colpatria for $500 million  the banks said.,normal
GE,General Electric Company,20111020,WRAPUP 3-U.S. manufacturers sound cautious note on economy ,* Europe in focus when GE reports on Friday  (Adds analyst comment on GE results due Friday  updates stock prices),topStory
GE,General Electric Company,20111020,Canada's Nova Scotia to buy 51 pct in Colombia bank ,Oct 20 Canada's Bank of Nova Scotia  has agreed to buy a 51 percent stake in unlisted Colombian bank Colpatria for $500 million  the banks said.,normal
GM,General Motors Company,20111020,TABLE-China Sept car sales up 8.8 pct yr-on-yr ,BEIJING  Oct 20 Car sales in China in September rose 8.8 percent from a year earlier  the China Association of Automobile Manufacturers (CAAM) said.  	 --------------------------------------------------------------- 	    	        	                           Sept   pct change  y-t-d        pct      	 ---------------------------------------------------------------   	 NATIONAL TOTAL BY CAAM                 	 Cars                  1 319 500      8.8  10 537 800      6.4     	 Vehicles  ,topStory
TV,Grupo Televisa SA,20111020,UPDATE 2-Mexico's Televisa Q3 net drops 6.8 pct ,MEXICO CITY  Oct 19 Mexican broadcaster Televisa said on Wednesday that its third-quarter net profit fell 6.8 percent from a year ago hurt by foreign exchange losses.,topStory
HMC,Honda Motor Company Ltd,20111020,REFILE-UPDATE 2-Thai floods hit Japan carmaker output  delay Sony launches ,* Unsure when Thai output will be restored - Japan auto group,topStory
HMC,Honda Motor Company Ltd,20111020,TABLE-China Sept car sales up 8.8 pct yr-on-yr ,BEIJING  Oct 20 Car sales in China in September rose 8.8 percent from a year earlier  the China Association of Automobile Manufacturers (CAAM) said.  	 --------------------------------------------------------------- 	    	        	                           Sept   pct change  y-t-d        pct      	 ---------------------------------------------------------------   	 NATIONAL TOTAL BY CAAM                 	 Cars                  1 319 500      8.8  10 537 800      6.4     	 Vehicles  ,normal
HPQ,HP Inc,20111020,HP loses strategy chief as overhaul rumbles on ,SAN FRANCISCO Hewlett-Packard Co's chief strategy and technology officer has retired  becoming the latest senior executive to leave the storied Silicon Valley giant struggling to restore its tarnished credibility.,topStory
HPQ,HP Inc,20111020,UPDATE 1-HP loses strategy chief as overhaul rumbles on ,SAN FRANCISCO  Oct 20 Hewlett-Packard Co's chief strategy and technology officer has retired  becoming the latest senior executive to leave the storied Silicon Valley giant struggling to restore its tarnished credibility.,normal
HSBC,HSBC Holdings plc,20111020,UPDATE 3-Capital One Q3 profit rises on net interest income ,Oct 20 Capital One Financial Corp  reported a better-than-expected quarterly profit on Thursday as net interest income rose and the bank set aside less money for loan losses.,topStory
HSBC,HSBC Holdings plc,20111020,EU bank funding fix is key step in debt crisis plan ,* Pickup in debt deals in last two weeks  but only for strong,normal
HSEA,HSBC Holdings plc,20111020,UPDATE 3-Capital One Q3 profit rises on net interest income ,Oct 20 Capital One Financial Corp  reported a better-than-expected quarterly profit on Thursday as net interest income rose and the bank set aside less money for loan losses.,topStory
HSEA,HSBC Holdings plc,20111020,EU bank funding fix is key step in debt crisis plan ,* Pickup in debt deals in last two weeks  but only for strong,normal
HSEB,HSBC Holdings plc,20111020,UPDATE 3-Capital One Q3 profit rises on net interest income ,Oct 20 Capital One Financial Corp  reported a better-than-expected quarterly profit on Thursday as net interest income rose and the bank set aside less money for loan losses.,topStory
HSEB,HSBC Holdings plc,20111020,EU bank funding fix is key step in debt crisis plan ,* Pickup in debt deals in last two weeks  but only for strong,normal
IR,Ingersoll-Rand plc (Ireland),20111020,WRAPUP 3-U.S. manufacturers sound cautious note on economy ,* Europe in focus when GE reports on Friday  (Adds analyst comment on GE results due Friday  updates stock prices),topStory
IR,Ingersoll-Rand plc (Ireland),20111020,Manufacturers sound cautious note on economy ,Manufacturers took a cautious tone about prospects for the domestic economy on Thursday  sounding particularly gloomy on construction markets even while reporting quarterly profits that generally beat Wall Street expectations.,normal
