GE,General Electric Company,20131216,VietJet Air agrees $800 million engine deal with GE's CFM International ,HANOI Vietnam's budget carrier VietJet Air has agreed an $800 million deal to buy 40 engines from CFM International  a joint venture between General Electric  and Snecma  a unit of France's Safran SA   the firms said on Monday.,topStory
GE,General Electric Company,20131216,VietJet Air agrees $800 mln engine deal with GE's CFM International ,HANOI  Dec 16 Vietnam's budget carrier VietJet Air has agreed an $800 million deal to buy 40 engines from CFM International  a joint venture between General Electric  and Snecma  a unit of France's Safran SA  the firms said on Monday.,normal
GEB,General Electric Company,20131216,VietJet Air agrees $800 million engine deal with GE's CFM International ,HANOI Vietnam's budget carrier VietJet Air has agreed an $800 million deal to buy 40 engines from CFM International  a joint venture between General Electric  and Snecma  a unit of France's Safran SA   the firms said on Monday.,topStory
GEB,General Electric Company,20131216,VietJet Air agrees $800 mln engine deal with GE's CFM International ,HANOI  Dec 16 Vietnam's budget carrier VietJet Air has agreed an $800 million deal to buy 40 engines from CFM International  a joint venture between General Electric  and Snecma  a unit of France's Safran SA  the firms said on Monday.,normal
GM,General Motors Company,20131216,GM CEO Akerson defends tenure as his exit nears ,WASHINGTON Dan Akerson  who will step down as General Motors Co's  chief executive next month  on Monday defended his tenure leading the No. 1 U.S. automaker and said his successor will have to build on the turnaround that he guided.,topStory
GM,General Motors Company,20131216,UPDATE 1-GM CEO Akerson defends tenure as his exit nears ,* Akerson to be succeeded by auto industry's first woman CEO,normal
GM,General Motors Company,20131216,GM CEO Akerson defends tenure as his exit nears ,WASHINGTON  Dec 16 Dan Akerson  General Motors Co's outgoing chief executive  on Monday defended his tenure leading the No. 1 U.S. automaker and said his successor will have to build on the turnaround that he guided.,normal
GM,General Motors Company,20131216,Tired of chasing winning investments? Go for a loser ,(The opinions expressed here are those of the author  a columnist for Reuters.),normal
GM,General Motors Company,20131216,COLUMN-Tired of chasing winning investments? Go for a loser ,BOSTON  Dec 13 Investors are notorious for chasing the hot stock or the hot mutual fund  only to be gravely disappointed when they learn that past is not prologue  after all.,normal
GM,General Motors Company,20131216,General Motors to invest $1.3 billion in five U.S. plants ,FLINT  Mich General Motors Co said on Monday it will invest nearly $1.3 billion at five U.S. plants to make a new transmission and boost output for a planned new engine as well as add a vehicle paint shop.,normal
GM,General Motors Company,20131216,General Motors to invest $1.3 bln in 5 U.S. plants ,FLINT  Mich  Dec 16 General Motors Co  said on Monday it will invest nearly $1.3 billion at five U.S. plants to make a new transmission and boost output for a planned new engine as well as add a vehicle paint shop.,normal
GSK,GlaxoSmithKline PLC,20131216,UPDATE 2-GSK bets on emerging markets with $1 bln plan to raise stake in India unit ,* To raise stake in pharma unit to up to 75 pct from 50.7 pct,topStory
GSK,GlaxoSmithKline PLC,20131216,GSK to spend $1 billion to raise stake in Indian unit ,MUMBAI GlaxoSmithKline Plc (GSK)  said on Monday it plans to raise its stake in its Indian pharmaceutical unit to up to 75 percent from 50.7 percent through an open offer in a deal worth about 629 million pounds ($1.02 billion).,normal
GSK,GlaxoSmithKline PLC,20131216,GSK to spend $1 billion to raise stake in Indian drugmaker unit ,MUMBAI  Dec 16 GlaxoSmithKline Plc (GSK)  said on Monday it plans to raise its stake in its Indian pharmaceutical unit to up to 75 percent from 50.7 percent  through an open offer  in a deal worth about 629 million pounds ($1.02 billion).,normal
HLF,Herbalife LTD,20131216,Herbalife's new audit  share rise deal fresh blow to Ackman ,BOSTON Herbalife Ltd  on Monday said a new audit yielded no changes to its financial statements  sending its shares up by more than 9 percent and dealing a blow to hedge fund manager William Ackman  who is betting against the stock.,topStory
HLF,Herbalife LTD,20131216,UPDATE 2-Herbalife's new audit  share rise deal fresh blow to Ackman ,BOSTON  Dec 16 Herbalife Ltd on Monday said a new audit yielded no changes to its financial statements  sending its shares up by more than 9 percent and dealing a blow to hedge fund manager William Ackman  who is betting against the stock.,normal
HLF,Herbalife LTD,20131216,BRIEF-Icahn: Herbalife undervalued  happy about audit news-CNBC ,* Carl icahn: 'certainly happy' about completed herbalife  re-audited results-cnbc,normal
HLF,Herbalife LTD,20131216,BRIEF-Herbalife shares extend gains on heavy volume; up 10 percent ,NEW YORK  Dec 16 Herbalife Ltd :  * Shares extend gains on heavy volume; up 10 percent,normal
HLF,Herbalife LTD,20131216,BRIEF-Herbalife shares resume trading  up 7.4 pct ,NEW YORK  Dec 16 Herbalife Ltd :  * Shares resume trading  up 7.4 percent versus up 3.4 percent before trading,normal
HES,Hess Corporation,20131216,Hess sees lower Q4 earnings  as oil and gas production dips ,Dec 16 Hess Corp said fourth quarter profit will be lower on a sequential basis due to a drop in oil prices and output will be lower than it had previously forecast.,topStory
HMC,Honda Motor Company Ltd,20131216,Honda recalls 7 751 Acura sedans in U.S.  Canada for loose bolts ,DETROIT Honda Motor Co  said on Monday it is recalling 7 751 Acura RLX sedans in the United States and Canada to replace rear suspension bolts that may not have been properly tightened.,topStory
HMC,Honda Motor Company Ltd,20131216,Honda recalls 7 751 Acura sedans in U.S.  Canada for loose bolts ,DETROIT  Dec 16 Honda Motor Co said on Monday it is recalling 7 751 Acura RLX sedans in the United States and Canada to replace rear suspension bolts that may not have been properly tightened.,normal
HMC,Honda Motor Company Ltd,20131216,Wuhan: Detroit of the East gives green light to Renault ,BEIJING/SHANGHAI Renault SA  clinched full access to China's auto market on Monday by sealing a joint venture agreement with state-owned Dongfeng Motor Group  in Wuhan  a city fast shaping up as China's own Detroit.,normal
IBM,International Business Machines Corporation,20131216,INDIA PRESS-Bharti Airtel set to reduce IBM's share in outsourcing deal-Mint ,Note: Reuters has not verified this story and does not vouch for its accuracy.,topStory
JPM,J P Morgan Chase & Co,20131216,JPMorgan blocked probe in Madoff case: government official ,NEW YORK A U.S. Treasury Department watchdog tried to examine whether JPMorgan Chase & Co  interfered with a regulatory probe into its relationship with convicted felon Bernard Madoff but the largest U.S. bank was able to nip the inquiry in the bud  a government official said on Monday.,topStory
JPM,J P Morgan Chase & Co,20131216,UPDATE 1-JPMorgan blocked probe in Madoff case -govt official ,NEW YORK  Dec 16 A U.S. Treasury Department watchdog tried to examine whether JPMorgan Chase & Co  interfered with a regulatory probe into its relationship with convicted felon Bernard Madoff but the largest U.S. bank was able to nip the inquiry in the bud  a government official said on Monday.,normal
JPM,J P Morgan Chase & Co,20131216,MOVES-JPMorgan Chase  Zurich Insurance  State Street  Agasti  Conning ,Dec 16 The following financial services industry appointments were announced on Monday. To inform us of other job changes  email to moves@thomsonreuters.com.,normal
JPM,J P Morgan Chase & Co,20131216,Treasury tried to probe JPM over Madoff  could not enforce subpoena -counsel ,NEW YORK  Dec 16 The U.S. Treasury Department's Office of the Inspector General tried to examine whether JPMorgan Chase & Co interfered with its regulator's oversight duties  according to a statement on Monday from the counsel to the inspector general  but the office failed to win permission to subpoena the bank.,normal
JPM,J P Morgan Chase & Co,20131216,EXCLUSIVE-Comcast weighs three options for Time Warner Cable deal-sources ,(Adds details on the cable companies  shareholder meeting),normal
JPM,J P Morgan Chase & Co,20131216,JPMorgan to sell small investment business in Asia ,JPMorgan Chase & Co   which is pushing to simplify operations on its $2.46 trillion balance sheet  has put up for sale its Global Special Opportunities Group  an Asia-based unit that makes investments in mid-sized companies  according to a person familiar with the matter.,normal
JPM,J P Morgan Chase & Co,20131216,JPMorgan  other employers move to cover costly autism therapies ,Boston Michael Giangregorio's son Nicholas was diagnosed as severely autistic when he was 18 months old. Now 12  Nicholas requires nearly round-the-clock care - special schooling as well as speech  occupational and physical therapy - that can cost tens of thousands of dollars a year.,normal
JPM,J P Morgan Chase & Co,20131216,JPMorgan  other employers move to cover costly autism therapies ,Boston  Dec 16 Michael Giangregorio's son Nicholas was diagnosed as severely autistic when he was 18 months old. Now 12  Nicholas requires nearly round-the-clock care - special schooling as well as speech  occupational and physical therapy - that can cost tens of thousands of dollars a year.,normal
JPM,J P Morgan Chase & Co,20131216,JP Morgan promotes two to senior roles in Saudi Arabia ,DUBAI  Dec 16 JP Morgan Chase has promoted two bankers to senior roles in Saudi Arabia  the bank said in a statement on Monday  after its top banker in the kingdom left earlier this year to join the central bank.,normal
KB,KB Financial Group Inc,20131216,REFILE-KB Financial  NongHyup among bidders for Woori's brokerage unit ,SEOUL  Dec 16 KB Financial Group was among three suitors to place final bids for a controlling stake in the brokerage unit of Woori Finance Holdings  the company said on Monday  in a deal seen to be worth around 1 trillion won ($949.94 million).,topStory
KMI,Kinder Morgan Inc,20131216,UPDATE 2-Kinder Morgan applies to expand Trans Mountain pipeline ,CALGARY  Alberta  Dec 16 Kinder Morgan Energy Partners LP filed an application with Canadian regulators on Monday to nearly treble the capacity of its Trans Mountain crude oil pipeline to 890 000 barrels per day.,topStory
KMI,Kinder Morgan Inc,20131216,Kinder Morgan files application to expand Trans Mountain pipeline ,CALGARY  Alberta  Dec 16 Kinder Morgan Energy Partners LP filed an application with Canadian regulators on Monday to build the facilities necessary to expand its Trans Mountain crude oil pipeline to 890 000 barrels per day.,normal
KKR,KKR & Co LP,20131216,KKR to acquire its specialty finance company for $2.6 billion ,NEW YORK Investment firm KKR & Co LP  said on Monday it would acquire KKR Financial Holdings LLC (KFN)  in an all-stock deal that would value the specialty finance company it launched more than nine years ago at $2.6 billion.,topStory
KKR,KKR & Co LP,20131216,UPDATE 1-KKR to acquire its specialty finance company for $2.6 bln ,NEW YORK  Dec 16 Investment firm KKR & Co LP  said on Monday it would acquire KKR Financial Holdings LLC (KFN) in an all-stock deal that would value the specialty finance company it launched more than nine years ago at $2.6 billion.,normal
KKR,KKR & Co LP,20131216,KKR to acquire its specialty finance company for $2.6 bln ,NEW YORK  Dec 16 Investment firm KKR & Co LP  said on Monday it would acquire KKR Financial Holdings LLC (KFN) in an all-stock deal that would value the specialty finance company it launched more than nine years ago at $2.6 billion.,normal
KKR,KKR & Co LP,20131216,BRIEF-KKR up 1.4 pct on deal to acquire KKR Financial; KKR Financial up 30.7 pct ,NEW YORK  Dec 16 KKR:  * KKR & co shares up 1.4 percent in after hours trading following deal to,normal
KR,Kroger Company (The),20131216,Fitch Rates Kroger's Proposed Notes 'BBB' ,(The following statement was released by the rating agency) CHICAGO  December 16 (Fitch) Fitch Ratings has assigned a rating of 'BBB' to The  Kroger Co.'s (Kroger) proposed issuance of senior unsecured notes due 2016  2019  and 2021. The Rating Outlook is Stable.  Kroger intends to use the proceeds from the notes to fund the merger with Harris  Teeter Supermarkets  Inc. (HTSI) and for general corporate purposes. As of Nov.  9  2013  Kroger had $8.3 billion of debt outstanding  including capital ,topStory
LMT,Lockheed Martin Corporation,20131216,Lockheed may revise 2014 outlook if U.S. budget deal passes ,WASHINGTON U.S. weapons maker Lockheed Martin Corp  may revise upward its financial outlook for 2014 if Congress passes a two-year budget deal that would blunt the effect of mandatory budget cuts  Marillyn Hewson  the company's president and chief executive officer  told Reuters on Monday.,topStory
LMT,Lockheed Martin Corporation,20131216,Lockheed sees strong cyber demand despite NSA scandal: CEO ,WASHINGTON Lockheed Martin Corp   the Pentagon's No. 1 supplier and top provider of information technology to the U.S. government  said on Monday there is continued demand for cybersecurity services  despite the National Security Agency spying scandal.,normal
LMT,Lockheed Martin Corporation,20131216,Lockheed sees strong cyber demand despite NSA scandal -CEO ,WASHINGTON  Dec 16 Lockheed Martin Corp  the Pentagon's No. 1 supplier and top provider of information technology to the U.S. government  said on Monday there is continued demand for cybersecurity services  despite the National Security Agency spying scandal.,normal
LMT,Lockheed Martin Corporation,20131216,Supreme Court declines to review Lockheed employee class action ,WASHINGTON The Supreme Court on Monday opted not to hear an appeal filed by Lockheed Martin Corp   which was contesting a class action lawsuit brought by employees.,normal
LMT,Lockheed Martin Corporation,20131216,U.S. top court declines to review Lockheed employee class action ,WASHINGTON  Dec 16 The U.S. Supreme Court on Monday opted not to hear an appeal filed by Lockheed Martin Corp   which was contesting a class action lawsuit brought by employees.,normal
ORAN,Orange,20131216,Bouygues Telecom  Orange hit back in 4G battle ,PARIS  Dec 16 Bouygues Telecom said it would offer superfast mobile broadband service at no extra charge in some of its low-cost packages in the latest salvo in the French mobile price war.,topStory
PBA,Pembina Pipeline Corp,20131216,Pembina Pipeline plans C$2 billion system expansion ,CALGARY  Alberta  Dec 16 Pembina Pipeline Corp  plans a C$2 billion expansion of its regional pipeline network in Western Canada to take crude oil and natural-gas liquids from northwest Alberta and northeastern British Columbia to the Edmonton  Alberta  processing hub  the company said on Monday.,topStory
PFE,Pfizer Inc,20131216,Siemens  Pfizer to cooperate on diagnostic tests ,FRANKFURT Germany's Siemens agreed to cooperate with Pfizer on diagnostic tests for therapeutic products across the U.S. drugmaker's pipeline.,topStory
PFE,Pfizer Inc,20131216,Siemens  Pfizer to cooperate on diagnostic tests ,FRANKFURT  Dec 16 Germany's Siemens  agreed to cooperate with Pfizer on diagnostic tests for therapeutic products across the U.S. drugmaker's pipeline.,normal
RIO,Rio Tinto Plc,20131216,RPT-UPDATE 1-Turquoise Hill says Oyu Tolgoi financing pledges extended ,TORONTO  Dec 16 Turquoise Hill Resources Ltd  said on Monday that parent Rio Tinto   had secured extended commitments from the banks that have agreed to finance the underground expansion of the Oyu Tolgoi copper and gold mine in Mongolia.,topStory
RIO,Rio Tinto Plc,20131216,RPT-Trafigura agrees off-take deal for Oyu Tolgoi mine ,* Majority mine owner Rio Tinto wrangling with Mongolia on expansion,normal
RIO,Rio Tinto Plc,20131216,Trafigura agrees off-take deal for Oyu Tolgoi mine ,* Majority mine owner Rio Tinto wrangling with Mongolia on expansion,normal
RIO,Rio Tinto Plc,20131216,UPDATE 1-Turquoise Hill says Oyu Tolgoi financing pledges extended ,TORONTO  Dec 16 Turquoise Hill Resources Ltd  said on Monday that parent Rio Tinto   had secured extended commitments from the banks that have agreed to finance the underground expansion of the Oyu Tolgoi copper and gold mine in Mongolia.,normal
RIO,Rio Tinto Plc,20131216,Turquoise Hill says Oyu Tolgoi financing pledges extended ,TORONTO  Dec 16 Turquoise Hill Resources Ltd  said on Monday that parent Rio Tinto   had secured extended commitments from the banks that have agreed to finance the underground expansion of the Oyu Tolgoi copper and gold mine in Mongolia.,normal
RBS,Royal Bank Scotland plc (The),20131216,RBS ends 8 billion pound capital back-up with UK government ,LONDON Royal Bank of Scotland  has cut itself free from an 8 billion-pound ($13 billion) capital tie to the British government  it said on Tuesday  following recent moves to strengthen its capital base.,topStory
RBS,Royal Bank Scotland plc (The),20131216,UPDATE 1-RBS ends 8 bln stg capital back-up with UK government ,LONDON  Dec 16 Royal Bank of Scotland  has cut itself free from an 8 billion-pound ($13 billion) capital tie to the British government  it said on Tuesday  following recent moves to strengthen its capital base.,normal
RBS,Royal Bank Scotland plc (The),20131216,RBS ends 8 bln stg capital back-up with UK government ,LONDON  Dec 16 Royal Bank of Scotland  said on Tuesday it had terminated an 8 billion pound ($13 billion) contingent capital facility with the government in light of actions taken recently to strengthen its capital.,normal
SBBC,Scorpio Tankers Inc,20131216,S.Korea Daewoo Shipbuilding wins $474 mln order from Scorpio Tankers ,SEOUL  Dec 16 Daewoo Shipbuilding & Marine Engineering Co Ltd said on Monday it had won a 499 billion Korean won ($474.02 million) order to build five very large crude carriers (VLCC) from Scorpio Tankers Inc.,topStory
SBNA,Scorpio Tankers Inc,20131216,S.Korea Daewoo Shipbuilding wins $474 mln order from Scorpio Tankers ,SEOUL  Dec 16 Daewoo Shipbuilding & Marine Engineering Co Ltd said on Monday it had won a 499 billion Korean won ($474.02 million) order to build five very large crude carriers (VLCC) from Scorpio Tankers Inc.,topStory
STNG,Scorpio Tankers Inc,20131216,S.Korea Daewoo Shipbuilding wins $474 mln order from Scorpio Tankers ,SEOUL  Dec 16 Daewoo Shipbuilding & Marine Engineering Co Ltd said on Monday it had won a 499 billion Korean won ($474.02 million) order to build five very large crude carriers (VLCC) from Scorpio Tankers Inc.,topStory
STT,State Street Corporation,20131216,MOVES-JPMorgan Chase  Zurich Insurance  State Street  Agasti  Conning ,Dec 16 The following financial services industry appointments were announced on Monday. To inform us of other job changes  email to moves@thomsonreuters.com.,topStory
GCI,TEGNA Inc,20131216,U.S. clears Gannett purchase of Belo minus one TV station ,WASHINGTON Gannett Co Inc can move ahead with its purchase of Belo Corp as long as the deal does not include KMOV-TV  a St. Louis television station  antitrust enforcers at the U.S. Justice Department said on Monday.,topStory
GCI,TEGNA Inc,20131216,UPDATE 1-US clears Gannett purchase of Belo minus one TV station ,WASHINGTON  Dec 16 Gannett Co Inc can move ahead with its purchase of Belo Corp as long as the deal does not include KMOV-TV  a St. Louis television station  antitrust enforcers at the U.S. Justice Department said on Monday.,normal
GCI,TEGNA Inc,20131216,U.S. approves Gannett purchase of Belo minus one TV station ,WASHINGTON  Dec 16 Gannett Co Inc can move ahead with its purchase of Belo Corp as long as the deal does not include KMOV-TV  a television station in St. Louis  antitrust enforcers at the U.S. Justice Department said on Monday.,normal
TI,Telecom Italia SPA,20131216,BlackRock ups stake in Telecom Italia ahead of vote for control ,MILAN BlackRock raised its stake in Telecom Italia to make it the struggling firm's second-biggest investor ahead of a vote for control  but did not say if it would side with top shareholder Telefonica or rebels fighting the Spanish firm's strategy.,topStory
TI,Telecom Italia SPA,20131216,UPDATE 4-BlackRock ups stake in Telecom Italia ahead of vote for control ,* Says will tell market its holding as of Monday within 48 hrs,normal
TI,Telecom Italia SPA,20131216,Blackrock says has 9.97 percent of Telecom Italia  not 10.14 percent ,MILAN Blackrock said on Monday it held 9.97 percent of Telecom Italia as of November 29 and not 10.14 percent as it had previously stated in a filing to the Securities and Exchange Commission (SEC).,normal
TI,Telecom Italia SPA,20131216,Blackrock says has 9.97 pct of Telecom Italia  not 10.14 pct ,MILAN  Dec 16 Blackrock said on Monday it held 9.97 percent of Telecom Italia as of November 29 and not 10.14 percent as it had previously stated in a filing to the Securities and Exchange Commission (SEC).,normal
TI,Telecom Italia SPA,20131216,Telecom Italia rebel investor proposes candidates for new board ,MILAN  Dec 16 Findim Group  a rebel investor in Telecom Italia which wants the board of the company revoked at a shareholder meeting this week  on Monday submitted its slate of five candidates to take over as directors.,normal
TI,Telecom Italia SPA,20131216,European shares climb on strong euro zone PMI  Aggreko leads ,LONDON  Dec 16 European shares rebounded on Monday as encouraging economic data out of the euro zone outweighed concern over the outlook for U.S. monetary policy  with Aggreko leading gainers after a bullish trading update.,normal
TI,Telecom Italia SPA,20131216,BlackRock says voting stake in Telecom Italia 7.789 pct as of Dec.15 ,MILAN  Dec 16 U.S. money manager BlackRock  said on Monday its voting stake in Telecom Italia  was 7.789 percent as of Dec. 15  adding it had no agreements regarding the stake that required disclosure under Italian rules.,normal
TI,Telecom Italia SPA,20131216,BlackRock has 7.78 pct in Telecom Italia voting capital - ANSA ,MILAN  Dec 16 BlackRock holds 7.783 percent of Telecom Italia's voting share capital  ANSA news agency reported on Monday  citing a statement by the U.S. money manager.,normal
TI,Telecom Italia SPA,20131216,RPT-Watchdog tells BlackRock to show its hand before Telecom Italia EGM ,* SEC says BlackRock raised Telecom Italia stake to 10.1 pct,normal
TEF,Telefonica SA,20131216,BlackRock ups stake in Telecom Italia ahead of vote for control ,MILAN BlackRock raised its stake in Telecom Italia to make it the struggling firm's second-biggest investor ahead of a vote for control  but did not say if it would side with top shareholder Telefonica or rebels fighting the Spanish firm's strategy.,topStory
TEF,Telefonica SA,20131216,UPDATE 4-BlackRock ups stake in Telecom Italia ahead of vote for control ,* Says will tell market its holding as of Monday within 48 hrs,normal
TEF,Telefonica SA,20131216,Deals of the day- Mergers and acquisitions ,Dec 16 The following bids  mergers  acquisitions and disposals were reported by 2100 GMT on Monday:,normal
TOT,Total SA,20131216,Total reaches pay deal with two French unions ,PARIS Total's  French refining operations have reached a pay rise deal with two unions  isolating the hardline CGT union  the company and a union official told Reuters on Monday.,topStory
TOT,Total SA,20131216,EU mergers and takeovers (Dec 16) ,BRUSSELS  Dec 16 The following are mergers under review by the European Commission and a brief guide to the EU merger process:,normal
TWTR,Twitter Inc,20131216,Facebook backer Yuri Milner exits automatic Y Combinator investments ,SAN FRANCISCO Yuri Milner  the Russian investor known for his bets on Facebook Inc and Twitter Inc  is pulling out of an arrangement that let him invest automatically in a group of companies participating in a program called Y Combinator.,topStory
TWTR,Twitter Inc,20131216,Facebook backer Yuri Milner exits automatic Y Combinator investments ,SAN FRANCISCO  Dec 16 Yuri Milner  the Russian investor known for his bets on Facebook Inc and Twitter Inc  is pulling out of an arrangement that let him invest automatically in a group of companies participating in a program called Y Combinator.,normal
TWTR,Twitter Inc,20131216,BRIEF-Twitter down 1.2 percent premarket after downgrades ,NEW YORK  Dec 16 Twitter Inc :  * Down 1.2 percent to $58.30 in premarket after Suntrust cuts to neutral rating and Wells Fargo downgrades to underperform rating,normal
VRX,Valeant Pharmaceuticals International Inc,20131216,Valeant to acquire Solta Medical for $236 million ,Valeant Pharmaceuticals International   said on Monday that it would buy Solta Medical Inc  for about $236 million in cash to add products for procedures such as skin rejuvenation  skin tightening and body contouring.,topStory
VRX,Valeant Pharmaceuticals International Inc,20131216,UPDATE 1-Valeant to acquire Solta Medical for $236 million ,Dec 16 Valeant Pharmaceuticals International   said on Monday that it would buy Solta Medical Inc for about $236 million in cash to add products for procedures such as skin rejuvenation  skin tightening and body contouring.,normal
VRX,Valeant Pharmaceuticals International Inc,20131216,Valeant to acquire Solta Medical for $236 million ,Valeant Pharmaceuticals International  said on Monday it would acquire Solta Medical Inc  for about $236 million in cash  giving it access to products used in procedures such as skin rejuvenation  skin tightening and body contouring.,normal
