AGEN,Agenus Inc,20131216,Agenus brain cancer vaccine shows promise in study ,Agenus Inc said more than 90 percent of patients treated with its experimental brain cancer vaccine were alive six months after undergoing surgery to remove the tumors.,topStory
AGEN,Agenus Inc,20131216,Agenus brain cancer vaccine shows promise in study ,Dec 16 Agenus Inc said more than 90 percent of patients treated with its experimental brain cancer vaccine were alive six months after undergoing surgery to remove the tumors.,normal
AGEN,Agenus Inc,20131216,BRIEF-Agenus up 27.5 percent premarket after phase 2 results for brain cancer vaccine ,NEW YORK  Dec 16 Agenus Inc :  * Up 27.5 percent to $3.11 in premarket after phase 2 results for brain cancer vaccine,normal
AMZN,Amazoncom Inc,20131216,Amazon's German workers strike as Christmas orders peak ,BERLIN/DUESSELDORF Hundreds of Amazon.com Inc workers in Germany went on strike on Monday  just as pre-Christmas sales were set to peak  in a dispute over pay and conditions that has raged for months. | Video ,topStory
AMZN,Amazoncom Inc,20131216,UPDATE 2-Amazon's German workers strike as Christmas orders peak ,* Amazon says most staff shun strike  Xmas trade unaffected,normal
AMZN,Amazoncom Inc,20131216,FINNEWS LATAM-Vale to sell $321 mln in bonds for railway building ,Brazilian mining giant Vale SA  asked for permission to sell 750 million reais ($321 million) of notes maturing between 2021 and 2029 to finance railway construction in the Amazon state of Pará  the company said in securities filing late Sunday. The notes will be sold under a so-called infrastructure debt program  which allows companies to issue tax-free securities to finance long-term investment projects.,normal
AMZN,Amazoncom Inc,20131216,Amazon's German workers set to go on strike ,FRANKFURT Workers at Amazon.com's German operations were set to go on strike on Monday  in the middle of the crucial Christmas holiday season  in a dispute over pay that has been raging for months.,normal
AMZN,Amazoncom Inc,20131216,Amazon's German workers set to go on strike ,FRANKFURT  Dec 16 Workers at Amazon.com's  German operations were set to go on strike on Monday  in the middle of the crucial Christmas holiday season  in a dispute over pay that has been raging for months.,normal
AAPL,Apple Inc,20131216,UPDATE 1-Obama to meet tech executives Tuesday on HealthCare.Gov -White House ,WASHINGTON  Dec 16 U.S. President Barack Obama will meet executives from leading technology companies like Google and Apple on Tuesday to discuss ways to improve the functioning of the health care website  HealthCare.gov  the White House said.,topStory
AAPL,Apple Inc,20131216,Obama to meet tech executives Tuesday on HealthCare.Gov: White House ,WASHINGTON U.S. President Barack Obama will meet executives from leading technology companies like Google and Apple on Tuesday to discuss ways to improve the functioning of the health care website  HealthCare.gov  the White House said.,normal
BLRX,BioLineRx Ltd,20131216,BRIEF-BioLine Rx U.S.-listed shares up 20.4 percent premarket ,NEW YORK  Dec 16 BioLine RX Ltd :  * U.S.-listed shares up 20.4 percent to $3.07 in premarket after initial phase 2 results of acute myeloid leukemia treatment,topStory
AVGO,Broadcom Limited,20131216,RPT-UPDATE 3-Avago to buy LSI for $6.6 billion to focus on storage chips ,* Enterprise storage to become biggest revenue contributor,topStory
AVGO,Broadcom Limited,20131216,US STOCKS-Upbeat data  deals lift Wall St; traders keep eye on Fed ,* Avago to buy LSI for $6.6 bln; AIG to sell unit for $5.4 bln,normal
AVGO,Broadcom Limited,20131216,US STOCKS-Wall St rebounds but cautious sentiment prevails on Fed ,* Avago to buy LSI for $6.6 bln; AIG to sell unit for $5.4 bln,normal
AVGO,Broadcom Limited,20131216,Avago to buy LSI for $6.6 billion to focus on storage chips ,Avago Technologies Ltd on Monday said it would buy LSI Corp for $6.6 billion in one of the semiconductor industry's largest deals this year as it turns to the fast-growing storage chip market to counter volatility in its main wireless business.,normal
AVGO,Broadcom Limited,20131216,UPDATE 3-Avago to buy LSI for $6.6 billion to focus on storage chips ,* Enterprise storage to become biggest revenue contributor   (Adds advisers  background on deal),normal
AVGO,Broadcom Limited,20131216,US STOCKS-Wall St rebounds after steep weekly decline; Fed in focus ,* Fed meeting in view  investors seek stimulus clarity     * Avago to buy LSI for $6.6 bln; AIG to sell unit for $5.4 bln     * S&P 500 near all-time high  but below 14-day moving average     * Indexes up: Dow 0.9 pct  S&P 0.7 pct  Nasdaq 0.8 pct       By Angela Moon     NEW YORK  Dec 16 U.S. stocks rose on Monday  rebounding from their worst week in months as large deals boosted optimism but investors remained cautious ahead of an upcoming Federal Reserve policy meeting.     Equitie,normal
AVGO,Broadcom Limited,20131216,US STOCKS-Wall St rises  eyes turn to Fed meeting ,* Avago to buy LSI for $6.6 bln; AIG to sell unit for $5.4 bln,normal
AVGO,Broadcom Limited,20131216,US STOCKS-Futures point to higher open  all eyes on Fed ,* Avago to buy LSI for $6.6 bln; AIG to sell unit for $5.4 bln,normal
AVGO,Broadcom Limited,20131216,BRIEF-LSI up 39.1 percent premarket; to be acquired by Avago Tech ,NEW YORK  Dec 16 LSI Corp :  * Up 39.1 percent to $11 in premarket; to be acquired by Avago Technologies for $6.6 billion. Avago shares rose 15 percent to $52.51 before the opening bell.,normal
AVGO,Broadcom Limited,20131216,Avago to buy storage chipmaker LSI for $6.6 bln ,Dec 16 Avago Technologies Ltd  whose chips are used in Apple Inc's products  will buy LSI Corp for $6.6 billion in cash  the companies said on Monday.,normal
CHTR,Charter Communications Inc,20131216,US STOCKS-Futures point to higher open  all eyes on Fed ,* Avago to buy LSI for $6.6 bln; AIG to sell unit for $5.4 bln,topStory
CHTR,Charter Communications Inc,20131216,EXCLUSIVE-Comcast weighs three options for Time Warner Cable deal-sources ,(Adds details on the cable companies  shareholder meeting),normal
CHTR,Charter Communications Inc,20131216,US STOCKS-Futures flat as investors turn eyes to Fed meeting ,* Dec New York manufacturing data on tap  seen rebounding,normal
CHTR,Charter Communications Inc,20131216,US STOCKS-Futures flat as investors turn eyes to Fed meeting ,* Fed meeting in view  investors looking for stimulus clarity,normal
CMCSA,Comcast Corporation,20131216,Exclusive: Comcast weighs three options for Time Warner Cable deal: sources ,NEW YORK Comcast Corp is examining three scenarios for a potential deal with Time Warner Cable  including a full takeover bid for the second-largest cable operator  people close to the situation said on Monday.,topStory
CMCSA,Comcast Corporation,20131216,EXCLUSIVE-Comcast weighs three options for Time Warner Cable deal-sources ,(Adds details on the cable companies  shareholder meeting),normal
ENDP,Endo International plc,20131216,Endo Health to acquire Nupathe for $105 million ,Specialty pharmaceutical company Endo Health Solutions Inc said it would buy NuPathe Inc for about $105 million to gain access to NuPathe's migraine treatment  Zecuity.,topStory
ENDP,Endo International plc,20131216,Endo Health to acquire Nupathe for $105 million ,Dec 16 Specialty pharmaceutical company Endo Health Solutions Inc said it would buy NuPathe Inc  for about $105 million to gain access to NuPathe's migraine treatment  Zecuity.,normal
ENDP,Endo International plc,20131216,BRIEF-NuPathe up 60.9 percent premarket; to be acquired by Endo Health ,NEW YORK  Dec 16 Nupathe Inc :  * Up 60.9 percent to $3.70 in premarket; to be acquired by Endo Health for about $105 million,normal
FB,Facebook Inc,20131216,Nasdaq fails to win dismissal of Facebook IPO lawsuit ,NEW YORK A federal judge has rejected Nasdaq OMX Group Inc's bid to dismiss lawsuits by investors who accused the exchange operator of botching Facebook Inc's $16 billion initial public offering  a decision released on Monday shows.,topStory
FB,Facebook Inc,20131216,Oregon politician gets six years for Facebook IPO fraud ,NEW YORK  Dec 16 A former candidate for governor of Oregon was sentenced to six years in prison on Monday for fraudulently convincing investors he had access to shares of Facebook Inc before its highly anticipated initial public offering in 2012.,normal
FB,Facebook Inc,20131216,Nasdaq fails to win dismissal of Facebook IPO lawsuit ,NEW YORK  Dec 16 A federal judge has rejected Nasdaq OMX Group Inc's bid to dismiss lawsuits by investors who accused the exchange operator of botching Facebook Inc's $16 billion initial public offering  a decision released on Monday shows.,normal
MGIC,Magic Software Enterprises Ltd,20131216,Thunder edge Magic  move to 12-0 at home ,OKLAHOMA CITY -- Orlando coach Jacque Vaughn knows how hard it is to get on any kind of winning streak. His squad's best run was a three-game win streak near the start the season.,topStory
MSFT,Microsoft Corporation,20131216,COLUMN-Tired of chasing winning investments? Go for a loser ,BOSTON  Dec 13 Investors are notorious for chasing the hot stock or the hot mutual fund  only to be gravely disappointed when they learn that past is not prologue  after all.,normal
QCOM,QUALCOMM Incorporated,20131216,UPDATE 1-Market Chatter- Corporate finance press digest ,Dec 16 The following corporate finance-related stories were reported by media:,topStory
QCOM,QUALCOMM Incorporated,20131216,InterDigital execs fear arrest  won't meet China antitrust agency ,Dec 16 InterDigital Inc  a U.S. patent licensing firm  says its executives will not attend a meeting with Chinese antitrust authorities in Beijing on Wednesday because it fears they will be arrested.,normal
QCOM,QUALCOMM Incorporated,20131216,ASE's clients may slash orders after plant said to pollute -reports ,TAIPEI  Dec 16 Qualcomm Inc and other clients of Advanced Semiconductor Engineering Inc (ASE)  have started to consider shifting some of their business elsewhere after the Taiwanese company's main plant was accused of polluting a river  local media said on Monday.,normal
TSLA,Tesla Inc ,20131216,UPDATE 1-GM CEO Akerson defends tenure as his exit nears ,* Akerson to be succeeded by auto industry's first woman CEO,normal
VOD,Vodafone Group Plc,20131216,Vodafone hit with 250 million euro lawsuit in Greece: FT ,Vodafone has been served with a 250 million euro ($343.26 million) lawsuit for allegedly breaching its contracts and causing harm to a Greek retail partner  the Financial Times reported late on Sunday.,topStory
VOD,Vodafone Group Plc,20131216,Vodafone hit with 250 mln euro lawsuit in Greece -FT ,Dec 16 Vodafone has been served with a 250 million euro ($343.26 million) lawsuit for allegedly breaching its contracts and causing harm to a Greek retail partner  the Financial Times reported late on Sunday.,normal
ASX,Advanced Semiconductor Engineering Inc,20131216,UPDATE 1-Market Chatter- Corporate finance press digest ,Dec 16 The following corporate finance-related stories were reported by media:,topStory
ASX,Advanced Semiconductor Engineering Inc,20131216,ASE's clients may slash orders after plant said to pollute -reports ,TAIPEI  Dec 16 Qualcomm Inc and other clients of Advanced Semiconductor Engineering Inc (ASE)  have started to consider shifting some of their business elsewhere after the Taiwanese company's main plant was accused of polluting a river  local media said on Monday.,normal
AER,Aercap Holdings NV,20131216,Fitch Places AerCap's 'BBB-' L-T IDR on Rating Watch Negative on Proposed Acquisition of ILFC ,(The following statement was released by the rating agency) NEW YORK  December 16 (Fitch) Fitch Ratings has placed AerCap Holdings N.V.'s  (AerCap) 'BBB-' long-term Issuer Default Rating (IDR) on Rating Watch Negative.  A full list of rating actions follows at the end of this press release. Today's action follows AerCap's announcement that it has entered into a  definitive agreement to acquire International Lease Finance Corp. (ILFC;  'BB'/Rating Watch Positive). Fitch expects to resolve the Rat,topStory
AER,Aercap Holdings NV,20131216,BRIEF-Aercap Holdings up 17.7 percent premarket; to buy aircraft-leasing business from AIG ,NEW YORK  Dec 16 AerCap Holdings N.V. :  * Up 17.7 percent to $29.35 in premarket; to buy aircraft-leasing business from American International Group for about $5.4 billion. AIG shares gained 3.1 percent to $51.25 before the opening bell.,normal
A,Agilent Technologies Inc,20131216,Avago to buy LSI for $6.6 billion to focus on storage chips ,Avago Technologies Ltd on Monday said it would buy LSI Corp for $6.6 billion in one of the semiconductor industry's largest deals this year as it turns to the fast-growing storage chip market to counter volatility in its main wireless business.,normal
A,Agilent Technologies Inc,20131216,UPDATE 3-Avago to buy LSI for $6.6 billion to focus on storage chips ,* Enterprise storage to become biggest revenue contributor   (Adds advisers  background on deal),normal
AA,Alcoa Corporation,20131216,Alcoa signs supply deal worth $110 million with Airbus ,Alcoa Inc  has signed a long-term deal worth about $110 million to supply titanium and aluminum parts to planemaker Airbus  from its recently overhauled facility in Cleveland.,topStory
AA,Alcoa Corporation,20131216,Alcoa signs supply deal worth $110 million with Airbus ,Dec 16 Alcoa Inc has signed a long-term deal worth about $110 million to supply titanium and aluminum parts to planemaker Airbus from its recently overhauled facility in Cleveland.,normal
AIG,American International Group Inc,20131216,AIG sells aircraft leasing wing to focus on insurance ,Insurer American International Group Inc  said on Monday it will sell its aircraft-leasing business to AerCap Holdings NV  for $5.4 billion  after four years of trying to divest its biggest non-insurance business in fits and starts.,topStory
AIG,American International Group Inc,20131216,UPDATE 3-AIG sells aircraft leasing wing to focus on insurance ,(Adds details about deal  analyst comment  bylines; updates share prices)     By Avik Das and Jessica Toonkel     Dec 16 Insurer American International Group Inc said on Monday it will sell its aircraft-leasing business to AerCap Holdings NV  for $5.4 billion  after four years of trying to divest its biggest non-insurance business in fits and starts.     The insurer  which was nearly wiped out by derivative bets during the financial crisis  put International Lease Finance Corp on the,normal
AIG,American International Group Inc,20131216,US STOCKS-Wall St rebounds but cautious sentiment prevails on Fed ,* Avago to buy LSI for $6.6 bln; AIG to sell unit for $5.4 bln,normal
AIG,American International Group Inc,20131216,Fitch: AIG Ratings Unaffected by ILFC Sale Announcement ,(The following statement was released by the rating agency) CHICAGO  December 16 (Fitch) Fitch Ratings comments that the ratings of American  International Group  Inc. (AIG)  including the 'BBB+' Issuer Default Rating  (IDR) and 'BBB' senior debt rating are unaffected by the company's announcement  of a proposed sale of aircraft leasing subsidiary International Lease Finance  Corporation (ILFC) to AerCap Holdings N.V. for a purchase price of approximately  $5.4 billion. All ratings are listed be,normal
AIG,American International Group Inc,20131216,US STOCKS-Wall St rebounds after steep weekly decline; Fed in focus ,* Fed meeting in view  investors seek stimulus clarity     * Avago to buy LSI for $6.6 bln; AIG to sell unit for $5.4 bln     * S&P 500 near all-time high  but below 14-day moving average     * Indexes up: Dow 0.9 pct  S&P 0.7 pct  Nasdaq 0.8 pct       By Angela Moon     NEW YORK  Dec 16 U.S. stocks rose on Monday  rebounding from their worst week in months as large deals boosted optimism but investors remained cautious ahead of an upcoming Federal Reserve policy meeting.     Equitie,normal
AIG,American International Group Inc,20131216,CORRECTED-UPDATE 1-AIG to sell aircraft leasing business in $5.4 bln deal ,(Corrects paragraph 2 to make clear AIG has repaid its debt to the government),normal
AIG,American International Group Inc,20131216,US STOCKS-Wall St rises  eyes turn to Fed meeting ,* Avago to buy LSI for $6.6 bln; AIG to sell unit for $5.4 bln,normal
AIG,American International Group Inc,20131216,US STOCKS-Futures point to higher open  all eyes on Fed ,* Avago to buy LSI for $6.6 bln; AIG to sell unit for $5.4 bln,normal
AIG,American International Group Inc,20131216,BRIEF-Aercap Holdings up 17.7 percent premarket; to buy aircraft-leasing business from AIG ,NEW YORK  Dec 16 AerCap Holdings N.V. :  * Up 17.7 percent to $29.35 in premarket; to buy aircraft-leasing business from American International Group for about $5.4 billion. AIG shares gained 3.1 percent to $51.25 before the opening bell.,normal
AIG,American International Group Inc,20131216,AIG to sell aircraft leasing business in $5.4 bln deal ,Dec 16 U.S. insurer American International Group Inc said it would sell its aircraft-leasing business to AerCap Holdings NV in a deal valued at about $5.4 billion.,normal
BLK,BlackRock Inc,20131216,BlackRock ups stake in Telecom Italia ahead of vote for control ,MILAN BlackRock raised its stake in Telecom Italia to make it the struggling firm's second-biggest investor ahead of a vote for control  but did not say if it would side with top shareholder Telefonica or rebels fighting the Spanish firm's strategy.,topStory
BLK,BlackRock Inc,20131216,UPDATE 4-BlackRock ups stake in Telecom Italia ahead of vote for control ,* Says will tell market its holding as of Monday within 48 hrs,normal
BLK,BlackRock Inc,20131216,BlackRock has 7.78 pct in Telecom Italia voting capital - ANSA ,MILAN  Dec 16 BlackRock holds 7.783 percent of Telecom Italia's voting share capital  ANSA news agency reported on Monday  citing a statement by the U.S. money manager.,normal
BLK,BlackRock Inc,20131216,Telecom Italia says no information so far from BlackRock ,MILAN  Dec 16 Telecom Italia said on Monday it had not received any information from U.S. money manager BlackRock regarding an increase in its stake in the Italian telecoms group to 10.14 percent  as shown by U.S. regulatory filings.,normal
BLK,BlackRock Inc,20131216,RPT-Watchdog tells BlackRock to show its hand before Telecom Italia EGM ,* SEC says BlackRock raised Telecom Italia stake to 10.1 pct,normal
BA,Boeing Company (The),20131216,Boeing announces $10 billion buyback  raises dividend ,Boeing Co's  board raised the company dividend about 50 percent on Monday and approved $10 billion in new share buyback authority that the company said it would use in the next two to three years.,topStory
BA,Boeing Company (The),20131216,UPDATE 1-Boeing announces $10 billion buyback  raises dividend ,Dec 16 Boeing Co's board raised the company dividend about 50 percent on Monday and approved $10 billion in new share buyback authority that the company said it would use in the next two to three years.,normal
BA,Boeing Company (The),20131216,Boeing announces $10 bln buyback  raises dividend ,Dec 16 Boeing Co's board authorized a new $10 billion share buyback program  and the company said it would increase its quarterly dividend by about 50 percent to 73 cents per share.,normal
BA,Boeing Company (The),20131216,BRIEF-Boeing shares up 1.9 pct after the bell following share repurchase  dividend news ,NEW YORK  Dec 16 Boeing Co :  * Shares up 1.9 percent after the bell following news of a share repurchase and increase in quarterly dividend.,normal
BA,Boeing Company (The),20131216,RPT-INSIGHT-Key Canada win signals Boeing bid to regain market share ,* Boeing jets chief tells staff winning key to funding growth,normal
BP,BP plc,20131216,Deals of the day- Mergers and acquisitions ,Dec 16 The following bids  mergers  acquisitions and disposals were reported by 2100 GMT on Monday:,topStory
BP,BP plc,20131216,BP signs $16 billion tight gas project deal in Oman ,MUSCAT/DUBAI BP  will drill some 300 wells to flush gas trapped deep under the Omani desert over the next 15 years in a $16-billion project that Oman is relying on to keep its economy growing.,normal
BP,BP plc,20131216,UPDATE 3-BP signs $16 bln tight gas project deal in Oman ,* BP to hold 60 percent of project  spend around $9.6 bln,normal
BP,BP plc,20131216,BP signs $16 billion tight gas project deal in Oman ,MUSCAT/DUBAI BP  has signed 30-year deals to develop Oman's Khazzan tight gas project at an estimated investment of $16 billion  that will help the Omani economy to keep growing and bolster flagging gas exports.,normal
BP,BP plc,20131216,RPT-BP signs deal to develop big Oman tight gas project -Oman oil min ,MUSCAT  Dec 16 BP has signed a deal to develop a big unconventional gas project in Oman  Oman's oil and gas minister  Mohammad bin Hamad al-Rumhy  told a news conference in Muscat on Monday.,normal
BPL,Buckeye Partners LP,20131216,Buckeye says 5 line segments overbooked for January ,Dec 16 Buckeye Partners LP said it was asking shippers to review their current nominations on pipeline segments L316  L203  L415/521  L403 and L010 to revise them with binding nominations.,topStory
CX,Cemex SAB de CV,20131216,Mexico's Cemex pays off $355 mln in debt ahead of schedule ,MEXICO CITY  Dec 16 Mexico's Cemex    one of the world's biggest cement companies  said on Monday it has paid off $355 million in notes maturing in 2016.,topStory
CVX,Chevron Corporation,20131216,UPDATE 1-U.S. safety board urges new rules for California refineries ,* Calif. officials weigh possible new rules for refineries   (Adds Chevron statement  details throughout on Safety Board's action),topStory
DAL,Delta Air Lines Inc,20131216,Passenger jet slips off runway taxiing in Wisconsin  no injuries ,MILWAUKEE A Delta Air Lines jet slipped off the runway while taxiing after landing in Madison  Wisconsin  on Monday afternoon in snowy conditions  authorities said. No injuries were reported.,topStory
DAL,Delta Air Lines Inc,20131216,Passenger jet slips off runway taxiing in Wisconsin  no injuries ,MILWAUKEE  Dec 16 A Delta Air Lines jet slipped off the runway while taxiing after landing in Madison  Wisconsin  on Monday afternoon in snowy conditions  authorities said. No injuries were reported.,normal
E,ENI SpA,20131216,Eni and Fiat join forces in Milan car-sharing scheme ,MILAN  Dec 16 Three of Italy's biggest companies  including oil major Eni and Fiat  launched a car-sharing initiative on Monday that the carmaker said could help to pull in new customers.,topStory
EQT,EQT Corporation,20131216,EQT buys stake in Chinese restaurant operator ,STOCKHOLM  Dec 16 Swedish private equity firm EQT said on Monday it had bought a majority in franchise operator China F&B group together with other investors.,topStory
XOM,Exxon Mobil Corporation,20131216,US STOCKS-Upbeat data  deals lift Wall St; traders keep eye on Fed ,* Avago to buy LSI for $6.6 bln; AIG to sell unit for $5.4 bln,topStory
F,Ford Motor Company,20131216,Ford prices key Lincoln MKC crossover below rivals ,DETROIT Ford Motor Co  said on Monday that its upcoming Lincoln MKC crossover will start at $33 995  thousands of dollars cheaper than competing models as the No. 2 U.S. automaker attempts to shore up its flagging premium brand.,topStory
F,Ford Motor Company,20131216,UPDATE 1-GM CEO Akerson defends tenure as his exit nears ,* Akerson to be succeeded by auto industry's first woman CEO,normal
F,Ford Motor Company,20131216,Ford prices key Lincoln MKC crossover below rivals ,DETROIT  Dec 16 Ford Motor Co said on Monday that its upcoming Lincoln MKC crossover will start at $33 995  thousands of dollars cheaper than competing models as the No. 2 U.S. automaker attempts to shore up its flagging premium brand.,normal
F,Ford Motor Company,20131216,Insight: Ford 'lifers' get second chance as CEO readies exit ,DETROIT Every Wednesday  Ford Motor Co's top executives gather before sunrise to work through some of the company's most vexing problems. Notably absent is Chief Executive Alan Mulally.,normal
F,Ford Motor Company,20131216,INSIGHT-Ford 'lifers' get second chance as CEO readies exit ,DETROIT  Dec 16 Every Wednesday  Ford Motor Co's  top executives gather before sunrise to work through some of the company's most vexing problems. Notably absent is Chief Executive Alan Mulally.,normal
GEH,General Electric Capital Corporation,20131216,VietJet Air agrees $800 million engine deal with GE's CFM International ,HANOI Vietnam's budget carrier VietJet Air has agreed an $800 million deal to buy 40 engines from CFM International  a joint venture between General Electric  and Snecma  a unit of France's Safran SA   the firms said on Monday.,topStory
GEH,General Electric Capital Corporation,20131216,VietJet Air agrees $800 mln engine deal with GE's CFM International ,HANOI  Dec 16 Vietnam's budget carrier VietJet Air has agreed an $800 million deal to buy 40 engines from CFM International  a joint venture between General Electric  and Snecma  a unit of France's Safran SA  the firms said on Monday.,normal
GEK,General Electric Capital Corporation,20131216,VietJet Air agrees $800 million engine deal with GE's CFM International ,HANOI Vietnam's budget carrier VietJet Air has agreed an $800 million deal to buy 40 engines from CFM International  a joint venture between General Electric  and Snecma  a unit of France's Safran SA   the firms said on Monday.,topStory
GEK,General Electric Capital Corporation,20131216,VietJet Air agrees $800 mln engine deal with GE's CFM International ,HANOI  Dec 16 Vietnam's budget carrier VietJet Air has agreed an $800 million deal to buy 40 engines from CFM International  a joint venture between General Electric  and Snecma  a unit of France's Safran SA  the firms said on Monday.,normal
